Date,Time,Original tweet,Clean tweet,Positive,Neutral,Negative
2022-05-09,19:15,It’s a blood bath in the market #crytocurrency #BTC,its a blood bath in the market crytocurrency btc,0.2530370056629181,0.7267073392868042,0.020255660638213158
2022-05-09,19:15,#Bitcoin depends on a shared organization that structures agreements between the gatherings to a blockchain. Blockchain is the main wonder in the working of any digital currency.-  #finance #digitalcurrency #cryptocurrency https://t.co/aDxoB9eXwj,bitcoin depends on a shared organization that structures agreements between the gatherings to a blockchain blockchain is the main wonder in the working of any digital currency finance digitalcurrency cryptocurrency,0.054123908281326294,0.9329532384872437,0.012922907248139381
2022-05-09,19:15,"#BTC #ETH #DollarIndex #crypto #cryptocurrency #money #chance  
I can't wait until the end of the week 😄 https://t.co/wEE0FUaFxp",btc eth dollarindex crypto cryptocurrency money chance i cannot wait until the end of the week,0.03724628686904907,0.9048241972923279,0.05792955681681633
2022-05-09,19:15,@nayibbukele At least someone is buying 😅 ##Bitcoin,nayibbukele at least someone is buying bitcoin,0.18051953613758087,0.8035721778869629,0.01590833067893982
2022-05-09,19:15,@BitcoinMagazine @saylor better start injecting more funds to keep his #bitcoin leverage position afloat. He is inches away from getting rekt.,bitcoinmagazine saylor better start injecting more funds to keep his bitcoin leverage position afloat he is inches away from getting rekt,0.1817762553691864,0.2520619332790375,0.5661618709564209
2022-05-09,19:15,"if thats not the end, God doesn't love us

$btc #btc #Bitcoin",if thats not the end god does not love us btc btc bitcoin,0.02923060767352581,0.9315968155860901,0.03917257860302925
2022-05-09,19:15,"Bitcoin Mining Profit

CONTRARIAN INDICATOR
If this line is rising the miners are experiencing diminishing rates of returns
If the line is falling the miners are experiencing high profit increases

Details : https://t.co/rxqqX8mQsP

#Bitcoin #Mining $BTC https://t.co/fDkGzXMoBf",bitcoin mining profit contrarian indicator if this line is rising the miners are experiencing diminishing rates of returns if the line is falling the miners are experiencing high profit increases details bitcoin mining btc,0.1280563622713089,0.30734550952911377,0.5645981431007385
2022-05-09,19:15,Where’s that bloody fiat when u need it for these absolutely delightful levels. The #Bitcoin ship returns to port! 😍,wheres that bloody fiat when u need it for these absolutely delightful levels the bitcoin ship returns to port,0.0840395838022232,0.8561902642250061,0.05977015942335129
2022-05-09,19:15,"Full thanks to @Tradeosiann as they have analysed this #Bitcoin crash so my funds doesn't affected and I have not faced any type of losses 
They are absolutely amazing in tips,advices and everything😌 #NFT #DeFi #DOGE #btcgem",full thanks to tradeosiann as they have analysed this bitcoin crash so my funds does not affected and i have not faced any type of losses they are absolutely amazing in tipsadvices and everything nft defi doge btcgem,0.2562065124511719,0.7170196771621704,0.02677381969988346
2022-05-09,19:15,"As BTC Slides Toward Resistance, the Chance of a Rare Triple Top Formation Comes Into Play – Markets and Prices Bitcoin News
#Bitcoin #Ethereum #BTC #ETH #Crypto #CryptoNews

https://t.co/r3inQRDDBr https://t.co/uCHwjglAed",as btc slides toward resistance the chance of a rare triple top formation comes into play markets and prices bitcoin news bitcoin ethereum btc eth crypto cryptonews,0.08250538259744644,0.8838098645210266,0.03368475288152695
2022-05-09,19:15,#Bitcoin Whales Shrinking the Fear and Greed Index in Extreme Fear https://t.co/t8E4MYhgfP via @coinjupiter,bitcoin whales shrinking the fear and greed index in extreme fear via coinjupiter,0.5132421255111694,0.0961228758096695,0.39063504338264465
2022-05-09,19:15,make #cryptocurrency #litecoin #bitcoin with @jobboycom,make cryptocurrency litecoin bitcoin with jobboycom,0.06274063885211945,0.9231441617012024,0.014115196652710438
2022-05-09,19:15,"@midaspivots Y8 RCI is forecasting #Bitcoin. That’s available for subscription

#SPY forecasts are available for subscription, too

subscription is only available for institutional customers",midaspivots y8 rci is forecasting bitcoin thats available for subscription spy forecasts are available for subscription too subscription is only available for institutional customers,0.02370161935687065,0.9479717016220093,0.02832668274641037
2022-05-09,19:15,#movetoearn #m2e $btc $eth #bitcoin #metaverse #crypto $bnb #bscgem #bnbchain $nft #nft #stepn #gmt $gmtSciLZC,movetoearn m2e btc eth bitcoin metaverse crypto bnb bscgem bnbchain nft nft stepn gmt gmtscilzc,0.04304733872413635,0.9319534301757812,0.024999182671308517
2022-05-09,19:15,#Bitcoin Slips Below $33k As Exchange Inflows Reach Highest Value Since July 2021 https://t.co/mFrrGD9SnQ via @coinjupiter,bitcoin slips below 33k as exchange inflows reach highest value since july 2021 via coinjupiter,0.04526777192950249,0.03473125025629997,0.9200009107589722
2022-05-09,19:15,"@beautyofhelin Is this the end of #Bitcoin?
That's what my gf asked me, she's now my ex😌",beautyofhelin is this the end of bitcoin that is what my gf asked me she is now my ex,0.03389931470155716,0.933110237121582,0.03299041837453842
2022-05-09,19:15,"@ThinkingBitmex Bitcoin is good at any price.
#BTC",thinkingbitmex bitcoin is good at any price btc,0.1668318510055542,0.8244467377662659,0.008721393533051014
2022-05-09,19:15,@maxkeiser Max is trying to get @saylor to sell his #bitcoin by shorting $mstr,maxkeiser max is trying to get saylor to sell his bitcoin by shorting mstr,0.073118656873703,0.9111539125442505,0.015727374702692032
2022-05-09,19:15,#Bitcoin right now https://t.co/WkkQ17Q6Xd,bitcoin right now,0.026716848835349083,0.9353625178337097,0.03792061284184456
2022-05-09,19:15,"🛍️🤑 BUY trade for #HBARUSD 🛍️🤑
    
executed on May 9, 2022, 19:14
    
buy price-&gt; 0.11697

signup for 5% commission!-&gt; https://t.co/tip1MrWOgo

#BTC #XRP #ETH #FLR #getrichslow #yolonofomo https://t.co/4AKkeNfwQO",buy trade for hbarusd executed on may 9 2022 buy pricegt 011697 signup for 5 commissiongt btc xrp eth flr getrichslow yolonofomo,0.11127866804599762,0.8765733242034912,0.01214800588786602
2022-05-09,19:15,"One small positive thought in the morning can change your whole day,,

#showedupjustintime
#daywithoutchildcare
#bitcoin",one small positive thought in the morning can change your whole day showedupjustintime daywithoutchildcare bitcoin,0.073191799223423,0.898705005645752,0.028103165328502655
2022-05-09,19:15,@nayibbukele Nayib every time you say dip then #BTC goes dipper. do not buy please,nayibbukele nayib every time you say dip then btc goes dipper do not buy please,0.026592537760734558,0.8832316398620605,0.09017587453126907
2022-05-09,19:15,"Full thanks to @Tradeosiann as they have analysed this #Bitcoin crash so my funds doesn't affected and I have not faced any type of losses 
They are absolutely amazing in tips,advices and everything😌 #NFT #DeFi #DOGE #btcgbp",full thanks to tradeosiann as they have analysed this bitcoin crash so my funds does not affected and i have not faced any type of losses they are absolutely amazing in tipsadvices and everything nft defi doge btcgbp,0.2666395306587219,0.7122986316680908,0.021061817184090614
2022-05-09,19:15,Don't forget to check on your friends that own bitcoin today #BTC ￼,do not forget to check on your friends that own bitcoin today btc,0.03406890854239464,0.9332851767539978,0.032645922154188156
2022-05-09,19:15,Thx #btc 30k. 😭,thx btc 30k,0.04403318464756012,0.9264203906059265,0.029546400532126427
2022-05-09,19:15,"El Salvador has bought 500 #BTC at an average price of ~$30,744: Bukele",el salvador has bought 500 btc at an average price of bukele,0.11266796290874481,0.8784392476081848,0.008892848156392574
2022-05-09,19:15,#Bitcoin may go down to $28k,bitcoin may go down to 28k,0.00995706394314766,0.06680741161108017,0.9232354760169983
2022-05-09,19:15,@missteencrypto @CNBC You should totally make a video where you explain #Bitcoin to 7-year-old you.,missteencrypto cnbc you should totally make a video where you explain bitcoin to 7yearold you,0.04364702105522156,0.9309704303741455,0.02538251131772995
2022-05-09,19:15,"Full thanks to @Tradeosiann as they have analysed this #Bitcoin crash so my funds doesn't affected and I have not faced any type of losses 
They are absolutely amazing in tips,advices and everything😌 #NFT #DeFi #DOGE #BTCが落ちている",full thanks to tradeosiann as they have analysed this bitcoin crash so my funds does not affected and i have not faced any type of losses they are absolutely amazing in tipsadvices and everything nft defi doge btcが落ちている,0.2085636705160141,0.7685359716415405,0.022900359705090523
2022-05-09,19:15,"Shoutout to anyone who mocked me or made fun of my analyses when #BTC was trading at $48k and I was calling $29k.
I just hope you're not being liquidated.
Facts speak for me and my job.
Spread kindness and hard work culture.
Cheers",shoutout to anyone who mocked me or made fun of my analyses when btc was trading at 48k and i was calling 29k i just hope you are not being liquidated facts speak for me and my job spread kindness and hard work culture cheers,0.1339597851037979,0.838107168674469,0.02793305367231369
2022-05-09,19:15,"One of the GREATEST opportunities is here to grab some cheap #altcoins and #Bitcoin at a huge discount. 

Wealth creation in the making. 🔥🚀🚀🚀
#Bitcoin #Cryptocrash",one of the greatest opportunities is here to grab some cheap altcoins and bitcoin at a huge discount wealth creation in the making bitcoin cryptocrash,0.1718910038471222,0.8181380033493042,0.009970948100090027
2022-05-09,19:15,"@cobie It’s that time again… maybe it works 

                       🕯
              🕯              🕯
        🕯                            🕯
 
   🕯            #Bitcoin          🕯

        🕯                           🕯
              🕯              🕯
                        🕯",cobie its that time again maybe it works bitcoin,0.05438641831278801,0.921820878982544,0.023792658001184464
2022-05-09,19:15,"🔻🔻🔻 $2,385,182 BTCUSDT SHORTED @$30,800.00 on #Binance (19:14:46 UTC) #BTC #cryptocurrency",2385182 btcusdt shorted 3080000 on binance utc btc cryptocurrency,0.03316937014460564,0.9353986382484436,0.03143199160695076
2022-05-09,19:15,"@nayibbukele @Benaskren hahahahaha.....They'll go BROKE! #Bitcoin 

This is a RED market. R E D. Realise fast. Be SMART!

$BTC gameplay is over!",nayibbukele benaskren hahahahahathey ll go broke bitcoin this is a red market r e d realise fast be smart btc gameplay is over,0.13832725584506989,0.7098835110664368,0.15178926289081573
2022-05-09,19:15,"Massive down 📉
#BTC #ETH #Decentraland",massive down btc eth decentraland,0.025434346869587898,0.7925488948822021,0.1820167601108551
2022-05-09,19:15,@nayibbukele STOP BİTCOİN BUY BİTCOİN ! #Bitcoin,nayibbukele stop bitcoin buy bitcoin bitcoin,0.0287101399153471,0.9125970005989075,0.05869283154606819
2022-05-09,19:15,@CryptoWhale Did you sell all your #BTC ?,cryptowhale did you sell all your btc,0.03327224776148796,0.9375265836715698,0.02920120395720005
2022-05-09,19:15,"LUNA FOUNDATION JUST EMPTIED THEIR #BTC RESERVE
400mil worth #btc sent to okex 
HUGE DUMP INCOMING",luna foundation just emptied their btc reserve 400mil worth btc sent to okex huge dump incoming,0.03554956614971161,0.759787917137146,0.2046625167131424
2022-05-09,19:15,@AltcoinGordon @LFG_org just send all their #bitcoin to Gemini. Lol. If 20k #btc holds it will be surprising,altcoingordon lfgorg just send all their bitcoin to gemini lol if 20k btc holds it will be surprising,0.05245586857199669,0.932439386844635,0.015104688704013824
2022-05-09,19:15,"I bought #bitcoin at 350$~ areas . 
Today my elder brother asking me, are you okah ?🤣  #CRYPTOCRASH. 

Inner me: yaah, I sacrificed my 80% total money on @RichardHeartWin projects. 😁

$BTC $HEX $ETH $CULT $SHIB $SOL $FTM $BNB $GMT $MRI",i bought bitcoin at 350 areas today my elder brother asking me are you okah cryptocrash inner yaah i sacrificed my 80 total money on richardheartwin projects btc hex eth cult shib sol ftm bnb gmt mri,0.09779102355241776,0.8829145431518555,0.01929447054862976
2022-05-09,19:15,"Relax and go to sleep 😴 
Tomorrow morning your pf won't be red 🔴 . It will be 0
#btc #LUNA #buythedip #UST",relax and go to sleep tomorrow morning your pf will not be red it will be 0 btc luna buythedip ust,0.05589206889271736,0.9247602820396423,0.019347630441188812
2022-05-09,19:15,"@Excellion @paoloardoino We need more individuals, businesses, regions and countries to adopt so this is no longer about investment but about usage.

Now is the time to spread it out so more people can participate.

#bitcoin #circulareconomy",excellion paoloardoino we need more individuals businesses regions and countries to adopt so this is no longer about investment but about usage now is the time to spread it out so more people can participate bitcoin circulareconomy,0.13367944955825806,0.8570153117179871,0.009305279701948166
2022-05-09,19:15,"@Dennis_Porter_ Holy sheet #Bitcoin is broken now, better go buy some more to fix it",dennisporter holy sheet bitcoin is broken now better go buy some more to fix it,0.09976042807102203,0.7421916127204895,0.15804797410964966
2022-05-09,19:15,fuck your manipulations @cz_binance @elonmusk #Bitcoin,fuck your manipulations czbinance elonmusk bitcoin,0.026784641668200493,0.9185370802879333,0.05467826500535011
2022-05-09,19:15,"BREAKING: El Salvador just bought the dip 500 #bitcoin at an average price of $30,744!!!!💥",el salvador just bought the dip 500 bitcoin at an average price of 30744,0.09788603335618973,0.8886907696723938,0.01342315599322319
2022-05-09,19:15,"People copy what is innovative. 

There used to be a lot of #Bitcoin copies. Now there are a lot of #Ethereum copies. 

The space is evolving. Don’t doubt the flippening 🐬 

(What will be copied next as being the most innovative or will it be Ethereum for a while?)",people copy what is innovative there used to be a lot of bitcoin copies now there are a lot of ethereum copies the space is evolving don not doubt the flippening what will be copied next as being the most innovative or will it be ethereum for a while,0.08865690976381302,0.9002551436424255,0.01108790934085846
2022-05-09,19:15,"El Salvador just bought 500 bitcoin at an average price of $30,744 per bitcoin. 🇸🇻 

#bitcoin",el salvador just bought 500 bitcoin at an average price of 30744 per bitcoin bitcoin,0.09085147827863693,0.8951511383056641,0.01399743091315031
2022-05-09,19:15,"The good thing is that experts are not posting #Bitcoin on-chain ""short squeeze"" charts today",the good thing is that experts are not posting bitcoin onchain short squeeze charts today,0.04265087470412254,0.8990421295166016,0.058306992053985596
2022-05-09,19:15,"$BTC at 30k?!  -- Will it hit 25k? 

#Crypto #Bitcoin #BTC #LUNA",btc at 30k will it hit 25k crypto bitcoin btc luna,0.18296192586421967,0.7992773652076721,0.017760634422302246
2022-05-09,19:15,"@StonkVotes @MentalWare @natbrunell Fake news

You can use #Bitcoin network to send any currency anywhere in the world immediately settled at almost zero cost 

The asset is volatile priced in Fiat because Fiat is collapsing at vs btc",stonkvotes mentalware natbrunell fake news you can use bitcoin network to send any currency anywhere in the world immediately settled at almost zero cost the asset is volatile priced in fiat because fiat is collapsing at vs btc,0.02913387306034565,0.5261061191558838,0.4447600841522217
2022-05-09,19:15,"People start acting like bitches once red candles appears, yelling at you as if you are the guy who is responsible for their wallets

I told you my #Bitcoin entry is $38.500 for the long term and Iam fine with that! Lucky enough to have sold both tops at least",people start acting like bitches once red candles appears yelling at you as if you are the guy who is responsible for their wallets i told you my bitcoin entry is 38500 for the long term and iam fine with that lucky enough to have sold both tops at least,0.04897394776344299,0.8829155564308167,0.06811054050922394
2022-05-09,19:15,"@Jayy_Crypt0 Hey bro. 

Don't forget to put these on your To Do List🧠..

#ATOM⚛️ ~ @cosmos 

And...

#EVMOS🦾 ~ @EvmosOrg 

I'm sensing a BULLISH forecast on the 3-24 months time range.

Intricate Pieces.🧩

#Cosmos #OSMO #UST 

#430aoncrypto #ETH #CRO #BNB #BTC #AVAX #TRX #XTZ #FTX #VGX",jayycrypt0 hey bro do not forget to put these on your to do list atom cosmos and evmos evmosorg i am sensing a bullish forecast on the 324 months time range intricate pieces cosmos osmo ust 430aoncrypto eth cro bnb btc avax trx xtz ftx vgx,0.16872289776802063,0.8130422234535217,0.018234889954328537
2022-05-09,19:15,"#Bitcoin  just hit $31,000!!!",bitcoin just hit 31000,0.1309957504272461,0.8347848653793335,0.034219369292259216
2022-05-09,19:15,@BitcoinMagazine Buy #Bitcoin now at lower prices will be a great opportunity for you 💥💥,bitcoinmagazine buy bitcoin now at lower prices will be a great opportunity for you,0.2958042323589325,0.6936914920806885,0.01050430815666914
2022-05-09,19:15,To be fair your money isnt safe anywhere right now unless you’re using it to buy and store food and water. #everythingcrash #bitcoin #USDollar #ethereum #crypto #fiat #preciousmetals,to be fair your money isnt safe anywhere right now unless youre using it to buy and store food and water everythingcrash bitcoin usdollar ethereum crypto fiat preciousmetals,0.04742656275629997,0.9281513690948486,0.024422043934464455
2022-05-09,19:15,@Bloctrends @DBATTAGLIAYtube @YouTube #btc 10K in coming days,bloctrends dbattagliaytube youtube btc 10k in coming days,0.04772661626338959,0.9204254746437073,0.031847890466451645
2022-05-09,19:15,Definitely over sold… #Bitcoin,definitely over sold bitcoin,0.271684467792511,0.47494807839393616,0.25336742401123047
2022-05-09,19:15,#Bitcoin  Memes are instane 🤣😂🤣,bitcoin memes are instane,0.021060075610876083,0.9089328646659851,0.07000704109668732
2022-05-09,19:15,"The #Bitcoin price is now below Microstrategy's average price of $30,700",the bitcoin price is now below microstrategy average price of 30700,0.0343349352478981,0.23854747414588928,0.7271175980567932
2022-05-09,19:15,"Buy the Fear and sell the Greed they say. 

#BTC",buy the fear and sell the greed they say btc,0.03868483006954193,0.9210693836212158,0.04024576395750046
2022-05-09,19:15,"I like #bitcoin at these levels, but I'll love them at sub $21,000. Either way I'm buying weekly regardless of price",i like bitcoin at these levels but i will love them at sub 21000 either way i am buying weekly regardless of price,0.08600722253322601,0.8998629450798035,0.014129786752164364
2022-05-09,19:15,"Things you MUST invest in
1: #Bitcoin
2: Emergency Food Rations
3: Guns and Ammo
4: Like minded friends",things you must invest in bitcoin emergency food rations guns and ammo like minded friends,0.03952941298484802,0.940976083278656,0.019494473934173584
2022-05-09,19:15,"#Bitcoin needs to get back above $36,000 to reverse the bear market. #Bitcoin2022 #BTC #SHIB",bitcoin needs to get back above 36000 to reverse the bear market bitcoin2022 btc shib,0.1365988850593567,0.8238473534584045,0.039553798735141754
2022-05-09,19:15,"Just a tip before I close the charts.

You better turn of your screen and come back tomorrow.

Don't take any rash decisions.

""Speaking from experience""

#bitcoin",just a tip before i close the charts you better turn of your screen and come back tomorrow do not take any rash decisions speaking from experience bitcoin,0.03690052404999733,0.9330285787582397,0.03007095865905285
2022-05-09,19:15,#BTC DUMPED HARD!!!!,btc dumped hard,0.05465211346745491,0.35931921005249023,0.5860287547111511
2022-05-09,19:15,"Central bankers &amp; politicians don’t belt tighten when they try to “fight inflation”

They force you to belt tighten

The world needs a new monetary standard 

#bitcoin",central bankers politicians don not belt tighten when they try to fight inflation they force you to belt tighten the world needs a new monetary standard bitcoin,0.06628570705652237,0.9012805819511414,0.03243369236588478
2022-05-09,19:15,#BTC when bearish can always go lower. Nor 20k nor 10k would surprise me.,btc when bearish can always go lower nor 20k nor 10k would surprise me,0.052930764853954315,0.3246018588542938,0.6224673390388489
2022-05-09,19:15,"@LoganLukas_ In a few days, 320K will be able to buy about 11 #BTC .",loganlukas in a few days 320k will be able to buy about 11 btc,0.5181097984313965,0.47413796186447144,0.007752230390906334
2022-05-09,19:15,"@nayibbukele Anyway you could buy 10,00 more #Bitcoin ?",nayibbukele anyway you could buy 1000 more bitcoin,0.0938403531908989,0.8930607438087463,0.013098923489451408
2022-05-09,19:15,I think we have had the dip for now  #Bitcoin,i think we have had the dip for now bitcoin,0.42801225185394287,0.5301551818847656,0.0418325699865818
2022-05-09,19:15,"#bitcoin price got ya down? Well we can't really help with that...

But we can help you stack more #btc while its on discount, accumulation is the name of the game after all.",bitcoin price got ya down well we cannot really help with that but we can help you stack more btc while its on discount accumulation is the name of the game after all,0.07132966816425323,0.8885764479637146,0.040093906223773956
2022-05-09,19:15,"@beautyofhelin Sure, I'm buying. It is an opportunity to acquire more #BTC",beautyofhelin sure i am buying it is an opportunity to acquire more btc,0.633226752281189,0.35908475518226624,0.007688475307077169
2022-05-09,19:15,Double bottom coming in. Ready for the jump start 🚀 #Bitcoin,double bottom coming in ready for the jump start bitcoin,0.14166787266731262,0.8417048454284668,0.016627337783575058
2022-05-09,19:15,"Overthinking ruins you..

#showedupjustintime
#daywithoutchildcare
#bitcoin",overthinking ruins you showedupjustintime daywithoutchildcare bitcoin,0.06505239754915237,0.9047514796257019,0.030196139588952065
2022-05-09,19:15,"El Salvador just bought the dip! 

They bought 500 #bitcoin at an average USD price of ~$30,744.",el salvador just bought the dip they bought 500 bitcoin at an average usd price of 30744,0.09464344382286072,0.8896675705909729,0.015689006075263023
2022-05-09,19:15,"@beautyofhelin This is the perfect opportunity to accumulate one's favorite crypto, not just #bitcoin.",beautyofhelin this is the perfect opportunity to accumulate one favorite crypto not just bitcoin,0.21809400618076324,0.7740719318389893,0.007834149524569511
2022-05-09,19:15,"@aarushi_btc Happy birthday, enjoy the dip.
U r the only hardcore #bitcoin girl I know in my circle.

Let the lord fill ur wallet with #Sats all the time. ❤️❤️😍😍",aarushibtc happy birthday enjoy the dip u r the only hardcore bitcoin girl i know in my circle let the lord fill ur wallet with sats all the time,0.051483333110809326,0.9020109176635742,0.04650569334626198
2022-05-09,19:15,"@krisbarger @EmperorBTC Most of them will dip more even though #btc recovers, it will take some time for them to fully bounce back...",krisbarger emperorbtc most of them will dip more even though btc recovers it will take some time for them to fully bounce back,0.5174890756607056,0.1673138290643692,0.3151971399784088
2022-05-09,19:15,@geostylegeo So now we are on #bitcoin and #crypto??,geostylegeo so now we are on bitcoin and crypto,0.035634126514196396,0.9410420656204224,0.023323798552155495
2022-05-09,19:15,@PeterSchiff Have your fun now while #Bitcoin is sliding. It'll back up stronger than before.,peterschiff have your fun now while bitcoin is sliding it will back up stronger than before,0.9411410689353943,0.039328549057245255,0.0195303987711668
2022-05-09,19:15,Worlds ending again? Third time this year! #BULLISH #BTC #Crypto,worlds ending again third time this year bullish btc crypto,0.5621526837348938,0.1253163069486618,0.312531054019928
2022-05-09,19:15,@elonmusk #BTC looks cheap. Isnt @Tesla buying more?,elonmusk btc looks cheap isnt tesla buying more,0.22702890634536743,0.7551426887512207,0.017828430980443954
2022-05-09,19:15,"If you bought #Crypto recently I feel bad for you son… you got 99 problems and more wealth ain’t one ☝️ 

#BTC",if you bought crypto recently i feel bad for you son you got 99 problems and more wealth ain not one btc,0.04772227257490158,0.6347874402999878,0.3174903392791748
2022-05-09,19:15,"This is the bloodbath that #Bitcoin needed. Alts are getting destroyed, some won’t be coming back.",this is the bloodbath that bitcoin needed alts are getting destroyed some won not be coming back,0.019722528755664825,0.11952140927314758,0.8607560992240906
2022-05-09,19:15,Buying the dip is nice but be strategic. Use only 10% of your intended fund per session. #Bitcoin #Binance #blockchainevolved #Metaverse,buying the dip is nice but be strategic use only 10 of your intended fund per session bitcoin binance blockchainevolved metaverse,0.05682886019349098,0.9296155571937561,0.01355560403317213
2022-05-09,19:15,"When life gets harder, challenge yourself to be stronger..

#showedupjustintime
#daywithoutchildcare
#bitcoin",when life gets harder challenge yourself to be stronger showedupjustintime daywithoutchildcare bitcoin,0.15057837963104248,0.8336735963821411,0.015748044475913048
2022-05-09,19:15,"Labor shortage?

#Bitcoin fixes this.",labor shortage bitcoin fixes this,0.07640095055103302,0.5294100046157837,0.39418908953666687
