Date,Time,Original tweet,Clean tweet,Positive,Neutral,Negative
2022-05-03,19:15,HUGE CAPITULATION WILL SEND #BITCOIN TO 30K SOON!!,huge capitulation will send bitcoin to 30k soon,0.022965671494603157,0.044135529547929764,0.932898759841919
2022-05-03,19:15,@BscPitbull_TR @gate_io @BscPitbull Pitbull wants to be listed on the token @gate_io $PIT @BscPitbull #Bitcoin #btc,bscpitbulltr gateio bscpitbull pitbull wants to be listed on the token gateio pit bscpitbull bitcoin btc,0.043153081089258194,0.9447188377380371,0.012128057889640331
2022-05-03,19:15,Diren 37.500$ #bitcoin #btc,diren 37500 bitcoin btc,0.028444524854421616,0.9342246055603027,0.037330884486436844
2022-05-03,19:15,#Bitcoin at $27k at the end of May. Inevitable or wishful thinking?,bitcoin at 27k at the end of may inevitable or wishful thinking,0.054619379341602325,0.8655064702033997,0.07987411320209503
2022-05-03,19:15,"My Timeline is filled w NFT and Doge-shitcoin Posts??  WTF?? I don’t follow or like ANY POSTS LIKE THAT!!??

Twitter Bots: Chewy Likes #bitcoin #btc #Bitcoin #btc #Bitcoin #btc #BTC #bitcoin #BTC #bitcoin #BTC #BTC #Bitcoin #BTC #BTC #BTC #Bitcoin #Bitcoin #BTC",my timeline is filled w nft and dogeshitcoin posts wtf i don not follow or like any posts like that twitter chewy likes bitcoin btc bitcoin btc bitcoin btc btc bitcoin btc bitcoin btc btc bitcoin btc btc btc bitcoin bitcoin btc,0.021465620025992393,0.9228177666664124,0.05571664869785309
2022-05-03,19:15,Have you ever seen a token that makes 13x in 1 week? We saw =) $PIT @BscPitbull #Bitcoin #btc   Pitbull1000x #PitbullCrew,have you ever seen a token that makes 13x in 1 week we saw pit bscpitbull bitcoin btc pitbull1000x pitbullcrew,0.06714475154876709,0.9177414178848267,0.01511382032185793
2022-05-03,19:15,@gate_io You can see us in the top 10 soon! $PIT @BscPitbull #Bitcoin #btc,gateio you can see us in the top 10 soon pit bscpitbull bitcoin btc,0.12598945200443268,0.8574473261833191,0.016563214361667633
2022-05-03,19:15,@gate_io looking for gems? BUY $PIT and buy more. @BscPitbull #Bitcoin #btc,gateio looking for gems buy pit and buy more bscpitbull bitcoin btc,0.10814971476793289,0.8761963248252869,0.01565399207174778
2022-05-03,19:15,"@BSVClub @handcashapp $DaveLynks

#Bitcoin DROP",bsvclub handcashapp davelynks bitcoin drop,0.035333361476659775,0.938016951084137,0.02664969488978386
2022-05-03,19:15,"@gate_io ➡️PITBULL TOKEN ➡️POWERFUL COMMUNITY ➡️POWERFUL TEAM ➡️ NO OWNERSHIP ➡️NUMBER OF HOLDERS EXCEEDING 470,000 ➡️ MORE THAN 59,3% BURNED🔥 #pitbulltoken #bscpitbull #DeFi #pitbullcoin #Pit #PitMag #hodl #Metaverse #P2E #NFT #Bsc #bitcoin #binance",gateio pitbull token powerful community powerful team no ownership number of holders exceeding 470000 more than 593 burned pitbulltoken bscpitbull defi pitbullcoin pit pitmag hodl metaverse p2e nft bsc bitcoin binance,0.055120062083005905,0.9299345016479492,0.01494542881846428
2022-05-03,19:15,"@BscPitbull_TR @gate_io @BscPitbull it's not investment advice, but research this army @BscPitbull $PIT #Bitcoin #btc",bscpitbulltr gateio bscpitbull it is not investment advice but research this army bscpitbull pit bitcoin btc,0.025020292028784752,0.9491389989852905,0.02584073692560196
2022-05-03,19:15,@gate_io Don't be late buy more $pit - #ForzaPitbull BscPitbull Our target is 1 billion market value by the end of the year. #PitbullCREW #PitbullTokenShibaKiller #Metaverse #P2E #NFT #Bsc #Bnb #BTC @BscPitbull #Bitcoin #btc #pitbulltoken lisr🙏🏻🙏🏻🙏🏻,gateio do not be late buy more pit forzapitbull bscpitbull our target is 1 billion market value by the end of the year pitbullcrew pitbulltokenshibakiller metaverse p2e nft bsc bnb btc bscpitbull bitcoin btc pitbulltoken lisr,0.06317171454429626,0.9244856238365173,0.012342660687863827
2022-05-03,19:15,"- Dump #BTC moar
- clean out majority of ALTs
- big inflows to quality NFT projects

Rinse

Repeat",dump btc moar clean out majority of alts big inflows to quality nft projects rinse repeat,0.18303146958351135,0.7648895382881165,0.05207899212837219
2022-05-03,19:15,"“It’s gold for nerds.”
— Stephen Colbert, Comedian #bitcoin #Crypto",its gold for nerds stephen colbert comedian bitcoin crypto,0.051448337733745575,0.9242404699325562,0.02431117184460163
2022-05-03,19:15,"not taking profit wont make you rich!
#BTC",not taking profit wont make you rich btc,0.11479101330041885,0.8574236631393433,0.02778533473610878
2022-05-03,19:15,@BscPitbull_TR @gate_io @BscPitbull You can see us in the top 10 soon! $PIT @BscPitbull #Bitcoin #btc,bscpitbulltr gateio bscpitbull you can see us in the top 10 soon pit bscpitbull bitcoin btc,0.09761392325162888,0.8880759477615356,0.014310180209577084
2022-05-03,19:15,"Invest in yourself. It pays the best interest.

#invest #Crypto #NFTCommunity #Bitcoin #MetGala2022",invest in yourself it pays the best interest invest crypto nftcommunity bitcoin metgala2022,0.08300226181745529,0.9071750044822693,0.009822800755500793
2022-05-03,19:15,"@Cylumfinance Cool, thanks a lot 🤑
@JJ70611 @mytutor_says @HariPutra_Flo 
#CYLUM #CYM #BNB #BSC #cryptocurrency #binance #BTC #ETH",cylumfinance cool thanks a lot jj70611 mytutorsays hariputraflo cylum cym bnb bsc cryptocurrency binance btc eth,0.20327115058898926,0.7873604893684387,0.009368295781314373
2022-05-03,19:15,"@gate_io I think we will delete another zero soon, these are our smaller footsteps. $PIT @BscPitbull #Bitcoin #btc",gateio i think we will delete another zero soon these are our smaller footsteps pit bscpitbull bitcoin btc,0.04808996990323067,0.9193764925003052,0.03253353014588356
2022-05-03,19:15,Has anyone noticed how senior finance executives keep citing their children as their window into crypto 🧐 #bitcoin,has anyone noticed how senior finance executives keep citing their children as their window into crypto bitcoin,0.0292087160050869,0.7456051111221313,0.22518619894981384
2022-05-03,19:15,"@gate_io The $PIT token, which has more than 490,000 investors, is booming @BscPitbull #Bitcoin #btc",gateio the pit token which has more than 490000 investors is booming bscpitbull bitcoin btc,0.10251573473215103,0.88385409116745,0.013630139641463757
2022-05-03,19:15,"@MartiniGuyYT I'm excited for the next few years!
It will be mind blowing 🤯
#Bitcoin bro❤️",martiniguyyt i am excited for the next few years it will be mind blowing bitcoin bro,0.46487101912498474,0.521758496761322,0.013370497152209282
2022-05-03,19:15,@gate_io If that's the case check out $PIT then. That's going probably do more than a 100x. Big announcement coming #pitbulltoken #bscpitbull #DeFi #pitbullcoin #Pit #PitMag #hodl #Metaverse #P2E #NFT #Bsc @BscPitbull $PIT #Bitcoin #btc,gateio if that is the case check out pit then that is going probably do more than a 100x big announcement coming pitbulltoken bscpitbull defi pitbullcoin pit pitmag hodl metaverse p2e nft bsc bscpitbull pit bitcoin btc,0.13821332156658173,0.8490553498268127,0.012731360271573067
2022-05-03,19:15,#Bitcoin  it’s better then Gold as investment ask me why #HODL #cryptocurrency #SHIB #SHIBARAMY,bitcoin its better then gold as investment ask me why hodl cryptocurrency shib shibaramy,0.17201879620552063,0.7999768257141113,0.028004389256238937
2022-05-03,19:15,@gate_io Ever-growing Ecosystem Ever-growing Numbers We are now 70.000+ Members on all @telegram Communities 150.000+ Followers on @Twitter 490.000+ Holders (30k in 7days) @BscPitbull #Bitcoin #btc,gateio evergrowing ecosystem evergrowing numbers we are now 70000 members on all telegram communities 150000 followers on twitter 490000 holders 30k in 7days bscpitbull bitcoin btc,0.05130593478679657,0.9300721287727356,0.01862194947898388
2022-05-03,19:15,@BscPitbull_TR @gate_io @BscPitbull Pitbull token is coming with a thump @BscPitbull $PIT #Bitcoin #btc,bscpitbulltr gateio bscpitbull pitbull token is coming with a thump bscpitbull pit bitcoin btc,0.16188232600688934,0.8294565677642822,0.008661077357828617
2022-05-03,19:15,"1. People think that NFTs are a bubble and while that may be true for some projects, the underlying technology behind Access NFTs is far from a bubble 

#nft #nftart #art #nfts #crypto #nftcommunity #nftcollector #ethereum #cryptocurrency #opensea #bitcoin #blockchain",1 people think that nfts are a bubble and while that may be true for some projects the underlying technology behind access nfts is far from a bubble nft nftart art nfts crypto nftcommunity nftcollector ethereum cryptocurrency opensea bitcoin blockchain,0.03710094094276428,0.9336079955101013,0.029291072860360146
2022-05-03,19:15,"@gate_io Do u know that $PIT NFT? I think that you should check it. In the past weeks, 3 nfts have been shared and all have been sold. 3 new nfts will be released this week #PitbullToken #Bitcoin #btc",gateio do u know that pit nft i think that you should check it in the past weeks 3 nfts have been shared and all have been sold 3 new nfts will be released this week pitbulltoken bitcoin btc,0.06202877312898636,0.924746036529541,0.013225237838923931
2022-05-03,19:15,"@MetapleFinance This is an excellent project for the future with a strong team, a transparent, planned and project roadmap. it will be successful I. spread
@SadamAli1996 
@Holilhaha 
@ajishafiz 

#cryptocurrency #Airdrop #BSC #Bitcoin #USDT #MetapleFinance #MLX #Airdropstario",metaplefinance this is an excellent project for the future with a strong team a transparent planned and project roadmap it will be successful i spread sadamali1996 holilhaha ajishafiz cryptocurrency airdrop bsc bitcoin usdt metaplefinance mlx airdropstario,0.7086048126220703,0.28426393866539,0.007131303194910288
2022-05-03,19:15,"2009 Satoshi Nakamoto creates Bitcoin because of Financial Crisis.
2022 Bitcoin traders waiting for FED meeting and Stock Market to go up, so that their crypto can go up as well...

IF this isn't a failure of Crypto as an idea, I don't know what is.

#Crypto 
#Bitcoin 
$BTC",2009 satoshi nakamoto creates bitcoin because of financial crisis 2022 bitcoin traders waiting for fed meeting and stock market to go up so that their crypto can go up as well if this is not a failure of crypto as an idea i do not know what is crypto bitcoin btc,0.0507420115172863,0.8807625770568848,0.06849539279937744
2022-05-03,19:15,@BscPitbull_TR @gate_io @BscPitbull We are coming like a bomb with brand new news! @BscPitbull @gate_io $PIT #Bitcoin #btc,bscpitbulltr gateio bscpitbull we are coming like a bomb with brand new news bscpitbull gateio pit bitcoin btc,0.15350008010864258,0.8318485021591187,0.01465144194662571
2022-05-03,19:15,"@BscPitbull_TR @gate_io @BscPitbull Hey, our community is so strong. See with your own eyes =) @BscPitbull $PIT #Bitcoin #btc
edited
15:36",bscpitbulltr gateio bscpitbull hey our community is so strong see with your own eyes bscpitbull pit bitcoin btc edited,0.14234676957130432,0.8482264876365662,0.009426715783774853
2022-05-03,19:15,"@BowTiedRam @chronicdreamz @__hodl__ @JohnReedStark Unfortunately I think you are the one that doesn’t get it but I am open to a discussion…a blockchain is an inefficient database/ledger

Money that cannot be corrupted/controlled (#bitcoin) is the only legitimate use case for a decentralized blockchain thus far",bowtiedram chronicdreamz hodl johnreedstark unfortunately i think you are the one that doesn not get it but i am open to a discussiona blockchain is an inefficient databaseledger money that cannot be corruptedcontrolled bitcoin is the only legitimate use case for a decentralized blockchain thus far,0.03385942801833153,0.854984700679779,0.11115584522485733
2022-05-03,19:15,"@BscPitbull_TR @gate_io @BscPitbull everything has a time, one day the room will come #Btc #Binance #BscPitbull @BscPitbull $PIT #Bitcoin #btc",bscpitbulltr gateio bscpitbull everything has a time one day the room will come btc binance bscpitbull bscpitbull pit bitcoin btc,0.05974376201629639,0.9229328036308289,0.01732347533106804
2022-05-03,19:15,"Small long on #BTC , very $SMOL so I can feel something",small long on btc very smol so i can feel something,0.09578783810138702,0.8801910281181335,0.024021117016673088
2022-05-03,19:15,"@gate_io it's not investment advice, but research this army @BscPitbull $PIT #Bitcoin #btc",gateio it is not investment advice but research this army bscpitbull pit bitcoin btc,0.031961001455783844,0.9457581639289856,0.022280819714069366
2022-05-03,19:15,"#Bitcoin 📈 

▓▓▓▓▓▓░░░░░░░░░ 38%

price:$37654.73      eth/btc: 0.07",bitcoin 38 007,0.02953343838453293,0.9354565143585205,0.035010017454624176
2022-05-03,19:15,@BscPitbull_TR @gate_io @BscPitbull @BscPitbull $PIT I'm talking about a token with a 490K holder #Bitcoin #btc,bscpitbulltr gateio bscpitbull bscpitbull pit i am talking about a token with a 490k holder bitcoin btc,0.04939360171556473,0.9327836036682129,0.017822790890932083
2022-05-03,19:15,"@gate_io road the moon, @gate_io  soon ! #PitbullToken100 @BscPitbull $PIT #Bitcoin #btc",gateio road the moon gateio soon pitbulltoken100 bscpitbull pit bitcoin btc,0.06094703450798988,0.9180994629859924,0.020953426137566566
2022-05-03,19:15,"@BscPitbull_TR @gate_io @BscPitbull investing enriches your future @BscPitbull $PIT #Bitcoin #btc
edited
15:36",bscpitbulltr gateio bscpitbull investing enriches your future bscpitbull pit bitcoin btc edited,0.0988849475979805,0.891191840171814,0.009923235513269901
2022-05-03,19:15,The current price of #BTC is $37712.63 in USD,the current price of btc is 3771263 in usd,0.029234660789370537,0.9495706558227539,0.02119465544819832
2022-05-03,19:15,@gate_io investing enriches your future @BscPitbull $PIT #Bitcoin #btc,gateio investing enriches your future bscpitbull pit bitcoin btc,0.1576276421546936,0.8320242762565613,0.01034802570939064
2022-05-03,19:15,"🇺🇸 This week from May 3 to May 4 - The US Federal Reserve's FOMC holds a two-day meeting on interest rates, followed by a decision to raise interest rates by 50 basis points is likely to be released. 
This may bring greater volatility to the global market.
#btc #Bitcoin #بيتكوين",this week from may 3 to may 4 the us federal reserve fomc holds a twoday meeting on interest rates followed by a decision to raise interest rates by 50 basis points is likely to be released this may bring greater volatility to the global market btc bitcoin بيتكوين,0.4494243562221527,0.5289599895477295,0.021615715697407722
2022-05-03,19:15,"🎗 Around 467,000 investors 🎗59.50% burned 🎗2% distributed to traders on every trade 🎗⌛️No time to wait #pitbull #pitbulltoken #pitbullarmy #pitbullnewlisting @BscPitbull #Bitcoin #btc   $Pitbull #PitbullCrew",around 467000 investors 5950 burned 2 distributed to traders on every trade no time to wait pitbull pitbulltoken pitbullarmy pitbullnewlisting bscpitbull bitcoin btc pitbull pitbullcrew,0.030519502237439156,0.9100103378295898,0.05947021767497063
2022-05-03,19:15,"@gate_io ✅Reach $290M MC this month #PitSwap, #PitMag and more #BullishPitbullToken #BscPitbull #gate_io #coinexcom #HuobiGlobal @BscPitbull #Bitcoin #btc",gateio reach 290m mc this month pitswap pitmag and more bullishpitbulltoken bscpitbull gateio coinexcom huobiglobal bscpitbull bitcoin btc,0.2417764812707901,0.7462598085403442,0.01196375023573637
2022-05-03,19:15,@gate_io #BuyPitbullToken Better than most tokens on your exchange. Their projects are beautiful and they have 490K holders. It's not too late to list @BscPitbull #Bitcoin #btc,gateio buypitbulltoken better than most tokens on your exchange their projects are beautiful and they have 490k holders it is not too late to list bscpitbull bitcoin btc,0.21135428547859192,0.7801118493080139,0.008533891290426254
2022-05-03,19:15,"@BscPitbull_TR @gate_io @BscPitbull it's going to burn down soon @BscPitbull $PIT #Bitcoin #btc
edited
15:35",bscpitbulltr gateio bscpitbull it is going to burn down soon bscpitbull pit bitcoin btc edited,0.021596252918243408,0.9193208813667297,0.05908285453915596
2022-05-03,19:15,"@RyanSAdams I think so.

I know a lot of ppl that have never researched anything related to finance and have done so after finding out about #bitcoin.

Some help out others in poor countries with giving them access to the financial system for the first time in their lives.

Etc...

So YES ✨",ryansadams i think so i know a lot of ppl that have never researched anything related to finance and have done so after finding out about bitcoin some help out others in poor countries with giving them access to the financial system for the first time in their lives etc so yes,0.2077830284833908,0.7826229929924011,0.00959400087594986
2022-05-03,19:15,"@TKralow #Bitcoin  always recover if you wait long enough If there is any coin not to ever underrate then is BTC because the pump will always happen

If you aren’t following @Bryan_tly you should be. There aren’t many who have a better understanding of value investing, great tweets &amp; tips",tkralow bitcoin always recover if you wait long enough if there is any coin not to ever underrate then is btc because the pump will always happen if you aren not following bryantly you should be there aren not many who have a better understanding of value investing great tweets tips,0.06638094782829285,0.900132954120636,0.033486105501651764
2022-05-03,19:15,@gate_io This is just the beginning. we're the pitbull family! $PIT @BscPitbull #Bitcoin #btc,gateio this is just the beginning we are the pitbull family pit bscpitbull bitcoin btc,0.06730752438306808,0.9179877638816833,0.014704725705087185
2022-05-03,19:15,"@AltcoinGordon I am So #Bullish in entire #Cryptomarket . 
Hit Like ❤️ if you feel the Same. #BITCOIN #altcoin",altcoingordon i am so bullish in entire cryptomarket hit like if you feel the same bitcoin altcoin,0.07286309450864792,0.8929089307785034,0.03422791510820389
2022-05-03,19:15,"@WatcherGuru I'm excited for the next few years!
It will be mind blowing 🤯
#Bitcoin",watcherguru i am excited for the next few years it will be mind blowing bitcoin,0.2029867321252823,0.7853797674179077,0.011633568443357944
2022-05-03,19:15,"Apparently, $luna wants to have $10 billion of #bitcoin to set the ""bitcoin standard"" for $ust. Is this the start of a massive protocol build-up?🤔#Crypto",apparently luna wants to have 10 billion of bitcoin to set the bitcoin standard for ust is this the start of a massive protocol buildupcrypto,0.04128050059080124,0.9098949432373047,0.048824578523635864
2022-05-03,19:15,@BscPitbull_TR @gate_io @BscPitbull every day you will regret that you did not take it one day @BscPitbull #Bitcoin #btc,bscpitbulltr gateio bscpitbull every day you will regret that you did not take it one day bscpitbull bitcoin btc,0.039553772658109665,0.9004496932029724,0.059996552765369415
2022-05-03,19:15,#utilitytoken should win during this boring time #btc #crypto,utilitytoken should win during this boring time btc crypto,0.7006837725639343,0.2887164056301117,0.010599752888083458
2022-05-03,19:15,@gate_io The real king of all tokens 👑 $PIT @BscPitbull #Bitcoin #btc,gateio the real king of all tokens pit bscpitbull bitcoin btc,0.07474768906831741,0.9056559205055237,0.01959644816815853
2022-05-03,19:15,Coinbase used #Bitcoin as collateral to borrow cash from Goldman Sachs.,coinbase used bitcoin as collateral to borrow cash from goldman sachs,0.04314671829342842,0.9271870255470276,0.029666176065802574
2022-05-03,19:15,Pitbull token is coming with a thump @BscPitbull $PIT #Bitcoin #btc   Pitbull Token #PitbullCrew,pitbull token is coming with a thump bscpitbull pit bitcoin btc pitbull token pitbullcrew,0.1107618510723114,0.8784541487693787,0.010783983394503593
2022-05-03,19:15,"@BscPitbull_TR @gate_io @BscPitbull ✅Reach $290M MC this month #PitSwap, #PitMag and more #BullishPitbullToken #BscPitbull #gate_io #coinexcom #HuobiGlobal @BscPitbull #Bitcoin #btc",bscpitbulltr gateio bscpitbull reach 290m mc this month pitswap pitmag and more bullishpitbulltoken bscpitbull gateio coinexcom huobiglobal bscpitbull bitcoin btc,0.16197144985198975,0.8264511227607727,0.011577432043850422
2022-05-03,19:15,Have #patience with your trade entries. It is still fragile/ volatile right now. Trade with alot of caution or go outside have a nice cold beer 🍻 #bitcoin #btc #cryptocurrency #crypto #cryptotrading,have patience with your trade entries it is still fragile volatile right now trade with alot of caution or go outside have a nice cold beer bitcoin btc cryptocurrency crypto cryptotrading,0.04072112962603569,0.9255093932151794,0.03376941755414009
2022-05-03,19:15,@gate_io 490.000+ Holders $9.5M+ Liquidity burned 330Trillions $PIT Burn by Tx in 7Days 6 Usecases/Dapps in Ecosystem 9 Listed Global Exchanges @BscPitbull #Bitcoin #btc,gateio 490000 holders 95m liquidity burned 330trillions pit burn by tx in 7days 6 usecasesdapps in ecosystem 9 listed global exchanges bscpitbull bitcoin btc,0.04517315700650215,0.9316913485527039,0.023135442286729813
2022-05-03,19:15,@gate_io You will hear more of us soon. Join us before it's too late! %100 Safety Token! $PIT @BscPitbull #Bitcoin #btc,gateio you will hear more of us soon join us before it is too late 100 safety token pit bscpitbull bitcoin btc,0.06437715142965317,0.9116746187210083,0.023948194459080696
2022-05-03,19:15,@BscPitbull_TR @gate_io @BscPitbull I'm enjoying watching because I'm a PITTBULL #pitbulltoken #bscpitbull #DeFi #pitbullcoin #Pit #PitMag #hodl #Metaverse #P2E #NFT #Bsc @BscPitbull $PIT #Bitcoin #btc,bscpitbulltr gateio bscpitbull i am enjoying watching because i am a pittbull pitbulltoken bscpitbull defi pitbullcoin pit pitmag hodl metaverse p2e nft bsc bscpitbull pit bitcoin btc,0.04496817663311958,0.9287154078483582,0.02631637267768383
2022-05-03,19:15,"🔻🔻🔻 $2,082,988 BTCUSDT SHORTED @$37,654.80 on #Binance (19:11:31 UTC) #BTC #cryptocurrency",2082988 btcusdt shorted 3765480 on binance utc btc cryptocurrency,0.04322994872927666,0.9253594279289246,0.03141060844063759
2022-05-03,19:15,"I am bullish in my mind and body. But i must admit that the momentum is bearish and $BTC will go lower🥹

I am prepared to buy at discount. Meanwhile staking stablecoins😌

#BTC #Bitcoin #ETH #Altcoins #NFTs #NFTCommunity",i am bullish in my mind and body but i must admit that the momentum is bearish and btc will go lower i am prepared to buy at discount meanwhile staking stablecoins btc bitcoin eth altcoins nfts nftcommunity,0.11107204109430313,0.4893933832645416,0.39953458309173584
2022-05-03,19:15,What if BTC crashes under 10k… 🤣🙃 #btc,what if btc crashes under 10k btc,0.021748263388872147,0.3987383544445038,0.5795133113861084
2022-05-03,19:15,@CashApp $fluffycho #Bitcoin,cashapp fluffycho bitcoin,0.03834833949804306,0.9383510947227478,0.023300616070628166
2022-05-03,19:15,"@Blockworks_ I'm excited for the next few years!
It will be mind blowing 🤯
#Bitcoin",blockworks i am excited for the next few years it will be mind blowing bitcoin,0.2456279993057251,0.7424066066741943,0.011965391226112843
2022-05-03,19:15,"@gate_io If you're researching tokens, you don't need to research anymore. Because there is Pitbull Token. $PIT @BscPitbull #Bitcoin",gateio if you are researching tokens you do not need to research anymore because there is pitbull token pit bscpitbull bitcoin,0.028912721201777458,0.9433146119117737,0.027772635221481323
2022-05-03,19:15,"@Vikingobitcoin2 #Bitcoin  always recover if you wait long enough If there is any coin not to ever underrate then is BTC because the pump will always happen

If you aren’t following @Bryan_tly you should be. There aren’t many who have a better understanding of value investing, great tweets &amp; tips",vikingobitcoin2 bitcoin always recover if you wait long enough if there is any coin not to ever underrate then is btc because the pump will always happen if you aren not following bryantly you should be there aren not many who have a better understanding of value investing great tweets tips,0.07224099338054657,0.8949697613716125,0.03278924897313118
2022-05-03,19:15,Don't be late buy more $pit - #ForzaPitbull BscPitbull Our target is 1 billion market value by the end of the year. #PitbullCREW #PitbullTokenShibaKiller #Metaverse #P2E #NFT #Bsc #Bnb #BTC @BscPitbull $PIT #Bitcoin #btc   Pit Community #PitbullCrew,do not be late buy more pit forzapitbull bscpitbull our target is 1 billion market value by the end of the year pitbullcrew pitbulltokenshibakiller metaverse p2e nft bsc bnb btc bscpitbull pit bitcoin btc pit community pitbullcrew,0.062542624771595,0.9244274497032166,0.01302995253354311
2022-05-03,19:15,"and I'm buying more!!! Df lol

#btc",and i am buying more df lol btc,0.317837119102478,0.6706380844116211,0.011524767614901066
2022-05-03,19:15,"#BTC $41150 is the road to $44,000 which would confirm all time highs is reachable this year!",btc 41150 is the road to 44000 which would confirm all time highs is reachable this year,0.23956122994422913,0.7448151111602783,0.015623671934008598
2022-05-03,19:15,"This abortion topic is here to distract you from the fact that a pedophile mafia hijacked America and the USD printing press. As well as BLM, COVID and Ukraine. Stop falling for this shit. Focus on fixing the money first, than we can fix the world. Buy and hodl #Bitcoin",this abortion topic is here to distract you from the fact that a pedophile mafia hijacked america and the usd printing press as well as blm covid and ukraine stop falling for this shit focus on fixing the money first than we can fix the world buy and hodl bitcoin,0.048004187643527985,0.6893371939659119,0.26265856623649597
