Date,Time,Original tweet,Clean tweet,Positive,Neutral,Negative
2022-05-09,19:15,"@MartiniGuyYT It's unclear what will happen to #Btc next, but it's best to prepare for more volatility.",martiniguyyt it is unclear what will happen to btc next but it is best to prepare for more volatility,0.028676647692918777,0.7826395630836487,0.18868377804756165
2022-05-09,19:15,"If you liked #Bitcoin at $69,000, you should love it at $36,000.",if you liked bitcoin at 69000 you should love it at 36000,0.06725167483091354,0.9128279089927673,0.01992042176425457
2022-05-09,19:15,Are $UST and $LUNA crashing #Bitcoin?,are ust and luna crashing bitcoin,0.027894334867596626,0.9509528279304504,0.021152814850211143
2022-05-09,19:15,I don't understand why and who is selling their #bitcoin at this price,i do not understand why and who is selling their bitcoin at this price,0.02979404479265213,0.7482133507728577,0.2219926118850708
2022-05-09,19:15,@BitcoinMagazine They sold their #btc any time announced that they bought again,bitcoinmagazine they sold their btc any time announced that they bought again,0.030122462660074234,0.94353848695755,0.026339126750826836
2022-05-09,19:15,"I’m smart, I keep my portfolios #Bitcoin I DON’T SELL!!!!!!",im smart i keep my portfolios bitcoin i don not sell,0.03179480880498886,0.9298499822616577,0.03835524246096611
2022-05-09,19:15,If you liked #Bitcoin at 60k you'll LOVE it at 30k. Surely...,if you liked bitcoin at 60k you will love it at 30k surely,0.07868407666683197,0.9056442975997925,0.01567165181040764
2022-05-09,19:15,"#WorkQuest $WQT $WUSD #WorkNet #WorkQuestApp #blockchian #crypto #cryptolife #BTC #BNB #ETH #digitalization #digitalassets #saving #BinanceSmartChain
Project that have come to solve the problems facing various payment system and also engender mass adoption of cryptocurrency.",workquest wqt wusd worknet workquestapp blockchian crypto cryptolife btc bnb eth digitalization digitalassets saving binancesmartchain project that have come to solve the problems facing various payment system and also engender mass adoption of cryptocurrency,0.27445849776268005,0.7177737951278687,0.007767656352370977
2022-05-09,19:15,I guarantee that if next week #btc closes at 45k this will be forgotten like it never happened. Emotions are At an ATH.,i guarantee that if next week btc closes at 45k this will be forgotten like it never happened emotions are at an ath,0.09514237940311432,0.6440976858139038,0.2607599198818207
2022-05-09,19:15,I just love this campagin for their management system . It is a great chance to earn money by using very easy process in today. #revenue #revenuecoin #bnb #bitcoin,i just love this campagin for their management system it is a great chance to earn money by using very easy process in today revenue revenuecoin bnb bitcoin,0.4363293945789337,0.5551910996437073,0.008479517884552479
2022-05-09,19:15,#Btc is ded,btc is ded,0.033165983855724335,0.9384145736694336,0.028419384732842445
2022-05-09,19:15,$28.8 is the key… #BTC,288 is the key btc,0.07520037144422531,0.9022590517997742,0.022540658712387085
2022-05-09,19:15,Time to support the support! #Bitcoin,time to support the support bitcoin,0.07725778967142105,0.9071387052536011,0.015603511594235897
2022-05-09,19:15,Just bought a tenth of 1 #Bitcoin @elonmusk make it go up please!,just bought a tenth of 1 bitcoin elonmusk make it go up please,0.23442277312278748,0.7508358955383301,0.014741340652108192
2022-05-09,19:15,"@stacyherbert When times are tough, we seek comfort from our #Bitcoin family. @maxkeiser and @stacyherbert are Daddy and Mommy.",stacyherbert when times are tough we seek comfort from our bitcoin family maxkeiser and stacyherbert are daddy and mommy,0.07924596220254898,0.9013352990150452,0.019418705254793167
2022-05-09,19:15,"@coinmamba Man, with $837.74M in liquidations, mostly longs of course, I can not imagine that we dont see a short squeeze at least from here. 
And $30300 #Bitcoin  looks like the perfect front-run!",coinmamba man with 83774m in liquidations mostly longs of course i can not imagine that we dont see a short squeeze at least from here and 30300 bitcoin looks like the perfect frontrun,0.12894409894943237,0.795238196849823,0.07581774145364761
2022-05-09,19:15,"WOW.... #BTC $30k and still dropping

This reeks of forced liquidations",wow btc 30k and still dropping this reeks of forced liquidations,0.018259089440107346,0.08207638561725616,0.8996644616127014
2022-05-09,19:15,"More like UNstablekwon

#BTC",more like unstablekwon btc,0.03500433638691902,0.931469738483429,0.03352593258023262
2022-05-09,19:15,"@Eric_BIGfund The short-term UST quickly dropped to around 0.95 USDT, and it was out of anchor. #bitcoin",ericbigfund the shortterm ust quickly dropped to around 095 usdt and it was out of anchor bitcoin,0.0073858592659235,0.026052014902234077,0.9665622115135193
2022-05-09,19:15,"This is just my personal opinion ok and nothing more 

I personally think #bitcoin 20000 area is a tremendous place for a jump may be even as high as 40-44K 

Now 31K $MSTR",this is just my personal opinion ok and nothing more i personally think bitcoin 20000 area is a tremendous place for a jump may be even as high as 4044k now 31k mstr,0.6455566883087158,0.3422221839427948,0.012221106328070164
2022-05-09,19:15,@Asher68W Buying #bitcoin is so EZ,asher68w buying bitcoin is so ez,0.10500795394182205,0.8726696968078613,0.022322334349155426
2022-05-09,19:15,"@elonmusk loves a good trade, now might be a good time to buy some #BTC!",elonmusk loves a good trade now might be a good time to buy some btc,0.18777495622634888,0.8000993728637695,0.012125717476010323
2022-05-09,19:15,"@PARABOLIT Man, with $837.74M in liquidations, mostly longs of course, I can not imagine that we dont see a short squeeze at least from here. 
And $30300 #Bitcoin  looks like the perfect front-run!",parabolit man with 83774m in liquidations mostly longs of course i can not imagine that we dont see a short squeeze at least from here and 30300 bitcoin looks like the perfect frontrun,0.12587638199329376,0.8060117959976196,0.0681118443608284
2022-05-09,19:15,@nic__carter #Bitcoin is dead 😂✌️,niccarter bitcoin is dead,0.03713339567184448,0.9009262323379517,0.061940331012010574
2022-05-09,19:15,"#Bitcoin MC hovering around 500-600 Billion

Multi Trillion dollars doesn’t happen over night! 

FEW.",bitcoin mc hovering around 500600 billion multi trillion dollars doesn not happen over night few,0.030054081231355667,0.9309739470481873,0.03897200524806976
2022-05-09,19:15,@RossjournoClark .@99BitcoinsHQ New #bitcoin obituary,rossjournoclark 99bitcoinshq new bitcoin obituary,0.06165338680148125,0.9204020500183105,0.017944522202014923
2022-05-09,19:15,And we are going back to pre bull run levels 😎👌🏼 hold on baby it’ll be another 4/5 years before we see any real returns - best times to accumulate are the coming months/ weeks/ years 👌🏼#Btc,and we are going back to pre bull run levels hold on baby itll be another 45 years before we see any real returns best times to accumulate are the coming months weeks years btc,0.09961209446191788,0.8805050849914551,0.01988283358514309
2022-05-09,19:15,In #Bitcoin i believe #cryptocurrency,in bitcoin i believe cryptocurrency,0.07496897876262665,0.9086015224456787,0.01642948016524315
2022-05-09,19:15,"Imagine not being one of the legends who bought $DOGE for less than a dime. #crypto
11/n $spy $djia $spx $ndx $qqq $iwm #btc",imagine not being one of the legends who bought doge for less than a dime crypto 11n spy djia spx ndx qqq iwm btc,0.05286620929837227,0.9316766858100891,0.015457144007086754
2022-05-09,19:15,I listen to no one on @CNBC when it comes to $BTC #Bitcoin,i listen to no one on cnbc when it comes to btc bitcoin,0.023583807051181793,0.9274948835372925,0.048921264708042145
2022-05-09,19:15,"I’m waiting 24,500 anytime 

But

For spot, my personal opinion 

🟢🟢🟢
Now is a good time to buy
🟢🟢🟢

#Bitcoin",im waiting 24500 anytime but for spot my personal opinion now is a good time to buy bitcoin,0.09393051266670227,0.8904237151145935,0.01564580760896206
2022-05-09,19:15,"FUCK YOU MCDONALDS!

#Bitcoin",fuck you mcdonalds bitcoin,0.043430496007204056,0.7138116955757141,0.24275782704353333
2022-05-09,19:15,"Markets going up or down do not bother me. We only trade the flow. 
Take your emotion out of the equation. 

$spy #Crypto #bitcoin",markets going up or down do not bother me we only trade the flow take your emotion out of the equation spy crypto bitcoin,0.0319710336625576,0.9287501573562622,0.0392787791788578
2022-05-09,19:15,#BTC down 11% so far!!???,btc down 11 so far,0.012050513178110123,0.027770398184657097,0.9601791501045227
2022-05-09,19:15,"🔻🔻🔻 $1,580,710 BTCUSDT SHORTED @$30,669.00 on #Binance (19:06:53 UTC) #BTC #cryptocurrency",1580710 btcusdt shorted 3066900 on binance utc btc cryptocurrency,0.040293123573064804,0.9310329556465149,0.028673874214291573
2022-05-09,19:15,"Black Friday sales on #Bitcoin and the whole crypto market.
But now, hodl &amp; thank me later.",black friday sales on bitcoin and the whole crypto market but now hodl thank me later,0.2379440814256668,0.7476664185523987,0.01438947394490242
2022-05-09,19:15,"😤😤😤😤😤😤😤😤The top two cryptocurrencies, BTC and ETH, fell by 10 percent today. What method would you choose to hedge? Please leave a message #BTC #EthereumNFTs",the top two cryptocurrencies btc and eth fell by 10 percent today what method would you choose to hedge please leave a message btc ethereumnfts,0.028189493343234062,0.6715030074119568,0.3003075420856476
2022-05-09,19:15,"Interesting times! 
New millionaires will be minted after this.
#Bitcoin #BTC #Crypto",interesting times new millionaires will be minted after this bitcoin btc crypto,0.10927864164113998,0.8785974979400635,0.01212382409721613
2022-05-09,19:15,"#Aliceincrypto #NFT #aliceNft #Airdrop #bountycampaign #bitcoin #defi #crypto #BSCGem #BSCGemsAlart #web3 This project has a very bright future, because I really think this project is too perfect to be neglected. This is a very cool and innovative project. The future belongs to",aliceincrypto nft alicenft airdrop bountycampaign bitcoin defi crypto bscgem bscgemsalart web3 this project has a very bright future because i really think this project is too perfect to be neglected this is a very cool and innovative project the future belongs to,0.539372980594635,0.4490920603275299,0.011534908786416054
2022-05-09,19:15,Where is #bitcoin going? Playing dumb.,where is bitcoin going playing dumb,0.02486644871532917,0.8575873970985413,0.11754610389471054
2022-05-09,19:15,"Analysts observe #Bitcoin recently completed its sixth red weekly candle, and the price could plummet to $28,000.",analysts observe bitcoin recently completed its sixth red weekly candle and the price could plummet to 28000,0.0398339182138443,0.014526866376399994,0.9456392526626587
2022-05-09,19:15,Is this the death of crypto? #cryptotrading #Bitcoin,is this the death of crypto cryptotrading bitcoin,0.01749367080628872,0.7611045241355896,0.22140176594257355
2022-05-09,19:15,"I don't know much about Bitcoin and trading, but what I do know is that when everyone is talking about a bear market or crash, the price usually does the opposite.

#eth #btc #hodl #stack",i do not know much about bitcoin and trading but what i do know is that when everyone is talking about a bear market or crash the price usually does the opposite eth btc hodl stack,0.025639627128839493,0.9056356549263,0.06872465461492538
2022-05-09,19:15,"🚨🚨ALERT🚨🚨

MICROSTRATEGY IS OFFICIALLY UNDER WATER WITH THEIR BITCOIN RESERVES!

@MicroStrategy @saylor 

#Bitcoin #BTC #MSTR",alert microstrategy is officially under water with their bitcoin reserves microstrategy saylor bitcoin btc mstr,0.20216234028339386,0.7851660251617432,0.012671591714024544
2022-05-09,19:15,"The crypto space has become a war zone, the west vrs the east. At the end of the day #Bitcoin will collapse then we all suffer 
#crypto #eth #shib #luna",the crypto space has become a war zone the west vrs the east at the end of the day bitcoin will collapse then we all suffer crypto eth shib luna,0.02525370754301548,0.5364181995391846,0.4383280873298645
2022-05-09,19:15,@ksicrypto I don't like what this guy is saying #btc,ksicrypto i do not like what this guy is saying btc,0.0301230289041996,0.6332287192344666,0.33664828538894653
2022-05-09,19:15,"What project are you Diamond Handing throughout this Crypto down trend? 💎

I will start $BSCWIN @BSCWIN_Bulls 🐂

#Crypto #NFT #BTC #ETH #BNB #cryptocurrency #NFTs",what project are you diamond handing throughout this crypto down trend i will start bscwin bscwinbulls crypto nft btc eth bnb cryptocurrency nfts,0.03597081080079079,0.9411728978157043,0.022856317460536957
2022-05-09,19:15,#Aliceincrypto #NFT #aliceNft #Airdrop #bountycampaign #bitcoin #defi #crypto #BSCGem #BSCGemsAlart #web3 This is the most reliable projects to join. The project have extraordinary goals and plans for the future. They have also a strong team with big ambitions.,aliceincrypto nft alicenft airdrop bountycampaign bitcoin defi crypto bscgem bscgemsalart web3 this is the most reliable projects to join the project have extraordinary goals and plans for the future they have also a strong team with big ambitions,0.6680902242660522,0.32346612215042114,0.008443707600235939
2022-05-09,19:15,"Why cryptos so low right now? Solana at $67 USD 
#Cryptocrash #Crypto #Bitcoin",why cryptos so low right now solana at 67 usd cryptocrash crypto bitcoin,0.034516409039497375,0.8255676627159119,0.13991586863994598
2022-05-09,19:15,"@Okanyksel07 According to the current trend, I think this will happen in #BTC .",okanyksel07 according to the current trend i think this will happen in btc,0.0852043405175209,0.8975152373313904,0.017280394211411476
2022-05-09,19:15,"Big money has been buying $btc huge today. These guys usually don't get rekt the way retail does. If you're buying 2,000 #bitcoin in one order, I think you're either out of your mind or know the bottom is near. We'll see.",big money has been buying btc huge today these guys usually do not get rekt the way retail does if you are buying 2000 bitcoin in one order i think you are either out of your mind or know the bottom is near we will see,0.03555265814065933,0.582072377204895,0.38237497210502625
2022-05-09,19:15,"🚨 #Bitcoin is now below MicroStrategy’s average purchase price of $30,700
@saylor @MicroStrategy @elonmusk",bitcoin is now below microstrategys average purchase price of 30700 saylor microstrategy elonmusk,0.0168504249304533,0.0771423801779747,0.9060071706771851
2022-05-09,19:15,"Mass adoption is imminent, this is not the end but a springboard for #Bitcoin 's biggest comeback 💣💥
ICYMI; Blueshshift's newest partnership with @Indacoin activated the purchase of #Blueshift $BLUES with Visa/MasterCard 🎉🚀 

#Cardano #Web3 #DeFi2",mass adoption is imminent this is not the end but a springboard for bitcoin biggest comeback icymi blueshshift newest partnership with indacoin activated the purchase of blueshift blues with visamastercard cardano web3 defi2,0.3315688967704773,0.6608089804649353,0.007622122298926115
2022-05-09,19:15,Can’t believe the price of #Bitcoin anyone know what’s happening?,can not believe the price of bitcoin anyone know whats happening,0.03174730762839317,0.8798485398292542,0.0884040892124176
2022-05-09,19:15,I blame this #Bitcoin crash on @MikeGillYYC. I told him not to buy into this Ponzi scheme but he didn’t listen. Oh well 🤷🏾‍♂️,i blame this bitcoin crash on mikegillyyc i told him not to buy into this ponzi scheme but he didn not listen oh well,0.039236877113580704,0.5187045931816101,0.4420585036277771
2022-05-09,19:15,"I’m gonna end up getting a lot more #bitcoin than I ever thought.

To the impatient degenerates: my family and my descendants thank you.",im gonna end up getting a lot more bitcoin than i ever thought to the impatient my family and my descendants thank you,0.1995970457792282,0.7712668776512146,0.02913605608046055
2022-05-09,19:15,"$Luna and $Ust must Go to 0
#Bitcoin
#SatoshiNakamoto 
#Freedom",luna and ust must go to 0 bitcoin satoshinakamoto freedom,0.026449207216501236,0.9529604911804199,0.02059033513069153
2022-05-09,19:15,@DiegoZatony @zxshvn @saylor @GoingParabolic @McDonalds With what? @MicroStrategy already have over $2B in loans to pay for billions in #Bitcoin,diegozatony zxshvn saylor goingparabolic mcdonalds with what microstrategy already have over 2b in loans to pay for billions in bitcoin,0.6684742569923401,0.3173193633556366,0.014206322841346264
2022-05-09,19:15,This will go down as the biggest dump in #btc history...,this will go down as the biggest dump in btc history,0.014880024828016758,0.11624691635370255,0.8688730597496033
2022-05-09,19:15,this is the end. #Bitcoin,this is the end bitcoin,0.024950150400400162,0.9320266246795654,0.04302319139242172
2022-05-09,19:15,"Bought #Bitcoin here @ $30,800.",bought bitcoin here 30800,0.0437474399805069,0.9340620040893555,0.02219061553478241
2022-05-09,19:15,#SeasonalTokens #CryptoMining #CyclicalInvesting #BTC this project implemented its unique idea and had good prospects and promising profits. a good project with a strong team always gives the best. i saw a very reliable and experienced team in managing this project,seasonaltokens cryptomining cyclicalinvesting btc this project implemented its unique idea and had good prospects and promising profits a good project with a strong team always gives the best i saw a very reliable and experienced team in managing this project,0.871996283531189,0.11752616614103317,0.01047758013010025
2022-05-09,19:15,Lets fucking go bears #btc,lets fucking go bears btc,0.10673782229423523,0.8469902276992798,0.0462719202041626
2022-05-09,19:15,"@bounce_finance @metalentshq all done 

@zdvbigwin 
@Hunter222Crypto 
@wilmerjaimesr 

#Cryptocurrency #Giveaway #CryptoGiveaway #Bitcoin #Ethereum #NFT #BTC #ETH #Auction #crypto #BinanceSmartChain #blockchain #NFTGiveaways",bouncefinance metalentshq all done zdvbigwin hunter222crypto wilmerjaimesr cryptocurrency giveaway cryptogiveaway bitcoin ethereum nft btc eth auction crypto binancesmartchain blockchain nftgiveaways,0.04853583127260208,0.9285838007926941,0.022880375385284424
2022-05-09,19:15,@NickGiva @MattiasLamotte @saylor about to be face his margin call once #bitcoin drops to around $21K. He's officially about to be underwater,nickgiva mattiaslamotte saylor about to be face his margin call once bitcoin drops to around 21k he is officially about to be underwater,0.0517612025141716,0.8742263913154602,0.07401235401630402
2022-05-09,19:15,@McDonalds #bitcoin is officially in a #bearmarket you guy’s hiring? Asking for a friend,mcdonalds bitcoin is officially in a bearmarket you guys hiring asking for a friend,0.049383845180273056,0.6797618865966797,0.27085426449775696
2022-05-09,19:15,🟢 #BTC Liquidated Short: $29.8K at $31100.0,btc liquidated 298k at 311000,0.02734558843076229,0.7152249813079834,0.25742942094802856
2022-05-09,19:15,@BitcoinMagazine Hey @saylor its time too buy some more #Bitcoin. 😎,bitcoinmagazine hey saylor its time too buy some more bitcoin,0.0856107696890831,0.8956723213195801,0.01871689036488533
2022-05-09,19:15,"48 hours ago, I told my friend to get his money out of #Bitcoin and #Fitfi and anything else except for #Earth2, so he did.

#Bitcoin has now gone #Skydiving and the the only thing keep it up is gravity.

This is the effect of #Crypto and there’s going to be a lot of upset.",48 hours ago i told my friend to get his money out of bitcoin and fitfi and anything else except for earth2 so he did bitcoin has now gone skydiving and the the only thing keep it up is gravity this is the effect of crypto and theres going to be a lot of upset,0.029558546841144562,0.7165940403938293,0.2538474500179291
2022-05-09,19:15,"@JorgeStolfi @saylor @leemonbaird @katie_haun @CaitlinLong_ @punk6529 @jackmallers @PeterMcCormack @RaoulGMI
#Bitcoin #Etherum #EthereumNFTs 
.
Vdog, et` al
@VitalikButerin 

Apparently you're following this guy (?), care to chime in?? - anyone? 

Look @ this thread, it's epic!

Go for it!",jorgestolfi saylor leemonbaird katiehaun caitlinlong punk6529 jackmallers petermccormack raoulgmi bitcoin etherum ethereumnfts vdog et al vitalikbuterin apparently you are following this guy care to chime in anyone look this thread it is epic go for it,0.03959745541214943,0.8967727422714233,0.06362977623939514
2022-05-09,19:15,"I Bought the dip:
$btc 
$eth
$Ada
$Dot 
$sol
$vet
$shib
$Win
$Xvg
$Pundix 

Now Bounce at 30k and to the moon 🚀 #btc #Bitcoin #ETH #SHIB #altcoin #moon #holo #holochain #PolkaDot #Solana #cardano #verge #xvg #VET #SHIBARMY",i bought the btc eth ada dot sol vet shib win xvg pundix now bounce at 30k and to the moon btc bitcoin eth shib altcoin moon holo holochain polkadot solana cardano verge xvg vet shibarmy,0.08399875462055206,0.9019437432289124,0.0140574611723423
2022-05-09,19:15,"@btcfts You're out of dollars, you need to wait for lower #bitcoin",btcfts you are out of dollars you need to wait for lower bitcoin,0.036037568002939224,0.8237694501876831,0.14019298553466797
2022-05-09,19:15,BarnBridge Governance Token (BOND) went up 10.5 percent in the last 30 minutes on Binance. #BOND  #crypto #bitcoin #cryptocurrency #btc #ethereum #blockchain #eth #trading #altcoin #binance #cryptonews,barnbridge governance token bond went up 105 percent in the last 30 minutes on binance bond crypto bitcoin cryptocurrency btc ethereum blockchain eth trading altcoin binance cryptonews,0.9150208234786987,0.07069963961839676,0.014279540628194809
2022-05-09,19:15,#Bitcoin go below 30k now,bitcoin go below 30k now,0.09026027470827103,0.5743468999862671,0.3353928327560425
2022-05-09,19:15,"No matter what happens, #Bitcoin class of 2021, we will have a story to tell our children.",no matter what happens bitcoin class of 2021 we will have a story to tell our children,0.0732354149222374,0.9136255383491516,0.013139129616320133
2022-05-09,19:15,"🟩 Block 735652 ⛏ ⛏

📅 9th May 2022, 19:02:02 GMT

📣 2,834 tx with a value of 23,330.628 ₿ ($714.84m 🇺🇸)

📣 distributed to 6,046 recipients 💎🙌

📣 19,035,331.25 ₿ (90.64443%) mined ⛏

📣 1,964,668.75 ₿ remaining 💰

#bitcoin #tictoknextblock",block 735652 9th may 2022 gmt 2834 tx with a value of 23330628 71484m distributed to 6046 recipients 1903533125 9064443 mined 196466875 remaining bitcoin tictoknextblock,0.059189777821302414,0.9149013757705688,0.02590887062251568
2022-05-09,19:15,🟢 #BTC Liquidated Short: $70.5K at $30644.0,btc liquidated 705k at 306440,0.026685280725359917,0.8325050473213196,0.14080968499183655
2022-05-09,19:15,🟢 #BTC Liquidated Short: $29.3K at $30644.0,btc liquidated 293k at 306440,0.0318414531648159,0.8671420216560364,0.1010165587067604
2022-05-09,19:15,🟢 #BTC Liquidated Short: $49K at $30644.0,btc liquidated 49k at 306440,0.028424862772226334,0.8253679275512695,0.14620722830295563
2022-05-09,19:15,@AurelienOhayon #BTC crashed to 30K &amp; you still ranting about big pump . Lol . It's a bear market . Can't deny that,aurelienohayon btc crashed to 30k you still ranting about big pump lol it is a bear market cannot deny that,0.06084989011287689,0.7752270698547363,0.1639229953289032
2022-05-09,19:15,"Btc is now below microstrategy average purchase of $30,700 

What are u doing to ur holding @saylor 

#Bitcoin",btc is now below microstrategy average purchase of 30700 what are u doing to ur holding saylor bitcoin,0.04356340691447258,0.5826554894447327,0.3737810254096985
2022-05-09,19:15,@Dennis_Porter_ They don’t care they got all the #Bitcoin they wanted from idiots who sold it to them.,dennisporter they don not care they got all the bitcoin they wanted from idiots who sold it to them,0.04285088926553726,0.9103682041168213,0.046780914068222046
2022-05-09,19:15,"Said it in July of 2021 and I’ll say it again. 

If this #Bitcoin drop shakes you out, then you’re soft and simply not going to make it. 

Buy #bitcoin 

Take it off whatever exchange you bought it on and everything will work out.",said it in july of 2021 and ill say it again if this bitcoin drop shakes you out then youre soft and simply not going to make it buy bitcoin take it off whatever exchange you bought it on and everything will work out,0.048221416771411896,0.876640796661377,0.07513782382011414
2022-05-09,19:15,🟢 #BTC Liquidated Short: $93.4K at $30703.0,btc liquidated 934k at 307030,0.02884317748248577,0.8567982912063599,0.11435849964618683
2022-05-09,19:15,🟢 #BTC Liquidated Short: $25.5K at $30703.0,btc liquidated 255k at 307030,0.03547462448477745,0.8287764191627502,0.13574892282485962
2022-05-09,19:15,"The only stable $ actually fully backed by #Bitcoin is $DOC on the #Bitcoin SideChain @RSKsmart 
With @moneyonchainok",the only stable actually fully backed by bitcoin is doc on the bitcoin sidechain rsksmart with moneyonchainok,0.04822239279747009,0.9374303817749023,0.014347245916724205
2022-05-09,19:15,🟢 #BTC Liquidated Short: $128K at $30672.0,btc liquidated 128k at 306720,0.05056191608309746,0.8405211567878723,0.10891689360141754
2022-05-09,19:15,🟢 #BTC Liquidated Short: $40.2K at $30703.0,btc liquidated 402k at 307030,0.03245433792471886,0.8802654147148132,0.08728022873401642
2022-05-09,19:15,🟢 #BTC Liquidated Short: $42.8K at $30703.0,btc liquidated 428k at 307030,0.02649143896996975,0.8023048043251038,0.17120376229286194
2022-05-09,19:15,🟢 #BTC Liquidated Short: $35.2K at $30703.0,btc liquidated 352k at 307030,0.029009731486439705,0.8351568579673767,0.13583342730998993
2022-05-09,19:15,🟢 #BTC Liquidated Short: $69.4K at $30703.0,btc liquidated 694k at 307030,0.030106177553534508,0.8513465523719788,0.11854727566242218
