Date,Time,Original tweet,Clean tweet,Positive,Neutral,Negative
2022-04-26,10:45,"There are many games in the FGW app where users can make cool money.

#FGW #FunnyGameWorld #crypto #bitcoin #cryptocurrency",there are many games in the fgw app where users can make cool money fgw funnygameworld crypto bitcoin cryptocurrency,0.045828189700841904,0.9328579902648926,0.02131378836929798
2022-04-26,10:45,"@DailyCrypto_t #Bitcoin is strongly retesting the $40000 area, if this holds, then we could see 41-41.5k before the close of the day #Buy #Hodl #Bitcoin 

@Mg_30y is a super underrated bitcoiner 
I’ve been taking her tweets and tips &amp; I’ve been doing really great 

Follow her",dailycryptot bitcoin is strongly retesting the 40000 area if this holds then we could see 41415k before the close of the day buy hodl bitcoin mg30y is a super underrated bitcoiner ive been taking her tweets and tips ive been doing really great follow her,0.837842583656311,0.1511313021183014,0.011026126332581043
2022-04-26,10:45,"Have a profitable Money Week ahead!

#MyMonyPot #BigMonyTribe #cryptocurrency #bitcoin #trading #economy #experience #FinancialMarket #CryptoCurrencynews #cryptotrading",have a profitable money week ahead mymonypot bigmonytribe cryptocurrency bitcoin trading economy experience financialmarket cryptocurrencynews cryptotrading,0.1960463970899582,0.7882341742515564,0.01571941189467907
2022-04-26,10:45,Inflation will make all #Bitcoin holders wealthy 📈,inflation will make all bitcoin holders wealthy,0.029279321432113647,0.10813577473163605,0.8625848889350891
2022-04-26,10:45,"#DeFi #ethax #ethaxcrypto #ethaxtoken #DEX #cryptocurrency #Ethereum #BinanceSmartChain #Bitcoin

I think this project will be successful as transparency and safety is exactly what we need to strengthen in the crypto world.",defi ethax ethaxcrypto ethaxtoken dex cryptocurrency ethereum binancesmartchain bitcoin i think this project will be successful as transparency and safety is exactly what we need to strengthen in the crypto world,0.8022167682647705,0.19041045010089874,0.00737277464941144
2022-04-26,10:45,"If #Bitcoin  closes with the weekly candle above the support trendline, that will be a huge confirmation that #BTC  will be bullish again.

Y'all follow @Tradeosiann  they'r super underrated #crypto #XRP  expert k",if bitcoin closes with the weekly candle above the support trendline that will be a huge confirmation that btc will be bullish again y all follow tradeosiann they r super underrated crypto xrp expert k,0.8268749117851257,0.15879283845424652,0.014332273043692112
2022-04-26,10:45,"We'll be open for a few weeks. 
Exchange some cryptocurrencies in a 1:1.2 ratio.
For example, if you give $100 worth of #btc , you can exchange it for $110-120 worth of cryptocurrency or more.
telegram: @exc00
You can start off with a small amount of money.
#BTC #XRP #DASH #DOGE",we will be open for a few weeks exchange some cryptocurrencies in a ratio for example if you give 100 worth of btc you can exchange it for 110120 worth of cryptocurrency or more exc00 you can start off with a small amount of money btc xrp dash doge,0.061661578714847565,0.9249415993690491,0.013396765105426311
2022-04-26,10:45,"#DeFi #ethax #ethaxcrypto #ethaxtoken #DEX #cryptocurrency #Ethereum #BinanceSmartChain #Bitcoin

This is very interesting project with big goals ahead project looks promising and there is a professional team working on ot. i believe this project has a bright future.",defi ethax ethaxcrypto ethaxtoken dex cryptocurrency ethereum binancesmartchain bitcoin this is very interesting project with big goals ahead project looks promising and there is a professional team working on ot i believe this project has a bright future,0.8264622092247009,0.16603252291679382,0.007505354005843401
2022-04-26,10:45,"@Meta_UFO #LTC #BNBBULL #bitcoin 
The project is implemented very professionally and has a clear development plan. Made by a very professional and experienced team. A potential project for the future. 

@luhak
@Priyada13501542
@ManojSanjeewa8",metaufo ltc bnbbull bitcoin the project is implemented very professionally and has a clear development plan made by a very professional and experienced team a potential project for the future luhak priyada13501542 manojsanjeewa8,0.6521272659301758,0.3399001657962799,0.007972481660544872
2022-04-26,10:45,"#DeFi #ethax #ethaxcrypto #ethaxtoken #DEX #cryptocurrency #Ethereum #BinanceSmartChain #Bitcoin

A good project collecting investment is developing and moving confidently towards the goals set. This means that the team is on its way to achieve the goal and will succeed",defi ethax ethaxcrypto ethaxtoken dex cryptocurrency ethereum binancesmartchain bitcoin a good project collecting investment is developing and moving confidently towards the goals set this means that the team is on its way to achieve the goal and will succeed,0.8887013792991638,0.10231572389602661,0.008982878178358078
2022-04-26,10:45,@MadhavSheth1 When accept crypto as payment? #dogecoin #bitcoin,madhavsheth1 when accept crypto as payment dogecoin bitcoin,0.04335520789027214,0.9400342702865601,0.016610536724328995
2022-04-26,10:45,"@gulf_news #Bitcoin is strongly retesting the $40000 area, if this holds, then we could see 41-41.5k before the close of the day #Buy #Hodl #Bitcoin 

@Mg_30y is a super underrated bitcoiner 
I’ve been taking her tweets and tips &amp; I’ve been doing really great 

Follow her",gulfnews bitcoin is strongly retesting the 40000 area if this holds then we could see 41415k before the close of the day buy hodl bitcoin mg30y is a super underrated bitcoiner ive been taking her tweets and tips ive been doing really great follow her,0.8457314968109131,0.1427464336156845,0.01152196153998375
2022-04-26,10:45,"@Healthland_io It's a very wonderful project !!!! I feel avant-garde and sharpened sensibility!!!! I'm so happy if you give me this one i'm very very thankyou 
@Majid29417958
@Niya1391
@venoos72

#cryptocurrency #BSC #Bitcoin #USDT #Healthify #HTF #Metaverse #NFT",healthlandio it is a very wonderful project i feel avantgarde and sharpened sensibility i am so happy if you give me this one i am very very thankyou majid29417958 niya1391 venoos72 cryptocurrency bsc bitcoin usdt healthify htf metaverse nft,0.16814962029457092,0.8214893937110901,0.01036101020872593
2022-04-26,10:45,CME: 11 new CME CF cryptocurrency reference rates and live indices now live.#NFTs #Ethereum #BTC,11 new cme cf cryptocurrency reference rates and live indices now livenfts ethereum btc,0.042633991688489914,0.9404430389404297,0.016922978684306145
2022-04-26,10:45,"If #Bitcoin  closes with the weekly candle above the support trendline, that will be a huge confirmation that #BTC  will be bullish again.

Y'all follow @Tradeosiann  they'r super underrated #crypto #XRP  expert j",if bitcoin closes with the weekly candle above the support trendline that will be a huge confirmation that btc will be bullish again y all follow tradeosiann they r super underrated crypto xrp expert j,0.8175933957099915,0.16747106611728668,0.014935524202883244
2022-04-26,10:45,"time is infinite ⏳
but your time and energy are finite 🎇 

use it wisely.                #bitcoin",time is infinite but your time and energy are finite use it wisely bitcoin,0.05145426094532013,0.927255392074585,0.021290281787514687
2022-04-26,10:45,"@CoinMarketCap Our analytical team has done a detailed analysis regarding #BTC, and its Fear and Greed Index is 44 - MILD FEAR at the moment with price of 40403.450698010573 usd, so what do you think about the current #Bitcoin state?",coinmarketcap our analytical team has done a detailed analysis regarding btc and its fear and greed index is 44 mild fear at the moment with price of 40403450698010573 usd so what do you think about the current bitcoin state,0.04534987360239029,0.925617516040802,0.029032574966549873
2022-04-26,10:45,"If #Bitcoin  closes with the weekly candle above the support trendline, that will be a huge confirmation that #BTC  will be bullish again.

Y'all follow @Tradeosiann  they'r super underrated #crypto #XRP  expert f",if bitcoin closes with the weekly candle above the support trendline that will be a huge confirmation that btc will be bullish again y all follow tradeosiann they r super underrated crypto xrp expert f,0.814744234085083,0.16923069953918457,0.016025083139538765
2022-04-26,10:45,"FGW is regrouping to do another great presale for users. Anticipate! 

#FGW #FunnyGameWorld #crypto #bitcoin #cryptocurrency",fgw is regrouping to do another great presale for users anticipate fgw funnygameworld crypto bitcoin cryptocurrency,0.8683133125305176,0.12159024924039841,0.01009642705321312
2022-04-26,10:45,"@TokenrewardI A great person says that success is achieved with a one percent chance of ninety-nine percent effort.I wish the best for this project.
#Airdrop #Binance #BNB #BSC #PancakeSwap #cryptocurrency #DeFi #BinanceSmartChain #BTC
@Sahaliiii4 @Arad1521 @Momo25802580",tokenrewardi a great person says that success is achieved with a one percent chance of ninetynine percent efforti wish the best for this project airdrop binance bnb bsc pancakeswap cryptocurrency defi binancesmartchain btc sahaliiii4 arad1521 momo25802580,0.5997759103775024,0.3896263837814331,0.010597730055451393
2022-04-26,10:45,#Bitcoin sence?,bitcoin sence,0.07346730679273605,0.9050100445747375,0.021522652357816696
2022-04-26,10:45,"Buy now Dogecoin NOW, its going to go sky high. 

#dogecoin #DogecoinToTheMoon #Bitcoin #ElonMusk",buy now dogecoin now its going to go sky high dogecoin dogecointothemoon bitcoin elonmusk,0.09952795505523682,0.8873501420021057,0.013121915981173515
2022-04-26,10:45,@Meta_UFO #LTC #BNBBULL #bitcoin The project is implemented very professionally and has a clear development plan. Made by a very professional and experienced team. A potential project for the future.,metaufo ltc bnbbull bitcoin the project is implemented very professionally and has a clear development plan made by a very professional and experienced team a potential project for the future,0.7835726737976074,0.20942512154579163,0.0070021431893110275
2022-04-26,10:45,"@rektcapital #Bitcoin is strongly retesting the $40000 area, if this holds, then we could see 41-41.5k before the close of the day #Buy #Hodl #Bitcoin 

@Mg_30y is a super underrated bitcoiner 
I’ve been taking her tweets and tips &amp; I’ve been doing really great 

Follow her",rektcapital bitcoin is strongly retesting the 40000 area if this holds then we could see 41415k before the close of the day buy hodl bitcoin mg30y is a super underrated bitcoiner ive been taking her tweets and tips ive been doing really great follow her,0.842456042766571,0.14626489579677582,0.011279070749878883
2022-04-26,10:45,@Cointelegraph #BTC has no borders 💎💎💎💕💕💕 this definitely clown news 🤡🤡🤡,cointelegraph btc has no borders this definitely clown news,0.08218323439359665,0.8904805183410645,0.02733624540269375
2022-04-26,10:45,"@cryptonews #Bitcoin is strongly retesting the $40000 area, if this holds, then we could see 41-41.5k before the close of the day #Buy #Hodl #Bitcoin 

@Mg_30y is a super underrated bitcoiner 
I’ve been taking her tweets and tips &amp; I’ve been doing really great 

Follow her",cryptonews bitcoin is strongly retesting the 40000 area if this holds then we could see 41415k before the close of the day buy hodl bitcoin mg30y is a super underrated bitcoiner ive been taking her tweets and tips ive been doing really great follow her,0.8323895335197449,0.1561855524778366,0.011424864642322063
2022-04-26,10:45,"Fun fact: #Bitcoin #BTC has been a lot less volatile than many fiat currencies the past four months. With no inflation, it seems like an easy pick.",fun bitcoin btc has been a lot less volatile than many fiat currencies the past four months with no inflation it seems like an easy pick,0.21458597481250763,0.7417317628860474,0.04368222877383232
2022-04-26,10:45,"Fidelity will let retirement savers put #Bitcoin into their 401(k) accounts starting later in 2022, the first major retirement plan provider to do so. #Cryptos",fidelity will let retirement savers put bitcoin into their 401k accounts starting later in 2022 the first major retirement plan provider to do so cryptos,0.13737228512763977,0.8532805442810059,0.009347156621515751
2022-04-26,10:45,"Show me your art / NFTs 👇🔥

#ElonMuskBuyTwitter #ElonMusk #BNB #Bitcoin #Bitcoin #dogecoin",show me your art nfts elonmuskbuytwitter elonmusk bnb bitcoin bitcoin dogecoin,0.06244770437479019,0.9229872226715088,0.014565098099410534
2022-04-26,10:45,"@zndtoshi #Bitcoin is strongly retesting the $40000 area, if this holds, then we could see 41-41.5k before the close of the day #Buy #Hodl #Bitcoin 

@Mg_30y is a super underrated bitcoiner 
I’ve been taking her tweets and tips &amp; I’ve been doing really great 

Follow her",zndtoshi bitcoin is strongly retesting the 40000 area if this holds then we could see 41415k before the close of the day buy hodl bitcoin mg30y is a super underrated bitcoiner ive been taking her tweets and tips ive been doing really great follow her,0.8349940180778503,0.15367475152015686,0.011331187561154366
2022-04-26,10:45,"What Crypto Coin do you think will rise the most 📈 in 2022 ? 

#bitcoin  #Bitcoin2022 #Crypto #Cryptos #Ethereum #twitter #Twitter #cryptoart #cryptotwitter",what crypto coin do you think will rise the most in 2022 bitcoin bitcoin2022 crypto cryptos ethereum twitter twitter cryptoart cryptotwitter,0.10007374733686447,0.8837071657180786,0.01621912233531475
2022-04-26,10:45,@cryptomanran #Bitcoin went to $43k and dumped again. It's doing the same until it goes down to $37k or $29k!,cryptomanran bitcoin went to 43k and dumped again it is doing the same until it goes down to 37k or 29k,0.03552831709384918,0.6606888175010681,0.3037828803062439
2022-04-26,10:45,"BREAKING 🚨
@Fidelity Investments pushes #Bitcoin further into #Mainstream by offering it for pension plans.

#CryptoNews",breaking fidelity investments pushes bitcoin further into mainstream by offering it for pension plans cryptonews,0.42954084277153015,0.5576410889625549,0.012818101793527603
2022-04-26,10:45,"@AbroadInJapan #Bitcoin is the only thing that can save people from the melting ice cube we call fiat currency. In the short term, tourism certainly helps but, that requires freedom…",abroadinjapan bitcoin is the only thing that can save people from the melting ice cube we call fiat currency in the short term tourism certainly helps but that requires freedom,0.22596825659275055,0.7629263997077942,0.011105356737971306
2022-04-26,10:45,"@Polytrade_fin price today is $0.180970 USD with a 
24-hour trading volume increased by 7.84% in 24 Hours.
Soon it will go to the moon.🚀
#Cryptos #cryptocurrency #Bitcoin #ETH",polytradefin price today is 0180970 usd with a 24hour trading volume increased by 784 in 24 hours soon it will go to the moon cryptos cryptocurrency bitcoin eth,0.41121166944503784,0.5772910714149475,0.011497251689434052
2022-04-26,10:45,@Cointelegraph @elonmusk @Tesla #BTC will moon 🚀🚀🚀🔥🔥🔥💎💎💎💕💕💕,cointelegraph elonmusk tesla btc will moon,0.06537584960460663,0.9238296747207642,0.01079445332288742
2022-04-26,10:45,"You may check the app and find out the coins which has a bullish / bearish potential. 

Scorehood is a toolkit, not a prediction machine. This toolkit will let you decide wiser with the help of AI based calculations. 

#Bitcoin #BTC #Crypto #altcoin",you may check the app and find out the coins which has a bullish bearish potential scorehood is a toolkit not a prediction machine this toolkit will let you decide wiser with the help of ai based calculations bitcoin btc crypto altcoin,0.08365677297115326,0.9027735590934753,0.013569623231887817
2022-04-26,10:45,"Do you also have the feeling that there is every stupidity in emoji, but IT has forgotten about #bitcoin?",do you also have the feeling that there is every stupidity in emoji but it has forgotten about bitcoin,0.04117633029818535,0.8960268497467041,0.06279677152633667
2022-04-26,10:45,"#Bitcoin and #Crypto liberates  you from everything,I literally mean EVERYTHING,Freedom is the core structure of crypto 🔥",bitcoin and crypto liberates you from everythingi literally mean everythingfreedom is the core structure of crypto,0.028720887377858162,0.9377336502075195,0.033545441925525665
2022-04-26,10:45,Happy 11th disappearing anniversary Satoshi Nakamoto. #Bitcoin,happy 11th disappearing anniversary satoshi nakamoto bitcoin,0.06610852479934692,0.8961645364761353,0.037727002054452896
2022-04-26,10:45,I'm guessing the Central African Republic didn't make #Bitcoin legal tender.,i am guessing the central african republic did not make bitcoin legal tender,0.02959303744137287,0.899825394153595,0.07058151066303253
2022-04-26,10:45,@elonmusk I want a #Bitcoin orange check and a yellow #Doge check. I will pay $$$,elonmusk i want a bitcoin orange check and a yellow doge check i will pay,0.06402742862701416,0.9175035953521729,0.018468938767910004
2022-04-26,10:45,"Am long on several industries. #EVs, #blockchaintechnology ,#drones 

$TSLA $NIO $GM $DPRO $TAKOF $CWRK

#StockMarket 
#BTC 
#Blockchain",am long on several industries evs blockchaintechnology drones tsla nio gm dpro takof cwrk stockmarket btc blockchain,0.06374599784612656,0.9227377772331238,0.01351624820381403
2022-04-26,10:45,"We are giving 5,750,000 $APE for 10,000 participants 🎁🎁

First Come First Serve.

1️⃣Follow us @Shima8095
2️⃣Like and Retweet pined Post
3️⃣Tag 3 Friends Hashtags #BoredApeYC #btc #bnb #eth 

4️⃣Fill form erc20 wallet bellow",we are giving 5750000 ape for 10000 participants first come first serve 1follow us shima8095 2like and retweet pined post 3tag 3 friends hashtags boredapeyc btc bnb eth 4fill form erc20 wallet bellow,0.08549007773399353,0.8996682167053223,0.014841722324490547
2022-04-26,10:45,"0.1 BNB giveaway! 10 X 0.01 BNB follow those steps:
1. Like the post
2. Retweet the post
3. Comment 'Done' once you did!

Picking the winners in 12 hours!
#BSC #crypto #BNB #giveaway #BTC #BSCGEM #BSCGEMS",01 bnb giveaway 10 x 001 bnb follow those 1 like the post 2 retweet the post 3 comment done once you did picking the winners in 12 hours bsc crypto bnb giveaway btc bscgem bscgems,0.04610228165984154,0.9322136044502258,0.02168409340083599
2022-04-26,10:45,"@CryptoBusy #Bitcoin is strongly retesting the $40000 area, if this holds, then we could see 41-41.5k before the close of the day #Buy #Hodl #Bitcoin 

@Mg_30y is a super underrated bitcoiner 
I’ve been taking her tweets and tips &amp; I’ve been doing really great 

Follow her",cryptobusy bitcoin is strongly retesting the 40000 area if this holds then we could see 41415k before the close of the day buy hodl bitcoin mg30y is a super underrated bitcoiner ive been taking her tweets and tips ive been doing really great follow her,0.8415254950523376,0.14735010266304016,0.011124414391815662
2022-04-26,10:45,"#SeasonalTokens #CryptoMining #CyclicalInvesting #BTC

This is most stronger and legit project.This is a high quality project with clear roadmap.I wish this project will be able to present itself as a much better project.",seasonaltokens cryptomining cyclicalinvesting btc this is most stronger and legit projectthis is a high quality project with clear roadmapi wish this project will be able to present itself as a much better project,0.9289777874946594,0.06143134832382202,0.009590920992195606
2022-04-26,10:45,"@CryptoTony__ #ETH  practical applications are way more than one can think . It’s gazillion times better than #Bitcoin.

It's another day of anticipation for $CVP big price  figures. Hodlers are glued to the announcement board. It's a win 🏆for $CVP this morning let's stay positive.",cryptotony eth practical applications are way more than one can think its gazillion times better than bitcoin it is another day of anticipation for cvp big price figures hodlers are glued to the announcement board it is a win for cvp this morning let us stay positive,0.28168943524360657,0.7042137980461121,0.014096762053668499
2022-04-26,10:45,@Davincij15 Buy more #btc,davincij15 buy more btc,0.1836366057395935,0.8027873635292053,0.013575968332588673
2022-04-26,10:45,"Scorehood AI Based Crypto Tool

If you are tired of looking technical , sentimental, fundamental analysis this app is for you. 

We are analyzing top 300 coins and calculating a score for finding bearish or bullish status.

#Bitcoin
#BTC
#Crypto
#altcoin",scorehood ai based crypto tool if you are tired of looking technical sentimental fundamental analysis this app is for you we are analyzing top 300 coins and calculating a score for finding bearish or bullish status bitcoin btc crypto altcoin,0.037899959832429886,0.9401796460151672,0.02192046493291855
2022-04-26,10:45,@Cointelegraph #BTC is digital gold 💎💎💎💕💕💕,cointelegraph btc is digital gold,0.0341254323720932,0.9459074139595032,0.019967135041952133
2022-04-26,10:45,"When you trade on just your gut, you gamble. 
When you trade with your gut and mind, you make history ‼️🚀🚀📈📈#cryptocurrency #BTC",when you trade on just your gut you gamble when you trade with your gut and mind you make history cryptocurrency btc,0.044437117874622345,0.9325089454650879,0.023053891956806183
2022-04-26,10:45,"@BitcoinMktJrnl #Bitcoin is strongly retesting the $40000 area, if this holds, then we could see 41-41.5k before the close of the day #Buy #Hodl #Bitcoin 

@Mg_30y is a super underrated bitcoiner 
I’ve been taking her tweets and tips &amp; I’ve been doing really great 

Follow her",bitcoinmktjrnl bitcoin is strongly retesting the 40000 area if this holds then we could see 41415k before the close of the day buy hodl bitcoin mg30y is a super underrated bitcoiner ive been taking her tweets and tips ive been doing really great follow her,0.8428629040718079,0.14544960856437683,0.011687515303492546
2022-04-26,10:45,"@NOPRINTSNOFACE Your 10,000 #GPCX gift has been sent to your wallet address. Thanks for interesting. 

#cryptocurrecy #CryptoNews #Crypto #altcoins #bitcoin #ethereum #Kriptopara #Token #bitcoin #ethereum #Cryptos #binance #gate #txbit",noprintsnoface your 10000 gpcx gift has been sent to your wallet address thanks for interesting cryptocurrecy cryptonews crypto altcoins bitcoin ethereum kriptopara token bitcoin ethereum cryptos binance gate txbit,0.11829095333814621,0.8706929683685303,0.011016009375452995
2022-04-26,10:45,Current #Bitcoin Price is $40405 #BTC #Crypto,current bitcoin price is 40405 btc crypto,0.020961105823516846,0.951324462890625,0.027714448049664497
2022-04-26,10:45,"@ScanTrend #Bitcoin is strongly retesting the $40000 area, if this holds, then we could see 41-41.5k before the close of the day #Buy #Hodl #Bitcoin 

@Mg_30y is a super underrated bitcoiner 
I’ve been taking her tweets and tips &amp; I’ve been doing really great 

Follow her",scantrend bitcoin is strongly retesting the 40000 area if this holds then we could see 41415k before the close of the day buy hodl bitcoin mg30y is a super underrated bitcoiner ive been taking her tweets and tips ive been doing really great follow her,0.8445635437965393,0.1433916985988617,0.012044685892760754
2022-04-26,10:45,"🆕 🇨🇫 The Central African Republic has begun creating a legal framework to regulate the use of cryptoassets and is not trying to introduce #bitcoin as legal tender, Finance Minister Herve Ndoba told Bloomberg.",the central african republic has begun creating a legal framework to regulate the use of cryptoassets and is not trying to introduce bitcoin as legal tender finance minister herve ndoba told bloomberg,0.18378525972366333,0.8039355874061584,0.012279205024242401
2022-04-26,10:45,"Current #Bitcoin price is $40,405.47",current bitcoin price is 4040547,0.02041671797633171,0.9435864686965942,0.03599683940410614
2022-04-26,10:45,'l.'.'...create twitter tasks and pay with #bitcoin #ethereum or #litecoin with @jobboycom,l create twitter tasks and pay with bitcoin ethereum or litecoin with jobboycom,0.026359912008047104,0.9463292360305786,0.027310851961374283
2022-04-26,10:45,I value efficiency improvements in #Bitcoin rather than increased expresivity. This is why I am in favor of Segwit and Taproot but against BIP300. I fail to understand which side of these two is CTV.,i value efficiency improvements in bitcoin rather than increased expresivity this is why i am in favor of segwit and taproot but against bip300 i fail to understand which side of these two is ctv,0.16134177148342133,0.8204855918884277,0.01817258447408676
2022-04-26,10:45,RMoonOfficial Nice moment with risemoonAdam52694915 UttamINC metabebyshark #Ethereum #bitcoin #BEAM,rmoonofficial nice moment with risemoonadam52694915 uttaminc metabebyshark ethereum bitcoin beam,0.25954678654670715,0.7298130393028259,0.010640150867402554
2022-04-26,10:45,"Try to save something while your salary is small; it’s impossible to save after you begin to earn more.

Make real income With me today and start wining daily #Bitcoin",try to save something while your salary is small its impossible to save after you begin to earn more make real income with me today and start wining daily bitcoin,0.05834389105439186,0.872147262096405,0.06950881332159042
2022-04-26,10:45,@Blockworks_ #BTC is on fire 🚀🚀🚀💎💎💎🔥🔥🔥200k this 2020 has become a reality 💎💎💎🔥🔥🔥do NOT sell your bitcoins and satoshis 💎💎💎💕💕💕,blockworks btc is on fire 200k this 2020 has become a reality do not sell your bitcoins and satoshis,0.02820485457777977,0.7989226579666138,0.17287251353263855
