Date,Time,Original tweet,Clean tweet,Positive,Neutral,Negative
2022-05-24,22:45,"upwind 💨🚶🏻‍♂️
I think it's will drop to break $9000
#Rememberd #BTC #Bitcoin",upwind i think it is will drop to break 9000 rememberd btc bitcoin,0.018473386764526367,0.03125592693686485,0.9502705931663513
2022-05-24,22:45,"Claim your 100 #USDT Now !!!

👇
Link ; https://t.co/EjiKhbzEbB

#NFTs #ETH #Binance #Bitcoin #BitcoinPizzaDay https://t.co/GgNnyA7t7V",claim your 100 usdt now link nfts eth binance bitcoin bitcoinpizzaday,0.05387004837393761,0.9272956848144531,0.018834281712770462
2022-05-24,22:45,@c0insbit #LUFFYCREW #LUFFY $LUFFY #LUFFYV2 #LUFFYTOKEN #SHIB #DOGE #Binance #Coinbase #Metaverse #cryptocurrency #BTC #ETH #nft #NFTs @luffyinutoken @LuffyTurkey #LUFFYCREW #LUFFY $LUFFY #LUFFYV2 #LUFFYTOKEN #SHIB #DOGE #Binance #Coinbase #Metaverse @luffyinutoken @LuffyTurkey #gateio,c0insbit luffycrew luffy luffy luffyv2 luffytoken shib doge binance coinbase metaverse cryptocurrency btc eth nft nfts luffyinutoken luffyturkey luffycrew luffy luffy luffyv2 luffytoken shib doge binance coinbase metaverse luffyinutoken luffyturkey gateio,0.04336071014404297,0.9375776052474976,0.019061727449297905
2022-05-24,22:45,"Mfers were buying houses and land in the metaverse and now they have to sell there houses to pay the bills

Welcome to crypto

#btc #eth",mfers were buying houses and land in the metaverse and now they have to sell there houses to pay the bills welcome to crypto btc eth,0.02740180306136608,0.9126311540603638,0.059967007488012314
2022-05-24,22:45,"@rovercrc Market is still Bearish. #BTC   Might touch $24,500. It could be $19,000 👀",rovercrc market is still bearish btc might touch 24500 it could be 19000,0.03906625881791115,0.902942419052124,0.05799132585525513
2022-05-24,22:45,@BitcoinMagazine @tedcruz Cruz is DCAing into #Bitcoin,bitcoinmagazine tedcruz cruz is dcaing into bitcoin,0.035555534064769745,0.9450038075447083,0.01944064535200596
2022-05-24,22:45,"👀

@CanteringClark took us all back to class a couple of hours ago.

Chad.

#Bitcoin",canteringclark took us all back to class a couple of hours ago chad bitcoin,0.03575052693486214,0.9357236623764038,0.028525810688734055
2022-05-24,22:45,@compoundfinance #LUFFYCREW #LUFFY $LUFFY #LUFFYV2 #LUFFYTOKEN #SHIB #DOGE #Binance #Coinbase #Metaverse #cryptocurrency #BTC #ETH #nft #NFTs @luffyinutoken @LuffyTurkey #LUFFYCREW #LUFFY $LUFFY #LUFFYV2 #LUFFYTOKEN #SHIB #DOGE #Binance #Coinbase #Metaverse @luffyinutoken @LuffyTurkey #gateio,compoundfinance luffycrew luffy luffy luffyv2 luffytoken shib doge binance coinbase metaverse cryptocurrency btc eth nft nfts luffyinutoken luffyturkey luffycrew luffy luffy luffyv2 luffytoken shib doge binance coinbase metaverse luffyinutoken luffyturkey gateio,0.045612882822752,0.9362785220146179,0.018108608201146126
2022-05-24,22:45,"@MMCrypto #ZIL for huge potencial and #jasmy for potencial of low cap oportunity and potencial to adopt in Japan, of course there is #BNB with which i can pay everything with theyr #VISA and for future of course old good #BTC mass adoption incoming 💪 but world crisis started now i think",mmcrypto zil for huge potencial and jasmy for potencial of low cap oportunity and potencial to adopt in japan of course there is bnb with which i can pay everything with theyr visa and for future of course old good btc mass adoption incoming but world crisis started now i think,0.06812797486782074,0.9078648686408997,0.024007093161344528
2022-05-24,22:45,"Who will use binance for crypto currency payment? Is it helpful?
Let me know
#Bitcoin
#Binance #BinanceSmartChain #ADA #cryptocurrency",who will use binance for crypto currency payment is it helpful let me know bitcoin binance binancesmartchain ada cryptocurrency,0.05060267075896263,0.9342092871665955,0.015188048593699932
2022-05-24,22:45,"i bought #Bitcoin at $60,000 

Ethereum at $4,000 

Dogecoin at $0.70 

$LUNA at $100

Follow me if you want to get rich quick 🤣🤣🤣🤣

#LUNA #Bitcoin #ElonMusk #Doge #SHIB  #Ethereum",i bought bitcoin at 60000 ethereum at 4000 dogecoin at 070 luna at 100 follow me if you want to get rich quick luna bitcoin elonmusk doge shib ethereum,0.050230901688337326,0.9305404424667358,0.0192286167293787
2022-05-24,22:45,"@BTCfuel as #bitcoin  was about to rally. We are now testing lower support levels and this area should be bought for a bullish resolution to the upside

@Sz_09y is a super underrated bitcoiner
I’ve been taking her tweets and tips seriously &amp; I’ve  been doing really great

Follow her",btcfuel as bitcoin was about to rally we are now testing lower support levels and this area should be bought for a bullish resolution to the upside sz09y is a super underrated bitcoiner ive been taking her tweets and tips seriously ive been doing really great follow her,0.8490592837333679,0.12188093364238739,0.029059723019599915
2022-05-24,22:45,"if @elonmusk doesn’t end up owning twitter for whatever reason, he should buy an equal amount of #Bitcoin instead, or at least threaten to",if elonmusk doesn not end up owning twitter for whatever reason he should buy an equal amount of bitcoin instead or at least threaten to,0.07422591745853424,0.9100028276443481,0.01577126979827881
2022-05-24,22:45,@compoundfinance @LewellenMichael @OpenZeppelin @pauljlei @gauntletnetwork @jmflatow #LUFFYCREW #LUFFY $LUFFY #LUFFYV2 #LUFFYTOKEN #SHIB #DOGE #Binance #Coinbase #Metaverse #cryptocurrency #BTC #ETH #nft #NFTs @luffyinutoken @LuffyTurkey #LUFFYCREW #LUFFY $LUFFY #LUFFYV2 #LUFFYTOKEN #SHIB #DOGE #Binance #Coinbase #Metaverse @luffyinutoken @LuffyTurkey #gateio,compoundfinance lewellenmichael openzeppelin pauljlei gauntletnetwork jmflatow luffycrew luffy luffy luffyv2 luffytoken shib doge binance coinbase metaverse cryptocurrency btc eth nft nfts luffyinutoken luffyturkey luffycrew luffy luffy luffyv2 luffytoken shib doge binance coinbase metaverse luffyinutoken luffyturkey gateio,0.040931228548288345,0.9340226650238037,0.025046125054359436
2022-05-24,22:45,@BithumbOfficial #LUFFYCREW #LUFFY $LUFFY #LUFFYV2 #LUFFYTOKEN #SHIB #DOGE #Binance #Coinbase #Metaverse #cryptocurrency #BTC #ETH #nft #NFTs @luffyinutoken @LuffyTurkey #LUFFYCREW #LUFFY $LUFFY #LUFFYV2 #LUFFYTOKEN #SHIB #DOGE #Binance #Coinbase #Metaverse @luffyinutoken @LuffyTurkey #gateio,bithumbofficial luffycrew luffy luffy luffyv2 luffytoken shib doge binance coinbase metaverse cryptocurrency btc eth nft nfts luffyinutoken luffyturkey luffycrew luffy luffy luffyv2 luffytoken shib doge binance coinbase metaverse luffyinutoken luffyturkey gateio,0.03982061147689819,0.9397749900817871,0.020404398441314697
2022-05-24,22:45,"Selling #Bitcoin now, even if it goes lower, unless you want to have a surgery or eat or pay electric bill, classifies you as 🤡._",selling bitcoin now even if it goes lower unless you want to have a surgery or eat or pay electric bill classifies you as,0.0476289726793766,0.7728638648986816,0.17950716614723206
2022-05-24,22:45,@BithumbOfficial @GenG_KR #LUFFYCREW #LUFFY $LUFFY #LUFFYV2 #LUFFYTOKEN #SHIB #DOGE #Binance #Coinbase #Metaverse #cryptocurrency #BTC #ETH #nft #NFTs @luffyinutoken @LuffyTurkey #LUFFYCREW #LUFFY $LUFFY #LUFFYV2 #LUFFYTOKEN #SHIB #DOGE #Binance #Coinbase #Metaverse @luffyinutoken @LuffyTurkey #gateio,bithumbofficial gengkr luffycrew luffy luffy luffyv2 luffytoken shib doge binance coinbase metaverse cryptocurrency btc eth nft nfts luffyinutoken luffyturkey luffycrew luffy luffy luffyv2 luffytoken shib doge binance coinbase metaverse luffyinutoken luffyturkey gateio,0.040545761585235596,0.9389338493347168,0.020520329475402832
2022-05-24,22:45,I just bought another #Bitcoin and threw it into a Ledger. Too much bearish talk right now. $BTC,i just bought another bitcoin and threw it into a ledger too much bearish talk right now btc,0.037225428968667984,0.7676374912261963,0.1951371133327484
2022-05-24,22:45,I think for #bitcoin there could take a sharp V-recovery place in the next weeks towards somewhere mid-range (40-45k). There is so much money on the sidelines of people thinking this is a long lasting bear market who will need to FOMO back in the market,i think for bitcoin there could take a sharp vrecovery place in the next weeks towards somewhere midrange 4045k there is so much money on the sidelines of people thinking this is a long lasting bear market who will need to fomo back in the market,0.04410317912697792,0.3259679079055786,0.6299290060997009
2022-05-24,22:45,@Gemini #LUFFYCREW #LUFFY $LUFFY #LUFFYV2 #LUFFYTOKEN #SHIB #DOGE #Binance #Coinbase #Metaverse #cryptocurrency #BTC #ETH #nft #NFTs @luffyinutoken @LuffyTurkey #LUFFYCREW #LUFFY $LUFFY #LUFFYV2 #LUFFYTOKEN #SHIB #DOGE #Binance #Coinbase #Metaverse @luffyinutoken @LuffyTurkey #gateio,gemini luffycrew luffy luffy luffyv2 luffytoken shib doge binance coinbase metaverse cryptocurrency btc eth nft nfts luffyinutoken luffyturkey luffycrew luffy luffy luffyv2 luffytoken shib doge binance coinbase metaverse luffyinutoken luffyturkey gateio,0.04564499482512474,0.93682461977005,0.01753033511340618
2022-05-24,22:45,"@adaswapapp Great opportunity Especially Thanks for sharing a great Giveaway Project 🤩 I think it is One of the best Giveaway Project in the world.

TEST NET

0x1a527037A779afC5847E0723f267a8FB0b7367cE

#blockchain #airdrop #crypto #Giveaways #Bitcoin",adaswapapp great opportunity especially thanks for sharing a great giveaway project i think it is one of the best giveaway project in the world test net 0x1a527037a779afc5847e0723f267a8fb0b7367ce blockchain airdrop crypto giveaways bitcoin,0.3700489103794098,0.6217178106307983,0.008233362808823586
2022-05-24,22:45,"Tesla’s shares dropped more than Bitcoin! Something must be going on 👀 #tesla #ElonMusk #bitcoin 

But whole tech is tho. 
How soon it will last? Any guess?!",teslas shares dropped more than bitcoin something must be going on tesla elonmusk bitcoin but whole tech is tho how soon it will last any guess,0.011158151552081108,0.05369912460446358,0.9351426959037781
2022-05-24,22:45,This is #Gold VS Bitcoin   #Bitcoin,this is gold vs bitcoin bitcoin,0.07219552248716354,0.9021143317222595,0.025690151378512383
2022-05-24,22:45,Hey #btc knock knock,hey btc knock knock,0.04825381562113762,0.8964272737503052,0.05531888082623482
2022-05-24,22:45,@LuganoPlanB @Tether_to #LUFFYCREW #LUFFY $LUFFY #LUFFYV2 #LUFFYTOKEN #SHIB #DOGE #Binance #Coinbase #Metaverse #cryptocurrency #BTC #ETH #nft #NFTs @luffyinutoken @LuffyTurkey #LUFFYCREW #LUFFY $LUFFY #LUFFYV2 #LUFFYTOKEN #SHIB #DOGE #Binance #Coinbase #Metaverse @luffyinutoken @LuffyTurkey #gateio,luganoplanb tetherto luffycrew luffy luffy luffyv2 luffytoken shib doge binance coinbase metaverse cryptocurrency btc eth nft nfts luffyinutoken luffyturkey luffycrew luffy luffy luffyv2 luffytoken shib doge binance coinbase metaverse luffyinutoken luffyturkey gateio,0.0424015112221241,0.937383234500885,0.020215274766087532
2022-05-24,22:45,I think we are arguing between 53 and 67 #Bitcoin,i think we are arguing between 53 and 67 bitcoin,0.05719839036464691,0.8997958898544312,0.04300572723150253
2022-05-24,22:45,@Tether_to #LUFFYCREW #LUFFY $LUFFY #LUFFYV2 #LUFFYTOKEN #SHIB #DOGE #Binance #Coinbase #Metaverse #cryptocurrency #BTC #ETH #nft #NFTs @luffyinutoken @LuffyTurkey #LUFFYCREW #LUFFY $LUFFY #LUFFYV2 #LUFFYTOKEN #SHIB #DOGE #Binance #Coinbase #Metaverse @luffyinutoken @LuffyTurkey #gateio,tetherto luffycrew luffy luffy luffyv2 luffytoken shib doge binance coinbase metaverse cryptocurrency btc eth nft nfts luffyinutoken luffyturkey luffycrew luffy luffy luffyv2 luffytoken shib doge binance coinbase metaverse luffyinutoken luffyturkey gateio,0.04668522998690605,0.9350082874298096,0.01830655336380005
2022-05-24,22:45,"@rovercrc We first have to recover from this dip. But more importantly the world has to recover from it deeds to get trust back to the market. After that the chances are high that we will blast right through the 50k mark.

#bitcoin #myopinion #crypto #nft #viral #hyped #cryptocurrency",rovercrc we first have to recover from this dip but more importantly the world has to recover from it deeds to get trust back to the market after that the chances are high that we will blast right through the 50k mark bitcoin myopinion crypto nft viral hyped cryptocurrency,0.7752115726470947,0.17600998282432556,0.048778411000967026
2022-05-24,22:45,"No one person in #bitcoin or #cryptocurrency should ever be THE reason WHY
If so, what’s the comparison with dollars in your mind 
Does that include just you or you and the people around you",no one person in bitcoin or cryptocurrency should ever be the reason why if so whats the comparison with dollars in your mind does that include just you or you and the people around you,0.025638537481427193,0.9131477475166321,0.06121373549103737
2022-05-24,22:45,"#MononokeInu will continue to break records and change many lives!

Mark my words -&gt; 

#TeamMononokeA5 #Mononoke #Mononoke_Inu #altcoin #memecoins #ATH #shiba #FLOKI #nextgem #nex100 #dogecoin #ETH #Ethereum #cryptocurrencies #cryptocurrency #BTC #dogecoin",mononokeinu will continue to break records and change many lives mark my words gt teammononokea5 mononoke mononokeinu altcoin memecoins ath shiba floki nextgem nex100 dogecoin eth ethereum cryptocurrencies cryptocurrency btc dogecoin,0.12351014465093613,0.8592333793640137,0.017256401479244232
2022-05-24,22:45,Current #Bitcoin Price is $29554 #BTC #Crypto,current bitcoin price is 29554 btc crypto,0.022963250055909157,0.9517617225646973,0.025274986401200294
2022-05-24,22:45,@ShapeShift #LUFFYCREW #LUFFY $LUFFY #LUFFYV2 #LUFFYTOKEN #SHIB #DOGE #Binance #Coinbase #Metaverse #cryptocurrency #BTC #ETH #nft #NFTs @luffyinutoken @LuffyTurkey #LUFFYCREW #LUFFY $LUFFY #LUFFYV2 #LUFFYTOKEN #SHIB #DOGE #Binance #Coinbase #Metaverse @luffyinutoken @LuffyTurkey #gateio,shapeshift luffycrew luffy luffy luffyv2 luffytoken shib doge binance coinbase metaverse cryptocurrency btc eth nft nfts luffyinutoken luffyturkey luffycrew luffy luffy luffyv2 luffytoken shib doge binance coinbase metaverse luffyinutoken luffyturkey gateio,0.04354463145136833,0.9375621676445007,0.018893182277679443
2022-05-24,22:45,"@news_of_bsc Just a personal analysis Market is still Bearish. #BTC   Might touch $24,500. It could be $19,000 👀",newsofbsc just a personal analysis market is still bearish btc might touch 24500 it could be 19000,0.03443440794944763,0.9155347347259521,0.05003084987401962
2022-05-24,22:45,"The amazing project that will lead the world in storage in the future will be Apple and Google in Web 3.0 and Blockchain. 
Who miss BTC in 2009 and ETH in 2015.DON’T Miss STRATOS in 2022. 
Non-financial advice DYOI will come back to this tweet in  2025.
#BTC  #ETH #STOS",the amazing project that will lead the world in storage in the future will be apple and google in web 30 and blockchain who miss btc in 2009 and eth in 2015don not miss stratos in 2022 nonfinancial advice dyoi will come back to this tweet in 2025 btc eth stos,0.0826847180724144,0.9050862193107605,0.012229073792696
2022-05-24,22:45,"As weak as #bitcoin seems after record running weeks of declines, it's still worth 3x than it was 2 years ago.

So yes it's bearish, it looks weak, it's come off a lot from highs, but it can be argued it's holding up pretty well and pretty damned resilient.",as weak as bitcoin seems after record running weeks of declines it is still worth 3x than it was 2 years ago so yes it is bearish it looks weak it is come off a lot from highs but it can be argued it is holding up pretty well and pretty damned resilient,0.8585238456726074,0.04870213568210602,0.09277404099702835
2022-05-24,22:45,@bitfinex #LUFFYCREW #LUFFY $LUFFY #LUFFYV2 #LUFFYTOKEN #SHIB #DOGE #Binance #Coinbase #Metaverse #cryptocurrency #BTC #ETH #nft #NFTs @luffyinutoken @LuffyTurkey #LUFFYCREW #LUFFY $LUFFY #LUFFYV2 #LUFFYTOKEN #SHIB #DOGE #Binance #Coinbase #Metaverse @luffyinutoken @LuffyTurkey #gateio,bitfinex luffycrew luffy luffy luffyv2 luffytoken shib doge binance coinbase metaverse cryptocurrency btc eth nft nfts luffyinutoken luffyturkey luffycrew luffy luffy luffyv2 luffytoken shib doge binance coinbase metaverse luffyinutoken luffyturkey gateio,0.04514868184924126,0.9367174506187439,0.01813388802111149
2022-05-24,22:45,batcoinofficia1 CoinMarketCap CMC PLEASE LİST US #BSCGems #BSC #bnb #Batcoin #Binance #Bitcoin #Ethereum #Coinmarketcap C…,batcoinofficia1 coinmarketcap cmc please list us bscgems bsc bnb batcoin binance bitcoin ethereum coinmarketcap c,0.02795747108757496,0.9471859335899353,0.024856584146618843
2022-05-24,22:45,@bitfinex @paoloardoino #LUFFYCREW #LUFFY $LUFFY #LUFFYV2 #LUFFYTOKEN #SHIB #DOGE #Binance #Coinbase #Metaverse #cryptocurrency #BTC #ETH #nft #NFTs @luffyinutoken @LuffyTurkey #LUFFYCREW #LUFFY $LUFFY #LUFFYV2 #LUFFYTOKEN #SHIB #DOGE #Binance #Coinbase #Metaverse @luffyinutoken @LuffyTurkey #gateio,bitfinex paoloardoino luffycrew luffy luffy luffyv2 luffytoken shib doge binance coinbase metaverse cryptocurrency btc eth nft nfts luffyinutoken luffyturkey luffycrew luffy luffy luffyv2 luffytoken shib doge binance coinbase metaverse luffyinutoken luffyturkey gateio,0.04139760136604309,0.938984751701355,0.019617639482021332
2022-05-24,22:45,"@davidgokhshtein Remember this next time when a dumb slave of fiat argues with you

#bitcoin    community is driven by a moral and humanitarian obligation to build a better world for all.Bitcoin makes it possible

Bravo @Georgeleonel363 Made us proud. his tweets and tips have been very helpful.",davidgokhshtein remember this next time when a dumb slave of fiat argues with you bitcoin community is driven by a moral and humanitarian obligation to build a better world for allbitcoin makes it possible bravo georgeleonel363 made us proud his tweets and tips have been very helpful,0.625012218952179,0.3620310127735138,0.01295673567801714
2022-05-24,22:45,"@AltcoinDailyio Remember this next time when a dumb slave of fiat argues with you

#bitcoin    community is driven by a moral and humanitarian obligation to build a better world for all.Bitcoin makes it possible

Bravo @Georgeleonel363 Made us proud. his tweets and tips have been very helpful.",altcoindailyio remember this next time when a dumb slave of fiat argues with you bitcoin community is driven by a moral and humanitarian obligation to build a better world for allbitcoin makes it possible bravo georgeleonel363 made us proud his tweets and tips have been very helpful,0.6556800603866577,0.33236122131347656,0.011958718299865723
2022-05-24,22:45,"@1goonrich #PlugPro is strong and bullish project

This is the only one that I feel safe to invest and sleep on it. I believe in the team and in community that supports this project 

Long term hold

#PlugPro #plugproarmy #BSC #BNBChain #Bitcoin  #DeFi #BSCGems #Utility

@plugprosocial",1goonrich plugpro is strong and bullish project this is the only one that i feel safe to invest and sleep on it i believe in the team and in community that supports this project long term hold plugpro plugproarmy bsc bnbchain bitcoin defi bscgems utility plugprosocial,0.24227923154830933,0.7493649125099182,0.008355863392353058
2022-05-24,22:45,"@JanWues Thank you Jan! It seems like investors were salivating at the opportunity for $DXY to fall, yet we haven't seen the follow-through in stocks or #Bitcoin that everyone was expecting.

Total risk-off environment?",janwues thank you jan it seems like investors were salivating at the opportunity for dxy to fall yet we have not seen the followthrough in stocks or bitcoin that everyone was expecting total riskoff environment,0.03939730301499367,0.10759743303060532,0.8530053496360779
2022-05-24,22:45,"@RSKsmart @CoinDesk @danielfogg as #bitcoin  was about to rally. We are now testing lower support levels and this area should be bought for a bullish resolution to the upside

@Sz_09y is a super underrated bitcoiner
I’ve been taking her tweets and tips seriously &amp; I’ve  been doing really great

Follow her",rsksmart coindesk danielfogg as bitcoin was about to rally we are now testing lower support levels and this area should be bought for a bullish resolution to the upside sz09y is a super underrated bitcoiner ive been taking her tweets and tips seriously ive been doing really great follow her,0.8066858053207397,0.14524810016155243,0.048066042363643646
2022-05-24,22:45,@LTLovesdigi @DigiByteCoin @deegebi @RenzoDGB @JohnnyLaw2021 #LUFFYCREW #LUFFY $LUFFY #LUFFYV2 #LUFFYTOKEN #SHIB #DOGE #Binance #Coinbase #Metaverse #cryptocurrency #BTC #ETH #nft #NFTs @luffyinutoken @LuffyTurkey #LUFFYCREW #LUFFY $LUFFY #LUFFYV2 #LUFFYTOKEN #SHIB #DOGE #Binance #Coinbase #Metaverse @luffyinutoken @LuffyTurkey #gateio,ltlovesdigi digibytecoin deegebi renzodgb johnnylaw2021 luffycrew luffy luffy luffyv2 luffytoken shib doge binance coinbase metaverse cryptocurrency btc eth nft nfts luffyinutoken luffyturkey luffycrew luffy luffy luffyv2 luffytoken shib doge binance coinbase metaverse luffyinutoken luffyturkey gateio,0.04782821610569954,0.9294939637184143,0.022677838802337646
2022-05-24,22:45,"@news_of_bsc Market is still Bearish. #BTC   Might touch $24,500. It could be $19,000 👀",newsofbsc market is still bearish btc might touch 24500 it could be 19000,0.03961922973394394,0.8845957517623901,0.07578500360250473
2022-05-24,22:45,@RenzoDGB @DigiByteCoin @DGBAT_Official #LUFFYCREW #LUFFY $LUFFY #LUFFYV2 #LUFFYTOKEN #SHIB #DOGE #Binance #Coinbase #Metaverse #cryptocurrency #BTC #ETH #nft #NFTs @luffyinutoken @LuffyTurkey #LUFFYCREW #LUFFY $LUFFY #LUFFYV2 #LUFFYTOKEN #SHIB #DOGE #Binance #Coinbase #Metaverse @luffyinutoken @LuffyTurkey #gateio,renzodgb digibytecoin dgbatofficial luffycrew luffy luffy luffyv2 luffytoken shib doge binance coinbase metaverse cryptocurrency btc eth nft nfts luffyinutoken luffyturkey luffycrew luffy luffy luffyv2 luffytoken shib doge binance coinbase metaverse luffyinutoken luffyturkey gateio,0.04465610161423683,0.9351679682731628,0.02017594687640667
2022-05-24,22:45,"You feel bad for your loss? 
I feel bad for people with no saving.
#Bitcoin",you feel bad for your loss i feel bad for people with no saving bitcoin,0.03712349012494087,0.3929923474788666,0.5698842406272888
2022-05-24,22:45,"👀

I am pedaling on my bicycle to hedge against the FED backpedaling the super cycle.

#Bitcoin",i am pedaling on my bicycle to hedge against the fed backpedaling the super cycle bitcoin,0.09859540313482285,0.8270348906517029,0.07436969131231308
2022-05-24,22:45,@LTLovesdigi @DigiByteCoin @exodus_io #LUFFYCREW #LUFFY $LUFFY #LUFFYV2 #LUFFYTOKEN #SHIB #DOGE #Binance #Coinbase #Metaverse #cryptocurrency #BTC #ETH #nft #NFTs @luffyinutoken @LuffyTurkey #LUFFYCREW #LUFFY $LUFFY #LUFFYV2 #LUFFYTOKEN #SHIB #DOGE #Binance #Coinbase #Metaverse @luffyinutoken @LuffyTurkey #gateio,ltlovesdigi digibytecoin exodusio luffycrew luffy luffy luffyv2 luffytoken shib doge binance coinbase metaverse cryptocurrency btc eth nft nfts luffyinutoken luffyturkey luffycrew luffy luffy luffyv2 luffytoken shib doge binance coinbase metaverse luffyinutoken luffyturkey gateio,0.03661777079105377,0.9409124255180359,0.02246982418000698
2022-05-24,22:45,"#Crypto will rise again ✅

#cryptocurrency #bitcoin",crypto will rise again cryptocurrency bitcoin,0.3034416437149048,0.673719584941864,0.022838767617940903
2022-05-24,22:45,@DigiByteCoin #LUFFYCREW #LUFFY $LUFFY #LUFFYV2 #LUFFYTOKEN #SHIB #DOGE #Binance #Coinbase #Metaverse #cryptocurrency #BTC #ETH #nft #NFTs @luffyinutoken @LuffyTurkey #LUFFYCREW #LUFFY $LUFFY #LUFFYV2 #LUFFYTOKEN #SHIB #DOGE #Binance #Coinbase #Metaverse @luffyinutoken @LuffyTurkey #gateio,digibytecoin luffycrew luffy luffy luffyv2 luffytoken shib doge binance coinbase metaverse cryptocurrency btc eth nft nfts luffyinutoken luffyturkey luffycrew luffy luffy luffyv2 luffytoken shib doge binance coinbase metaverse luffyinutoken luffyturkey gateio,0.043228793889284134,0.9371433258056641,0.019627921283245087
2022-05-24,22:45,"No more posting about $wluna for the next  10-15 hours . I know you guys are sick of $wluna tweets .
I’ll continue to update you on #btc .",no more posting about wluna for the next 1015 hours i know you guys are sick of wluna tweets ill continue to update you on btc,0.022690298035740852,0.882612407207489,0.09469721466302872
2022-05-24,22:45,@snapsssss @tradingview #LUFFYCREW #LUFFY $LUFFY #LUFFYV2 #LUFFYTOKEN #SHIB #DOGE #Binance #Coinbase #Metaverse #cryptocurrency #BTC #ETH #nft #NFTs @luffyinutoken @LuffyTurkey #LUFFYCREW #LUFFY $LUFFY #LUFFYV2 #LUFFYTOKEN #SHIB #DOGE #Binance #Coinbase #Metaverse @luffyinutoken @LuffyTurkey #gateio,snapsssss tradingview luffycrew luffy luffy luffyv2 luffytoken shib doge binance coinbase metaverse cryptocurrency btc eth nft nfts luffyinutoken luffyturkey luffycrew luffy luffy luffyv2 luffytoken shib doge binance coinbase metaverse luffyinutoken luffyturkey gateio,0.04579067975282669,0.9339638948440552,0.020245352759957314
2022-05-24,22:45,"BITCOIN WENT UP!

USD $29,521.50 (+0,06%)
Yesterday: -2,43%
Last 30 days: -25,19%

#bitcoin",bitcoin went up usd 2952150 006 243 last 30 2519 bitcoin,0.9172394871711731,0.06548332422971725,0.017277205362915993
2022-05-24,22:45,@tradingview #LUFFYCREW #LUFFY $LUFFY #LUFFYV2 #LUFFYTOKEN #SHIB #DOGE #Binance #Coinbase #Metaverse #cryptocurrency #BTC #ETH #nft #NFTs @luffyinutoken @LuffyTurkey #LUFFYCREW #LUFFY $LUFFY #LUFFYV2 #LUFFYTOKEN #SHIB #DOGE #Binance #Coinbase #Metaverse @luffyinutoken @LuffyTurkey #gateio,tradingview luffycrew luffy luffy luffyv2 luffytoken shib doge binance coinbase metaverse cryptocurrency btc eth nft nfts luffyinutoken luffyturkey luffycrew luffy luffy luffyv2 luffytoken shib doge binance coinbase metaverse luffyinutoken luffyturkey gateio,0.04700890928506851,0.9358882904052734,0.017102815210819244
