Date,Time,Original tweet,Clean tweet,Positive,Neutral,Negative
2022-05-12,2:15,"#BTC  Interesting, it has done it before. Fractal matches levels and swing ups and downs. It's not perfect, but it shows this has happened before, exactly at the same fib levels, with an expanded flat that puts in a higher high and then  a lower low... what are the odds? https://t.co/w7pVj8S37V",btc interesting it has done it before fractal matches levels and swing ups and downs it is not perfect but it shows this has happened before exactly at the same fib levels with an expanded flat that puts in a higher high and then a lower low what are the odds,0.08995215594768524,0.8750409483909607,0.03500693291425705
2022-05-12,2:15,#BTC Holding,btc holding,0.03541206195950508,0.9386109113693237,0.02597704529762268
2022-05-12,2:15,Reminder: Withdraw Your #Bitcoin Off Exchanges https://t.co/gUFtdMCBwl via @coinjupiter,withdraw your bitcoin off exchanges via coinjupiter,0.01932014711201191,0.9098031520843506,0.07087672501802444
2022-05-12,2:15,#Bitcoin already broke 2021 low 😜,bitcoin already broke 2021 low,0.15038801729679108,0.2026679515838623,0.6469440460205078
2022-05-12,2:15,#btc broke last years low😨,btc broke last years low,0.5198599696159363,0.4288678467273712,0.05127213895320892
2022-05-12,2:15,Fetch (FET) went down 16.2 percent in the last 30 minutes on Binance. #FET  #crypto #bitcoin #cryptocurrency #btc #ethereum #blockchain #eth #trading #altcoin #binance #cryptonews,fetch fet went down 162 percent in the last 30 minutes on binance fet crypto bitcoin cryptocurrency btc ethereum blockchain eth trading altcoin binance cryptonews,0.007977516390383244,0.030085140839219093,0.9619373083114624
2022-05-12,2:15,@drewhil82 @scottmelker @MrBerthazz Why the fuck would you buy stuff (and incur capital gains) with pristine #Bitcoin? That’s what garbage fiat is for.,drewhil82 scottmelker mrberthazz why the fuck would you buy stuff and incur capital gains with pristine bitcoin thats what garbage fiat is for,0.02408546954393387,0.8372806906700134,0.1386338323354721
2022-05-12,2:15,Distribution will be done by project team. We aren't in charge of distribution. #SeasonalTokens #CryptoMining #CyclicalInvesting #BTC,distribution will be done by project team we are not in charge of distribution seasonaltokens cryptomining cyclicalinvesting btc,0.033729564398527145,0.9515344500541687,0.014735924080014229
2022-05-12,2:15,Yesterday 4 digit ens day top - around 3 ETH Today some mfers selling for 1.8 ETH I think in one day it will be above 3 ETH again. I guess you don't need 2x in 24 hours? #9999club #nft #opensea #BAYC #eth #Ethereum #crypto #hodl #btc #bitcoin #ens #10kClub #ens #ensdomains,yesterday 4 digit ens day top around 3 eth today some mfers selling for 18 eth i think in one day it will be above 3 eth again i guess you do not need 2x in 24 hours 9999club nft opensea bayc eth ethereum crypto hodl btc bitcoin ens 10kclub ens ensdomains,0.10717407613992691,0.8750154972076416,0.017810413613915443
2022-05-12,2:15,"@IncomeSharks #bitcoin now back down to 29k. I have added to my #btc position. Given the current instability, DCA is the way to go.",incomesharks bitcoin now back down to 29k i have added to my btc position given the current instability dca is the way to go,0.8539808988571167,0.08995559066534042,0.05606351047754288
2022-05-12,2:15,"What would be a good ‘realistic’ incentive for you to buy in an NFT collection? 🤔

(regardless of how the market is rn)

#NFTCommunity #NFTGiveaways #nfts #bitcoin #stockmarket #cryptocurrency #COIN #Cryptocrash #bayc #nftart #art #digitalartist",what would be a good realistic incentive for you to buy in an nft collection regardless of how the market is rn nftcommunity nftgiveaways nfts bitcoin stockmarket cryptocurrency coin cryptocrash bayc nftart art digitalartist,0.08583943545818329,0.9027016758918762,0.011458950117230415
2022-05-12,2:15,The rich and elite are not selling their #Bitcoin . THEY ARE NOT SELLING THEIR BITCOIN.,the rich and elite are not selling their bitcoin they are not selling their bitcoin,0.027073977515101433,0.9030354619026184,0.069890595972538
2022-05-12,2:15,@Dennis_Porter_ Didn’t China Ban #bitcoin like 100 times? Talk about Capricious!,dennisporter didn not china ban bitcoin like 100 times talk about capricious,0.0594753660261631,0.8834952712059021,0.057029373943805695
2022-05-12,2:15,QUICK TIP:  BUY and HODL👇🏼 #BITCOIN #Ethereum #BNB #SHIB #BONE #LEASH #FEG #Babydoge #FLOKI #RichQUACK #MarvinInu #Elemongame #BlueSparrow #WalterInu #GrimaceCoin #SHINJA #Pitbull *dyor,quick buy and hodl bitcoin ethereum bnb shib bone leash feg babydoge floki richquack marvininu elemongame bluesparrow walterinu grimacecoin shinja pitbull dyor,0.0721258819103241,0.8960097432136536,0.03186442703008652
2022-05-12,2:15,@EarnBitcoinTips @coinkit_ #BTC what are you doing bro.. 🤦‍♂️ 💔,earnbitcointips coinkit btc what are you doing bro,0.027044761925935745,0.9352264404296875,0.03772884979844093
2022-05-12,2:15,@WatcherGuru Chinese play #bitcoin like they play ping pong.,watcherguru chinese play bitcoin like they play ping pong,0.028295600786805153,0.9386606216430664,0.0330437533557415
2022-05-12,2:15,"A good project with a great future and experienced team. I see a lot of potential in this project, I think that the team is able to accomplish what is indicated in its roadmap.  #IKONIC #CRYPTO #BSC #BINANCE #BITCOIN",a good project with a great future and experienced team i see a lot of potential in this project i think that the team is able to accomplish what is indicated in its roadmap ikonic crypto bsc binance bitcoin,0.8722454905509949,0.12033297121524811,0.007421538699418306
2022-05-12,2:15,"296 #BTC (8,810,285 USD) just transferred

From:
3BHuH7f9WruM9tEQjfbdaEmR2CDtvdXqwr

To:
bc1qkv874h6snews832m02jgver2457ndeuqn3ug9d

Tx hash:
8d8fdf88779ef06672ad06289bacee2bd11df542fde655f839dc95027e7f1b7e

#Bitcoin $BTC #crypto",296 btc 8810285 usd just transferred 3bhuh7f9wrum9teqjfbdaemr2cdtvdxqwr bc1qkv874h6snews832m02jgver2457ndeuqn3ug9d tx 8d8fdf88779ef06672ad06289bacee2bd11df542fde655f839dc95027e7f1b7e bitcoin btc crypto,0.07814709097146988,0.8928724527359009,0.028980495408177376
2022-05-12,2:15,"$BTC A big chance in a billion!
Price: \3865259.0 (2022/05/12 11:09)
#Bitcoin #FX #BTC #crypto",btc a big chance in a billion 38652590 20220512 bitcoin fx btc crypto,0.1784571260213852,0.8099942803382874,0.011548521928489208
2022-05-12,2:15,Who will rug pull next 🤔👀 #BTC #bitcoin #ETH #ethereum #CRYPTO #cryptocurrencies #cryptocurrency #altcoins #blockchain #Cardano #ADA #APECOIN,who will rug pull next btc bitcoin eth ethereum crypto cryptocurrencies cryptocurrency altcoins blockchain cardano ada apecoin,0.03456951305270195,0.9220690727233887,0.04336138814687729
2022-05-12,2:15,I trust in this project and is sure that it will prove to be very powerfully in the nearest future. I see that project has a good team and they have a well-planned future. #SeasonalTokens #CryptoMining #CyclicalInvesting #BTC,i trust in this project and is sure that it will prove to be very powerfully in the nearest future i see that project has a good team and they have a wellplanned future seasonaltokens cryptomining cyclicalinvesting btc,0.9059649705886841,0.08313106745481491,0.010903928428888321
2022-05-12,2:15,@Remi_Tetot @gladstein #Bitcoin welcomes you home Remi.,remitetot gladstein bitcoin welcomes you home remi,0.1506298929452896,0.8317442536354065,0.017625892534852028
2022-05-12,2:15,"Should have paid more attention to that weekly blood diamond on  
#MARKETCIPHER

#Bitcoin",should have paid more attention to that weekly blood diamond on marketcipher bitcoin,0.06091752275824547,0.9095935225486755,0.02948899008333683
2022-05-12,2:15,"Who will survive, who won’t… All I know is im holding my #ETH 🤭🤭

#BTC #ETH #SOL #MATIC",who will survive who won not all i know is im holding my eth btc eth sol matic,0.045711953192949295,0.9324110746383667,0.021876994520425797
2022-05-12,2:15,Terra (LUNA) went down 27.3 percent in the last 30 minutes on Binance. #LUNA  #crypto #bitcoin #cryptocurrency #btc #ethereum #blockchain #eth #trading #altcoin #binance #cryptonews,terra luna went down 273 percent in the last 30 minutes on binance luna crypto bitcoin cryptocurrency btc ethereum blockchain eth trading altcoin binance cryptonews,0.008199980482459068,0.032359104603528976,0.9594409465789795
2022-05-12,2:15,"the market will always be volatile that's why it is called ""the market"", if you are a trader or real investors you will get used to and be reasonable about this situation,but if you are a newbie here i just wanna to say ""welcome to jungle buddy"".
#Bitcoin #Cryptocrash",the market will always be volatile that is why it is called the market if you are a trader or real investors you will get used to and be reasonable about this situationbut if you are a newbie here i just wanna to say welcome to jungle buddy bitcoin cryptocrash,0.06299854815006256,0.9164211750030518,0.020580312237143517
2022-05-12,2:15,Why we sold our 300k house and went all in on #bitcoin ?Our house on 1-1-16 was 681 BTCOur house on 1-1-17 was 300 BTC…,why we sold our 300k house and went all in on bitcoin our house on 1116 was 681 btcour house on 1117 was 300 btc,0.034728582948446274,0.946828305721283,0.01844308339059353
2022-05-12,2:15,"Q. What's that beep beep beep noise?

A. #Bitcoin maxis everywhere backing up the truck.",q what is that beep beep beep noise a bitcoin maxis everywhere backing up the truck,0.04232205078005791,0.7429522275924683,0.21472574770450592
2022-05-12,2:15,"With the 💩🪙meltdown this week a lot of hard lessons have been learned. The most important lessons often hurt the most. If you understand Luke 23:34 you'll understand the ""toxic"" #Bitcoin community reaction to reformed 💩🪙 who learned why #btc only",with the meltdown this week a lot of hard lessons have been learned the most important lessons often hurt the most if you understand luke you will understand the toxic bitcoin community reaction to reformed who learned why btc only,0.04033993184566498,0.5120866298675537,0.4475734233856201
2022-05-12,2:15,@CryptoCloaks ill be taking this to every #Bitcoin  meetup i go to,cryptocloaks ill be taking this to every bitcoin meetup i go to,0.029234616085886955,0.9258347153663635,0.04493066668510437
2022-05-12,2:15,"$UST is a shitcoin. If you got rekt, you deserve it. 

#Bitcoin only. Learn your lessons clowns.",ust is a shitcoin if you got rekt you deserve it bitcoin only learn your lessons clowns,0.034008804708719254,0.8352704048156738,0.13072079420089722
2022-05-12,2:15,"Rate your cryptos feeling tonight??

 0   1    2   3   4   5  6   7   8   9  10   
😵😵‍💫🥴🫠😪🫣😐🫢🤗🤩🥳

#NFT #Crypto #Cryptocrash #Bitcoin #USDT #nftart",rate your cryptos feeling tonight 0 1 2 3 4 5 6 7 8 9 10 nft crypto cryptocrash bitcoin usdt nftart,0.08672031760215759,0.8937278389930725,0.0195518396794796
2022-05-12,2:15,$28k has FINALLY been breached on #Bitcoin #BTC #BitcoinCrash,28k has finally been breached on bitcoin btc bitcoincrash,0.1885799765586853,0.30166736245155334,0.509752631187439
2022-05-12,2:15,"In my crypto portfolio I only own #BTC and $ALGO now.
Quite honestly, with this reset of the entire crypto market that's happening I'm starting to think $ALGO might be one of the best plays out there. I will add to $ALGO if it drops more - low risk high reward imo.",in my crypto portfolio i only own btc and algo now quite honestly with this reset of the entire crypto market that is happening i am starting to think algo might be one of the best plays out there i will add to algo if it drops more low risk high reward imo,0.13556963205337524,0.8544110059738159,0.010019353590905666
2022-05-12,2:15,I got 99 problems but my community ain’t one @LPBCNFT  #Nfts #Solana #LUNAUSDT #Bitcoin #build,i got 99 problems but my community ain not one lpbcnft nfts solana lunausdt bitcoin build,0.038376957178115845,0.9276102781295776,0.0340128056704998
2022-05-12,2:15,"@PrestonPysh What other choices do huge HUGE capital pools have? (While I might wish #BTC , there’s not nearly enough depth there.  No other, risk on asset is even remotely appealing in this environment.

So there is nothing to choose for collateral other than short term, on the run Treasuri.",prestonpysh what other choices do huge huge capital pools have while i might wish btc theres not nearly enough depth there no other risk on asset is even remotely appealing in this environment so there is nothing to choose for collateral other than short term on the run treasuri,0.04171159863471985,0.9301257729530334,0.02816266007721424
2022-05-12,2:15,@jack @elonmusk Jack did see any post on how man #BTC you added today?,jack elonmusk jack did see any post on how man btc you added today,0.043281424790620804,0.9348282217979431,0.021890372037887573
2022-05-12,2:15,"@theRealKiyosaki #BTC s a scam just like the rest of the nonsense coins. It was stolen from Craig Wright, he owns the patents, the database and the protocol. The whole thing is coming to an end. Can’t believe you fell for this bs to be honest,",therealkiyosaki btc a scam just like the rest of the nonsense coins it was stolen from craig wright he owns the patents the database and the protocol the whole thing is coming to an end can not believe you fell for this bs to be honest,0.03668246418237686,0.8345593214035034,0.12875819206237793
2022-05-12,2:15,"Just bought more #ADA, #DOT, #ETH, #BTC &amp; #GLMR... this was the bottom, right? RIGHT?",just bought more ada dot eth btc glmr this was the bottom right right,0.12299410253763199,0.8407080769538879,0.03629779443144798
2022-05-12,2:15,Are you Still Virgin? $LUNA $TERRA #UST #Bitcoin,are you still virgin luna terra ust bitcoin,0.034248750656843185,0.9420992136001587,0.02365196868777275
2022-05-12,2:15,@davidgokhshtein Sounds like crisis PR. Stay quiet and deny everything. #Bitcoin #ETH $cwi,davidgokhshtein sounds like crisis pr stay quiet and deny everything bitcoin eth cwi,0.024230092763900757,0.723905622959137,0.2518642842769623
2022-05-12,2:15,"The #crash of #crypto proved that
#cryptocurrecy is bubble.

#btc
#LUNA
#bitcoin #germany #italy",the crash of crypto proved that cryptocurrecy is bubble btc luna bitcoin germany italy,0.06224433705210686,0.9047996997833252,0.032955899834632874
2022-05-12,2:15,"🇨🇳 Shanghai High People’s Court has declared #Bitcoin is a legal virtual property protected under Chinese law.

""#IBuySDtokensONLY""
#IUseFEGex",shanghai high peoples court has declared bitcoin is a legal virtual property protected under chinese law ibuysdtokensonly iusefegex,0.05269171670079231,0.8612741827964783,0.08603409677743912
2022-05-12,2:15,"@GusGusCryptoBus #BitcoinCustomerService cares about everyone! #Bitcoin is an independent, deflationary, peer-to-peer monetary system...everything gets less expensive as Bitcoin adoption grows. 

We care about the people being able to own their money and keep the benefits of their labour.",gusguscryptobus bitcoincustomerservice cares about everyone bitcoin is an independent deflationary peertopeer monetary systemeverything gets less expensive as bitcoin adoption grows we care about the people being able to own their money and keep the benefits of their labour,0.12759439647197723,0.8590234518051147,0.013382094912230968
2022-05-12,2:15,What I learned from this #bearmarket people don’t know shit! Bankers are in control. #Bitcoin,what i learned from this bearmarket people don not know shit bankers are in control bitcoin,0.03937770426273346,0.9242154955863953,0.03640677034854889
2022-05-12,2:15,"Bow very good morning

 The Shanghai High People's Court
 has declared #bitcoin to be a virtual asset protected by
 Chinese law. $BTC
 #cryptocurrency #crypto",bow very good morning the shanghai high people court has declared bitcoin to be a virtual asset protected by chinese law btc cryptocurrency crypto,0.07709342986345291,0.8217965960502625,0.10110993683338165
2022-05-12,2:15,"When #BTC  comes down to $500, we can then join and invest.  It's the wish. 

🙄🙄🤔🤔 #Bitcoin",when btc comes down to 500 we can then join and invest it is the wish bitcoin,0.03310579061508179,0.9446293711662292,0.022264908999204636
2022-05-12,2:15,My #EW waves labaling has improved exponentially from few months ago. Work in progress. 😆 $btc #bitcoin #crypto,my ew waves labaling has improved exponentially from few months ago work in progress btc bitcoin crypto,0.9449062943458557,0.043808870017528534,0.011284731328487396
2022-05-12,2:15,"[⭐️🟢 NEW LISTING⭐️]
[MARK] BEING LISTED IN HOTBIT [TWITTER]

More Info in bio

$AU #Bitcoin #AutoCrypto #crypto #cryptocurrecy #BNB #ToTheMoon #BSC #BSCGem #GEM #altcoin #token",new listing mark being listed in hotbit twitter more info in bio au bitcoin autocrypto crypto cryptocurrecy bnb tothemoon bsc bscgem gem altcoin token,0.03200768306851387,0.9490045309066772,0.01898779720067978
2022-05-12,2:15,"@unusual_whales does anyone dare with a date for the end of #Bitcoin ?  It would be very useful, since the tombstone factory will be in high demand that day.  for a presale",unusualwhales does anyone dare with a date for the end of bitcoin it would be very useful since the tombstone factory will be in high demand that day for a presale,0.06687398254871368,0.9139329791069031,0.019192982465028763
2022-05-12,2:15,#bitcoin bros—y’all okay? #BitcoinCrash is a new 1929 situation IMHO 👀,bitcoin brosyall okay bitcoincrash is a new 1929 situation imho,0.07203805446624756,0.908399224281311,0.01956276223063469
2022-05-12,2:15,"I keep sending my fiat to #Coinbase to convert into crypto. 

There's no safe haven right now and I know where my best bet is long term.

#BTC
#ETH",i keep sending my fiat to coinbase to convert into crypto there is no safe haven right now and i know where my best bet is long term btc eth,0.04643411561846733,0.9272186160087585,0.026347290724515915
2022-05-12,2:15,"I may be a #Bitcoin maxi before this shit is all over….
Nah.. I am #LitecoinFam and #Amplified along with big daddy #Bitcoin for now. I’m ok with this plan. Be ok with your plan too. You are on charge of your destiny🙌🏼🍾🥂",i may be a bitcoin maxi before this shit is all over nah i am litecoinfam and amplified along with big daddy bitcoin for now im ok with this plan be ok with your plan too you are on charge of your destiny,0.07228097319602966,0.9085726737976074,0.019146360456943512
2022-05-12,2:15,"#Holding is not easy 
#crypto #btc",holding is not easy crypto btc,0.0338764414191246,0.941175639629364,0.02494797110557556
2022-05-12,2:15,"233 #BTC (6,950,875 USD) just transferred

From:
3EzU8Mwsj63rcuvxrrPe1rQm1meo1PPzUL

To:
bc1qudyca0eu60358gt2rl93rec06pydlkayygc58l

Tx hash:
a4d2cb2952cefa687d21f8ef1905fd8cddb89a823698735c6bd77f4064d3dc66

#Bitcoin $BTC #crypto",233 btc 6950875 usd just transferred 3ezu8mwsj63rcuvxrrpe1rqm1meo1ppzul bc1qudyca0eu60358gt2rl93rec06pydlkayygc58l tx a4d2cb2952cefa687d21f8ef1905fd8cddb89a823698735c6bd77f4064d3dc66 bitcoin btc crypto,0.08877988159656525,0.880214512348175,0.031005628407001495
2022-05-12,2:15,"@WatcherGuru This is it.. This is the hidden reason why #Bitcoin is down, so that smart money can buy",watcherguru this is it this is the hidden reason why bitcoin is down so that smart money can buy,0.030024439096450806,0.8685952425003052,0.10138028860092163
2022-05-12,2:15,Elon! Drop the Twitter deal and buy #bitcoin instead. You shall be called ELONSHI DOGEMOTO 👑 @elonmusk @Bitcoin,elon drop the twitter deal and buy bitcoin instead you shall be called elonshi dogemoto elonmusk bitcoin,0.021122537553310394,0.9395129680633545,0.039364442229270935
2022-05-12,2:15,Current #Bitcoin Price is $29184 #BTC #Crypto,current bitcoin price is 29184 btc crypto,0.019677896052598953,0.9480907917022705,0.03223131597042084
2022-05-12,2:15,"To our clients, #FYI we will be accepting payments in #Bitcoin only for the time being. Thank you for your understanding. :)",to our clients fyi we will be accepting payments in bitcoin only for the time being thank you for your understanding,0.49012812972068787,0.4945327639579773,0.015339083038270473
2022-05-12,2:15,Anchor Protocol (ANC) went down 19.6 percent in the last 30 minutes on Binance. #ANC  #crypto #bitcoin #cryptocurrency #btc #ethereum #blockchain #eth #trading #altcoin #binance #cryptonews,anchor protocol anc went down 196 percent in the last 30 minutes on binance anc crypto bitcoin cryptocurrency btc ethereum blockchain eth trading altcoin binance cryptonews,0.008116434328258038,0.02563331462442875,0.9662502408027649
2022-05-12,2:15,"2/ #Tether (#USDT) is the world's first #stablecoin &amp; is the most transacted/liquid. It is the largest stablecoin by market cap ($83B), ranked #3 behind #Bitcoin &amp; #Ether

USD Coin (#USDC) is the 4th largest crypto by market cap ($49B), and next in line (liquidity) behind #Tether",2 tether usdt is the world first stablecoin is the most transactedliquid it is the largest stablecoin by market cap 83b ranked 3 behind bitcoin ether usd coin usdc is the 4th largest crypto by market cap 49b and next in line liquidity behind tether,0.19135427474975586,0.7940052151679993,0.014640447683632374
2022-05-12,2:15,We’re making good progress with the #ICP &amp;lt;&amp;gt; #BTC integration! We just had a test subnet ingest the entire bitcoin testnet…,were making good progress with the icp ltgt btc integration we just had a test subnet ingest the entire bitcoin testnet,0.41426461935043335,0.5670168995857239,0.018718501552939415
2022-05-12,2:15,"@okx FLOW
#Bitcoin #OKX #flow",okx flow bitcoin okx flow,0.02802317589521408,0.9398542642593384,0.03212258592247963
2022-05-12,2:15,@AltcoinSherpa Buy #Bitcoin and move it off exchange.,altcoinsherpa buy bitcoin and move it off exchange,0.03368215635418892,0.9400591850280762,0.026258643716573715
2022-05-12,2:15,"#Ilovebitcoin because you don't ""own"" the coins, you own ""access"" to the coins #bitcoin",ilovebitcoin because you do not own the coins you own access to the coins bitcoin,0.021706758067011833,0.9486218690872192,0.02967134490609169
2022-05-12,2:15,"@elonmusk @jack And twitter begins implementing important change we all appreciate 🤝

When #BTC guys?",elonmusk jack and twitter begins implementing important change we all appreciate when btc guys,0.3294273614883423,0.6616360545158386,0.008936619386076927
2022-05-12,2:15,Today I helped someone get out of crypto and become Bitcoin only and I'm personally ending the day with more #Bitcoin than I had yesterday. Today was a good day even though I spent 6 hours in a car and 3 hours in a hospital. 🤝,today i helped someone get out of crypto and become bitcoin only and i am personally ending the day with more bitcoin than i had yesterday today was a good day even though i spent 6 hours in a car and 3 hours in a hospital,0.676578938961029,0.2958032488822937,0.027617761865258217
2022-05-12,2:15,If I could go back to 2011 I would buy #BTC  If I could go back to 2015 I would buy #ETH If I could go back to 2017 I would buy #MATIC  If I could go back to 2018 I would buy #DOGE If I could go back to 2019 I would buy #SHIB What #Crypto would you buy today? 🤷‍♀️😊👇🏻👇🏻,if i could go back to 2011 i would buy btc if i could go back to 2015 i would buy eth if i could go back to 2017 i would buy matic if i could go back to 2018 i would buy doge if i could go back to 2019 i would buy shib what crypto would you buy today,0.05049874261021614,0.9327904582023621,0.016710834577679634
2022-05-12,2:15,#LUNA #Bitcoin #BTC everyone into #LUNA !!!,luna bitcoin btc everyone into luna,0.04371149092912674,0.9220340847969055,0.03425438702106476
2022-05-12,2:15,"#Bitcoin is a decentralized, peer-to-peer payment protocol built on a simple #cryptographic approach whereby all transactions have certain fees.",bitcoin is a decentralized peertopeer payment protocol built on a simple cryptographic approach whereby all transactions have certain fees,0.04326372221112251,0.9424273371696472,0.014308911748230457
2022-05-12,2:15,"If they swing market prices in a way that they can buy your #Bitcoin for cheaper, did you even deserve #BTC?",if they swing market prices in a way that they can buy your bitcoin for cheaper did you even deserve btc,0.12428463995456696,0.8622869849205017,0.01342838816344738
2022-05-12,2:15,@TheMoonCarl Congratulations to the #Bitcoin,themooncarl congratulations to the bitcoin,0.2912203371524811,0.6881921887397766,0.020587438717484474
2022-05-12,2:15,BREAKING NEWS: The Shanghai High People's Court has declared #bitcoin  to be a virtual asset protected by Chinese law. $BTC #cryptocurrency #crypto,breaking the shanghai high people court has declared bitcoin to be a virtual asset protected by chinese law btc cryptocurrency crypto,0.045274507254362106,0.752472460269928,0.2022530436515808
2022-05-12,2:15,"No worries! If #BTC goes to $10K, we all are going to start again. It’s sad but we should have plan B.",no worries if btc goes to 10k we all are going to start again its sad but we should have plan b,0.2466588169336319,0.7395447492599487,0.013796402141451836
2022-05-12,2:15,"BITCOIN FELL!

USD $29,045.34 (-2,23%)
Yesterday: -6,31%
Last 30 days: -26,53%

#bitcoin",bitcoin fell usd 2904534 223 631 last 30 2653 bitcoin,0.013476395979523659,0.03915820270776749,0.947365403175354
2022-05-12,2:15,"@jacquieleemusic @CashApp $cashzone11 🙏🏻
#WYCMF #Bitcoin",jacquieleemusic cashapp cashzone11 wycmf bitcoin,0.04767780750989914,0.9263312220573425,0.02599102444946766
