Date,Time,Original tweet,Clean tweet,Positive,Neutral,Negative
2022-05-07,16:15,@BTC_Archive #DeutscheBank holds derivatives worth 9 times #Germany #GNP the equivalent of 32 thousand BILLION euro and so does more or less every major bank in the EU including #Spain #Santander. So what is the problem with #Binance #BTC derivatives? Shame on govts and shame on ECB!!,btcarchive deutschebank holds derivatives worth 9 times germany gnp the equivalent of 32 thousand billion euro and so does more or less every major bank in the eu including spain santander so what is the problem with binance btc derivatives shame on govts and shame on ecb,0.029693949967622757,0.6645981073379517,0.3057078719139099
2022-05-07,16:15,It’s hard to predict #Bitcoin profits because it’s hard to visualize 4-Dimensional equations.,its hard to predict bitcoin profits because its hard to visualize 4dimensional equations,0.02611902728676796,0.705960750579834,0.26792019605636597
2022-05-07,16:15,"#SeasonalTokens #CryptoMining #Cyclicallnvesting #BTC
 
The most gifted  made this platform team and who can run this task he was additionally the most astounding and capable individual so uniqueness in this platform",seasonaltokens cryptomining cyclicallnvesting btc the most gifted made this platform team and who can run this task he was additionally the most astounding and capable individual so uniqueness in this platform,0.5061061382293701,0.4826049208641052,0.011288877576589584
2022-05-07,16:15,"@wilkinsoncape No, we need only #Bitcoin.
Like ElSalvador, and Central African Republic. Infinitely divisible (layer 2), instantly transferrable globally. Bank 60% of the population's unbanked in 90 days. Not controlled by corrupt govt. Truth money",wilkinsoncape no we need only bitcoin like elsalvador and central african republic infinitely divisible layer 2 instantly transferrable globally bank 60 of the population unbanked in 90 days not controlled by corrupt govt truth money,0.06818018108606339,0.9175661206245422,0.014253679662942886
2022-05-07,16:15,"The US dollar is the elevated part of the fiat ship. Jump on the live boat/#Bitcoin now, before it's too late.",the us dollar is the elevated part of the fiat ship jump on the live boatbitcoin now before it is too late,0.10061671584844589,0.8765156269073486,0.022867592051625252
2022-05-07,16:15,One part of the Titanic was elevated even though the rest of the ship was sinking. Why #Bitcoin was the live boat and Bitcoiners helping people to get on board. It was only a matter of time and the entire ship sank (including the elevated part).,one part of the titanic was elevated even though the rest of the ship was sinking why bitcoin was the live boat and bitcoiners helping people to get on board it was only a matter of time and the entire ship sank including the elevated part,0.029820693656802177,0.8238674998283386,0.14631184935569763
2022-05-07,16:15,"The tokens are produced by proof-of-work mining, just like Bitcoin. They're commodities, not promises.
#SeasonalTokens #CryptoMining #CyclicalInvesting #BTC",the tokens are produced by proofofwork mining just like bitcoin they are commodities not promises seasonaltokens cryptomining cyclicalinvesting btc,0.06533949822187424,0.9169254302978516,0.017735101282596588
2022-05-07,16:15,Never forget your just on a rock in space #bitcoin,never forget your just on a rock in space bitcoin,0.04391195625066757,0.9143113493919373,0.041776761412620544
2022-05-07,16:15,"Altseason this year?
#cryptocurrency #Bitcoin #Ethereum #XRP #Crypto #NFT",altseason this year cryptocurrency bitcoin ethereum xrp crypto nft,0.07096982002258301,0.9167519807815552,0.012278171256184578
2022-05-07,16:15,@DisCas_DAO #bitcoin #bitcoinindonesia #ido #bitcoinnews #blockchainnews #blockchainwallet This is really very cool and strong project with great facilities.I hope this project will achieve more success.We will be happy to see the achievements and results of this excellent,discasdao bitcoin bitcoinindonesia ido bitcoinnews blockchainnews blockchainwallet this is really very cool and strong project with great facilitiesi hope this project will achieve more successwe will be happy to see the achievements and results of this excellent,0.8466157913208008,0.1452932357788086,0.008090927265584469
2022-05-07,16:15,"📉#BTC | Decreasing 0.08%
Average price for the last hour: BTCUSDT - 35997.0486",btc decreasing 008 average price for the last btcusdt 359970486,0.035011131316423416,0.9328078031539917,0.03218109905719757
2022-05-07,16:15,What’s the best way to run a #Bitcoin node that doesn’t compromise your privacy if someone breaks in your house?,whats the best way to run a bitcoin node that doesn not compromise your privacy if someone breaks in your house,0.030648482963442802,0.8550400137901306,0.11431152373552322
2022-05-07,16:15,An investor who trades 3 Spring tokens for 5 Summer tokens will have more tokens in total after the trade than before. #SeasonalTokens #CryptoMining #CyclicalInvesting #BTC,an investor who trades 3 spring tokens for 5 summer tokens will have more tokens in total after the trade than before seasonaltokens cryptomining cyclicalinvesting btc,0.10267830640077591,0.8654925227165222,0.03182923048734665
2022-05-07,16:15,"An entire generation of investors about to realize what long term investing really means.
@shivamchhuneja 
#Bitcoin #Crypto",an entire generation of investors about to realize what long term investing really means shivamchhuneja bitcoin crypto,0.15456928312778473,0.8345291614532471,0.010901514440774918
2022-05-07,16:15,"#SeasonalTokens #CryptoMining #Cyclicallnvesting #BTC
Very promising project and in the future will bring its investors a good profit. Advanced technologies and a professional team. I advise everyone this great success project",seasonaltokens cryptomining cyclicallnvesting btc very promising project and in the future will bring its investors a good profit advanced technologies and a professional team i advise everyone this great success project,0.8676982522010803,0.12428028136491776,0.008021495305001736
2022-05-07,16:15,"The fact that #btc can remain as the same price point during a weekend is proof that #bitcoin price is controlled in a centralised manner. 

Won't end well.",the fact that btc can remain as the same price point during a weekend is proof that bitcoin price is controlled in a centralised manner will not end well,0.11243072897195816,0.8638330101966858,0.023736272007226944
2022-05-07,16:15,"Either die in madness, or busy die in silence, #Bitcoin",either die in madness or busy die in silence bitcoin,0.02127513661980629,0.8882117867469788,0.09051300585269928
2022-05-07,16:15,"Always trade tokens for more tokens and the total number of tokens you own will increase with every trade.
#SeasonalTokens #CryptoMining #CyclicalInvesting #BTC",always trade tokens for more tokens and the total number of tokens you own will increase with every trade seasonaltokens cryptomining cyclicalinvesting btc,0.2774907052516937,0.7107385993003845,0.011770683340728283
2022-05-07,16:15,Dunno I just don't think people shilling gold are not reliable source of Alpha. They are a bit more sophisticated than #BTC maxis but their reasonings to buying gold  are often severely detached from their reasonings which kind of make sense if heard individually.,dunno i just do not think people shilling gold are not reliable source of alpha they are a bit more sophisticated than btc maxis but their reasonings to buying gold are often severely detached from their reasonings which kind of make sense if heard individually,0.03826509043574333,0.7469034194946289,0.21483151614665985
2022-05-07,16:15,"#SeasonalTokens #CryptoMining #Cyclicallnvesting #BTC
The project will be implemented in the crypto world. We believe in our innovative product and energetic team. The company will show excellent results!",seasonaltokens cryptomining cyclicallnvesting btc the project will be implemented in the crypto world we believe in our innovative product and energetic team the company will show excellent results,0.9060698747634888,0.08566538244485855,0.008264790289103985
2022-05-07,16:15,@ProtectUrWealth @GregInLapwai @Dennis_Porter_ I’d like to hear any organized religion’s plan of action or adoption regarding faith in #Bitcoin.,protecturwealth greginlapwai dennisporter id like to hear any organized religions plan of action or adoption regarding faith in bitcoin,0.06260091811418533,0.9261242151260376,0.01127492357045412
2022-05-07,16:15,@StoopidPigeon Is that what’s holding down #BTC?,stoopidpigeon is that whats holding down btc,0.04895961284637451,0.6404092311859131,0.31063112616539
2022-05-07,16:15,"@ScalperSilly @TrueCrypto28 True risk management is not trying to time a bottom. Trying to wait for the perfect price entry, is literally the wrong way to go about it. DCA’ing is the only way. That means stacking regularly, whenever you can. #Bitcoin",scalpersilly truecrypto28 true risk management is not trying to time a bottom trying to wait for the perfect price entry is literally the wrong way to go about it dcaing is the only way that means stacking regularly whenever you can bitcoin,0.02319236844778061,0.8037927150726318,0.17301496863365173
2022-05-07,16:15,"If the price of one of the seasonal tokens plunges, you can trade other seasonal tokens for it and increase the number of tokens you own. #SeasonalTokens #CryptoMining #CyclicalInvesting #BTC",if the price of one of the seasonal tokens plunges you can trade other seasonal tokens for it and increase the number of tokens you own seasonaltokens cryptomining cyclicalinvesting btc,0.17804935574531555,0.7971850037574768,0.024765627458691597
2022-05-07,16:15,@MrBigWhaleREAL gonna buy some #btc on bfx... have you even seen what happened to the price?,mrbigwhalereal gonna buy some btc on bfx have you even seen what happened to the price,0.0260869599878788,0.9059821367263794,0.06793095916509628
2022-05-07,16:15,"Best time to buy #Crypto ... Agar Market ise bhi 5-10% Niche gaya toh.. i will consider crypto as world biggest #scam ... Agar niche gaya toh iska matlab Jab tak log loss main sell nahi karenge tab tak market uper nhi jayega..

#shiba #dogecoin #Bitcoin #ETH  #ELON #Binance #wrx",best time to buy crypto agar market ise bhi 510 niche gaya toh i will consider crypto as world biggest scam agar niche gaya toh iska matlab jab tak log loss main sell nahi karenge tab tak market uper nhi jayega shiba dogecoin bitcoin eth elon binance wrx,0.09912784397602081,0.8873769640922546,0.013495185412466526
2022-05-07,16:15,"@rovercrc Yeah... This year will be great for  
#bitcoin",rovercrc yeah this year will be great for bitcoin,0.8567193746566772,0.13493427634239197,0.00834635365754366
2022-05-07,16:15,"Be very aware on YouTube guys they are  #ElonMusk IMPOSTERS trying to steal your bitcoin. Be very aware and never send them anything and please report these RATS 

#Bitcoin #youtube #cryptocurrency",be very aware on youtube guys they are elonmusk imposters trying to steal your bitcoin be very aware and never send them anything and please report these rats bitcoin youtube cryptocurrency,0.018182216212153435,0.8534110188484192,0.12840671837329865
2022-05-07,16:15,"JUST IN: Attention Traders This Is Where The Top 3 Cryptocurrencies #BTC, #ETH, And #XRP Are Heading Next!.

#cryptonews #news",just attention traders this is where the top 3 cryptocurrencies btc eth and xrp are heading next cryptonews news,0.05205210670828819,0.933104932308197,0.014842972159385681
2022-05-07,16:15,@JohalMiles Best time to buy #bitcoin,johalmiles best time to buy bitcoin,0.06418170034885406,0.9138438105583191,0.021974479779601097
2022-05-07,16:15,"FUN FACT: Luna Foundation is now the 10th biggest #Bitcoin  holder in the world with over 80,000 $BTC worth $2.87 billion",fun luna foundation is now the 10th biggest bitcoin holder in the world with over 80000 btc worth 287 billion,0.21142461895942688,0.78005450963974,0.008520875126123428
2022-05-07,16:15,"I see the 30k-50k area as a support for a much larger future area, #Bitcoin will be crazy then",i see the 30k50k area as a support for a much larger future area bitcoin will be crazy then,0.10423777997493744,0.8655948638916016,0.030167361721396446
2022-05-07,16:15,"@binance At the time of writing this tweet, the price of #Bitcoin is ≈$40k, you may be reading this when its price is $1 million",binance at the time of writing this tweet the price of bitcoin is 40k you may be reading this when its price is 1 million,0.02390141226351261,0.9043667316436768,0.07173193246126175
2022-05-07,16:15,"@AirdropStario Great project with great team and high potential.  Thank you for giving me this opportunity, 🚀🚀🚀 Good luck

@mmmdrahimi
@Mohamma39219494
@mehrdaddado2

#cryptocurrency #Airdrop #BSC #Bitcoin #NFT #MetaFlokiRacers #MFA #Airdropstario",airdropstario great project with great team and high potential thank you for giving me this opportunity good luck mmmdrahimi mohamma39219494 mehrdaddado2 cryptocurrency airdrop bsc bitcoin nft metaflokiracers mfa airdropstario,0.6771478056907654,0.31338080763816833,0.009471355006098747
2022-05-07,16:15,#Bitcoin is to currencies what The Ten Commandments are to laws,bitcoin is to currencies what the ten commandments are to laws,0.026762984693050385,0.9387459754943848,0.03449101373553276
2022-05-07,16:15,"@StackinSatoshis @NeilJacobs We think it's time for another Matrix-inspired #bitcoin design 😎

We'll work on something.",stackinsatoshis neiljacobs we think it is time for another matrixinspired bitcoin design we will work on something,0.20412804186344147,0.7874223589897156,0.008449597284197807
2022-05-07,16:15,@steve_hanke Basically what u are saying Warren is that Facebook is worth NOTHING-AGREE ! Bitcoin intrinsic value is also nothing-AGREE - But value comes when people use or believe in things so make ur own calculation for the years to come ! #Bitcoin,stevehanke basically what u are saying warren is that facebook is worth nothingagree bitcoin intrinsic value is also nothingagree but value comes when people use or believe in things so make ur own calculation for the years to come bitcoin,0.03862551227211952,0.9327839612960815,0.028590507805347443
2022-05-07,16:15,"This project will achieve great success thanks to a strong team and their reliable idea makes this project great. Join and support promising project.

#WorkQuest $WQT $WUSD #WorkNet #WorkQuestApp #blockchian #crypto #cryptolife #BTC #BNB #ETH #digitalization #digitalassets #savin",this project will achieve great success thanks to a strong team and their reliable idea makes this project great join and support promising project workquest wqt wusd worknet workquestapp blockchian crypto cryptolife btc bnb eth digitalization digitalassets savin,0.8112313747406006,0.18185070157051086,0.0069179232232272625
2022-05-07,16:15,Im weirdly excited about the possibility of #Bitcoin to go to 20k.,im weirdly excited about the possibility of bitcoin to go to 20k,0.36550140380859375,0.6155462265014648,0.01895235665142536
2022-05-07,16:15,"The current BTC price is $35987, buy #Bitcoin.  Source by CoinGecko",the current btc price is 35987 buy bitcoin source by coingecko,0.025245429947972298,0.9490029215812683,0.025751614943146706
2022-05-07,16:15,"Give the clip 40 seconds. C2E - collect to experience #NFTs. @Shirtum is changing the way we interact with our idols.

@cz_binance in regards to today’s AMA. 

#binance  #cryptocurrencies #OpenSeaNFT #sports #Ethereum #bitcoin",give the clip 40 seconds c2e collect to experience nfts shirtum is changing the way we interact with our idols czbinance in regards to todays ama binance cryptocurrencies openseanft sports ethereum bitcoin,0.07092272490262985,0.9099730849266052,0.019104164093732834
2022-05-07,16:15,"The Tracr™ platform is said to combine distributed ledger technology with advanced data security and privacy, ensuring that participants control the use and access of their own data

#CryptoNews #CryptocurrencyNews #cryptocommunity #cryptotwitter #bitcoin #NFT #NFTs",the tracr platform is said to combine distributed ledger technology with advanced data security and privacy ensuring that participants control the use and access of their own data cryptonews cryptocurrencynews cryptocommunity cryptotwitter bitcoin nft nfts,0.17530204355716705,0.8169549107551575,0.007743098773062229
2022-05-07,16:15,We need to tell the world that we are done with their money. #Bitcoin,we need to tell the world that we are done with their money bitcoin,0.07594412565231323,0.7050374746322632,0.21901841461658478
2022-05-07,16:15,"I wonder if Bill Miller has sold any of his $AMZN or #BTC?

🧐",i wonder if bill miller has sold any of his amzn or btc,0.025040073320269585,0.9183226227760315,0.056637365370988846
2022-05-07,16:15,@raybrown007 @MackoRyszard Or you can transact peer to peer with other free people using gold or #Bitcoin. I recommend #Bitcoin.,raybrown007 mackoryszard or you can transact peer to peer with other free people using gold or bitcoin i recommend bitcoin,0.07019459456205368,0.916766345500946,0.01303909346461296
2022-05-07,16:15,"🔔Price updates for different #crypto assets that get price predictions on 🦥SlothTrading:

#BTC: $35,978.99
#AVA: $1.196
#BNB: $376.40
#ADA: $0.7800
#DOGE: $0.1315

💥New predictions every hour",price updates for different crypto assets that get price predictions on 3597899 1196 37640 07800 01315 new predictions every hour,0.022798513993620872,0.936184287071228,0.041017234325408936
2022-05-07,16:15,"#Helios #Mining #Fintech #Insurtech #Crypto #Bitcoin
This project is really and most promising project. I saw there every detail and information. They look pretty impressive",helios mining fintech insurtech crypto bitcoin this project is really and most promising project i saw there every detail and information they look pretty impressive,0.7945003509521484,0.19578243792057037,0.0097172437235713
2022-05-07,16:15,@Bitcoin_Wallace #Bitcoin doesn't care. HODL on.,bitcoinwallace bitcoin does not care hodl on,0.036102693527936935,0.8325016498565674,0.13139568269252777
2022-05-07,16:15,"@binance #bitcoin not crapto #sorrynotsorry 

🧡🧡🧡🧡🧡🧡🧡",binance bitcoin not crapto sorrynotsorry,0.04733961075544357,0.9191620349884033,0.03349839150905609
2022-05-07,16:15,"I beg you stop comparing charts to previous years or months or different times.
We haven’t faced a similar economical crisis since 2008 .
Always take that into consideration.
#btc #BTCUSDT $BTC",i beg you stop comparing charts to previous years or months or different times we haven not faced a similar economical crisis since 2008 always take that into consideration btc btcusdt btc,0.02806716226041317,0.9135305881500244,0.05840225890278816
2022-05-07,16:15,death is the only true form of freedom. #bitcoin,death is the only true form of freedom bitcoin,0.0192958302795887,0.8696619868278503,0.11104224622249603
2022-05-07,16:15,I just panic bought more #Bitcoin 🤭,i just panic bought more bitcoin,0.1264095902442932,0.7050164937973022,0.16857385635375977
2022-05-07,16:15,"So many scammers on twitter.
Don't send or follow anyone's instructions without proper research.
Don't fall for quick money making schemes.
You'll get ripped.

Do your reaserch and trust yourself.
Quick money is scam.

#ETH 
#Bitcoin 
#SolanaNFT 
#HBAR 
#Crypto",so many scammers on twitter do not send or follow anyone instructions without proper research do not fall for quick money making schemes you will get ripped do your reaserch and trust yourself quick money is scam eth bitcoin solananft hbar crypto,0.02984658256173134,0.9365357756614685,0.03361765667796135
2022-05-07,16:15,"“When someone tries to buy all the world’s supply of a scarce asset, the more they buy the higher the price goes.”

#Bitcoin

#Satoshi_Nakamoto",when someone tries to buy all the worlds supply of a scarce asset the more they buy the higher the price goes bitcoin satoshinakamoto,0.054401151835918427,0.8739405870437622,0.07165829837322235
2022-05-07,16:15,"@MetapleFinance 
This project is built on good development and open long term opportunities for each user. 
#MetapleFinance #Metaple #MLX #blockchain #cryptocurrency #technology #bitcoin #money #crypto #Binance #BNB #cryptocurrencies #fintech",metaplefinance this project is built on good development and open long term opportunities for each user metaplefinance metaple mlx blockchain cryptocurrency technology bitcoin money crypto binance bnb cryptocurrencies fintech,0.3353879749774933,0.6579478979110718,0.006664190907031298
2022-05-07,16:15,"#Bitcoin 📈 

▓▓▓▓▓░░░░░░░░░░ 36%

price:$35963.92      eth/btc: 0.07",bitcoin 36 007,0.028370222076773643,0.932212233543396,0.039417557418346405
2022-05-07,16:15,JUST IN: According to the 🇵🇹 Portuguese Tax Law #Bitcoin and #Crypto capital gains are tax-free.😍,just according to the portuguese tax law bitcoin and crypto capital gains are taxfree,0.02724314294755459,0.921924352645874,0.050832558423280716
2022-05-07,16:15,@steve_hanke Trust / self sovereignty / Censorship resistance.  #Bitcoin,stevehanke trust self sovereignty censorship resistance bitcoin,0.04290726035833359,0.9116169214248657,0.04547581449151039
2022-05-07,16:15,@binance #Bnb will be Second in Command after #btc,binance bnb will be second in command after btc,0.030227655544877052,0.9508869647979736,0.018885402008891106
2022-05-07,16:15,#BTC is now at $35963.92,btc is now at 3596392,0.026509612798690796,0.9321480393409729,0.041342321783304214
2022-05-07,16:15,"Buy now, you’ll regret it later. #btc",buy now youll regret it later btc,0.05256939306855202,0.8787075281143188,0.06872307509183884
2022-05-07,16:15,"A location agnostic buyer of energy incentivized to find the cheapest sources on the earth is a BIG DEAL.

#Bitcoin",a location agnostic buyer of energy incentivized to find the cheapest sources on the earth is a big deal bitcoin,0.1406739056110382,0.8464566469192505,0.012869458645582199
2022-05-07,16:15,#BTC IS GOING TO 28K!!!!!!,btc is going to 28k,0.05428178980946541,0.9276962280273438,0.018021974712610245
2022-05-07,16:15,@APompliano True innovators don’t care about stocks… 😂🙌🚀 #Bitcoin #sovereignty #freedom,apompliano true innovators don not care about stocks bitcoin sovereignty freedom,0.043412432074546814,0.9221295714378357,0.034457989037036896
2022-05-07,16:15,"@funnygameworld 
I hope this company will become great successful company. I recommend to all investors. This is great opportunities for this century. Wonderful project. #FGW #FunnyGameWorld #crypto #bitcoin #cryptocurrency #blockchain #bounty #binance #eth #token #coinsbit",funnygameworld i hope this company will become great successful company i recommend to all investors this is great opportunities for this century wonderful project fgw funnygameworld crypto bitcoin cryptocurrency blockchain bounty binance eth token coinsbit,0.23484784364700317,0.7559866905212402,0.009165476076304913
2022-05-07,16:15,"@workquest_co #WorkQuest $WQT $WUSD #WorkNet #WorkQuestApp #blockchian #crypto #cryptolife #BTC #BNB #ETH #digitalization #digitalassets #saving #BinanceSmartChain
Wonderful project with cool plan. This project completing every step according their plan. This project deserve",workquestco workquest wqt wusd worknet workquestapp blockchian crypto cryptolife btc bnb eth digitalization digitalassets saving binancesmartchain wonderful project with cool plan this project completing every step according their plan this project deserve,0.1403929889202118,0.8502752184867859,0.009331764653325081
2022-05-07,16:15,What can be the next bad news for #Bitcoin ?,what can be the next bad news for bitcoin,0.023300183936953545,0.4871223270893097,0.4895775616168976
2022-05-07,16:15,"The boring bitcoin movement reminds me of a football match where the winning team just wants the referee to blow the final whistle. Now bitcoin is playing in such a way that the 3d death-cross whistle is blown, probably next week #Bitcoin",the boring bitcoin movement reminds me of a football match where the winning team just wants the referee to blow the final whistle now bitcoin is playing in such a way that the 3d deathcross whistle is blown probably next week bitcoin,0.024462297558784485,0.7380065321922302,0.23753121495246887
2022-05-07,16:15,"Everyone on twitter is so bearish, it makes me bullish.. 🤔 #Bitcoin",everyone on twitter is so bearish it makes me bullish bitcoin,0.029705990105867386,0.3911997079849243,0.5790942907333374
2022-05-07,16:15,"@Breedlove22 The US should be quietly accumulating the hell out of #Bitcoin, while embracing a 1 to 1 backed US dollar stable coin. This would prop up demand for the dollar. The exorbitant privilege is coming to an end but the US could front run all other nations on #Bitcoin .",breedlove22 the us should be quietly accumulating the hell out of bitcoin while embracing a 1 to 1 backed us dollar stable coin this would prop up demand for the dollar the exorbitant privilege is coming to an end but the us could front run all other nations on bitcoin,0.8170368671417236,0.15416580438613892,0.028797365725040436
2022-05-07,16:15,@BTC_Archive If derivative this is great news for #BTC actually,btcarchive if derivative this is great news for btc actually,0.8198168873786926,0.1695297211408615,0.010653423145413399
2022-05-07,16:15,"#VRA/#USDT from #Kucoin looks good for #trading.

For Detailed signals, use the link in profile &amp; contact admin for VIP membership plans.

#Bitcoin #Cryptocurrency",vrausdt from kucoin looks good for trading for detailed signals use the link in profile contact admin for vip membership plans bitcoin cryptocurrency,0.07186031341552734,0.9146093726158142,0.013530256226658821
