Date,Time,Original tweet,Clean tweet,Positive,Neutral,Negative
2022-05-09,20:45,Almost 300 billion usd moved away from #btc market cap. Which is not a lot of money but still that happened without regulators. Damn.,almost 300 billion usd moved away from btc market cap which is not a lot of money but still that happened without regulators damn,0.07694295793771744,0.5969187021255493,0.32613831758499146
2022-05-09,20:45,the real flippening is my #Bitcoin friends going from thinking I'm insane for buying $GME to being mad at me for celebrating #BTC tanking lmayo,the real flippening is my bitcoin friends going from thinking i am insane for buying gme to being mad at me for celebrating btc tanking lmayo,0.04051433131098747,0.5786226391792297,0.38086310029029846
2022-05-09,20:45,"KTC CRYPTO TRADE  RESULTS
MAY 9 - 4  TRADES ( 3 HIT TP2 / 1 SL) 
$ETH $TRX $NEAR $BTC
Grats KTC GROUP

Check Link  for Details 
https://t.co/9boXqEKd3s

#Cryptocrash #cryptotrading #eth #btc #ada #xrp #Metaverse #nft #eos #shib #xtz #xlm #gmt  #trx  #luna #ape #bnb #doge #eth https://t.co/7WBuUs3YKF",ktc crypto trade results may 9 4 trades 3 hit tp2 1 sl eth trx near btc grats ktc group check link for details cryptocrash cryptotrading eth btc ada xrp metaverse nft eos shib xtz xlm gmt trx luna ape bnb doge eth,0.05541118606925011,0.9241849780082703,0.020403822883963585
2022-05-09,20:45,"Financial News: U.S. stocks fell Monday morning to extend last week's losses

#AwoyeCapital #LearnMoney #FinancialFreedom #Entrepreneur  #Bitcoin #Podcast #Economy #Investments #FinancialAdvisor #SmallBusiness #WealthManager #NFT #CNBC #BlackWallStreet #BlackWealth",financial us stocks fell monday morning to extend last week losses awoyecapital learnmoney financialfreedom entrepreneur bitcoin podcast economy investments financialadvisor smallbusiness wealthmanager nft cnbc blackwallstreet blackwealth,0.008041756227612495,0.03353668376803398,0.9584214687347412
2022-05-09,20:45,@nayibbukele El Salvador should have waited a few more days to buy #BTC.,nayibbukele el salvador should have waited a few more days to buy btc,0.1126956045627594,0.87019944190979,0.01710495539009571
2022-05-09,20:45,I rode #Bitcoin down from 20k to 3k. I've seen some shit. This is not scary at all.,i rode bitcoin down from 20k to 3k i have seen some shit this is not scary at all,0.11213564872741699,0.16309045255184174,0.7247738838195801
2022-05-09,20:45,- Cloud mining sites. Sign Up - https://t.co/rej8BOenly Mining has never been easier. Put your investing ideas into action with a full range of investments. Enjoy real benefits and rewards on your accrue investing. Don't waste your time and REGISTER NOW. #BTC https://t.co/4EgTOo3V2e,cloud mining sites sign up mining has never been easier put your investing ideas into action with a full range of investments enjoy real benefits and rewards on your accrue investing do not waste your time and register now btc,0.09019657969474792,0.897236704826355,0.012566696852445602
2022-05-09,20:45,"LaserPunk Genesis #NFT holders will be given exclusive access to participate in the #Launchpad  of upcoming projects through discounted minting price, airdrops and other rewards, like $corx.@cz_binance  #NFTs #BTC #ETH #NFTGiveaways  #Binance #cryptocurrency #Bitcoin #NFTartists https://t.co/fM38jHw79O",laserpunk genesis nft holders will be given exclusive access to participate in the launchpad of upcoming projects through discounted minting price airdrops and other rewards like corxczbinance nfts btc eth nftgiveaways binance cryptocurrency bitcoin nftartists,0.340413361787796,0.6520563960075378,0.007530248258262873
2022-05-09,20:45,Current #Bitcoin Price is $31025 #BTC #Crypto,current bitcoin price is 31025 btc crypto,0.02279231697320938,0.9530777335166931,0.02412993460893631
2022-05-09,20:45,"Definitely don’t pay attention to the #Bitcoin Weekly RSI

We aren’t going to 10k 😂 https://t.co/RztZ2Cqnou",definitely don not pay attention to the bitcoin weekly rsi we aren not going to 10k,0.0290997251868248,0.9059492349624634,0.06495105475187302
2022-05-09,20:45,"@ScottieTash @MyMetaverse 💟 NICE 💟

Enjin:
0x072302384Bdf3269Bdf99b25b893C71e8Fb6B812

@ArmMrh3 @ArmHam12 @Arz163 @Arzmrh9 @ArmTab7

#NFT #COIN #CRYPTO #DEFI #AIRDROP #BSC #BTC #Airdrops #GameFi #ENJIN #EJN
#Enjin #NFTCommunity #NFTGiveaway

💢Peace on all, good LUCK💢 https://t.co/w8LgCA0nys",scottietash mymetaverse nice 0x072302384bdf3269bdf99b25b893c71e8fb6b812 armmrh3 armham12 arz163 arzmrh9 armtab7 nft coin crypto defi airdrop bsc btc airdrops gamefi enjin ejn enjin nftcommunity nftgiveaway peace on all good luck,0.10500568896532059,0.8729615807533264,0.022032713517546654
2022-05-09,20:45,"💢 Trend line interaction dedected on #CTSI's 4 hours time frame!

⚠️ What you must consider for this chart? ⬇️
https://t.co/nJysxkopGk

📢 Join our Telegram channel to receive instant trend and pattern breakout notifications:
https://t.co/AJVr4xZOGj

#BTC #Bitcoin #Crypto https://t.co/Jf6mfDQr4N",trend line interaction dedected on ctsi 4 hours time frame what you must consider for this chart join our telegram channel to receive instant trend and pattern breakout btc bitcoin crypto,0.04717245697975159,0.9381088614463806,0.014718682505190372
2022-05-09,20:45,"Invest more than usual with this kind of signals #IOTA #IOTABTC 

#BTC #Bitcoin #Crypto #BTC #биткойн #比特币 #비트코인
Join more than 400 happy members with us now, PM ME!",invest more than usual with this kind of signals iota iotabtc btc bitcoin crypto btc биткойн 比特币 비트코인 join more than 400 happy members with us now pm me,0.13202784955501556,0.8569126129150391,0.011059552431106567
2022-05-09,20:45,#BTC is scam))),btc is scam,0.017192456871271133,0.874969482421875,0.10783806443214417
2022-05-09,20:45,The flip side of #BTC diminishing returns is that the bear market will also be less violent than before,the flip side of btc diminishing returns is that the bear market will also be less violent than before,0.021775519475340843,0.03460909053683281,0.9436154365539551
2022-05-09,20:45,"@intocryptoverse 2025 #Bitcoin will rise to $120k+ and then drop to $60k again during 2026-27.

Then 2029 #Bitcoin will go beyond $340k. And drop to $175k-200k in 2030-31. 

2033 once again rising about $750k-875k top. Fall to $600k in 2034-35.

Won’t go $1 million #BTC until 2037. #FromTheFuture",intocryptoverse 2025 bitcoin will rise to 120k and then drop to 60k again during 202627 then 2029 bitcoin will go beyond 340k and drop to 175k200k in 203031 2033 once again rising about 750k875k top fall to 600k in 203435 won not go 1 million btc until 2037 fromthefuture,0.016567664220929146,0.07718122005462646,0.906251072883606
2022-05-09,20:45,"@TheCryptoLark You can be in extreme fear with #Bitcoin , but with @FitEvoNFT you stand a chance to stay , happy , fit , steadily earning , and most of all you stand a chance to #ShakeItUp #MoveToEarn 🔥🔥",thecryptolark you can be in extreme fear with bitcoin but with fitevonft you stand a chance to stay happy fit steadily earning and most of all you stand a chance to shakeitup movetoearn,0.16553786396980286,0.8197671175003052,0.014695056714117527
2022-05-09,20:45,"The tokens are designed to rise in price relative to each other in a predictable sequence. Spring will tend to rise in price, then Summer, Autumn, Winter and Spring again.
#SeasonalTokens #CryptoMining #CyclicalInvesting #BTC",the tokens are designed to rise in price relative to each other in a predictable sequence spring will tend to rise in price then summer autumn winter and spring again seasonaltokens cryptomining cyclicalinvesting btc,0.5378610491752625,0.4326276481151581,0.029511306434869766
2022-05-09,20:45,"@MichaelSuppo Tough one but I think top was in as @RichardHeartWin called, &amp; we just seeing diminishing returns.

IMO, the bull trap late 2021 was just new dynamics coming into play such as mass accessibility, acceptance &amp; Wall Street pretty much owning #bitcoin and #Ethereum 

$HEX did great!",michaelsuppo tough one but i think top was in as richardheartwin called we just seeing diminishing returns imo the bull trap late 2021 was just new dynamics coming into play such as mass accessibility acceptance wall street pretty much owning bitcoin and ethereum hex did great,0.1119009330868721,0.8198279738426208,0.06827101111412048
2022-05-09,20:45,I have to say this 😳 Who would have ever thought that the #Ruble would outperform #bitcoin?,i have to say this who would have ever thought that the ruble would outperform bitcoin,0.3602255582809448,0.5864531397819519,0.053321342915296555
2022-05-09,20:45,@ErikVoorhees @terra_money Build on #Bitcoin... problem solved. Resilience gained,erikvoorhees terramoney build on bitcoin problem solved resilience gained,0.908183753490448,0.07601919025182724,0.015797067433595657
2022-05-09,20:45,"Wow #Bitcoin is not my friend this week. Maybe I'll mint something with #Ethereum ... oh, it's #notAMintWeek",wow bitcoin is not my friend this week maybe i will mint something with ethereum oh it is notamintweek,0.041237927973270416,0.8911195397377014,0.06764251738786697
2022-05-09,20:45,"@nayibbukele Yikes. This will hurt in 6 months when #BTC bottoms out to $9K 

@RemindMe_OfThis can you set a reminder for November 9 2022?",nayibbukele yikes this will hurt in 6 months when btc bottoms out to 9k remindmeofthis can you set a reminder for november 9 2022,0.06693491339683533,0.8651924729347229,0.06787258386611938
2022-05-09,20:45,what most people don't have is the mindset. mindset is everything. #mindset #btc,what most people do not have is the mindset mindset is everything mindset btc,0.027140621095895767,0.9461437463760376,0.026715653017163277
2022-05-09,20:45,Breaking news: El Salvador sold the 500 #Bitcoin they bought just 1hr ago. 🙄,breaking el salvador sold the 500 bitcoin they bought just 1hr ago,0.15819135308265686,0.8256512880325317,0.016157321631908417
2022-05-09,20:45,Luna foundation Guard ( LFG ) sold 42000 bitcoins . #Bitcoin,luna foundation guard lfg sold 42000 bitcoins bitcoin,0.052494484931230545,0.9291471242904663,0.018358321860432625
2022-05-09,20:45,"The tokens are produced by proof-of-work mining, just like Bitcoin. They're commodities, not promises.
#SeasonalTokens #CryptoMining #CyclicalInvesting #BTC",the tokens are produced by proofofwork mining just like bitcoin they are commodities not promises seasonaltokens cryptomining cyclicalinvesting btc,0.06533949822187424,0.9169254302978516,0.017735101282596588
2022-05-09,20:45,@BTC_Archive Probably just moved as it would more #BTC than traded entire day today,btcarchive probably just moved as it would more btc than traded entire day today,0.08030713349580765,0.8961822390556335,0.023510633036494255
2022-05-09,20:45,"@robsonjackie3 @noahkaufmanmd @RufasKe Ah, but when the giant margin call comes — as it inevitably will — that’s when HODLers of on-chain #bitcoin really win. Yes, all the bad financialization is suppressing the market price. But HODLers don’t much care — they just scoop up more on-chain bitcoin at lower prices. 💪",robsonjackie3 noahkaufmanmd rufaske ah but when the giant margin call comes as it inevitably will thats when hodlers of onchain bitcoin really win yes all the bad financialization is suppressing the market price but hodlers don not much care they just scoop up more onchain bitcoin at lower prices,0.05837513506412506,0.7819444537162781,0.15968042612075806
2022-05-09,20:45,All this is doing is creating future millionaires 👌🏿 keep your eyes open and your fear in check #BTC,all this is doing is creating future millionaires keep your eyes open and your fear in check btc,0.05321953445672989,0.9288501143455505,0.01793033443391323
2022-05-09,20:45,Where are you moonboys?? 😂😂😂 #Crypto #btc #Bitcoin #ETHEREUM #binance,where are you moonboys crypto btc bitcoin ethereum binance,0.030206836760044098,0.9310519099235535,0.03874132037162781
2022-05-09,20:45,We don’t liquidate. We HODL.  #Bitcoin,we don not liquidate we hodl bitcoin,0.03293637931346893,0.9218592047691345,0.04520442709326744
2022-05-09,20:45,"🔻🔻🔻 $1,111,479 BTCUSDT SHORTED @$30,800.00 on #Binance (20:44:25 UTC) #BTC #cryptocurrency",1111479 btcusdt shorted 3080000 on binance utc btc cryptocurrency,0.03472444787621498,0.9309420585632324,0.03433346748352051
2022-05-09,20:45,"🔻🔻🔻 $2,581,810 BTCUSDT SHORTED @$30,800.00 on #Binance (20:44:25 UTC) #BTC #cryptocurrency",2581810 btcusdt shorted 3080000 on binance utc btc cryptocurrency,0.03719102963805199,0.9250554442405701,0.03775355964899063
2022-05-09,20:45,1000% in coming 🚀🚀🚀 @eth_shiba @EthFloki @ETHFanToken #TrustTheProcess #1zeroatatime #1centdream #Bitcoin #Binance,1000 in coming ethshiba ethfloki ethfantoken trusttheprocess 1zeroatatime 1centdream bitcoin binance,0.13838426768779755,0.8479787111282349,0.013637025840580463
2022-05-09,20:45,Majority of the country will own #Bitcoin except consumer. part of the plan. shake out all the weak hands. #Cryptocrash,majority of the country will own bitcoin except consumer part of the plan shake out all the weak hands cryptocrash,0.1460958570241928,0.839714765548706,0.014189341105520725
2022-05-09,20:45,"#Bitcoin  When people are selling, buy, when people are buying, #HODL. ------&gt; 

I bet you thought I'd say, ""sell"".. hehe. 

BTW, #TerareumStrong #Terareum is holding well in this ""crash"" scenario... just FYI...🍀🍀🍀🍀",bitcoin when people are selling buy when people are buying hodl gt i bet you thought i would say sell hehe btw terareumstrong terareum is holding well in this crash scenario just fyi,0.5113529562950134,0.4716777503490448,0.016969263553619385
2022-05-09,20:45,"🔻🔻🔻 $2,101,268 BTCUSDT SHORTED @$30,800.00 on #Binance (20:44:18 UTC) #BTC #cryptocurrency",2101268 btcusdt shorted 3080000 on binance utc btc cryptocurrency,0.03575108200311661,0.9309914112091064,0.03325752168893814
2022-05-09,20:45,"🚀🚀🚀 $2,424,914 BTCUSDT LONGED @$30,800.00 on #Binance (20:44:18 UTC) #BTC #cryptocurrency",2424914 btcusdt longed 3080000 on binance utc btc cryptocurrency,0.03977575525641441,0.9268491864204407,0.03337501734495163
2022-05-09,20:45,"The $LUNA experiment failed, #bitcoin will prevail long term. You can die off now $LUNA",the luna experiment failed bitcoin will prevail long term you can die off now luna,0.046135399490594864,0.8475252985954285,0.10633932799100876
2022-05-09,20:45,Bitcoin below 30K.. Spain without the S #btc,bitcoin below 30k spain without the btc,0.05728116258978844,0.8212318420410156,0.12148699909448624
2022-05-09,20:45,"By trading tokens for more tokens, you can convert price fluctuations into gains.
#SeasonalTokens #CryptoMining #CyclicalInvesting #BTC",by trading tokens for more tokens you can convert price fluctuations into gains seasonaltokens cryptomining cyclicalinvesting btc,0.09216351807117462,0.8870084285736084,0.020828086882829666
2022-05-09,20:45,"@MkNFTz_ @SteezyApes 💟🌐NICE🌐💟

Bsc &amp; Eth &amp; PLG:
0x4f260B7F90D4F2924112Dc8f011d1E9af72839aD

@ArmMrh3 @ArmHam12 @arz163 @ArzMrh9 @ArmTab7 @ArzMrh8
#NFT #COIN #CRYPTO #DEFI #AIRDROP #BSC #BTC #Airdrops #NFTGiveaway #NFTGiveaways #NFTdrop #NFTCommmunity

💢Peace on all, good LUCK💢",mknftz steezyapes nice bsc eth 0x4f260b7f90d4f2924112dc8f011d1e9af72839ad armmrh3 armham12 arz163 arzmrh9 armtab7 arzmrh8 nft coin crypto defi airdrop bsc btc airdrops nftgiveaway nftgiveaways nftdrop nftcommmunity peace on all good luck,0.14092426002025604,0.8431249260902405,0.015950869768857956
2022-05-09,20:45,"At the end of the day we are all slaves of capitalism 

#crypto #cryptocurrency #cryptotrading #crypto #terraluna #solana  #Ethereum #cardano #Bitcoin #bitcoin #ETH #SOL #UST #Cryptocrash #LUNA #USDT #USDC #BSC #XRP",at the end of the day we are all slaves of capitalism crypto cryptocurrency cryptotrading crypto terraluna solana ethereum cardano bitcoin bitcoin eth sol ust cryptocrash luna usdt usdc bsc xrp,0.041470177471637726,0.933887779712677,0.02464204840362072
2022-05-09,20:45,I'm simply not selling &amp; that is all there is to it #Bitcoin  #btc,i am simply not selling that is all there is to it bitcoin btc,0.03602728992700577,0.9422303438186646,0.02174239419400692
2022-05-09,20:45,1 #Bitcoin = 1 #Bitcoin Thats it.,1 bitcoin 1 bitcoin thats it,0.06621517986059189,0.9117171168327332,0.02206769958138466
2022-05-09,20:45,#BTC GO TO 27K,btc go to 27k,0.08608853816986084,0.8907203078269958,0.023191140964627266
2022-05-09,20:45,Why does #Bitcoin follow the #NASDAQ #DowJones and/or the general #Markets ?  It's not a stock.  Just curious what more experienced investors think.,why does bitcoin follow the nasdaq dowjones andor the general markets it is not a stock just curious what more experienced investors think,0.03279229253530502,0.9341559410095215,0.033051762729883194
2022-05-09,20:45,"Buy Bitcoin near 30k$-32k$ and wait for Wednesday 11 May 2020.
#Bitcoin pump",buy bitcoin near 30k 32k and wait for wednesday 11 may 2020 bitcoin pump,0.027610570192337036,0.9435449242591858,0.028844455257058144
2022-05-09,20:45,"Fun Fact of the day:
Our #1 anchor @_StephanieMyers @OANN has been at her job for 7 years now,  happy Anniversary!!
How long have you been at your job?
#Bitcoin #breakfast #BreakingNews #Anniversary #happiness",fun fact of the our 1 anchor stephaniemyers oann has been at her job for 7 years now happy anniversary how long have you been at your job bitcoin breakfast breakingnews anniversary happiness,0.04943329095840454,0.904028594493866,0.046538110822439194
2022-05-09,20:45,"Seasonality is a problem for cryptocurrency investors. Seasonal Tokens have been engineered to make seasonality work for the benefit of investors.
#SeasonalTokens #CryptoMining #CyclicalInvesting #BTC",seasonality is a problem for cryptocurrency investors seasonal tokens have been engineered to make seasonality work for the benefit of investors seasonaltokens cryptomining cyclicalinvesting btc,0.060613758862018585,0.887972354888916,0.05141390860080719
2022-05-09,20:45,#Bitcoin will make ick in exchange for the amount it takes to pay the premium currency back .,bitcoin will make ick in exchange for the amount it takes to pay the premium currency back,0.08356247842311859,0.9068669080734253,0.009570629335939884
2022-05-09,20:45,"Kidney for sale, will take #bitcoin #btc",kidney for sale will take bitcoin btc,0.03921787440776825,0.948072612285614,0.012709511443972588
2022-05-09,20:45,#Bitcoin Is super healty....,bitcoin is super healty,0.25035491585731506,0.7355859875679016,0.014059041626751423
2022-05-09,20:45,"@CryptoMichNL Looking extremely likely..

Can partly thank LUNA.

#BTC #Crypto #Cryptos #cryptotrading #Bitcoin #LUNA",cryptomichnl looking extremely likely can partly thank luna btc crypto cryptos cryptotrading bitcoin luna,0.2104078084230423,0.7791886329650879,0.010403523221611977
2022-05-09,20:45,#Bitcoin is adopting the IMF and raising them right.,bitcoin is adopting the imf and raising them right,0.15198726952075958,0.8396210074424744,0.00839171838015318
2022-05-09,20:45,"Algo stable coin is the most interesting fintech innovation of all and can be pivotal in moving to Bitcoin standard.

Most Bitcoin will move off the exchange eventually and stable coins backed by Bitcoin could be a game changer.

$LUNA
#Bitcoin",algo stable coin is the most interesting fintech innovation of all and can be pivotal in moving to bitcoin standard most bitcoin will move off the exchange eventually and stable coins backed by bitcoin could be a game changer luna bitcoin,0.20622719824314117,0.7842968106269836,0.009476046077907085
2022-05-09,20:45,"Protect your funds and grow your wealth over time. The first crypto designed to make cyclical trading profitable
#SeasonalTokens #CryptoMining #CyclicalInvesting #BTC",protect your funds and grow your wealth over time the first crypto designed to make cyclical trading profitable seasonaltokens cryptomining cyclicalinvesting btc,0.17395031452178955,0.8166908025741577,0.009358839131891727
2022-05-09,20:45,#Bitcoin to $35k soon!,bitcoin to 35k soon,0.8605273365974426,0.11375302076339722,0.02571962960064411
2022-05-09,20:45,"@cperruna People say #Bitcoin is risky...well, just look at $NFLX and $UPST...pure garbage...I better put my money on #Bitcoin that on these hypervalued tech companies",cperruna people say bitcoin is riskywell just look at nflx and upstpure garbagei better put my money on bitcoin that on these hypervalued tech companies,0.07015848159790039,0.9014824628829956,0.02835908532142639
2022-05-09,20:45,@MMCrypto tell to others will drop to $17k #btc. if brake down that,mmcrypto tell to others will drop to 17k btc if brake down that,0.017120571807026863,0.18161971867084503,0.8012596964836121
2022-05-09,20:45,@ashwsbreal Please pump #BTC,ashwsbreal please pump btc,0.05306093022227287,0.9291496872901917,0.017789315432310104
2022-05-09,20:45,"🥳🥳🥳We made it to 500🎉🎉🎉 
Stay tuned, #NFTGiveaway coming real soon‼️‼️

#ETH #NFTs #NFTProjects #nftcollector #NFTartwork #NFTfamily #NFTCommmunity #bullish #opensea #OpenSeaNFT #cryptotrading #BTC #Ethereum #NFTdrop #NFTGiveaways $ETH
#Cryptocom #Binance #NFTMarketplace",we made it to 500 stay tuned nftgiveaway coming real soon eth nfts nftprojects nftcollector nftartwork nftfamily nftcommmunity bullish opensea openseanft cryptotrading btc ethereum nftdrop nftgiveaways eth cryptocom binance nftmarketplace,0.13405275344848633,0.8514476418495178,0.014499608427286148
2022-05-09,20:45,"$BTC, how low can it go?

#BTC",btc how low can it go btc,0.034102872014045715,0.9244330525398254,0.04146403819322586
2022-05-09,20:45,"$30,000 new #Bitcoin floor price?

#Crypto #Cryptocrash #cryptocurrency #altcoins",30000 new bitcoin floor price crypto cryptocrash cryptocurrency altcoins,0.06023512780666351,0.9206608533859253,0.0191040076315403
2022-05-09,20:45,"@DonPorrero We only want 6 hour work days also and the government needs to pay us 100$ to help with that and missing hours etc, 

#Iran #chronic #JeffBezos  #paranormal #bank #weed  #loan #BTC #hiphop #india #Ukraine #Russia #poverty  #NickiMinaj #Raw #Czech #nft #gold 
#civilbenefits",donporrero we only want 6 hour work days also and the government needs to pay us 100 to help with that and missing hours etc iran chronic jeffbezos paranormal bank weed loan btc hiphop india ukraine russia poverty nickiminaj raw czech nft gold civilbenefits,0.09430128335952759,0.8774276971817017,0.02827104553580284
2022-05-09,20:45,"I bought at the low $4.5K a few years ago and sold at $55K last year, but have not opted for the long-term buy this year, the price has been volatile this year. Need enough experience to distinguish, maybe my guts are too small #BTC #Bitcoin #cryptocurrency #Ethereum #invest",i bought at the low 45k a few years ago and sold at 55k last year but have not opted for the longterm buy this year the price has been volatile this year need enough experience to distinguish maybe my guts are too small btc bitcoin cryptocurrency ethereum invest,0.047027330845594406,0.9281796216964722,0.024793023243546486
2022-05-09,20:45,"@mcuban @mcuban Mark, we briefly emailed is the past. Big fan. Question: I think #Bitcoin, et al, is silly, #crypto is dangerous. Most of us don't have the $ to play the let's wait and see game. Advise or thoughts? Respectfully, DW",mcuban mcuban mark we briefly emailed is the past big fan i think bitcoin et al is silly crypto is dangerous most of us do not have the to play the let us wait and see game advise or thoughts respectfully dw,0.025261200964450836,0.8153760433197021,0.15936279296875
2022-05-09,20:45,#BTC ALGORITHMIC BUY &amp;amp; SELL SIGNALS.A SINGLE INDICATOR IS SUFFICIENT :THE #SPX'S SMI ERGODIC INDICATOR (2W).A BUY…,btc algorithmic buy amp sell signalsa single indicator is sufficient spx smi ergodic indicator 2wa buy,0.09331884980201721,0.8949835300445557,0.011697624810039997
2022-05-09,20:45,"Idk but some of these fellow giveaways are all the way cap 🧢 
🤔🤔🤔 

#cryptotrading #Giveaways #NFT #cashappinwild #Bitcoin",idk but some of these fellow giveaways are all the way cap cryptotrading giveaways nft cashappinwild bitcoin,0.08073630928993225,0.8969168066978455,0.022346921265125275
2022-05-09,20:45,Shit.. What should I buy ?? #crypto #bitcoin,shit what should i buy crypto bitcoin,0.03868585452437401,0.9367079138755798,0.02460622973740101
2022-05-09,20:45,"@Remi_Tetot No kidding… if I didn’t already understand and believe in #Bitcoin, the maxis would turn me off from BTC. Just a bunch of bird brains celebrating the dump of a project that has praised BTC and has accumulated billion of $ worth of BTC. Just pathetic.",remitetot no kidding if i didn not already understand and believe in bitcoin the maxis would turn me off from btc just a bunch of bird brains celebrating the dump of a project that has praised btc and has accumulated billion of worth of btc just pathetic,0.06627296656370163,0.8150630593299866,0.11866398900747299
2022-05-09,20:45,Here’s your chance to double down on #Bitcoin #Ethereum,heres your chance to double down on bitcoin ethereum,0.14088651537895203,0.8434489369392395,0.015664570033550262
2022-05-09,20:45,This is the end of #btc or just another correction?,this is the end of btc or just another correction,0.02208765223622322,0.6906213760375977,0.28729090094566345
2022-05-09,20:45,looks like it's confirmed that some sort of loan is taking place using the #btc as collateral. developing.,looks like it is confirmed that some sort of loan is taking place using the btc as collateral developing,0.09171119332313538,0.8880792260169983,0.020209534093737602
