Date,Time,Original tweet,Clean tweet,Positive,Neutral,Negative
2022-05-03,19:15,@gate_io Pitbulltoken will be the star token of 2022. Everyone will be talking about pitbulltoken. It is completely owned by the community and has reached 470 thousand investors. #bscpitbull #pitbulltoken #buypitbulltoken #btc #bitcoin,gateio pitbulltoken will be the star token of 2022 everyone will be talking about pitbulltoken it is completely owned by the community and has reached 470 thousand investors bscpitbull pitbulltoken buypitbulltoken btc bitcoin,0.09706573933362961,0.8940725326538086,0.008861728012561798
2022-05-03,19:15,@gate_io Read about @Pitbullwhitepaper you will find it very interesting! #pitbulltoken #bscpitbull #DeFi #pitbullcoin #Pit #PitMag #hodl #Metaverse #P2E #NFT #Bsc @BscPitbull $PIT #Bitcoin #btc,gateio read about pitbullwhitepaper you will find it very interesting pitbulltoken bscpitbull defi pitbullcoin pit pitmag hodl metaverse p2e nft bsc bscpitbull pit bitcoin btc,0.11065111309289932,0.879330039024353,0.010018913075327873
2022-05-03,19:15,"It takes time 🕓
 #eidmubarak #grupomusical #crypto #nfts #jimin #withyou #money #newprofilepic #marchagainstimportedgovt #melhordoc #butyou #eth #btsjimin #jungkook #nowplaying #nftcommunity #blackpink #jisoo #bitcoin #mentor #money #success #millionaire #mindset #business https://t.co/jCDU5mDlnU",it takes time eidmubarak grupomusical crypto nfts jimin withyou money newprofilepic marchagainstimportedgovt melhordoc butyou eth btsjimin jungkook nowplaying nftcommunity blackpink jisoo bitcoin mentor money success millionaire mindset business,0.09516185522079468,0.8902868628501892,0.014551229774951935
2022-05-03,19:15,"@maxybinks I love my #Kishininja, #Katsumi and my @BoredApeDojo. @kishimotoinu is anime.
The apes will be stakeable for #BTC soon 😁💵.
#Kishimoto is the motto
#Katsumi #Kishininjas #BoredApeDC #BADclub https://t.co/EDY7yY9xzS",maxybinks i love my kishininja katsumi and my boredapedojo kishimotoinu is anime the apes will be stakeable for btc soon kishimoto is the motto katsumi kishininjas boredapedc badclub,0.09531363099813461,0.8919058442115784,0.012780499644577503
2022-05-03,19:15,"@gate_io Have you heard of the Pitbull token? #BSC #BSCGems #PitbullToken #Pitbullish #PitbullTokenArmy #BuyPitbullToken #BuyPIT #PitbullMetaverse $PIT #Metaverse #P2E #NFT #Bsc #BTC #BNB Don't you think there are many reasons to buy, what are you waiting for @BscPitbull #Bitcoin #btc",gateio have you heard of the pitbull token bsc bscgems pitbulltoken pitbullish pitbulltokenarmy buypitbulltoken buypit pitbullmetaverse pit metaverse p2e nft bsc btc bnb do not you think there are many reasons to buy what are you waiting for bscpitbull bitcoin btc,0.039315953850746155,0.9405731558799744,0.020110884681344032
2022-05-03,19:15,@gate_io it's going to burn down soon @BscPitbull $PIT #Bitcoin #btc,gateio it is going to burn down soon bscpitbull pit bitcoin btc,0.03923546150326729,0.8417409062385559,0.11902368068695068
2022-05-03,19:15,"@Coryn_B @WomenUniteNFT I am blessed i am open to receive universe always works on my favour😍@womenuniteNFT
#WomenEmpowerment  #WomenEmpowerment #WomenInNFTs #cryptocurrency #BSCGems #ETH #Metaverse #NFTCommunity #nftphotography #cryptomeme #Bitcoin #Blockchain",corynb womenunitenft i am blessed i am open to receive universe always works on my favourwomenunitenft womenempowerment womenempowerment womeninnfts cryptocurrency bscgems eth metaverse nftcommunity nftphotography cryptomeme bitcoin blockchain,0.07797899842262268,0.9060073494911194,0.01601361110806465
2022-05-03,19:15,#Bitcoin is an arsenal for freedom.,bitcoin is an arsenal for freedom,0.048709411174058914,0.9311558604240417,0.020134786143898964
2022-05-03,19:15,"@MartiniGuyYT Best strategy I ever tooqk was buying a little bit every day and increasing the amount of those buys during dips into #bitcoin   is the best strategy of the past decade Following @bernie_Doranfx tweets, prediction and tips I have really learnt a lot about how Bitcoin works",martiniguyyt best strategy i ever tooqk was buying a little bit every day and increasing the amount of those buys during dips into bitcoin is the best strategy of the past decade following berniedoranfx tweets prediction and tips i have really learnt a lot about how bitcoin works,0.2835511267185211,0.7030916810035706,0.013357160612940788
2022-05-03,19:15,"@BscPitbull @gate_io Our target is 1 billion market value by the end of the year. %100 Safe Community Token %59 Burn Listed exchanges ; OKX, CoinEx, Bitrue, Digifinex, Bitget, Hotbit, MEXC, Latoken, Cointiger, ZT, Indoex Swap ; Pitswap, Pancakeswap, 1nchNetworkSwap 490+K Holders @BscPitbull #Bitcoin",bscpitbull gateio our target is 1 billion market value by the end of the year 100 safe community token 59 burn listed exchanges okx coinex bitrue digifinex bitget hotbit mexc latoken cointiger zt indoex swap pitswap pancakeswap 1nchnetworkswap 490k holders bscpitbull bitcoin,0.07252006977796555,0.9153817892074585,0.012098178267478943
2022-05-03,19:15,@gate_io #PITBULL LOOKS DAMN BULLISH #pitbulltoken #bscpitbull #DeFi #pitbullcoin #Pit #PitMag #hodl #Metaverse #P2E #NFT #Bsc @BscPitbull $PIT #Bitcoin #btc,gateio pitbull looks damn bullish pitbulltoken bscpitbull defi pitbullcoin pit pitmag hodl metaverse p2e nft bsc bscpitbull pit bitcoin btc,0.1392136514186859,0.8441637754440308,0.0166226327419281
2022-05-03,19:15,"@BscPitbull_TR @gate_io @BscPitbull Our target is 1 billion market value by the end of the year. %100 Safe Community Token %59 Burn Listed exchanges ; OKX, CoinEx, Bitrue, Digifinex, Bitget, Hotbit, MEXC, Latoken, Cointiger, ZT, Indoex Swap ; Pitswap, Pancakeswap, 1nchNetworkSwap 490+K Holders @BscPitbull #Bitcoin",bscpitbulltr gateio bscpitbull our target is 1 billion market value by the end of the year 100 safe community token 59 burn listed exchanges okx coinex bitrue digifinex bitget hotbit mexc latoken cointiger zt indoex swap pitswap pancakeswap 1nchnetworkswap 490k holders bscpitbull bitcoin,0.07861120253801346,0.9100115895271301,0.01137714646756649
2022-05-03,19:15,"@SenWarren is spot on about #RoeVWade - and with her logic on this major issue, she should also support #Bitcoin - it allows freedom from oppressive / abusive partners. Safety as an unbanked citizen. That’s where there’s contradiction in her ideology. Can’t be progressive on one.",senwarren is spot on about roevwade and with her logic on this major issue she should also support bitcoin it allows freedom from oppressive abusive partners safety as an unbanked citizen thats where theres contradiction in her ideology can not be progressive on one,0.16878998279571533,0.8098516464233398,0.02135837823152542
2022-05-03,19:15,"@gate_io We are not going to the moon, the moon is coming to us!#PitbullToken100x @BscPitbull $PIT #Bitcoin #btc",gateio we are not going to the moon the moon is coming to uspitbulltoken100x bscpitbull pit bitcoin btc,0.07497675716876984,0.9099882245063782,0.015035080723464489
2022-05-03,19:15,"@WatcherGuru The chances of #btc dumping are much higher it is 36k
34k last 32k",watcherguru the chances of btc dumping are much higher it is 36k 34k last 32k,0.809328556060791,0.08090973645448685,0.10976175218820572
2022-05-03,19:15,"@gate_io Our target is 1 billion market value by the end of the year. %100 Safe Community Token %59 Burn Listed exchanges ; OKX, CoinEx, Bitrue, Digifinex, Bitget, Hotbit, MEXC, Latoken, Cointiger, ZT, Indoex Swap ; Pitswap, Pancakeswap, 1nchNetworkSwap 490+K Holders @BscPitbull #Bitcoin",gateio our target is 1 billion market value by the end of the year 100 safe community token 59 burn listed exchanges okx coinex bitrue digifinex bitget hotbit mexc latoken cointiger zt indoex swap pitswap pancakeswap 1nchnetworkswap 490k holders bscpitbull bitcoin,0.07521896064281464,0.9118243455886841,0.012956664897501469
2022-05-03,19:15,@gate_io every day you will regret that you did not take it one day @BscPitbull #Bitcoin #btc,gateio every day you will regret that you did not take it one day bscpitbull bitcoin btc,0.05112859979271889,0.8931599259376526,0.05571143329143524
2022-05-03,19:15,"everything has a time, one day the room will come #Btc #Binance #BscPitbull @BscPitbull $PIT #Bitcoin #btc   $Pit #PitbullCrew",everything has a time one day the room will come btc binance bscpitbull bscpitbull pit bitcoin btc pit pitbullcrew,0.05280199274420738,0.9231391549110413,0.024058843031525612
2022-05-03,19:15,@gate_io We are growing fast💪🏻💪🏻🚀🚀🚀 #Bitcoin #PitbullCREW #PitbullTokenShibaKiller #Metaverse #P2E #NFT #Bsc #Bnb #BTC #BuyPitbullToken @BscPitbull #btc,gateio we are growing fast bitcoin pitbullcrew pitbulltokenshibakiller metaverse p2e nft bsc bnb btc buypitbulltoken bscpitbull btc,0.5404530167579651,0.44911330938339233,0.010433605872094631
2022-05-03,19:15,@gate_io The Rising and Shining Star of The Crypto World. #pit #PitbullToken #pitbulltoken1000x @BscPitbull #Bitcoin #btc,gateio the rising and shining star of the crypto world pit pitbulltoken pitbulltoken1000x bscpitbull bitcoin btc,0.15750518441200256,0.8323231339454651,0.010171630419790745
2022-05-03,19:15,"Life happens at the level of events not words, trust MOVEMENT.
#NFTSolana #NFTs #NFTColletions #NFTCollector #NFTCommunity #NFT #bitcoin #MetaverseNFT #art",life happens at the level of events not words trust movement nftsolana nfts nftcolletions nftcollector nftcommunity nft bitcoin metaversenft art,0.023332742974162102,0.9474859833717346,0.029181217774748802
2022-05-03,19:15,"The perception of #Bitcoin to follow S&amp;P 500 trend is being pushed into reality, and this is worrying for the revolutionary side of the crypto. In this case, we are talking about a decentralized entity of which destiny is centralized by an American institution. No good!",the perception of bitcoin to follow sp 500 trend is being pushed into reality and this is worrying for the revolutionary side of the crypto in this case we are talking about a decentralized entity of which destiny is centralized by an american institution no good,0.03500969335436821,0.8047558069229126,0.1602344661951065
2022-05-03,19:15,@gate_io Pitbull wants to be listed on the token @gate_io $PIT @BscPitbull #Bitcoin #btc,gateio pitbull wants to be listed on the token gateio pit bscpitbull bitcoin btc,0.04391571879386902,0.94460529088974,0.01147895772010088
2022-05-03,19:15,"@HManRiZZle Yep if I sat outside a casino and warned everyone they were gonna lose their money people would still go inside and I would look stupid 

Same with lottery tickets, strip club and other vices 

#Bitcoin is amazing but do what ever you want 

I’m a #FreedomMaxi",hmanrizzle yep if i sat outside a casino and warned everyone they were gonna lose their money people would still go inside and i would look stupid same with lottery tickets strip club and other vices bitcoin is amazing but do what ever you want im a freedommaxi,0.039813317358493805,0.9240754246711731,0.036111243069171906
2022-05-03,19:15,"@BscPitbull @gate_io If you're researching tokens, you don't need to research anymore. Because there is Pitbull Token. $PIT @BscPitbull #Bitcoin #btc",bscpitbull gateio if you are researching tokens you do not need to research anymore because there is pitbull token pit bscpitbull bitcoin btc,0.02948603220283985,0.9466968774795532,0.023817086592316628
2022-05-03,19:15,@cz_binance 3-Cz pre-sale coins #ata $5 - 0.30 cents #beta $5 - 0.30 cents and more and currently #bitcoin operation,czbinance 3cz presale coins ata 5 030 cents beta 5 030 cents and more and currently bitcoin operation,0.029848149046301842,0.9445890188217163,0.025562843307852745
2022-05-03,19:15,"@BscPitbull_TR @gate_io @BscPitbull If you're researching tokens, you don't need to research anymore. Because there is Pitbull Token. $PIT @BscPitbull #Bitcoin #btc",bscpitbulltr gateio bscpitbull if you are researching tokens you do not need to research anymore because there is pitbull token pit bscpitbull bitcoin btc,0.02847481518983841,0.9461731910705566,0.02535201609134674
2022-05-03,19:15,"JUST IN: 100,000 Cubans Are Using #Bitcoin In Response To U.S. Sanctions $BTC",just 100000 cubans are using bitcoin in response to us sanctions btc,0.06850029528141022,0.8901423215866089,0.04135734587907791
2022-05-03,19:15,"@JamalDR25 Following @10_BTC4 has been educative
$BTC immortality was not invented. lovers of the fiat system are leaving, there are fewer of them. new people and new era and new money is #cryptocurrency. old people are trying their best to stop it, TIME is on our side!!! #hodl #bitcoin",jamaldr25 following 10btc4 has been educative btc immortality was not invented lovers of the fiat system are leaving there are fewer of them new people and new era and new money is cryptocurrency old people are trying their best to stop it time is on our side hodl bitcoin,0.036409225314855576,0.8064011931419373,0.1571895331144333
2022-05-03,19:15,"@gate_io If you're researching tokens, you don't need to research anymore. Because there is Pitbull Token. $PIT @BscPitbull #Bitcoin #btc",gateio if you are researching tokens you do not need to research anymore because there is pitbull token pit bscpitbull bitcoin btc,0.029639581218361855,0.9449353814125061,0.025425048545002937
2022-05-03,19:15,"@BTC_Archive Crypto millionaires will be the greatest philanthropists the world have ever seen.
We know what it's like to have nothing. I'm still working a minimum wage job in discount store despite gaining heavily from crypto. Follow @bernie_Doranfx for guide on #Btc earning tips,&amp; tweets",btcarchive crypto millionaires will be the greatest philanthropists the world have ever seen we know what it is like to have nothing i am still working a minimum wage job in discount store despite gaining heavily from crypto follow berniedoranfx for guide on btc earning tips tweets,0.05486410856246948,0.9109057784080505,0.03423003852367401
2022-05-03,19:15,Current #Bitcoin Price is $37725 #BTC #Crypto,current bitcoin price is 37725 btc crypto,0.02269187942147255,0.9516723155975342,0.02563578449189663
2022-05-03,19:15,@gate_io Don't be late buy more $pit - #ForzaPitbull BscPitbull Our target is 1 billion market value by the end of the year. #PitbullCREW #PitbullTokenShibaKiller #Metaverse #P2E #NFT #Bsc #Bnb #BTC @BscPitbull $PIT #Bitcoin #btc,gateio do not be late buy more pit forzapitbull bscpitbull our target is 1 billion market value by the end of the year pitbullcrew pitbulltokenshibakiller metaverse p2e nft bsc bnb btc bscpitbull pit bitcoin btc,0.06332239508628845,0.924211859703064,0.01246577501296997
2022-05-03,19:15,"@MartiniGuyYT Crypto millionaires will be the greatest philanthropists the world have ever seen.
We know what it's like to have nothing. I'm still working a minimum wage job in discount store despite gaining heavily from crypto. Follow @bernie_Doranfx for guide on #Btc earning tips,&amp; tweets",martiniguyyt crypto millionaires will be the greatest philanthropists the world have ever seen we know what it is like to have nothing i am still working a minimum wage job in discount store despite gaining heavily from crypto follow berniedoranfx for guide on btc earning tips tweets,0.059017207473516464,0.9047932624816895,0.036189571022987366
2022-05-03,19:15,"THOUSANDS OF PEOPLE ARE SAYING THAT THE PITBUL TOKEN IS COMING TO BEAUTIFUL PLACES, SO IT WILL BE THERE. #Pitbull #pitbulltoken #pitbullish #pitbularmy @BscPitbull #Bitcoin #btc   $Pitbull #PitbullCrew",thousands of people are saying that the pitbul token is coming to beautiful places so it will be there pitbull pitbulltoken pitbullish pitbularmy bscpitbull bitcoin btc pitbull pitbullcrew,0.04577484726905823,0.9196041822433472,0.034620970487594604
2022-05-03,19:15,@BTCfuel So based on that structure we have options to see a new ATH in #bitcoin about 2024 right?,btcfuel so based on that structure we have options to see a new ath in bitcoin about 2024 right,0.16748468577861786,0.8240440487861633,0.008471224457025528
2022-05-03,19:15,@BscPitbull @gate_io Have you ever seen a token that makes 13x in 1 week? We saw =) $PIT @BscPitbull #Bitcoin #btc,bscpitbull gateio have you ever seen a token that makes 13x in 1 week we saw pit bscpitbull bitcoin btc,0.07385964691638947,0.9110561013221741,0.015084275044500828
2022-05-03,19:15,"🥇🥈🥉 Largest Crypto
📊 Current Prices 🎭

BTC-USD: #N/A
BTC-EUR: #N/A
ETH-USD: #N/A
ETH-EUR: #N/A
LTC-USD: #N/A
LTC-EUR: #N/A
XRP-USD: #N/A
XRP-EUR: #N/A

#BItcoin #ETH",largest crypto current prices na na na na na na na na bitcoin eth,0.03324667364358902,0.9458640217781067,0.02088930644094944
2022-05-03,19:15,@BscPitbull_TR @gate_io @BscPitbull Have you ever seen a token that makes 13x in 1 week? We saw =) $PIT @BscPitbull #Bitcoin #btc,bscpitbulltr gateio bscpitbull have you ever seen a token that makes 13x in 1 week we saw pit bscpitbull bitcoin btc,0.0613897368311882,0.9216864109039307,0.01692390628159046
2022-05-03,19:15,"#btc

Downside to 37200 - 37150
Then can expect a rise towards 40200

#novice #chartist #speculation",btc downside to 37200 37150 then can expect a rise towards 40200 novice chartist speculation,0.3060697615146637,0.15495140850543976,0.5389788746833801
2022-05-03,19:15,@gate_io #pitbulltoken is the best option for the future. #pitbulltoken #bscpitbull #DeFi #pitbullcoin #Pit #PitMag #hodl #Metaverse #P2E #NFT #Bsc @BscPitbull $PIT #Bitcoin #btc,gateio pitbulltoken is the best option for the future pitbulltoken bscpitbull defi pitbullcoin pit pitmag hodl metaverse p2e nft bsc bscpitbull pit bitcoin btc,0.12082452327013016,0.8706743717193604,0.00850114319473505
2022-05-03,19:15,Today #Bitcoin has decoupled from the stock market. There is still hope that it can pump during the depression.,today bitcoin has decoupled from the stock market there is still hope that it can pump during the depression,0.9201740026473999,0.060933325439691544,0.01889272965490818
2022-05-03,19:15,@gate_io #Pitbull Weekly Update for Community🚀 160K+ Twitter Followers 490K+ Holders ✅#NFT Release &amp; Auction ✅3 Exchanges Listing (P2P option) ✅Wallet Listing ⏳Brand-new Usecase ⏳New #NFT Series ⏳#PitMag Contest🏆 ⏳Partnership with a big community @bscPitbull #Bitcoin #btc,gateio pitbull weekly update for community 160k twitter followers 490k holders nft release auction 3 exchanges listing p2p option wallet listing brandnew usecase new nft series pitmag contest partnership with a big community bscpitbull bitcoin btc,0.15802522003650665,0.8333439826965332,0.008630840107798576
2022-05-03,19:15,"@dannylmasters Following @10_BTC4 has been educative
$BTC immortality was not invented. lovers of the fiat system are leaving, there are fewer of them. new people and new era and new money is #cryptocurrency. old people are trying their best to stop it, TIME is on our side!!! #hodl #bitcoin",dannylmasters following 10btc4 has been educative btc immortality was not invented lovers of the fiat system are leaving there are fewer of them new people and new era and new money is cryptocurrency old people are trying their best to stop it time is on our side hodl bitcoin,0.03486461564898491,0.8029414415359497,0.16219395399093628
2022-05-03,19:15,"@gate_io #pitbulltoken 490.000+ Holders $9.5M+ Liquidity burned 330Trillions $PIT Burn by Tx in 7Days 6 Usecases/Dapps in Ecosystem 9 Listed Global Exchanges 
@BscPitbull
 #Bitcoin #btc",gateio pitbulltoken 490000 holders 95m liquidity burned 330trillions pit burn by tx in 7days 6 usecasesdapps in ecosystem 9 listed global exchanges bscpitbull bitcoin btc,0.04560139775276184,0.9320634007453918,0.022335194051265717
2022-05-03,19:15,"it's not investment advice, but research this army @BscPitbull $PIT #Bitcoin #btc   Pitbullish #PitbullCrew",it is not investment advice but research this army bscpitbull pit bitcoin btc pitbullish pitbullcrew,0.026052501052618027,0.9437656402587891,0.03018188290297985
2022-05-03,19:15,@BscPitbull_TR @gate_io @BscPitbull looking for gems? BUY $PIT and buy more. @BscPitbull #Bitcoin #btc,bscpitbulltr gateio bscpitbull looking for gems buy pit and buy more bscpitbull bitcoin btc,0.08600782603025436,0.8969230055809021,0.017069129273295403
2022-05-03,19:15,"Name: LaceSupply: 50,000,000,000Symbol: LAC💰💰💰RULES:1⃣ FOLLOW 2⃣ RETWEET3⃣ COMMENT ERC20#AIRDROP #ICO #BITCOIN  #…",follow 2 retweet3 comment erc20airdrop ico bitcoin,0.03325516730546951,0.9422587156295776,0.02448609285056591
2022-05-03,19:15,@gate_io Have you ever seen a token that makes 13x in 1 week? We saw =) $PIT @BscPitbull #Bitcoin #btc,gateio have you ever seen a token that makes 13x in 1 week we saw pit bscpitbull bitcoin btc,0.09403441101312637,0.891607403755188,0.014358236454427242
2022-05-03,19:15,@gate_io Pitbull token steps into NFT and Metaverse projects 📢✍️🚀 @BscPitbull $PIT #Bitcoin #btc,gateio pitbull token steps into nft and metaverse projects bscpitbull pit bitcoin btc,0.1269955039024353,0.8644295930862427,0.008574947714805603
2022-05-03,19:15,Have you ever seen a token that makes 13x in 1 week? We saw =) $PIT @BscPitbull #Bitcoin #btc   $Pitbull #PitbullCrew,have you ever seen a token that makes 13x in 1 week we saw pit bscpitbull bitcoin btc pitbull pitbullcrew,0.05603095144033432,0.9235865473747253,0.02038249373435974
2022-05-03,19:15,@BscPitbull_TR @gate_io @BscPitbull #Pitbull Weekly Update for Community🚀 160K+ Twitter Followers 490K+ Holders ✅#NFT Release &amp; Auction ✅3 Exchanges Listing (P2P option) ✅Wallet Listing ⏳Brand-new Usecase ⏳New #NFT Series ⏳#PitMag Contest🏆 ⏳Partnership with a big community @bscPitbull #Bitcoin #btc,bscpitbulltr gateio bscpitbull pitbull weekly update for community 160k twitter followers 490k holders nft release auction 3 exchanges listing p2p option wallet listing brandnew usecase new nft series pitmag contest partnership with a big community bscpitbull bitcoin btc,0.11283956468105316,0.8770627379417419,0.010097692720592022
2022-05-03,19:15,@AltcoinGordon 90% won't exist...Bale out from #shitcoins and invest in #Bitcoin,altcoingordon 90 will not existbale out from shitcoins and invest in bitcoin,0.05175220966339111,0.9367295503616333,0.011518288403749466
2022-05-03,19:15,@lesha64maksimov @10_BTC4 I like Rebecca @10_BTC4 #btc $btc,lesha64maksimov 10btc4 i like rebecca 10btc4 btc btc,0.0878669023513794,0.8928098082542419,0.019323313608765602
2022-05-03,19:15,"Is it because i want to get rich quick from #Bitcoin that is why am bothered or should i buy and go after my life 🤔
#Crypto #BNB #Ethereum",is it because i want to get rich quick from bitcoin that is why am bothered or should i buy and go after my life crypto bnb ethereum,0.03597741201519966,0.9383884072303772,0.025634130463004112
2022-05-03,19:15,@BscPitbull_TR @gate_io @BscPitbull #pitbulltoken is the best option for the future. #pitbulltoken #bscpitbull #DeFi #pitbullcoin #Pit #PitMag #hodl #Metaverse #P2E #NFT #Bsc @BscPitbull $PIT #Bitcoin #btc,bscpitbulltr gateio bscpitbull pitbulltoken is the best option for the future pitbulltoken bscpitbull defi pitbullcoin pit pitmag hodl metaverse p2e nft bsc bscpitbull pit bitcoin btc,0.13282126188278198,0.8588168621063232,0.008361825719475746
2022-05-03,19:15,Pitbull token comment data looks very positive due to both the advantages it provides to its users and the fact that it is in the dog-named coins group. $PIT @BscPitbull #Bitcoin #btc   Pitbull #PitbullCrew,pitbull token comment data looks very positive due to both the advantages it provides to its users and the fact that it is in the dognamed coins group pit bscpitbull bitcoin btc pitbull pitbullcrew,0.6110680103302002,0.38091573119163513,0.008016236126422882
2022-05-03,19:15,@gate_io We are coming like a bomb with brand new news! @BscPitbull @gate_io $PIT #Bitcoin #btc,gateio we are coming like a bomb with brand new news bscpitbull gateio pit bitcoin btc,0.12274795770645142,0.8588177561759949,0.018434278666973114
2022-05-03,19:15,"Sell in May walk away.....Done
Going to sit this summer out #Bitcoin looks terrible right now as do #Altcoins 
Best bet to buy back in September, got to let the world sort out its shit 1st
Not spending summer looking at charts
Good Luck u all going to need it 🧲☠️",sell in may walk awaydone going to sit this summer out bitcoin looks terrible right now as do altcoins best bet to buy back in september got to let the world sort out its shit 1st not spending summer looking at charts good luck u all going to need it,0.03837299719452858,0.49728134274482727,0.46434566378593445
2022-05-03,19:15,Please #btc devs do something!!!,please btc devs do something,0.02932743914425373,0.9440619945526123,0.026610568165779114
2022-05-03,19:15,"#WorkQuest $WQT $WUSD #WorkNet #WorkQuestApp #blockchian #crypto #cryptolife #BTC #BNB #ETH #digitalization #digitalassets #saving #BinanceSmartChain
This is very nice project I love the project and idea. hope the project will be success",workquest wqt wusd worknet workquestapp blockchian crypto cryptolife btc bnb eth digitalization digitalassets saving binancesmartchain this is very nice project i love the project and idea hope the project will be success,0.6145658493041992,0.3757781684398651,0.009655963629484177
2022-05-03,19:15,"@BscPitbull_TR @gate_io @BscPitbull see pitbull tokens everywhere, don't you? good, now you will see more @BscPitbull $PIT #Bitcoin #btc
edited
15:36",bscpitbulltr gateio bscpitbull see pitbull tokens everywhere do not you good now you will see more bscpitbull pit bitcoin btc edited,0.07363229990005493,0.9088225960731506,0.0175450649112463
2022-05-03,19:15,"@PAW_digital 
Check this out guys
Massive pump in few months
#Bitcoin #BitTorrent #Solana #Elrond",pawdigital check this out guys massive pump in few months bitcoin bittorrent solana elrond,0.11400848627090454,0.8606299161911011,0.025361577048897743
