Date,Time,Original tweet,Clean tweet,Positive,Neutral,Negative
2022-05-13,8:15,"🔍 Search and access any Twitter space using our search engine! 🌍

https://t.co/h8htSgYQYs

#tezos
#Solana
#ethereum 
#bitcoin
#dogecoin
#SHIB
#NFTs
#FTM",search and access any twitter space using our search engine tezos solana ethereum bitcoin dogecoin shib nfts ftm,0.04031270742416382,0.9443327784538269,0.015354529023170471
2022-05-13,8:15,"Shanghai court affirms that Bitcoin is virtual property, subject to property rights 
 
A district court in Shanghai ruled on ... 
 https://t.co/jRgQS1uiDI 
 #Altcoins #Bitcoin #Coinyar.com https://t.co/kW0ivnyxFF",shanghai court affirms that bitcoin is virtual property subject to property rights a district court in shanghai ruled on altcoins bitcoin coinyarcom,0.19209100306034088,0.640572726726532,0.16733625531196594
2022-05-13,8:15,"Now When #Bitcoin (BTC) Price is Above $30,000, Has the Bear Market Ended or is it Just Another Dead Cat Bounce! https://t.co/ILQkCwi1Gi via @coinjupiter",now when bitcoin btc price is above 30000 has the bear market ended or is it just another dead cat bounce via coinjupiter,0.029058292508125305,0.5957953929901123,0.3751462996006012
2022-05-13,8:15,"I genuinely mean this, even if Bitcoin trades sideways range after it heads lower from here for 10 years, just keep stacking. Don't overcomplicate things. #Bitcoin and if you're new, look into using DCA approach. It helps psychologically.",i genuinely mean this even if bitcoin trades sideways range after it heads lower from here for 10 years just keep stacking do not overcomplicate things bitcoin and if you are new look into using dca approach it helps psychologically,0.25854846835136414,0.7101417779922485,0.031309787184000015
2022-05-13,8:15,"Join our whatsapp group for more updates
https://t.co/mbiztzkNk8
#trader #bitcoin #signalforex #crypto #forexanalysis #indices #forexmoney #indicessignals #cryptosignals #forexsupport #forexfundamentals #commoditiessignals #forexblog #binary #binarysignals #investments https://t.co/aIsoxGB92t",join our whatsapp group for more updates trader bitcoin signalforex crypto forexanalysis indices forexmoney indicessignals cryptosignals forexsupport forexfundamentals commoditiessignals forexblog binary binarysignals investments,0.035343147814273834,0.9401589035987854,0.024497948586940765
2022-05-13,8:15,"@ProBit_Exchange @7_6_2000_arafat 
@7Marcos1324 
@akter246276 

✅Complete your phone verification on #ProBitGlobal 📲

#cryptocurrencies #Bitcoin #cryptotrading
It is us who should be thanking you for the efforts to give back. So thank you and you are very much appreciated! 🙋🙇",probitexchange 762000arafat 7marcos1324 akter246276 complete your phone verification on probitglobal cryptocurrencies bitcoin cryptotrading it is us who should be thanking you for the efforts to give back so thank you and you are very much appreciated,0.6864359974861145,0.30342796444892883,0.010136066004633904
2022-05-13,8:15,"UAE's largest airline, Emirates, has announced plans to add #Bitcoin as a payment method.",uae largest airline emirates has announced plans to add bitcoin as a payment method,0.5398269295692444,0.4507300555706024,0.009442983195185661
2022-05-13,8:15,As long as #bitcoin still has a price-tag you should buy as much as you can.,as long as bitcoin still has a pricetag you should buy as much as you can,0.12158355116844177,0.866256058216095,0.012160374782979488
2022-05-13,8:15,"JUST IN: 🇦🇪 UAE's Emirates Airline, has announced plans to use #Bitcoin as a payment service.",just uae emirates airline has announced plans to use bitcoin as a payment service,0.6170986294746399,0.3748769760131836,0.008024314418435097
2022-05-13,8:15,"Still 99% sure we’ll see #Bitcoin at $26k before it’s major jump👍

Not closing my position till then

#Crypto",still 99 sure well see bitcoin at 26k before its major jump not closing my position till then crypto,0.25209325551986694,0.7234260439872742,0.0244806669652462
2022-05-13,8:15,@gzeon It's the bottom - MOON TIME #BTC,gzeon it is the bottom moon time btc,0.06354478001594543,0.8774709105491638,0.058984335511922836
2022-05-13,8:15,"Nietzsche knew...

""A casual stroll through the LUNATIC asylum shows that faith does not prove anything.""

~Friedrich Nietzsche

#Terra $Luna #crypto #cryptocurrency #bitcoin #btc $btc #ethereum $eth",nietzsche knew a casual stroll through the lunatic asylum shows that faith does not prove anything friedrich nietzsche terra luna crypto cryptocurrency bitcoin btc btc ethereum eth,0.04691581800580025,0.9293662905693054,0.02371792122721672
2022-05-13,8:15,"I was fast asleep but it looks like #BTC hit 26,900 and a huge flood of buys were triggered. I think it's a trap but won't be surprised if we hit 33,500.",i was fast asleep but it looks like btc hit 26900 and a huge flood of buys were triggered i think it is a trap but will not be surprised if we hit 33500,0.07504338026046753,0.8244674801826477,0.10048915445804596
2022-05-13,8:15,"So the first session I attended at the 2022 #bitcoin conference there was a certain dude talking about and shilling Luna to the audience, who booed him. Looks like another point for toxic #bitcoin maximalism.",so the first session i attended at the 2022 bitcoin conference there was a certain dude talking about and shilling luna to the audience who booed him looks like another point for toxic bitcoin maximalism,0.051592227071523666,0.8376976847648621,0.11071015894412994
2022-05-13,8:15,#Bitcoin maxi number go up! 👆👆👆👆👆👆,bitcoin maxi number go up,0.5010814666748047,0.45286035537719727,0.04605819657444954
2022-05-13,8:15,"@stablechen @terra_money Forget about the stable coin pls and focus on $Luna..
#Ethereum as a blockchain has no stable coin. Same with #bitcoin.
Why is #Terra's own different?
With just $Luna,the blockchain will acquire all it takes to outperform $Ether.. why becoming so greed and tyrant?",stablechen terramoney forget about the stable coin pls and focus on luna ethereum as a blockchain has no stable coin same with bitcoin why is terra own different with just lunathe blockchain will acquire all it takes to outperform ether why becoming so greed and tyrant,0.04389842599630356,0.9123066067695618,0.043795038014650345
2022-05-13,8:15,"If there was no #luna scam then for sure we would have fallen little more slowly than how it happened now. Since that story is finished, we will continue the downtrend in a few days &amp; will go down significantly from here. #BTC can go down below $20k sooner or later!",if there was no luna scam then for sure we would have fallen little more slowly than how it happened now since that story is finished we will continue the downtrend in a few days will go down significantly from here btc can go down below 20k sooner or later,0.013034341856837273,0.029982436448335648,0.9569832682609558
2022-05-13,8:15,"A great company headed by a team of specialists, the output of which will forever change the concept of cryptocurrency, I enjoy in this project. #SeasonalTokens #CryptoMining #CyclicalInvesting #BTC",a great company headed by a team of specialists the output of which will forever change the concept of cryptocurrency i enjoy in this project seasonaltokens cryptomining cyclicalinvesting btc,0.1921287626028061,0.7978991866111755,0.00997199397534132
2022-05-13,8:15,@apollo_river I hope you read and run to join this great community that is growing Paw a great family #paw #doge #shib #Bitcoin,apolloriver i hope you read and run to join this great community that is growing paw a great family paw doge shib bitcoin,0.31206369400024414,0.6779637932777405,0.009972499683499336
2022-05-13,8:15,@MeekMill Before that the hood should understand what Broke them…. Cant win their game@with their money 🥷💴#Bitcoin is on sale though,meekmill before that the hood should understand what broke them cant win their gamewith their money bitcoin is on sale though,0.06838838011026382,0.893200159072876,0.03841147944331169
2022-05-13,8:15,This great project has importance in the crypto market. This is a very good project and its team is working very hard on this project so that this project.#SeasonalTokens #CryptoMining #CyclicalInvesting #BTC,this great project has importance in the crypto market this is a very good project and its team is working very hard on this project so that this projectseasonaltokens cryptomining cyclicalinvesting btc,0.7858031392097473,0.2058958262205124,0.00830098520964384
2022-05-13,8:15,"Great team, great company, great job! I'm sure the company will show great results! Today there is a great urgency of development in this field.#SeasonalTokens #CryptoMining #CyclicalInvesting #BTC",great team great company great job i am sure the company will show great results today there is a great urgency of development in this fieldseasonaltokens cryptomining cyclicalinvesting btc,0.8612247109413147,0.1290445178747177,0.009730720892548561
2022-05-13,8:15,"I bought some $LUNA before the #downfall, not because to make profit but because to remind myself undispensable rules in #crypto market. They will exist in my #wallet forever. Take your lesson and move.

What did you learn from this downfall? #cryptocurrency #Lunacrash #Bitcoin",i bought some luna before the downfall not because to make profit but because to remind myself undispensable rules in crypto market they will exist in my wallet forever take your lesson and move what did you learn from this downfall cryptocurrency lunacrash bitcoin,0.04327068105340004,0.9261144995689392,0.03061479516327381
2022-05-13,8:15,This is a very cool and amazing project all the partners of this project are so hardworking and this team.I hope this project will achieve more success.#SeasonalTokens #CryptoMining #CyclicalInvesting #BTC,this is a very cool and amazing project all the partners of this project are so hardworking and this teami hope this project will achieve more successseasonaltokens cryptomining cyclicalinvesting btc,0.8402654528617859,0.1508331149816513,0.008901340886950493
2022-05-13,8:15,"1,201.53 #BTC ($36,385,250)
aggregated inflows to #Coinbase Pro",120153 btc 36385250 aggregated inflows to coinbase pro,0.042336396872997284,0.9284600019454956,0.029203681275248528
2022-05-13,8:15,@WazirXIndia @cz_binance @pushpendrakum @earnwithrk @ImZiaulHaque  If world top 10 coins do this type of cheat with innocent investor then what is the guarantee that #btc and #eth will not do  the same thing. Thats why govt trying to ban it to protect Investor.,wazirxindia czbinance pushpendrakum earnwithrk imziaulhaque if world top 10 coins do this type of cheat with innocent investor then what is the guarantee that btc and eth will not do the same thing thats why govt trying to ban it to protect investor,0.02845221757888794,0.7391684055328369,0.23237936198711395
2022-05-13,8:15,"@funnygameworld 
FunnyGameWorld great project this is. It is high demanding project with a lot of interesting things. This project is big it is maintained by an amazing talented project team. #FGW #FunnyGameWorld #bitcoin #cryptocurrency  #bounty #binance #eth #token #coinsbit",funnygameworld funnygameworld great project this is it is high demanding project with a lot of interesting things this project is big it is maintained by an amazing talented project team fgw funnygameworld bitcoin cryptocurrency bounty binance eth token coinsbit,0.13734756410121918,0.8531128168106079,0.009539651684463024
2022-05-13,8:15,"@TerraUSTLuna I want to marry a girl give me #BTC

bc1qlnrvzqqngyry3k9tjgju4hn5n539w2rzsnxdjl",terraustluna i want to marry a girl give me btc bc1qlnrvzqqngyry3k9tjgju4hn5n539w2rzsnxdjl,0.05756503343582153,0.9146678447723389,0.027767155319452286
2022-05-13,8:15,@sama #Bitcoin is here to stay!,sama bitcoin is here to stay,0.07289872318506241,0.9138262867927551,0.013275048695504665
2022-05-13,8:15,"Never buy #Bitcoin from phantom agencies or from uncertain and unverified channels. In 99.9% of cases, these are blatant scams or financial frauds.",never buy bitcoin from phantom agencies or from uncertain and unverified channels in 999 of cases these are blatant scams or financial frauds,0.021717796102166176,0.6335634589195251,0.34471872448921204
2022-05-13,8:15,"The $BTC all-time high is $68,990.

An 80% draw-down is $13,798. $27k is about halfway there.

This is #Bitcoin . Be prepared. ❄️",the btc alltime high is 68990 an 80 drawdown is 13798 27k is about halfway there this is bitcoin be prepared,0.05525700002908707,0.8982152342796326,0.046527765691280365
2022-05-13,8:15,"#Bitcoin #btc is trading at $30,000!",bitcoin btc is trading at 30000,0.024045245721936226,0.9457375407218933,0.030217139050364494
2022-05-13,8:15,"Breaking: The United Arab Emirates (UAE)’s 🇦🇪 leading airline, Emirates, will soon embrace ""#Bitcoin   as a payment service,” the company’s chief operating officer (COO) Adel Ahmed Al-Redha has said.

@ElonMansur @mannythehitman @kleingabriel",the united arab emirates uaes leading airline emirates will soon embrace bitcoin as a payment service the companys chief operating officer coo adel ahmed alredha has said elonmansur mannythehitman kleingabriel,0.5552324056625366,0.43594804406166077,0.00881955400109291
2022-05-13,8:15,"You are only waiting for 20k because you sold at a loss cmon get in

$btc #btc #Bitcoin",you are only waiting for 20k because you sold at a loss cmon get in btc btc bitcoin,0.039670512080192566,0.9361339211463928,0.024195555597543716
2022-05-13,8:15,"Ask any Child aged 10 to 16 Years Old
 
Would you rather use #Cryptos or #Dollars you will be shocked at the results.

Add Answers Below 
👇👇👇👇👇👇👇

#Crypto #bitcoin #dogecoin #CryptocurrencyNews #Cryptocrash",ask any child aged 10 to 16 years old would you rather use cryptos or dollars you will be shocked at the results add answers below crypto bitcoin dogecoin cryptocurrencynews cryptocrash,0.026222839951515198,0.9173087477684021,0.056468430906534195
2022-05-13,8:15,"@TheRyanLion We already have decentralized money, it's called #Bitcoin",theryanlion we already have decentralized money it is called bitcoin,0.05039486289024353,0.9323353171348572,0.017269831150770187
2022-05-13,8:15,@badsidehustles @mark_dow #bitcoin is juuuust fine mate,badsidehustles markdow bitcoin is juuuust fine mate,0.1973145455121994,0.7555559873580933,0.04712947830557823
2022-05-13,8:15,Did I tell you guys that our biggest whale bought some #Bitcoin  again yesterday…😂😂😂,did i tell you guys that our biggest whale bought some bitcoin again yesterday,0.08597802370786667,0.8836420774459839,0.030379904434084892
2022-05-13,8:15,FunnyGameWorld great project this is. It is high demanding project with a lot of interesting things. This project is big it is maintained by an amazing talented project team. #FGW #FunnyGameWorld #crypto #bitcoin #cryptocurrency #blockchain #bounty #binance #eth #token #coinsbit,funnygameworld great project this is it is high demanding project with a lot of interesting things this project is big it is maintained by an amazing talented project team fgw funnygameworld crypto bitcoin cryptocurrency blockchain bounty binance eth token coinsbit,0.13900531828403473,0.8515170812606812,0.00947759672999382
2022-05-13,8:15,Alpine F1 Team Fan Token (ALPINE) went up 24.6 percent in the last 30 minutes on Binance. #ALPINE  #crypto #bitcoin #cryptocurrency #btc #ethereum #blockchain #eth #trading #altcoin #binance #cryptonews,alpine f1 team fan token alpine went up 246 percent in the last 30 minutes on binance alpine crypto bitcoin cryptocurrency btc ethereum blockchain eth trading altcoin binance cryptonews,0.8682934045791626,0.11942613124847412,0.012280426919460297
2022-05-13,8:15,"🔻 🔻 🔻 $1,900,033 BTCUSDT SHORTED @$30,200.00 on #Binance (8:12:44 UTC) #BTC #cryptocurrency",1900033 btcusdt shorted 3020000 on binance utc btc cryptocurrency,0.03165176138281822,0.9385421276092529,0.02980605512857437
2022-05-13,8:15,For anybody that is in fear or doubt. I bought in at these prices last JUNE with 1.3k  and in 4 months was 110k up. Dips make you rich 🤑 #rich #money #Bitcoin #BitcoinCrash #ETH #Ethereum,for anybody that is in fear or doubt i bought in at these prices last june with 13k and in 4 months was 110k up dips make you rich rich money bitcoin bitcoincrash eth ethereum,0.05634799599647522,0.9210219383239746,0.022630024701356888
2022-05-13,8:15,Are we seeing a #Bitcoin reversal or dead cat bounce?,are we seeing a bitcoin reversal or dead cat bounce,0.040357086807489395,0.3552825152873993,0.6043604016304016
2022-05-13,8:15,"Hey... Pakistan, want a way out of your debt? #Bitcoin is what you're looking for.",hey pakistan want a way out of your debt bitcoin is what you are looking for,0.08621206134557724,0.899351954460144,0.014436054043471813
2022-05-13,8:15,"#Cryptocurrencies &amp; #DeFi have gone from a curiosity to a viable #investment, making them almost impossible to ignore.

#Blockchain #BNBChain #BNB #Crypto #BTC #ETH #Luna #terraluna #Terra",cryptocurrencies defi have gone from a curiosity to a viable investment making them almost impossible to ignore blockchain bnbchain bnb crypto btc eth luna terraluna terra,0.11248992383480072,0.866624653339386,0.02088537998497486
2022-05-13,8:15,A good trader should teach you the tools for trading. Not give predictions and claim its not fianacial advice. People looking for prediction looks for fianacial advice thats what predictions are for. To give financial advice. Something ive understood to late. #Bitcoin #btc #eth,a good trader should teach you the tools for trading not give predictions and claim its not fianacial advice people looking for prediction looks for fianacial advice thats what predictions are for to give financial advice something ive understood to late bitcoin btc eth,0.031201329082250595,0.9385746121406555,0.030224034562706947
2022-05-13,8:15,"Good Morning!

What are we buying today?

#BTC #ETH #BNB #altcoin #memecoin #Metaverse #m2e",good morning what are we buying today btc eth bnb altcoin memecoin metaverse m2e,0.11604412645101547,0.8728675246238708,0.011088293977081776
2022-05-13,8:15,#Crypto hedef 100.000 Usd #Bitcoin,crypto hedef 100000 usd bitcoin,0.027270620688796043,0.9385830163955688,0.03414635732769966
2022-05-13,8:15,@terra_money I guess you should try other stable currency coin or convert usd to other stable currency coin and may be it can save all of us . #COIN #TerraUSD #BTC #CryptocurrencyNews #altcoin,terramoney i guess you should try other stable currency coin or convert usd to other stable currency coin and may be it can save all of us coin terrausd btc cryptocurrencynews altcoin,0.1312810480594635,0.8572937250137329,0.011425182223320007
2022-05-13,8:15,"🔻 🔻 🔻 $2,487,151 BTCUSDT SHORTED @$30,200.00 on #Binance (8:12:18 UTC) #BTC #cryptocurrency",2487151 btcusdt shorted 3020000 on binance utc btc cryptocurrency,0.034034498035907745,0.936668872833252,0.029296671971678734
2022-05-13,8:15,"A historical event as big as Mt.Gox.
This is worse than 2008 Lehman Brothers collapse.

I am officially a graduate of the class of 2022. Will be stronger and better next cycle.
#luna #terra #bitcoin #mtgox",a historical event as big as mtgox this is worse than 2008 lehman brothers collapse i am officially a graduate of the class of 2022 will be stronger and better next cycle luna terra bitcoin mtgox,0.3185199797153473,0.6440647840499878,0.0374152734875679
2022-05-13,8:15,~25k was the bottom for #Bitcoin,25k was the bottom for bitcoin,0.035300955176353455,0.08525808900594711,0.8794409036636353
2022-05-13,8:15,#btc ? is not #bitcoin !,btc is not bitcoin,0.023014573380351067,0.9435102343559265,0.03347519040107727
2022-05-13,8:15,@davidmarcus welcome back and godspeed with your #Bitcoin lightning startup. If I may humbly share an advice… remember the why Bitcoin was put in the world and how you can help enable financial freedom to 8B people in the world,davidmarcus welcome back and godspeed with your bitcoin lightning startup if i may humbly share an advice remember the why bitcoin was put in the world and how you can help enable financial freedom to 8b people in the world,0.21295689046382904,0.7778583765029907,0.009184744209051132
2022-05-13,8:15,"This project contains a strong and promising team and the opportunity to make big profits from this project. 
#WorkQuest $WQT $WUSD #WorkNet #WorkQuestApp #blockchian #crypto #cryptolife #BTC #BNB #ETH #digitalization #digitalassets #saving #BinanceSmartChain",this project contains a strong and promising team and the opportunity to make big profits from this project workquest wqt wusd worknet workquestapp blockchian crypto cryptolife btc bnb eth digitalization digitalassets saving binancesmartchain,0.5596750378608704,0.43226808309555054,0.00805682223290205
2022-05-13,8:15,"What will be the next support level for #BTC ?

26k ?            20k ?          14k ?",what will be the next support level for btc 26k 20k 14k,0.037325069308280945,0.9437593817710876,0.018915560096502304
2022-05-13,8:15,"@ProBit_Exchange @Bamchi52 
@akter246276 
@ZionZion0042 

Thank you for giving..
We appreciate and always here to support 💪.
✅Complete your phone verification on #ProBitGlobal 📲

#cryptocurrencies #Bitcoin #cryptotrading",probitexchange bamchi52 akter246276 zionzion0042 thank you for giving we appreciate and always here to support complete your phone verification on probitglobal cryptocurrencies bitcoin cryptotrading,0.3109288215637207,0.6801198720932007,0.008951349183917046
2022-05-13,8:15,The experience of ADA and LUNA operations proves that there is nothing good for long term ! Except #Etherum and #btc,the experience of ada and luna operations proves that there is nothing good for long term except etherum and btc,0.6530879735946655,0.3379243314266205,0.008987738750874996
2022-05-13,8:15,"LUNA PUMPING 🚀🚀💯💯💯💯

$aave #xrp $gt $ink #miota $poly #btc #xrp",luna pumping aave xrp gt ink miota poly btc xrp,0.06018228083848953,0.9243398904800415,0.015477882698178291
2022-05-13,8:15,"Pump Season
#bitcoin #doge #crypto",pump season bitcoin doge crypto,0.041247133165597916,0.9308635592460632,0.027889350429177284
2022-05-13,8:15,"contracted into a glen, allowed room only for the stream, and a narrow walk amidst the rough coppic #Bitcoin",contracted into a glen allowed room only for the stream and a narrow walk amidst the rough coppic bitcoin,0.04077719524502754,0.9288169145584106,0.03040587529540062
2022-05-13,8:15,"I believe that investing in the ICO - this is the best investment! The project worthwhile, it is clear that a young competent team tried to do everything perfectly! I recommend to invest in this project!  !! #Helios #mining  #Fintech #Insuetech #Crypto #Bitcoin",i believe that investing in the ico this is the best investment the project worthwhile it is clear that a young competent team tried to do everything perfectly i recommend to invest in this project helios mining fintech insuetech crypto bitcoin,0.35332414507865906,0.6378003358840942,0.008875512517988682
2022-05-13,8:15,Current #Bitcoin Price is $30256 #BTC #Crypto,current bitcoin price is 30256 btc crypto,0.022982733324170113,0.9515634775161743,0.025453776121139526
2022-05-13,8:15,"#LUNA Fundación showed us that if you destroy the #Bitcoin  reserves, you will go bankrupt. #HODL #BITCOIN",luna fundación showed us that if you destroy the bitcoin reserves you will go bankrupt hodl bitcoin,0.023635173216462135,0.3277229368686676,0.6486418843269348
2022-05-13,8:15,@hiRavenCrypto #BTC is fast buy,hiravencrypto btc is fast buy,0.5777468681335449,0.40108636021614075,0.021166840568184853
2022-05-13,8:15,@JamesMelville @JamesMelville even if you are sceptical of #Bitcoin there is always #XMR,jamesmelville jamesmelville even if you are sceptical of bitcoin there is always xmr,0.033080533146858215,0.9230332970619202,0.04388618469238281
2022-05-13,8:15,@hendry_hugh But I like #btc,hendryhugh but i like btc,0.07425318658351898,0.9003422856330872,0.025404512882232666
2022-05-13,8:15,Good morning #Crypto twitter #Btc #Altcoins,good morning crypto twitter btc altcoins,0.05524349957704544,0.9269278645515442,0.01782860979437828
2022-05-13,8:15,"Anc token delist ⚠️
#binance #huobi #Phemex
#coinbase #Bitcoin

#ANC  $anc",anc token delist binance huobi phemex coinbase bitcoin anc anc,0.028861677274107933,0.9420140981674194,0.02912420965731144
2022-05-13,8:15,"#Bitcoin 📈 

▓▓▓▓▓░░░░░░░░░░ 31%

price:$30184.11      eth/btc: 0.07",bitcoin 31 007,0.030829837545752525,0.9301158785820007,0.0390542708337307
2022-05-13,8:15,@Frances_Coppola @FrenziedLunatik time to clean your twitter friend list and keep #bitcoin only people. Plebs and people with commits on the github.,francescoppola frenziedlunatik time to clean your twitter friend list and keep bitcoin only people plebs and people with commits on the github,0.032228704541921616,0.9298087358474731,0.03796250373125076
2022-05-13,8:15,"This is the question now?
W or V?
if W we will see 23.000 probably...
İf V we will see 34.500 and go on climbing...
Which one you prefer?
#BTC #ETH #Metaverse #AVAX 
#lunacoin",this is the question now w or v if w we will see 23000 probably if v we will see 34500 and go on climbing which one you prefer btc eth metaverse avax lunacoin,0.03245154768228531,0.94404536485672,0.02350308559834957
2022-05-13,8:15,"🔔Price updates for different #crypto assets that get price predictions on 🦥SlothTrading:

#BTC: $30,255.71
#AVA: $0.6900
#BNB: $299.10
#ADA: $0.5737
#DOGE: $0.0913

💥New predictions every hour",price updates for different crypto assets that get price predictions on 3025571 06900 29910 05737 00913 new predictions every hour,0.02651723101735115,0.9378461241722107,0.03563661128282547
