Date,Time,Original tweet,Clean tweet,Positive,Neutral,Negative
2022-04-26,17:45,"@rovercrc That's not a #BTC pump you're smelling, it's your fear of losing money",rovercrc that is not a btc pump you are smelling it is your fear of losing money,0.042330801486968994,0.7914148569107056,0.16625434160232544
2022-04-26,17:45,"🔥Mexico has just placed its first official Bitcoin ATM inside the Senate building.

#BTC",mexico has just placed its first official bitcoin atm inside the senate building btc,0.11223104596138,0.8780454397201538,0.00972353108227253
2022-04-26,17:45,"I love it when #bitcoin is down because I can just acquire more of it. My personal interest is that it keeps going down (it won't). 

Why?

My time preference is 10 years. I believe 10 years from now, I won't care what price I bought it at and just be thankful I bought it!",i love it when bitcoin is down because i can just acquire more of it my personal interest is that it keeps going down it won t why my time preference is 10 years i believe 10 years from now i will not care what price i bought it at and just be thankful i bought it,0.04235498607158661,0.9152178764343262,0.04242711886763573
2022-04-26,17:45,"💥BREAKING: Fort Worth, Texas, becomes the first U.S. city government to mine #Bitcoin  

😱",fort worth texas becomes the first us city government to mine bitcoin,0.26997110247612,0.7196322679519653,0.010396582074463367
2022-04-26,17:45,💥BREAKING: The first #Bitcoin ATM in Mexico has been installed  inside the Senate. #Btc is the future,the first bitcoin atm in mexico has been installed inside the senate btc is the future,0.1081928014755249,0.8826805949211121,0.009126612916588783
2022-04-26,17:45,"This combination of seasonal supply and seasonal demand provides the pressure on the prices of the tokens relative to each other that makes them increase in a predictable sequence.
#SeasonalTokens #CryptoMining #CyclicalInvesting #BTC",this combination of seasonal supply and seasonal demand provides the pressure on the prices of the tokens relative to each other that makes them increase in a predictable sequence seasonaltokens cryptomining cyclicalinvesting btc,0.09402415156364441,0.8718996047973633,0.034076206386089325
2022-04-26,17:45,We are going to pump the next crypto soon. Join us on telegram for announcement. Link in profile desc. #CAKE. #cryptopump #btc #coinpump #USDT #BNBcoins #Eth,we are going to pump the next crypto soon join us on telegram for announcement link in profile desc cake cryptopump btc coinpump usdt bnbcoins eth,0.06812025606632233,0.9203916788101196,0.011488066054880619
2022-04-26,17:45,Not a bull but cow #btc 😁,not a bull but cow btc,0.03999267891049385,0.9337888360023499,0.026218529790639877
2022-04-26,17:45,"@Cointelegraph What is your opinion about the current #Bitcoin state, since its Fear and Greed Index is 41 - MILD FEAR, with price of 38671.195256250348 usd? Our analytical team has done extended research regarding #BTC, but we want to hear your opinion also.",cointelegraph what is your opinion about the current bitcoin state since its fear and greed index is 41 mild fear with price of 38671195256250348 usd our analytical team has done extended research regarding btc but we want to hear your opinion also,0.056333452463150024,0.9254346489906311,0.018231870606541634
2022-04-26,17:45,"#BTC #Bitcoin price $38275
2022-04-26 20:37",btc bitcoin price 38275 20220426,0.03982202336192131,0.930018424987793,0.030159590765833855
2022-04-26,17:45,"Optimism airdrop coming soon check if you are eligible it’s now live ,what do we think about layer 2 projects ? #Bitcoin",optimism airdrop coming soon check if you are eligible its now live what do we think about layer 2 projects bitcoin,0.04205461964011192,0.9408242106437683,0.01712113618850708
2022-04-26,17:45,"@jerryxfeng It's a two way thing:
(1) With little or no knowledge about #Bitcoin = THE MORE YOU LOOK THE LESS YOU SEE.
(2) With proper knowledge about #Bitcoin = THE LESS YOU LOOK THE MORE YOU SEE. 

Knowledge is the Key 🔑 #BITCOIN",jerryxfeng it is a two way 1 with little or no knowledge about bitcoin the more you look the less you see 2 with proper knowledge about bitcoin the less you look the more you see knowledge is the key bitcoin,0.02376527711749077,0.8370429873466492,0.13919176161289215
2022-04-26,17:45,"Crypto is becoming a conversation that people are talking about, and @cmesi is here to talk about how it affects the future of money.

#Cryptocurrency #Crypto #Bitcoin #CBILaunch",crypto is becoming a conversation that people are talking about and cmesi is here to talk about how it affects the future of money cryptocurrency crypto bitcoin cbilaunch,0.06459520757198334,0.921413779258728,0.013991089537739754
2022-04-26,17:45,You can have money and still not feel rich it's the #CNFTcommunity #Bitcoin that makes me feel rich 🤑,you can have money and still not feel rich it is the cnftcommunity bitcoin that makes me feel rich,0.06723236292600632,0.9081950187683105,0.024572543799877167
2022-04-26,17:45,"I hope this project will achieve more success. happy to see the achievements and results of this excellent project.Don’t miss this project. It's future bright
#FGW #FunnyGameWorld #crypto #bitcoin #cryptocurrency #blockchain #bounty #binance #eth #token #coinsbit
@funnygameworld",i hope this project will achieve more success happy to see the achievements and results of this excellent projectdon not miss this project it is future bright fgw funnygameworld crypto bitcoin cryptocurrency blockchain bounty binance eth token coinsbit funnygameworld,0.15791450440883636,0.8307046294212341,0.011380837298929691
2022-04-26,17:45,"It always seems impossible, until it is done.
#quote #twittersold #ElonMusk #dogecoin #Bitcoin #BTC #ETH #Ethereum #trading #NFTartist #NFT #Mindset #Success #Space #alternance #lifestyle #goals #Motivation #free #FreeSpeech #USA #America #France #Qatar2022 #LaReunion",it always seems impossible until it is done quote twittersold elonmusk dogecoin bitcoin btc eth ethereum trading nftartist nft mindset success space alternance lifestyle goals motivation free freespeech usa america france qatar2022 lareunion,0.05475841462612152,0.9221494197845459,0.023092197254300117
2022-04-26,17:45,"@WatcherGuru @IndiraKempis For education purposes, there are no #bitcoin ATMs working in México yet, there is no legislation for it.",watcherguru indirakempis for education purposes there are no bitcoin atms working in méxico yet there is no legislation for it,0.03168093040585518,0.94316166639328,0.02515742927789688
2022-04-26,17:45,"@hernanlafalce Thank you for the chance @hernanlafalce ☺️
Notification on 
#BNB #BSC #NFT #NFTCommunity #NFT #BSCGems #Solana #BTC  #Ethereum #cryptocurrency #Airdrop #Giveaway",hernanlafalce thank you for the chance hernanlafalce notification on bnb bsc nft nftcommunity nft bscgems solana btc ethereum cryptocurrency airdrop giveaway,0.18527556955814362,0.8042448163032532,0.010479580610990524
2022-04-26,17:45,If you try to think rationally about news on #bitcoin you will get disappointed 99% of the time. Crypto moves irrationally in the short term. Only longterm makes sense in investing. Always!!! Everything else is just luck,if you try to think rationally about news on bitcoin you will get disappointed 99 of the time crypto moves irrationally in the short term only longterm makes sense in investing always everything else is just luck,0.024757610633969307,0.6189149022102356,0.35632744431495667
2022-04-26,17:45,#BTC you are annoying us at the moment,btc you are annoying us at the moment,0.034963272511959076,0.20338702201843262,0.7616497874259949
2022-04-26,17:45,@TheCryptoLark I've been hodling #bitcoin and #sand ✌🏻🧜🏻‍♀️🧚‍♂️,thecryptolark i have been hodling bitcoin and sand,0.05209118500351906,0.9252253174781799,0.022683516144752502
2022-04-26,17:45,"@aantonop THEY ALWAYS WOULD NEED BANK ACCOUNT TO FIRST INTERACT/AQUIRE #BITCOIN AS THERE IS NOT P2P BUSINESS IN THEIR TOWN ...

WHAT OTHER SOLUTIONS THEY HAVE TO START TO INTERACT ?!",aantonop they always would need bank account to first interactaquire bitcoin as there is not p2p business in their town what other solutions they have to start to interact,0.04972965642809868,0.930281937122345,0.01998836174607277
2022-04-26,17:45,@Thymeless_Trvl Meanwhile NY is on a path to ban #Bitcoin mining for minimum of two years.,thymelesstrvl meanwhile ny is on a path to ban bitcoin mining for minimum of two years,0.05459918454289436,0.6742517352104187,0.2711490988731384
2022-04-26,17:45,Elon Maybe selling his entire BTC portfolio to Buy Twitter #btc #twitter #becareful be careful sudden drop may come.,elon maybe selling his entire btc portfolio to buy twitter btc twitter becareful be careful sudden drop may come,0.0340886190533638,0.8763269186019897,0.08958443999290466
2022-04-26,17:45,"@saylor @crypto_birb @Twitter Sir, for the sake of mi familia 😂 stop tweeting until #BTC goes beyond 50K",saylor cryptobirb twitter sir for the sake of mi familia stop tweeting until btc goes beyond 50k,0.03615402802824974,0.9018609523773193,0.06198500096797943
2022-04-26,17:45,Current #Bitcoin Price is $38278 #BTC #Crypto,current bitcoin price is 38278 btc crypto,0.021416479721665382,0.9489690065383911,0.029614470899105072
2022-04-26,17:45,"It goes from being the cheapest to produce, to being the most expensive. Then it goes from being the least valuable for farming, to being the most valuable.
#SeasonalTokens #CryptoMining #CyclicalInvesting #BTC",it goes from being the cheapest to produce to being the most expensive then it goes from being the least valuable for farming to being the most valuable seasonaltokens cryptomining cyclicalinvesting btc,0.2658403217792511,0.7217234969139099,0.012436249293386936
2022-04-26,17:45,"Capitulation when u got no money left or u lost everything tryna to make some bucks
It's coming. #BTC 10k",capitulation when u got no money left or u lost everything tryna to make some bucks it is coming btc 10k,0.051761072129011154,0.9051021337509155,0.043136756867170334
2022-04-26,17:45,@michaeljburry When #bitcoin,michaeljburry when bitcoin,0.040522243827581406,0.8138361573219299,0.14564165472984314
2022-04-26,17:45,"#Bullish - #Fidelity Investments will allow investors to put #btc  in their 401(k) accounts later this year - accelerates mainstream adoption - 20,000+ companies use Fidelity to administer retirement accounts. Fidelity are the first major retirement-plan provider to do this.",bullish fidelity investments will allow investors to put btc in their 401k accounts later this year accelerates mainstream adoption 20000 companies use fidelity to administer retirement accounts fidelity are the first major retirementplan provider to do this,0.1769927591085434,0.8146058917045593,0.008401365019381046
2022-04-26,17:45,"@BitcoinMagazine What do you think about the current #Bitcoin state, since its Fear and Greed Index is 41 - MILD FEAR at the moment, with price of 38671.731999608212 usd? Our analytical team has done a detailed analysis regarding #BTC, but we want to hear your opinion too.",bitcoinmagazine what do you think about the current bitcoin state since its fear and greed index is 41 mild fear at the moment with price of 38671731999608212 usd our analytical team has done a detailed analysis regarding btc but we want to hear your opinion too,0.05341148376464844,0.9226956367492676,0.023892924189567566
2022-04-26,17:45,#BITCOIN GOING HELL Guys,bitcoin going hell guys,0.022871240973472595,0.21179050207138062,0.7653381824493408
2022-04-26,17:45,"It can be said that #crypto has now made its way into the mainstream. #Bitcoin which used to only exist on a small part of the internet is now one of the most popular investment assets. As the years have gone by, other crypto besides bitcoin have made their way to the forefront.",it can be said that crypto has now made its way into the mainstream bitcoin which used to only exist on a small part of the internet is now one of the most popular investment assets as the years have gone by other crypto besides bitcoin have made their way to the forefront,0.21637439727783203,0.7746272087097168,0.008998343721032143
2022-04-26,17:45,"Since 2015 #Bitcoin  never had more than 4 red weekly candles in a row. Is this going to be the exception and have 5 red candles una row or are we closing this weekly candle green?? 

$BTC $ETH $FTM $AVAX $LUNA $SOL $BOSON $ADA",since 2015 bitcoin never had more than 4 red weekly candles in a row is this going to be the exception and have 5 red candles una row or are we closing this weekly candle green btc eth ftm avax luna sol boson ada,0.03898505121469498,0.9378589391708374,0.023155972361564636
2022-04-26,17:45,"Buy the token that you expect to soon become the most expensive of the four, and then sell it a few weeks later when there is expected farming demand.
#SeasonalTokens #CryptoMining #CyclicalInvesting #BTC",buy the token that you expect to soon become the most expensive of the four and then sell it a few weeks later when there is expected farming demand seasonaltokens cryptomining cyclicalinvesting btc,0.12165455520153046,0.8603850603103638,0.0179604422301054
2022-04-26,17:45,@gladstein On the same day as the Chanoybol meltdown. Maybe Satoshi was hoping #bitcoin would cause a meltdown in the current monetary and financial system?,gladstein on the same day as the chanoybol meltdown maybe satoshi was hoping bitcoin would cause a meltdown in the current monetary and financial system,0.020036844536662102,0.08096209913492203,0.8990011215209961
2022-04-26,17:45,"Alright Elon now please bring back @derose.

#bitcoinuncensored @DeRoseClips #Bitcoin",alright elon now please bring back derose bitcoinuncensored deroseclips bitcoin,0.02318229340016842,0.941914975643158,0.034902725368738174
2022-04-26,17:45,Who's buying the dip? #BTC,who is buying the dip btc,0.03059449978172779,0.9381796717643738,0.031225748360157013
2022-04-26,17:45,"I Hope that the price continue to drop 

So i can maximize my position! #Bitcoin",i hope that the price continue to drop so i can maximize my position bitcoin,0.7937889099121094,0.10868397355079651,0.09752711653709412
2022-04-26,17:45,@CryptosR_Us @elonmusk sell #Bitcoin for buying Twitter🤷🏼‍♂️,cryptosrus elonmusk sell bitcoin for buying twitter,0.04622302204370499,0.9360212087631226,0.01775580272078514
2022-04-26,17:45,@coinbureau @coinbureau #Bitcoin  keep supporting,coinbureau coinbureau bitcoin keep supporting,0.05429818481206894,0.889427125453949,0.05627468600869179
2022-04-26,17:45,"Fox Business chyron:

""#bitcoin under pressure after Elon Musk agrees to buy Twitter""

WTF does that have to do with #bitcoin? 🤡

@FoxBusiness 
@TeamCavuto",fox business bitcoin under pressure after elon musk agrees to buy twitter wtf does that have to do with bitcoin foxbusiness teamcavuto,0.02543182484805584,0.364104300737381,0.6104639172554016
2022-04-26,17:45,@mayemusk can you tell your son to pump bitcoin #BTC please ma'am,mayemusk can you tell your son to pump bitcoin btc please madam,0.055356498807668686,0.9298566579818726,0.014786815270781517
2022-04-26,17:45,"Trade tokens for more tokens every time there is a big price difference, or when the price changes because of the new season coming.
#SeasonalTokens #CryptoMining #CyclicalInvesting #BTC",trade tokens for more tokens every time there is a big price difference or when the price changes because of the new season coming seasonaltokens cryptomining cyclicalinvesting btc,0.04802021384239197,0.7695844173431396,0.18239536881446838
2022-04-26,17:45,"-Dead Cat Bounces Confirmed ✅

-Now keep chasing the hare

#Bitcoin #alts $Stocks",dead cat bounces confirmed now keep chasing the hare bitcoin alts stocks,0.13081805408000946,0.7519721984863281,0.11720971018075943
2022-04-26,17:45,@WhaleTrades #Bitcoin GOING HELL,whaletrades bitcoin going hell,0.15760847926139832,0.8048949837684631,0.037496574223041534
2022-04-26,17:45,It’s important to focus on how we can strengthen international trade. #NFTCommunity #nftart #NFTdrops #NFTartists #NFTGame @BoredApeYC @MeekMill @Coinbase_NFT @TheBinanceNFT #bitcoin,its important to focus on how we can strengthen international trade nftcommunity nftart nftdrops nftartists nftgame boredapeyc meekmill coinbasenft thebinancenft bitcoin,0.30823126435279846,0.6833420395851135,0.008426675572991371
2022-04-26,17:45,@SGBarbour Infinite fiat is not infinite--and I think most #Bitcoin devs know this,sgbarbour infinite fiat is not infiniteand i think most bitcoin devs know this,0.04677920043468475,0.9313104152679443,0.02191043272614479
2022-04-26,17:45,"If you always trade tokens for more tokens of a different type, the total number of tokens in your investment will increase with every trade.
#SeasonalTokens #CryptoMining #CyclicalInvesting #BTC",if you always trade tokens for more tokens of a different type the total number of tokens in your investment will increase with every trade seasonaltokens cryptomining cyclicalinvesting btc,0.19772744178771973,0.7873953580856323,0.014877228066325188
2022-04-26,17:45,"Tommorow is one surprise for You guy's 😊

#DNP is Ready to Goo Moon 🌝...

✅ Guess the surprise ??👇🤭🤔

#FutureDonationisDNP #cryptocurrency #ElonMusk #ElonMuskBuyTwitter #Bitcoin #Airdrop #Crypto #CrazyLove #Bitcoin #BNB #BSC",tommorow is one surprise for you guy dnp is ready to goo moon guess the surprise futuredonationisdnp cryptocurrency elonmusk elonmuskbuytwitter bitcoin airdrop crypto crazylove bitcoin bnb bsc,0.08317577093839645,0.9034773111343384,0.013346906751394272
2022-04-26,17:45,"@kubi_lay34 @Ripple I joined this giveaway because I like your project, I hope this project will always be successful 

@DXMBU 
@mariobros057 
@agnesnatasya123 

#Giveaway #Ripple #Airdrop #Doge  #ADA #SHIB #Omnichain #Avax #SOL #solana #cryptocurrency #EOS #ApE #XRP #bnb #btc #eth #GMT",kubilay34 ripple i joined this giveaway because i like your project i hope this project will always be successful dxmbu mariobros057 agnesnatasya123 giveaway ripple airdrop doge ada shib omnichain avax sol solana cryptocurrency eos ape xrp bnb btc eth gmt,0.48971277475357056,0.49870771169662476,0.011579498648643494
2022-04-26,17:45,"@Dennis_Porter_ For #bitcoin to reach $1M it would need to have a market cap of approx $25 trillion---so yeah, that's not gonna happen buddy (atleast in your lifetime.)",dennisporter for bitcoin to reach 1m it would need to have a market cap of approx 25 trillionso yeah that is not gonna happen buddy atleast in your lifetime,0.12348905205726624,0.8538406491279602,0.02267024666070938
2022-04-26,17:45,@Davincij15 Take out a loan against my Bitcoin to buy more #bitcoin,davincij15 take out a loan against my bitcoin to buy more bitcoin,0.2844407260417938,0.704893171787262,0.010666127316653728
2022-04-26,17:45,💥MicroStrategy will offer  #Bitcoin to staff as an option for their 401K retirement savings account.,microstrategy will offer bitcoin to staff as an option for their 401k retirement savings account,0.1530907154083252,0.8379055857658386,0.00900367833673954
2022-04-26,17:45,"All you Twitter people, go to #Distrikt and #DSCVR social networks that are on the Internet computer #icp blockchain. These networks will be decentralized and hand over decision making rights to users. These nets will never be owned by one person. #ADA #ETH #BTC #LUNA #Solana",all you twitter people go to distrikt and dscvr social networks that are on the internet computer icp blockchain these networks will be decentralized and hand over decision making rights to users these nets will never be owned by one person ada eth btc luna solana,0.025228293612599373,0.9523851275444031,0.022386601194739342
2022-04-26,17:45,@OniiEth She doesn't know that she could earn much more by choosing #BTC 👀,oniieth she does not know that she could earn much more by choosing btc,0.11189833283424377,0.8702791929244995,0.017822517082095146
2022-04-26,17:45,"Guess I'm not eating out this month. Bought the dip!

#bitcoin",guess i am not eating out this month bought the dip bitcoin,0.0705956220626831,0.8847848773002625,0.04461956396698952
2022-04-26,17:45,"#Bitcoin is primed: negative earnings this afternoon and expect a big drop to retest range lows at 37k, then 35.5k.",bitcoin is negative earnings this afternoon and expect a big drop to retest range lows at 37k then 355k,0.01015735138207674,0.01707100309431553,0.9727716445922852
2022-04-26,17:45,This is the best quality project that is currently running in the market. I trust in this project and it will prove to be very powerfully nearest future. @Alice_in_Crypto #aliceincrypto #NFT #aliceNFT #Airdrop #bountycampaign #bitcoin #defi #Crypto #BSCGem #BSCGemsAlert #web3,this is the best quality project that is currently running in the market i trust in this project and it will prove to be very powerfully nearest future aliceincrypto aliceincrypto nft alicenft airdrop bountycampaign bitcoin defi crypto bscgem bscgemsalert web3,0.7597332000732422,0.23350083827972412,0.006765872705727816
2022-04-26,17:45,"@AltcoinGordon If what u said corresponds to this video, call it lucky 🍀 for not crushing its head, at least we have a chance to buy the dip . #Bitcoin is King",altcoingordon if what u said corresponds to this video call it lucky for not crushing its head at least we have a chance to buy the dip bitcoin is king,0.3908950686454773,0.5945084095001221,0.014596555382013321
2022-04-26,17:45,💥BREAKING: The first #Bitcoin ATM in Mexico has been installed  inside the Senate.,the first bitcoin atm in mexico has been installed inside the senate,0.21346408128738403,0.7786531448364258,0.007882769219577312
2022-04-26,17:45,"Trade cannot exist without trust, and it is very difficult to trust strangers. #NFTCommunity #nftart #NFTdrops #NFTartists #NFTGame @BoredApeYC @MeekMill @Coinbase_NFT @TheBinanceNFT #bitcoin",trade cannot exist without trust and it is very difficult to trust strangers nftcommunity nftart nftdrops nftartists nftgame boredapeyc meekmill coinbasenft thebinancenft bitcoin,0.026063580065965652,0.9199663996696472,0.05396996811032295
2022-04-26,17:45,"@airdropinspect This is a very good project. You all join.

@AbuyusufRony2

@simanto_joy

@Biplob80049000 

#Airdrop #Airdrops #Airdropinspector #BSC #CryptoMetropolis #CTM #Crypto #Bitcoin",airdropinspect this is a very good project you all join abuyusufrony2 simantojoy biplob80049000 airdrop airdrops airdropinspector bsc cryptometropolis ctm crypto bitcoin,0.24098198115825653,0.751306414604187,0.0077116345055401325
2022-04-26,17:45,"Follow along as #bitcoin goes from magic internet money to the planet’s preferred money, one tweet at a time.",follow along as bitcoin goes from magic internet money to the planets preferred money one tweet at a time,0.060684941709041595,0.925471305847168,0.01384375523775816
2022-04-26,17:45,"🔔Price updates for different #crypto assets that get price predictions on 🦥SlothTrading:

#BTC: $38,261.16
#AVA: $1.175
#BNB: $388.70
#ADA: $0.8361
#DOGE: $0.1427

💥New predictions every hour",price updates for different crypto assets that get price predictions on 3826116 1175 38870 08361 01427 new predictions every hour,0.02616112120449543,0.9373836517333984,0.036455173045396805
2022-04-26,17:45,"Stacking goals for #bitcoin:
0.1 = Set for life
0.26 = Guaranteed top 1% globally
1 = Generational wealth
3.125=10 min of mining power in 2024
6.15 = Eternal riches and big titty bi…",stacking goals for 01 set for life 026 guaranteed top 1 globally 1 generational wealth 312510 min of mining power in 2024 615 eternal riches and big titty bi,0.14906755089759827,0.8352010250091553,0.015731457620859146
2022-04-26,17:45,"@Gem_Exquisite @JohnStrandford Def check out $parma and their nodes for daily passive income! We have nfts,certik audit almost completed ,swap,eth &amp; bsc cross chain, referral program and 244% apr nodes. I recommend you come join our telegram and vibe with our awesome community! #Bitcoin   #Ethereum #Altcoins",gemexquisite johnstrandford def check out parma and their nodes for daily passive income we have nftscertik audit almost completed swapeth bsc cross chain referral program and 244 apr nodes i recommend you come join our telegram and vibe with our awesome community bitcoin ethereum altcoins,0.1733943670988083,0.8179143667221069,0.008691255003213882
2022-04-26,17:45,"@BTC_Archive Our analytical team has done a detailed analysis regarding #BTC, and its Fear and Greed Index is 41 - MILD FEAR at the moment with price of 38671.440733077105 usd, so what do you think about the current #Bitcoin state?",btcarchive our analytical team has done a detailed analysis regarding btc and its fear and greed index is 41 mild fear at the moment with price of 38671440733077105 usd so what do you think about the current bitcoin state,0.041474293917417526,0.9274044632911682,0.031121261417865753
2022-04-26,17:45,"@NETONOfficial Great project.
I am sure that everything will work out and will be on top!
I think in the near future I will see an unprecedented growth of this project
@Ramazan95093785
@blockchain_rich
@DONUSATALAY
#Airdrops  #Bitcoin #AirdropDetective #Crypto #NFTs",netonofficial great project i am sure that everything will work out and will be on top i think in the near future i will see an unprecedented growth of this project ramazan95093785 blockchainrich donusatalay airdrops bitcoin airdropdetective crypto nfts,0.633486807346344,0.35659176111221313,0.009921489283442497
