Date,Time,Original tweet,Clean tweet,Positive,Neutral,Negative
2022-05-05,20:15,"🟩 Block 735069 ⛏ ⛏

📅 5th May 2022, 20:13:34 GMT

📣 1,962 tx with a value of 5,648.759 ₿ ($205.05m 🇺🇸)

📣 distributed to 5,688 recipients 💎🙌

📣 19,031,687.50 ₿ (90.62708%) mined ⛏

📣 1,968,312.50 ₿ remaining 💰

#bitcoin #tictoknextblock",block 735069 5th may 2022 gmt 1962 tx with a value of 5648759 20505m distributed to 5688 recipients 1903168750 9062708 mined 196831250 remaining bitcoin tictoknextblock,0.05449993908405304,0.9235967397689819,0.021903302520513535
2022-05-05,20:15,Ok this reversal candle was not expected. Ugly af! #Bitcoin,ok this reversal candle was not expected ugly af bitcoin,0.0787961557507515,0.5721815228462219,0.3490222990512848
2022-05-05,20:15,Spambots already have laser eyes. We‘re winning. #Bitcoin,spambots already have laser eyes were winning bitcoin,0.1352577954530716,0.8497417569160461,0.015000456012785435
2022-05-05,20:15,📈 ETHUSD SELL signal now (partial) #eth #crypto #DCA #TradingSignals #BTC #Bitcoin 5/5/2022@20:14:59,ethusd sell signal now partial eth crypto dca tradingsignals btc bitcoin,0.02995689958333969,0.9357785582542419,0.03426458686590195
2022-05-05,20:15,"🧵Thread began 04.21.22 - 2 weeks ago.
$BTCUSD #Bitcoin 240m

Read the thread. What I said would happen is exactly what happened. How many likes did my posts get?

Idiots spewing nonsense about going to the moon get 1000s of likes. I drew you a fckin map. 

Sheeple, no hope. SMH https://t.co/KBueGurKDZ",thread began 042122 2 weeks ago btcusd bitcoin 240m read the thread what i said would happen is exactly what happened how many likes did my posts get idiots spewing nonsense about going to the moon get 1000s of likes i drew you a fckin map sheeple no hope smh,0.039197515696287155,0.9096840620040894,0.05111844092607498
2022-05-05,20:15,"Best Best Best :O #Bitcoin  
https://t.co/cxEb09G6O1
$BTC $ETH $USDT $BNB $USDC $SOL $XRP $LUNA https://t.co/zJxvJcqeUV",best best best bitcoin btc eth usdt bnb usdc sol xrp luna,0.6822097301483154,0.3074505925178528,0.010339660570025444
2022-05-05,20:15,"It will only make you miserable...

#Bitcoin #Crypto #altcoin #btc https://t.co/K9W5GPnZxd",it will only make you miserable bitcoin crypto altcoin btc,0.023188162595033646,0.9203628897666931,0.056448906660079956
2022-05-05,20:15,#bitcoin hasn’t got a lot of space left before we plunge to 30k levels. Really need to have a good bounce here..👇 https://t.co/oQsfKP6ugr https://t.co/p2uL4z4L15,bitcoin hasn not got a lot of space left before we plunge to 30k levels really need to have a good bounce here,0.19145861268043518,0.7754281163215637,0.03311322256922722
2022-05-05,20:15,🟢 #BTC Liquidated Short: $259K at $36390.46,btc liquidated 259k at 3639046,0.04815332964062691,0.7962949872016907,0.15555159747600555
2022-05-05,20:15,"🔻🔻🔻 $1,525,934 BTCUSDT SHORTED @$36,369.00 on #Binance (20:14:48 UTC) #BTC #cryptocurrency",1525934 btcusdt shorted 3636900 on binance utc btc cryptocurrency,0.03441830351948738,0.9384592175483704,0.027122553437948227
2022-05-05,20:15,"It's just a dip, the market is back to recovere soon , Just keep accumulating big opportunity for diamond hands to buy more 💰
#bitcoin #bnb #trading #nft #sol",it is just a dip the market is back to recovere soon just keep accumulating big opportunity for diamond hands to buy more bitcoin bnb trading nft sol,0.6929495930671692,0.28609833121299744,0.0209521371871233
2022-05-05,20:15,@BTC_Archive They need to adopt #bitcoin now more than ever......that's the only way out for Turkey now.,btcarchive they need to adopt bitcoin now more than everthat the only way out for turkey now,0.10609560459852219,0.8807579278945923,0.013146502897143364
2022-05-05,20:15,"Satoshi Nakamoto programmed the
last #bitcoin $ to be mined in 2140
meaning they intentionally created
something they themselves would
never get to see finished.",satoshi nakamoto programmed the last bitcoin to be mined in 2140 meaning they intentionally created something they themselves would never get to see finished,0.023936988785862923,0.7144752144813538,0.2615877687931061
2022-05-05,20:15,"@OptionsMike Wow? Freeking #Bitcoin again, and they promised me the world? Wonder whatever happened to the  $btc die-hard fans?",optionsmike wow freeking bitcoin again and they promised me the world wonder whatever happened to the btc diehard fans,0.16169419884681702,0.8231037259101868,0.015202099457383156
2022-05-05,20:15,An economy running on #BITCOIN does not mean we are getting rid of all inflation. When people quit their jobs thinking that they have enough bitcoin to retire that leads to less production. That leads to higher prices and people coming back to work.,an economy running on bitcoin does not mean we are getting rid of all inflation when people quit their jobs thinking that they have enough bitcoin to retire that leads to less production that leads to higher prices and people coming back to work,0.01924905553460121,0.07195673882961273,0.9087942242622375
2022-05-05,20:15,"HODLing is painful. 

If you survive the journey you will truly know what HODL means.#BTC",hodling is painful if you survive the journey you will truly know what hodl meansbtc,0.09095662087202072,0.8857921957969666,0.023251241073012352
2022-05-05,20:15,@ADinmohamed @PeterSchiff Pretty irrelevant comparison considering #bitcoin and #gold are nothing alike,adinmohamed peterschiff pretty irrelevant comparison considering bitcoin and gold are nothing alike,0.06499065458774567,0.9144729971885681,0.020536337047815323
2022-05-05,20:15,"Every single time. I say I'm going to purchase  Bitcoin, lazily, and it fucking tanks, lol. Did not actually buy, but will warn y'all when I say it out loud. #bitcoin",every single time i say i am going to purchase bitcoin lazily and it fucking tanks lol did not actually buy but will warn y all when i say it out loud bitcoin,0.04844680428504944,0.9179474115371704,0.03360580652952194
2022-05-05,20:15,Healthy DIP #Bitcoin #Ethereum,healthy dip bitcoin ethereum,0.18125566840171814,0.8034359216690063,0.015308353118598461
2022-05-05,20:15,@nayibbukele #bitcoin getting slaughtered by Dirty corrupt Wall Street . Poor El Salvador paying for it,nayibbukele bitcoin getting slaughtered by dirty corrupt wall street poor el salvador paying for it,0.057787273079156876,0.4976290762424469,0.4445836544036865
2022-05-05,20:15,If #DXY drop at this level #BTC bounce incoming,if dxy drop at this level btc bounce incoming,0.052514612674713135,0.21153524518013,0.7359501719474792
2022-05-05,20:15,"Life of the working class, can’t BTFD 🙄

#Bitcoin",life of the working class can not btfd bitcoin,0.021990038454532623,0.8829271793365479,0.09508277475833893
2022-05-05,20:15,"If you still don’t understand why #Bitcoin is going to $1M in the next 10 years (a 20x), you REALLY should drop everything and do some research. Like right now. I’m serious, it’s a mind-blowing paradigm shift.",if you still don not understand why bitcoin is going to 1m in the next 10 years a 20x you really should drop everything and do some research like right now im serious its a mindblowing paradigm shift,0.030200544744729996,0.7245448231697083,0.24525468051433563
2022-05-05,20:15,#bitcoin flush aint yet- the downside has a lot of potential as the last moonboys change their narrative need them to change their thinking so bearishness is everywhere.,bitcoin flush aint yet the downside has a lot of potential as the last moonboys change their narrative need them to change their thinking so bearishness is everywhere,0.08469122648239136,0.831111490726471,0.0841972604393959
2022-05-05,20:15,"Buffett has never been a fan of non-producing assets – it’s the reason he’s never owned gold… it doesn’t pay a dividend and it doesn’t generate cash flow.  So, it’s very consistent of him to not like #BTC on those merits. 1/6",buffett has never been a fan of nonproducing assets its the reason hes never owned gold it doesn not pay a dividend and it doesn not generate cash flow so its very consistent of him to not like btc on those merits 16,0.032034218311309814,0.8943579196929932,0.07360785454511642
2022-05-05,20:15,"today they are selling, tomorrow they will be buying :D 

its pointless, just hold ;) 

#BTC #bitcoin #Ethereum #ETH",today they are selling tomorrow they will be buying its pointless just hold btc bitcoin ethereum eth,0.07600109279155731,0.9137647747993469,0.010234148241579533
2022-05-05,20:15,#Bitcoin is on the up! 🚀,bitcoin is on the up,0.09614770114421844,0.8717039823532104,0.03214836120605469
2022-05-05,20:15,"Bear is here.

#crypto #BTC #altcoins",bear is here crypto btc altcoins,0.029382599517703056,0.9443873763084412,0.026229968294501305
2022-05-05,20:15,"Best thing i ever did was stop telling people what’s going on in my life
#qanda #NFTs #Crypto #bitcoin #lag",best thing i ever did was stop telling people whats going on in my life qanda nfts crypto bitcoin lag,0.027544332668185234,0.8693807721138,0.10307486355304718
2022-05-05,20:15,Was hoping #btc would not revisit January lows but here we are. Could def see it bounce off 29k  before the summer is over fwiw,was hoping btc would not revisit january lows but here we are could def see it bounce off 29k before the summer is over fwiw,0.09958019852638245,0.18031252920627594,0.7201072573661804
2022-05-05,20:15,Everythings on fire and I'm still buying the MF dip 💯 #BITCOIN,everythings on fire and i am still buying the mf dip bitcoin,0.14949028193950653,0.8183842301368713,0.03212549909949303
2022-05-05,20:15,I am to a point where I genuinely get excited for days like today. Discounts everywhere. #BTC #ETH #APECOIN #UMBR,i am to a point where i genuinely get excited for days like today discounts everywhere btc eth apecoin umbr,0.14301323890686035,0.8400013446807861,0.01698542758822441
2022-05-05,20:15,"Ops !
Btc on 51% attacked right now 🙂 
Goodbye cryptocurrency 
#bitcoin #AmberHeardlsALiar 
#Finance #Binance #Ethereum #btc",ops btc on 51 attacked right now goodbye cryptocurrency bitcoin amberheardlsaliar finance binance ethereum btc,0.0474289134144783,0.9282675385475159,0.024303527548909187
2022-05-05,20:15,If I didn’t own #bitcoin I would wish it’s failure just due to its asshole people in it   Of course it’s failing to hold even half its ATH  and zoom out is Low IQ response,if i didn not own bitcoin i would wish its failure just due to its asshole people in it of course its failing to hold even half its ath and zoom out is low iq response,0.018449213355779648,0.22160539031028748,0.7599454522132874
2022-05-05,20:15,@TheMoonCarl I was telling this massage since January 2021 that #BTC will hit 28k and it's.,themooncarl i was telling this massage since january 2021 that btc will hit 28k and it s,0.15698933601379395,0.8238199353218079,0.01919078640639782
2022-05-05,20:15,"If the #Bitcoin weekly candle closes at this level, we’re gonna have a potential weekly bullish divergence. An Event which happened last time since like… never. Exciting times!",if the bitcoin weekly candle closes at this level were gonna have a potential weekly bullish divergence an event which happened last time since like never exciting times,0.036580976098775864,0.7665544748306274,0.1968645453453064
2022-05-05,20:15,"Friendly Reminder 🔔

Do Not Panic Selling. 

#Bitcoin  $BTC
#Binance 
#cryptocurrency",friendly reminder do not panic selling bitcoin btc binance cryptocurrency,0.08449005335569382,0.89372718334198,0.021782826632261276
2022-05-05,20:15,"Pressure make diamonds 👀🫡

#Bitcoin",pressure make diamonds bitcoin,0.05270089581608772,0.9052481651306152,0.04205097258090973
2022-05-05,20:15,Current #Bitcoin Price is $36259 #BTC #Crypto,current bitcoin price is 36259 btc crypto,0.021439462900161743,0.9499611258506775,0.028599435463547707
2022-05-05,20:15,Dry powder waiting for the orange light specials! #btc,dry powder waiting for the orange light specials btc,0.05645731836557388,0.9034702181816101,0.04007244110107422
2022-05-05,20:15,"@intocryptoverse People are selling their bitcoin to buy CillionCoin these days. And I understand them. This thing is about to explode. #CT #Cillionaire #CilllionCoin #Cillion
#BSC #ETH #BTC #TikTok",intocryptoverse people are selling their bitcoin to buy cillioncoin these days and i understand them this thing is about to explode ct cillionaire cilllioncoin cillion bsc eth btc tiktok,0.031223416328430176,0.9171873927116394,0.05158913508057594
2022-05-05,20:15,"Imagine you wake up one morning, there is no such thing as #bitcoin.  Not everyone logs into scam accounts.  There is no court to complain to.  All your savings are gone.  The situation seems to be heading in that direction.  Look at the price altcoins fell 70% #btc #btcusdt",imagine you wake up one morning there is no such thing as bitcoin not everyone logs into scam accounts there is no court to complain to all your savings are gone the situation seems to be heading in that direction look at the price altcoins fell 70 btc btcusdt,0.04696420580148697,0.48309335112571716,0.4699423909187317
2022-05-05,20:15,#btc all in short @cz_binance,btc all in short czbinance,0.024694278836250305,0.9418167471885681,0.03348897024989128
2022-05-05,20:15,Zero up to 12 hours!!#BITCOIN,zero up to 12 hoursbitcoin,0.05618796870112419,0.9149561524391174,0.02885587513446808
2022-05-05,20:15,"Wall Street shakes: NASDAQ plunges 5%, fear index jumps〰️
#cryptotrading #CryptoNews #CryptocurrencyNews #bitcoin #CoinMarketCap #BTC #NFT #crypto",wall street nasdaq plunges 5 fear index jumps cryptotrading cryptonews cryptocurrencynews bitcoin coinmarketcap btc nft crypto,0.024592280387878418,0.36727699637413025,0.608130693435669
2022-05-05,20:15,"@davidgokhshtein Yeah a great opportunity to get rare gems like $MGT the native token of @MetagwaraToken.
Metagwara aims at bringing into reality the Gwaraverse, features staking farming nfts p2e etc.
You can't afford to miss out from this gem 🔥
#btc #metaverse #web3 #crypto #nft",davidgokhshtein yeah a great opportunity to get rare gems like mgt the native token of metagwaratoken metagwara aims at bringing into reality the gwaraverse features staking farming nfts p2e etc you cannot afford to miss out from this gem btc metaverse web3 crypto nft,0.1400577872991562,0.8507695198059082,0.00917272549122572
2022-05-05,20:15,Which crypto will get to a dollar first? #bitcoin #dogecoin,which crypto will get to a dollar first bitcoin dogecoin,0.043740011751651764,0.9380550384521484,0.01820491999387741
2022-05-05,20:15,"@AirdropStario Fantastic project with great potential.The team's dedication and ingenuity with excellent fan support will make this the envy of the crypto world.Glad to be part.
@mfkhoirs
@Ahmedda007
@DilshanKamitha
#crypto #Airdrop #BSC #Bitcoin #USDT #LamboFinance #BUSD #Airdropstario",airdropstario fantastic project with great potentialthe team dedication and ingenuity with excellent fan support will make this the envy of the crypto worldglad to be part mfkhoirs ahmedda007 dilshankamitha crypto airdrop bsc bitcoin usdt lambofinance busd airdropstario,0.6975637078285217,0.29491180181503296,0.007524546701461077
2022-05-05,20:15,"Bought at 40k on #Bitcoin yesterday, when you wake up , it’s around 36.3k on current market price. 🫣😮‍💨#Crypto",bought at 40k on bitcoin yesterday when you wake up its around 363k on current market price crypto,0.08384294807910919,0.8904225826263428,0.025734497234225273
2022-05-05,20:15,@ChartsBtc @BitcoinMagazine Bought the dip.  #bitcoin flash sale,chartsbtc bitcoinmagazine bought the dip bitcoin flash sale,0.04856076091527939,0.9358147382736206,0.015624474734067917
2022-05-05,20:15,"@BabaCugs Truthfully, outside of the shitty #BTC maxis and the #ETH crowd going silent now the spotlight is shining bright on them., I don’t give two shits if they stay or go.. I care that the ones I’m holding the most of do what has been said they’ll do..",babacugs truthfully outside of the shitty btc maxis and the eth crowd going silent now the spotlight is shining bright on them i don not give two shits if they stay or go i care that the ones im holding the most of do what has been said theyll do,0.055757150053977966,0.9039608836174011,0.04028194397687912
2022-05-05,20:15,1K #LinkedIn profiles to view but #coffee 1st! Might miss the #bitcoin #meetup now.,1k linkedin profiles to view but coffee 1st might miss the bitcoin meetup now,0.0298537015914917,0.546176016330719,0.4239703416824341
2022-05-05,20:15,When there is blood 🩸 on the streets buy #BITCOIN,when there is blood on the streets buy bitcoin,0.026247667148709297,0.9330675005912781,0.04068480059504509
2022-05-05,20:15,"Feels like that covid night  drop jn march 2020.... you got cash ?
#Bitcoin",feels like that covid night drop jn march 2020 you got cash bitcoin,0.045118510723114014,0.895884096622467,0.05899736285209656
2022-05-05,20:15,#BTC sub 25k loading…,btc sub 25k loading,0.13094301521778107,0.7442034482955933,0.12485348433256149
2022-05-05,20:15,@BTC_Archive 🙏Subscribe me for news and insights about #BITCOIN,btcarchive subscribe me for news and insights about bitcoin,0.043764956295490265,0.9407593607902527,0.015475746244192123
2022-05-05,20:15,Looking forward to buying a f*ck ton of #Bitcoin in the $20k’s. What’s the going rate for a healthy kidney these days?,looking forward to buying a fck ton of bitcoin in the 20ks whats the going rate for a healthy kidney these days,0.7316014170646667,0.25797566771507263,0.0104227839037776
2022-05-05,20:15,It really is just about buying at the times you are TERRIFIED to buy at #Crypto #BTC,it really is just about buying at the times you are terrified to buy at crypto btc,0.025232898071408272,0.9241523146629333,0.05061482638120651
2022-05-05,20:15,"Many uncertainty over the Federal Reserve’s actions that how will ease inflation without causing a recession, The concerns that made the stock market correction over the past few months(eg. inflation, the Russia-Ukraine war and high oil prices) have NOT solved.
#Bitcoin #BTC #ETH",many uncertainty over the federal reserves actions that how will ease inflation without causing a recession the concerns that made the stock market correction over the past few monthseg inflation the russiaukraine war and high oil prices have not solved bitcoin btc eth,0.11216862499713898,0.180068701505661,0.7077627182006836
2022-05-05,20:15,"Friendly reminder: 

It’s not a sprint, it’s a marathon. 

#Bitcoin",friendly its not a sprint its a marathon bitcoin,0.03883732110261917,0.9412298202514648,0.01993289589881897
2022-05-05,20:15,Yooooo what’s going on #Bitcoin,yooooo whats going on bitcoin,0.024407710880041122,0.8793283700942993,0.09626387804746628
2022-05-05,20:15,Any #BITCOIN digger ever existed? Just curious,any bitcoin digger ever existed just curious,0.03685277700424194,0.9259520769119263,0.03719520941376686
2022-05-05,20:15,"Struggling everyday to earn living and to achieve my dreams
Wish I could get a financial support of 500 #Bitcoin 
Oneday it will come true
@chamath
#ThankYou",struggling everyday to earn living and to achieve my dreams wish i could get a financial support of 500 bitcoin oneday it will come true chamath thankyou,0.4415183961391449,0.5472107529640198,0.011270813643932343
2022-05-05,20:15,"#ETH is holding up better in this smash &amp; crash than #BitCoin

Impressive.",eth is holding up better in this smash crash than bitcoin impressive,0.9514536261558533,0.028967317193746567,0.019578997045755386
2022-05-05,20:15,"@Meta_UFO Don't miss this airdrop
#bitcoin
#MINA
#nft",metaufo do not miss this airdrop bitcoin mina nft,0.06660871207714081,0.9138047695159912,0.019586483016610146
2022-05-05,20:15,"@cryptomanran In 2021 of January is the last time we saw this price but then in November #BTC jumped to $69,000 that same year. So, there’s potential and I’m buying again!",cryptomanran in 2021 of january is the last time we saw this price but then in november btc jumped to 69000 that same year so theres potential and im buying again,0.25498712062835693,0.7246835827827454,0.020329253748059273
2022-05-05,20:15,"🚀🚀🚀 $2,965,644 BTCUSDT LONGED @$36,277.00 on #Binance (20:12:03 UTC) #BTC #cryptocurrency",2965644 btcusdt longed 3627700 on binance utc btc cryptocurrency,0.037086278200149536,0.9301342964172363,0.03277938812971115
2022-05-05,20:15,"@PeterSchiff Hehe..Where do you think we learned how to hodl Pete..The same way you hold onto your outdated diets and extractive mentality, we will hold onto our #bitcoin and use your #gold to line the network for your great, great, great, great, grandkids to enjoy in humanity’s abundance. 🥂",peterschiff hehewhere do you think we learned how to hodl petethe same way you hold onto your outdated diets and extractive mentality we will hold onto our bitcoin and use your gold to line the network for your great great great great grandkids to enjoy in humanitys abundance,0.144624263048172,0.8449669480323792,0.010408814065158367
2022-05-05,20:15,"It’s possible (though unlikely) that, at any time, #Bitcoin can fail for a reason that we cannot foresee today but the idea of a decentralised and permisionless monetary system based on the blockchain technology will eventually prevail.",its possible though unlikely that at any time bitcoin can fail for a reason that we cannot foresee today but the idea of a decentralised and permisionless monetary system based on the blockchain technology will eventually prevail,0.6273680329322815,0.3566771149635315,0.015954917296767235
2022-05-05,20:15,"Life: Change is scary, but change is growth.

#NFTCommunity #nftart  #Crypto #BTC #Metaverse",change is scary but change is growth nftcommunity nftart crypto btc metaverse,0.06386278569698334,0.9156641364097595,0.020473094657063484
2022-05-05,20:15,"#BTC $BTC reversal runnin since 30 minutes, lets hope it holds 🔥👌🏽 above 36K again",btc btc reversal runnin since 30 minutes lets hope it holds above 36k again,0.8185327053070068,0.08103935420513153,0.10042800009250641
2022-05-05,20:15,How come no one talks about #CentralAfrica making #btc legal tender... The 2nd in za worrld ! ... #cryptotwitter do better,how come no one talks about centralafrica making btc legal tender the 2nd in za worrld cryptotwitter do better,0.046980421990156174,0.9274491667747498,0.025570420548319817
2022-05-05,20:15,My only happiness is the drop in #btc dominance,my only happiness is the drop in btc dominance,0.013904056511819363,0.06273292005062103,0.9233630299568176
2022-05-05,20:15,"#Bitcoin MAY crash 😎
@saylor you still staking SATs?
@nayibbukele no more dip money?",bitcoin may crash saylor you still staking sats nayibbukele no more dip money,0.1095997542142868,0.6739258170127869,0.21647441387176514
2022-05-05,20:15,"@LayahHeilpern 💯... if you believe in #Bitcoin  long term, for 5; 10; 15 years from now $40k or $35k makes no difference. Likewise, when it goes up to $100k and possibly gets back down to $80k at some point, it doesn’t make a difference! #BTC  must be held by those w/ balls &amp; conviction! #news",layahheilpern if you believe in bitcoin long term for 5 10 15 years from now 40k or 35k makes no difference likewise when it goes up to 100k and possibly gets back down to 80k at some point it doesn not make a difference btc must be held by those w balls conviction news,0.04866389185190201,0.9118030667304993,0.03953305631875992
2022-05-05,20:15,"#DOT/#USDT from #Kucoin looks good for #trading.

For Detailed signals, use the link in profile &amp; contact admin for VIP membership plans.

#Bitcoin #Cryptocurrency",dotusdt from kucoin looks good for trading for detailed signals use the link in profile contact admin for vip membership plans bitcoin cryptocurrency,0.06595849245786667,0.9198794364929199,0.014162040315568447
2022-05-05,20:15,#ETH holding up better than #BTC as of recent. Pretty interesting IMO and definitely not what I expected. Maybe it’s in part to all the locked up ETH &amp; burned coins.,eth holding up better than btc as of recent pretty interesting imo and definitely not what i expected maybe its in part to all the locked up eth burned coins,0.9020084142684937,0.0575396753847599,0.04045187681913376
2022-05-05,20:15,Successful people do what unsuccessful people are not willing to do. Don't wish it were easier; wish you were better.#Bitcoin #investing #realestateinvesting,successful people do what unsuccessful people are not willing to do do not wish it were easier wish you were betterbitcoin investing realestateinvesting,0.10025288909673691,0.8816140294075012,0.018133064731955528
2022-05-05,20:15,Is there a #bitcoin fisherman Twitter I have missed?,is there a bitcoin fisherman twitter i have missed,0.03536932170391083,0.844889760017395,0.11974085867404938
2022-05-05,20:15,"S&amp;P started falling hard at the opening, BTC with it. Decentralized, not accepting authority, it's all a story. As someone who experienced the big crash in 2018, there is no bottom, unfortunately, in this market. #BITCOIN #Crypto #Ethereum",sp started falling hard at the opening btc with it decentralized not accepting authority it is all a story as someone who experienced the big crash in 2018 there is no bottom unfortunately in this market bitcoin crypto ethereum,0.03160430118441582,0.49676209688186646,0.47163358330726624
2022-05-05,20:15,@PeterSchiff You didn't have a brain and you are still in stone age. #Bitcoin is the future and #web3 will adopt more countries in future. I think you sit up your buttocks on #gold only.,peterschiff you did not have a brain and you are still in stone age bitcoin is the future and web3 will adopt more countries in future i think you sit up your buttocks on gold only,0.04164699837565422,0.9315549731254578,0.026798056438565254
