Date,Time,Original tweet,Clean tweet,Positive,Neutral,Negative
2022-05-20,17:15,"Long Liquidations Continue To Rock Market As #Bitcoin Struggles To Settle Above $30,000 https://t.co/SssEDcds1G via @coinjupiter",long liquidations continue to rock market as bitcoin struggles to settle above 30000 via coinjupiter,0.011630394496023655,0.024955328553915024,0.9634142518043518
2022-05-20,17:15,"#Bitcoin Will Go Into the Millions, Predicts MicroStrategy’s Michael Saylor https://t.co/JyBHSYfqXC via @coinjupiter",bitcoin will go into the millions predicts microstrategys michael saylor via coinjupiter,0.0865410566329956,0.9007468819618225,0.012712049297988415
2022-05-20,17:15,"#Bitcoin and #Ethereum are Not Currencies, States Swedish Central Bank https://t.co/khWeLpX3Cy via @coinjupiter",bitcoin and ethereum are not currencies states swedish central bank via coinjupiter,0.018912065774202347,0.9419208765029907,0.03916701301932335
2022-05-20,17:15,"So they send money to Ukraine and they use that money to buy weapons from US based companies lmao inflation is going to hit harder.
#crypto #btc #eth #luna #ust",so they send money to ukraine and they use that money to buy weapons from us based companies lmao inflation is going to hit harder crypto btc eth luna ust,0.2843630611896515,0.5520271062850952,0.1636098325252533
2022-05-20,17:15,JUST IN: Cyprus has finalized a #Bitcoin  &amp; #crypto draft regulation.,just cyprus has finalized a bitcoin crypto draft regulation,0.15271581709384918,0.8390747904777527,0.008209381252527237
2022-05-20,17:15,The current price of #BTC is $28890.61 in USD,the current price of btc is 2889061 in usd,0.026668986305594444,0.9482747316360474,0.02505631186068058
2022-05-20,17:15,@Lamborghini Would be nice in our #community garage #MDC #Lamborghini #btc #NFT #NFTCommunity,lamborghini would be nice in our community garage mdc lamborghini btc nft nftcommunity,0.13434183597564697,0.8564988374710083,0.009159327484667301
2022-05-20,17:15,@greg_ip Trash 🗑 Piece. Shit job Greg. #bitcoin not crypto first of all. And 12 years you honestly feel is long enough to make the determination that it’s a failure? Are you serious?,gregip trash piece shit job greg bitcoin not crypto first of all and 12 years you honestly feel is long enough to make the determination that its a failure are you serious,0.039601895958185196,0.872071385383606,0.08832677453756332
2022-05-20,17:15,"@JasonPLowery @Dennis_Porter_ In a hyperbitcoinized world will govt policy be the same as now or will it evolve to prioritize the integrity of the #btc network? So if I steal your bitcoin through phishing, robbery, etc… will punishments change compared to now?",jasonplowery dennisporter in a hyperbitcoinized world will govt policy be the same as now or will it evolve to prioritize the integrity of the btc network so if i steal your bitcoin through phishing robbery etc will punishments change compared to now,0.04997510090470314,0.8993657231330872,0.0506591834127903
2022-05-20,17:15,create twitter tasks and pay with #bitcoin #ethereum #litecoin #nft #airdrop with @jobboycom,create twitter tasks and pay with bitcoin ethereum litecoin nft airdrop with jobboycom,0.03466211259365082,0.9412561058998108,0.024081749841570854
2022-05-20,17:15,"Turning very ugly #markets taking #Bitcoin down further, #DowJones again turning negative, staying out 4 time being.",turning very ugly markets taking bitcoin down further dowjones again turning negative staying out 4 time being,0.033303625881671906,0.03806515038013458,0.9286311864852905
2022-05-20,17:15,"@token_ventures @Gateway_Conf @cosmos This week, we were busy baking some #Bitcoin pie and spreading some #DeFi love at @Gateway_Conf. Stay tuned for more updates on our tokenventures journey!",tokenventures gatewayconf cosmos this week we were busy baking some bitcoin pie and spreading some defi love at gatewayconf stay tuned for more updates on our tokenventures journey,0.05743947997689247,0.9241085052490234,0.01845201849937439
2022-05-20,17:15,"@PSpuce We had Already 7x red candle on the weekly in a row. We will not have it 8x #Bitcoin fam. 
Only a noob blame others for their own investment decisions.",pspuce we had already 7x red candle on the weekly in a row we will not have it 8x bitcoin fam only a noob blame others for their own investment decisions,0.08000563085079193,0.8950501680374146,0.024944178760051727
2022-05-20,17:15,"💥💥Reasonable price for #Bitcoin is 1 cent per Satoshi.💥💥

We'll get there eventually",reasonable price for bitcoin is 1 cent per satoshi we will get there eventually,0.20931318402290344,0.7812018394470215,0.009484987705945969
2022-05-20,17:15,"@yieldster The project is great very professionally and has a clear development plan.  Made by a very professional and experienced team 

@danny_satoma 
 
@duyen37537245 
 
@duy36361969 

#blockchain #LUNA #fintech #Bitcoin",yieldster the project is great very professionally and has a clear development plan made by a very professional and experienced team dannysatoma duyen37537245 duy36361969 blockchain luna fintech bitcoin,0.6212350726127625,0.37047305703163147,0.00829187873750925
2022-05-20,17:15,"I don’t ask for much.
Just for the frictionless flow and allocation of money to align with the flow and allocation of value contribution.
#bitcoin",i don not ask for much just for the frictionless flow and allocation of money to align with the flow and allocation of value contribution bitcoin,0.08049942553043365,0.906603991985321,0.012896651402115822
2022-05-20,17:15,"@Anthony74970961 I'm PAWsitive about $Paw
I'm a $PAW holder and i believe in #paw 🚀🚀🏆

#Paw #Bitcoin  #cryptocurrency",anthony74970961 i am pawsitive about paw i am a paw holder and i believe in paw paw bitcoin cryptocurrency,0.037315815687179565,0.9272137880325317,0.03547041490674019
2022-05-20,17:15,NEW: House Republicans introduce a bill that protects #Bitcoin &amp; crypto investments in retirement accounts,house republicans introduce a bill that protects bitcoin crypto investments in retirement accounts,0.12337352335453033,0.8501758575439453,0.026450607925653458
2022-05-20,17:15,20k #Bitcoin maybe,20k bitcoin maybe,0.03431393951177597,0.9355273246765137,0.03015868179500103
2022-05-20,17:15,@BTC_Archive Gib sauce Archie #Bitcoin,btcarchive gib sauce archie bitcoin,0.03919687122106552,0.9385737776756287,0.022229406982660294
2022-05-20,17:15,$QNT QRC standard allows smart contracts on your favorite cryptocurrency like idk....ummmmmm maybe #Bitcoin ?!,qnt qrc standard allows smart contracts on your favorite cryptocurrency like idkummmmmm maybe bitcoin,0.059478554874658585,0.9263695478439331,0.014151929877698421
2022-05-20,17:15,"#FGW #FunnyGameWorld #crypto #bitcoin #cryptocurrency #blockchain #bounty #binance #eth #token #coinsbit
Project looks promising. We hope for the success of the team and the community supporting this project, and we hope that it will last a long time. Good luck to the project",fgw funnygameworld crypto bitcoin cryptocurrency blockchain bounty binance eth token coinsbit project looks promising we hope for the success of the team and the community supporting this project and we hope that it will last a long time good luck to the project,0.8332471251487732,0.15797795355319977,0.008774916641414165
2022-05-20,17:15,"I'M A GRAPHIC DESIGNER... 
WE DESIGN YOUR WORLD.
BRINGING ALL TO REALITY...

FLYERS,LOGO DESIGNS..ETC..

YOUR SATISFACTION IS ALWAYS OUR PRIORITY....

#BTC  #nft #3D #graphicdesign #cryptocurrency ..",i am a graphic designer we design your world bringing all to reality flyerslogo designsetc your satisfaction is always our priority btc nft 3d graphicdesign cryptocurrency,0.04999640956521034,0.9294889569282532,0.02051462046802044
2022-05-20,17:15,💥BREAKING: US Congress considering bill to protect right to allocate retirement savings to #Bitcoin ✅,us congress considering bill to protect right to allocate retirement savings to bitcoin,0.21214833855628967,0.7759218811988831,0.011929785832762718
2022-05-20,17:15,"@AirdropStario Best project ever , I am very happy to be participating in this project. I hope this project will gain more popularity in the future.

@DelanMunos
@IkmalA10 
@nacake947 

#cryptocurrency #Airdrop #BSC #Bitcoin #USDT #BoomerangCapital #BOOM #Airdropstario",airdropstario best project ever i am very happy to be participating in this project i hope this project will gain more popularity in the future delanmunos ikmala10 nacake947 cryptocurrency airdrop bsc bitcoin usdt boomerangcapital boom airdropstario,0.6818310618400574,0.30975618958473206,0.008412742987275124
2022-05-20,17:15,"A great project with a very cool idea! These are the projects I always suggest to friends and acquaintances 
#WorkQuest $WQT $WUSD #WorkNet #WorkQuestApp #blockchian #crypto #cryptolife #BTC #BNB #ETH #digitalization #digitalassets #saving #BinanceSmartChain",a great project with a very cool idea these are the projects i always suggest to friends and acquaintances workquest wqt wusd worknet workquestapp blockchian crypto cryptolife btc bnb eth digitalization digitalassets saving binancesmartchain,0.06668341904878616,0.9188153743743896,0.014501145109534264
2022-05-20,17:15,"#Cardano has added an average of 2,340 new wallets per day over the past month

#blockchain #Crypto #Bitcoin #ADA",cardano has added an average of 2340 new wallets per day over the past month blockchain crypto bitcoin ada,0.42097005248069763,0.5669647455215454,0.012065206654369831
2022-05-20,17:15,"#BTC/USDT ANALYSIS

$BTC Breakdown bearish pennant continuation pattern to continue bearish movement , target down $23.400 - $24k if down in there at the time Close CME GAP for $BTC 

and then we see any Minor HNS pattern with breakdown target last wick before $26.800

in po…",btcusdt analysis btc breakdown bearish pennant continuation pattern to continue bearish movement target down 23400 24k if down in there at the time close cme gap for btc and then we see any minor hns pattern with breakdown target last wick before 26800 in po,0.028580624610185623,0.1797981709241867,0.791621208190918
2022-05-20,17:15,"@BTC_Archive #btc tax 50%, crypto tax 5% rumour has been going around...",btcarchive btc tax 50 crypto tax 5 rumour has been going around,0.027162306010723114,0.7901496291160583,0.18268801271915436
2022-05-20,17:15,"@jonwu_ Why lose 8.5% in a year when you can lose 50% over a month?

#bitcoin",jonwu why lose 85 in a year when you can lose 50 over a month bitcoin,0.03661254048347473,0.8830803632736206,0.08030709624290466
2022-05-20,17:15,"[⭐️ 🟡 FLASH-LOAN ⭐️]
COIN [TOMSWAP] COULD HAVE BEEN FLASH-LOANED

More Info in bio

$AU #Bitcoin #AutoCrypto #crypto #cryptocurrecy #BNB #ToTheMoon #BSC #BSCGem #GEM #altcoin #token",flashloan coin tomswap could have been flashloaned more info in bio au bitcoin autocrypto crypto cryptocurrecy bnb tothemoon bsc bscgem gem altcoin token,0.03205828741192818,0.9451018571853638,0.022839833050966263
2022-05-20,17:15,@TokunboAdesina That's why we need #Bitcoin    to stop printing too much cash.,tokunboadesina that is why we need bitcoin to stop printing too much cash,0.06536661088466644,0.9100733995437622,0.02455996163189411
2022-05-20,17:15,Omfg dead Okcoin 🤣#Bitcoin  #bsvhttps://t.co/lSpDMWU5mN,omfg dead okcoin bitcoin,0.02471981756389141,0.9192978739738464,0.055982258170843124
2022-05-20,17:15,"Project has transparency and safety exactly what we need to strengthen in the crypto world.
#WorkQuest $WQT $WUSD #WorkNet #WorkQuestApp #blockchian #crypto #cryptolife #BTC #BNB #ETH #digitalization #digitalassets #saving #BinanceSmartChain",project has transparency and safety exactly what we need to strengthen in the crypto world workquest wqt wusd worknet workquestapp blockchian crypto cryptolife btc bnb eth digitalization digitalassets saving binancesmartchain,0.21075809001922607,0.7812607884407043,0.007981096394360065
2022-05-20,17:15,What do #bitcoin community think of the #stacks thing? Genuinely curious.  $stacks,what do bitcoin community think of the stacks thing genuinely curious stacks,0.030034808441996574,0.9337302446365356,0.03623495250940323
2022-05-20,17:15,Create automated tasks with @jobboycom API Deposit withdraw with #crypto #bitcoin,create automated tasks with jobboycom api deposit withdraw with crypto bitcoin,0.04047772288322449,0.9392165541648865,0.020305754616856575
2022-05-20,17:15,"@CryptoRex69 Because the majority of market participants still misunderstand #Bitcoin. They view it primarily as a small tech stock, similar to ""crypto.""",cryptorex69 because the majority of market participants still misunderstand bitcoin they view it primarily as a small tech stock similar to crypto,0.03418384864926338,0.7496673464775085,0.21614880859851837
2022-05-20,17:15,"Current #Bitcoin Price is $28865 #BTC #Cryptos 
What u think straight ⏫ or a ⏬ then pump?",current bitcoin price is 28865 btc cryptos what u think straight or a then pump,0.025225302204489708,0.9465214610099792,0.028253234922885895
2022-05-20,17:15,Current #Bitcoin Price is $28869 #BTC #Crypto,current bitcoin price is 28869 btc crypto,0.02088012546300888,0.9491631388664246,0.02995668537914753
2022-05-20,17:15,@BitcoinResh @BTC_Archive That is correct. #bitcoin is free.,bitcoinresh btcarchive that is correct bitcoin is free,0.028634248301386833,0.9210602641105652,0.050305500626564026
2022-05-20,17:15,Some of my bull run #DeFi investments are turning into great #Bitcoin and #ETH DCA tools,some of my bull run defi investments are turning into great bitcoin and eth dca tools,0.1452973335981369,0.8434456586837769,0.011256982572376728
2022-05-20,17:15,@terra_money Forget it. This project is on life support and will die.  Go to $BCUBE and thank me later #LUNA #UST #NFT #BTC,terramoney forget it this project is on life support and will die go to bcube and thank me later luna ust nft btc,0.05967189371585846,0.9238092303276062,0.016518928110599518
2022-05-20,17:15,"A Friend: Are you a Crypto Trader

Me: No, I'm a #Bitcoin HODLer.

Few...",a are you a crypto trader no i am a bitcoin hodler few,0.032375603914260864,0.9108142852783203,0.05681005120277405
2022-05-20,17:15,"@SocialGood_Inc Thank you so much 
@SocialGood_Inc  for this awesome giveaway and giving back

@Jameetkudasai
@komsattt
@richardxxvx 

#Bitcoin  #Giveaway  $SG",socialgoodinc thank you so much socialgoodinc for this awesome giveaway and giving back jameetkudasai komsattt richardxxvx bitcoin giveaway sg,0.6682948470115662,0.3223174512386322,0.009387733414769173
2022-05-20,17:15,@cryptojack Have just accumulated #Bitcoin on finex. I hope we won't go dipper tho😅,cryptojack have just accumulated bitcoin on finex i hope we will not go dipper tho,0.053110938519239426,0.5425712466239929,0.4043178856372833
2022-05-20,17:15,VeThor Token (VTHO) went up 10.3 percent in the last 30 minutes on Binance. #VTHO  #crypto #bitcoin #cryptocurrency #btc #ethereum #blockchain #eth #trading #altcoin #binance #cryptonews,vethor token vtho went up 103 percent in the last 30 minutes on binance vtho crypto bitcoin cryptocurrency btc ethereum blockchain eth trading altcoin binance cryptonews,0.9177799820899963,0.06910576671361923,0.013114308938384056
2022-05-20,17:15,"Bitcoin and Ethereum Hash Rates Hit All-Time Highs Despite Bear Market
#btc #ETH",bitcoin and ethereum hash rates hit alltime highs despite bear market btc eth,0.9335499405860901,0.04640942066907883,0.020040592178702354
2022-05-20,17:15,"@FundHelios

This project is growing very fast. An experienced team does everything to make the project the best. High ratings show the great potential of this project. I encourage all of us to keep taking part in this project.
#Helios #Mining #Fintech #Insurtech #Crypto #Bitcoin",fundhelios this project is growing very fast an experienced team does everything to make the project the best high ratings show the great potential of this project i encourage all of us to keep taking part in this project helios mining fintech insurtech crypto bitcoin,0.5322453379631042,0.45821982622146606,0.009534841403365135
2022-05-20,17:15,"Real campaign! Really like the line consept of their device inside ,true professional,friendly staff and most importantly the idea with a promising future!! Success to us all.
#FGW #FunnyGameWorld #crypto #bitcoin #cryptocurrency #blockchain #bounty #binance #eth #token",real campaign really like the line consept of their device inside true professionalfriendly staff and most importantly the idea with a promising future success to us all fgw funnygameworld crypto bitcoin cryptocurrency blockchain bounty binance eth token,0.31335410475730896,0.6786437630653381,0.008002109825611115
2022-05-20,17:15,@john_scavone @dickcata @PeterMcCormack @DominicFrisby @bbcfivelive #BTC has 15 nodes.. you can actually get 100 million pounds if you can prove otherwise….,johnscavone dickcata petermccormack dominicfrisby bbcfivelive btc has 15 nodes you can actually get 100 million pounds if you can prove otherwise,0.22161337733268738,0.7685204744338989,0.009866110980510712
2022-05-20,17:15,"#FGW #FunnyGameWorld #crypto #bitcoin #cryptocurrency #blockchain #bounty #binance #eth #token #coinsbit 
promising project. we hope for the success of this project and the people who support this project will benefit greatly, i hope this project will last forever",fgw funnygameworld crypto bitcoin cryptocurrency blockchain bounty binance eth token coinsbit promising project we hope for the success of this project and the people who support this project will benefit greatly i hope this project will last forever,0.5598085522651672,0.4289882779121399,0.011203142814338207
2022-05-20,17:15,@TheEconomist They will destroy nature. They will become heroes with artificial food. They will prepare for the antichrist. They will declare themselves gods. The whole world must put a stop to this. Do not leave Allah (God).@JoeBiden #goodmorning #BTC #christian #muslim,theeconomist they will destroy nature they will become heroes with artificial food they will prepare for the antichrist they will declare themselves gods the whole world must put a stop to this do not leave allah godjoebiden goodmorning btc christian muslim,0.03871830925345421,0.9123872518539429,0.04889447242021561
2022-05-20,17:15,"#FGW #FunnyGameWorld #crypto #bitcoin #cryptocurrency #blockchain #bounty #binance #eth #token #coinsbit 
promising project with innovative team &amp; will put a lot of people on the right track and towards success in investing &amp; gaining profit in the financial sector",fgw funnygameworld crypto bitcoin cryptocurrency blockchain bounty binance eth token coinsbit promising project with innovative team will put a lot of people on the right track and towards success in investing gaining profit in the financial sector,0.8253811001777649,0.166971817612648,0.007647076155990362
2022-05-20,17:15,Oh noooo... #Bitcoin continues to tumble,oh noooo bitcoin continues to tumble,0.3352898359298706,0.5567079782485962,0.10800222307443619
2022-05-20,17:15,@zackvoell @TYonClubhouse Whatever/whoever is holding #btc down will eventually run out of money…,zackvoell tyonclubhouse whateverwhoever is holding btc down will eventually run out of money,0.018706943839788437,0.3240668773651123,0.6572262048721313
2022-05-20,17:15,"@bsc_daily @RealFlokiInu @Biconomy_Global that is awesome 👌 
This is a beautiful event, I hope everyone will join to our family 🥰
💎💎💎💎💎💎💎💎💎💎💎💎
Biconomy Exchange 🚀🚀🚀 
#BiconomyExchange #BITToken #BUYBIT #HOLDBIT #NFT #GameFi #launchpad #BTC  #ETH 

💫💫💥💥",bscdaily realflokiinu biconomyglobal that is awesome this is a beautiful event i hope everyone will join to our family biconomy exchange biconomyexchange bittoken buybit holdbit nft gamefi launchpad btc eth,0.18587401509284973,0.8050321936607361,0.009093723259866238
2022-05-20,17:15,"Let's Make a Massive Trend For 
1 BTCs = 3,000$💰..
Let's start
Like + Retweet + Follow
Let's Make Massive Trend 📈..

#BTCs #btc #crypto #futurebtc",let us make a massive trend for 1 btcs 3000 let us start like retweet follow let us make massive trend btcs btc crypto futurebtc,0.057056158781051636,0.9266341924667358,0.016309671103954315
2022-05-20,17:15,"#FGW #FunnyGameWorld #crypto #bitcoin #cryptocurrency #blockchain #bounty #binance #eth #token #coinsbit 
promising project ideas are always one of the key indicators of a successful initiative. this project is attractive in terms of investment",fgw funnygameworld crypto bitcoin cryptocurrency blockchain bounty binance eth token coinsbit promising project ideas are always one of the key indicators of a successful initiative this project is attractive in terms of investment,0.5503690838813782,0.4412071704864502,0.008423698134720325
2022-05-20,17:15,"Today is the day that starts it all. 

Zero followers.

I start with 1 #Ethereum and I build it to 1001.

Follow my progress, get involved and build with me, moves will be made but the end goal is to build that #Ethereum Bag. 

#Ethereum #Bitcoin #BinanceSmartChain #FEGtoken",today is the day that starts it all zero followers i start with 1 ethereum and i build it to 1001 follow my progress get involved and build with me moves will be made but the end goal is to build that ethereum bag ethereum bitcoin binancesmartchain fegtoken,0.05951443314552307,0.9251502156257629,0.01533537358045578
2022-05-20,17:15,"#Bitcoin 
Right now I feel ashamed to be a trader in a market that is manipulated like this.
Decentralization?!?
What a shame...",bitcoin right now i feel ashamed to be a trader in a market that is manipulated like this decentralization what a shame,0.07870113849639893,0.5988120436668396,0.3224867880344391
2022-05-20,17:15,#BTC is now at $28849.97,btc is now at 2884997,0.026123402640223503,0.9291656613349915,0.04471098259091377
2022-05-20,17:15,#Qatar launches first #Bitcoin exchange,qatar launches first bitcoin exchange,0.12644270062446594,0.8605324625968933,0.013024797663092613
2022-05-20,17:15,funding rate -0.75% 400 minutes #bitcoin,funding rate 075 400 minutes bitcoin,0.023754285648465157,0.9432590007781982,0.03298668563365936
2022-05-20,17:15,"#FGW #FunnyGameWorld #crypto #bitcoin #cryptocurrency #blockchain #bounty #binance #eth #token #coinsbit 
project has a strong team that strives for success.this project has an interesting idea, a well-thought-out, and well-developed concept",fgw funnygameworld crypto bitcoin cryptocurrency blockchain bounty binance eth token coinsbit project has a strong team that strives for successthis project has an interesting idea a wellthoughtout and welldeveloped concept,0.4143335819244385,0.5764073133468628,0.009259045124053955
2022-05-20,17:15,"#GMT Is The Biggest Swollen Coin And For Me The Real Price Is 0.51$ If I Had Any Of Them I Would Sold All Od Them Not A Financial Advice But I Love All Of u.

#Cryptos #Bitcoin #BinanceSmartChain #NFTCommunity #investors #terraluna #ADA #ETH #NFTCommunity",gmt is the biggest swollen coin and for me the real price is 051 if i had any of them i would sold all od them not a financial advice but i love all of u cryptos bitcoin binancesmartchain nftcommunity investors terraluna ada eth nftcommunity,0.048887304961681366,0.9297374486923218,0.021375318989157677
2022-05-20,17:15,@ashwsbreal FED.... BANKSTERS... FIAT MONIES..#BTC fixes this.,ashwsbreal fed banksters fiat moniesbtc fixes this,0.07125034183263779,0.8848214149475098,0.04392817243933678
2022-05-20,17:15,"Every bear
Every shorts 
Gonna be rekt..soon  long dildo 
#BTC #BNB",every bear every shorts gonna be rektsoon long dildo btc bnb,0.04161429405212402,0.9378949999809265,0.020490754395723343
2022-05-20,17:15,"@k_roberson2 The real Luna Inu is READY to send!🚀🚀#BSCgems #1000xgem #BSC
#BTC #memecoin #DAO #BinanceSmartChain",kroberson2 the real luna inu is ready to sendbscgems 1000xgem bsc btc memecoin dao binancesmartchain,0.10271219909191132,0.8860610723495483,0.011226655915379524
2022-05-20,17:15,@BTC_Archive Massive opportunity for all to take a position in #bitcoin. At least some in congress get it. Save the American dream!! @saylor @CathieDWood,btcarchive massive opportunity for all to take a position in bitcoin at least some in congress get it save the american dream saylor cathiedwood,0.45240238308906555,0.5381667017936707,0.009430866688489914
2022-05-20,17:15,@rovercrc Still early? #Bitcoin has been around over 13 years already Mr Bot.,rovercrc still early bitcoin has been around over 13 years already mr bot,0.1378246694803238,0.8443645238876343,0.017810791730880737
2022-05-20,17:15,"#Bitcoin sliding towards 19K levels, if it looses its *Real Price* support in 23-24 K area.
Apparently no TA/Volume as well as the Fundamentals which may support or pump in price or even the stability. Be cautious of the bull traps. 
#cryptocurrency",bitcoin sliding towards 19k levels if it looses its real price support in 2324 k area apparently no tavolume as well as the fundamentals which may support or pump in price or even the stability be cautious of the bull traps cryptocurrency,0.03339418023824692,0.04927564784884453,0.9173301458358765
2022-05-20,17:15,"People need to know that #Bitcoin never been coupled with #spy500 #spx500 .They need to remember that #Bitcoin was made for us to protect our money, our privacy.",people need to know that bitcoin never been coupled with spy500 spx500 they need to remember that bitcoin was made for us to protect our money our privacy,0.06201186031103134,0.9221790432929993,0.01580911874771118
2022-05-20,17:15,@Dennis_Porter_ Right. #btc is going to touch million $ within 70 years.,dennisporter right btc is going to touch million within 70 years,0.31804394721984863,0.672954261302948,0.00900180358439684
