Date,Time,Original tweet,Clean tweet,Positive,Neutral,Negative
2022-05-30,16:30,"How was your weekend guys?
We worked hard on a lot of cool stuff...big announcement and new video later today! 💥🦝🤟

In the meantime...
Welcome DOCTOR STRANGECOON!🔮

#DoctorStrange #NFT #NFTCommunity #NFTGiveaways #420Life #FreeNFT #MondayMotivation #Marvel #Crypto #Bitcoin https://t.co/DIQsLeKSsm",how was your weekend guys we worked hard on a lot of cool stuffbig announcement and new video later today in the meantime welcome doctor strangecoon doctorstrange nft nftcommunity nftgiveaways 420life freenft mondaymotivation marvel crypto bitcoin,0.1249600276350975,0.8578786253929138,0.017161360010504723
2022-05-30,16:30,"[₿] #Bitcoin Daily $BTC [₿]

Kraken❯
A:$30,620 L:$29,282 H:$30,900
Bitstamp❯
A:$30,642 L:$29,051 H:$30,903
Bitfinex❯
A:$30,663 L:$29,074 H:$31,000

Market Cap: $583,335,323,941
24h Volume: $6,109,228,123
24h: 4.68%  7d: 14.96%",bitcoin daily btc kraken bitstamp bitfinex market 583335323941 24h 6109228123 468 1496,0.04457792639732361,0.9282910823822021,0.027131058275699615
2022-05-30,16:30,"#Bitcoin (BTC) Price Rebounds, Giving Investors Sigh of Relief https://t.co/chC9Evrpuk via @coinjupiter",bitcoin btc price rebounds giving investors sigh of relief via coinjupiter,0.538935124874115,0.07063531875610352,0.3904295861721039
2022-05-30,16:30,Be Honest do you still believe $VINU going to $0.0002! 🐶 #Bitcoin #BTC #Ethereum #ETH #Crypto #altcoin #BSC #BSCGem #LUNA…,be honest do you still believe vinu going to 00002 bitcoin btc ethereum eth crypto altcoin bsc bscgem luna,0.08092930167913437,0.9069705009460449,0.012100201100111008
2022-05-30,16:30,Bitcoin fiat price in last day https://t.co/JQwPzDdy5f #BTC #bitcoin  #R #ggplot2 https://t.co/2iSOl0k3Mc,bitcoin fiat price in last day btc bitcoin r ggplot2,0.03473809361457825,0.9202812314033508,0.04498071223497391
2022-05-30,16:30,Bitcoin fiat price in last month https://t.co/JQwPzDdy5f #BTC #bitcoin #R #ggplot2 https://t.co/tPBKk5TsZn,bitcoin fiat price in last month btc bitcoin r ggplot2,0.041288185864686966,0.9272468090057373,0.031464967876672745
2022-05-30,16:30,Bitcoin fiat price in last week https://t.co/JQwPzDdy5f #BTC #bitcoin  #R #ggplot2 https://t.co/Uw7SCWDsfc,bitcoin fiat price in last week btc bitcoin r ggplot2,0.03691764175891876,0.9284916520118713,0.03459068015217781
2022-05-30,16:30,Histogram of bitcoin fiat price in last day https://t.co/JQwPzDdy5f #BTC #bitcoin  #R #ggplot2 https://t.co/wQUPYLrfSA,histogram of bitcoin fiat price in last day btc bitcoin r ggplot2,0.031004173681139946,0.9218674898147583,0.047128304839134216
2022-05-30,16:30,Histogram of bitcoin fiat price in last week https://t.co/JQwPzDdy5f #BTC #bitcoin  #R #ggplot2 https://t.co/wM3soeT2wF,histogram of bitcoin fiat price in last week btc bitcoin r ggplot2,0.03663482517004013,0.9261462688446045,0.03721889853477478
2022-05-30,16:30,Histogram of bitcoin fiat price in last month https://t.co/JQwPzDdy5f #BTC #bitcoin  #R #ggplot2 https://t.co/DO9cClMejp,histogram of bitcoin fiat price in last month btc bitcoin r ggplot2,0.03720629960298538,0.9258334040641785,0.036960288882255554
2022-05-30,16:30,"NEED a #JOB?
Sign up now https://t.co/o7lVlsCHXv
FREE. NO MIDDLEMEN
#Jobs #AI #DataAnalytics #MachineLearning #Python #JavaScript #WomenWhoCode #Programming #Coding #100DaysofCode #DEVCommunity #gamedev #gamedevelopment #indiedev #IndieGameDev #Mobile #gamers #RHOP #BTC #ETH #SOL https://t.co/SZMNEw8vys",need a job sign up now free no middlemen jobs ai dataanalytics machinelearning python javascript womenwhocode programming coding 100daysofcode devcommunity gamedev gamedevelopment indiedev indiegamedev mobile gamers rhop btc eth sol,0.033379729837179184,0.9003863334655762,0.06623385101556778
2022-05-30,16:30,"🇬🇧 LIVE IN 30MINS WITH ‘THE UK BITCOIN MASTER LIVE SHOW’ (EP 429) 🇬🇧
#bitcoin  (30-05-2022)
https://t.co/FrrwLg6ll0",live in 30mins with the uk bitcoin master live show ep 429 bitcoin 30052022,0.040729738771915436,0.9349552392959595,0.024315062910318375
2022-05-30,16:30,"@thomas_quinlan @Mashinsky @CelsiusNetwork I’m still #HODLing my #cel tokens. I bought alot at $3-$4. I have no more extra funds to DCA on it, I put it in #Bitcoin and #ADA instead. Just Hodling my bag.",thomasquinlan mashinsky celsiusnetwork im still hodling my cel tokens i bought alot at 3 4 i have no more extra funds to dca on it i put it in bitcoin and ada instead just hodling my bag,0.03231773525476456,0.9352274537086487,0.03245474770665169
2022-05-30,16:30,Just wanted to give a shout out to all the projects that have messaged me ahead of the trade token launch. Your support hasn’t gone unnoticed and it’s great to see the space pulling together. #DeFi #cryptocurrencies #Bitcoin,just wanted to give a shout out to all the projects that have messaged me ahead of the trade token launch your support hasn not gone unnoticed and its great to see the space pulling together defi cryptocurrencies bitcoin,0.7312189936637878,0.25656619668006897,0.012214820832014084
2022-05-30,16:30,#Bitcoin to the moon 🚀❔❓,bitcoin to the moon,0.09707019478082657,0.8775932788848877,0.025336477905511856
2022-05-30,16:30,@Blockworks_ JUST IN: The 🇮🇳 Indian Government is finalizing its crypto consultation paper #btc,blockworks just the indian government is finalizing its crypto consultation paper btc,0.13009676337242126,0.8587329387664795,0.011170302517712116
2022-05-30,16:30,"How Terra's Collapse Could Prompt an International Wave of Crypto Regulations.

Short-term crackdowns could have long-term effects if more governments become less crypto-friendly..

#crypto #btc #eth #xrp",how terra collapse could prompt an international wave of crypto regulations shortterm crackdowns could have longterm effects if more governments become less cryptofriendly crypto btc eth xrp,0.020039251074194908,0.3510003983974457,0.6289602518081665
2022-05-30,16:30,"Not all Altcoins recover previous ATH. #crypto #defi #BTC #ETH #TRX

I've seen a lot of speculation from individual coin subs claiming ""this is a great price to get in, just think when we go back to ATH you'll make so much money!"", ""bargain when we hit ATH""! etc etc etc

But…",not all altcoins recover previous ath crypto defi btc eth trx i have seen a lot of speculation from individual coin subs claiming this is a great price to get in just think when we go back to ath you will make so much money bargain when we hit ath etc etc etc but,0.14753827452659607,0.8308464288711548,0.021615291014313698
2022-05-30,16:30,"#Bitcoin

Everybody having bots fun 😂😂

Ponzi really living up to its reputation. All that wash trading money flows into the $Luna rescue mission coordinated by Binance.

1.2$ billion down 👀🎯",bitcoin everybody having bots fun ponzi really living up to its reputation all that wash trading money flows into the luna rescue mission coordinated by binance 12 billion down,0.09296292811632156,0.8852457404136658,0.021791398525238037
2022-05-30,16:30,"First tweet. New alt. Looking for crypto friends to share alpha and shitposts. LFG.

#btc #eth #ltc #xrp #ada #doge #ftm #avax #dot #crypto #nft #bayc #cryptopunks #sovereign",first tweet new alt looking for crypto friends to share alpha and shitposts lfg btc eth ltc xrp ada doge ftm avax dot crypto nft bayc cryptopunks sovereign,0.061279408633708954,0.9233942031860352,0.015326358377933502
2022-05-30,16:30,Has anyone forgotten that reps from 44 countries met to learn about #Bitcoin ? 2 weeks ago?,has anyone forgotten that reps from 44 countries met to learn about bitcoin 2 weeks ago,0.1157962754368782,0.8650264739990234,0.019177276641130447
2022-05-30,16:30,"@rovercrc This is already a rejection on that support signifying that #bitcoin is bouncing off and staying bullish on this week and next week to come.
You can follow @BrizzaMabel or send #DM for all you need to stay informed.",rovercrc this is already a rejection on that support signifying that bitcoin is bouncing off and staying bullish on this week and next week to come you can follow brizzamabel or send dm for all you need to stay informed,0.07856600731611252,0.6833557486534119,0.2380782514810562
2022-05-30,16:30,Gold or #Bitcoin ? are you a lifter or investor ?,gold or bitcoin are you a lifter or investor,0.0712156742811203,0.905460774898529,0.023323537781834602
2022-05-30,16:30,"This is a very strong project and my favorite projects. I think this project will gain a lot more popularity in the future.i request everyone to come and see the project. The project is going to success.
#BRIDGESWAP #CRYPTO #BTC #BINANCE",this is a very strong project and my favorite projects i think this project will gain a lot more popularity in the futurei request everyone to come and see the project the project is going to success bridgeswap crypto btc binance,0.5120611190795898,0.4788198471069336,0.009119031019508839
2022-05-30,16:30,The #ROX Baseline is gonna keep on rising 🧨Everything is gonna be ✅ #BNB #BSC #ETH #USDT #BTC Next100XGEMS Crypt0mum…,the rox baseline is gonna keep on rising everything is gonna be bnb bsc eth usdt btc next100xgems crypt0mum,0.19251804053783417,0.7948461771011353,0.012635752558708191
2022-05-30,16:30,#Bitcoin #ETH moving! #VOLTINU will go parabolic any time now📈📈📈📈📈📈📈📈📈📈📈🚀🚀🚀🚀🚀🚀👀🎉🎉🎉🎉⚡️⚡️⚡️🚀🚀 if you know crypto you know! Hop in! #VOLT #CRYPTO,bitcoin eth moving voltinu will go parabolic any time now if you know crypto you know hop in volt crypto,0.02602519281208515,0.9280298948287964,0.04594486579298973
2022-05-30,16:30,#bitcoin didn't go to Davis.,bitcoin did not go to davis,0.02269788086414337,0.9266461730003357,0.050655994564294815
2022-05-30,16:30,@LayahHeilpern There is a #BTC vs #Altcoins crisis on #Twitter,layahheilpern there is a btc vs altcoins crisis on twitter,0.01947271078824997,0.11969271302223206,0.8608346581459045
2022-05-30,16:30,"@LUNRR_ @crypto_bitlord7 @LUNRR_ great initiative, great goal, we're heading to millions mcap

$LUNRR #LUNAtics #100xgem #ETH #Crypto #SHIB #lunaburn #gem #100xgem #1000xgem #Crypto #LUNA #Terra #BTC #Lunaterra #lunc",lunrr cryptobitlord7 lunrr great initiative great goal we are heading to millions mcap lunrr lunatics 100xgem eth crypto shib lunaburn gem 100xgem 1000xgem crypto luna terra btc lunaterra lunc,0.2128039300441742,0.7780985236167908,0.009097517468035221
2022-05-30,16:30,People who make money are the ones who are not afraid of losing it. #Bitcoin,people who make money are the ones who are not afraid of losing it bitcoin,0.035462554544210434,0.9180229306221008,0.04651452973484993
2022-05-30,16:30,@Route2FI Buy only #Bitcoin,route2fi buy only bitcoin,0.04060055688023567,0.9440256357192993,0.015373839065432549
2022-05-30,16:30,"I've been putting my $USDC into @Polytrade_fin for a year, and it's been slowly growing, so I'm delighted I made the right decision. 

$TRADE #BTC #Cryptos",i have been putting my usdc into polytradefin for a year and it is been slowly growing so i am delighted i made the right decision trade btc cryptos,0.8324676156044006,0.1589570939540863,0.00857536680996418
2022-05-30,16:30,"$FRR   $FEAR  $SLIMA pump is coming, nothing will stop it#BNB #BTC #altcoin🔥🔥🔥🔥🔥🔥🔥🔥🔥",frr fear slima pump is coming nothing will stop itbnb btc altcoin,0.0556681863963604,0.8842630386352539,0.06006883457303047
2022-05-30,16:30,"#bitcoin #eth #luna 

Luna just went live on kucoin futures 20x max. 
Up 1100% right now.",bitcoin eth luna luna just went live on kucoin futures 20x max up 1100 right now,0.12662597000598907,0.8589012622833252,0.014472694136202335
2022-05-30,16:30,"🟩 Block 738597 ⛏ ⛏

📅 30th May 2022, 16:27:18 GMT

📣 2,510 tx with a value of 21,416.766 ₿ ($655.63m 🇺🇸)

📣 distributed to 7,665 recipients 💎🙌

📣 19,053,737.50 ₿ (90.73208%) mined ⛏

📣 1,946,262.50 ₿ remaining 💰

#bitcoin #tictoknextblock",block 738597 30th may 2022 gmt 2510 tx with a value of 21416766 65563m distributed to 7665 recipients 1905373750 9073208 mined 194626250 remaining bitcoin tictoknextblock,0.04895447939634323,0.926167368888855,0.024878129363059998
2022-05-30,16:30,@CryptoCapo_ wen #btc dump ser?,cryptocapo wen btc dump ser,0.05058947950601578,0.9259266257286072,0.023483870550990105
2022-05-30,16:30,Interacting with the Defi protocol can be a daunting task. But the BridgeSwap team has created a whole host of DeFi glossaries to help you get used to BridgeSwap! #BRIDGESWAP #CRYPTO #BTC #BINANCE,interacting with the defi protocol can be a daunting task but the bridgeswap team has created a whole host of defi glossaries to help you get used to bridgeswap bridgeswap crypto btc binance,0.07711192220449448,0.9095997214317322,0.01328830886632204
2022-05-30,16:30,"1 Bitcoin ( #BTC )
Dollar: 30,627.02$ 

1 Bitcoin Cash ( #BCH )
Dollar: 1,88.85$ 

1 Ethereum ( #ETH )
Dollar: 1,915.24$ 

1 Ripple ( #XRP )
Dollar: 0.39839$ 

Date: 30 May 2022 16:27

#Bitcoin #Ethereum #cryptocurrency #crypto #altcoin #Blockchain #Ripple",1 bitcoin btc 3062702 1 bitcoin cash bch 18885 1 ethereum eth 191524 1 ripple xrp 039839 30 may 2022 bitcoin ethereum cryptocurrency crypto altcoin blockchain ripple,0.037371352314949036,0.9410132169723511,0.021615352481603622
2022-05-30,16:30,"Sold a few sats, because I really wanted that music instrument. Feels bad man 😞 #Bitcoin",sold a few sats because i really wanted that music instrument feels bad man bitcoin,0.13691873848438263,0.8227306604385376,0.04035061225295067
2022-05-30,16:30,"👋 A new block was found on the #Bitcoin network. We're at block height 738597, current #bitcoin price is $30614.74 and there are 194623747690011 #sats left to mine.",a new block was found on the bitcoin network we are at block height 738597 current bitcoin price is 3061474 and there are 194623747690011 sats left to mine,0.024474525824189186,0.9267604351043701,0.04876505583524704
2022-05-30,16:30,What’s the biggest opportunity to make money in #crypto right now? #Bitcoin,whats the biggest opportunity to make money in crypto right now bitcoin,0.08094025403261185,0.9053649306297302,0.013694780878722668
2022-05-30,16:30,"I know altcoins have great profits, if you're a gambler or on a fluke, I don't recommend buying altcoins, a lot of people have gone bankrupt because of Luna, this may only be a warning #BTC #USDT",i know altcoins have great profits if you are a gambler or on a fluke i do not recommend buying altcoins a lot of people have gone bankrupt because of luna this may only be a warning btc usdt,0.028991375118494034,0.44428038597106934,0.5267282128334045
2022-05-30,16:30,#bitcoin $30630 Ethereum $1911.89,bitcoin 30630 ethereum 191189,0.02905610203742981,0.9341316819190979,0.036812227219343185
2022-05-30,16:30,"@mikealfred #Bitcoin definitely has peoples attention, especially if JPow pivots.",mikealfred bitcoin definitely has peoples attention especially if jpow pivots,0.541442334651947,0.423136830329895,0.035420842468738556
2022-05-30,16:30,I AM MEGA BULLISH ON #BITCOIN! 🚀⚡️,i am mega bullish on bitcoin,0.14892947673797607,0.6969114542007446,0.15415909886360168
2022-05-30,16:30,@mikealfred That scenario is no problem for anyone… the problematic scenario would be #Bitcoin between 3k-30k for the next 10 years.,mikealfred that scenario is no problem for anyone the problematic scenario would be bitcoin between 3k30k for the next 10 years,0.04998541250824928,0.9181543588638306,0.03186025097966194
2022-05-30,16:30,Current #Bitcoin Price is $30645 #BTC #Crypto,current bitcoin price is 30645 btc crypto,0.021845676004886627,0.9513599872589111,0.02679433859884739
2022-05-30,16:30,@Ledger_Support hello 👋 please explain why i can see numerous confirmed #btc #transactions in my #ledger  history of deposits made &amp; also on #blockchain explorer. how is that possible? can send #tx id of #transactions. i received almost 2 #bitcoin then it vanished but transactions have not????,ledgersupport hello please explain why i can see numerous confirmed btc transactions in my ledger history of deposits made also on blockchain explorer how is that possible can send tx id of transactions i received almost 2 bitcoin then it vanished but transactions have not,0.03933541104197502,0.9330642819404602,0.02760031819343567
2022-05-30,16:30,@TralfamadorianH This is why #Bitcoin saves us,tralfamadorianh this is why bitcoin saves us,0.045898448675870895,0.9120954871177673,0.042006105184555054
2022-05-30,16:30,"💥 Lightning Network capacity hits all time of +3,900 #Bitcoin 🙌",lightning network capacity hits all time of 3900 bitcoin,0.3576916754245758,0.6295819282531738,0.012726417742669582
2022-05-30,16:30,"@airdropinspect This is so amazing. I am impressed with this project, hopefully with this event the community and especially this coin will achieve success.

@MdAbdul015 
@Mdfaisalsk 
@Yeasin06 

#Airdrop #Airdrops #Airdropinspector #BSC #CharityToken #CHAT #Crypto #Bitcoin",airdropinspect this is so amazing i am impressed with this project hopefully with this event the community and especially this coin will achieve success mdabdul015 mdfaisalsk yeasin06 airdrop airdrops airdropinspector bsc charitytoken chat crypto bitcoin,0.6751488447189331,0.3158980906009674,0.008953140117228031
2022-05-30,16:30,"#Bitcoin
#BTC
Bitcoin is inevitable.",bitcoin btc bitcoin is inevitable,0.03566954657435417,0.9385506510734558,0.02577977254986763
2022-05-30,16:30,"@SwanBitcoin May sell more copies if you were more descriptive like “The BTC Butt Kisser”
#BTC",swanbitcoin may sell more copies if you were more descriptive like the btc butt kisser btc,0.10359016805887222,0.8843379020690918,0.012071982957422733
2022-05-30,16:30,"@OfficialTravlad Let’s go🔥🔥this would be so amazing!❤️❤️ 
@1CrypticPoet @BigWin_ForHakim @WinnerBigwin999 @winaerywin @zirayla__ @pickawbigwinn1 @cryptokatH22 @cc_aryan 
@bigwmoon @NFTETG
🎉🎉🎉
#BTC #BNB #ETH #LUNA #luna2 #BinanceSmartChain #NFT #Airdrop #BSCGems
🔥🔥🔥",officialtravlad lets gothis would be so amazing 1crypticpoet bigwinforhakim winnerbigwin999 winaerywin zirayla pickawbigwinn1 cryptokath22 ccaryan bigwmoon nftetg btc bnb eth luna luna2 binancesmartchain nft airdrop bscgems,0.1068112701177597,0.8733184337615967,0.01987023651599884
2022-05-30,16:30,@UniverseTwenty Efforts to mislead investors continue. Thank heavens that investors have got smarter. Both #Bitcoin and #ETH were ruined by pumpers. Same happening with #XRP,universetwenty efforts to mislead investors continue thank heavens that investors have got smarter both bitcoin and eth were ruined by pumpers same happening with xrp,0.06213390827178955,0.10558192431926727,0.832284152507782
2022-05-30,16:30,"@shakepay I love the smell of #Bitcoin in the morning 🌄  .....and the afternoon, I love it in the evening and underneath the moon  🌙 🤣",shakepay i love the smell of bitcoin in the morning and the afternoon i love it in the evening and underneath the moon,0.06568015366792679,0.9140486121177673,0.020271217450499535
2022-05-30,16:30,"#Bitcoin  nerd 😎. forever bullish on governance tokens

#BTC #cryptocurrency #blockchain",bitcoin nerd forever bullish on governance tokens btc cryptocurrency blockchain,0.0568658784031868,0.9013261198997498,0.04180796816945076
2022-05-30,16:30,@kyel_es Can we put some #Bitcoin on it mr kyel,kyeles can we put some bitcoin on it mr kyel,0.08550164848566055,0.9015100598335266,0.01298829447478056
2022-05-30,16:30,"Nothing can be called Steady Passive Income 

if its not consistent, 
if it needs more investment than initial 
If revenue generated depends on other new buyers

Check us out as we are building to eliminate all above points

#NFTGiveaway #nfts #NFTCollection #btc #mining #crypto",nothing can be called steady passive income if its not consistent if it needs more investment than initial if revenue generated depends on other new buyers check us out as we are building to eliminate all above points nftgiveaway nfts nftcollection btc mining crypto,0.05751120299100876,0.9179158210754395,0.02457292377948761
2022-05-30,16:30,"Hopefully - BTC would/could/should make a pop to The Fair Value Territory - between 30-40k. However, there is no real catalyst, except for the Equities market rally. A modest Crypto rally would give the opportunity to get out with small profit. 💰#Crypto #BTC #Ethereum #APE",hopefully btc wouldcouldshould make a pop to the fair value territory between 3040k however there is no real catalyst except for the equities market rally a modest crypto rally would give the opportunity to get out with small profit crypto btc ethereum ape,0.5892136693000793,0.3998194634914398,0.010966910980641842
2022-05-30,16:30,Bitcoin gives us everything that banks never gave us.. #Bitcoin,bitcoin gives us everything that banks never gave us bitcoin,0.1162891611456871,0.8720462322235107,0.011664604768157005
2022-05-30,16:30,"This project will go much further in the future because the team working on it is very strong. We will be happy to see the achievements and results of this excellent project.
#IKONIC #CRYPTO #BSC #BINANCE #BITCOIN",this project will go much further in the future because the team working on it is very strong we will be happy to see the achievements and results of this excellent project ikonic crypto bsc binance bitcoin,0.824592649936676,0.16787530481815338,0.007532058283686638
2022-05-30,16:30,"@AirdropStario That's a Really fantastic &amp; Amazing project. I am very happy to become a part of this event. Thanks for the opportunity.

#cryptocurrency #Airdrop #BSC #Bitcoin #USDT #WALKEE #Airdropstario",airdropstario that is a really fantastic amazing project i am very happy to become a part of this event thanks for the opportunity cryptocurrency airdrop bsc bitcoin usdt walkee airdropstario,0.3858388066291809,0.6047757267951965,0.009385418146848679
2022-05-30,16:30,"#ZEC/USDT Scalp Long !!

Entry Zone:9510 &amp; 9000

Sell zone:9600-9700-9900-10200

StopLoss : 1Hour Close under 8900

Lev : Cross  20-50x 

INVEST 1% OF YOUR TOTAL PORTFOLIO 

#BTC #CRYPTO #BINANCE #KUCOIN #shiba #memecoin #altcoin",zecusdt scalp long entry 9000 sell stoploss 1hour close under 8900 lev cross 2050x invest 1 of your total portfolio btc crypto binance kucoin shiba memecoin altcoin,0.10936705023050308,0.8779416680335999,0.012691277079284191
2022-05-30,16:30,"@AirdropDet I hope the token will be big and strong forever
#Airdrops #Maxity #Bitcoin #AirdropDetective #Crypto #BUSD",airdropdet i hope the token will be big and strong forever airdrops maxity bitcoin airdropdetective crypto busd,0.1613694280385971,0.829047679901123,0.009582825005054474
2022-05-30,16:30,This project with very good design and great goal  perspective in future.I see many people support it  don't forgot to follow the announcement. #BRIDGESWAP #CRYPTO #BTC #BINANCE,this project with very good design and great goal perspective in futurei see many people support it do not forgot to follow the announcement bridgeswap crypto btc binance,0.5464242100715637,0.44471046328544617,0.008865322917699814
2022-05-30,16:30,"@Crypto__Diva I believe you would have been in the #BTC or $ETH community

I implore you to join @SYSARMY as well, because the community has been growing massively since the NEVM smart contract was deployed on the @syscoin platform. And it also enables you to build your ideas on the $SYS chain",cryptodiva i believe you would have been in the btc or eth community i implore you to join sysarmy as well because the community has been growing massively since the nevm smart contract was deployed on the syscoin platform and it also enables you to build your ideas on the sys chain,0.4518704116344452,0.5405744314193726,0.007555121090263128
2022-05-30,16:30,elonmusk pmarca He also buying  #btc,elonmusk pmarca he also buying btc,0.05065421387553215,0.9338318705558777,0.015513946302235126
2022-05-30,16:30,"Like if you hodl #Bitcoin     

Retweet if you hodl &amp; buy more #Bitcoin",like if you hodl bitcoin retweet if you hodl buy more bitcoin,0.03834960237145424,0.9419846534729004,0.019665710628032684
2022-05-30,16:30,"@AztecGoldHero @sasha35625 Thank you  @sasha35625 
we love you and your team.

 #wavesarmy  #waves #vires #wx

#Bitcoin",aztecgoldhero sasha35625 thank you sasha35625 we love you and your team wavesarmy waves vires wx bitcoin,0.20649853348731995,0.7835142612457275,0.00998715776950121
2022-05-30,16:30,"What a relief for #Bitcoin, we want this 30k support 👊",what a relief for bitcoin we want this 30k support,0.9208070039749146,0.06331931054592133,0.01587366685271263
2022-05-30,16:30,"💥ARGENTINA: 12% own #Bitcoin or crypto. 

Inflation is 60% there 🤔",12 own bitcoin or crypto inflation is 60 there,0.04253993183374405,0.8987720608711243,0.058688078075647354
2022-05-30,16:30,@twobitidiot Interesting take. I am wondering how we expect #Bitcoin and #Crypto price to be unrelated to $COIN and $MSTR price? I think they are likely to move together.,twobitidiot interesting take i am wondering how we expect bitcoin and crypto price to be unrelated to coin and mstr price i think they are likely to move together,0.03453094884753227,0.9331192970275879,0.032349757850170135
2022-05-30,16:30,@saylor #Bitcoin help us fight for freedom,saylor bitcoin help us fight for freedom,0.13512466847896576,0.8523761630058289,0.012499174103140831
