Date,Time,Original tweet,Clean tweet,Positive,Neutral,Negative
2022-04-30,6:45,#bitcoin is now $38717 #wagmi https://t.co/Z20H8wt0Uy,bitcoin is now 38717 wagmi,0.022236011922359467,0.9354986548423767,0.04226534813642502
2022-04-30,6:45,"Organizations face #cybersecurity #debt for not prioritizing cybersecurity 
https://t.co/ulmpavAWoa

#AIEthics #MachineLearning #AI #Python #DeepLearning #IoT #100DaysOfCode #fintech #insurtech #nocode #bitcoin #cybersecurity #cybersecurite #metaverse https://t.co/gePjAZa97V",organizations face cybersecurity debt for not prioritizing cybersecurity aiethics machinelearning ai python deeplearning iot 100daysofcode fintech insurtech nocode bitcoin cybersecurity cybersecurite metaverse,0.023678449913859367,0.7940146327018738,0.18230696022510529
2022-04-30,6:45,@woonomic Are these #bitcoin futures ETF?,woonomic are these bitcoin futures etf,0.02376582846045494,0.9318364858627319,0.04439770057797432
2022-04-30,6:45,What year did you first purchase #Bitcoin ? ⬇️,what year did you first purchase bitcoin,0.031875740736722946,0.9456909894943237,0.02243332378566265
2022-04-30,6:45,"Full thanks to @cryptocharts_M as they have analysed this severe #bitcoin crash and #cryptocrash so my funds doesn't affected and I have not faced any type of losses 
They are absolutely amazing in tips,advices and everything. Thankyou for saving me sir. #BTC #ETH #Cryptos🔅",full thanks to cryptochartsm as they have analysed this severe bitcoin crash and cryptocrash so my funds does not affected and i have not faced any type of losses they are absolutely amazing in tipsadvices and everything thankyou for saving me sir btc eth cryptos,0.3660181164741516,0.6201736927032471,0.013808191753923893
2022-04-30,6:45,"@Dennis_Porter_ Are you just going to just watch, without doing anything. Don't be left behind, #BTC $100000, #SHIBA $3, #DOGE $5, #CAKE, #BTTC #dogearmy #SHIBARMY Dont forget add more if price going down.",dennisporter are you just going to just watch without doing anything do not be left behind btc 100000 shiba 3 doge 5 cake bttc dogearmy shibarmy dont forget add more if price going down,0.030360130593180656,0.8842530250549316,0.08538676798343658
2022-04-30,6:45,"Full thanks to @cryptocharts_M as they have analysed this #Bitcoin crash so my funds doesn't affected and I have not faced any type of losses 
They are absolutely amazing in tips,advices and everything😊 #NFT #DeFi #Metaverse #WEB3 #cryptocurrency💗",full thanks to cryptochartsm as they have analysed this bitcoin crash so my funds does not affected and i have not faced any type of losses they are absolutely amazing in tipsadvices and everything nft defi metaverse web3 cryptocurrency,0.19111235439777374,0.7932155132293701,0.01567208394408226
2022-04-30,6:45,"Great project! See what a professional team I think he has more future! Good opportunity to earn money by investing in this pro
#WorkQuest $WQT $WUSD #WorkNet #WorkQuestApp #blockchian #crypto #cryptolife #BTC #BNB #ETH #digitalization #digitalassets #saving #BinanceSmartChain",great project see what a professional team i think he has more future good opportunity to earn money by investing in this pro workquest wqt wusd worknet workquestapp blockchian crypto cryptolife btc bnb eth digitalization digitalassets saving binancesmartchain,0.22917607426643372,0.7626301050186157,0.008193764835596085
2022-04-30,6:45,"$BTC Latest Block Info: Block 734206 holds 582 transactions for a total of 1,142.16373 #Bitcoin including Block Reward. Block Size 1,207,283 Bytes",btc latest block block 734206 holds 582 transactions for a total of 114216373 bitcoin including block reward block size 1207283 bytes,0.028192097321152687,0.9477652907371521,0.024042576551437378
2022-04-30,6:45,"My heartful thankyou to @tradeosiann for knowing me this dangerous #Bitcoin crash and #Ethereum crash. That's because of you only  I didn't cause any type of losses. A huge thankyou to you once again. #BitcoinCrash #cryptocurrency crash  ""accurate from all."" ,C,x",my heartful thankyou to tradeosiann for knowing me this dangerous bitcoin crash and ethereum crash that is because of you only i did not cause any type of losses a huge thankyou to you once again bitcoincrash cryptocurrency crash accurate from all cx,0.1764596402645111,0.8020895719528198,0.021450765430927277
2022-04-30,6:45,"@btc_charlie Are you just going to just watch, without doing anything. Don't be left behind, #BTC $100000, #SHIBA $3, #DOGE $5, #CAKE, #BTTC #dogearmy #SHIBARMY Dont forget add more if price going down.",btccharlie are you just going to just watch without doing anything do not be left behind btc 100000 shiba 3 doge 5 cake bttc dogearmy shibarmy dont forget add more if price going down,0.02977384440600872,0.8881657123565674,0.08206047117710114
2022-04-30,6:45,"👋 A new block was found on the #Bitcoin network. We're at block height 734206, current #bitcoin price is $38718.44 and there are 197368122690011 #sats left to mine.",a new block was found on the bitcoin network we are at block height 734206 current bitcoin price is 3871844 and there are 197368122690011 sats left to mine,0.02649794891476631,0.9291583895683289,0.04434366896748543
2022-04-30,6:45,"@mdtrade #BTC RSI has been indicating strength while price has been on a decline. This indication 

may be foreseeing underlying strength within #Bitcoin , and it may only be a matter of time before price reflects in a MAJOR way

I’ve been taking @bnbt_ix TA seriously and I’ve been superb",mdtrade btc rsi has been indicating strength while price has been on a decline this indication may be foreseeing underlying strength within bitcoin and it may only be a matter of time before price reflects in a major way ive been taking bnbtix ta seriously and ive been superb,0.2062770426273346,0.05819641798734665,0.7355266213417053
2022-04-30,6:45,"My heartful thankyou to @tradeosiann for knowing me this dangerous #Bitcoin crash and #Ethereum crash. That's because of you only  I didn't cause any type of losses. A huge thankyou to you once again. #BitcoinCrash #cryptocurrency crash  ""accurate from all."" C,c",my heartful thankyou to tradeosiann for knowing me this dangerous bitcoin crash and ethereum crash that is because of you only i did not cause any type of losses a huge thankyou to you once again bitcoincrash cryptocurrency crash accurate from all cc,0.19534479081630707,0.7857009768486023,0.01895422674715519
2022-04-30,6:45,There are now two countries where #bitcoin is legal tender. This is HUGE!!!!,there are now two countries where bitcoin is legal tender this is huge,0.04622410610318184,0.933307945728302,0.020467938855290413
2022-04-30,6:45,@EndlessBullrun @Arthur_van_Pelt @kurtwuckertjr And he holds more #btc than he does #bsv ( in $ value) which contradicts his entire narrative that bsv is his #1 choice,endlessbullrun arthurvanpelt kurtwuckertjr and he holds more btc than he does bsv in value which contradicts his entire narrative that bsv is his 1 choice,0.04067254438996315,0.6582834720611572,0.30104395747184753
2022-04-30,6:45,"@AltcoinGordon Are you just going to just watch, without doing anything. Don't be left behind, #BTC $100000, #SHIBA $3, #DOGE $5, #CAKE, #BTTC #dogearmy #SHIBARMY Dont forget add more if price going down.",altcoingordon are you just going to just watch without doing anything do not be left behind btc 100000 shiba 3 doge 5 cake bttc dogearmy shibarmy dont forget add more if price going down,0.030905622988939285,0.8826151490211487,0.08647927641868591
2022-04-30,6:45,"Contact us 
swapping cryptocurrency at a ratio of 1:1.1~3 or more
For example, Giving $100 worth of #xrp , Immediately exchanging it for $110-120 worth of #btc
telegram: @exc00
Starting off with a small amount of money.
#BTC #XRP #DASH #DOGE",contact us swapping cryptocurrency at a ratio of or more for example giving 100 worth of xrp immediately exchanging it for 110120 worth of btc exc00 starting off with a small amount of money btc xrp dash doge,0.08021506667137146,0.906299352645874,0.01348560955375433
2022-04-30,6:45,"My heartful thankyou to @tradeosiann for knowing me this dangerous #Bitcoin crash and #Ethereum crash. That's because of you only  I didn't cause any type of losses. A huge thankyou to you once again. #BitcoinCrash #cryptocurrency crash  ""accurate from all."" ,X,c",my heartful thankyou to tradeosiann for knowing me this dangerous bitcoin crash and ethereum crash that is because of you only i did not cause any type of losses a huge thankyou to you once again bitcoincrash cryptocurrency crash accurate from all xc,0.1617807298898697,0.8191940784454346,0.019025197252631187
2022-04-30,6:45,"@Blockworks_ Are you just going to just watch, without doing anything. Don't be left behind, #BTC $100000, #SHIBA $3, #DOGE $5, #CAKE, #BTTC #dogearmy #SHIBARMY Dont forget add more if price going down.",blockworks are you just going to just watch without doing anything do not be left behind btc 100000 shiba 3 doge 5 cake bttc dogearmy shibarmy dont forget add more if price going down,0.02553938329219818,0.8951348662376404,0.07932572811841965
2022-04-30,6:45,"My heartful thankyou to @tradeosiann for knowing me this dangerous #Bitcoin crash and #Ethereum crash. That's because of you only  I didn't cause any type of losses. A huge thankyou to you once again. #BitcoinCrash #cryptocurrency crash  ""accurate from all."" G",my heartful thankyou to tradeosiann for knowing me this dangerous bitcoin crash and ethereum crash that is because of you only i did not cause any type of losses a huge thankyou to you once again bitcoincrash cryptocurrency crash accurate from all g,0.17834162712097168,0.8024738430976868,0.019184550270438194
2022-04-30,6:45,What are the Bears doing with #Bitcoin?? Trying to convince the whole world it is a shitcoin that doesnt replace inflating fiat?,what are the bears doing with bitcoin trying to convince the whole world it is a shitcoin that doesnt replace inflating fiat,0.03691156953573227,0.7700678706169128,0.1930205374956131
2022-04-30,6:45,"@AirdropStario Believe this is a faithful project. 
The projector has a lot of attractive so hopefully the project will be better in the future and will be the best.

@rigan_sarder2 
@Tawfik6656 
@TushuMunna 

#cryptocurrency #Airdrop #BSC 
#Bitcoin #BNB #BNBNINJA 
#BNBN #Airdropstario",airdropstario believe this is a faithful project the projector has a lot of attractive so hopefully the project will be better in the future and will be the best rigansarder2 tawfik6656 tushumunna cryptocurrency airdrop bsc bitcoin bnb bnbninja bnbn airdropstario,0.8470084071159363,0.1463489532470703,0.006642600987106562
2022-04-30,6:45,"My heartful thankyou to @tradeosiann for knowing me this dangerous #Bitcoin crash and #Ethereum crash. That's because of you only  I didn't cause any type of losses. A huge thankyou to you once again. #BitcoinCrash #cryptocurrency crash  ""accurate from all."" F",my heartful thankyou to tradeosiann for knowing me this dangerous bitcoin crash and ethereum crash that is because of you only i did not cause any type of losses a huge thankyou to you once again bitcoincrash cryptocurrency crash accurate from all f,0.20771659910678864,0.7735074162483215,0.018776003271341324
2022-04-30,6:45,"The latest #bitcoin block 734205 with 585 transactions was just mined by SlushPool
Total Fees:0.12822328
Block Subsidy:6.25
#Bitcoin #BTC #blockchain #analysis",the latest bitcoin block 734205 with 585 transactions was just mined by slushpool total block bitcoin btc blockchain analysis,0.024623362347483635,0.9486260414123535,0.02675056643784046
2022-04-30,6:45,"My heartful thankyou to @tradeosiann for knowing me this dangerous #Bitcoin crash and #Ethereum crash. That's because of you only  I didn't cause any type of losses. A huge thankyou to you once again. #BitcoinCrash #cryptocurrency crash  ""accurate from all."" D",my heartful thankyou to tradeosiann for knowing me this dangerous bitcoin crash and ethereum crash that is because of you only i did not cause any type of losses a huge thankyou to you once again bitcoincrash cryptocurrency crash accurate from all d,0.20181886851787567,0.7802175879478455,0.017963528633117676
2022-04-30,6:45,"@airdropinspect It's a very wonderful project !!!! I feel avant-garde and sharpened sensibility!!!! I'm so happy if you give me this one i'm very very thankyou 

@Parvezshamim22
@CryptoTownEU
@UbiquityDAO

#Airdrop #Airdrops #Airdropinspector #BSC #Dotbit #Crypto #Bitcoin",airdropinspect it is a very wonderful project i feel avantgarde and sharpened sensibility i am so happy if you give me this one i am very very thankyou parvezshamim22 cryptotowneu ubiquitydao airdrop airdrops airdropinspector bsc dotbit crypto bitcoin,0.1641090214252472,0.8248184323310852,0.011072581633925438
2022-04-30,6:45,"@usssks Are you just going to just watch, without doing anything. Don't be left behind, #BTC $100000, #SHIBA $3, #DOGE $5, #CAKE, #BTTC #dogearmy #SHIBARMY Dont forget add more if price going down.",usssks are you just going to just watch without doing anything do not be left behind btc 100000 shiba 3 doge 5 cake bttc dogearmy shibarmy dont forget add more if price going down,0.028592145070433617,0.8929193615913391,0.07848843187093735
2022-04-30,6:45,"My heartful thankyou to @tradeosiann for knowing me this dangerous #Bitcoin crash and #Ethereum crash. That's because of you only  I didn't cause any type of losses. A huge thankyou to you once again. #BitcoinCrash #cryptocurrency crash  ""accurate from all."" ,,Yu",my heartful thankyou to tradeosiann for knowing me this dangerous bitcoin crash and ethereum crash that is because of you only i did not cause any type of losses a huge thankyou to you once again bitcoincrash cryptocurrency crash accurate from all yu,0.20809519290924072,0.7725947499275208,0.01931004226207733
2022-04-30,6:45,The project uses a very consistent pricing and marketing policy. I am confident that the project will perform well in the future. #FGW #FunnyGameWorld #crypto #bitcoin #cryptocurrency #blockchain #bounty #binance #eth #token #coinsbit @funnygameworld,the project uses a very consistent pricing and marketing policy i am confident that the project will perform well in the future fgw funnygameworld crypto bitcoin cryptocurrency blockchain bounty binance eth token coinsbit funnygameworld,0.5595671534538269,0.4309292435646057,0.009503614157438278
2022-04-30,6:45,"@Superalkaline11 Bitcoin volatility index , moving very huge .

DM on how you can make money with Bitcoin investment today and get paid on weekly basis. #bitcoin #likes #love #wealth #money #forex #cash #shiba #eth #binance #BTC",superalkaline11 bitcoin volatility index moving very huge dm on how you can make money with bitcoin investment today and get paid on weekly basis bitcoin likes love wealth money forex cash shiba eth binance btc,0.06423535197973251,0.9143045544624329,0.021460143849253654
2022-04-30,6:45,"My heartful thankyou to @tradeosiann for knowing me this dangerous #Bitcoin crash and #Ethereum crash. That's because of you only  I didn't cause any type of losses. A huge thankyou to you once again. #BitcoinCrash #cryptocurrency crash  ""accurate from all."" S",my heartful thankyou to tradeosiann for knowing me this dangerous bitcoin crash and ethereum crash that is because of you only i did not cause any type of losses a huge thankyou to you once again bitcoincrash cryptocurrency crash accurate from all s,0.15570929646492004,0.8222222924232483,0.022068383172154427
2022-04-30,6:45,"@rovercrc GM, Are you just going to just watch, without doing anything. Don't be left behind, #BTC $100000, #SHIBA $3, #DOGE $5, #CAKE, #BTTC #dogearmy #SHIBARMY Dont forget add more if price going down.",rovercrc gm are you just going to just watch without doing anything do not be left behind btc 100000 shiba 3 doge 5 cake bttc dogearmy shibarmy dont forget add more if price going down,0.030033022165298462,0.8527972102165222,0.11716972291469574
2022-04-30,6:45,Very good and promising project well done you will achieve the goal you planned good luck to the developers. #FGW #FunnyGameWorld #crypto #bitcoin #cryptocurrency #blockchain #bounty #binance #eth #token #coinsbit @funnygameworld,very good and promising project well done you will achieve the goal you planned good luck to the developers fgw funnygameworld crypto bitcoin cryptocurrency blockchain bounty binance eth token coinsbit funnygameworld,0.2385394126176834,0.7518554329872131,0.009605176746845245
2022-04-30,6:45,All these crypto “influencers” will always push “BUY” #bitcoin so it can pump and they can dump on your ass leaving you holding the bag.,all these crypto influencers will always push buy bitcoin so it can pump and they can dump on your ass leaving you holding the bag,0.030321065336465836,0.9007763862609863,0.06890255212783813
2022-04-30,6:45,"My heartful thankyou to @tradeosiann for knowing me this dangerous #Bitcoin crash and #Ethereum crash. That's because of you only  I didn't cause any type of losses. A huge thankyou to you once again. #BitcoinCrash #cryptocurrency crash  ""accurate from all."" ,,We",my heartful thankyou to tradeosiann for knowing me this dangerous bitcoin crash and ethereum crash that is because of you only i did not cause any type of losses a huge thankyou to you once again bitcoincrash cryptocurrency crash accurate from all we,0.19800353050231934,0.7775524854660034,0.02444395422935486
2022-04-30,6:45,"@TheCryptoLark Are you just going to just watch, without doing anything. Don't be left behind, #BTC $100000, #SHIBA $3, #DOGE $5, #CAKE, #BTTC #dogearmy #SHIBARMY Dont forget add more if price going down.",thecryptolark are you just going to just watch without doing anything do not be left behind btc 100000 shiba 3 doge 5 cake bttc dogearmy shibarmy dont forget add more if price going down,0.028926221653819084,0.9031394124031067,0.06793434917926788
2022-04-30,6:45,"@cz_binance Many will follow, this will be as relentless as #Bitcoin's math is. 🚀💎🙏",czbinance many will follow this will be as relentless as bitcoin math is,0.06178855895996094,0.9115216732025146,0.02668980322778225
2022-04-30,6:45,"My heartful thankyou to @tradeosiann for knowing me this dangerous #Bitcoin crash and #Ethereum crash. That's because of you only  I didn't cause any type of losses. A huge thankyou to you once again. #BitcoinCrash #cryptocurrency crash  ""accurate from all."" ,,Q",my heartful thankyou to tradeosiann for knowing me this dangerous bitcoin crash and ethereum crash that is because of you only i did not cause any type of losses a huge thankyou to you once again bitcoincrash cryptocurrency crash accurate from all q,0.1776478886604309,0.8021867275238037,0.020165350288152695
2022-04-30,6:45,"@Seasonal_Tokens This is a very promising project.The team is excellent,As for the idea itself,it is relevant in modern times.I admire its continuous development.The project has very strong team. #SeasonalTokens #CryptoMining #Cyclicallnvesting #BTC",seasonaltokens this is a very promising projectthe team is excellentas for the idea itselfit is relevant in modern timesi admire its continuous developmentthe project has very strong team seasonaltokens cryptomining cyclicallnvesting btc,0.8606683015823364,0.13149091601371765,0.00784075353294611
2022-04-30,6:45,"@TheCryptoLark Still vouching for a #Bitcoin standard. 
It CAN be good news... but it also means a few countries governments are enabling local leveraging of #BTC ... which isn't all that great. 

Bitcoin is best decentralized and community carried. 
Not justified by central authority.",thecryptolark still vouching for a bitcoin standard it can be good news but it also means a few countries governments are enabling local leveraging of btc which is not all that great bitcoin is best decentralized and community carried not justified by central authority,0.38236552476882935,0.6069227457046509,0.010711729526519775
2022-04-30,6:45,The project is really very excellent and worthy in the crypto  project will work and it works because this project has a great team always giving creative ideas. #revenue #revenuecoin #bnb #bitcoin,the project is really very excellent and worthy in the crypto project will work and it works because this project has a great team always giving creative ideas revenue revenuecoin bnb bitcoin,0.7354922294616699,0.2561635673046112,0.008344179019331932
2022-04-30,6:45,"@IIICapital That's’ good, Joe. Volatility is life, and #Bitcoin is most certainly alive!",iiicapital that s good joe volatility is life and bitcoin is most certainly alive,0.21004757285118103,0.7803700566291809,0.00958243478089571
2022-04-30,6:45,@Seasonal_Tokens Trusted project. Their road way map is very advanced. This Project will honorly successfull. Large number of cryoto lover join the project. I like the project.#SeasonalTokens #CryptoMining #Cyclicallnvesting #BTC,seasonaltokens trusted project their road way map is very advanced this project will honorly successfull large number of cryoto lover join the project i like the projectseasonaltokens cryptomining cyclicallnvesting btc,0.3361606001853943,0.6556782126426697,0.008161187171936035
2022-04-30,6:45,@BitcoinErrorLog @rogerkver Do we know how many babies have died over this period of time because #Bitcoin decided not to go large blocks?,bitcoinerrorlog rogerkver do we know how many babies have died over this period of time because bitcoin decided not to go large blocks,0.026231104508042336,0.7378807663917542,0.23588815331459045
2022-04-30,6:45,@Seasonal_Tokens The very amazing project which creates a big market in a short time. The project looks very flexible and profitable in the good future. Its demands are growing day by day.#SeasonalTokens #CryptoMining #Cyclicallnvesting #BTC,seasonaltokens the very amazing project which creates a big market in a short time the project looks very flexible and profitable in the good future its demands are growing day by dayseasonaltokens cryptomining cyclicallnvesting btc,0.7783438563346863,0.21405428647994995,0.007601844146847725
2022-04-30,6:45,"#btc is ESG, scarce, easy to move, store, and accessible to EVERYONE. Even if it will never replace gold, it is how we should think and build our future
@elonmusk 
@cz_binance 
@",btc is esg scarce easy to move store and accessible to everyone even if it will never replace gold it is how we should think and build our future elonmusk czbinance,0.21471507847309113,0.7760253548622131,0.009259572252631187
2022-04-30,6:45,"@saylor Bitcoin volatility index , moving very huge .

DM on how you can make money with Bitcoin investment today and get paid on weekly basis. #bitcoin #likes #love #wealth #money #forex #cash #shiba #eth #binance #BTC",saylor bitcoin volatility index moving very huge dm on how you can make money with bitcoin investment today and get paid on weekly basis bitcoin likes love wealth money forex cash shiba eth binance btc,0.07074826210737228,0.9075506925582886,0.02170102670788765
2022-04-30,6:45,"My heartful thankyou to @tradeosiann for knowing me this dangerous #Bitcoin crash and #Ethereum crash. That's because of you only  I didn't cause any type of losses. A huge thankyou to you once again. #BitcoinCrash #cryptocurrency crash  ""accurate from all."" ,Z",my heartful thankyou to tradeosiann for knowing me this dangerous bitcoin crash and ethereum crash that is because of you only i did not cause any type of losses a huge thankyou to you once again bitcoincrash cryptocurrency crash accurate from all z,0.17976947128772736,0.8002164363861084,0.020014146342873573
2022-04-30,6:45,"@EthaxCrypto Very good company! Cool concept and I'm glad that I'm here! Hope this project fully successful for the benefits to all users.
#ethax #ethaxcrypto #ethaxcryptoforeveryone #crypto #bitcoin #cryptocurrency #trading #money #cryptotrading #cryptonews",ethaxcrypto very good company cool concept and i am glad that i am here hope this project fully successful for the benefits to all users ethax ethaxcrypto ethaxcryptoforeveryone crypto bitcoin cryptocurrency trading money cryptotrading cryptonews,0.7354574203491211,0.2565416395664215,0.00800095871090889
2022-04-30,6:45,"Wanna know next move of #btc by one &amp; only @TalhaBMUS ???

Discord memberships are open so be quick.

@AllegiantBTC @Vince_Prince_ 
@mr_precidentt 
@Pinnacle_Shail",wanna know next move of btc by one only talhabmus discord memberships are open so be quick allegiantbtc vinceprince mrprecidentt pinnacleshail,0.04717138037085533,0.930665135383606,0.022163504734635353
2022-04-30,6:45,"My heartful thankyou to @tradeosiann for knowing me this dangerous #Bitcoin crash and #Ethereum crash. That's because of you only  I didn't cause any type of losses. A huge thankyou to you once again. #BitcoinCrash #cryptocurrency crash  ""accurate from all."" T",my heartful thankyou to tradeosiann for knowing me this dangerous bitcoin crash and ethereum crash that is because of you only i did not cause any type of losses a huge thankyou to you once again bitcoincrash cryptocurrency crash accurate from all t,0.1966698169708252,0.7820627689361572,0.02126738801598549
2022-04-30,6:45,"My heartful thankyou to @tradeosiann for knowing me this dangerous #Bitcoin crash and #Ethereum crash. That's because of you only  I didn't cause any type of losses. A huge thankyou to you once again. #BitcoinCrash #cryptocurrency crash  ""accurate from all."" A",my heartful thankyou to tradeosiann for knowing me this dangerous bitcoin crash and ethereum crash that is because of you only i did not cause any type of losses a huge thankyou to you once again bitcoincrash cryptocurrency crash accurate from all a,0.16609102487564087,0.8114576935768127,0.022451307624578476
