Date,Time,Original tweet,Clean tweet,Positive,Neutral,Negative
2022-05-15,13:30,@namcios This! There’s only one. #Bitcoin,namcios this theres only one bitcoin,0.028087833896279335,0.9088537096977234,0.06305845081806183
2022-05-15,13:30,"[₿] #Bitcoin Daily $BTC [₿]

Kraken❯
A:$30,154 L:$29,453 H:$30,500
Bitstamp❯
A:$30,163 L:$28,561 H:$30,509
Bitfinex❯
A:$30,217 L:$28,630 H:$30,565

Market Cap: $573,596,704,126
24h Volume: $1,845,330,610
24h: 4.81%  7d: -26.21%",bitcoin daily btc kraken bitstamp bitfinex market 573596704126 24h 1845330610 481 2621,0.04825488105416298,0.9265071749687195,0.025237910449504852
2022-05-15,13:30,"Just like the US Patent system spurred monumental growth in the industrial revolution (innovators had no fear of their ideas being stolen), the US embracing #Bitcoin will enable greater economic growth when people who hold their own keys have no fear of their value being stolen🧐",just like the us patent system spurred monumental growth in the industrial revolution innovators had no fear of their ideas being stolen the us embracing bitcoin will enable greater economic growth when people who hold their own keys have no fear of their value being stolen,0.1699756532907486,0.8157030940055847,0.014321312308311462
2022-05-15,13:30,"@ShibInform Gi #lunacoin
where is the 42k of #bitcoin?
🤦",shibinform gi lunacoin where is the 42k of bitcoin,0.026054808869957924,0.9416130781173706,0.032332099974155426
2022-05-15,13:30,"#Hiring?
Sign up now https://t.co/o7lVlsl75X
FREE. NO MIDDLEMEN.
#Robotics #AIEthics #MachineLearning #AI #Python #DataScience #BigData #100DaysOfCode #Robots #fintech #insurtech #cybersecurity #blockchain #Bitcoin #coding #Cryptos #NFTGame #Job #Metaverse #ETH #Python #HR #DeFi https://t.co/SmeqlOAn8U",hiring sign up now free no middlemen robotics aiethics machinelearning ai python datascience bigdata 100daysofcode robots fintech insurtech cybersecurity blockchain bitcoin coding cryptos nftgame job metaverse eth python hr defi,0.052226483821868896,0.924238920211792,0.023534590378403664
2022-05-15,13:30,@aundreiiNFT The Gameplay is awesome i need more update @MetaKatFinance  #BITCOIN #Binance #BSC #BSCGems #DeFiProject #DEFI #P2E #CryptocurrencyNews #NFTCommunity #nftart #ETH #Metaverse,aundreiinft the gameplay is awesome i need more update metakatfinance bitcoin binance bsc bscgems defiproject defi p2e cryptocurrencynews nftcommunity nftart eth metaverse,0.03657941147685051,0.9438920021057129,0.01952860690653324
2022-05-15,13:30,Goldman Sachs and Barclays have invested in #Bitcoin  and #crypto trading platform Elwood Technologies.,goldman sachs and barclays have invested in bitcoin and crypto trading platform elwood technologies,0.11218850314617157,0.8786499500274658,0.00916155893355608
2022-05-15,13:30,"6 - #BTC has an amazing track record, the technology is amazing and it makes it the safest network in the world. #Tesla is an amazing company with an incredible track record and the best team in the world.Always do your own diligence and don't invest in a promise of quick returns",6 btc has an amazing track record the technology is amazing and it makes it the safest network in the world tesla is an amazing company with an incredible track record and the best team in the worldalways do your own diligence and do not invest in a promise of quick returns,0.582535982131958,0.40722376108169556,0.010240237228572369
2022-05-15,13:30,"@AirdropStario Good project and success to all team $SDEX 
@DivaUtama2
@idarozalia781
@Darmawa19493965 

#cryptocurrency #Airdrop #BSC #Bitcoin #USDT #SolanaDEX #SDEX #Airdropstario",airdropstario good project and success to all team sdex divautama2 idarozalia781 darmawa19493965 cryptocurrency airdrop bsc bitcoin usdt solanadex sdex airdropstario,0.8906498551368713,0.10093227028846741,0.0084178876131773
2022-05-15,13:30,"DID YOU KNOW? Starbucks has announced plans to create a series of branded #NFT collections.
#bitcoin #NFTGame #goodmorning #coffee #StarbucksSummer #starbuck #singlemothers #teachers #artist #NFTProjects #bnb #NFTCollector",did you know starbucks has announced plans to create a series of branded nft collections bitcoin nftgame goodmorning coffee starbuckssummer starbuck singlemothers teachers artist nftprojects bnb nftcollector,0.08459293842315674,0.9046269059181213,0.01078017894178629
2022-05-15,13:30,@aundreiiNFT Cool graphics @MetaKatFinance  #METAKAT #BITCOIN #Binance #BSC #BSCGems #DeFiProject #DEFI #P2E #CryptocurrencyNews #NFTCommunity #nftart #ETH #Metaverse,aundreiinft cool graphics metakatfinance metakat bitcoin binance bsc bscgems defiproject defi p2e cryptocurrencynews nftcommunity nftart eth metaverse,0.06935306638479233,0.9191527366638184,0.01149415411055088
2022-05-15,13:30,"#Bitcoin  is about to close the 7th weekly red candle in a row. 

This has never happened before in its entire history.

#Bitcoin #Crypto #Trading",bitcoin is about to close the 7th weekly red candle in a row this has never happened before in its entire history bitcoin crypto trading,0.06406310200691223,0.8768691420555115,0.059067800641059875
2022-05-15,13:30,@tyler This is a very bad take. Owning your keys is the most interesting part of the #bitcoin invention. You should find ways to teach that to your users not the contrary :(,tyler this is a very bad take owning your keys is the most interesting part of the bitcoin invention you should find ways to teach that to your users not the contrary,0.04973491653800011,0.8391275405883789,0.1111375018954277
2022-05-15,13:30,"People who know how to control both their panic and FOMO emotions are one of the rarest and smartest investors. #crypto #defi #BTC #ETH #TRX

It’s really easy to say “don't panic” or “don't buy the hype” when in reality its VERY hard to disregard and ignore these feelings ca…",people who know how to control both their panic and fomo emotions are one of the rarest and smartest investors crypto defi btc eth trx its really easy to say don t panic or don t buy the hype when in reality its very hard to disregard and ignore these feelings ca,0.04358832910656929,0.9109211564064026,0.045490577816963196
2022-05-15,13:30,"At this stage of my acquaintance with the project , I can say that I was surprised by the idea of global expansion in the future and a huge scope in the future. We will work together on the successful development of this project. 
#FGW #FunnyGameWorld #crypto #bitcoin #cryptocury",at this stage of my acquaintance with the project i can say that i was surprised by the idea of global expansion in the future and a huge scope in the future we will work together on the successful development of this project fgw funnygameworld crypto bitcoin cryptocury,0.6591668128967285,0.3317727744579315,0.009060471318662167
2022-05-15,13:30,@Swifteagle007 @ScottWapnerCNBC @sthenc #Bitcoin will force-feed him.,swifteagle007 scottwapnercnbc sthenc bitcoin will forcefeed him,0.0555097870528698,0.917843759059906,0.026646455749869347
2022-05-15,13:30,Golden rule: Never chase a pump! #btc,golden never chase a pump btc,0.0697479099035263,0.909024715423584,0.021227426826953888
2022-05-15,13:30,@workquest_co This project is running smoothly and stronger then ever. #WorkQuest $WQT $WUSD #WorkNet #WorkQuestApp #blockchian #crypto #cryptolife #BTC #BNB #ETH #digitalization #digitalassets #saving #BinanceSmartChain.,workquestco this project is running smoothly and stronger then ever workquest wqt wusd worknet workquestapp blockchian crypto cryptolife btc bnb eth digitalization digitalassets saving binancesmartchain,0.2210668921470642,0.770094633102417,0.008838411420583725
2022-05-15,13:30,"@elerianm The lower  #Bitcoin    goes, the more BULLISH It become. Why?Price going down, value staying the same

This is a bullish divergence buy the dip 

following @cavalier__Ch I’ve been doing extremely superb as His a mentor, his tweets has been accurate &amp; helpful",elerianm the lower bitcoin goes the more bullish it become whyprice going down value staying the same this is a bullish divergence buy the dip following cavalierch ive been doing extremely superb as his a mentor his tweets has been accurate helpful,0.3796807527542114,0.5992174744606018,0.021101798862218857
2022-05-15,13:30,Just getting started 🚀#shibainu #dogecoin #SaitaMask #ethereum #erc #eth #cryptotrading #cryptocurrency #Ethereum #BTC…,just getting started shibainu dogecoin saitamask ethereum erc eth cryptotrading cryptocurrency ethereum btc,0.10315435379743576,0.8842434287071228,0.012602191418409348
2022-05-15,13:30,"@ScottWapnerCNBC Haha, your post on #BTC yesterday tells me you haven't put in more than 10 minutes into understanding #Bitcoin

You've got 1000 hours left to learn...",scottwapnercnbc haha your post on btc yesterday tells me you have not put in more than 10 minutes into understanding bitcoin you ve got 1000 hours left to learn,0.05069980397820473,0.9078688025474548,0.041431378573179245
2022-05-15,13:30,"@rocket__crypto @WatcherGuru If You believe in it, So that's the right way💪🏼
#luna #terraluna #Terra #LUNA #LUNAtics #lunacoin 😍❤️ 

#BNB  #BTC  #Bitcoin     #Binance     #Altcoins #BitcoinButton     #cryptocurrencies #BTCs #Bitcoin2022 #kriptopara #BTCUSD #Satoshi #multichain #XEC",rocketcrypto watcherguru if you believe in it so that is the right way luna terraluna terra luna lunatics lunacoin bnb btc bitcoin binance altcoins bitcoinbutton cryptocurrencies btcs bitcoin2022 kriptopara btcusd satoshi multichain xec,0.08195683360099792,0.9055157899856567,0.012527384795248508
2022-05-15,13:30,"If you are new here, I don’t care what the price of #Bitcoin goes up to or comes down to. I keep it simple. #Buy and #Hodl",if you are new here i don not care what the price of bitcoin goes up to or comes down to i keep it simple buy and hodl,0.03207077831029892,0.9322638511657715,0.035665374249219894
2022-05-15,13:30,@lunaterra_com Even if they use some #bitcoin to burn $luna would be a huge help for everyone that got screwed,lunaterracom even if they use some bitcoin to burn luna would be a huge help for everyone that got screwed,0.28629282116889954,0.7017419338226318,0.011965258046984673
2022-05-15,13:30,"#TerraUST was a reminder that if we all run to sell our #Bitcoin, only a few of will be able to sell it at $ 30k..",terraust was a reminder that if we all run to sell our bitcoin only a few of will be able to sell it at 30k,0.06419017910957336,0.8421909809112549,0.09361881017684937
2022-05-15,13:30,Anchor Protocol (ANC) went down 10.0 percent in the last 30 minutes on Binance. #ANC  #crypto #bitcoin #cryptocurrency #btc #ethereum #blockchain #eth #trading #altcoin #binance #cryptonews,anchor protocol anc went down 100 percent in the last 30 minutes on binance anc crypto bitcoin cryptocurrency btc ethereum blockchain eth trading altcoin binance cryptonews,0.009203962981700897,0.03591921553015709,0.9548767805099487
2022-05-15,13:30,"Have you ever come across across any application that's enjoyable to play and easy to win, funny game world have got all that. Just download the app now.

#FGW #FunnyGameWorld #crypto #bitcoin #cryptocurrency #blockchain #bounty #binance #eth #token #coinsbit",have you ever come across across any application that is enjoyable to play and easy to win funny game world have got all that just download the app now fgw funnygameworld crypto bitcoin cryptocurrency blockchain bounty binance eth token coinsbit,0.06935297697782516,0.9163402915000916,0.014306665398180485
2022-05-15,13:30,Current #Bitcoin Price is $30171 #BTC #Crypto,current bitcoin price is 30171 btc crypto,0.021422898396849632,0.9497808814048767,0.028796199709177017
2022-05-15,13:30,@Borsaemiliano very important!!! Only those who will become stock sellers in the near future should be happy to see their stock rise. Potential buyers should prefer more falling prices.#stock market #BTC #spx,borsaemiliano very important only those who will become stock sellers in the near future should be happy to see their stock rise potential buyers should prefer more falling pricesstock market btc spx,0.1582983285188675,0.8184456825256348,0.023256003856658936
2022-05-15,13:30,"#BTC update. either the sell-off in the $24055 - $18897 zone has already started or we’ll see the last retest at 32-34k…. Of course, after retesting same goal🤝",btc update either the selloff in the 24055 18897 zone has already started or well see the last retest at 3234k of course after retesting same goal,0.04007415100932121,0.8361596465110779,0.1237662211060524
2022-05-15,13:30,@BTC_Archive #Bitcoin comeback 70k$,btcarchive bitcoin comeback 70k,0.10377537459135056,0.871697187423706,0.02452743984758854
2022-05-15,13:30,$luna more important than #bitcoin since crash and elon took away the symbol  hashtag for BTC 😂😂to make a new #dogecoin hashtag symbol for twitter,luna more important than bitcoin since crash and elon took away the symbol hashtag for btc to make a new dogecoin hashtag symbol for twitter,0.10073158890008926,0.8867402672767639,0.01252820435911417
2022-05-15,13:30,"Let’s not get too excited about #BTC above 30K.

The whales still need to think we are super scared 🤫 so they can flip the market ‘unexpectedly’",lets not get too excited about btc above 30k the whales still need to think we are super scared so they can flip the market unexpectedly,0.09028467535972595,0.8276557326316833,0.0820595771074295
2022-05-15,13:30,This project is running smoothly and stronger then ever. #WorkQuest $WQT $WUSD #WorkNet #WorkQuestApp #blockchian #crypto #cryptolife #BTC #BNB #ETH #digitalization #digitalassets #saving #BinanceSmartChain.,this project is running smoothly and stronger then ever workquest wqt wusd worknet workquestapp blockchian crypto cryptolife btc bnb eth digitalization digitalassets saving binancesmartchain,0.2636592984199524,0.7277037501335144,0.008636941201984882
2022-05-15,13:30,"I’ve deleted all of my previous tweets &amp; replies (mostly about altcoins). I’ve became a #Bitcoin maximalist after LUNA/UST crash. If I have to pick another cryptocurrency to invest in, that would be only #BNB.",ive deleted all of my previous tweets replies mostly about altcoins ive became a bitcoin maximalist after lunaust crash if i have to pick another cryptocurrency to invest in that would be only bnb,0.022886307910084724,0.7448478937149048,0.23226580023765564
2022-05-15,13:30,"The fact that we can make or do only one thing at time is what makes the present so interesting. 

#Bitcoin #BTC #Crypto #lunacoin #nftart #NFT #NFTs",the fact that we can make or do only one thing at time is what makes the present so interesting bitcoin btc crypto lunacoin nftart nft nfts,0.056112948805093765,0.9272815585136414,0.016605505719780922
2022-05-15,13:30,"@rocket__crypto @WatcherGuru JUST IN: Terra has announced plans to burn billions of $UST and stake millions of $LUNA.  😍

#terraluna #Terra #LUNAtic #LUNAtics #BitcoinCrash #BNB     #BTC     #Bitcoin     #Binance     #altcoins #multichain #BTCUSDT #LUNA #lunacoin 

@rocket__crypto 💎🚀",rocketcrypto watcherguru just terra has announced plans to burn billions of ust and stake millions of luna terraluna terra lunatic lunatics bitcoincrash bnb btc bitcoin binance altcoins multichain btcusdt luna lunacoin rocketcrypto,0.06747034192085266,0.9193724393844604,0.013157255947589874
2022-05-15,13:30,"@kubieth @NFTOdette Followed and notified. Hoping to win this giveaway 

God bless you and your famaly 

@IamIbrvhim
@Rudy561999
@adi_giffary

#Giveaways #Airdrop #crypto #Btc   #ETH $USDT #cryptocurrency #doge #shib #solana #elonmusk #APE #GMT 
#solana #SolanaGiveaway #Avax",kubieth nftodette followed and notified hoping to win this giveaway god bless you and your famaly iamibrvhim rudy561999 adigiffary giveaways airdrop crypto btc eth usdt cryptocurrency doge shib solana elonmusk ape gmt solana solanagiveaway avax,0.31609275937080383,0.6722255349159241,0.011681717820465565
2022-05-15,13:30,"@waytooript @concodanomics You forgot to mention the fact #Bitcoin is legal tender in two countries. That's one more country than the Canadian dollar for example. Keep not holding any for another decade, please. 👍🤣🤡",waytooript concodanomics you forgot to mention the fact bitcoin is legal tender in two countries that is one more country than the canadian dollar for example keep not holding any for another decade please,0.045114949345588684,0.9239659905433655,0.030919091776013374
2022-05-15,13:30,"🚀 🚀 🚀 $2,024,482 BTCUSDT LONGED @$30,150.00 on #Binance (13:28:02 UTC) #BTC #cryptocurrency",2024482 btcusdt longed 3015000 on binance utc btc cryptocurrency,0.03746211156249046,0.9341732859611511,0.028364630416035652
2022-05-15,13:30,"Unbound $UNB price by the #UNB May 31 Binance #mainnet day @unboundfinance 

UNB .08 cents all time high
UNB .0017 now

#Bitcoin #cryptocurrency #crypto $LUNA",unbound unb price by the unb may 31 binance mainnet day unboundfinance unb 08 cents all time high unb 0017 now bitcoin cryptocurrency crypto luna,0.07265614718198776,0.8944370746612549,0.03290679305791855
2022-05-15,13:30,"@stablekwon @terra_money 
Where are all #Bitcoin  reserve gone?",stablekwon terramoney where are all bitcoin reserve gone,0.022893846035003662,0.9228785634040833,0.054227571934461594
2022-05-15,13:30,"@PunkCryptoNFT @NFTlifegiveaway Please help me sir make up for my loss... I lost all my money in Luna's collapse.😭😭😭😭😭 0x0569012BD5005C12F9490Db891DDaF775df6129A .my LUNA in trust Wallet SIR  .#ETH #BNB #BTC #LUNA #TERRA #UST #USDT #thanksgiving ,#thankyousir #Ihopeforyou🙏🙏🙏",punkcryptonft nftlifegiveaway please help me sir make up for my loss i lost all my money in luna collapse 0x0569012bd5005c12f9490db891ddaf775df6129a my luna in trust wallet sir eth bnb btc luna terra ust usdt thanksgiving thankyousir ihopeforyou,0.21521641314029694,0.7619799375534058,0.022803645581007004
2022-05-15,13:30,@terra_money very important!!! Only those who will become stock sellers in the near future should be happy to see their stock rise. Potential buyers should prefer more falling prices.#stock market #BTC #spx,terramoney very important only those who will become stock sellers in the near future should be happy to see their stock rise potential buyers should prefer more falling pricesstock market btc spx,0.18169155716896057,0.7974957823753357,0.020812636241316795
2022-05-15,13:30,"Is the indirect war between China and USA via Russia and Ukraine positive for #bitcoin? No.

Will the US hold its status as the reserve currency of the world? Yes.

Will the US dollar hold its bid? Yes.

Let me explain simply below.",is the indirect war between china and usa via russia and ukraine positive for bitcoin no will the us hold its status as the reserve currency of the world yes will the us dollar hold its bid yes let me explain simply below,0.1299196183681488,0.8564401865005493,0.013640178367495537
2022-05-15,13:30,"Do you think our political system is broken?

Do you think we should get money out of politics?

Do you think our politicians are supposed to work for us?

Then it is time to tell them we need #bitcoin",do you think our political system is broken do you think we should get money out of politics do you think our politicians are supposed to work for us then it is time to tell them we need bitcoin,0.05006735771894455,0.8367855548858643,0.1131470575928688
2022-05-15,13:30,@Donjuliozz Yes sir. $10 #btc,donjuliozz yes sir 10 btc,0.07207610458135605,0.9048526287078857,0.02307134121656418
2022-05-15,13:30,@0xSmartContract @hellspawncrypto very important!!! Only those who will become stock sellers in the near future should be happy to see their stock rise. Potential buyers should prefer more falling prices.#stock market #BTC #spx,0xsmartcontract hellspawncrypto very important only those who will become stock sellers in the near future should be happy to see their stock rise potential buyers should prefer more falling pricesstock market btc spx,0.23165258765220642,0.7515541911125183,0.016793230548501015
2022-05-15,13:30,"@biancoresearch Your biggest opportunity into financial freedom lies within owning #Cryptos. Move from fiat to digital. Move to financial freedom. In the nearest future, the strength of several companies will be determined by how much crypto power they own. #Bitcoin follow @cavalier__Ch",biancoresearch your biggest opportunity into financial freedom lies within owning cryptos move from fiat to digital move to financial freedom in the nearest future the strength of several companies will be determined by how much crypto power they own bitcoin follow cavalierch,0.07945606857538223,0.9086491465568542,0.011894769966602325
2022-05-15,13:30,"Life changing advice. Work hard anywhere to make money, buy #bitcoin, wait 5 years doing anything you like. Never look for a job again.",life changing advice work hard anywhere to make money buy bitcoin wait 5 years doing anything you like never look for a job again,0.028521252796053886,0.8637374043464661,0.10774137824773788
2022-05-15,13:30,"I think, $LUNA earners of last two days started to buy #Bitcoin
Be aware if you are trading on #lunaterra",i think luna earners of last two days started to buy bitcoin be aware if you are trading on lunaterra,0.06370112299919128,0.9202262759208679,0.01607256382703781
2022-05-15,13:30,@saifedean Love #Bitcoin but ETH will likely prove you wrong in the not so distant future.,saifedean love bitcoin but eth will likely prove you wrong in the not so distant future,0.23325411975383759,0.7300777435302734,0.0366680733859539
2022-05-15,13:30,"@biancoresearch The lower  #Bitcoin    goes, the more BULLISH It become. Why?Price going down, value staying the same

This is a bullish divergence buy the dip 

following @cavalier__Ch I’ve been doing extremely superb as His a mentor, his tweets has been accurate &amp; helpful",biancoresearch the lower bitcoin goes the more bullish it become whyprice going down value staying the same this is a bullish divergence buy the dip following cavalierch ive been doing extremely superb as his a mentor his tweets has been accurate helpful,0.2917681336402893,0.6856866478919983,0.022545266896486282
2022-05-15,13:30,"@Sumeet0188 @Eternity_Earn That’s why they said about #bitcoin too . Had I listened to people like you, I’d have missed the ride from .01 to literally the fucking moon.",sumeet0188 eternityearn thats why they said about bitcoin too had i listened to people like you id have missed the ride from 01 to literally the fucking moon,0.06596557050943375,0.696678638458252,0.23735575377941132
2022-05-15,13:30,@DylanLeClair_ @ScottWapnerCNBC The bitcoin community could stop advertising #Bitcoin far above from the realized price.,dylanleclair scottwapnercnbc the bitcoin community could stop advertising bitcoin far above from the realized price,0.027839990332722664,0.47000589966773987,0.5021541118621826
2022-05-15,13:30,"@biancoresearch #Bitcoin   Lets see 👀 if we can hold 30k. Looks to be putting in a symmetrical triangle on the lower time frames. 54.76% pull back from all time high so far.

@cavalier__Ch  is a good super underrated bitcoiner
I’ve been taking her TA seriously &amp; I’ve  been superb

Follow him",biancoresearch bitcoin lets see if we can hold 30k looks to be putting in a symmetrical triangle on the lower time frames 5476 pull back from all time high so far cavalierch is a good super underrated bitcoiner ive been taking her ta seriously ive been superb follow him,0.2769295275211334,0.6925894618034363,0.03048102557659149
2022-05-15,13:30,"Have you downloaded the @funnygameworld app? You can download the app now and start earning.
#FGW #FunnyGameWorld #crypto #bitcoin #cryptocurrency #blockchain #bounty #binance #eth #token #coinsbit",have you downloaded the funnygameworld app you can download the app now and start earning fgw funnygameworld crypto bitcoin cryptocurrency blockchain bounty binance eth token coinsbit,0.06330589205026627,0.9234421849250793,0.013251852244138718
2022-05-15,13:30,"#BTC is $200 DOWN📉 since the last alert.

Current #Bitcoin price: $30,200

05/15 13:26 UTC",btc is 200 down since the last alert current bitcoin 30200 0515 utc,0.013847404159605503,0.03537658974528313,0.9507761001586914
2022-05-15,13:30,"@VenomCrypto_ Following + 🔔

#BTC #BNB #BSC #Binance #Crypto #Giveaway",venomcrypto following btc bnb bsc binance crypto giveaway,0.027841871604323387,0.9460051655769348,0.026152946054935455
2022-05-15,13:30,"@DudeinMeta It is just paired to #btc, but #stablecoin fear will weight in the near future even on #busd",dudeinmeta it is just paired to btc but stablecoin fear will weight in the near future even on busd,0.37534111738204956,0.6075469851493835,0.01711195707321167
2022-05-15,13:30,@bitcoinmask @coinkit_ #BTC to the moon,bitcoinmask coinkit btc to the moon,0.1054910197854042,0.8826127052307129,0.011896258220076561
2022-05-15,13:30,"Risk reward ratio on any crypto activity seems now quiet attractive. Further it dips more attractive becomes. I even think i may add up here

#bitcoin #Crypto",risk reward ratio on any crypto activity seems now quiet attractive further it dips more attractive becomes i even think i may add up here bitcoin crypto,0.7908563017845154,0.1390232890844345,0.0701204240322113
