Date,Time,Original tweet,Clean tweet,Positive,Neutral,Negative
2022-05-19,16:15,what if... $BTC #Bitcoin https://t.co/1alrFfTgyM,what if btc bitcoin,0.02564121223986149,0.9433801770210266,0.030978688970208168
2022-05-19,16:15,#BTC  up at 30k,btc up at 30k,0.6260601282119751,0.28895390033721924,0.08498598635196686
2022-05-19,16:15,"When #TERRA $LUNA holds $BTC, extreme believers: #BTC drives Terra's value.

When #TERRA $LUNA  crashes, extreme believers: BTC never goes to zero.

🤡🤡🤡🤡",when terra luna holds btc extreme btc drives terra value when terra luna crashes extreme btc never goes to zero,0.022052280604839325,0.9313279986381531,0.04661974310874939
2022-05-19,16:15,"The biggest take awayfrom this BTC stop hunt pump is that it's now clear that BTC doesn't really do much while stonks are closed, it literally waited for stonks to open to make a move. Bitcoin now trades on stocks time. Anyway resume the Bear.

$BTC #BTC #BITCOIN #cryptocurrency",the biggest take awayfrom this btc stop hunt pump is that it is now clear that btc does not really do much while stonks are closed it literally waited for stonks to open to make a move bitcoin now trades on stocks time anyway resume the bear btc btc bitcoin cryptocurrency,0.04307163134217262,0.756596028804779,0.20033234357833862
2022-05-19,16:15,"As long as there is a bear market, there will be a bull market 📈🚀 #btc",as long as there is a bear market there will be a bull market btc,0.03662525862455368,0.9341890811920166,0.029185662046074867
2022-05-19,16:15,"Ok, i need an appreciation for my work so badly 😭

#bitcoin #btc #crypto #cryptocurrency #cryptotrading #cryptogiveaway #NFTGiveaways #NFTGiveaway #nft #NFTCommmunity #NFTProject #NFTProjects #BurnLuna",ok i need an appreciation for my work so badly bitcoin btc crypto cryptocurrency cryptotrading cryptogiveaway nftgiveaways nftgiveaway nft nftcommmunity nftproject nftprojects burnluna,0.14088688790798187,0.8429424166679382,0.016170723363757133
2022-05-19,16:15,@PeterSchiff The fastest way and the first step to lower the global #inflation is that governments stops printing useless fiat money which has unlimited supply and starts to support deflationary digital assets like #bitcoin,peterschiff the fastest way and the first step to lower the global inflation is that governments stops printing useless fiat money which has unlimited supply and starts to support deflationary digital assets like bitcoin,0.17146635055541992,0.8077530264854431,0.02078062668442726
2022-05-19,16:15,"⚡ What are you dip buying today ?💰

#Bitcoin #cryptocurrency #LUNAtics #Ethereum #Bull #Bch #BinanceSmartChain",what are you dip buying today bitcoin cryptocurrency lunatics ethereum bull bch binancesmartchain,0.05601481348276138,0.9262852668762207,0.017699945718050003
2022-05-19,16:15,"🚀 🚀 🚀 $754,109 BTCUSDT LONGED @$30,243.00 on #Bybit (16:14:21 UTC) #BTC #cryptocurrency",754109 btcusdt longed 3024300 on bybit utc btc cryptocurrency,0.0374084934592247,0.9318599700927734,0.0307315606623888
2022-05-19,16:15,"i retweet what i like but i dont invest all the time. people need to convince that they are consuming their money. all scams will dead soon and some are them will turn to scam with attacks, mistakes or for evilness.  #bitcoin #Terra",i retweet what i like but i dont invest all the time people need to convince that they are consuming their money all scams will dead soon and some are them will turn to scam with attacks mistakes or for evilness bitcoin terra,0.025026356801390648,0.5494271516799927,0.4255464971065521
2022-05-19,16:15,"This project has a very bright future, because I really think this project is too perfect to be true. This is a very cool. #WorkQuest $WQT $WUSD #WorkNet #WorkQuestApp #blockchian #crypto #cryptolife #BTC #BNB #ETH #digitalization #digitalassets #saving #BinanceSmartChain",this project has a very bright future because i really think this project is too perfect to be true this is a very cool workquest wqt wusd worknet workquestapp blockchian crypto cryptolife btc bnb eth digitalization digitalassets saving binancesmartchain,0.17585596442222595,0.8139050006866455,0.010239056311547756
2022-05-19,16:15,#bitcoin whales are moving 🐳,bitcoin whales are moving,0.10994669049978256,0.8438511490821838,0.04620219022035599
2022-05-19,16:15,"Those that haven't seen the trend since BTC's inception fail to do so because they know they couldn't emotionally handle the volatility, which is fine - but don't try to criticize something just because you can't hang. 

#BTC #crypto #ETH #DOT #cryptocurrency",those that have not seen the trend since btc inception fail to do so because they know they could not emotionally handle the volatility which is fine but do not try to criticize something just because you cannot hang btc crypto eth dot cryptocurrency,0.03161926195025444,0.3383440375328064,0.6300366520881653
2022-05-19,16:15,"BTC could fall another 348% to $8,991.50 and would STILL be outperforming the S&amp;P.

Keep in mind - this is being favorable to the S&amp;P by taking the same date range into account - BTC's lowest weekly close in March was $5,343.14 which is actually a 485.7% gain.

#Bitcoin wins.",btc could fall another 348 to 899150 and would still be outperforming the sp keep in mind this is being favorable to the sp by taking the same date range into account btc lowest weekly close in march was 534314 which is actually a 4857 gain bitcoin wins,0.018101109191775322,0.058094024658203125,0.9238048195838928
2022-05-19,16:15,"🚀 🚀 🚀 $1,740,000 BTCUSDT LONGED @$30,201.00 on #Binance (16:14:04 UTC) #BTC #cryptocurrency",1740000 btcusdt longed 3020100 on binance utc btc cryptocurrency,0.03869323432445526,0.9265381693840027,0.034768614917993546
2022-05-19,16:15,"And most of you will know by now that you have a job or you know a job, right? You might be thinking, you haven't got any clients, so how do you do that? Well, you turn that question up, you start to my TurboTax form here #content #btc #natural $IVR $WISH #nft",and most of you will know by now that you have a job or you know a job right you might be thinking you have not got any clients so how do you do that well you turn that question up you start to my turbotax form here content btc natural ivr wish nft,0.031240517273545265,0.9362481236457825,0.03251137584447861
2022-05-19,16:15,@0xKillTheWolf @clunaBSC @Clunadaily @clunaBSC  @goobygambles you've been challanged to become a . @clunaBSC is a community driven project to give back to those affected by the #LUNA crash. #BITCOIN         #BSCGEM #BTC         #LUNA #CLUNA #ETH #BNB         #MOONSHOT #100X #CRYPTO #1000X #ALTCOINS #CLUNATICS,0xkillthewolf clunabsc clunadaily clunabsc goobygambles you ve been challanged to become a clunabsc is a community driven project to give back to those affected by the luna crash bitcoin bscgem btc luna cluna eth bnb moonshot 100x crypto 1000x altcoins clunatics,0.061908092349767685,0.9251424670219421,0.012949459254741669
2022-05-19,16:15,"“It’s gonna crash and I think Bitcoin could go down to $3,000 or $7,000 and then go to half a million to a million in the next global boom” - Economist H. Dent 😲🤯

#BitcoinCrash #bitcoin #HDent",its gonna crash and i think bitcoin could go down to 3000 or 7000 and then go to half a million to a million in the next global boom economist h dent bitcoincrash bitcoin hdent,0.03626538813114166,0.809797465801239,0.15393716096878052
2022-05-19,16:15,"think of #bitcoin as in a HOLD PATTERN 

like when everyone in Wall Street waits on the Fed and then the minutes to come out

the markets either EXPLODE UP or DROP like a DEAD CAT",think of bitcoin as in a hold pattern like when everyone in wall street waits on the fed and then the minutes to come out the markets either explode up or drop like a dead cat,0.021412715315818787,0.5359804630279541,0.44260674715042114
2022-05-19,16:15,"@BTCTN What garbage is this , I think the whole market is feeling the pressure of what #shiba will become.
I see mass adoption the number one recipe for #shiba to steal away the 👑 from #bitcoin",btctn what garbage is this i think the whole market is feeling the pressure of what shiba will become i see mass adoption the number one recipe for shiba to steal away the from bitcoin,0.03982282057404518,0.907517671585083,0.052659500390291214
2022-05-19,16:15,"@JustinBennettFX I'm just DCA $10/day into #BTC #ETH and #ADA 
And $20/week into #DOT.
U think that's a good strategy?",justinbennettfx i am just dca 10day into btc eth and ada and 20week into dot u think that is a good strategy,0.11283618956804276,0.8750065565109253,0.012157325632870197
2022-05-19,16:15,"🚀 🚀 🚀 $1,602,406 BTCUSDT LONGED @$30,230.10 on #Binance (16:13:40 UTC) #BTC #cryptocurrency",1602406 btcusdt longed 3023010 on binance utc btc cryptocurrency,0.04186232388019562,0.92894446849823,0.029193216934800148
2022-05-19,16:15,Will Russia legalize #BTC this year?,will russia legalize btc this year,0.06805209815502167,0.9199573397636414,0.011990594677627087
2022-05-19,16:15,"#bitcoin seems likely still bearish till end of month.  We may see 24k in about 1 or 2 weeks from now
I doubt 26xxx is the bottom. If 26xxx is the bottom we should already  make double  bottom 
#cryptotrading  #BTC #cryptocurrency  #shorting",bitcoin seems likely still bearish till end of month we may see 24k in about 1 or 2 weeks from now i doubt 26xxx is the bottom if 26xxx is the bottom we should already make double bottom cryptotrading btc cryptocurrency shorting,0.08898879587650299,0.7285442352294922,0.18246693909168243
2022-05-19,16:15,"@SharksCoins $cLuna #cLuna @clunaBSC is the only thing that's relevant when it comes to volume in a bear market. Why not?

#ToTheMoon #cryptocurrency #altcoin #memecoin #BTC #BullishAF #BITCOIN #BSCGEM #BTC #LUNA #CLUNA #ETH #BNB #MOONSHOT #100X #CRYPTO #1000X",sharkscoins cluna cluna clunabsc is the only thing that is relevant when it comes to volume in a bear market why not tothemoon cryptocurrency altcoin memecoin btc bullishaf bitcoin bscgem btc luna cluna eth bnb moonshot 100x crypto 1000x,0.03827427327632904,0.9399095177650452,0.02181621454656124
2022-05-19,16:15,I don’t wanna brag too much but it’s worth connecting with me. I’m toxic and like based memes. #networking #pleb2plebcom #einundzwanzig #bitcoin,i don not wanna brag too much but its worth connecting with me im toxic and like based memes networking pleb2plebcom einundzwanzig bitcoin,0.05541188642382622,0.9216962456703186,0.022891931235790253
2022-05-19,16:15,Current #Bitcoin Price is $30287 #BTC #Crypto,current bitcoin price is 30287 btc crypto,0.021530194208025932,0.9505643844604492,0.027905454859137535
2022-05-19,16:15,#Bitcoin is up 3.02% in the past 4hrs.,bitcoin is up 302 in the past 4hrs,0.948588490486145,0.03303880989551544,0.01837264373898506
2022-05-19,16:15,"@MikeStroup10 Though about this earlier. #btc doesn’t waste energy (E), it uses it, justifiably, &amp; with a clear benefit. Civilization dev is measured by E generation capability. Rather than mourning BTC E use, we should celebrate the value add, and seek ways to boost E generation across earth",mikestroup10 though about this earlier btc doesn not waste energy e it uses it justifiably with a clear benefit civilization dev is measured by e generation capability rather than mourning btc e use we should celebrate the value add and seek ways to boost e generation across earth,0.719356894493103,0.272193968296051,0.008449111133813858
2022-05-19,16:15,"@AnwarCryptoo $cLuna #cLuna @clunaBSC is the only thing that's relevant when it comes to volume in a bear market.

#ToTheMoon #cryptocurrency #altcoin #memecoin #BTC #BullishAF #BITCOIN #BSCGEM #BTC #LUNA #CLUNA #ETH #BNB #MOONSHOT #100X #CRYPTO #1000X",anwarcryptoo cluna cluna clunabsc is the only thing that is relevant when it comes to volume in a bear market tothemoon cryptocurrency altcoin memecoin btc bullishaf bitcoin bscgem btc luna cluna eth bnb moonshot 100x crypto 1000x,0.03762781620025635,0.9418413639068604,0.02053080126643181
2022-05-19,16:15,"In the 1300s Mali King Mansa Musa was the richest person on earth, he owned alot of gold. Today Elon is the richest person on earth, he bought #Bitcoin",in the 1300s mali king mansa musa was the richest person on earth he owned alot of gold today elon is the richest person on earth he bought bitcoin,0.0679982379078865,0.9121881127357483,0.01981358788907528
2022-05-19,16:15,I was great at being a bull... The bear market will make into a king. #Bitcoin,i was great at being a bull the bear market will make into a king bitcoin,0.10878454893827438,0.8758217096328735,0.015393799170851707
2022-05-19,16:15,"It's time #Bitcoin. Show these shitcoins what you're made of once and for all!

Goodbye Fiat, stock market and shitcoins. Hear my roar!

#Bitcoin",it is time bitcoin show these shitcoins what you are made of once and for all goodbye fiat stock market and shitcoins hear my roar bitcoin,0.047017741948366165,0.927349328994751,0.025632934644818306
2022-05-19,16:15,"In the field of digital currency, there is always such an argument that rising is justice, and falling is a scam. This is quite normal, #BTC",in the field of digital currency there is always such an argument that rising is justice and falling is a scam this is quite normal btc,0.043203290551900864,0.9145016074180603,0.04229515790939331
2022-05-19,16:15,"#Bitcoin #Bitcoin price $30257
2022-05-19 19:12",bitcoin bitcoin price 30257 20220519,0.030964063480496407,0.9323458075523376,0.036690082401037216
2022-05-19,16:15,"Selling my account - $15

• 32.5k followers 
• NFT based 

Payment via: Crypto (BTC, ETH, SOL) 

#sellingaccount #forsale #twitterforsale #buyingtwitter #BTC",selling my account 15 325k followers nft based payment crypto btc eth sol sellingaccount forsale twitterforsale buyingtwitter btc,0.07318395376205444,0.9131651520729065,0.013650927692651749
2022-05-19,16:15,#bitcoin hopefully hit the 32k level soon for bitcoin after testing the 28k level,bitcoin hopefully hit the 32k level soon for bitcoin after testing the 28k level,0.749416172504425,0.23671135306358337,0.013872441835701466
2022-05-19,16:15,"@k59343170 $cLuna #cLuna @clunaBSC is the only thing that's relevant when it comes to volume in a bear market. It is my opinion

#ToTheMoon #cryptocurrency #altcoin #memecoin #BTC #BullishAF #BITCOIN #BSCGEM #BTC #LUNA #CLUNA #ETH #BNB #MOONSHOT #100X #CRYPTO #1000X",k59343170 cluna cluna clunabsc is the only thing that is relevant when it comes to volume in a bear market it is my opinion tothemoon cryptocurrency altcoin memecoin btc bullishaf bitcoin bscgem btc luna cluna eth bnb moonshot 100x crypto 1000x,0.03639576956629753,0.9437153339385986,0.01988898031413555
2022-05-19,16:15,in walks Vlad -&gt; #bitcoin,in walks vlad gt bitcoin,0.05031220242381096,0.9278073906898499,0.02188039943575859
2022-05-19,16:15,"🐮 BULLWHALE! just LONGED $3,039,651 worth of #Bitcoin #BTC at $30,251 on #Binance Futures",bullwhale just longed 3039651 worth of bitcoin btc at 30251 on binance futures,0.042455755174160004,0.9069889187812805,0.05055532976984978
2022-05-19,16:15,"🚀 🚀 🚀 $1,571,069 BTCUSDT LONGED @$30,250.10 on #Binance (16:12:34 UTC) #BTC #cryptocurrency",1571069 btcusdt longed 3025010 on binance utc btc cryptocurrency,0.036640241742134094,0.9278786778450012,0.0354810431599617
2022-05-19,16:15,"🚀 🚀 🚀 $3,039,650 BTCUSDT LONGED @$30,251.00 on #Binance (16:12:34 UTC) #BTC #cryptocurrency",3039650 btcusdt longed 3025100 on binance utc btc cryptocurrency,0.036928340792655945,0.9292606711387634,0.03381101414561272
2022-05-19,16:15,"The project is very promising, interesting and necessary for society. The company should bring enough benefits to the world. I want to be a part of...
#presale #blockchain #cryptotrading #investing #cryptocurrency #bitcoin #trading #altcoin #cryptonews",the project is very promising interesting and necessary for society the company should bring enough benefits to the world i want to be a part of presale blockchain cryptotrading investing cryptocurrency bitcoin trading altcoin cryptonews,0.16488873958587646,0.8267946243286133,0.008316648192703724
2022-05-19,16:15,"$BTC &amp; $ETH showing some good green candles - fingers crossed 🕯 🚀 

#bitcon #BTC  #Ethereum #ETH #Bounce #cryptocurrency #market",btc eth showing some good green candles fingers crossed bitcon btc ethereum eth bounce cryptocurrency market,0.36195117235183716,0.6271243095397949,0.01092451810836792
2022-05-19,16:15,I am bullish as fuck on #Bitcoin !! That’s my tweet,i am bullish as fuck on bitcoin thats my tweet,0.076199471950531,0.881361186504364,0.042439334094524384
2022-05-19,16:15,"Bitcoin is down 58% from ATH. How is this a hedge against inflation? If you bought the height 5 years ago, you’d have amassed a whopping 3% a year and really close to breaking even as we trend lower. 
#btc #BitcoinCrash #crypto",bitcoin is down 58 from ath how is this a hedge against inflation if you bought the height 5 years ago youd have amassed a whopping 3 a year and really close to breaking even as we trend lower btc bitcoincrash crypto,0.024471819400787354,0.0717725157737732,0.9037557244300842
2022-05-19,16:15,"@MastaRubio @rob77776066 @PsychedelicBart ""ROI is pointless. Blockchain data that shows high def sentiment analysis is pointless. I'll say nothing further on the subject."" - #BTC #maxi",mastarubio rob77776066 psychedelicbart roi is pointless blockchain data that shows high def sentiment analysis is pointless i will say nothing further on the subject btc maxi,0.03557225316762924,0.9341877698898315,0.030240042135119438
2022-05-19,16:15,"@MubeenMazhar786 You would want to see a strong close above the recent Daily Level that still remains, for a chance at further upside price action.

IF #BTC moves up, the first strong Fibonacci level around 34K 🤫

The newsletter shows where support still remains 🙂",mubeenmazhar786 you would want to see a strong close above the recent daily level that still remains for a chance at further upside price action if btc moves up the first strong fibonacci level around 34k the newsletter shows where support still remains,0.911264181137085,0.05828462168574333,0.030451172962784767
2022-05-19,16:15,@cryptojack Obviously #BTC,cryptojack obviously btc,0.03929010406136513,0.930428147315979,0.030281713232398033
2022-05-19,16:15,"all it takes in one global event and tweet -&gt; #Bitcoin 

I see what the curve is doing",all it takes in one global event and tweet gt bitcoin i see what the curve is doing,0.039760395884513855,0.9363155364990234,0.023924091830849648
2022-05-19,16:15,"@CaesarNFTx Let's support this project because it is very promising and I really support it and invest friends to join this project and good luck always 

@trizana057 
@agihamdan 

#BTC #APE #Avax #AvalancheHouse #NFTGiveaway #EGLD",caesarnftx let us support this project because it is very promising and i really support it and invest friends to join this project and good luck always trizana057 agihamdan btc ape avax avalanchehouse nftgiveaway egld,0.5787837505340576,0.41191017627716064,0.009306102991104126
2022-05-19,16:15,"$PIXY Low float with only 20.8M shares. Hot play in #Reddit. #MOASS candidate up to $1.50. Prepared #WallStreetBets 
 #StocksToTrade #Stock #Trader #Investors #fintech #fintel #MONEY #StockMarket #FinTwitt #cryptocurrency #Bitcoin",pixy low float with only 208m shares hot play in reddit moass candidate up to 150 prepared wallstreetbets stockstotrade stock trader investors fintech fintel money stockmarket fintwitt cryptocurrency bitcoin,0.05691930279135704,0.9179851412773132,0.025095587596297264
2022-05-19,16:15,"The project supported by experienced and highly qualified team, which in my opinion is able to bring the project to the highest level in the shortest possible time  
#FGW #FunnyGameWorld #crypto #bitcoin #cryptocurrency #blockchain #bounty #binance #eth #token #coinsbit",the project supported by experienced and highly qualified team which in my opinion is able to bring the project to the highest level in the shortest possible time fgw funnygameworld crypto bitcoin cryptocurrency blockchain bounty binance eth token coinsbit,0.8269376754760742,0.1661597043275833,0.006902611348778009
2022-05-19,16:15,@CMHRZKSR #Bitcoin is rational optimism.,cmhrzksr bitcoin is rational optimism,0.07588031142950058,0.9080449938774109,0.016074711456894875
2022-05-19,16:15,"Don't be ashamed for your hard work ethic to stack #Bitcoin. Remember, no one will feed you when you go broke.",do not be ashamed for your hard work ethic to stack bitcoin remember no one will feed you when you go broke,0.06780743598937988,0.9018962979316711,0.030296295881271362
2022-05-19,16:15,"This assignment has a exquisite destiny. All this indicates that the challenge give an excellent income within the near future. So, do now not late to join.
#IKONIC #CRYPTO #BSC #BINANCE #BITCOIN",this assignment has a exquisite destiny all this indicates that the challenge give an excellent income within the near future so do now not late to join ikonic crypto bsc binance bitcoin,0.4926777184009552,0.49746423959732056,0.009858058765530586
2022-05-19,16:15,"Blockchain technology is here to save us, FRENS.

$btc #btc",blockchain technology is here to save us frens btc btc,0.187724307179451,0.8011550903320312,0.011120655573904514
2022-05-19,16:15,#BTC at resistance again … time to break or fall,btc at resistance again time to break or fall,0.11928955465555191,0.7247718572616577,0.15593856573104858
2022-05-19,16:15,"@PSpuce #bitcoin either hit bottom or we are very close to it. We will not see surely anything under $20k that is 100% in front of me. I am not excited about $32k 
It is a fact that we hit that by Sunday. Then we will hit $40k too.",pspuce bitcoin either hit bottom or we are very close to it we will not see surely anything under 20k that is 100 in front of me i am not excited about 32k it is a fact that we hit that by sunday then we will hit 40k too,0.07268369942903519,0.8158915042877197,0.11142480373382568
2022-05-19,16:15,"#BNB  : #BinanceSmartChain offers a new home to projects that were building on the #Terra blockchain. 

#CryptoNews #cryptocurrency #cryptotrading #news #ETH #BTC",bnb binancesmartchain offers a new home to projects that were building on the terra blockchain cryptonews cryptocurrency cryptotrading news eth btc,0.5952649712562561,0.3972086012363434,0.0075264074839651585
2022-05-19,16:15,"Bull traP 
#Bitcoin",bull trap bitcoin,0.021986771374940872,0.9088185429573059,0.06919460743665695
2022-05-19,16:15,"@BarrySilbert Coupling is always better. #btc and me together forever. 

Now that I'm a minimalist I don't worry bout these things at a personal level. So freeing. 

Make a nice book title 'The Great Decoupling'.",barrysilbert coupling is always better btc and me together forever now that i am a minimalist i do not worry bout these things at a personal level so freeing make a nice book title the great decoupling,0.08747515082359314,0.893307626247406,0.019217174500226974
2022-05-19,16:15,"Your Condition is not even as critical as those I've Handled

Inbox me, If you still want your Account Back!!!

I'm available 24/7 for all Hacking Services
#Hack #coinbase #Hacking #bitcoin   #bnb  #privacy",your condition is not even as critical as those i have handled inbox me if you still want your account back i am available 247 for all hacking services hack coinbase hacking bitcoin bnb privacy,0.047640785574913025,0.9341422915458679,0.018216967582702637
2022-05-19,16:15,"One shall not push the red button May all beras be liquidated 

Amen #bitcoin",one shall not push the red button may all beras be liquidated amen bitcoin,0.03085729293525219,0.9453806281089783,0.023762106895446777
2022-05-19,16:15,@LayahHeilpern Save money to buy #Bitcoin in 8 years! 😄,layahheilpern save money to buy bitcoin in 8 years,0.728222668170929,0.2616170048713684,0.01016039028763771
2022-05-19,16:15,"The likelihood we see a $20K #bitcoin by July 1st? Current #cryptopowerindex longterm trend on 
#BTC still showing a down month for June - things could change - but will take some big news!",the likelihood we see a 20k bitcoin by july 1st current cryptopowerindex longterm trend on btc still showing a down month for june things could change but will take some big news,0.06630072742700577,0.1355094313621521,0.7981898188591003
2022-05-19,16:15,"🚀 🚀 🚀 $1,575,842 BTCUSDT LONGED @$30,293.60 on #Binance (16:11:24 UTC) #BTC #cryptocurrency",1575842 btcusdt longed 3029360 on binance utc btc cryptocurrency,0.03649807348847389,0.9304890036582947,0.03301291540265083
2022-05-19,16:15,"@AirdropDet good project

#Airdrops #DexCheck #Bitcoin #AirdropDet",airdropdet good project airdrops dexcheck bitcoin airdropdet,0.11552198976278305,0.8735904097557068,0.01088764425367117
2022-05-19,16:15,"🚀 🚀 🚀 $857,263 BTCUSDT LONGED @$30,292.00 on #Bybit (16:11:07 UTC) #BTC #cryptocurrency",857263 btcusdt longed 3029200 on bybit utc btc cryptocurrency,0.031607434153556824,0.939605176448822,0.028787370771169662
2022-05-19,16:15,"IKONIC is one of the most ongoing projects in the market at present.  Hopefully, those of us who are working on this project will benefit a lot from here. 
IKONIC #CRYPTO #BSC #BINANCE #BITCOIN",ikonic is one of the most ongoing projects in the market at present hopefully those of us who are working on this project will benefit a lot from here ikonic crypto bsc binance bitcoin,0.5569409132003784,0.43530020117759705,0.007758955005556345
