Date,Time,Original tweet,Clean tweet,Positive,Neutral,Negative
2022-04-30,6:45,"@igograph @binance @PlayWizardia #BTC faced selling pressure around the $42.8k area, and another wave of fear rippled across the crypto market. but for #ApeCoin, which occupied the 30th spot on CoinMarketCap, ranked by market capitalization.i make decent profits mrs Zita signals on telegram(radmilazitasignals)",igograph binance playwizardia btc faced selling pressure around the 428k area and another wave of fear rippled across the crypto market but for apecoin which occupied the 30th spot on coinmarketcap ranked by market capitalizationi make decent profits mrs zita signals on telegramradmilazitasignals,0.07860447466373444,0.043968863785266876,0.8774266839027405
2022-04-30,6:45,#Russia stopping gas transfers to Europe reminds me of China #BTC mining ban. There was a period of confusion and forced adaptation but ultimately BTC hashrate is better than ever and China lost leverage over crypto markets.,russia stopping gas transfers to europe reminds me of china btc mining ban there was a period of confusion and forced adaptation but ultimately btc hashrate is better than ever and china lost leverage over crypto markets,0.8301535844802856,0.05390483886003494,0.1159416139125824
2022-04-30,6:45,@crypstax #BTC the power of crypto,crypstax btc the power of crypto,0.030866296961903572,0.9354676604270935,0.03366602584719658
2022-04-30,6:45,"project not to be missed. Investing in a crypto startup is one of the best ways to earn money on a cryptocurrency.#MetapleFinance #Metaple #MLX #blockchain #cryptocurrency #technology #bitcoin #money #crypto #Binance #BNB #cryptocurrencies #fintech
 @MetapleFinance",project not to be missed investing in a crypto startup is one of the best ways to earn money on a cryptocurrencymetaplefinance metaple mlx blockchain cryptocurrency technology bitcoin money crypto binance bnb cryptocurrencies fintech metaplefinance,0.14644242823123932,0.8442386984825134,0.009318878874182701
2022-04-30,6:45,"In #2022 Bull Run Keep Your Eyes on These Gems 💎

1) $VRA 
2) $doge 
3) $munch 
4) $Ape
5) $bepro

Once the #btc crossed over $50k, we can expect huge moves for these coins.",in 2022 bull run keep your eyes on these gems 1 vra 2 doge 3 munch 4 ape 5 bepro once the btc crossed over 50k we can expect huge moves for these coins,0.48610952496528625,0.49217459559440613,0.021715916693210602
2022-04-30,6:45,"The project is qualitative, it is obvious that the team works and puts in it heart and soul, looking forward to see the development of this project. a very worthy project. 
#DeFi #ethax #ethaxcrypto #ethaxtoken #DEX #cryptocurrency #Ethereum #BinanceSmartChain #Bitcoin",the project is qualitative it is obvious that the team works and puts in it heart and soul looking forward to see the development of this project a very worthy project defi ethax ethaxcrypto ethaxtoken dex cryptocurrency ethereum binancesmartchain bitcoin,0.6140338778495789,0.3778347671031952,0.008131330832839012
2022-04-30,6:45,"@duyunsheng1 @binance #BTC faced selling pressure around the $42.8k area, and another wave of fear rippled across the crypto market. but for #ApeCoin, which occupied the 30th spot on CoinMarketCap, ranked by market capitalization.i make decent profits mrs Zita signals on telegram(radmilazitasignals)",duyunsheng1 binance btc faced selling pressure around the 428k area and another wave of fear rippled across the crypto market but for apecoin which occupied the 30th spot on coinmarketcap ranked by market capitalizationi make decent profits mrs zita signals on telegramradmilazitasignals,0.1137143075466156,0.054460715502500534,0.8318249583244324
2022-04-30,6:45,"#ethaxcrypto #ethaxtoken #DEX #cryptocurrency #Ethereum #BinanceSmartChain #Bitcoin
Ethax Tokens project is a better choice for traders and farmers to join. Rate of production of tokens making the value of token price in future. Yes i am recently success produce this coin.",ethaxcrypto ethaxtoken dex cryptocurrency ethereum binancesmartchain bitcoin ethax tokens project is a better choice for traders and farmers to join rate of production of tokens making the value of token price in future yes i am recently success produce this coin,0.22533221542835236,0.7659638524055481,0.008703967556357384
2022-04-30,6:45,"[⭐️🟡 NEW LISTING⭐️]
[NOSNITCH] BEING LISTED IN COINGECKO [BLACKSTAR]

More Info in bio

$AU #Bitcoin #AutoCrypto #crypto #cryptocurrecy #BNB #ToTheMoon #BSC #BSCGem #GEM #altcoin #token",new listing nosnitch being listed in coingecko blackstar more info in bio au bitcoin autocrypto crypto cryptocurrecy bnb tothemoon bsc bscgem gem altcoin token,0.03751607984304428,0.945236086845398,0.017247870564460754
2022-04-30,6:45,"@dwijdoc @BriseZilla @bitgertbrise @Shibtoken @dogecoin Great project! Amazing team! Still soooo early!

#BRISEZILLA #BRZILLA #BRC20 #BRISE #BITGERT #BRISECHAIN #SHIBA #BABYDOGE #KISHUINU #SHINJA #SAITAMAINU #DOGE #PITBULL #BTC #ETHEREUM #BINANCE #CARDANO #SOLANO",dwijdoc brisezilla bitgertbrise shibtoken dogecoin great project amazing team still soooo early brisezilla brzilla brc20 brise bitgert brisechain shiba babydoge kishuinu shinja saitamainu doge pitbull btc ethereum binance cardano solano,0.06095763295888901,0.8928796648979187,0.04616264998912811
2022-04-30,6:45,"Full thanks to @Tradeosiann as they have analysed this #Bitcoin crash so my funds doesn't affected and I have not faced any type of losses 
They are absolutely amazing in tips,advices and everything😌 #BTC #Crypto #MATIC  #XRP ,c,cvv",full thanks to tradeosiann as they have analysed this bitcoin crash so my funds does not affected and i have not faced any type of losses they are absolutely amazing in tipsadvices and everything btc crypto matic xrp ccvv,0.18983611464500427,0.7917146682739258,0.018449191004037857
2022-04-30,6:45,"@lambofinance1 This really amazing project and very strong team.i wish this project succes and moon

@AsepMaosul8 @Aryaa1508 @yogamaulana0 

#crypto #Airdrop #BSC #Bitcoin #BUSD #LamboFinance #BUSD #Airdropstario",lambofinance1 this really amazing project and very strong teami wish this project succes and moon asepmaosul8 aryaa1508 yogamaulana0 crypto airdrop bsc bitcoin busd lambofinance busd airdropstario,0.608596920967102,0.38251763582229614,0.00888543576002121
2022-04-30,6:45,"@Dennis_Porter_ @AbelitoPanama Bitcoin volatility index , moving very huge .

DM on how you can make money with Bitcoin investment today and get paid on weekly basis. #bitcoin #likes #love #wealth #money #forex #cash #shiba #eth #binance #BTC",dennisporter abelitopanama bitcoin volatility index moving very huge dm on how you can make money with bitcoin investment today and get paid on weekly basis bitcoin likes love wealth money forex cash shiba eth binance btc,0.06292527168989182,0.9166322946548462,0.02044239640235901
2022-04-30,6:45,"@Zhra99574270 @binance #BTC faced selling pressure around the $42.8k area, and another wave of fear rippled across the crypto market. but for #ApeCoin, which occupied the 30th spot on CoinMarketCap, ranked by market capitalization.i make decent profits mrs Zita signals on telegram(radmilazitasignals)",zhra99574270 binance btc faced selling pressure around the 428k area and another wave of fear rippled across the crypto market but for apecoin which occupied the 30th spot on coinmarketcap ranked by market capitalizationi make decent profits mrs zita signals on telegramradmilazitasignals,0.1551979035139084,0.053504131734371185,0.7912980318069458
2022-04-30,6:45,@theisland_live The great and dedicated team involved. It's a very high quality and reliable project. The team will work effectively for the success of the project.#aliceincrypto #NFT #aliceNFT #Airdrop #bountycampaign #bitcoin #defi #Crypto #BSCGem #BSCGemsAlert #web3,theislandlive the great and dedicated team involved it is a very high quality and reliable project the team will work effectively for the success of the projectaliceincrypto nft alicenft airdrop bountycampaign bitcoin defi crypto bscgem bscgemsalert web3,0.745465874671936,0.24695797264575958,0.0075762090273201466
2022-04-30,6:45,"@Dennis_Porter_ Bitcoin volatility index , moving very huge .

DM on how you can make money with Bitcoin investment today and get paid on weekly basis. #bitcoin #likes #love #wealth #money #forex #cash #shiba #eth #binance #BTC",dennisporter bitcoin volatility index moving very huge dm on how you can make money with bitcoin investment today and get paid on weekly basis bitcoin likes love wealth money forex cash shiba eth binance btc,0.06596507877111435,0.9130557775497437,0.020979152992367744
2022-04-30,6:45,"It’s simply stunning at how many friendships are forming within the @DeGodsNFT community! We all want everyone to make it and will stop at nothing to help! This is what your buying into, it’s unrivalled!

#solana #NFTs #SOL #solananetwork #SolanaNFTs #NFT #nftart #sol #BTC #ETH",its simply stunning at how many friendships are forming within the degodsnft community we all want everyone to make it and will stop at nothing to help this is what your buying into its unrivalled solana nfts sol solananetwork solananfts nft nftart sol btc eth,0.15822412073612213,0.8315784931182861,0.010197319090366364
2022-04-30,6:45,"Fidelity is adding #Bitcoin to the 401K pension plans.

Goldman Sachs offered their first #Bitcoin -backed loan.

The adoption is growing.

Matter of time until #Bitcoin price kicks towards $250K too.",fidelity is adding bitcoin to the 401k pension plans goldman sachs offered their first bitcoin backed loan the adoption is growing matter of time until bitcoin price kicks towards 250k too,0.13218070566654205,0.8548192381858826,0.013000023551285267
2022-04-30,6:45,"@RadiantGalaxyIO The is constantly attracting growing interest as a global audience and investo #Gaxy #Metaverse #NFTs #Gaming #DeFi #Airdrop  #cryptocurrency #blockchain  #Defi #NFT #crypto #BTC #Altcoin #NFTCommunity
#NFTgamers #Playtoearn #cryptogaming #movetoearn #walktoearn",radiantgalaxyio the is constantly attracting growing interest as a global audience and investo gaxy metaverse nfts gaming defi airdrop cryptocurrency blockchain defi nft crypto btc altcoin nftcommunity nftgamers playtoearn cryptogaming movetoearn walktoearn,0.21617047488689423,0.775584876537323,0.008244683966040611
2022-04-30,6:45,@AriZonanHODL My earnings has increased drastically from 2 Bitcoin to 9 Bitcoin in just 4 weeks and some days. I have full confidence in Joseph Leon trading abilities. Y'all can reach out to him through Telegram @ LeonJoe1 for any #Crypto currencies related issues or more assistants #Bitcoin,arizonanhodl my earnings has increased drastically from 2 bitcoin to 9 bitcoin in just 4 weeks and some days i have full confidence in joseph leon trading abilities y all can reach out to him through telegram leonjoe1 for any crypto currencies related issues or more assistants bitcoin,0.8430827260017395,0.14691977202892303,0.009997542016208172
2022-04-30,6:45,"@coinok #BTC RSI has been indicating strength while price has been on a decline. This indication 

may be foreseeing underlying strength within #Bitcoin , and it may only be a matter of time before price reflects in a MAJOR way

I’ve been taking @bnbt_ix TA seriously and I’ve been superb",coinok btc rsi has been indicating strength while price has been on a decline this indication may be foreseeing underlying strength within bitcoin and it may only be a matter of time before price reflects in a major way ive been taking bnbtix ta seriously and ive been superb,0.14194661378860474,0.06562229245901108,0.7924310564994812
2022-04-30,6:45,#BTC is a bad trip,btc is a bad trip,0.019741609692573547,0.12780141830444336,0.8524569869041443
2022-04-30,6:45,"Full thanks to @Tradeosiann as they have analysed this #Bitcoin crash so my funds doesn't affected and I have not faced any type of losses 
They are absolutely amazing in tips,advices and everything😌 #BTC #Crypto #MATIC  #XRP l",full thanks to tradeosiann as they have analysed this bitcoin crash so my funds does not affected and i have not faced any type of losses they are absolutely amazing in tipsadvices and everything btc crypto matic xrp l,0.2866118252277374,0.6965200901031494,0.01686807908117771
2022-04-30,6:45,"Just don’t give up trying to do what you really want to do. Where there is love and inspiration, I don’t think you can go wrong. Trust the process

GM 🌞 Cillionaires 

#NFTCommuntiy #NFTs #BNB  #Binance  #WAGMI #BTC #GHC #AFEN",just don not give up trying to do what you really want to do where there is love and inspiration i don not think you can go wrong trust the process gm cillionaires nftcommuntiy nfts bnb binance wagmi btc ghc afen,0.06825843453407288,0.9123648405075073,0.01937669888138771
2022-04-30,6:45,@TheCryptoLark My earnings has increased drastically from 2 Bitcoin to 9 Bitcoin in just 4 weeks and some days. I have full confidence in Joseph Leon trading abilities. Y'all can reach out to him through Telegram @ LeonJoe1 for any #Crypto currencies related issues or more assistants #Bitcoin,thecryptolark my earnings has increased drastically from 2 bitcoin to 9 bitcoin in just 4 weeks and some days i have full confidence in joseph leon trading abilities y all can reach out to him through telegram leonjoe1 for any crypto currencies related issues or more assistants bitcoin,0.8248533606529236,0.16434329748153687,0.010803353041410446
2022-04-30,6:45,"#GMTUSDT #greenmeta up 2000% in less than 2mnt while you're waiting for 20k on #BITCOIN 

Smart money find way to make 1000%. ✌️",gmtusdt greenmeta up 2000 in less than 2mnt while you are waiting for 20k on bitcoin smart money find way to make 1000,0.19678163528442383,0.790382981300354,0.012835422530770302
2022-04-30,6:45,"Nearly 51 years after going off gold (Nixon Shock)😏, the dollar must go for crypto.
#bitcoin #cryptocurrency #Cryptos #Ethereum #BTC",nearly 51 years after going off gold nixon shock the dollar must go for crypto bitcoin cryptocurrency cryptos ethereum btc,0.0731954276561737,0.906050980091095,0.020753541961312294
2022-04-30,6:45,"How can India be more #Crypto-Friendly?

#BTC #cryptocurrency",how can india be more cryptofriendly btc cryptocurrency,0.05296054109930992,0.926038920879364,0.021000510081648827
2022-04-30,6:45,Current #Bitcoin Price is $38677 #BTC #Crypto,current bitcoin price is 38677 btc crypto,0.021794311702251434,0.9478798508644104,0.030325859785079956
2022-04-30,6:45,@Dennis_Porter_ #bitcoin is the ultimate savings technology.,dennisporter bitcoin is the ultimate savings technology,0.15378478169441223,0.8359975814819336,0.010217610746622086
2022-04-30,6:45,"Through this I’ve become a person who I’m so very proud of. Don’t count yourself out. Don’t sell yourself short. The life you’ve been gifted is unrivaled, in potential, on the most grand scale  imaginable. They only thing close is the loss when that gift is wasted. #Bitcoin #life",through this ive become a person who im so very proud of don not count yourself out don not sell yourself short the life youve been gifted is unrivaled in potential on the most grand scale imaginable they only thing close is the loss when that gift is wasted bitcoin life,0.048614051192998886,0.9149006605148315,0.03648531064391136
2022-04-30,6:45,@888Velvet My earnings has increased drastically from 2 Bitcoin to 9 Bitcoin in just 4 weeks and some days. I have full confidence in Joseph Leon trading abilities. Y'all can reach out to him through Telegram @ LeonJoe1 for any #Crypto currencies related issues or more assistants #Bitcoin,888velvet my earnings has increased drastically from 2 bitcoin to 9 bitcoin in just 4 weeks and some days i have full confidence in joseph leon trading abilities y all can reach out to him through telegram leonjoe1 for any crypto currencies related issues or more assistants bitcoin,0.83236163854599,0.15796853601932526,0.009669763967394829
2022-04-30,6:45,"A common mistake is start taking stupid risks after a trading loss.

Revenge trading kills traders careers. 
#cryptocurrecy #Defi #BTC",a common mistake is start taking stupid risks after a trading loss revenge trading kills traders careers cryptocurrecy defi btc,0.026456279680132866,0.2311592400074005,0.7423844933509827
2022-04-30,6:45,"Weekly reminder to not trade weekends. This has a very high chance of being an insanely nasty weekend of chop, especially since we have a monthly close. #Bitcoin  will still be here Monday.",weekly reminder to not trade weekends this has a very high chance of being an insanely nasty weekend of chop especially since we have a monthly close bitcoin will still be here monday,0.031232571229338646,0.23299384117126465,0.7357736229896545
2022-04-30,6:45,"The very idea that #Bitcoin scales to the world through the base layer makes little sense, regardless of block space considerations. It's like trying to implement YouTube using the OSI physical or data link layer.

The future of scalability will be built at the application layer.",the very idea that bitcoin scales to the world through the base layer makes little sense regardless of block space considerations it is like trying to implement youtube using the osi physical or data link layer the future of scalability will be built at the application layer,0.0407344251871109,0.935853898525238,0.023411620408296585
2022-04-30,6:45,"@Infosys @EverestGroup #BTC RSI has been indicating strength while price has been on a decline. This indication 

may be foreseeing underlying strength within #Bitcoin , and it may only be a matter of time before price reflects in a MAJOR way

I’ve been taking @bnbt_ix TA seriously and I’ve been superb",infosys everestgroup btc rsi has been indicating strength while price has been on a decline this indication may be foreseeing underlying strength within bitcoin and it may only be a matter of time before price reflects in a major way ive been taking bnbtix ta seriously and ive been superb,0.27965494990348816,0.05141966789960861,0.6689254641532898
2022-04-30,6:45,create twitter tasks and pay with #bitcoin #ethereum or #litecoin with @jobboycom,create twitter tasks and pay with bitcoin ethereum or litecoin with jobboycom,0.02573881857097149,0.9398004412651062,0.03446068987250328
2022-04-30,6:45,"@TheRealPlanC #BTC RSI has been indicating strength while price has been on a decline. This indication 

may be foreseeing underlying strength within #Bitcoin , and it may only be a matter of time before price reflects in a MAJOR way

I’ve been taking @bnbt_ix TA seriously and I’ve been superb",therealplanc btc rsi has been indicating strength while price has been on a decline this indication may be foreseeing underlying strength within bitcoin and it may only be a matter of time before price reflects in a major way ive been taking bnbtix ta seriously and ive been superb,0.26224708557128906,0.05415964126586914,0.6835932731628418
2022-04-30,6:45,"@SaraLuax1 @binance @Marvin_Inu #BTC faced selling pressure around the $42.8k area, and another wave of fear rippled across the crypto market. but for #ApeCoin, which occupied the 30th spot on CoinMarketCap, ranked by market capitalization.i make decent profits mrs Zita signals on telegram(radmilazitasignals)",saraluax1 binance marvininu btc faced selling pressure around the 428k area and another wave of fear rippled across the crypto market but for apecoin which occupied the 30th spot on coinmarketcap ranked by market capitalizationi make decent profits mrs zita signals on telegramradmilazitasignals,0.10650019347667694,0.05376468226313591,0.8397351503372192
2022-04-30,6:45,"@everyanyone_ Bitcoin volatility index , moving very huge .

DM on how you can make money with Bitcoin investment today and get paid on weekly basis. #bitcoin #likes #love #wealth #money #forex #cash #shiba #eth #binance #BTC",everyanyone bitcoin volatility index moving very huge dm on how you can make money with bitcoin investment today and get paid on weekly basis bitcoin likes love wealth money forex cash shiba eth binance btc,0.06591751426458359,0.9127498865127563,0.0213325172662735
2022-04-30,6:45,"#Bitcoin 📈 

▓▓▓▓▓▓░░░░░░░░░ 39%

price:$38666.76      eth/btc: 0.07",bitcoin 39 007,0.030288487672805786,0.9321002960205078,0.0376112274825573
2022-04-30,6:45,The strongest team of this company will make it in the new year the most successful company.#aliceinrypto #NFT #aliceNFT #airdrop #bountycampaign #bitcoin #defi #Crypto #BSCGem #BSCGemsAlert #web3,the strongest team of this company will make it in the new year the most successful companyaliceinrypto nft alicenft airdrop bountycampaign bitcoin defi crypto bscgem bscgemsalert web3,0.7848532199859619,0.2078184336423874,0.007328344509005547
2022-04-30,6:45,"@News18lokmat @news18 @zebpayofficial #BTC RSI has been indicating strength while price has been on a decline. This indication 

may be foreseeing underlying strength within #Bitcoin , and it may only be a matter of time before price reflects in a MAJOR way

I’ve been taking @bnbt_ix TA seriously and I’ve been superb",news18lokmat news18 zebpayofficial btc rsi has been indicating strength while price has been on a decline this indication may be foreseeing underlying strength within bitcoin and it may only be a matter of time before price reflects in a major way ive been taking bnbtix ta seriously and ive been superb,0.23430189490318298,0.049936916679143906,0.715761125087738
2022-04-30,6:45,"@rovercrc Good morning  #BTC $36,0000 soon",rovercrc good morning btc 360000 soon,0.034075357019901276,0.9385358691215515,0.02738880179822445
2022-04-30,6:45,"Time to sleep.  Wen I wake, I will see 30K and smash buy

#btc — let’s go my fellow degens",time to sleep wen i wake i will see 30k and smash buy btc lets go my fellow degens,0.07249920815229416,0.9007302522659302,0.026770586147904396
2022-04-30,6:45,"@saeedkh86 @binance #BTC faced selling pressure around the $42.8k area, and another wave of fear rippled across the crypto market. but for #ApeCoin, which occupied the 30th spot on CoinMarketCap, ranked by market capitalization.i make decent profits mrs Zita signals on telegram(radmilazitasignals)",saeedkh86 binance btc faced selling pressure around the 428k area and another wave of fear rippled across the crypto market but for apecoin which occupied the 30th spot on coinmarketcap ranked by market capitalizationi make decent profits mrs zita signals on telegramradmilazitasignals,0.07705436646938324,0.0540236234664917,0.8689220547676086
2022-04-30,6:45,#BTC will save us,btc will save us,0.17773406207561493,0.8084356188774109,0.013830325566232204
2022-04-30,6:45,How is world feeling about #BTC right now ? 🤔,how is world feeling about btc right now,0.041030313819646835,0.9071065187454224,0.05186319723725319
2022-04-30,6:45,"I think anybody who is interested in keeping their money safe from the criminal banking system would want gold, silver, and #Bitcoin. 
Max Keiser",i think anybody who is interested in keeping their money safe from the criminal banking system would want gold silver and bitcoin max keiser,0.0875624492764473,0.8997865915298462,0.012650889344513416
2022-04-30,6:45,"The $SLP from @AxieInfinity is now at $0.01226 
📈 Is up 0.223% compare to 1 hour ago
📉 and is down -22.167% compare to 1 week ago
 #BTC #ETH #SLP",the slp from axieinfinity is now at 001226 is up 0223 compare to 1 hour ago and is down 22167 compare to 1 week ago btc eth slp,0.5926758050918579,0.04742991179227829,0.3598942756652832
2022-04-30,6:45,"@phip420 @binance @DFSMAFIA99 #BTC faced selling pressure around the $42.8k area, and another wave of fear rippled across the crypto market. but for #ApeCoin, which occupied the 30th spot on CoinMarketCap, ranked by market capitalization.i make decent profits mrs Zita signals on telegram(radmilazitasignals)",phip420 binance dfsmafia99 btc faced selling pressure around the 428k area and another wave of fear rippled across the crypto market but for apecoin which occupied the 30th spot on coinmarketcap ranked by market capitalizationi make decent profits mrs zita signals on telegramradmilazitasignals,0.13720296323299408,0.050252728164196014,0.8125443458557129
2022-04-30,6:45,"Rules of the game. 

In bull market you, buy the pump. 

In bear markets??? 

You__________. ? 

🤣🤣🤣

#Bitcoin",rules of the game in bull market you buy the pump in bear markets you bitcoin,0.03672115504741669,0.9315536618232727,0.03172517940402031
2022-04-30,6:45,"@BitcoinMagazine @nayibbukele Bitcoin volatility index , moving very huge .

DM on how you can make money with Bitcoin investment today and get paid on weekly basis. #bitcoin #likes #love #wealth #money #forex #cash #shiba #eth #binance #BTC",bitcoinmagazine nayibbukele bitcoin volatility index moving very huge dm on how you can make money with bitcoin investment today and get paid on weekly basis bitcoin likes love wealth money forex cash shiba eth binance btc,0.07509024441242218,0.9044352769851685,0.020474515855312347
2022-04-30,6:45,make #cryptocurrency #litecoin #bitcoin with @jobboycom,make cryptocurrency litecoin bitcoin with jobboycom,0.06274063885211945,0.9231441617012024,0.014115196652710438
2022-04-30,6:45,"30 USD on #ElSalvador #BitcoinDay got you 63,900 sat. 
Now 63,900 sat are 24.71 USD (-17.63%)

1 BTC = 38,675.50 USD
1 USD = 2,586 Sat
on Sat 30 Apr 2022 01:30 AM CDT

1 BTC = 46,948.36 USD
1 USD = 2,130 sat
on Tue 07 Sep 2021 11:00 AM CDT

#Bitcoin",30 usd on elsalvador bitcoinday got you 63900 sat now 63900 sat are 2471 usd 1763 1 btc 3867550 usd 1 usd 2586 sat on sat 30 apr 2022 am cdt 1 btc 4694836 usd 1 usd 2130 sat on tue 07 sep 2021 am cdt bitcoin,0.08983699232339859,0.894639253616333,0.01552383042871952
