Date,Time,Original tweet,Clean tweet,Positive,Neutral,Negative
2022-05-24,22:45,@Phemex_official #LUFFYCREW #LUFFY $LUFFY #LUFFYV2 #LUFFYTOKEN #SHIB #DOGE #Binance #Coinbase #Metaverse #cryptocurrency #BTC #ETH #nft #NFTs @luffyinutoken @LuffyTurkey #LUFFYCREW #LUFFY $LUFFY #LUFFYV2 #LUFFYTOKEN #SHIB #DOGE #Binance #Coinbase #Metaverse @luffyinutoken @LuffyTurkey #gateio,phemexofficial luffycrew luffy luffy luffyv2 luffytoken shib doge binance coinbase metaverse cryptocurrency btc eth nft nfts luffyinutoken luffyturkey luffycrew luffy luffy luffyv2 luffytoken shib doge binance coinbase metaverse luffyinutoken luffyturkey gateio,0.03750123828649521,0.9432100057601929,0.01928870938718319
2022-05-24,22:45,"Pairs:ETHUSDT 
 SELL:1979.43000
 Time :5/25/2022 4:13:41 AM
 Average Decision:47.61180 OneHour 
 Estimated Direction: DOWN
 #BTC #ADABIDR #Bitcoin #RSİ #Bollinger -It is not investment advice. You can visit our profile for your own alarms. YTD. 1:38:17 AM",time am average onehour estimated down btc adabidr bitcoin rsi bollinger it is not investment advice you can visit our profile for your own alarms ytd am,0.021298646926879883,0.9322543144226074,0.04644699767231941
2022-05-24,22:45,@rogerkver It’s called #Bitcoin Lightning network sir,rogerkver its called bitcoin lightning network sir,0.040141116827726364,0.9381411671638489,0.021717742085456848
2022-05-24,22:45,@Phemex_official @Stepnofficial #LUFFYCREW #LUFFY $LUFFY #LUFFYV2 #LUFFYTOKEN #SHIB #DOGE #Binance #Coinbase #Metaverse #cryptocurrency #BTC #ETH #nft #NFTs @luffyinutoken @LuffyTurkey #LUFFYCREW #LUFFY $LUFFY #LUFFYV2 #LUFFYTOKEN #SHIB #DOGE #Binance #Coinbase #Metaverse @luffyinutoken @LuffyTurkey #gateio,phemexofficial stepnofficial luffycrew luffy luffy luffyv2 luffytoken shib doge binance coinbase metaverse cryptocurrency btc eth nft nfts luffyinutoken luffyturkey luffycrew luffy luffy luffyv2 luffytoken shib doge binance coinbase metaverse luffyinutoken luffyturkey gateio,0.04284646362066269,0.9384455680847168,0.01870794966816902
2022-05-24,22:45,@HodlDee Me bro #bitcoin only,hodldee me bro bitcoin only,0.08388769626617432,0.8602648973464966,0.055847473442554474
2022-05-24,22:45,@RainforestCx @HUAWEI_TECH4ALL #LUFFYCREW #LUFFY $LUFFY #LUFFYV2 #LUFFYTOKEN #SHIB #DOGE #Binance #Coinbase #Metaverse #cryptocurrency #BTC #ETH #nft #NFTs @luffyinutoken @LuffyTurkey #LUFFYCREW #LUFFY $LUFFY #LUFFYV2 #LUFFYTOKEN #SHIB #DOGE #Binance #Coinbase #Metaverse @luffyinutoken @LuffyTurkey #gateio,rainforestcx huaweitech4all luffycrew luffy luffy luffyv2 luffytoken shib doge binance coinbase metaverse cryptocurrency btc eth nft nfts luffyinutoken luffyturkey luffycrew luffy luffy luffyv2 luffytoken shib doge binance coinbase metaverse luffyinutoken luffyturkey gateio,0.048020269721746445,0.9345571398735046,0.01742258295416832
2022-05-24,22:45,#fmg to the moon 🔥🔥🔥🚀🚀🚀🚀 #btc #eth,fmg to the moon btc eth,0.05650073662400246,0.9315056800842285,0.011993637308478355
2022-05-24,22:45,@HUAWEI_TECH4ALL #LUFFYCREW #LUFFY $LUFFY #LUFFYV2 #LUFFYTOKEN #SHIB #DOGE #Binance #Coinbase #Metaverse #cryptocurrency #BTC #ETH #nft #NFTs @luffyinutoken @LuffyTurkey #LUFFYCREW #LUFFY $LUFFY #LUFFYV2 #LUFFYTOKEN #SHIB #DOGE #Binance #Coinbase #Metaverse @luffyinutoken @LuffyTurkey #gateio,huaweitech4all luffycrew luffy luffy luffyv2 luffytoken shib doge binance coinbase metaverse cryptocurrency btc eth nft nfts luffyinutoken luffyturkey luffycrew luffy luffy luffyv2 luffytoken shib doge binance coinbase metaverse luffyinutoken luffyturkey gateio,0.04412863776087761,0.9369509220123291,0.01892046630382538
2022-05-24,22:45,"@saylor @hodlXhold #Bitcoin is nuclear energy 
#Cardano is green energy the future #ADA",saylor hodlxhold bitcoin is nuclear energy cardano is green energy the future ada,0.06801489740610123,0.9150336980819702,0.01695142686367035
2022-05-24,22:45,great day to take your #Bitcoin off exchanges,great day to take your bitcoin off exchanges,0.26948681473731995,0.7012499570846558,0.0292632058262825
2022-05-24,22:45,Blaming #bitcoin for #ransomware attacks is like #blaming the #dollar when a #bank is #robbed.,blaming bitcoin for ransomware attacks is like blaming the dollar when a bank is robbed,0.027630960568785667,0.6421522498130798,0.3302168548107147
2022-05-24,22:45,@Eljaboom #LUFFYCREW #LUFFY $LUFFY #LUFFYV2 #LUFFYTOKEN #SHIB #DOGE #Binance #Coinbase #Metaverse #cryptocurrency #BTC #ETH #nft #NFTs @luffyinutoken @LuffyTurkey #LUFFYCREW #LUFFY $LUFFY #LUFFYV2 #LUFFYTOKEN #SHIB #DOGE #Binance #Coinbase #Metaverse @luffyinutoken @LuffyTurkey #gateio,eljaboom luffycrew luffy luffy luffyv2 luffytoken shib doge binance coinbase metaverse cryptocurrency btc eth nft nfts luffyinutoken luffyturkey luffycrew luffy luffy luffyv2 luffytoken shib doge binance coinbase metaverse luffyinutoken luffyturkey gateio,0.04370487481355667,0.9368153214454651,0.019479840993881226
2022-05-24,22:45,"@Atlantis_Ex Bep20:--------
0xB72709f9Ec0D128b13995E2BC45D87a8692B58fF

@catie_william
@Cupidoge
@yanyan724826912
@StewartCeara 
@zhouxueli2 

$ATC $AC #BTC #NFTs
#Atlantis_NFTs",atlantisex 0xb72709f9ec0d128b13995e2bc45d87a8692b58ff catiewilliam cupidoge yanyan724826912 stewartceara zhouxueli2 atc ac btc nfts atlantisnfts,0.05370381101965904,0.9274968504905701,0.018799282610416412
2022-05-24,22:45,The chart is ETH/BTC on the daily chart.   #Bitcoin,the chart is ethbtc on the daily chart bitcoin,0.024787379428744316,0.9466152191162109,0.0285973958671093
2022-05-24,22:45,"@macguyvermedia @CryptoTodayLive Awesome! 
LFG 🙌😍🚀
Thank you #MacAttack 
#Crypto #Bitcoin #bnb 
Good luck everyone
@JustMeElla @DeAxist @verenic61522738",macguyvermedia cryptotodaylive awesome lfg thank you macattack crypto bitcoin bnb good luck everyone justmeella deaxist verenic61522738,0.18686021864414215,0.7932630777359009,0.01987665891647339
2022-05-24,22:45,@JakeLeask @buythedip___ @bh30317 Looks like a fair distribution lol. Why has your hashrate dropped so much? And you are correct. I stopped mining “crypto” several years ago now. I only secure the #bitcoin network now so I’m not very well versed in “crypto” any longer.,jakeleask buythedip bh30317 looks like a fair distribution lol why has your hashrate dropped so much and you are correct i stopped mining crypto several years ago now i only secure the bitcoin network now so im not very well versed in crypto any longer,0.020014654844999313,0.08246055990457535,0.8975247144699097
2022-05-24,22:45,"@JackPosobiec @crypto_birb Just a personal Analysis Market is still Bearish. #BTC   Might touch $24,500. It could be $19,000 👀",jackposobiec cryptobirb just a personal analysis market is still bearish btc might touch 24500 it could be 19000,0.042624447494745255,0.9272748827934265,0.03010064922273159
2022-05-24,22:45,@upbitglobal #LUFFYCREW #LUFFY $LUFFY #LUFFYV2 #LUFFYTOKEN #SHIB #DOGE #Binance #Coinbase #Metaverse #cryptocurrency #BTC #ETH #nft #NFTs @luffyinutoken @LuffyTurkey #LUFFYCREW #LUFFY $LUFFY #LUFFYV2 #LUFFYTOKEN #SHIB #DOGE #Binance #Coinbase #Metaverse @luffyinutoken @LuffyTurkey #gateio,upbitglobal luffycrew luffy luffy luffyv2 luffytoken shib doge binance coinbase metaverse cryptocurrency btc eth nft nfts luffyinutoken luffyturkey luffycrew luffy luffy luffyv2 luffytoken shib doge binance coinbase metaverse luffyinutoken luffyturkey gateio,0.042559027671813965,0.9376893043518066,0.01975167542695999
2022-05-24,22:45,@FossGregfoss Richard Heart was smart enough to mine 50 #BTC a block for pennies &amp; made literally millions from doing so.  But now that he is wealthy beyond anyone's wildest dreams he doesn't miss a chance to shit on #BTC. #BTC made him a multi multi millionaire but ETH is his new gateway drug,fossgregfoss richard heart was smart enough to mine 50 btc a block for pennies made literally millions from doing so but now that he is wealthy beyond anyone wildest dreams he does not miss a chance to shit on btc btc made him a multi multi millionaire but eth is his new gateway drug,0.10616744309663773,0.8774086833000183,0.016423823311924934
2022-05-24,22:45,I only get mad when my patients tell me they are going to invest in something that is not #Bitcoin,i only get mad when my patients tell me they are going to invest in something that is not bitcoin,0.03190739452838898,0.48316776752471924,0.4849248230457306
2022-05-24,22:45,"@AirdropDet This project is very good. And I believe that. Let's support this project so that it runs smoothly and competes in the market

#Airdrops #Bitcoin #BrightyPad #AirdropDet #Crypto #Blockchain #BYP",airdropdet this project is very good and i believe that let us support this project so that it runs smoothly and competes in the market airdrops bitcoin brightypad airdropdet crypto blockchain byp,0.5600928664207458,0.43221208453178406,0.007695091422647238
2022-05-24,22:45,"#rinfinancecoin going 1,000,000%#BSC #ETH #BTC #cryptocurrency #BSCGems #altcoin #altcoins #AVAX #Avalanche #Solana #A…",rinfinancecoin going 1000000bsc eth btc cryptocurrency bscgems altcoin altcoins avax avalanche solana a,0.0635494738817215,0.9185965657234192,0.017853982746601105
2022-05-24,22:45,@Hoo_exchange @SpacePi_Com @btchdcommunity @Strongblock_io @OfficialMoonDAO @mirror_protocol #LUFFYCREW #LUFFY $LUFFY #LUFFYV2 #LUFFYTOKEN #SHIB #DOGE #Binance #Coinbase #Metaverse #cryptocurrency #BTC #ETH #nft #NFTs @luffyinutoken @LuffyTurkey #LUFFYCREW #LUFFY $LUFFY #LUFFYV2 #LUFFYTOKEN #SHIB #DOGE #Binance #Coinbase #Metaverse @luffyinutoken @LuffyTurkey #gateio,hooexchange spacepicom btchdcommunity strongblockio officialmoondao mirrorprotocol luffycrew luffy luffy luffyv2 luffytoken shib doge binance coinbase metaverse cryptocurrency btc eth nft nfts luffyinutoken luffyturkey luffycrew luffy luffy luffyv2 luffytoken shib doge binance coinbase metaverse luffyinutoken luffyturkey gateio,0.04320786893367767,0.933373212814331,0.02341892383992672
2022-05-24,22:45,"@natbrunell @elonmusk 🤣🤣🤣🤣 if @elonmusk make tweets to content #Bitcoin of its ad, it will be so memes...",natbrunell elonmusk if elonmusk make tweets to content bitcoin of its ad it will be so memes,0.01641928032040596,0.331035315990448,0.6525454521179199
2022-05-24,22:45,@Hoo_exchange #LUFFYCREW #LUFFY $LUFFY #LUFFYV2 #LUFFYTOKEN #SHIB #DOGE #Binance #Coinbase #Metaverse #cryptocurrency #BTC #ETH #nft #NFTs @luffyinutoken @LuffyTurkey #LUFFYCREW #LUFFY $LUFFY #LUFFYV2 #LUFFYTOKEN #SHIB #DOGE #Binance #Coinbase #Metaverse @luffyinutoken @LuffyTurkey #gateio,hooexchange luffycrew luffy luffy luffyv2 luffytoken shib doge binance coinbase metaverse cryptocurrency btc eth nft nfts luffyinutoken luffyturkey luffycrew luffy luffy luffyv2 luffytoken shib doge binance coinbase metaverse luffyinutoken luffyturkey gateio,0.04101090505719185,0.9383985996246338,0.02059042640030384
2022-05-24,22:45,"The perfect market condition for investment is when the economy is terrible. Investors buy, they don't just save or hold, they invest more. #Bitcoin #stocks #forex",the perfect market condition for investment is when the economy is terrible investors buy they do not just save or hold they invest more bitcoin stocks forex,0.033847492188215256,0.9348123669624329,0.03134018927812576
2022-05-24,22:45,The current price of #BTC is $29555.79 in USD,the current price of btc is 2955579 in usd,0.02702176384627819,0.9481462240219116,0.024832027032971382
2022-05-24,22:45,"If I found #bitcoin 10 years ago,
Price would likely be a million now",if i found bitcoin 10 years ago price would likely be a million now,0.043756190687417984,0.9282568693161011,0.027986962348222733
2022-05-24,22:45,Having charts up during work meetings is dangerous. $XDB trying to flip Resistance to support in the past hour out of nowhere… problems of a part-time normie #crypto #BTC,having charts up during work meetings is dangerous xdb trying to flip resistance to support in the past hour out of nowhere problems of a parttime normie crypto btc,0.03617020696401596,0.20649133622646332,0.7573384642601013
2022-05-24,22:45,@Bybit_Official @Filecoin @LockheedMartin #LUFFYCREW #LUFFY $LUFFY #LUFFYV2 #LUFFYTOKEN #SHIB #DOGE #Binance #Coinbase #Metaverse #cryptocurrency #BTC #ETH #nft #NFTs @luffyinutoken @LuffyTurkey #LUFFYCREW #LUFFY $LUFFY #LUFFYV2 #LUFFYTOKEN #SHIB #DOGE #Binance #Coinbase #Metaverse @luffyinutoken @LuffyTurkey #gateio,bybitofficial filecoin lockheedmartin luffycrew luffy luffy luffyv2 luffytoken shib doge binance coinbase metaverse cryptocurrency btc eth nft nfts luffyinutoken luffyturkey luffycrew luffy luffy luffyv2 luffytoken shib doge binance coinbase metaverse luffyinutoken luffyturkey gateio,0.03712182492017746,0.9408447742462158,0.02203339710831642
2022-05-24,22:45,@Bybit_Official @redbullracing #LUFFYCREW #LUFFY $LUFFY #LUFFYV2 #LUFFYTOKEN #SHIB #DOGE #Binance #Coinbase #Metaverse #cryptocurrency #BTC #ETH #nft #NFTs @luffyinutoken @LuffyTurkey #LUFFYCREW #LUFFY $LUFFY #LUFFYV2 #LUFFYTOKEN #SHIB #DOGE #Binance #Coinbase #Metaverse @luffyinutoken @LuffyTurkey #gateio,bybitofficial redbullracing luffycrew luffy luffy luffyv2 luffytoken shib doge binance coinbase metaverse cryptocurrency btc eth nft nfts luffyinutoken luffyturkey luffycrew luffy luffy luffyv2 luffytoken shib doge binance coinbase metaverse luffyinutoken luffyturkey gateio,0.04991293326020241,0.9314886927604675,0.018598370254039764
2022-05-24,22:45,@AlphaSeeker21 @CryptoMan_Ram @routerprotocol Nice guy and good project. I personally lke Indians in softwares. Very trustful and reliable smart. Though ryt now #bitcoin a bit weak as soon it comes 15k i will surely lke to invest some of my cap in Ram company Router protocol.,alphaseeker21 cryptomanram routerprotocol nice guy and good project i personally lke indians in softwares very trustful and reliable smart though ryt now bitcoin a bit weak as soon it comes 15k i will surely lke to invest some of my cap in ram company router protocol,0.16308924555778503,0.8071655631065369,0.02974514663219452
2022-05-24,22:45,"@danheld ...non-dividend stocks at this stage, ...will take #Bitcoin anytime...",danheld nondividend stocks at this stage will take bitcoin anytime,0.03250560909509659,0.9511821866035461,0.016312219202518463
2022-05-24,22:45,"James @invest_answers is there anything retail investors can do to leverage by investing/involving oneself in the #Bining process😉 #btc
Forgive me if I have missed any of your videos on the topic.
Cheers!",james investanswers is there anything retail investors can do to leverage by investinginvolving oneself in the bining process btc forgive me if i have missed any of your videos on the topic cheers,0.027807749807834625,0.7926580309867859,0.1795342117547989
2022-05-24,22:45,"@Muhamma54786393 @ashwsbreal To not ever reach 60k again, #Bitcoin has to die, otherwise it is impossible to not touch at least $1.000.000. We live in capitalism, that means everything will rise until the planet will put all the bitcoins in our butts and kill us all. It's so simple.",muhamma54786393 ashwsbreal to not ever reach 60k again bitcoin has to die otherwise it is impossible to not touch at least 1000000 we live in capitalism that means everything will rise until the planet will put all the bitcoins in our butts and kill us all it is so simple,0.0209319069981575,0.8339033126831055,0.14516471326351166
2022-05-24,22:45,Current #Bitcoin Price is $29555 #BTC #Crypto,current bitcoin price is 29555 btc crypto,0.022458605468273163,0.9508779048919678,0.026663515716791153
2022-05-24,22:45,@beniaminmincu #LUFFYCREW #LUFFY $LUFFY #LUFFYV2 #LUFFYTOKEN #SHIB #DOGE #Binance #Coinbase #Metaverse #cryptocurrency #BTC #ETH #nft #NFTs @luffyinutoken @LuffyTurkey #LUFFYCREW #LUFFY $LUFFY #LUFFYV2 #LUFFYTOKEN #SHIB #DOGE #Binance #Coinbase #Metaverse @luffyinutoken @LuffyTurkey #gateio,beniaminmincu luffycrew luffy luffy luffyv2 luffytoken shib doge binance coinbase metaverse cryptocurrency btc eth nft nfts luffyinutoken luffyturkey luffycrew luffy luffy luffyv2 luffytoken shib doge binance coinbase metaverse luffyinutoken luffyturkey gateio,0.03880132734775543,0.9385665059089661,0.022632161155343056
2022-05-24,22:45,@TheMoonCarl #LUFFYCREW #LUFFY $LUFFY #LUFFYV2 #LUFFYTOKEN #SHIB #DOGE #Binance #Coinbase #Metaverse #cryptocurrency #BTC #ETH #nft #NFTs @luffyinutoken @LuffyTurkey #LUFFYCREW #LUFFY $LUFFY #LUFFYV2 #LUFFYTOKEN #SHIB #DOGE #Binance #Coinbase #Metaverse @luffyinutoken @LuffyTurkey #gateio,themooncarl luffycrew luffy luffy luffyv2 luffytoken shib doge binance coinbase metaverse cryptocurrency btc eth nft nfts luffyinutoken luffyturkey luffycrew luffy luffy luffyv2 luffytoken shib doge binance coinbase metaverse luffyinutoken luffyturkey gateio,0.04272029176354408,0.9373098015785217,0.01996985264122486
2022-05-24,22:45,@Rebllon #LUFFYCREW #LUFFY $LUFFY #LUFFYV2 #LUFFYTOKEN #SHIB #DOGE #Binance #Coinbase #Metaverse #cryptocurrency #BTC #ETH #nft #NFTs @luffyinutoken @LuffyTurkey #LUFFYCREW #LUFFY $LUFFY #LUFFYV2 #LUFFYTOKEN #SHIB #DOGE #Binance #Coinbase #Metaverse @luffyinutoken @LuffyTurkey #gateio,rebllon luffycrew luffy luffy luffyv2 luffytoken shib doge binance coinbase metaverse cryptocurrency btc eth nft nfts luffyinutoken luffyturkey luffycrew luffy luffy luffyv2 luffytoken shib doge binance coinbase metaverse luffyinutoken luffyturkey gateio,0.04700552672147751,0.9347711205482483,0.018223300576210022
2022-05-24,22:45,"The 21 million #Bitcoin as a whole, could be consider and NFT…there is no other network like it. The population of the world can own satoshis of $BTC",the 21 million bitcoin as a whole could be consider and nftthere is no other network like it the population of the world can own satoshis of btc,0.05419456586241722,0.9333530068397522,0.01245249342173338
2022-05-24,22:45,"@TheRealPlanC The most mature &amp; powerful is DEFINITELY the Cardano community.

The #Bitcoin community is strong af but so toxic it's laughable",therealplanc the most mature powerful is definitely the cardano community the bitcoin community is strong af but so toxic it is laughable,0.140616774559021,0.8412721157073975,0.01811107061803341
2022-05-24,22:45,The capability of #Bitcoin Script to enforce CSV/CLTV time-locks on an output can be defined as introspection?,the capability of bitcoin script to enforce csvcltv timelocks on an output can be defined as introspection,0.022348005324602127,0.9022276997566223,0.07542432099580765
2022-05-24,22:45,@GeckoInsights @coingecko @Zhongychan @NeBB399 #LUFFYCREW #LUFFY $LUFFY #LUFFYV2 #LUFFYTOKEN #SHIB #DOGE #Binance #Coinbase #Metaverse #cryptocurrency #BTC #ETH #nft #NFTs @luffyinutoken @LuffyTurkey #LUFFYCREW #LUFFY $LUFFY #LUFFYV2 #LUFFYTOKEN #SHIB #DOGE #Binance #Coinbase #Metaverse @luffyinutoken @LuffyTurkey #gateio,geckoinsights coingecko zhongychan nebb399 luffycrew luffy luffy luffyv2 luffytoken shib doge binance coinbase metaverse cryptocurrency btc eth nft nfts luffyinutoken luffyturkey luffycrew luffy luffy luffyv2 luffytoken shib doge binance coinbase metaverse luffyinutoken luffyturkey gateio,0.04018698260188103,0.9368026852607727,0.0230103749781847
2022-05-24,22:45,@coingecko @GameStop #LUFFYCREW #LUFFY $LUFFY #LUFFYV2 #LUFFYTOKEN #SHIB #DOGE #Binance #Coinbase #Metaverse #cryptocurrency #BTC #ETH #nft #NFTs @luffyinutoken @LuffyTurkey #LUFFYCREW #LUFFY $LUFFY #LUFFYV2 #LUFFYTOKEN #SHIB #DOGE #Binance #Coinbase #Metaverse @luffyinutoken @LuffyTurkey #gateio,coingecko gamestop luffycrew luffy luffy luffyv2 luffytoken shib doge binance coinbase metaverse cryptocurrency btc eth nft nfts luffyinutoken luffyturkey luffycrew luffy luffy luffyv2 luffytoken shib doge binance coinbase metaverse luffyinutoken luffyturkey gateio,0.03989690542221069,0.9388076663017273,0.021295392885804176
2022-05-24,22:45,@Dennis_Porter_ The million. One dollar in hand is better than two in the bushes. 1 million is 1 million. Where as you'll be hoping that #Bitcoin reaches and exceeds 1 million in a decade. Remember he said hold. I'll hold the million and if bitcoin catches up I'll buy the dip with the million.,dennisporter the million one dollar in hand is better than two in the bushes 1 million is 1 million where as you will be hoping that bitcoin reaches and exceeds 1 million in a decade remember he said hold i will hold the million and if bitcoin catches up i will buy the dip with the million,0.20875923335552216,0.7757028937339783,0.015537806786596775
2022-05-24,22:45,@GeckoInsights @coingecko @LidoFinance #LUFFYCREW #LUFFY $LUFFY #LUFFYV2 #LUFFYTOKEN #SHIB #DOGE #Binance #Coinbase #Metaverse #cryptocurrency #BTC #ETH #nft #NFTs @luffyinutoken @LuffyTurkey #LUFFYCREW #LUFFY $LUFFY #LUFFYV2 #LUFFYTOKEN #SHIB #DOGE #Binance #Coinbase #Metaverse @luffyinutoken @LuffyTurkey #gateio,geckoinsights coingecko lidofinance luffycrew luffy luffy luffyv2 luffytoken shib doge binance coinbase metaverse cryptocurrency btc eth nft nfts luffyinutoken luffyturkey luffycrew luffy luffy luffyv2 luffytoken shib doge binance coinbase metaverse luffyinutoken luffyturkey gateio,0.04255330190062523,0.9372614622116089,0.020185304805636406
2022-05-24,22:45,#bears have caught a cold today #Bitcoin,bears have caught a cold today bitcoin,0.29221343994140625,0.2941266894340515,0.413659930229187
2022-05-24,22:45,Buy #WOLVERINU trillions of coins now or regret tomorrow #cryptocurrency #CryptoNews #Bitcoin #BinanceSmartChain #Binance  #memecoin #Airdrop #cryptocurrencies #Metaverse  #Wolverarmy #Cryptos #Dollar #inflation #ETH #shiba #dogecoin #BabyDogeCoin· #blockchain,buy wolverinu trillions of coins now or regret tomorrow cryptocurrency cryptonews bitcoin binancesmartchain binance memecoin airdrop cryptocurrencies metaverse wolverarmy cryptos dollar inflation eth shiba dogecoin babydogecoin blockchain,0.037978749722242355,0.9344280362129211,0.027593256905674934
2022-05-24,22:45,"@SGBarbour The #Bitcoin market is down, dips keeps dipping. But without a doubt bitcoin will bounce back up, a new ATH is possible by year end.

I suggest you follow @Fentinq.  His ideas and insights has mutually assured preservations and will blow your mind.",sgbarbour the bitcoin market is down dips keeps dipping but without a doubt bitcoin will bounce back up a new ath is possible by year end i suggest you follow fentinq his ideas and insights has mutually assured preservations and will blow your mind,0.4991967976093292,0.4092736542224884,0.09152954071760178
2022-05-24,22:45,@GeckoInsights @alfalfawm @coingecko @ShaunPaulLee #LUFFYCREW #LUFFY $LUFFY #LUFFYV2 #LUFFYTOKEN #SHIB #DOGE #Binance #Coinbase #Metaverse #cryptocurrency #BTC #ETH #nft #NFTs @luffyinutoken @LuffyTurkey #LUFFYCREW #LUFFY $LUFFY #LUFFYV2 #LUFFYTOKEN #SHIB #DOGE #Binance #Coinbase #Metaverse @luffyinutoken @LuffyTurkey #gateio,geckoinsights alfalfawm coingecko shaunpaullee luffycrew luffy luffy luffyv2 luffytoken shib doge binance coinbase metaverse cryptocurrency btc eth nft nfts luffyinutoken luffyturkey luffycrew luffy luffy luffyv2 luffytoken shib doge binance coinbase metaverse luffyinutoken luffyturkey gateio,0.04100121930241585,0.9360499382019043,0.022948801517486572
2022-05-24,22:45,@ninaturner @KarenKilgariff Bad money = bad incentives #bitcoin,ninaturner karenkilgariff bad money bad incentives bitcoin,0.03018295392394066,0.60638827085495,0.3634287416934967
2022-05-24,22:45,@coingecko @GeckoInsights #LUFFYCREW #LUFFY $LUFFY #LUFFYV2 #LUFFYTOKEN #SHIB #DOGE #Binance #Coinbase #Metaverse #cryptocurrency #BTC #ETH #nft #NFTs @luffyinutoken @LuffyTurkey #LUFFYCREW #LUFFY $LUFFY #LUFFYV2 #LUFFYTOKEN #SHIB #DOGE #Binance #Coinbase #Metaverse @luffyinutoken @LuffyTurkey #gateio,coingecko geckoinsights luffycrew luffy luffy luffyv2 luffytoken shib doge binance coinbase metaverse cryptocurrency btc eth nft nfts luffyinutoken luffyturkey luffycrew luffy luffy luffyv2 luffytoken shib doge binance coinbase metaverse luffyinutoken luffyturkey gateio,0.03609752655029297,0.9416037201881409,0.022298814728856087
2022-05-24,22:45,@coingecko #LUFFYCREW #LUFFY $LUFFY #LUFFYV2 #LUFFYTOKEN #SHIB #DOGE #Binance #Coinbase #Metaverse #cryptocurrency #BTC #ETH #nft #NFTs @luffyinutoken @LuffyTurkey #LUFFYCREW #LUFFY $LUFFY #LUFFYV2 #LUFFYTOKEN #SHIB #DOGE #Binance #Coinbase #Metaverse @luffyinutoken @LuffyTurkey #gateio,coingecko luffycrew luffy luffy luffyv2 luffytoken shib doge binance coinbase metaverse cryptocurrency btc eth nft nfts luffyinutoken luffyturkey luffycrew luffy luffy luffyv2 luffytoken shib doge binance coinbase metaverse luffyinutoken luffyturkey gateio,0.04320044815540314,0.9373942613601685,0.01940525323152542
2022-05-24,22:45,Investing in @Algorand in 2022 is like investing in @Apple in the 80s. #Bitcoin,investing in algorand in 2022 is like investing in apple in the 80s bitcoin,0.0539654865860939,0.9336381554603577,0.012396387755870819
2022-05-24,22:45,@rogerkver Why not just fix #btc instead of making infinite forks,rogerkver why not just fix btc instead of making infinite forks,0.039015453308820724,0.9252167344093323,0.03576786071062088
2022-05-24,22:45,"@A_R_ANDANI @AnnanPerry @AnatuBogobiri @BruceJojo They are LIARS, we gonna stop them before twenty years with TRUTH and FREEDOM Money, #Bitcoin",arandani annanperry anatubogobiri brucejojo they are liars we gonna stop them before twenty years with truth and freedom money bitcoin,0.06578786671161652,0.8173360824584961,0.116876021027565
2022-05-24,22:45,"@UndeadBlocks Now this is badasss 🤩🤩🤩⚔️⚔️⚔️ I can't wait.

We'll play it in our @afriverse_guild. Come join us to make money playing @UndeadBlocks and other cool #P2E games

#Giveaway #community #NFTGiveaway #Bitcoin 

Follow @afriverse_guild and join us on #Discord",undeadblocks now this is badasss i cannot wait we will play it in our afriverseguild come join us to make money playing undeadblocks and other cool p2e games giveaway community nftgiveaway bitcoin follow afriverseguild and join us on discord,0.06592024862766266,0.916336715221405,0.01774301938712597
