Date,Time,Original tweet,Clean tweet,Positive,Neutral,Negative
2022-04-26,17:45,"@Bybit_Official @Meta Ever been able to figure out the lowest possible price for a currency? In Smart Defi, we have a backup pool for every currency that builds its price floor. The price does not fall below a certain number. #feg #fegtoken #SmartDefi #FegArmy #fegex #eth #crypto #btc #fegtoken2012",bybitofficial meta ever been able to figure out the lowest possible price for a currency in smart defi we have a backup pool for every currency that builds its price floor the price does not fall below a certain number feg fegtoken smartdefi fegarmy fegex eth crypto btc fegtoken2012,0.042962417006492615,0.9299538731575012,0.027083681896328926
2022-04-26,17:45,"Discussion: #BTC Short term downside for this week and next week.
1. Has the 50 pip rate hike from the May rate hike meeting been priced in by the market?
2. will this week's earnings reports from tech giants boost prices back up?
3. the ECB's talk about deFi, is it good or bad?",btc short term downside for this week and next week 1 has the 50 pip rate hike from the may rate hike meeting been priced in by the market 2 will this week earnings reports from tech giants boost prices back up 3 the ecb talk about defi is it good or bad,0.881416380405426,0.0700610801577568,0.0485224649310112
2022-04-26,17:45,"@Ralvero Our projects are P2E game, +10 to be listed on the stock market in the year,bsc bridge,and many more!!
#LUFFY #LuffyV2 #Luffytoken #LUFFYCREW #CryptoCurrency  #NFT #P2E #ETH #BTC  @luffyinutoken https://t.co/ebyFMUZrPw",ralvero our projects are p2e game 10 to be listed on the stock market in the yearbsc bridgeand many more luffy luffyv2 luffytoken luffycrew cryptocurrency nft p2e eth btc luffyinutoken,0.05633194372057915,0.932171106338501,0.01149686984717846
2022-04-26,17:45,JUST IN: 🇦🇷 Buenos Aires has announced plans to allow citizens to pay taxes with #Bitcoin and #cryptocurrency.,just buenos aires has announced plans to allow citizens to pay taxes with bitcoin and cryptocurrency,0.6258116960525513,0.36279454827308655,0.011393747292459011
2022-04-26,17:45,JUST IN: Mexican senator Indira Kempis has put the first #Bitcoin ATM in the Mexican Senate 🇲🇽 https://t.co/Gh8vv3jUcB,just mexican senator indira kempis has put the first bitcoin atm in the mexican senate,0.08681266754865646,0.8993587493896484,0.013828535564243793
2022-04-26,17:45,"Bear trap, bull tap, bear trap, bull trap

#Bitcoin",bear trap bull tap bear trap bull trap bitcoin,0.025331104174256325,0.8931212425231934,0.08154766261577606
2022-04-26,17:45,"Apart from Bitcoin, what are your choice Altcoins?

Wouldn't mind your suggestion on gems too

#bitcoin #altcoins #gems",apart from bitcoin what are your choice altcoins would not mind your suggestion on gems too bitcoin altcoins gems,0.0335499607026577,0.9438429474830627,0.022607069462537766
2022-04-26,17:45,"Disappear a few days after recruiting members publicly 
Swap certain cryptocurrencies in 1:1.2 ratio.
Ex, Giving $100 worth of #btc , Immediately exchanging it for $110-120 worth of #doge
telegram: @exc00
Grab an opportunity.
#BTC #XRP #ETH  #DOGE#EOS #ADA #LUNA #SOL #LAC",disappear a few days after recruiting members publicly swap certain cryptocurrencies in ratio ex giving 100 worth of btc immediately exchanging it for 110120 worth of doge exc00 grab an opportunity btc xrp eth dogeeos ada luna sol lac,0.07646571099758148,0.8987638354301453,0.0247704666107893
2022-04-26,17:45,"Another trend to watch: Texas is not only ""leading the way"" in #bitcoin adoption. It's carving a completely new path. In fact, I would argue it's de-facto separating itself from the rest of the US via slowly adopting a new monetary standard. Thoughts on this @nic__carter ?",another trend to texas is not only leading the way in bitcoin adoption it is carving a completely new path in fact i would argue it is defacto separating itself from the rest of the us via slowly adopting a new monetary standard thoughts on this niccarter,0.20390214025974274,0.7817710041999817,0.014326775446534157
2022-04-26,17:45,Powering decentralized sharing networks. Good luck to everyone involved in the development of the project...#aliceincrypto #NFT #aliceNFT #Airdrop #bountycampaign #bitcoin #defi #Crypto #BSCGem #BSCGemsAlert #web3,powering decentralized sharing networks good luck to everyone involved in the development of the projectaliceincrypto nft alicenft airdrop bountycampaign bitcoin defi crypto bscgem bscgemsalert web3,0.5730488896369934,0.41645732522010803,0.01049386989325285
2022-04-26,17:45,#bitcoin holding strong at $38k 🍦,bitcoin holding strong at 38k,0.8879114985466003,0.08802716434001923,0.024061284959316254
2022-04-26,17:45,"@WatcherGuru @IndiraKempis Similar to what @tedcruz proposed. I believe he wants vending machines in the Senate to accept #Bitcoin to get Senators more familiar with Bitcoin. Unfortunately, I don't believe that's happened, yet. Good job 🍊 💊 Mexican politicians way to go @IndiraKempis",watcherguru indirakempis similar to what tedcruz proposed i believe he wants vending machines in the senate to accept bitcoin to get senators more familiar with bitcoin unfortunately i do not believe that is happened yet good job mexican politicians way to go indirakempis,0.20094865560531616,0.7872686386108398,0.011782660149037838
2022-04-26,17:45,@MartiniGuyYT Nope....as long as #Bitcoin is basically only a traders coin its value will be linked to stocks,martiniguyyt nopeas long as bitcoin is basically only a traders coin its value will be linked to stocks,0.0467810332775116,0.9328785538673401,0.020340440794825554
2022-04-26,17:45,"@SeasonalTokens
#SeasonalTokens #cryptoMining #Cyclicallnvesting #BTC
This is very interesting project with big goals ahead project looks promising and there is a professional team working on ot. i believe this project has a bright future",seasonaltokens seasonaltokens cryptomining cyclicallnvesting btc this is very interesting project with big goals ahead project looks promising and there is a professional team working on ot i believe this project has a bright future,0.8920401334762573,0.09873084723949432,0.009228943847119808
2022-04-26,17:45,"If you're new to crypto, the majority of your investment should be in #Bitcoin &amp; #Ethereum. 

BUT, if you're experienced in crypto and want to make 10x, 20x, or even 100x, you should be trading alts.

But you can't just HODL random shit coins.

🧵Want to 100x? Read below🧵
👇👇",if you are new to crypto the majority of your investment should be in bitcoin ethereum but if you are experienced in crypto and want to make 10x 20x or even 100x you should be trading alts but you cannot just hodl random shit coins want to 100x read below,0.03428041562438011,0.9432074427604675,0.02251208946108818
2022-04-26,17:45,The bitcoin marketcap has reached 16.4 twitters. #Bitcoin,the bitcoin marketcap has reached 164 twitters bitcoin,0.32595354318618774,0.6490569710731506,0.0249894168227911
2022-04-26,17:45,"@Polkadot is one of the most unique blockchains. 

It wins through hard-working parachain builders.

 #bitcoin  $BTC #ethereum $ETH $DOT #kusama $KSM @kusamanetwork $ZTG @ZeitgeistPM",polkadot is one of the most unique blockchains it wins through hardworking parachain builders bitcoin btc ethereum eth dot kusama ksm kusamanetwork ztg zeitgeistpm,0.2771775424480438,0.7150145769119263,0.00780788017436862
2022-04-26,17:45,make #cryptocurrency #litecoin #bitcoin with @jobboycom,make cryptocurrency litecoin bitcoin with jobboycom,0.06274063885211945,0.9231441617012024,0.014115196652710438
2022-04-26,17:45,"Long term I couldn't care less whether Metabook made or lost money last quarter. If it spooks equities and #BTC lower in the short term, that'd serve my DCAing dipbuying spree just fine.",long term i could not care less whether metabook made or lost money last quarter if it spooks equities and btc lower in the short term that would serve my dcaing dipbuying spree just fine,0.0675702840089798,0.6753243803977966,0.25710538029670715
2022-04-26,17:45,#Bitcoin TeaTime ...,bitcoin teatime,0.04324698448181152,0.9202604293823242,0.03649260103702545
2022-04-26,17:45,"@CryptoThro The dip keeps dipping and #Bitcoin is touching 38k right now... 📉😬so, almost any buy would make money on the medium term! 📈🤑

This said I prefer to play the long game and join the #NFT revolution with the next level technology that @Unique_NFTchain is bringuing to the space!",cryptothro the dip keeps dipping and bitcoin is touching 38k right now so almost any buy would make money on the medium term this said i prefer to play the long game and join the nft revolution with the next level technology that uniquenftchain is bringuing to the space,0.07826563715934753,0.9051759839057922,0.016558334231376648
2022-04-26,17:45,When will the crypto and equities stop being so closely correlated? Let me know your thoughts! #Crypto #Bitcoin #StockMarket,when will the crypto and equities stop being so closely correlated let me know your thoughts crypto bitcoin stockmarket,0.026194347068667412,0.9369273781776428,0.03687822073698044
2022-04-26,17:45,"@Selcoin #DKSGAMES  is not just a game studio. It contains more than one game, including its own game. It has partnerships with #ENJ and #BLOK. The coin, which also has an agreement on #Mobipad, is in MEXC and pancakes. 

#Ape #gmtマスター2 #Bitcoin  $DKS #Dks @DarkshieldG",selcoin dksgames is not just a game studio it contains more than one game including its own game it has partnerships with enj and blok the coin which also has an agreement on mobipad is in mexc and pancakes ape gmtマスター2 bitcoin dks dks darkshieldg,0.04837715998291969,0.9401110410690308,0.011511837132275105
2022-04-26,17:45,@Seasonal_Tokens This will certainly be a successful project as it has a great team that is more than qualified and focused on making this project a success.#Seasonal #Tokens #CryptoMining #Cyclicallnvesting #BTC,seasonaltokens this will certainly be a successful project as it has a great team that is more than qualified and focused on making this project a successseasonal tokens cryptomining cyclicallnvesting btc,0.8423587083816528,0.15012763440608978,0.007513673510402441
2022-04-26,17:45,The stock market is in a free fall but people still say they won't invest in #Bitcoin because it is too volatile 🤔,the stock market is in a free fall but people still say they will not invest in bitcoin because it is too volatile,0.028937963768839836,0.3183066248893738,0.6527553796768188
2022-04-26,17:45,"@Seasonal_Tokens @SeasonalTokens
#SeasonalTokens #cryptoMining #Cyclicallnvesting #BTC
This is very interesting project with big goals ahead project looks promising and there is a professional team working on ot. i believe this project has a bright future",seasonaltokens seasonaltokens seasonaltokens cryptomining cyclicallnvesting btc this is very interesting project with big goals ahead project looks promising and there is a professional team working on ot i believe this project has a bright future,0.892999529838562,0.09796673059463501,0.009033759124577045
2022-04-26,17:45,"@Bybit_Official @redbullracing USCT is the first stable coin based on $ 0.01
Smart
No oscillation
Ocean Blockchain Liquidity
Find the best liquidity and make the cheapest purchases all in the FEG ecosystem
#feg #fegtoken #SmartDefi #bnb #FegArmy #fegex #eth #crypto #btc #fegtoken2012",bybitofficial redbullracing usct is the first stable coin based on 001 smart no oscillation ocean blockchain liquidity find the best liquidity and make the cheapest purchases all in the feg ecosystem feg fegtoken smartdefi bnb fegarmy fegex eth crypto btc fegtoken2012,0.6040138006210327,0.3885100781917572,0.007476017810404301
2022-04-26,17:45,"🔴 Sell $FIRO [Spot Hourly]
#FIROUSDT
Average Cost: $3.147
Sell Price: $3.181
Filled: 7.9441 #FIRO / 25.27 #USDT
PNL: $0.27 / 1.08%

#Firo #Binance #Bitcoin #Metaverse #NFT #Web3 #Altcoins",sell firo spot hourly firousdt average 3147 sell 3181 79441 firo 2527 usdt 027 108 firo binance bitcoin metaverse nft web3 altcoins,0.0511801540851593,0.9176214337348938,0.03119835816323757
2022-04-26,17:45,"@BTC_Archive 🤣 what thaf! , pull rug will happen.
M-Chart is engulfing it.
From mass psychosis of greed to mass psychosis of fear from #BTC
Multi efforts now to save from massive major crypto market shorting. Years of long, now easy month to deep short. 3 days to go.",btcarchive what thaf pull rug will happen mchart is engulfing it from mass psychosis of greed to mass psychosis of fear from btc multi efforts now to save from massive major crypto market shorting years of long now easy month to deep short 3 days to go,0.05335652455687523,0.8656212091445923,0.0810222253203392
2022-04-26,17:45,"Eventually, every nation state will be mining #bitcoin. It’s inevitable.",eventually every nation state will be mining bitcoin its inevitable,0.1063244566321373,0.8805604577064514,0.013115107081830502
2022-04-26,17:45,"@Bitcoinsensus In no particular order; #Bitcoin, #ETH, #Syscoin, #Doge and #Cardano",bitcoinsensus in no particular order bitcoin eth syscoin doge and cardano,0.02645132876932621,0.9529087543487549,0.020639915019273758
2022-04-26,17:45,"@Bybit_Official @redbullracing The world's largest ecosystem is here The big FEG ecosystem If you can hack our new wallet called GRAFENE WALLET, the first 2FA technology anti-hack wallet in blockchain will not be hacked if you have 12 words.
#feg #fegtoken #SmartDefi #bnb #FegArmy #fegex #crypto #btc #eth",bybitofficial redbullracing the world largest ecosystem is here the big feg ecosystem if you can hack our new wallet called grafene wallet the first 2fa technology antihack wallet in blockchain will not be hacked if you have 12 words feg fegtoken smartdefi bnb fegarmy fegex crypto btc eth,0.08702675998210907,0.9010435342788696,0.01192968338727951
2022-04-26,17:45,@APompliano @saylor For sure! After #SatoshiNakamoto I can’t think of anybody else that’s more the face of #Bitcoin as Mr. @saylor is. 🙌🙌🧡🍊💊,apompliano saylor for sure after satoshinakamoto i can not think of anybody else thats more the face of bitcoin as mr saylor is,0.032072898000478745,0.9273678660392761,0.04055919125676155
2022-04-26,17:45,"If you support @elonmusk buying #Twitter I want to follow you!
#ElrondNetwork #Bitcoin #ETH 
#Egld",if you support elonmusk buying twitter i want to follow you elrondnetwork bitcoin eth egld,0.07895416021347046,0.9093354940414429,0.011710378341376781
2022-04-26,17:45,"🔻🔻🔻 $769,050 BTCUSDT SHORTED @$38,452.50 on #Bybit (17:43:28 UTC) #BTC #cryptocurrency",769050 btcusdt shorted 3845250 on bybit utc btc cryptocurrency,0.043066784739494324,0.9290270805358887,0.027906136587262154
2022-04-26,17:45,"@Bybit_Official @redbullracing It's amazing you can convert all your currencies into Wrapp in FEG ecosystem and even earn money in your sleep
 #feg #fegtoken #SmartDefi #bnb #FegArmy #fegex #eth #crypto #btc #fegtoken2012",bybitofficial redbullracing it is amazing you can convert all your currencies into wrapp in feg ecosystem and even earn money in your sleep feg fegtoken smartdefi bnb fegarmy fegex eth crypto btc fegtoken2012,0.17173565924167633,0.8172560930252075,0.011008284986019135
2022-04-26,17:45,"#btc prices can go down as much as it wants. It happened too many times and most of us are numb to the whale games.

♾️ printing &amp; debt versus hard money. I'd rather hodl them tokens!",btc prices can go down as much as it wants it happened too many times and most of us are numb to the whale games printing debt versus hard money i would rather hodl them tokens,0.019270706921815872,0.23964563012123108,0.7410836815834045
2022-04-26,17:45,@elonmusk its time to send me that verification blue check #thadigitalera #digitalera #bitcoin #btc #twitter,elonmusk its time to send me that verification blue check thadigitalera digitalera bitcoin btc twitter,0.08545792102813721,0.9037380814552307,0.010804028250277042
2022-04-26,17:45,BREAKING: The first #Bitcoin ATM in Mexico 🇲🇽 has been installed inside the Senate building 🏢,the first bitcoin atm in mexico has been installed inside the senate building,0.2065049707889557,0.7855731844902039,0.007921842858195305
2022-04-26,17:45,#btc yearly return rate currently is 170% so if your more experienced I’d consider it an option but then again all you have to do is download a damn app and add your card dassit,btc yearly return rate currently is 170 so if your more experienced id consider it an option but then again all you have to do is download a damn app and add your card dassit,0.03300495818257332,0.9368507862091064,0.030144229531288147
2022-04-26,17:45,For the love of Jesus STOP SETTING LONGS ON $BTC!!!! Good grief!!! You’re killing us here! #Bitcoin,for the love of jesus stop setting longs on btc good grief youre killing us here bitcoin,0.0313829705119133,0.3444281816482544,0.6241888999938965
2022-04-26,17:45,"#Bitcoin 
 Price Now: $38287
 Market Cap: $728327371716.125 #BTC",bitcoin price 38287 market 728327371716125 btc,0.02824377827346325,0.925650954246521,0.04610525071620941
2022-04-26,17:45,"Right now bookie is buying and retail investors are starting to sell
#BTC #altcoin #Altcoins #Crypto #cryptocurrecy #CryptoNews",right now bookie is buying and retail investors are starting to sell btc altcoin altcoins crypto cryptocurrecy cryptonews,0.08074703812599182,0.9019143581390381,0.01733863726258278
2022-04-26,17:45,Create automated tasks with @jobboycom API Deposit withdraw with #crypto #bitcoin,create automated tasks with jobboycom api deposit withdraw with crypto bitcoin,0.04047772288322449,0.9392165541648865,0.020305754616856575
2022-04-26,17:45,"I think @elonmusk will use @twitter for delivery his message regarding stock like #Bitcoin ,#Ethereum as before that he was need to take permission for his tweet. So,by this maximum people can earn money from #stock.
What is your thought?
#ElonMuskBuyTwitter #ElonMusk #Elon",i think elonmusk will use twitter for delivery his message regarding stock like bitcoin ethereum as before that he was need to take permission for his tweet soby this maximum people can earn money from stock what is your thought elonmuskbuytwitter elonmusk elon,0.04033699259161949,0.9385669231414795,0.021096086129546165
2022-04-26,17:45,"#BTC is $200 UP📈 since the last alert.

Current #Bitcoin price: $38,400

04/26 17:42 UTC",btc is 200 up since the last alert current bitcoin 38400 0426 utc,0.9045237898826599,0.06149156764149666,0.03398466855287552
2022-04-26,17:45,"@Bybit_Official @redbullracing Ever been able to figure out the lowest possible price for a currency? In Smart Defi, we have a backup pool for every currency that builds its price floor. The price does not fall below a certain number. #feg #fegtoken #SmartDefi #FegArmy #fegex #eth #crypto #btc #fegtoken2012",bybitofficial redbullracing ever been able to figure out the lowest possible price for a currency in smart defi we have a backup pool for every currency that builds its price floor the price does not fall below a certain number feg fegtoken smartdefi fegarmy fegex eth crypto btc fegtoken2012,0.06525292992591858,0.9152454733848572,0.01950165629386902
2022-04-26,17:45,@zerohedge Should mine some #Bitcoin to fund this….. oh wait 🥴,zerohedge should mine some bitcoin to fund this oh wait,0.23677894473075867,0.7539123892784119,0.009308665059506893
2022-04-26,17:45,Current #Bitcoin Price is $38315 #BTC #Crypto,current bitcoin price is 38315 btc crypto,0.02028522454202175,0.948564887046814,0.03114989399909973
2022-04-26,17:45,create twitter tasks and pay with #bitcoin #ethereum or #litecoin with @jobboycom,create twitter tasks and pay with bitcoin ethereum or litecoin with jobboycom,0.02573881857097149,0.9398004412651062,0.03446068987250328
2022-04-26,17:45,The @CityofFortWorth announced that they are mining bitcoin with machines donated by the Texas Blockchain Council @txblockchain1 - Fort Worth is the first city in the U.S. to mine #BTC  directly. @tedcruz,the cityoffortworth announced that they are mining bitcoin with machines donated by the texas blockchain council txblockchain1 fort worth is the first city in the us to mine btc directly tedcruz,0.22084364295005798,0.7710553407669067,0.008101033978164196
2022-04-26,17:45,@imchrischuks #Bitcoin  @ ~$38.3k right now. lol. nice call.,imchrischuks bitcoin 383k right now lol nice call,0.06821306049823761,0.9140434265136719,0.01774352602660656
2022-04-26,17:45,"if the bears want to do this, they need to close a fat body close under 37.5 then we should see a full send if will not be shocked if it retraces the entire pump and makes new lows - Mattb

#bitcoin",if the bears want to do this they need to close a fat body close under 375 then we should see a full send if will not be shocked if it retraces the entire pump and makes new lows mattb bitcoin,0.22171138226985931,0.7610127925872803,0.0172758549451828
2022-04-26,17:45,"Elon Musk buy Twitter 
I am buying #Bitcoin and #Doge",elon musk buy twitter i am buying bitcoin and doge,0.0719829574227333,0.9138193726539612,0.01419764943420887
2022-04-26,17:45,"Someone just fixed the #Bitcoin chart. Looks quite upside down, and price prediction quite correct",someone just fixed the bitcoin chart looks quite upside down and price prediction quite correct,0.11416520178318024,0.6491814255714417,0.23665335774421692
2022-04-26,17:45,"Good morning friends !

So who bought #Bitcoin dip then got REKT ?",good morning friends so who bought bitcoin dip then got rekt,0.10196638107299805,0.8772082328796387,0.020825399085879326
2022-04-26,17:45,"#Litecoin/#Bitcoin pair still looks good to me.

Still think we're close to the breakout from this frustrating 2 year wedge.",litecoinbitcoin pair still looks good to me still think we are close to the breakout from this frustrating 2 year wedge,0.9298991560935974,0.04967862740159035,0.020422304049134254
2022-04-26,17:45,"@the_tuolomee @Dennis_Porter_ It’s not been selling any #BTC, but it has been selling #ETH to cover its operational and capital growth.",thetuolomee dennisporter its not been selling any btc but it has been selling eth to cover its operational and capital growth,0.04456188902258873,0.9375807642936707,0.01785735972225666
2022-04-26,17:45,@BitcoinMagazine @IndiraKempis @senadomexicano Cinco de mayo is coming #Bitcoin ....get it started 🚀,bitcoinmagazine indirakempis senadomexicano cinco de mayo is coming bitcoin get it started,0.1337863653898239,0.852136492729187,0.014077137224376202
2022-04-26,17:45,Fidelity offering #bitcoin in 401ks 🙌🙌,fidelity offering bitcoin in 401ks,0.055990416556596756,0.9320496320724487,0.011959926225244999
2022-04-26,17:45,Austin then Munich sup 🦠 🇩🇪🦠🗽🇮🇱 loop around #Bitcoin and @creditkarma 😆,austin then munich sup loop around bitcoin and creditkarma,0.04363713413476944,0.9378024339675903,0.018560396507382393
2022-04-26,17:45,"There are at least 3 adverse events affecting the US right now:

1) Dollar Devaluation
2) Destruction of Food Processing
3) Border Collapse

and you're not:
Buying, mining, or earning #Bitcoin?
Sorry,
NGMI",there are at least 3 adverse events affecting the us right 1 dollar devaluation 2 destruction of food processing 3 border collapse and you are buying mining or earning bitcoin sorry ngmi,0.02346903830766678,0.3432435691356659,0.6332873702049255
2022-04-26,17:45,"$COIN down over 4% below $129, $RIOT $MARA $MSTR all down over 7% as crypto related names sink with #Bitcoin down -4.6% to $38,300",coin down over 4 below 129 riot mara mstr all down over 7 as crypto related names sink with bitcoin down 46 to 38300,0.01858832687139511,0.034551940858364105,0.9468598365783691
2022-04-26,17:45,@Marketsbylili @aantonop Introduction to #Bitcoin,marketsbylili aantonop introduction to bitcoin,0.04794944077730179,0.9226094484329224,0.02944103255867958
2022-04-26,17:45,"@BTC_NFT #BTC is really going to be too much profitable keep investing in it everyone this time is good for investment it's low now just go and grab it and #HOLD and no doubt you will definately get some serious profit 🔥🚀🔥
#BTC #Bitcoin #investing",btcnft btc is really going to be too much profitable keep investing in it everyone this time is good for investment it is low now just go and grab it and hold and no doubt you will definately get some serious profit btc bitcoin investing,0.05709318444132805,0.9156472682952881,0.027259521186351776
2022-04-26,17:45,"Revenue Coin (RVC) holders fund high-tech companies to scale. Startups receiving funding allocate up to 10% of revenues to the systematic purchase of RVC from the market, reducing supply and increasing value.#revenue #revenuecoin #bnb #bitcoin",revenue coin rvc holders fund hightech companies to scale startups receiving funding allocate up to 10 of revenues to the systematic purchase of rvc from the market reducing supply and increasing valuerevenue revenuecoin bnb bitcoin,0.7119346261024475,0.27959877252578735,0.008466656319797039
2022-04-26,17:45,@ngNGDarryl Feels better. I don’t want give out my #Bitcoin tho lol or donate with #dogecoin,ngngdarryl feels better i don not want give out my bitcoin tho lol or donate with dogecoin,0.06553484499454498,0.9025887250900269,0.03187646344304085
2022-04-26,17:45,"Hold the line 🔥🔥🔥 

#crypto #charts #btc #crofam",hold the line crypto charts btc crofam,0.052774012088775635,0.9253954291343689,0.021830549463629723
2022-04-26,17:45,@jerryxfeng Hell you should interview me #Bitcoin please 😂,jerryxfeng hell you should interview me bitcoin please,0.05047058314085007,0.9244541525840759,0.025075212121009827
2022-04-26,17:45,@MartiniGuyYT Im not sure #bitcoin bounce back...still bearish😩😩😩😩,martiniguyyt im not sure bitcoin bounce backstill bearish,0.19224026799201965,0.6643991470336914,0.14336061477661133
