Date,Time,Original tweet,Clean tweet,Positive,Neutral,Negative
2022-05-26,20:15,@BscPitbull_TR @HuobiGlobal @HuobiTurkiye invest in #pitbulltoken your long term profit will surely pay off #pitbulltoken #pitbulltoken #bscpitbull #DeFi #pitbullcoin #Pit #PitMag #hodl #Metaverse #P2E #NFT #Bsc @BscPitbull $PIT #Bitcoin #btc,bscpitbulltr huobiglobal huobiturkiye invest in pitbulltoken your long term profit will surely pay off pitbulltoken pitbulltoken bscpitbull defi pitbullcoin pit pitmag hodl metaverse p2e nft bsc bscpitbull pit bitcoin btc,0.1762811541557312,0.8000076413154602,0.023711174726486206
2022-05-26,20:15,"@PeterMcCormack Why are you making this connection? Obviously #Bitcoin has nothing to do with guns.

On the other hand guns have rather a lot to do with the constitution. These kind of specious comments are just meddling in the affairs of a country you don't seem to understand.",petermccormack why are you making this connection obviously bitcoin has nothing to do with guns on the other hand guns have rather a lot to do with the constitution these kind of specious comments are just meddling in the affairs of a country you do not seem to understand,0.02806018479168415,0.5882189273834229,0.38372084498405457
2022-05-26,20:15,"@BscPitbull_TR @HuobiGlobal @HuobiTurkiye Currently, I am buying and HODLing #pitbulltoken before they hit the moon! #pitbulltoken #bscpitbull #DeFi #pitbullcoin #Pit #PitMag #hodl #Metaverse #P2E #NFT #Bsc @BscPitbull $PIT #Bitcoin #btc",bscpitbulltr huobiglobal huobiturkiye currently i am buying and hodling pitbulltoken before they hit the moon pitbulltoken bscpitbull defi pitbullcoin pit pitmag hodl metaverse p2e nft bsc bscpitbull pit bitcoin btc,0.04298330843448639,0.9339854717254639,0.023031290620565414
2022-05-26,20:15,"#GMT is next ponzi scheme 
A lot of coins will be not exist in another bull run 🤟 #Bitcoin",gmt is next ponzi scheme a lot of coins will be not exist in another bull run bitcoin,0.022474853321909904,0.732717752456665,0.24480736255645752
2022-05-26,20:15,"Litecoin is also incredibly cheaper to use, usually less than 10 cents (which makes it ideal for daily transactions).

Litecoin is available in major exchanges.

This is #NFA.

Disclosure: as of the time of writing, neither @koinsandkash  nor I hodl any #ltc but #btc.",litecoin is also incredibly cheaper to use usually less than 10 cents which makes it ideal for daily transactions litecoin is available in major exchanges this is nfa as of the time of writing neither koinsandkash nor i hodl any ltc but btc,0.04663590341806412,0.939704954624176,0.01365909818559885
2022-05-26,20:15,"@NorthmanTrader Are negative prices possible for #Bitcoin in that context?

I'm asking for a friend...",northmantrader are negative prices possible for bitcoin in that context i am asking for a friend,0.05652696266770363,0.6343128085136414,0.3091602623462677
2022-05-26,20:15,@BscPitbull_TR @HuobiGlobal @HuobiTurkiye Investing in #Altcoins can be among the best decision someone can make now to be among future millionaires! #pitbulltoken #bscpitbull #DeFi #pitbullcoin #Pit #PitMag #hodl #Metaverse #P2E #NFT #Bsc @BscPitbull $PIT #Bitcoin #btc,bscpitbulltr huobiglobal huobiturkiye investing in altcoins can be among the best decision someone can make now to be among future millionaires pitbulltoken bscpitbull defi pitbullcoin pit pitmag hodl metaverse p2e nft bsc bscpitbull pit bitcoin btc,0.13504505157470703,0.8554593920707703,0.009495613165199757
2022-05-26,20:15,Current #Bitcoin Price is $29338 #BTC #Crypto,current bitcoin price is 29338 btc crypto,0.020903412252664566,0.9514760971069336,0.027620485052466393
2022-05-26,20:15,"In relation to my name, I must say I invest properly, well timed and super amounts.
#cryptocurrency #Doge #Solana #BTC #crypto",in relation to my name i must say i invest properly well timed and super amounts cryptocurrency doge solana btc crypto,0.1588038206100464,0.8312132358551025,0.009982994757592678
2022-05-26,20:15,"#Bitcoin protects you against totalitarianism. You can flee the country, get to the other side and be self sufficient. That’s if you haven’t been killed in the process.
Look up what happened to the Portuguese in Mozambique.  
Same with the whites in Zimbabwe.",bitcoin protects you against totalitarianism you can flee the country get to the other side and be self sufficient thats if you haven not been killed in the process look up what happened to the portuguese in mozambique same with the whites in zimbabwe,0.037628307938575745,0.8960644006729126,0.06630732864141464
2022-05-26,20:15,"It's time to go back to the moon, #Bitcoin.",it is time to go back to the moon bitcoin,0.09034820646047592,0.879543662071228,0.03010818548500538
2022-05-26,20:15,🔴 #BTC Liquidated Long: $120K at $29300.00,btc liquidated 120k at 2930000,0.028755562379956245,0.5965560078620911,0.37468841671943665
2022-05-26,20:15,@schizosmile @terra_money Either way you’re taking part in a Ponzi scheme. Quit putting energy into this non sense and just put your savings into #Bitcoin,schizosmile terramoney either way youre taking part in a ponzi scheme quit putting energy into this non sense and just put your savings into bitcoin,0.028480933979153633,0.9216833710670471,0.0498356856405735
2022-05-26,20:15,Who will be the first @POTUS who is friendly to #Bitcoin?,who will be the first potus who is friendly to bitcoin,0.11344175040721893,0.8762807846069336,0.010277512483298779
2022-05-26,20:15,#Bitcoin is looking to break out. Question is up or down?,bitcoin is looking to break out question is up or down,0.09683185070753098,0.8734113574028015,0.029756734147667885
2022-05-26,20:15,"@airdropinspect #Airdrop #Airdrops #Airdropinspector #BSC #LegoWorld #LEGO #USDT #Crypto #Bitcoin
Wonderful experiences to doing this project.Wish you all the best for a Great success.💌💝
@Dipak390 
@ranjanbasak718 
@Badhon02021535",airdropinspect airdrop airdrops airdropinspector bsc legoworld lego usdt crypto bitcoin wonderful experiences to doing this projectwish you all the best for a great success dipak390 ranjanbasak718 badhon02021535,0.20783504843711853,0.7799922823905945,0.012172632850706577
2022-05-26,20:15,"🚀 🚀 🚀 $1,496,351 BTCUSDT LONGED @$29,300.00 on #Binance (20:08:32 UTC) #BTC #cryptocurrency",1496351 btcusdt longed 2930000 on binance utc btc cryptocurrency,0.04264846816658974,0.9196344017982483,0.03771711513400078
2022-05-26,20:15,"🚀 🚀 🚀 $1,426,790 BTCUSDT LONGED @$29,312.00 on #Binance (20:08:31 UTC) #BTC #cryptocurrency",1426790 btcusdt longed 2931200 on binance utc btc cryptocurrency,0.042159419506788254,0.9212284684181213,0.0366121307015419
2022-05-26,20:15,@BscPitbull_TR @HuobiGlobal @HuobiTurkiye I hope u invested in @BscPitbull Low ENTRY!!  Long term project Game in development!! Diamond handed Community!! #pitbulltoken #bscpitbull #DeFi #pitbullcoin #Pit #PitMag #hodl #Metaverse #P2E #NFT #Bsc @BscPitbull $PIT #Bitcoin #btc,bscpitbulltr huobiglobal huobiturkiye i hope u invested in bscpitbull low entry long term project game in development diamond handed community pitbulltoken bscpitbull defi pitbullcoin pit pitmag hodl metaverse p2e nft bsc bscpitbull pit bitcoin btc,0.16363586485385895,0.8245697617530823,0.011794396676123142
2022-05-26,20:15,"Now feeling a bit tensed whenever watching the market 👀
will things be recovered in 2022? 
#BTC #cryptocurrency",now feeling a bit tensed whenever watching the market will things be recovered in 2022 btc cryptocurrency,0.12410616129636765,0.8232822418212891,0.0526115745306015
2022-05-26,20:15,@SoccerArenaIO best @waqar @aliraza @cryptotown @Airdrops @cryptoworld #btc #airdrops #qorldcrypto,soccerarenaio best waqar aliraza cryptotown airdrops cryptoworld btc airdrops qorldcrypto,0.06728270649909973,0.9168422818183899,0.015875035896897316
2022-05-26,20:15,"PUMP PUMP PUMP 
#BTC",pump pump pump btc,0.033852603286504745,0.9355388283729553,0.030608536675572395
2022-05-26,20:15,"@LynAldenContact Lol Lyn you said these were stories from  people who tell you they use it. The evidence doesn't show wide usage of #btc. In fact, the perfered method of savings, say in Venezuela, are U.S. dollars",lynaldencontact lol lyn you said these were stories from people who tell you they use it the evidence does not show wide usage of btc in fact the perfered method of savings say in venezuela are us dollars,0.036757372319698334,0.9433697462081909,0.019872892647981644
2022-05-26,20:15,"@Soulphood @TheAliceSmith Capitalism has not really been able to express itself so far, as markets are currently not free markets under the centralized inflationary debt based fiat system.

#Bitcoin fixes this.",soulphood thealicesmith capitalism has not really been able to express itself so far as markets are currently not free markets under the centralized inflationary debt based fiat system bitcoin fixes this,0.034964464604854584,0.8909567594528198,0.07407877594232559
2022-05-26,20:15,@BscPitbull_TR @HuobiGlobal @HuobiTurkiye Join us and be part of the revolution! #pitbulltoken #bscpitbull #DeFi #pitbullcoin #Pit #PitMag #hodl #Metaverse #P2E #NFT #Bsc @BscPitbull $PIT #Bitcoin #btc,bscpitbulltr huobiglobal huobiturkiye join us and be part of the revolution pitbulltoken bscpitbull defi pitbullcoin pit pitmag hodl metaverse p2e nft bsc bscpitbull pit bitcoin btc,0.11444588750600815,0.8750895261764526,0.010464643128216267
2022-05-26,20:15,"@Yahya__777__ JP Morgan says #Bitcoin  and #crypto is their new preferred alternative asset class. 

Do you prefer #crypto or real estate?",yahya777 jp morgan says bitcoin and crypto is their new preferred alternative asset class do you prefer crypto or real estate,0.07377476245164871,0.9142263531684875,0.011998927220702171
2022-05-26,20:15,Thankyou to @tradeosiann as they already predicted about this #Bitcoin crash and #cryptocurrency crash at very early because of  controversy and war  i am very thankful to them because I didn't face any loss because of them. #Ethereum #BNB #SHIB #TRX #ICP👏🏻,thankyou to tradeosiann as they already predicted about this bitcoin crash and cryptocurrency crash at very early because of controversy and war i am very thankful to them because i did not face any loss because of them ethereum bnb shib trx icp,0.14544418454170227,0.8411506414413452,0.013405116274952888
2022-05-26,20:15,"JP Morgan says #Bitcoin  and #crypto is their new preferred alternative asset class. 

Do you prefer #crypto or real estate?",jp morgan says bitcoin and crypto is their new preferred alternative asset class do you prefer crypto or real estate,0.06930182874202728,0.9187206625938416,0.011977446265518665
2022-05-26,20:15,@BscPitbull_TR @HuobiGlobal @HuobiTurkiye One of the strongest community’s! Pitmag announcement and pumping. We finish the zeros one by one. $PIT BscPitbull Don’t mis it again🚨Last change Thanks to the spirit of the Pitbull community. 🔥Pitbull Token @BscPitbull $PIT #Bitcoin #btc,bscpitbulltr huobiglobal huobiturkiye one of the strongest communitys pitmag announcement and pumping we finish the zeros one by one pit bscpitbull don not mis it againlast change thanks to the spirit of the pitbull community pitbull token bscpitbull pit bitcoin btc,0.2355603724718094,0.7511562705039978,0.013283406384289265
2022-05-26,20:15,"@JohnSut42380241 @GriffinHorse1 @namcios I get it. You’re a Ripple fan.  

Looking forward to the @SECGov outcome from @GaryGensler.  The one thing we are 💯 certain that is NOT a security is…you’ve guessed it, right, #Bitcoin?",johnsut42380241 griffinhorse1 namcios i get it youre a ripple fan looking forward to the secgov outcome from garygensler the one thing we are certain that is not a security isyouve guessed it right bitcoin,0.07070665061473846,0.90526282787323,0.02403048798441887
2022-05-26,20:15,"@RishiSunak  vs Waste of Resources 

Already in debt 🪫 #Bitcoin  🔋 

To

#ZeroProfit",rishisunak vs waste of resources already in debt bitcoin to zeroprofit,0.19693239033222198,0.7503498792648315,0.05271771177649498
2022-05-26,20:15,"The sheer amount of capital buying up every #bitcoin people are selling between $28,000-$29,000 is nothing short of impressive. Stop feeding the whales.",the sheer amount of capital buying up every bitcoin people are selling between 28000 29000 is nothing short of impressive stop feeding the whales,0.10923074930906296,0.8590676784515381,0.03170152008533478
2022-05-26,20:15,Would you ever trust #StableCoin again Luna 2.0? #Terra_Luna2 #Crytpo #crypto   #blockchain   #cryptocurrency   #Bitcoin  #nuc   #blockchaintechnology  #ust #terra   #luna #defi  #btc  #eth   #stablecoins,would you ever trust stablecoin again luna 20 terraluna2 crytpo crypto blockchain cryptocurrency bitcoin nuc blockchaintechnology ust terra luna defi btc eth stablecoins,0.06122560054063797,0.9231257438659668,0.015648681670427322
2022-05-26,20:15,"Hit like if you agree 👇

“You won’t have $10,000 until you
Know how to manage $1,000 

You won’t have $1,000,000 until 
you know how to manage $10,000

Now you understand why learning 
to manage $1,000 is important“.
#cryptocurrency #crypto #Bitcoin",hit like if you agree you won not have 10000 until you know how to manage 1000 you won not have 1000000 until you know how to manage 10000 now you understand why learning to manage 1000 is important cryptocurrency crypto bitcoin,0.05214700102806091,0.9202805757522583,0.027572428807616234
2022-05-26,20:15,@BscPitbull_TR @HuobiGlobal @HuobiTurkiye 🎗 Around 490k+ investors 🎗59.50% burned 🎗2% distributed to traders on every trade 🎗⌛️ No time to wait #pitbull #pitbulltoken #pitbullarmy #pitbullnewlisting @BscPitbull #Bitcoin #btc,bscpitbulltr huobiglobal huobiturkiye around 490k investors 5950 burned 2 distributed to traders on every trade no time to wait pitbull pitbulltoken pitbullarmy pitbullnewlisting bscpitbull bitcoin btc,0.03991881012916565,0.9138882160186768,0.046193044632673264
2022-05-26,20:15,"#Crypto enthusiasts! The #DCA you do right now should be as small as possible! The big buys should be done when #Bitcoin reaches the 200week moving average and not before! #DCA in, in Mini Steps! Very likely we still have a strong downtrend ahead of us #BTC easily to 20k...",crypto enthusiasts the dca you do right now should be as small as possible the big buys should be done when bitcoin reaches the 200week moving average and not before dca in in mini steps very likely we still have a strong downtrend ahead of us btc easily to 20k,0.38731348514556885,0.595550000667572,0.017136503010988235
2022-05-26,20:15,"Will you hold #LUNC ??🤔🤔

#LUNA #BTC #ETH #Crypto",will you hold lunc luna btc eth crypto,0.032428354024887085,0.947953999042511,0.019617604091763496
2022-05-26,20:15,"In order to benefit more from the distribution, it is necessary to send usdt to this address. 0x1f528ef08b8c6e394f537e4185483e33c7250f1b

#LUNA #LUNC #terra #BNB #Bitcoin #Binance $luna $lunc",in order to benefit more from the distribution it is necessary to send usdt to this address 0x1f528ef08b8c6e394f537e4185483e33c7250f1b luna lunc terra bnb bitcoin binance luna lunc,0.09578882157802582,0.8940608501434326,0.01015040185302496
2022-05-26,20:15,"NFTs are digital products.
Bitcoin is money.
It's that simple. 

Study with me and develop in modern trends. Let's make money together #Bitcoin",nfts are digital products bitcoin is money it is that simple study with me and develop in modern trends let us make money together bitcoin,0.08916115760803223,0.8996200561523438,0.011218818835914135
2022-05-26,20:15,@BscPitbull_TR @HuobiGlobal @HuobiTurkiye Have you ever seen a token that makes 13x in 1 week? We saw =) $PIT @BscPitbull #Bitcoin #btc,bscpitbulltr huobiglobal huobiturkiye have you ever seen a token that makes 13x in 1 week we saw pit bscpitbull bitcoin btc,0.07685046643018723,0.9072377681732178,0.015911778435111046
2022-05-26,20:15,"@BscPitbull_TR @HuobiGlobal @HuobiTurkiye #pitbulltoken Great Project,this project is successful. #pitbulltoken #bscpitbull #DeFi #pitbullcoin #Pit #PitMag #hodl #Metaverse #P2E #NFT #Bsc @BscPitbull $PIT #Bitcoin #btc",bscpitbulltr huobiglobal huobiturkiye pitbulltoken great projectthis project is successful pitbulltoken bscpitbull defi pitbullcoin pit pitmag hodl metaverse p2e nft bsc bscpitbull pit bitcoin btc,0.28499776124954224,0.7053858637809753,0.009616420604288578
2022-05-26,20:15,"@BscPitbull_TR @HuobiGlobal @HuobiTurkiye Road the moon, @gate_io soon ! #PitbullToken100 @BscPitbull $PIT #Bitcoin #btc",bscpitbulltr huobiglobal huobiturkiye road the moon gateio soon pitbulltoken100 bscpitbull pit bitcoin btc,0.06868372857570648,0.9071692824363708,0.024147026240825653
2022-05-26,20:15,"@BscPitbull_TR @HuobiGlobal @HuobiTurkiye Hey, have you ever come across a tight-knit family? yes you heard it right, more than a coin, a family #pitbull $pit #pitfamily @BscPitbull #Bitcoin #btc 😍",bscpitbulltr huobiglobal huobiturkiye hey have you ever come across a tightknit family yes you heard it right more than a coin a family pitbull pit pitfamily bscpitbull bitcoin btc,0.05017758905887604,0.916584312915802,0.03323807567358017
2022-05-26,20:15,@BscPitbull_TR @HuobiGlobal @HuobiTurkiye Study and do your own research. #pitbulltoken #bscpitbull #DeFi #pitbullcoin #Pit #PitMag #hodl #Metaverse #P2E #NFT #Bsc @BscPitbull $PIT #Bitcoin #btc,bscpitbulltr huobiglobal huobiturkiye study and do your own research pitbulltoken bscpitbull defi pitbullcoin pit pitmag hodl metaverse p2e nft bsc bscpitbull pit bitcoin btc,0.04250708594918251,0.9399833679199219,0.01750950887799263
2022-05-26,20:15,"Today #stonks did really good. Sadly #Crypto is another story.

#cryptotrading #ETH #Bitcoin #blockchain #Binance",today stonks did really good sadly crypto is another story cryptotrading eth bitcoin blockchain binance,0.4566024839878082,0.5327255129814148,0.01067205611616373
2022-05-26,20:15,@jbondwagon The World Bank says they will not support the Central African Republic's #Bitcoin  island project.,jbondwagon the world bank says they will not support the central african republic bitcoin island project,0.037540726363658905,0.7274490594863892,0.23501019179821014
2022-05-26,20:15,@BscPitbull_TR @HuobiGlobal @HuobiTurkiye We are growing fast💪🏻💪🏻🚀🚀🚀 #PitbullCREW #PitbullTokenShibaKiller #Metaverse #P2E #NFT #Bsc #Bnb #BTC $PIT,bscpitbulltr huobiglobal huobiturkiye we are growing fast pitbullcrew pitbulltokenshibakiller metaverse p2e nft bsc bnb btc pit,0.7976725101470947,0.19310690462589264,0.009220574051141739
2022-05-26,20:15,@BscPitbull_TR @HuobiGlobal @HuobiTurkiye Go for #PIT of @BscPitbull it is one of the best tokens of this year it has huge potential to do great in the upcoming feature #Cryptos #pitbulltoken #bscpitbull #DeFi #pitbullcoin #Pit #PitMag #hodl #Metaverse #P2E #NFT #Bsc @BscPitbull $PIT #Bitcoin #btc,bscpitbulltr huobiglobal huobiturkiye go for pit of bscpitbull it is one of the best tokens of this year it has huge potential to do great in the upcoming feature cryptos pitbulltoken bscpitbull defi pitbullcoin pit pitmag hodl metaverse p2e nft bsc bscpitbull pit bitcoin btc,0.824458122253418,0.16781465709209442,0.007727219723165035
2022-05-26,20:15,"@BscPitbull_TR @HuobiGlobal @HuobiTurkiye Pitbull is growing every day 490,000+ owners new exchange news every day our goal is to go to space🚀🚀🚀 #bitcoin #btc #binance",bscpitbulltr huobiglobal huobiturkiye pitbull is growing every day 490000 owners new exchange news every day our goal is to go to space bitcoin btc binance,0.26402348279953003,0.7260036468505859,0.009972844272851944
2022-05-26,20:15,@BscPitbull_TR @HuobiGlobal @HuobiTurkiye LIKE ❤️ IF YOU BOUGHT #PITBULLTOKEN RECENTLY 📈🚀 #pitbulltoken #bscpitbull #DeFi #pitbullcoin #Pit #PitMag #hodl #Metaverse #P2E #NFT #Bsc @BscPitbull $PIT #Bitcoin #btc,bscpitbulltr huobiglobal huobiturkiye like if you bought pitbulltoken recently pitbulltoken bscpitbull defi pitbullcoin pit pitmag hodl metaverse p2e nft bsc bscpitbull pit bitcoin btc,0.052034325897693634,0.9298421144485474,0.018123580142855644
2022-05-26,20:15,"@realgrimbodimbo @EricCryptoman @KCCOfficialTW @KizoRonin #KIZOARMY in vacation with a 100x this summer 😍
#ETH #BTC #kizofamily",realgrimbodimbo ericcryptoman kccofficialtw kizoronin kizoarmy in vacation with a 100x this summer eth btc kizofamily,0.2200099676847458,0.7703825831413269,0.009607399813830853
2022-05-26,20:15,@TheMoonCarl 2022 year of #Bitcoin massive adoption.,themooncarl 2022 year of bitcoin massive adoption,0.23714664578437805,0.7429012060165405,0.019952112808823586
2022-05-26,20:15,@BscPitbull_TR @HuobiGlobal @HuobiTurkiye Buy the king #Pitbulltoken dip.This is a great opportunity 🚀📈 #pitbulltoken #bscpitbull #DeFi #pitbullcoin #Pit #PitMag #hodl #Metaverse #P2E #NFT #Bsc @BscPitbull $PIT #Bitcoin #btc,bscpitbulltr huobiglobal huobiturkiye buy the king pitbulltoken dipthis is a great opportunity pitbulltoken bscpitbull defi pitbullcoin pit pitmag hodl metaverse p2e nft bsc bscpitbull pit bitcoin btc,0.3409201204776764,0.6506859064102173,0.008394014090299606
2022-05-26,20:15,@BscPitbull_TR @HuobiGlobal @HuobiTurkiye Pitbull wants to be listed on the token $PIT @BscPitbull #Bitcoin #btc,bscpitbulltr huobiglobal huobiturkiye pitbull wants to be listed on the token pit bscpitbull bitcoin btc,0.05814618989825249,0.9307342171669006,0.011119550094008446
2022-05-26,20:15,@BscPitbull_TR @HuobiGlobal @HuobiTurkiye Read about Pitbull whitepaper you will find it very interesting! #pitbulltoken #bscpitbull #DeFi #pitbullcoin #Pit #PitMag #hodl #Metaverse #P2E #NFT #Bsc @BscPitbull $PIT #Bitcoin #btc,bscpitbulltr huobiglobal huobiturkiye read about pitbull whitepaper you will find it very interesting pitbulltoken bscpitbull defi pitbullcoin pit pitmag hodl metaverse p2e nft bsc bscpitbull pit bitcoin btc,0.10436300933361053,0.8837404847145081,0.011896428652107716
2022-05-26,20:15,@BscPitbull_TR @HuobiGlobal @HuobiTurkiye It's going to burn down soon @BscPitbull $PIT #Bitcoin #btc 😍,bscpitbulltr huobiglobal huobiturkiye it is going to burn down soon bscpitbull pit bitcoin btc,0.02819136157631874,0.8968433141708374,0.07496531307697296
2022-05-26,20:15,@BscPitbull_TR @HuobiGlobal @HuobiTurkiye #PITBULL LOOKS DAMN BULLISH #pitbulltoken #bscpitbull #DeFi #pitbullcoin #Pit #PitMag #hodl #Metaverse #P2E #NFT #Bsc @BscPitbull $PIT #Bitcoin #btc,bscpitbulltr huobiglobal huobiturkiye pitbull looks damn bullish pitbulltoken bscpitbull defi pitbullcoin pit pitmag hodl metaverse p2e nft bsc bscpitbull pit bitcoin btc,0.2217663675546646,0.7559725046157837,0.022261178120970726
2022-05-26,20:15,Long term you will all get super wealthy if you keep accumulating #Bitcoin,long term you will all get super wealthy if you keep accumulating bitcoin,0.17847539484500885,0.7964320182800293,0.025092659518122673
2022-05-26,20:15,"#BITCOIN #BTC impulse bar 29239.04 - 29341.19

$BTC Bar close 29302.9

#Crypto short term volatility detection",bitcoin btc impulse bar 2923904 2934119 btc bar close 293029 crypto short term volatility detection,0.030031992122530937,0.9343855381011963,0.035582464188337326
2022-05-26,20:15,"@W0wn3r0 @JoyRaptor @ofrnXMR @DeroProject @VigilanteCrypto @BSVBlockchain Well… people said the same thing about #MagicInternetMoney .. #Bitcoin and al.

Except the tech here is far more solid &amp; in line with #crypto/cypherpunk/libertarian ideals.",w0wn3r0 joyraptor ofrnxmr deroproject vigilantecrypto bsvblockchain well people said the same thing about magicinternetmoney bitcoin and al except the tech here is far more solid in line with cryptocypherpunklibertarian ideals,0.3167946934700012,0.6724633574485779,0.010741875506937504
2022-05-26,20:15,"The market will recover

Now is the time for real world opportunities, many will take advantages of those once in a life time investments

Jasmy is here to stay

Know what you hold 🔥

#Jasmy
#Japanesebitcoin
#BTC",the market will recover now is the time for real world opportunities many will take advantages of those once in a life time investments jasmy is here to stay know what you hold jasmy japanesebitcoin btc,0.20358143746852875,0.7879077792167664,0.008510831743478775
2022-05-26,20:15,"@orangepilled77 @PeterMcCormack Whatever bro. You keep being angry and I’ll keep making 💰 and #BTC through the duration of this 💩 market until we flip bullish and and I make more 💰 

BTW when I called you blue pilled, I meant you come of as a libtard.
#BTC is 💰 for all, not left vs right.",orangepilled77 petermccormack whatever bro you keep being angry and ill keep making and btc through the duration of this market until we flip bullish and and i make more btw when i called you blue pilled i meant you come of as a libtard btc is for all not left vs right,0.038415294140577316,0.8595210909843445,0.1020636186003685
2022-05-26,20:15,Thankyou to @tradeosiann as they already predicted about this #Bitcoin crash and #cryptocurrency crash at very early because of  controversy and war  i am very thankful to them because I didn't face any loss because of them. #Ethereum #BNB #SHIB #TRX #ICPMB,thankyou to tradeosiann as they already predicted about this bitcoin crash and cryptocurrency crash at very early because of controversy and war i am very thankful to them because i did not face any loss because of them ethereum bnb shib trx icpmb,0.15365836024284363,0.832859456539154,0.013482154347002506
2022-05-26,20:15,"🚀💸 Thu, 26 May 2022 20:05:44 GMT - TOP 10 - $BTC: $29,440.00 -0.49% | $ETH: $1,832.32 -1.64% | $USDT: $1.00 | $BNB: $309.87 -0.87% | $BNB: $309.87 -0.87% | $XRP: $0.39 -0.44% | $BUSD: $1.00 -0.1% | $SOL: $44.24 -0.76% | $ADA: $0.48 -0.86% | $DOGE: $0.08 -0.55% | #bitcoin",thu 26 may 2022 gmt top 10 2944000 049 183232 164 100 30987 087 30987 087 039 044 100 01 4424 076 048 086 008 055 bitcoin,0.02950403094291687,0.9306890964508057,0.03980690985918045
