Date,Time,Original tweet,Clean tweet,Positive,Neutral,Negative
2022-05-13,13:15,Bitcoin and Ethereum will hit all time highs again at some point and people are going to act surprised #BTC #Ethereum #BTC &amp; ETH ETH,bitcoin and ethereum will hit all time highs again at some point and people are going to act surprised btc ethereum btc eth eth,0.21617557108402252,0.7723859548568726,0.011438503861427307
2022-05-13,13:15,Facebook Ex #Crypto Head Launched a #Bitcoin Payments Startup https://t.co/fxrG8WJKc7 via @coinjupiter,facebook ex crypto head launched a bitcoin payments startup via coinjupiter,0.08047974854707718,0.907056987285614,0.012463228777050972
2022-05-13,13:15,"@Carnage4Life #BTC would be shitty tech???? Com'on, man!",carnage4life btc would be shitty tech com on man,0.027107466012239456,0.943710207939148,0.029182374477386475
2022-05-13,13:15,"Every drop in the history of BTC reached its 200MA. If it happens this time we drop ~ 20k #Bitcoin @Theimmigrant84

29-NOV-2021 Regime Change They can never beat you if you buy the dips. @nayibbukele #BTC The ‘Bukeleists’ are going to be tested #Bitcoin
https://t.co/R0bkXFS3kh https://t.co/RfUfLJkDjG",every drop in the history of btc reached its 200ma if it happens this time we drop 20k bitcoin theimmigrant84 29nov2021 regime change they can never beat you if you buy the dips nayibbukele btc the bukeleists are going to be tested bitcoin,0.13488411903381348,0.786412239074707,0.07870366424322128
2022-05-13,13:15,📈 ETHUSD BUY signal now (severity: 4) #eth #crypto #DCA #TradingSignals #BTC #Bitcoin 13/5/2022@13:14:59,ethusd buy signal now 4 eth crypto dca tradingsignals btc bitcoin,0.043113235384225845,0.9361562728881836,0.02073047123849392
2022-05-13,13:15,"is not possible that @terra_money is giving us hope 👀🥺 

is getting us really #LUNAtics 

#LUNA $luna #btc #Crypto",is not possible that terramoney is giving us hope is getting us really lunatics luna luna btc crypto,0.03112443909049034,0.8041085004806519,0.1647670418024063
2022-05-13,13:15,"Remember a couple days ago when max fear set in and you didn't buy anything because it was all going to zero... 30, 40, +50% looking pretty sweet today. New concept I'm trying out. Buy low sell high. 😉🤠 #crypto #nft #bitcoin",remember a couple days ago when max fear set in and you did not buy anything because it was all going to zero 30 40 50 looking pretty sweet today new concept i am trying out buy low sell high crypto nft bitcoin,0.06245531141757965,0.9130392074584961,0.024505510926246643
2022-05-13,13:15,"What do you think about $Luna? 🤧

#PancakeSwap #cryptocurrency #DAO #BSC #binance #ToTheSirius #BTC #OHM  #SiriusDAO #Eth #Luna #BSC #Crypto",what do you think about luna pancakeswap cryptocurrency dao bsc binance tothesirius btc ohm siriusdao eth luna bsc crypto,0.0327356718480587,0.9486737847328186,0.018590539693832397
2022-05-13,13:15,Norway has rejected a proposal to ban #Bitcoin mining.,norway has rejected a proposal to ban bitcoin mining,0.044480741024017334,0.13791555166244507,0.8176036477088928
2022-05-13,13:15,At least we’re seeing some green this morning 🥹 #BTC #Crypto #Cryptocrash #Ethereum,at least were seeing some green this morning btc crypto cryptocrash ethereum,0.4295808970928192,0.5554564595222473,0.014962630346417427
2022-05-13,13:15,@Bitcasinoio This is the way and the truth #Bitcoin #Bitcasino #Dota #ESLOne,bitcasinoio this is the way and the truth bitcoin bitcasino dota eslone,0.04912504553794861,0.9327729344367981,0.01810198649764061
2022-05-13,13:15,"@AirdropDet Nice project and congratulations to the team for their efforts and dedication and highly appreciated the visionary thought of the projector and it will create history

#Airdrops #KOKChain #Bitcoin #AirdropDetective #Cryptocurrency",airdropdet nice project and congratulations to the team for their efforts and dedication and highly appreciated the visionary thought of the projector and it will create history airdrops kokchain bitcoin airdropdetective cryptocurrency,0.6720536947250366,0.3193244934082031,0.008621730841696262
2022-05-13,13:15,"Closed $30505  
Nasdaq looking to open positive!!
Nice little 5% trade will enter again if we get $31000 !!
#BTC #Bitcoin",closed 30505 nasdaq looking to open positive nice little 5 trade will enter again if we get 31000 btc bitcoin,0.2295657992362976,0.7509912252426147,0.019443001598119736
2022-05-13,13:15,"@TheMoonCarl Altcoin is just another way to say scam that hasn’t gone to zero yet… #Bitcoin only, I have seen the light after $LUNA and finding out even #Ethereum had a 70% premine to investors, risky to hold any unregistered security.",themooncarl altcoin is just another way to say scam that hasn not gone to zero yet bitcoin only i have seen the light after luna and finding out even ethereum had a 70 premine to investors risky to hold any unregistered security,0.08966638892889023,0.8845627307891846,0.025770951062440872
2022-05-13,13:15,"$BTC #BTC - Overall trend is not good on the D chart, Day trade as much as possible. Get in and get out with your profits ! Don't convert your profits to losses !

#cryptotrading #Cryptos #cryptocurrencies #Crypto #binance #Houbi #Kucoin #BTC #ETHEREUM $BTC",btc btc overall trend is not good on the d chart day trade as much as possible get in and get out with your profits do not convert your profits to losses cryptotrading cryptos cryptocurrencies crypto binance houbi kucoin btc ethereum btc,0.05295755714178085,0.9015620946884155,0.04548031464219093
2022-05-13,13:15,"@MMCrypto Please also learn the risk of investing in absolute shitcoins.
#bitcoin is King.",mmcrypto please also learn the risk of investing in absolute shitcoins bitcoin is king,0.048322901129722595,0.9353465437889099,0.016330501064658165
2022-05-13,13:15,"@Steven_Ehrlich @ChartsBtc @Grayscale Yep &amp; ethe is a better play of the 2 

#ethe $ethe #eth $eth 
#gbtc $gbtc #bitcoin $btc",stevenehrlich chartsbtc grayscale yep ethe is a better play of the 2 ethe ethe eth eth gbtc gbtc bitcoin btc,0.226532444357872,0.7633878588676453,0.01007970329374075
2022-05-13,13:15,"#Bitcoin is clearly inferior to #Ethereum, and Bitcoin Maximalists are toxic, immoral personalities",bitcoin is clearly inferior to ethereum and bitcoin maximalists are toxic immoral personalities,0.01670585758984089,0.11016117036342621,0.8731330037117004
2022-05-13,13:15,Did you buy any #Crypto during the 🔥 yesterday? #Bitcoin #Ethereum #drip,did you buy any crypto during the yesterday bitcoin ethereum drip,0.03769554942846298,0.9384941458702087,0.023810317739844322
2022-05-13,13:15,"🔻 🔻 🔻 $1,174,524 BTCUSDT SHORTED @$30,500.00 on #Binance (13:14:10 UTC) #BTC #cryptocurrency",1174524 btcusdt shorted 3050000 on binance utc btc cryptocurrency,0.0381971076130867,0.9284522533416748,0.03335058316588402
2022-05-13,13:15,"🚨NY OPEN🚨 #Bitcoin at 30500 #SPX with a huge gap of approximately 1.3% - both trading around high ADR. I expect at least a retrace into the 1hr 50EMA, from there it could go either way. Interesting weekly close - keeping an eye out on the #DXY as well.",ny open bitcoin at 30500 spx with a huge gap of approximately 13 both trading around high adr i expect at least a retrace into the 1hr 50ema from there it could go either way interesting weekly close keeping an eye out on the dxy as well,0.06728268414735794,0.9079196453094482,0.024797746911644936
2022-05-13,13:15,@ImpactXPToken @saitamaprincezz So why whales and investors r not coming in #BTC move from 24.5K to 30L now trading why not u guys flow money in it how u can impressed investors,impactxptoken saitamaprincezz so why whales and investors r not coming in btc move from 245k to 30l now trading why not u guys flow money in it how u can impressed investors,0.09604832530021667,0.888495147228241,0.015456532128155231
2022-05-13,13:15,"if u go down due to crypto,Hang around with friends and be close to ur support system. It's money, more will come ❤️🚀

#Btc #luna #Happykidville",if u go down due to cryptohang around with friends and be close to ur support system it is money more will come btc luna happykidville,0.051543302834033966,0.6952012181282043,0.2532554864883423
2022-05-13,13:15,"We feel ""encouraged"" following a ""productive meeting"" with the SEC about our #Bitcoin  ETF - Grayscale spokesperson",we feel encouraged following a productive meeting with the sec about our bitcoin etf grayscale spokesperson,0.9246382713317871,0.06304832547903061,0.012313351966440678
2022-05-13,13:15,"🙏 'Now I’m very happy that 80% of my crypto is in #Bitcoin. 

Stay safe.' - Tweet from: @TheMoonCarl #Bitcoin",now im very happy that 80 of my crypto is in bitcoin stay safe tweet themooncarl bitcoin,0.07411343604326248,0.9067406058311462,0.019145973026752472
2022-05-13,13:15,"@brian_trollz True story.  I asked the most “reputable” people I know all over the interwebs who is worth listening to about #BTC and your name consistently came up!  Also, that list is VERY short!!! The “community” desperately needs more people like you❤️😊👍",briantrollz true story i asked the most reputable people i know all over the interwebs who is worth listening to about btc and your name consistently came up also that list is very short the community desperately needs more people like you,0.0438590943813324,0.9173376560211182,0.03880329057574272
2022-05-13,13:15,"@RonStoeferle Well, if you own #Bitcoin then you are essentially your own bank.",ronstoeferle well if you own bitcoin then you are essentially your own bank,0.04377083107829094,0.9383962154388428,0.017832977697253227
2022-05-13,13:15,"@TheMoonCarl Two weeks later... #Bitcoin is Dead buy $USD.... 

Two Months Later.. $USD is Dead, Find Trinkets to barter with!",themooncarl two weeks later bitcoin is dead buy usd two months later usd is dead find trinkets to barter with,0.053124021738767624,0.913098156452179,0.033777885138988495
2022-05-13,13:15,Current #Bitcoin Price is $30559 #BTC #Crypto,current bitcoin price is 30559 btc crypto,0.019841356202960014,0.9471746683120728,0.03298398107290268
2022-05-13,13:15,@BobLoukas Further decline from gold hints that rallies from equities and #btc are bear market rallies?,bobloukas further decline from gold hints that rallies from equities and btc are bear market rallies,0.10635106265544891,0.02760542370378971,0.8660435080528259
2022-05-13,13:15,"Again, #EthereumNFTs and #ETH are just a more obfuscated version of #lunacoin 

Stop f***ing around with centralized scams pretending to be innovation 

Stack Sats 

#bitcoin",again ethereumnfts and eth are just a more obfuscated version of lunacoin stop fing around with centralized scams pretending to be innovation stack sats bitcoin,0.023591894656419754,0.8751495480537415,0.10125850886106491
2022-05-13,13:15,"#Bitcoin is not crypto.  Once you understand that, you win.",bitcoin is not crypto once you understand that you win,0.040609538555145264,0.9361067414283752,0.0232837051153183
2022-05-13,13:15,Lets go #BTC RECOVER,lets go btc recover,0.03330567106604576,0.9451094269752502,0.021584901958703995
2022-05-13,13:15,"They will pump the #crypto market till monday keep longing guys 🧐

#Bitcoin #ALTSEASON",they will pump the crypto market till monday keep longing guys bitcoin altseason,0.05598742887377739,0.9213590025901794,0.02265358529984951
2022-05-13,13:15,Pump pump pump !!! So the smart money dumps #bitcoin #SAFEMOONARMY #bearmarket REKT BTC and ETH #HODL,pump pump pump so the smart money dumps bitcoin safemoonarmy bearmarket rekt btc and eth hodl,0.08255108445882797,0.9005911946296692,0.01685771718621254
2022-05-13,13:15,@BitcoinSapiens I have balls to buy #Bitcoin at $1k the thing is when price get at that level there wouldn’t be any penny left on my account to buy again 💀,bitcoinsapiens i have balls to buy bitcoin at 1k the thing is when price get at that level there wouldn not be any penny left on my account to buy again,0.041209056973457336,0.9002701044082642,0.0585208535194397
2022-05-13,13:15,"hope for the #best.  even though my #wife has started asking questions like a #secret agent investigator 🥲☺️☺️ 
@TerraLunaCom @terra_money @binance #Binance #Cryptocrash #CryptoNews #hotbit #KuCoin #LUNA #LUNAUSDT #Bitcoin",hope for the best even though my wife has started asking questions like a secret agent investigator terralunacom terramoney binance binance cryptocrash cryptonews hotbit kucoin luna lunausdt bitcoin,0.07266385108232498,0.8693071603775024,0.05802898481488228
2022-05-13,13:15,"@PAWstronaut13 #PAW believes everyone can participate, so you can earn PAW mine-free with:

🕹 Games
💰 Giveaways
👨‍👨‍👧‍👦 Community engagement
🚀 Helping PAW grow

$PAW is the people’s crypto 🤝

#fridaymorning #btc #doge #SHIB #FridayThe13th #fridayfeeling",pawstronaut13 paw believes everyone can participate so you can earn paw minefree games giveaways community engagement helping paw grow paw is the peoples crypto fridaymorning btc doge shib fridaythe13th fridayfeeling,0.07807739078998566,0.9050817489624023,0.016840893775224686
2022-05-13,13:15,@PeterSchiff why do you keep talking about #Bitcoin,peterschiff why do you keep talking about bitcoin,0.02553967572748661,0.8363758325576782,0.13808445632457733
2022-05-13,13:15,Is El Salvador's planned #Bitcoin city ever happening?,is el salvador planned bitcoin city ever happening,0.10055001080036163,0.87968909740448,0.019760850816965103
2022-05-13,13:15,"“Future generations won’t know what it’s like to find money on the ground.” 
- #Bitcoin #BTC",future generations won not know what its like to find money on the ground bitcoin btc,0.04741707816720009,0.9317803382873535,0.020802540704607964
2022-05-13,13:15,@CoinCornerMolly Increased #Bitcoin #utility #crypto,coincornermolly increased bitcoin utility crypto,0.8777693510055542,0.08976747840642929,0.03246317803859711
2022-05-13,13:15,"Time and time again, #Bitcoin returns stronger than before while shitcoins turn to ash and broken families.",time and time again bitcoin returns stronger than before while shitcoins turn to ash and broken families,0.21343670785427094,0.24387089908123016,0.5426924228668213
2022-05-13,13:15,"@PAWstronaut13 #paw for me and you
$PAW is a good project

@PawTipBot

#fridaymorning #btc #doge #SHIB #FridayThe13th #fridayfeeling",pawstronaut13 paw for me and you paw is a good project pawtipbot fridaymorning btc doge shib fridaythe13th fridayfeeling,0.08396260440349579,0.8993062376976013,0.01673121005296707
2022-05-13,13:15,"🔻 🔻 🔻 $2,285,353 BTCUSDT SHORTED @$30,530.00 on #Binance (13:12:22 UTC) #BTC #cryptocurrency",2285353 btcusdt shorted 3053000 on binance utc btc cryptocurrency,0.03304063156247139,0.9336739778518677,0.033285338431596756
2022-05-13,13:15,"“If bitcoin was anything other than a useless representation of financial hype and speculative mania it would stop gyrating like a profit less cloud software IPO” - VitalDawn newsletter. Spot on 💀💀💀

#Bitcoin",if bitcoin was anything other than a useless representation of financial hype and speculative mania it would stop gyrating like a profit less cloud software ipo vitaldawn newsletter spot on bitcoin,0.0394214428961277,0.8742998242378235,0.08627869188785553
2022-05-13,13:15,"🟩 Block 736212 ⛏ ⛏

📅 13th May 2022, 13:11:32 GMT

📣 2,127 tx with a value of 11,714.659 ₿ ($357.90m 🇺🇸)

📣 distributed to 8,037 recipients 💎🙌

📣 19,038,831.25 ₿ (90.66110%) mined ⛏

📣 1,961,168.75 ₿ remaining 💰

#bitcoin #tictoknextblock",block 736212 13th may 2022 gmt 2127 tx with a value of 11714659 35790m distributed to 8037 recipients 1903883125 9066110 mined 196116875 remaining bitcoin tictoknextblock,0.06108474358916283,0.9189103841781616,0.020004823803901672
2022-05-13,13:15,Emotions are a wonderful thing in trading when they are consuming the mind of the person on the other side of your trade. #MachineTrading #CoolAsSteel #TradingDiscipline #Bitcoin #Crypto #AutoTrading #QuantGeeks,emotions are a wonderful thing in trading when they are consuming the mind of the person on the other side of your trade machinetrading coolassteel tradingdiscipline bitcoin crypto autotrading quantgeeks,0.03664223849773407,0.9328134059906006,0.030544381588697433
2022-05-13,13:15,📈 ETHUSD BUY signal now (severity: 3) #eth #crypto #DCA #TradingSignals #BTC #Bitcoin 13/5/2022@13:11:59,ethusd buy signal now 3 eth crypto dca tradingsignals btc bitcoin,0.04323381185531616,0.9369625449180603,0.01980365626513958
2022-05-13,13:15,@Pentosh1 #bitcoin is always a good buy.,pentosh1 bitcoin is always a good buy,0.21307377517223358,0.7719346880912781,0.014991519041359425
2022-05-13,13:15,"I´m giving 0.1 #btc #bitcoin to the first 1000 people who follows and retweets!! #cryptocurrency 
Drop your wallet",im giving 01 btc bitcoin to the first 1000 people who follows and retweets cryptocurrency drop your wallet,0.023576492443680763,0.9329184889793396,0.0435049831867218
2022-05-13,13:15,"Just bought some of this dip 😋

#Bitcoin",just bought some of this dip bitcoin,0.09552359580993652,0.8877325057983398,0.016743920743465424
2022-05-13,13:15,#Market #Capitulation is where you sell #Stocks that you love. $QQQ $VIX #Gold #Bitcoin $SPY,market capitulation is where you sell stocks that you love qqq vix gold bitcoin spy,0.0331326499581337,0.9412249326705933,0.025642413645982742
2022-05-13,13:15,"Buy your favorite alt now.

Sell in like 10 days to enjoy your 2x - 5x.

Enjoy!

#BTC",buy your favorite alt now sell in like 10 days to enjoy your 2x 5x enjoy btc,0.08264414966106415,0.9035786986351013,0.013777166604995728
2022-05-13,13:15,"given the price of #luna, $luna buying a small amount for $10 can pay off! #UST #BTC #Lunacrash",given the price of luna luna buying a small amount for 10 can pay off ust btc lunacrash,0.09584192931652069,0.8868049383163452,0.01735309697687626
2022-05-13,13:15,"Its good to see some green , but remember you are not in a bull market. This is not me saying Im bearish. I even see some possible big moves for #BTC on the 1H and 4H, but remember as fast as you got it you can lose it even faster so always be prepared to protect your profits. 💯",its good to see some green but remember you are not in a bull market this is not me saying im bearish i even see some possible big moves for btc on the 1h and 4h but remember as fast as you got it you can lose it even faster so always be prepared to protect your profits,0.15533138811588287,0.7465072274208069,0.09816136956214905
2022-05-13,13:15,@ca_nigam Yes #bitcoin is the only king 👑,canigam yes bitcoin is the only king,0.05774092301726341,0.9304198622703552,0.011839241720736027
2022-05-13,13:15,This is a potential project with higher return on investment. Well realistic concept with competent project team. !!#WorkQuest $WQT $WUSD #WorkNet #WorkQuestApp #blockchian #crypto #cryptolife #BTC #BNB #ETH #digitalization #digitalassets #saving #BinanceSmartChain,this is a potential project with higher return on investment well realistic concept with competent project team workquest wqt wusd worknet workquestapp blockchian crypto cryptolife btc bnb eth digitalization digitalassets saving binancesmartchain,0.36702844500541687,0.625633180141449,0.0073383646085858345
2022-05-13,13:15,#Bitcoin to $19k as first level of strong support if it fails.. we go back down to $12k,bitcoin to 19k as first level of strong support if it fails we go back down to 12k,0.05204285681247711,0.7027221918106079,0.24523493647575378
2022-05-13,13:15,"@bobthebagfinder Interesting.. personally I’m suspicious of this insta bounce, seems like one last liquidity suck.. i’m not ruling out a 14k #BTC",bobthebagfinder interesting personally im suspicious of this insta bounce seems like one last liquidity suck im not ruling out a 14k btc,0.08804775774478912,0.847427248954773,0.06452499330043793
2022-05-13,13:15,"#Bitcoin 📈 

▓▓▓▓▓░░░░░░░░░░ 31%

price:$30556.35      eth/btc: 0.07",bitcoin 31 007,0.030829837545752525,0.9301158785820007,0.0390542708337307
2022-05-13,13:15,create twitter tasks and pay with #bitcoin #ethereum #litecoin #nft #airdrop with @jobboycom,create twitter tasks and pay with bitcoin ethereum litecoin nft airdrop with jobboycom,0.03466211259365082,0.9412561058998108,0.024081749841570854
2022-05-13,13:15,@TelegramTycoon cryptocurrency is super! #crypto #Bitcoin #,telegramtycoon cryptocurrency is super crypto bitcoin,0.032330214977264404,0.9467235803604126,0.02094619907438755
2022-05-13,13:15,Is market again green? #Bitcoin,is market again green bitcoin,0.1614566594362259,0.8108307123184204,0.027712669223546982
2022-05-13,13:15,"The root of all evil is not money. It’s bad money. Money that incentivizes bad behavior.

The root of all good could also be money. Money that incentivizes good behavior.

#Bitcoin",the root of all evil is not money its bad money money that incentivizes bad behavior the root of all good could also be money money that incentivizes good behavior bitcoin,0.02153109945356846,0.8768057227134705,0.10166316479444504
2022-05-13,13:15,"Glad to see the #crypto market recovering slowly 🔥🚀 diamond hands 
I won’t sell for less of my price targets .
#AWC #AWRT #Saitama #Mandox #KOACOMBAT #JASMY #Bitcoin #ETH
Have a great weekend .",glad to see the crypto market recovering slowly diamond hands i won not sell for less of my price targets awc awrt saitama mandox koacombat jasmy bitcoin eth have a great weekend,0.5510590672492981,0.43352165818214417,0.015419271774590015
2022-05-13,13:15,"@PeterSchiff If #Bitcoin doesn't exist you would have 0 follower
You use #Bitcoin more than any maxis",peterschiff if bitcoin does not exist you would have 0 follower you use bitcoin more than any maxis,0.06010990962386131,0.884036123752594,0.055853940546512604
2022-05-13,13:15,UMA Voting Token (UMA) went up 11.6 percent in the last 30 minutes on Binance. #UMA  #crypto #bitcoin #cryptocurrency #btc #ethereum #blockchain #eth #trading #altcoin #binance #cryptonews,uma voting token uma went up 116 percent in the last 30 minutes on binance uma crypto bitcoin cryptocurrency btc ethereum blockchain eth trading altcoin binance cryptonews,0.9138956665992737,0.07258966565132141,0.013514709658920765
2022-05-13,13:15,"If you think #Bitcoin is a cryptocurrency in the crypto space, I ask that you consider this alternate hypothesis:

Bitcoin is the only legitimate digital asset, in a class all its own, and all other “cryptos” are flawed imitations.

Here’s some thoughts to get you started:",if you think bitcoin is a cryptocurrency in the crypto space i ask that you consider this alternate bitcoin is the only legitimate digital asset in a class all its own and all other cryptos are flawed imitations heres some thoughts to get you,0.0334065705537796,0.8447936177253723,0.12179978936910629
2022-05-13,13:15,@markets We will see #Bitcoin moving even lower closer to the $10k level with the market cap shrinking closer to $200 billion. The huge volatility moves only confirm the investors getting nervous as we see less trust in the crypto industry due to the recent #Terra_Luna events.,markets we will see bitcoin moving even lower closer to the 10k level with the market cap shrinking closer to 200 billion the huge volatility moves only confirm the investors getting nervous as we see less trust in the crypto industry due to the recent terraluna events,0.01280348189175129,0.02060016058385372,0.9665963053703308
2022-05-13,13:15,"@PeterSchiff Agree with the first part, but can't agree with second part. 
If the NASDAQ rallies, so #Bitcoin will too.",peterschiff agree with the first part but cannot agree with second part if the nasdaq rallies so bitcoin will too,0.07919759303331375,0.7298583984375,0.19094397127628326
2022-05-13,13:15,"@Cylumfinance good pri
#CYLUM #CYM #BNB #BSC #cryptocurrency #binance #BTC #ETH",cylumfinance good pri cylum cym bnb bsc cryptocurrency binance btc eth,0.09846331179141998,0.8915347456932068,0.010001946240663528
2022-05-13,13:15,"#Bitcoin  has no CEO, staff, or office. It is the most decentralized &amp; most censorship-resistant. 💪

It is here to stand the test of time &amp; state resistance. 💎",bitcoin has no ceo staff or office it is the most decentralized most censorshipresistant it is here to stand the test of time state resistance,0.0585503987967968,0.9203188419342041,0.021130774170160294
2022-05-13,13:15,@GaryGensler @FINRA Are you asleep at the wheel or are you about to announce regulations around digital securities i.e Eth and every altcoin? #Bitcoin,garygensler finra are you asleep at the wheel or are you about to announce regulations around digital securities ie eth and every altcoin bitcoin,0.02438080869615078,0.9133452773094177,0.062273938208818436
2022-05-13,13:15,"@saylor You settle   always

#Bitcoin is King.",saylor you settle always bitcoin is king,0.06763175874948502,0.8962321281433105,0.036136094480752945
2022-05-13,13:15,"BITCOIN WENT UP!

USD $30,556.35 (+0,30%)
Yesterday: +5,45%
Last 30 days: -23,77%

#bitcoin",bitcoin went up usd 3055635 030 545 last 30 2377 bitcoin,0.9078252911567688,0.07118268311023712,0.020991960540413857
2022-05-13,13:15,"@PlanetCapitan @ElrondNetwork @beniaminmincu @SeverMM @lucianmincu You forgot to mention the best part for #Lunatics:

Programmed scarcity similar to #Bitcoin and the native token isn't used to maintain a stablecoin. There is 0 chance of your investment being inflated away.",planetcapitan elrondnetwork beniaminmincu severmm lucianmincu you forgot to mention the best part for programmed scarcity similar to bitcoin and the native token is not used to maintain a stablecoin there is 0 chance of your investment being inflated away,0.039080120623111725,0.5894106030464172,0.371509313583374
