Date,Time,Original tweet,Clean tweet,Positive,Neutral,Negative
2022-05-07,9:45,"7Bit The Bitcoin casino

Looking for a hybrid casino that offers a gaming experience for both cryptocurrencies &amp; currency? Then your quest for the best ends at 7 Bit Casino

Not Available in the Uk
https://t.co/4G69cufufX

.
18+ GambleAware
#Casino #Slots #Bitcoin.5 https://t.co/FjdwfdZCxK",7bit the bitcoin casino looking for a hybrid casino that offers a gaming experience for both cryptocurrencies currency then your quest for the best ends at 7 bit casino not available in the uk 18 gambleaware casino slots bitcoin5,0.115360789000988,0.8739757537841797,0.010663446970283985
2022-05-07,9:45,"U.S. Treasury Department has sanctioned #cryptocurrency mixer ""Blender"" for helping North Korean hackers launder millions of dollars.

Read: https://t.co/HnrkRIxdiU

#infosec #cybersecurity #hackernews #technology #hacking #bitcoin",us treasury department has sanctioned cryptocurrency mixer blender for helping north korean hackers launder millions of dollars infosec cybersecurity hackernews technology hacking bitcoin,0.1050742045044899,0.2943870723247528,0.6005386710166931
2022-05-07,9:45,"Remember: #Bitcoin, not crypto.",bitcoin not crypto,0.029589667916297913,0.9365822076797485,0.03382815793156624
2022-05-07,9:45,@LeaksBlockchain Sad to hear this but our warmest condolence to the family. take heart chico the #bitcoin family loves you and supports you,leaksblockchain sad to hear this but our warmest condolence to the family take heart chico the bitcoin family loves you and supports you,0.4783030152320862,0.5024459362030029,0.01925109326839447
2022-05-07,9:45,"What's the best altcoin today? 👇🚀

#BTC #BNB #Cryto #ETH #APE #ADA #NEXO",what is the best altcoin today btc bnb cryto eth ape ada nexo,0.09183277189731598,0.8951182961463928,0.013048938475549221
2022-05-07,9:45,"#Bitcoin Price
on 07/05/2021 👉 $57,382
on 07/05/2022 👉 $35,999
Profit/Loss in USD = -37.26%
Keep stacking sats!",bitcoin price on 07052021 57382 on 07052022 35999 profitloss in usd 3726 keep stacking sats,0.06889358907938004,0.8780356645584106,0.053070761263370514
2022-05-07,9:45,$BTC - downtrend - 5/7/2022 11:37 - Timeframe : 40 min #BTC,btc downtrend 572022 timeframe 40 min btc,0.024976231157779694,0.6805386543273926,0.2944851517677307
2022-05-07,9:45,Next Super Blockchain is..🏅#blockchain #Cardano #BTC #Ethereum #cryptocurrency #BSC #Avalanche #SHIB #dogecoin #Solano…,next super blockchain isblockchain cardano btc ethereum cryptocurrency bsc avalanche shib dogecoin solano,0.05962764099240303,0.9266339540481567,0.013738425448536873
2022-05-07,9:45,"@Ralvero Check out @BrogeOfficial Broge Token!
#BRISEZILLA #BRZILLA #BRC20 #BRISE #BITGERT #BRISECHAIN #SHIBA #BABYDOGE #KISHUINU #SHINJA #SAITAMAINU #DOGE #PITBULL #BTC #ETHEREUM #BINANCE #CARDANO #SOLANO #DOKEN",ralvero check out brogeofficial broge token brisezilla brzilla brc20 brise bitgert brisechain shiba babydoge kishuinu shinja saitamainu doge pitbull btc ethereum binance cardano solano doken,0.04707983881235123,0.9059780836105347,0.046942099928855896
2022-05-07,9:45,"What is your Market Sentiment for #Bitcoin and #Crypto right now?💥

Bullish                   Neutral                   Bearish
   👇                           👇                           👇",what is your market sentiment for bitcoin and crypto right now bullish neutral bearish,0.06381595879793167,0.9003179669380188,0.035866089165210724
2022-05-07,9:45,"@flomontoya_ @RhymingBitcoin @BVBTC @OtherAlias #BitcoinArt is a thing and it’s beautiful, I gotta say! Very impressed with the beauty and originality! 👌🏻 

Keen to explore more &amp; help promote as this is also a form of increasing global knowledge of the existence and beauty of #Bitcoin as sound money &amp; savings technology.",flomontoya rhymingbitcoin bvbtc otheralias bitcoinart is a thing and its beautiful i gotta say very impressed with the beauty and originality keen to explore more help promote as this is also a form of increasing global knowledge of the existence and beauty of bitcoin as sound money savings technology,0.7088600397109985,0.28326135873794556,0.007878588512539864
2022-05-07,9:45,@stevejonnshon #BTC #ETH its really most successful every year in The fam,stevejonnshon btc eth its really most successful every year in the fam,0.8488134741783142,0.13727642595767975,0.013910074718296528
2022-05-07,9:45,"@TheCryptoLark Remember: Every year 15bn US$ worth of new #Bitcoin potentially  hit the market via mining.

And that is the reason why everybody is trying to lure new suckers in. 

#Bitcoin #ponzi",thecryptolark every year 15bn us worth of new bitcoin potentially hit the market via mining and that is the reason why everybody is trying to lure new suckers in bitcoin ponzi,0.05157608538866043,0.9031147956848145,0.04530909284949303
2022-05-07,9:45,"$100k this year is still happening. 
Just a matter of time
#Bitcoin",100k this year is still happening just a matter of time bitcoin,0.060527607798576355,0.9255645275115967,0.013907824642956257
2022-05-07,9:45,"@Ralvero Check out Broge @BrogeOfficial the Doge of #Bitgert chain!
#BRISEZILLA #BRZILLA #BRC20 #BRISE #BITGERT #BRISECHAIN #SHIBA #BABYDOGE #KISHUINU #SHINJA #SAITAMAINU #DOGE #PITBULL #BTC #ETHEREUM #BINANCE #CARDANO #SOLANO #DOKEN",ralvero check out broge brogeofficial the doge of bitgert chain brisezilla brzilla brc20 brise bitgert brisechain shiba babydoge kishuinu shinja saitamainu doge pitbull btc ethereum binance cardano solano doken,0.040605053305625916,0.918268620967865,0.04112628102302551
2022-05-07,9:45,@bitminster Mayer Multiple is my way but I always sell some shoes for the dip! 🧡💋 #Bitcoin,bitminster mayer multiple is my way but i always sell some shoes for the dip bitcoin,0.038047779351472855,0.9276477098464966,0.034304458647966385
2022-05-07,9:45,Power is fluid - #Bitcoin,power is fluid bitcoin,0.03844514116644859,0.9451267123222351,0.016428129747509956
2022-05-07,9:45,"@Riderland_ This project has a very bright future, because I really think this project is too perfect to be true. This is a very cool and innovative project. The future belongs to such projects. 

@atik8882 
@BillalM68295993 
@Niloy7878  

 #Airdrop #Airdrops #Bitcoin #Crypto #BSC #NFT",riderland this project has a very bright future because i really think this project is too perfect to be true this is a very cool and innovative project the future belongs to such projects atik8882 billalm68295993 niloy7878 airdrop airdrops bitcoin crypto bsc nft,0.19546280801296234,0.7950111627578735,0.009525995701551437
2022-05-07,9:45,#Bitcoin  down                          #nasdaq down.👇                               Pakistani stock market down.👇   #amazon down                                       #tesla down                                               #tenup @TenupNation,bitcoin down nasdaq down pakistani stock market down amazon down tesla down tenup tenupnation,0.025119805708527565,0.14726577699184418,0.8276143670082092
2022-05-07,9:45,"To everyone that feels the world is fucked up and unjust: 

If you stop using government money, you stop giving them power, you stop funding their wars, their experiments, their corruption and their madness. 

Learn (deeply) about, buy and use #Bitcoin and take back control.",to everyone that feels the world is fucked up and if you stop using government money you stop giving them power you stop funding their wars their experiments their corruption and their madness learn deeply about buy and use bitcoin and take back control,0.037580862641334534,0.9114959239959717,0.05092327296733856
2022-05-07,9:45,PoW enables #Bitcoin to be real money. PoS can never achieve this.,pow enables bitcoin to be real money pos can never achieve this,0.0706692487001419,0.9043658971786499,0.024964798241853714
2022-05-07,9:45,"Your car, your home is not worth more.

The dollar is just worth less.

This is why #bitcoin is the futur!",your car your home is not worth more the dollar is just worth less this is why bitcoin is the futur,0.031772907823324203,0.873924970626831,0.09430211037397385
2022-05-07,9:45,@stevejonnshon #BTC will be the most successful in 2022,stevejonnshon btc will be the most successful in 2022,0.7813764214515686,0.2103896588087082,0.008233961649239063
2022-05-07,9:45,What happened with #Cryptocrash 🙁.  #cryptotrading #Cryptocom #btc #BTC #cryptocurrency #cryptocurrencies,what happened with cryptocrash cryptotrading cryptocom btc btc cryptocurrency cryptocurrencies,0.02220907434821129,0.9098042249679565,0.0679866373538971
2022-05-07,9:45,"Higher interest rates = Higher borrowing costs 

To dumb this down further = Bad for the economy 

This is why i keep saying a new ATH on #Bitcoin and #Crypto as a whole will take time. If people cannot afford to pay for daily bits, they are not going to buy other assets",higher interest rates higher borrowing costs to dumb this down further bad for the economy this is why i keep saying a new ath on bitcoin and crypto as a whole will take time if people cannot afford to pay for daily bits they are not going to buy other assets,0.05684572830796242,0.17967703938484192,0.7634772658348083
2022-05-07,9:45,It doesn't matter if my money goes.  he goes to pimps like you 💰 it's hard for my money #btc  #Bitcoin  #2022 #doge #shiba #clv #vcf #dollar #usd #abd #borsa #kripto #curses #cennettenkovulanlar #zebaniler (t14 #cino #bad #cripto #coin #binance #coinbase,it does not matter if my money goes he goes to pimps like you it is hard for my money btc bitcoin 2022 doge shiba clv vcf dollar usd abd borsa kripto curses cennettenkovulanlar zebaniler t14 cino bad cripto coin binance coinbase,0.03532715514302254,0.9205423593521118,0.04413050413131714
2022-05-07,9:45,#BTC is now at $35999.13,btc is now at 3599913,0.028679603710770607,0.9230930209159851,0.048227306455373764
2022-05-07,9:45,"stop fucking comparing #Bitcoin 's past price action with the actual one!

Nowdays market is totally different!",stop fucking comparing bitcoin past price action with the actual one nowdays market is totally different,0.02868359349668026,0.8673557043075562,0.10396066308021545
2022-05-07,9:45,"In seven days God created earth, in 7 seconds we lost our #Bitcoin",in seven days god created earth in 7 seconds we lost our bitcoin,0.028649263083934784,0.36557531356811523,0.6057754158973694
2022-05-07,9:45,"If you are holding $atc

1️⃣1.000.000 $atc, your are a future Billionaire.

2️⃣100.000 $atc, you are a future millionaires.

3️⃣10.000 $atc, 🔥🔥

💎💎💎
WAGMI!!!🚀🚀🚀🚀🚀🌒🔥🔥🔥🔥🔥🔥🔥🔥

On CG and CMC
Buy on raydium or jupswap

#btc #solana #doge #x1000GEM #Airdrops #samo #Sol",if you are holding atc 11000000 atc your are a future billionaire 2100000 atc you are a future millionaires 310000 atc wagmi on cg and cmc buy on raydium or jupswap btc solana doge x1000gem airdrops samo sol,0.05184368044137955,0.9332539439201355,0.01490235049277544
2022-05-07,9:45,I haven't sold 1 #Bitcoin sat!,i have not sold 1 bitcoin sat,0.046430304646492004,0.9216932058334351,0.03187655285000801
2022-05-07,9:45,"#SeasonalTokens #CryptoMining #CyclicalInvesting #BTC

Farm rewards 💰

The farm pays out rewards to liquidity providers for the token/ETH trading pairs in a ratio changing every 9 months. 

If initially, Spring has the lowest reward, nine months later Spring will have",seasonaltokens cryptomining cyclicalinvesting btc farm rewards the farm pays out rewards to liquidity providers for the tokeneth trading pairs in a ratio changing every 9 months if initially spring has the lowest reward nine months later spring will have,0.044985443353652954,0.8960846066474915,0.05892994999885559
2022-05-07,9:45,Quick blatt up to around 37K for #Bitcoin makes for a nice Bart Simpson pattern.. Added a bit of $LUNA at $73.00 today just incase. Adding that to @CrescentHub $LUNA/$bCre pool later..,quick blatt up to around 37k for bitcoin makes for a nice bart simpson pattern added a bit of luna at 7300 today just incase adding that to crescenthub luna bcre pool later,0.17610883712768555,0.7976896166801453,0.026201477274298668
2022-05-07,9:45,Whales are buying more #bitcoin👀,whales are buying more bitcoin,0.535460352897644,0.4430442750453949,0.021495327353477478
2022-05-07,9:45,"Current #Bitcoin price is $35,999.87",current bitcoin price is 3599987,0.019193613901734352,0.9384524822235107,0.04235389083623886
2022-05-07,9:45,@stevejonnshon I think #btc have so much potential,stevejonnshon i think btc have so much potential,0.16499337553977966,0.8256577253341675,0.009348863735795021
2022-05-07,9:45,"I´m giving 0.1 #btc   #bitcoin   to the first 1000 people who follows and retweets!! #cryptocurrency #crypto
Drop your wallet",im giving 01 btc bitcoin to the first 1000 people who follows and retweets cryptocurrency crypto drop your wallet,0.026501407846808434,0.9363441467285156,0.03715449199080467
2022-05-07,9:45,"#ETH is so backwards, it still uses *gas*💨😂  #Bitcoin is real power🔋⚡️",eth is so backwards it still uses gas bitcoin is real power,0.13611456751823425,0.8497088551521301,0.014176514931023121
2022-05-07,9:45,"@Coinw_exchange I think #Bitcoin DOWN  💯
Thank you so much for gift join friend quick,This project is very good 

@newton_money
@Loton37 @John_orian",coinwexchange i think bitcoin down thank you so much for gift join friend quickthis project is very good newtonmoney loton37 johnorian,0.5083133578300476,0.46532708406448364,0.02635960839688778
2022-05-07,9:45,@bitminster Bought every dip since black swan 2020... I'm still here and all my #Bitcoin with me..,bitminster bought every dip since black swan 2020 i am still here and all my bitcoin with me,0.09851786494255066,0.8873142600059509,0.014167805202305317
2022-05-07,9:45,"Waiting in trading in very important
#forex #Stocks #crypto #Bitcoin #finance",waiting in trading in very important forex stocks crypto bitcoin finance,0.056261543184518814,0.9175043106079102,0.026234157383441925
2022-05-07,9:45,"One positive thought in your mind, you can change your whole life.....
#SeasonalTokens #CryptoMining #CyclicalInvesting #BTC",one positive thought in your mind you can change your whole life seasonaltokens cryptomining cyclicalinvesting btc,0.2236432135105133,0.761405348777771,0.014951523393392563
2022-05-07,9:45,"Whould it be possible to add automatically and on a daily basis, the costs of energy consumption when using/farming #BTC to the value of Bitcoin? Or is it already the case? Hashrate ↗️ = more miners = ↗️ energy costs = added value for BTC",whould it be possible to add automatically and on a daily basis the costs of energy consumption when usingfarming btc to the value of bitcoin or is it already the case hashrate more miners energy costs added value for btc,0.07032912224531174,0.9093994498252869,0.020271429792046547
2022-05-07,9:45,@AirdropMoonPad #Baby #Bitcoin perfect project @Ilon_Bender  @oleg @OlegPopovich6,airdropmoonpad baby bitcoin perfect project ilonbender oleg olegpopovich6,0.10512902587652206,0.8803210258483887,0.01454991940408945
2022-05-07,9:45,"@Meta_UFO I like this project
#DOGE #bitcoin #ROSE
@ramblingsloa 
@robertwil21 
@_taleesha_",metaufo i like this project doge bitcoin rose ramblingsloa robertwil21 taleesha,0.12224207073450089,0.8616489171981812,0.016109030693769455
2022-05-07,9:45,Current #Bitcoin Price is $36003 #BTC #Crypto,current bitcoin price is 36003 btc crypto,0.02144569903612137,0.9526230692863464,0.025931287556886673
2022-05-07,9:45,"@CATB3AN5 Followed 🤝
For other plebs, follow me for instant follow-back. 

#Bitcoin only!",catb3an5 followed for other plebs follow me for instant followback bitcoin only,0.02931053191423416,0.9468222260475159,0.023867275565862656
2022-05-07,9:45,@Lenis_Hammilton Don't hesitate #BTC is the best,lenishammilton do not hesitate btc is the best,0.06660083681344986,0.9195044636726379,0.013894732110202312
2022-05-07,9:45,Don't look down upon an ordinary photograph. It's the roots. Just like #Bitcoin #ETH .,do not look down upon an ordinary photograph it is the roots just like bitcoin eth,0.031463854014873505,0.9362009763717651,0.03233509883284569
2022-05-07,9:45,"@TheCryptoLark There is some hope for you @TheCryptoLark: If the #FederalReserve overdoes interest hikes and kills the economy, guess what will happen to #interestrates? People could throw it back into #bitcoin or if they are unemployed by then on #food…",thecryptolark there is some hope for you if the federalreserve overdoes interest hikes and kills the economy guess what will happen to interestrates people could throw it back into bitcoin or if they are unemployed by then on food,0.031201981008052826,0.4936411380767822,0.47515684366226196
2022-05-07,9:45,Thinking you’re late to #Bitcoin is like thinking you’re late to the internet in January 1998.,thinking youre late to bitcoin is like thinking youre late to the internet in january 1998,0.025035101920366287,0.7803242802619934,0.1946406066417694
2022-05-07,9:45,"The current BTC price is $36026, buy #Bitcoin.  Source by CoinGecko",the current btc price is 36026 buy bitcoin source by coingecko,0.027803540229797363,0.9499961733818054,0.02220028266310692
2022-05-07,9:45,"@Cylumfinance Awesome project and congrats to the team for their efforts and dedication and highly appreciated the visionary thought of the projector and it Will create history.
@detra_price4 
@fredrickson_cin 
@marjorie_siddon
#CYLUM #CYM #BNB #BSC #cryptocurrency #binance #BTC #ETH",cylumfinance awesome project and congrats to the team for their efforts and dedication and highly appreciated the visionary thought of the projector and it will create history detraprice4 fredricksoncin marjoriesiddon cylum cym bnb bsc cryptocurrency binance btc eth,0.6233949661254883,0.3670044243335724,0.009600701741874218
2022-05-07,9:45,"#FGW #FunnyGameWorld #crypto #bitcoin #cryptocurrency #blockchain #bounty #binance #eth #token #coinsbit
I hope this company will become great successful company. I recommend to all investors. This is great opportunities for this century. Wonderful project.",fgw funnygameworld crypto bitcoin cryptocurrency blockchain bounty binance eth token coinsbit i hope this company will become great successful company i recommend to all investors this is great opportunities for this century wonderful project,0.5830547213554382,0.40618011355400085,0.010765135288238525
2022-05-07,9:45,I wouldn`t be surprised to see another 15% #Bitcoin correction.,i wouldnt be surprised to see another 15 bitcoin correction,0.07220832258462906,0.9075971245765686,0.020194580778479576
2022-05-07,9:45,"@Okan_crypted @BTCfuel @AdventureFrens These pros #ETH and #BTC has history. @AdventureFrens is coming with lots of adventure of which years from now, ☺ we will tell the story of how it stayed on the top🤑",okancrypted btcfuel adventurefrens these pros eth and btc has history adventurefrens is coming with lots of adventure of which years from now we will tell the story of how it stayed on the top,0.10580092668533325,0.8814525008201599,0.012746604159474373
2022-05-07,9:45,@IntEngineering UP only every four year cycle; #Bitcoin only tho 🧠🤙.,intengineering up only every four year cycle bitcoin only tho,0.04696634039282799,0.9376927614212036,0.015340844169259071
2022-05-07,9:45,@stevejonnshon I think #btc,stevejonnshon i think btc,0.061165016144514084,0.9168415665626526,0.02199339121580124
2022-05-07,9:45,There is wallstreetbets and then there are people like us on cryptos. dumping the next coin soon. announcement on telegram. link in desc #cryptopump #btc #coinpump #USDT #BNBcoins #Eth,there is wallstreetbets and then there are people like us on cryptos dumping the next coin soon announcement on telegram link in desc cryptopump btc coinpump usdt bnbcoins eth,0.03547004237771034,0.9461594223976135,0.018370548263192177
2022-05-07,9:45,"@kucoincom @FantomFDN #Fantom is a directed acyclic graph (DAG) based smart contract platform with high performance, security and high scalability. FTM has the technology to overcome the limitations of first generation blockchain platforms such as #Bitcoin. I See The Future of #FTM is quite Good.",kucoincom fantomfdn fantom is a directed acyclic graph dag based smart contract platform with high performance security and high scalability ftm has the technology to overcome the limitations of first generation blockchain platforms such as bitcoin i see the future of ftm is quite good,0.8849858045578003,0.1080915629863739,0.006922610569745302
2022-05-07,9:45,Why do you love #Bitcoin ❓,why do you love bitcoin,0.0327782928943634,0.936706006526947,0.03051568940281868
2022-05-07,9:45,"@axion_network Would I spend my #Bitcoin on Gucci? 
Undecided at the moment. 

#Axion, the people currency, I would. 
Just not yet.",axionnetwork would i spend my bitcoin on gucci undecided at the moment axion the people currency i would just not yet,0.06543157994747162,0.9105631709098816,0.024005191400647163
2022-05-07,9:45,@criptok803 @mgokhanduman #metaxlauncher #btc Good Project,criptok803 mgokhanduman metaxlauncher btc good project,0.2373819798231125,0.7522600293159485,0.010358002036809921
2022-05-07,9:45,"@MexcResearch @MEXC_Fans I guess #btc $BTC 39235$

@Sophia6R 
@sezgingamze85 
@SenequaZ",mexcresearch mexcfans i guess btc btc 39235 sophia6r sezgingamze85 senequaz,0.05983056128025055,0.9226248860359192,0.01754453033208847
2022-05-07,9:45,"@funnygameworld 
If you do build a great experience, customers tell each other about that. Word of mouth is very powerful.
#FGW #FunnyGameWorld #crypto #bitcoin #cryptocurrency #blockchain #bounty #binance #eth #token #coinsbit",funnygameworld if you do build a great experience customers tell each other about that word of mouth is very powerful fgw funnygameworld crypto bitcoin cryptocurrency blockchain bounty binance eth token coinsbit,0.08752553910017014,0.8998465538024902,0.012627937830984592
2022-05-07,9:45,"@EddieSabah @SupertopcatP @Awyee_is_Ghost CrYpTo or #Bitcoin? Do shitcoins have ethics? Some may evangelize that they do, but inevitably none of them are truly decentralized like Bitcoin. They represent fiat 2.0.",eddiesabah supertopcatp awyeeisghost crypto or bitcoin do shitcoins have ethics some may evangelize that they do but inevitably none of them are truly decentralized like bitcoin they represent fiat 20,0.05142943561077118,0.9280458092689514,0.020524801686406136
2022-05-07,9:45,"#BTC previous support of 36.000 seems to be a resistance now. We are locked between 35.500 and 36.000. In my opinion we will see a 15min red candle touches 34
300 &amp; then a 5min green candle pass through 37.500 just to kill every short position. Think as they do. They kill futures",btc previous support of 36000 seems to be a resistance now we are locked between 35500 and 36000 in my opinion we will see a 15min red candle touches 34 300 then a 5min green candle pass through 37500 just to kill every short position think as they do they kill futures,0.06120491772890091,0.8957318067550659,0.043063271790742874
2022-05-07,9:45,The $Luna Foundation has surpassed Tesla as the second largest corporate holder of #Bitcoin￼.,the luna foundation has surpassed tesla as the second largest corporate holder of bitcoin,0.733425498008728,0.25850778818130493,0.008066664449870586
2022-05-07,9:45,"YoBit AirDrop: Earn up to 4700 Fast Dollars daily: 
#yobit #etherum #bitcoin",yobit earn up to 4700 fast dollars yobit etherum bitcoin,0.162692129611969,0.8261923789978027,0.011115491390228271
2022-05-07,9:45,There must be a reason why you love #Bitcoin right..?,there must be a reason why you love bitcoin right,0.06922314316034317,0.9138182997703552,0.016958588734269142
2022-05-07,9:45,"@funnygameworld 
Thank you for this wonderful project, I hope this project goes well and more power to the community.
#FGW #FunnyGameWorld #crypto #bitcoin #cryptocurrency #blockchain #bounty #binance #eth #token #coinsbit",funnygameworld thank you for this wonderful project i hope this project goes well and more power to the community fgw funnygameworld crypto bitcoin cryptocurrency blockchain bounty binance eth token coinsbit,0.2115364521741867,0.7791171669960022,0.00934632495045662
2022-05-07,9:45,Millionaires are made from such market situation... #HODL your line and buy more if you could afford. #BTC #MemeTech #Ethereum #BNB,millionaires are made from such market situation hodl your line and buy more if you could afford btc memetech ethereum bnb,0.06932750344276428,0.9177778363227844,0.012894662097096443
2022-05-07,9:45,This is an amazing time to be stacking more #bitcoin!,this is an amazing time to be stacking more bitcoin,0.5918533802032471,0.39577072858810425,0.0123758465051651
2022-05-07,9:45,"#bitcoin would be at 100K already if all those #fiat #investors would stay on stock market.  Most have no clue about the #ethics behind #btc.  If they make money to trade in gold or horsesh.t, they go for it.  Big comments on #btc, but they add nothing. #satoshinakamoto #satoshin",bitcoin would be at 100k already if all those fiat investors would stay on stock market most have no clue about the ethics behind btc if they make money to trade in gold or horsesht they go for it big comments on btc but they add nothing satoshinakamoto satoshin,0.025203486904501915,0.920426607131958,0.05436991900205612
2022-05-07,9:45,#BTC has fallen by -6.81% in the last week. The price is currently $35996.02.,btc has fallen by 681 in the last week the price is currently 3599602,0.007997826673090458,0.030696524307131767,0.9613056778907776
2022-05-07,9:45,Stoke to see the exponential growth of people quitting meaningless fiat jobs and opting in for #bitcoin only jobs. LFG 🚀,stoke to see the exponential growth of people quitting meaningless fiat jobs and opting in for bitcoin only jobs lfg,0.07258974015712738,0.6594974398612976,0.2679128050804138
