Date,Time,Original tweet,Clean tweet,Positive,Neutral,Negative
2022-05-24,22:45,One of the most challenging aspects of #Bitcoin  is that it makes you completely reevaluate many aspects of life while everyone else around you remains right where they were.,one of the most challenging aspects of bitcoin is that it makes you completely reevaluate many aspects of life while everyone else around you remains right where they were,0.03436138853430748,0.678469717502594,0.28716886043548584
2022-05-24,22:45,"🟩 Block 737764 ⛏ ⛏

📅 24th May 2022, 22:32:47 GMT

📣 2,850 tx with a value of 45,407.584 ₿ ($1.34b 🇺🇸)

📣 distributed to 10,887 recipients 💎🙌

📣 19,048,531.25 ₿ (90.70729%) mined ⛏

📣 1,951,468.75 ₿ remaining 💰

#bitcoin #tictoknextblock",block 737764 24th may 2022 gmt 2850 tx with a value of 45407584 134b distributed to 10887 recipients 1904853125 9070729 mined 195146875 remaining bitcoin tictoknextblock,0.05447031930088997,0.9210994839668274,0.024430138990283012
2022-05-24,22:45,#crypto #CardanoADA #doge #link #BTC my first buy in crypto in over a year ..I still think crypto is going down more but I do not want to risk this being the bottom..I do not think we will ever see these prices again,crypto cardanoada doge link btc my first buy in crypto in over a year i still think crypto is going down more but i do not want to risk this being the bottomi do not think we will ever see these prices again,0.06734831631183624,0.3603267967700958,0.5723248720169067
2022-05-24,22:45,okx 📌🔥 #BUYFEG #FEG $FEG #FEGTOKEN #FEGARMY #FEGEX #trading #Crypto #BTC #ETH #Saitama #SHIB #BabyDogeCoin #BabyDoge…,okx buyfeg feg feg fegtoken fegarmy fegex trading crypto btc eth saitama shib babydogecoin babydoge,0.05921581760048866,0.9234119057655334,0.0173722505569458
2022-05-24,22:45,"@doodle_homes I love it!

0x339396b58CeB4D10b5196a0986d21E260EB94Cc6

#NFTArtist #Drop #NFTGiveaway #ETH #Binance #NFTs #SHIB #NFTProject #BAYC #LUNA #BNB #nftcollectors #opensea #NFT #BTC #Tweets #NFTArt #Matic #NFTCommunity #SOL #Giveways #Giveaway",doodlehomes i love it 0x339396b58ceb4d10b5196a0986d21e260eb94cc6 nftartist drop nftgiveaway eth binance nfts shib nftproject bayc luna bnb nftcollectors opensea nft btc tweets nftart matic nftcommunity sol giveways giveaway,0.05225570872426033,0.9240358471870422,0.023708468303084373
2022-05-24,22:45,"@CryptoGemsCom Although the bear market has not ended, that won't stop me from buying #bitcoin.

I might also add $CVP which is capable of giving me a steady passive income.",cryptogemscom although the bear market has not ended that will not stop me from buying bitcoin i might also add cvp which is capable of giving me a steady passive income,0.6597126126289368,0.3291418254375458,0.011145557276904583
2022-05-24,22:45,"@TheMoonCarl Just buying as much until I am out of fiat 😂😂😂

#Bitcoin #BitcoinPizzaDay #crypto #gains #viral #hyped #NFTCommunity #NFT",themooncarl just buying as much until i am out of fiat bitcoin bitcoinpizzaday crypto gains viral hyped nftcommunity nft,0.1385945975780487,0.8404467105865479,0.020958729088306427
2022-05-24,22:45,"@coryklippsten @CelsiusNetwork @SwanBitcoin @coryklippsten has followed up fyi , thanks and sorry for being a pain . Looking forward to learning more about #btc and @SwanBitcoin",coryklippsten celsiusnetwork swanbitcoin coryklippsten has followed up fyi thanks and sorry for being a pain looking forward to learning more about btc and swanbitcoin,0.22276514768600464,0.7614049315452576,0.015829967334866524
2022-05-24,22:45,"@shibainuart @CoinDesk as #bitcoin  was about to rally. We are now testing lower support levels and this area should be bought for a bullish resolution to the upside

@Sz_09y is a super underrated bitcoiner
I’ve been taking her tweets and tips seriously &amp; I’ve  been doing really great

Follow her",shibainuart coindesk as bitcoin was about to rally we are now testing lower support levels and this area should be bought for a bullish resolution to the upside sz09y is a super underrated bitcoiner ive been taking her tweets and tips seriously ive been doing really great follow her,0.7990458011627197,0.14982880651950836,0.051125433295965195
2022-05-24,22:45,"@elliotrades The metaverse is an undeniable crypto bubble

Prices are down &amp; most shitcoins wont recover.

Staying focused during this bear is the play of a century IMO.

Don't listen to these fools - Be smart, just buy #Bitcoin ✍️",elliotrades the metaverse is an undeniable crypto bubble prices are down most shitcoins wont recover staying focused during this bear is the play of a century imo do not listen to these fools be smart just buy bitcoin,0.0330134741961956,0.7808073163032532,0.18617922067642212
2022-05-24,22:45,"@Nearprotocolfam $NEAR is literally the sleeping giant of 2022.👌
Once #btc market sentiment recovers we shall see another #DeFi summer soon.👀

$NEAR's ready for it, ecosystem TVL grew tremendously the past months, current price is a steal right now.💯",nearprotocolfam near is literally the sleeping giant of 2022 once btc market sentiment recovers we shall see another defi summer soon near ready for it ecosystem tvl grew tremendously the past months current price is a steal right now,0.12586148083209991,0.4020741283893585,0.47206440567970276
2022-05-24,22:45,"👋 A new block was found on the #Bitcoin network. We're at block height 737764, current #bitcoin price is $29529.61 and there are 195144372690011 #sats left to mine.",a new block was found on the bitcoin network we are at block height 737764 current bitcoin price is 2952961 and there are 195144372690011 sats left to mine,0.025381481274962425,0.9269461035728455,0.04767247661948204
2022-05-24,22:45,pump it already #btc,pump it already btc,0.09576643258333206,0.8813560009002686,0.022877536714076996
2022-05-24,22:45,@zhusu @Bitcoin #LUFFYCREW #LUFFY $LUFFY #LUFFYV2 #LUFFYTOKEN #SHIB #DOGE #Binance #Coinbase #Metaverse #cryptocurrency #BTC #ETH #nft #NFTs @luffyinutoken @LuffyTurkey #LUFFYCREW #LUFFY $LUFFY #LUFFYV2 #LUFFYTOKEN #SHIB #DOGE #Binance #Coinbase #Metaverse @luffyinutoken @LuffyTurkey #gateio,zhusu bitcoin luffycrew luffy luffy luffyv2 luffytoken shib doge binance coinbase metaverse cryptocurrency btc eth nft nfts luffyinutoken luffyturkey luffycrew luffy luffy luffyv2 luffytoken shib doge binance coinbase metaverse luffyinutoken luffyturkey gateio,0.041035592555999756,0.9387912750244141,0.020173173397779465
2022-05-24,22:45,"#BTC Maximalists would argue that you should hold Bitcoin through thick and thin. I beg to differ. 

Use DAI or other stablecoins during uncertainty.",btc maximalists would argue that you should hold bitcoin through thick and thin i beg to differ use dai or other stablecoins during uncertainty,0.03404202312231064,0.9065903425216675,0.05936767905950546
2022-05-24,22:45,"Being a shitcoiner is really unfortunate. You’re either really evil or really stupid. There is no in between. Refusing to understand this is what manifests as a fear of #bitcoin maximalism, or whatever that is.",being a shitcoiner is really unfortunate youre either really evil or really stupid there is no in between refusing to understand this is what manifests as a fear of bitcoin maximalism or whatever that is,0.027216222137212753,0.6012973785400391,0.3714863955974579
2022-05-24,22:45,"So crazy how things will work out. 

There's 100 Million satoshi's in 1 #Bitcoin 

So when 1 #BTC = $1 Million, satoshi's (sats) will be worth $0.01 each.

That'll be at roughly double the current market cap of what gold is right now. 

It'll be glorious.",so crazy how things will work out there is 100 million satoshi in 1 bitcoin so when 1 btc 1 million satoshi sats will be worth 001 each that ll be at roughly double the current market cap of what gold is right now it will be glorious,0.11357395350933075,0.8715428113937378,0.014883311465382576
2022-05-24,22:45,@Bitcoin @ScottMinerd @GuggenheimPtnrs #LUFFYCREW #LUFFY $LUFFY #LUFFYV2 #LUFFYTOKEN #SHIB #DOGE #Binance #Coinbase #Metaverse #cryptocurrency #BTC #ETH #nft #NFTs @luffyinutoken @LuffyTurkey #LUFFYCREW #LUFFY $LUFFY #LUFFYV2 #LUFFYTOKEN #SHIB #DOGE #Binance #Coinbase #Metaverse @luffyinutoken @LuffyTurkey #gateio,bitcoin scottminerd guggenheimptnrs luffycrew luffy luffy luffyv2 luffytoken shib doge binance coinbase metaverse cryptocurrency btc eth nft nfts luffyinutoken luffyturkey luffycrew luffy luffy luffyv2 luffytoken shib doge binance coinbase metaverse luffyinutoken luffyturkey gateio,0.04860060662031174,0.9322617650032043,0.019137591123580933
2022-05-24,22:45,"The man who would be your #bitcoin inventor never intended for you to own anything physical. He only intended for you to own something digital. 

A crypto-utopian dream built on a crypto-anarchist philosophy. 

Make no mistake, this is a revolution. Yours. Not anyone else’s.",the man who would be your bitcoin inventor never intended for you to own anything physical he only intended for you to own something digital a cryptoutopian dream built on a cryptoanarchist philosophy make no mistake this is a revolution yours not anyone elses,0.03762023523449898,0.9399398565292358,0.02243989333510399
2022-05-24,22:45,@invest_answers #BTC is digital gold 🔥🔥🔥💕💕💕 James our lighthouse in the middle of this storm 💕💕💕Thanks always💕💕💕,investanswers btc is digital gold james our lighthouse in the middle of this storm thanks always,0.5236957669258118,0.46266257762908936,0.013641725294291973
2022-05-24,22:45,@Bitboy_Crypto @RichardHeartWin #bitcoin Maxis are the worst things in crypto. No logic or cryptically thinking can ever be used with them.,bitboycrypto richardheartwin bitcoin maxis are the worst things in crypto no logic or cryptically thinking can ever be used with them,0.023520922288298607,0.8003316521644592,0.1761474907398224
2022-05-24,22:45,"In some countries women aren’t allowed to bank themselves. 

#bitcoin fixes this. 

#Freedom",in some countries women aren not allowed to bank themselves bitcoin fixes this freedom,0.028925130143761635,0.8102415204048157,0.16083335876464844
2022-05-24,22:45,@Bitcoin #LUFFYCREW #LUFFY $LUFFY #LUFFYV2 #LUFFYTOKEN #SHIB #DOGE #Binance #Coinbase #Metaverse #cryptocurrency #BTC #ETH #nft #NFTs @luffyinutoken @LuffyTurkey #LUFFYCREW #LUFFY $LUFFY #LUFFYV2 #LUFFYTOKEN #SHIB #DOGE #Binance #Coinbase #Metaverse @luffyinutoken @LuffyTurkey #gateio,bitcoin luffycrew luffy luffy luffyv2 luffytoken shib doge binance coinbase metaverse cryptocurrency btc eth nft nfts luffyinutoken luffyturkey luffycrew luffy luffy luffyv2 luffytoken shib doge binance coinbase metaverse luffyinutoken luffyturkey gateio,0.044107306748628616,0.9372011423110962,0.018691593781113625
2022-05-24,22:45,@SquawkCNBC @Bitcoin @RayDalio #LUFFYCREW #LUFFY $LUFFY #LUFFYV2 #LUFFYTOKEN #SHIB #DOGE #Binance #Coinbase #Metaverse #cryptocurrency #BTC #ETH #nft #NFTs @luffyinutoken @LuffyTurkey #LUFFYCREW #LUFFY $LUFFY #LUFFYV2 #LUFFYTOKEN #SHIB #DOGE #Binance #Coinbase #Metaverse @luffyinutoken @LuffyTurkey #gateio,squawkcnbc bitcoin raydalio luffycrew luffy luffy luffyv2 luffytoken shib doge binance coinbase metaverse cryptocurrency btc eth nft nfts luffyinutoken luffyturkey luffycrew luffy luffy luffyv2 luffytoken shib doge binance coinbase metaverse luffyinutoken luffyturkey gateio,0.03914245218038559,0.9396581053733826,0.021199384704232216
2022-05-24,22:45,"There is the timechain (#Bitcoin) and there are other blockchains. One matters, the other don’t.",there is the timechain bitcoin and there are other blockchains one matters the other don not,0.026039626449346542,0.9356406927108765,0.03831974416971207
2022-05-24,22:45,"Even when the market looks grim,
Loading up on #btc and #eth will alter your life forever...

#CryptoNews",even when the market looks grim loading up on btc and eth will alter your life forever cryptonews,0.04313834384083748,0.9010494351387024,0.0558122843503952
2022-05-24,22:45,"i bought #Bitcoin  at $13,000 

Ethereum at $200 

Dogecoin at $0.02 

Folloe me if you want to be rich",i bought bitcoin at 13000 ethereum at 200 dogecoin at 002 folloe me if you want to be rich,0.04210318624973297,0.9367942214012146,0.0211026594042778
2022-05-24,22:45,"Can someone shill me some good #Bitcoin and #crypto accounts? 

Not nft related, just some dudes with the thread and the market analysis and all that cool stuff

 Thank you!",can someone shill me some good bitcoin and crypto accounts not nft related just some dudes with the thread and the market analysis and all that cool stuff thank you,0.07338006794452667,0.9078978300094604,0.01872209832072258
2022-05-24,22:45,@Cointelegraph It’s hilarious. No one ducking knows other than the composite operator. They are giving you plenty of time to get out at these prices though…. That isn’t normal…. Have fun. #btc,cointelegraph its hilarious no one ducking knows other than the composite operator they are giving you plenty of time to get out at these prices though that isn not normal have fun btc,0.06432850658893585,0.9148198366165161,0.02085161581635475
2022-05-24,22:45,@BitMEX @islandgrlcurves @inkyall @AronsenLinuss @kchandras4 @Vishura73484520 @adelgamarza14 @masdineronline @ajarbaezen @marichuy0302__ @w1n_xx #LUFFYCREW #LUFFY $LUFFY #LUFFYV2 #LUFFYTOKEN #SHIB #DOGE #Binance #Coinbase #Metaverse #cryptocurrency #BTC #ETH #nft #NFTs @luffyinutoken @LuffyTurkey #LUFFYCREW #LUFFY $LUFFY #LUFFYV2 #LUFFYTOKEN #SHIB #DOGE #Binance #Coinbase #Metaverse @luffyinutoken @LuffyTurkey #gateio,bitmex islandgrlcurves inkyall aronsenlinuss kchandras4 vishura73484520 adelgamarza14 masdineronline ajarbaezen marichuy0302 w1nxx luffycrew luffy luffy luffyv2 luffytoken shib doge binance coinbase metaverse cryptocurrency btc eth nft nfts luffyinutoken luffyturkey luffycrew luffy luffy luffyv2 luffytoken shib doge binance coinbase metaverse luffyinutoken luffyturkey gateio,0.05235280469059944,0.9280565977096558,0.0195905938744545
2022-05-24,22:45,@BitMEX @BanxaOfficial #LUFFYCREW #LUFFY $LUFFY #LUFFYV2 #LUFFYTOKEN #SHIB #DOGE #Binance #Coinbase #Metaverse #cryptocurrency #BTC #ETH #nft #NFTs @luffyinutoken @LuffyTurkey #LUFFYCREW #LUFFY $LUFFY #LUFFYV2 #LUFFYTOKEN #SHIB #DOGE #Binance #Coinbase #Metaverse @luffyinutoken @LuffyTurkey #gateio,bitmex banxaofficial luffycrew luffy luffy luffyv2 luffytoken shib doge binance coinbase metaverse cryptocurrency btc eth nft nfts luffyinutoken luffyturkey luffycrew luffy luffy luffyv2 luffytoken shib doge binance coinbase metaverse luffyinutoken luffyturkey gateio,0.03659551218152046,0.9430971741676331,0.02030731551349163
2022-05-24,22:45,#BTC is now at $29530.43,btc is now at 2953043,0.027822939679026604,0.9332950711250305,0.03888202831149101
2022-05-24,22:45,"@lexfridman Hello my friend. Please help me with $ 1. You will not be poor with $ 1, but if a thousand people help me with a dollar, I will be rich. Please deposit one dollar for me
usdt_trc20

TX7C8cHCSCoYFSzZ69J8an8AiQctBWNUW3

#BSCGems  #BNB #ETH #SOL #BTC #DeFi #NFT #Metave",lexfridman hello my friend please help me with 1 you will not be poor with 1 but if a thousand people help me with a dollar i will be rich please deposit one dollar for me usdttrc20 tx7c8chcscoyfszz69j8an8aiqctbwnuw3 bscgems bnb eth sol btc defi nft metave,0.10442836582660675,0.8770962953567505,0.018475312739610672
2022-05-24,22:45,"Updated bio of @okcoin: ""We’re a global cryptocurrency exchange with the lowest fees around. A better way to #Bitcoin — and more.""",updated bio of were a global cryptocurrency exchange with the lowest fees around a better way to bitcoin and more,0.09499538689851761,0.89377760887146,0.011226990260183811
2022-05-24,22:45,@MetaMask @skiffprivacy #LUFFYCREW #LUFFY $LUFFY #LUFFYV2 #LUFFYTOKEN #SHIB #DOGE #Binance #Coinbase #Metaverse #cryptocurrency #BTC #ETH #nft #NFTs @luffyinutoken @LuffyTurkey #LUFFYCREW #LUFFY $LUFFY #LUFFYV2 #LUFFYTOKEN #SHIB #DOGE #Binance #Coinbase #Metaverse @luffyinutoken @LuffyTurkey #gateio,metamask skiffprivacy luffycrew luffy luffy luffyv2 luffytoken shib doge binance coinbase metaverse cryptocurrency btc eth nft nfts luffyinutoken luffyturkey luffycrew luffy luffy luffyv2 luffytoken shib doge binance coinbase metaverse luffyinutoken luffyturkey gateio,0.03728772699832916,0.9406695365905762,0.022042663767933846
2022-05-24,22:45,@ConsenSys @MetaMask #LUFFYCREW #LUFFY $LUFFY #LUFFYV2 #LUFFYTOKEN #SHIB #DOGE #Binance #Coinbase #Metaverse #cryptocurrency #BTC #ETH #nft #NFTs @luffyinutoken @LuffyTurkey #LUFFYCREW #LUFFY $LUFFY #LUFFYV2 #LUFFYTOKEN #SHIB #DOGE #Binance #Coinbase #Metaverse @luffyinutoken @LuffyTurkey #gateio,consensys metamask luffycrew luffy luffy luffyv2 luffytoken shib doge binance coinbase metaverse cryptocurrency btc eth nft nfts luffyinutoken luffyturkey luffycrew luffy luffy luffyv2 luffytoken shib doge binance coinbase metaverse luffyinutoken luffyturkey gateio,0.03889590874314308,0.9406681060791016,0.020435966551303864
2022-05-24,22:45,@SquawkCNBC @RayDalio #Bitcoin is the answer! Freedom,squawkcnbc raydalio bitcoin is the answer freedom,0.04340076446533203,0.9364250302314758,0.020174158737063408
2022-05-24,22:45,@ConsenSys @MetaMask @MMInstitutional #LUFFYCREW #LUFFY $LUFFY #LUFFYV2 #LUFFYTOKEN #SHIB #DOGE #Binance #Coinbase #Metaverse #cryptocurrency #BTC #ETH #nft #NFTs @luffyinutoken @LuffyTurkey #LUFFYCREW #LUFFY $LUFFY #LUFFYV2 #LUFFYTOKEN #SHIB #DOGE #Binance #Coinbase #Metaverse @luffyinutoken @LuffyTurkey #gateio,consensys metamask mminstitutional luffycrew luffy luffy luffyv2 luffytoken shib doge binance coinbase metaverse cryptocurrency btc eth nft nfts luffyinutoken luffyturkey luffycrew luffy luffy luffyv2 luffytoken shib doge binance coinbase metaverse luffyinutoken luffyturkey gateio,0.03862914815545082,0.9404069781303406,0.020963912829756737
2022-05-24,22:45,@MetaMask #LUFFYCREW #LUFFY $LUFFY #LUFFYV2 #LUFFYTOKEN #SHIB #DOGE #Binance #Coinbase #Metaverse #cryptocurrency #BTC #ETH #nft #NFTs @luffyinutoken @LuffyTurkey #LUFFYCREW #LUFFY $LUFFY #LUFFYV2 #LUFFYTOKEN #SHIB #DOGE #Binance #Coinbase #Metaverse @luffyinutoken @LuffyTurkey #gateio,metamask luffycrew luffy luffy luffyv2 luffytoken shib doge binance coinbase metaverse cryptocurrency btc eth nft nfts luffyinutoken luffyturkey luffycrew luffy luffy luffyv2 luffytoken shib doge binance coinbase metaverse luffyinutoken luffyturkey gateio,0.041601330041885376,0.9394336342811584,0.018965022638440132
2022-05-24,22:45,@manbirmarwah @MetaMask @ETHDubaiConf @httpJunkie @francescoswiss @ConsenSys @ETHGlobal #LUFFYCREW #LUFFY $LUFFY #LUFFYV2 #LUFFYTOKEN #SHIB #DOGE #Binance #Coinbase #Metaverse #cryptocurrency #BTC #ETH #nft #NFTs @luffyinutoken @LuffyTurkey #LUFFYCREW #LUFFY $LUFFY #LUFFYV2 #LUFFYTOKEN #SHIB #DOGE #Binance #Coinbase #Metaverse @luffyinutoken @LuffyTurkey #gateio,manbirmarwah metamask ethdubaiconf httpjunkie francescoswiss consensys ethglobal luffycrew luffy luffy luffyv2 luffytoken shib doge binance coinbase metaverse cryptocurrency btc eth nft nfts luffyinutoken luffyturkey luffycrew luffy luffy luffyv2 luffytoken shib doge binance coinbase metaverse luffyinutoken luffyturkey gateio,0.04098649322986603,0.9352988004684448,0.023714685812592506
2022-05-24,22:45,"Why is our economy based on home sales and debt?! Are we stupid?

#Bitcoin solves this",why is our economy based on home sales and debt are we stupid bitcoin solves this,0.04198487475514412,0.8827995657920837,0.07521553337574005
2022-05-24,22:45,@MetaMask @coinbase #LUFFYCREW #LUFFY $LUFFY #LUFFYV2 #LUFFYTOKEN #SHIB #DOGE #Binance #Coinbase #Metaverse #cryptocurrency #BTC #ETH #nft #NFTs @luffyinutoken @LuffyTurkey #LUFFYCREW #LUFFY $LUFFY #LUFFYV2 #LUFFYTOKEN #SHIB #DOGE #Binance #Coinbase #Metaverse @luffyinutoken @LuffyTurkey #gateio,metamask coinbase luffycrew luffy luffy luffyv2 luffytoken shib doge binance coinbase metaverse cryptocurrency btc eth nft nfts luffyinutoken luffyturkey luffycrew luffy luffy luffyv2 luffytoken shib doge binance coinbase metaverse luffyinutoken luffyturkey gateio,0.03916982561349869,0.9405295848846436,0.020300572738051414
2022-05-24,22:45,"You can DM me, or comment on this tweet if need assistant. 🤗 #btc #BNB #Luno #Malaysia #matawangkripto #kripto #emasdigital #XRP #Litecoin",you can dm me or comment on this tweet if need assistant btc bnb luno malaysia matawangkripto kripto emasdigital xrp litecoin,0.030308391898870468,0.9481183290481567,0.021573197096586227
2022-05-24,22:45,"@FireBursts Argue, because I don’t want a future that has #bitcoin in it. Bitcoin would fail tremendously. I want dollars. I love dollars. And I am free.",firebursts argue because i don not want a future that has bitcoin in it bitcoin would fail tremendously i want dollars i love dollars and i am free,0.10374493151903152,0.8611759543418884,0.03507915884256363
2022-05-24,22:45,Current #Bitcoin Price is $29571 #BTC #Crypto,current bitcoin price is 29571 btc crypto,0.021289054304361343,0.9498576521873474,0.028853267431259155
2022-05-24,22:45,Everyone is trapped in the middle. People who bought above 40K and below 20K wont sell. Most buyers in crypto have weak hands and no sense of financial risk. A massive rug pull is coming to consume your soul. #btc,everyone is trapped in the middle people who bought above 40k and below 20k wont sell most buyers in crypto have weak hands and no sense of financial risk a massive rug pull is coming to consume your soul btc,0.019810153171420097,0.34841594099998474,0.631773829460144
2022-05-24,22:45,@0xMineWolf @BishopsEquation @GirlsWhoCode So you're going to buy #bitcoin and not ape into another failing not right click scam?,0xminewolf bishopsequation girlswhocode so you are going to buy bitcoin and not ape into another failing not right click scam,0.03689466044306755,0.9229825139045715,0.04012274742126465
2022-05-24,22:45,@CoinbaseExch #LUFFYCREW #LUFFY $LUFFY #LUFFYV2 #LUFFYTOKEN #SHIB #DOGE #Binance #Coinbase #Metaverse #cryptocurrency #BTC #ETH #nft #NFTs @luffyinutoken @LuffyTurkey #LUFFYCREW #LUFFY $LUFFY #LUFFYV2 #LUFFYTOKEN #SHIB #DOGE #Binance #Coinbase #Metaverse @luffyinutoken @LuffyTurkey #gateio,coinbaseexch luffycrew luffy luffy luffyv2 luffytoken shib doge binance coinbase metaverse cryptocurrency btc eth nft nfts luffyinutoken luffyturkey luffycrew luffy luffy luffyv2 luffytoken shib doge binance coinbase metaverse luffyinutoken luffyturkey gateio,0.043764907866716385,0.9370666742324829,0.01916833221912384
2022-05-24,22:45,"Less than 2% of the world owns #Bitcoin .

It’s still so early.",less than 2 of the world owns bitcoin its still so early,0.11232190579175949,0.8534294962882996,0.03424858674407005
2022-05-24,22:45,REALLY NICE PROJECT =&gt; @MemeTherapy_ #Memecoin  #Klaytn #bitcoin,really nice project gt memetherapy memecoin klaytn bitcoin,0.16373853385448456,0.8271018266677856,0.009159653447568417
2022-05-24,22:45,"📝🏦Federal Reserve’s Economic Well-Being of US Households in 2021 Report:
● 12% of US adults held cryptocurrency in 2021
● Only 3% of US adults used crypto for money transfers
● Most users kept crypto for speculation

#cryptocurrency #DeFi
#Bitcoin #Ethereum #btc #eth #web3",federal reserves economic wellbeing of us households in 2021 12 of us adults held cryptocurrency in 2021 only 3 of us adults used crypto for money transfers most users kept crypto for speculation cryptocurrency defi bitcoin ethereum btc eth web3,0.034762416034936905,0.9372945427894592,0.027943070977926254
2022-05-24,22:45,"@WatcherGuru #btc not #crypto,bro",watcherguru btc not cryptobro,0.03934873640537262,0.9381592273712158,0.022492030635476112
2022-05-24,22:45,@ThinkingBitmex That’s why I’m bullish ser #BTC is king we long BTC we short alts,thinkingbitmex thats why im bullish ser btc is king we long btc we short alts,0.08906958252191544,0.8683745265007019,0.04255589097738266
2022-05-24,22:45,"True or False:
Over 20% of #bitcoin is lost forever.",true or over 20 of bitcoin is lost forever,0.019124317914247513,0.42803189158439636,0.5528438091278076
2022-05-24,22:45,Who's the anti-#Bitcoin @saylor  and can they please debate?  #crypto,who is the antibitcoin saylor and can they please debate crypto,0.03681989014148712,0.9400836229324341,0.02309643104672432
2022-05-24,22:45,"The $SLP from @AxieInfinity is now at $0.00566 
📉 Is down -0.483% compare to 1 hour ago
📉 And is down -1.319% compare to 1 week ago
 #BTC #ETH #SLP",the slp from axieinfinity is now at 000566 is down 0483 compare to 1 hour ago and is down 1319 compare to 1 week ago btc eth slp,0.009217443875968456,0.025535810738801956,0.965246856212616
2022-05-24,22:45,"Do you think #Bitcoin is going to reach $100,000 in 2022? 📈🤔",do you think bitcoin is going to reach 100000 in 2022,0.1339571624994278,0.854508101940155,0.01153473649173975
2022-05-24,22:45,"Current Price:
#Bitcoin:$29,542.51
#Litecoin:$70.26
#dogecoin:$0.831
#Ethereum:$1,979.53
#EthereumClassic:$23.63
#BitcoinCash:$195.81",current,0.03294489160180092,0.9251602292060852,0.041894908994436264
2022-05-24,22:45,#bitcoin Is not black friday but black six month 🤣🤣,bitcoin is not black friday but black six month,0.030000898987054825,0.9283241629600525,0.04167492687702179
2022-05-24,22:45,Two underrated things about #Bitcoin: 1) It’s a trustless payment system that does not depend on a central authority. 2) counterfeit protection,two underrated things about 1 its a trustless payment system that does not depend on a central authority 2 counterfeit protection,0.041318006813526154,0.9025898575782776,0.05609213560819626
