Date,Time,Original tweet,Clean tweet,Positive,Neutral,Negative
2022-05-09,20:45,What a night. A few $BTC limit buy orders placed. GN #Bitcoin lets see what tomorrow brings.,what a night a few btc limit buy orders placed gn bitcoin lets see what tomorrow brings,0.06338192522525787,0.9134263396263123,0.023191682994365692
2022-05-09,20:45,@honey_xbt All you can do is a little DCA into #Bitcoin and #Ethereum and wait until next week,honeyxbt all you can do is a little dca into bitcoin and ethereum and wait until next week,0.02519882470369339,0.933059811592102,0.041741371154785156
2022-05-09,20:45,"#btc rsi is very low , this week #BTCUSDT  will bounce to 38k  #Bitcoin",btc rsi is very low this week btcusdt will bounce to 38k bitcoin,0.07269790023565292,0.09086818993091583,0.8364339470863342
2022-05-09,20:45,"El Salvador just bought the dip! 🇸🇻

500 coins at an average USD price of ~$30,744

#BTC #Bitcoin #Crypto #CryptoNews #Cryptocrash #cryptocurrencies #Cryptos",el salvador just bought the dip 500 coins at an average usd price of 30744 btc bitcoin crypto cryptonews cryptocrash cryptocurrencies cryptos,0.12020496279001236,0.8660231232643127,0.013771934434771538
2022-05-09,20:45,"We went from ""spend what you're willing to lose"" to panic selling. 🤣 💎 🙌
#Bitcoin #cryptocurrency #cryptotrading #CryptoNews",we went from spend what you are willing to lose to panic selling bitcoin cryptocurrency cryptotrading cryptonews,0.04885568097233772,0.9137576818466187,0.03738664463162422
2022-05-09,20:45,#IF #I #WAS #WHITE #ID #BUY #XLM #IOTA #XRP #XDC #ALGO #IF #WAS #NIGGA #ID #ADD #BITCOIN @NBC @MSNBC $GOLD $SILVER $PLAT,if i was white id buy xlm iota xrp xdc algo if was nigga id add bitcoin nbc msnbc gold silver plat,0.08945288509130478,0.8967750668525696,0.013772000558674335
2022-05-09,20:45,"@BAYC2745 Can you invite Mr $ETH Aand Mrs #BTC 

Think they need a couple of pointers. 👀",bayc2745 can you invite mr eth aand mrs btc think they need a couple of pointers,0.0473608672618866,0.9337713718414307,0.018867699429392815
2022-05-09,20:45,"@TheWhyOfFI Very good thread.

I was already down the #Bitcoin rabbit hole back then but I too supported Bernie for the same reasons.

But once you see the current system for everything it is, you realize you need to change the incentives.",thewhyoffi very good thread i was already down the bitcoin rabbit hole back then but i too supported bernie for the same reasons but once you see the current system for everything it is you realize you need to change the incentives,0.1151723712682724,0.8528515100479126,0.031976088881492615
2022-05-09,20:45,"Guys don't forget to set your orders:
0$ #BTC
0$ #ETH
And 0$ #SOL

Soon filled
Easy trade",guys do not forget to set your 0 btc 0 eth and 0 sol soon filled easy trade,0.046560563147068024,0.9275069832801819,0.02593238465487957
2022-05-09,20:45,"just in… $BTC got rugged 🤪

It’ll pop again. 🙌 you only lose if you sell. 
#Bitcoin #BTC #NFTs #CheebaEmu",just in btc got rugged itll pop again you only lose if you sell bitcoin btc nfts cheebaemu,0.06991381198167801,0.8867654800415039,0.04332071170210838
2022-05-09,20:45,"@rovercrc this time if BTC goes to around 10k, I'll buy at least 3 to 5 BTC for sure. nothing can stop #btc huge potential.",rovercrc this time if btc goes to around 10k i will buy at least 3 to 5 btc for sure nothing can stop btc huge potential,0.06972052901983261,0.8941760659217834,0.03610340133309364
2022-05-09,20:45,"Last year, I asked few people to invest in #Crypto

They said: Fucking NO

I called them fucking loosers n dump asses

2022: Plot twist, they’re not smiling 😉😉

#cryptocrash #cryptotrading  #Binance #Etherum #ETH #BTC #Bitcoin  #Dogecoin #SHIB #Solana #DOT #FTM 28% Luna #LUNA",last year i asked few people to invest in crypto they fucking no i called them fucking loosers n dump asses plot twist theyre not smiling cryptocrash cryptotrading binance etherum eth btc bitcoin dogecoin shib solana dot ftm 28 luna luna,0.06139223277568817,0.9097334146499634,0.028874384239315987
2022-05-09,20:45,"The Best trade right now is #LUNA at $1.00

#Bitcoin #BTCUSDT #cryptotrading #cryptocurrency #CryptoNews",the best trade right now is luna at 100 bitcoin btcusdt cryptotrading cryptocurrency cryptonews,0.07853592187166214,0.9069658517837524,0.014498255215585232
2022-05-09,20:45,"@whale_alert El Salvador President Just bought 500 #BTC  at an average price of $30,744.",whalealert el salvador president just bought 500 btc at an average price of 30744,0.09863126277923584,0.889726459980011,0.011642263270914555
2022-05-09,20:45,Buy the dip #Bitcoin #HarmonyONE,buy the dip bitcoin harmonyone,0.040775883942842484,0.934636652469635,0.024587482213974
2022-05-09,20:45,"@Sadeeque_keks @CryptoGemsCom @altcryptocom @BabyCatcoinBSC Are you ready to become a millionaire? It’s okay invest in $Babycats @BabyCatcoinBSC. 
#BTC   #Bnb #babycatcoinbsc #babycatcoin",sadeequekeks cryptogemscom altcryptocom babycatcoinbsc are you ready to become a millionaire its okay invest in babycats babycatcoinbsc btc bnb babycatcoinbsc babycatcoin,0.09059785306453705,0.8957377076148987,0.01366440113633871
2022-05-09,20:45,Rehab tomorrow! #Bitcoin #dip #stx #rehab,rehab tomorrow bitcoin dip stx rehab,0.08197902143001556,0.8633915781974792,0.05462941154837608
2022-05-09,20:45,"So as I told you earlier Algorithmic stable coins are shitty we are now witnessing the same with $UST , Rumours are that $LUNA sold off whooping 34k $BTC to peg back $UST to dollar causing bloodshed today. #Crypto #Cryptocrash #cryptocurrency #Bitcoin",so as i told you earlier algorithmic stable coins are shitty we are now witnessing the same with ust rumours are that luna sold off whooping 34k btc to peg back ust to dollar causing bloodshed today crypto cryptocrash cryptocurrency bitcoin,0.06711159646511078,0.6787623763084412,0.2541259825229645
2022-05-09,20:45,#HODL in a cold wallet to do you part in hastening the #Bitcoin supply shock.,hodl in a cold wallet to do you part in hastening the bitcoin supply shock,0.17283399403095245,0.7109448313713074,0.11622115224599838
2022-05-09,20:45,"@NFT_DROPNEWS I control my fear. Not the markets. I see 2 scenarios:
1/ #bitcoin goes $0. I lose my #btc. I DCA from there.
2/ It does what it has before and will go back up. I DCA'd down, and will continue to stack for a profit and hodl a current/future asset.

What's more likely?",nftdropnews i control my fear not the markets i see 2 1 bitcoin goes 0 i lose my btc i dca from there 2 it does what it has before and will go back up i dca d down and will continue to stack for a profit and hodl a currentfuture asset what is more likely,0.025703324005007744,0.12549223005771637,0.8488044738769531
2022-05-09,20:45,@asteriojorgo After the #BTC top in 2017 the bottom came a year later. I would not expect a bottom for BTC until at least a year from the November top in 2021.,asteriojorgo after the btc top in 2017 the bottom came a year later i would not expect a bottom for btc until at least a year from the november top in 2021,0.08945853263139725,0.6669467687606812,0.24359464645385742
2022-05-09,20:45,#Bitcoin will soon hit 22k$ this week #BTCUSDT #BTCBUSD #BTC,bitcoin will soon hit 22k this week btcusdt btcbusd btc,0.277691513299942,0.7065897583961487,0.015718787908554077
2022-05-09,20:45,Now that we have reached more than  a 50% drop from ATH with #Bitcoin is this not generally a marker for Bear market Lows?,now that we have reached more than a 50 drop from ath with bitcoin is this not generally a marker for bear market lows,0.04495241865515709,0.05670652538537979,0.8983410596847534
2022-05-09,20:45,"@abba_elnafaty @BSCGemsAlert @FreshCoinsIo @BabyCatcoinBSC Are you ready to become a millionaire? It’s okay invest in $Babycats @BabyCatcoinBSC. 
#BTC   #Bnb #babycatcoinbsc #babycatcoin",abbaelnafaty bscgemsalert freshcoinsio babycatcoinbsc are you ready to become a millionaire its okay invest in babycats babycatcoinbsc btc bnb babycatcoinbsc babycatcoin,0.11075834184885025,0.875794529914856,0.013447077944874763
2022-05-09,20:45,@ashwsbreal @SirDecka Ty for the chance.I want to get into crypto currency but lack the money to invest at the moment. #Bitcoin,ashwsbreal sirdecka ty for the chancei want to get into crypto currency but lack the money to invest at the moment bitcoin,0.055279720574617386,0.9147822260856628,0.02993800863623619
2022-05-09,20:45,@workquest_co WorkQuest is decentralized Payment Provider connecting employer with employees anywhere in the world governed by DAO.#WorkQuest $WQT $WUSD #WorkNet #WorkQuestApp #blockchian #crypto #cryptolife #BTC #BNB #ETH #digitalization #digitalassets #saving #BinanceSmartChain,workquestco workquest is decentralized payment provider connecting employer with employees anywhere in the world governed by daoworkquest wqt wusd worknet workquestapp blockchian crypto cryptolife btc bnb eth digitalization digitalassets saving binancesmartchain,0.05789228528738022,0.9289929270744324,0.013114837929606438
2022-05-09,20:45,"#Bitcoin another great short the pop from  31.9k, already up over 3%
#BTC $Bitcoin",bitcoin another great short the pop from 319k already up over 3 btc bitcoin,0.8967440128326416,0.08777347952127457,0.015482470393180847
2022-05-09,20:45,#BTC is now at $30874.36,btc is now at 3087436,0.02817685157060623,0.9272013902664185,0.044621750712394714
2022-05-09,20:45,"@elonmusk Are you selling #btc ? 
I am sure YES 🙌",elonmusk are you selling btc i am sure yes,0.048456110060214996,0.9350899457931519,0.016453903168439865
2022-05-09,20:45,@rovercrc I already knew that #bitcoin will go to shit,rovercrc i already knew that bitcoin will go to shit,0.0722130686044693,0.9128398299217224,0.014947124756872654
2022-05-09,20:45,"“Adversity strengthens the mind, like hard labor strengthens the body” #Bitcoin #HODL",adversity strengthens the mind like hard labor strengthens the body bitcoin hodl,0.21417826414108276,0.7622305750846863,0.02359122782945633
2022-05-09,20:45,"If it wasn't for all the entities I owe, all my imaginary money would be in #BTC",if it was not for all the entities i owe all my imaginary money would be in btc,0.03246580436825752,0.9331491589546204,0.03438499569892883
2022-05-09,20:45,"@EthanHBellamy @StreetBomber @FracSlap @Mario_Guti713 @petromundo1 #bitcoin was born out of the fires of the Great Recession.

Interesting to see how it'll hold up during it's first recession.",ethanhbellamy streetbomber fracslap marioguti713 petromundo1 bitcoin was born out of the fires of the great recession interesting to see how it will hold up during it is first recession,0.3030424416065216,0.6832888722419739,0.01366861816495657
2022-05-09,20:45,@CoinCornerMSW Every SAT counts: keep stackin‘ #Bitcoin 🙌🏻,coincornermsw every sat keep stackin bitcoin,0.03986767306923866,0.9238391518592834,0.03629320487380028
2022-05-09,20:45,"#Stockmarket looks cooked to me

#Bitcoin as well",stockmarket looks cooked to me bitcoin as well,0.16795530915260315,0.8205764889717102,0.01146822702139616
2022-05-09,20:45,"The aim of the game is to bring your average purchase price as low as possible.

If you believed in bitcoin enough to buy at $69k, then you should still believe in bitcoin now/at lower prices.

When opportunity presents itself, take it. 

#bitcoin 

(Never financial advice)",the aim of the game is to bring your average purchase price as low as possible if you believed in bitcoin enough to buy at 69k then you should still believe in bitcoin nowat lower prices when opportunity presents itself take it bitcoin never financial advice,0.03841680660843849,0.8882968425750732,0.07328637689352036
2022-05-09,20:45,$BTC $29K incoming. $BTC #Bitcoin #Cryptocrash,btc 29k incoming btc bitcoin cryptocrash,0.06741324067115784,0.918682336807251,0.013904416002333164
2022-05-09,20:45,"Load up on your favorites, #cryptocurrency is not dead nor will it ever die 💯💯💯💪🏼💪🏼💪🏼 here to stay! #dogecoin #doge #Bitcoin #Ethereum #dogearmy",load up on your favorites cryptocurrency is not dead nor will it ever die here to stay dogecoin doge bitcoin ethereum dogearmy,0.04419723525643349,0.9337314367294312,0.02207133173942566
2022-05-09,20:45,"How are you feeling?
#cryptocurrency  #cryptotrading  #Bitcoin #ETH  #Bnb #CryptoNews",how are you feeling cryptocurrency cryptotrading bitcoin eth bnb cryptonews,0.06240435317158699,0.9205074906349182,0.017088163644075394
2022-05-09,20:45,Bitcoin is on discount and I’m here for it! 🙌🏻 #btc,bitcoin is on discount and im here for it btc,0.05609117075800896,0.9256330728530884,0.0182757917791605
2022-05-09,20:45,The time will come and #Bitcoin will raise to unbelievable highs - have patience! ✨💎✨,the time will come and bitcoin will raise to unbelievable highs have patience,0.8250109553337097,0.1624828428030014,0.012506281957030296
2022-05-09,20:45,I’m still not poor yet you bitch ass market go lower. #BTC,im still not poor yet you bitch ass market go lower btc,0.03541942685842514,0.09398788213729858,0.8705927133560181
2022-05-09,20:45,@BTC_Archive I already knew that #bitcoin will go to shit,btcarchive i already knew that bitcoin will go to shit,0.061192531138658524,0.9255516529083252,0.013255834579467773
2022-05-09,20:45,"Current #Bitcoin price is $31,093.43",current bitcoin price is 3109343,0.020455176010727882,0.9462230801582336,0.033321719616651535
2022-05-09,20:45,"I'm so much looking forward to those ""I told you so"" days in crypto.... #crypto #btc #bitcoin #thefuture",i am so much looking forward to those i told you so days in crypto crypto btc bitcoin thefuture,0.10511276125907898,0.8802687525749207,0.01461854763329029
2022-05-09,20:45,@CriptovalutaI U bought #bitcoin in this hours sir ?,criptovalutai u bought bitcoin in this hours sir,0.07216575741767883,0.9032135009765625,0.024620704352855682
2022-05-09,20:45,"#LUNA bought more #btc

28205.54636042 BTC",luna bought more btc 2820554636042 btc,0.12139637768268585,0.861322820186615,0.017280837520956993
2022-05-09,20:45,"🔻🔻🔻 $1,864,358 BTCUSDT SHORTED @$30,850.00 on #Binance (20:41:29 UTC) #BTC #cryptocurrency",1864358 btcusdt shorted 3085000 on binance utc btc cryptocurrency,0.03642073646187782,0.930703341960907,0.032875970005989075
2022-05-09,20:45,@Cylumfinance Great #CYLUM #CYM #BNB #BSC #cryptocurrency #binance #BTC #ETH,cylumfinance great cylum cym bnb bsc cryptocurrency binance btc eth,0.082765132188797,0.9063438773155212,0.010890915989875793
2022-05-09,20:45,"So Terra is causing this #Bitcoin dip?

Great!",so terra is causing this bitcoin dip great,0.03292115032672882,0.4273453950881958,0.5397334694862366
2022-05-09,20:45,"I know I should sell half my stack and buy lower so my stack is bigger later but I just worry ill screw it up 

#Bitcoin",i know i should sell half my stack and buy lower so my stack is bigger later but i just worry ill screw it up bitcoin,0.032294824719429016,0.13748998939990997,0.8302152752876282
2022-05-09,20:45,"I don't know which support works. But I know that every support that all thinks works, will broke! Be careful, swing whith trends. The market maker decide which support will work. Every number for btc maybe an afraid. Same as plan b the cheater.

#btc
#BTCUSDT",i do not know which support works but i know that every support that all thinks works will broke be careful swing whith trends the market maker decide which support will work every number for btc maybe an afraid same as plan b the cheater btc btcusdt,0.05319783464074135,0.9280927181243896,0.018709396943449974
2022-05-09,20:45,@intocryptoverse Play the @blingfiapp #Bitcoin games to stack more sats,intocryptoverse play the blingfiapp bitcoin games to stack more sats,0.05703655257821083,0.9251614212989807,0.01780196651816368
2022-05-09,20:45,Countries are loading #bitcoin  UT the price goes down. Lol start loading DCA IN #cnbc #bloomberg #thestreet #cryptocurrency #Crypto #Blockchain #egamers #Metaverse #elonmusk #cryptotrading #btc #eth #bch #xlm #xrp #ThetaToken #PersistenceToken #silver #gold #Cardano #StockMarket,countries are loading bitcoin ut the price goes down lol start loading dca in cnbc bloomberg thestreet cryptocurrency crypto blockchain egamers metaverse elonmusk cryptotrading btc eth bch xlm xrp thetatoken persistencetoken silver gold cardano stockmarket,0.05483298748731613,0.8947612643241882,0.05040573328733444
2022-05-09,20:45,"@davidgokhshtein Btc , bitcoin #btc $BTC , BITCOIN",davidgokhshtein btc bitcoin btc btc bitcoin,0.035321194678545,0.9435961246490479,0.021082745864987373
2022-05-09,20:45,@reyTempest_ @altcryptocom @BabyCatcoinBSC Babycatcoin is the top memecoin #babycatcoin #babycatcoinbsc #bnb #btc,reytempest altcryptocom babycatcoinbsc babycatcoin is the top memecoin babycatcoin babycatcoinbsc bnb btc,0.14749690890312195,0.8436933159828186,0.008809744380414486
2022-05-09,20:45,"#Bitcoin $BTC
This never gets boring.",bitcoin btc this never gets boring,0.029317529872059822,0.8881770968437195,0.08250537514686584
2022-05-09,20:45,@whale_alert Says it all about #btc,whalealert says it all about btc,0.032875362783670425,0.9391660690307617,0.027958575636148453
2022-05-09,20:45,dolar cost averaging investing should be the way to go. #btc,dolar cost averaging investing should be the way to go btc,0.13737455010414124,0.8489676713943481,0.01365773007273674
2022-05-09,20:45,Do most VCs realize that they go bankrupt on a #bitcoin standard? They are merely the parasitic tentacles of fiat.,do most vcs realize that they go bankrupt on a bitcoin standard they are merely the parasitic tentacles of fiat,0.020195772871375084,0.6091651916503906,0.3706390857696533
2022-05-09,20:45,"#Bitcoin near $30,000
Now 

Buy or wait (dip😎📉)
👇👇

#Bitcoin
#Crypto #cryptotrading",bitcoin near 30000 now buy or wait dip bitcoin crypto cryptotrading,0.02759556658565998,0.9389129877090454,0.033491432666778564
2022-05-09,20:45,"Would be pretty legendary if $BTC decides to just go ape and moon to $70,000 in the next 7 days.   

Anything is possible and one can dream. 

Go on #Bitcoin ...send it for the lawls.",would be pretty legendary if btc decides to just go ape and moon to 70000 in the next 7 days anything is possible and one can dream go on bitcoin send it for the lawls,0.04570624977350235,0.9327325820922852,0.02156117558479309
2022-05-09,20:45,CONFIRMED: 🇨🇺 Upwards of 200k Cubans are now using #Bitcoin and #crypto,upwards of 200k cubans are now using bitcoin and crypto,0.033624812960624695,0.943483293056488,0.022891927510499954
2022-05-09,20:45,"Am trying this thing out making #Memes jokes

If #bitcoin was a bubble, how come it keeps expanding in size and expectations

Some are like expecting $100000
#cryptocurrencies",am trying this thing out making memes jokes if bitcoin was a bubble how come it keeps expanding in size and expectations some are like expecting 100000 cryptocurrencies,0.048038139939308167,0.9262455701828003,0.025716273114085197
2022-05-09,20:45,“Local bottom is in”… tbd #crypto #BTC,local bottom is in tbd crypto btc,0.027404366061091423,0.9462390542030334,0.026356589049100876
2022-05-09,20:45,@PlateLicker_21m Sammy stackmore   Heck of a candidate #btc.,platelicker21m sammy stackmore heck of a candidate btc,0.22469209134578705,0.7629807591438293,0.012327156029641628
2022-05-09,20:45,"@Susan08398320 #DCA  I set aside in case this would happen.  Cannot tell you where it ends bc picking bottoms seems impossible.  So I have chosen my “range”. If I’m wrong, life hands me yet another hard lesson.  #BTC",susan08398320 dca i set aside in case this would happen cannot tell you where it ends bc picking bottoms seems impossible so i have chosen my range if im wrong life hands me yet another hard lesson btc,0.07124041765928268,0.8841060996055603,0.04465349391102791
2022-05-09,20:45,"Does anyone remember when the #BTC maxis were screaming #XRP is centralized. 
Now imagine #BTC maxis having their fate being decided by someone named kown. 👀",does anyone remember when the btc maxis were screaming xrp is centralized now imagine btc maxis having their fate being decided by someone named kown,0.023252015933394432,0.8992502093315125,0.07749772071838379
2022-05-09,20:45,Breaking News : El Salvador announces new purchase of 500 #BTC,breaking news el salvador announces new purchase of 500 btc,0.07943875342607498,0.8937516212463379,0.02680959552526474
2022-05-09,20:45,"@WatcherGuru Heheh, do you want me to sell and show the real liquidation? #Bitcoin",watcherguru heheh do you want me to sell and show the real liquidation bitcoin,0.04802951216697693,0.9348130822181702,0.01715737394988537
2022-05-09,20:45,@MEXC_Global #BTC DELIST...,mexcglobal btc delist,0.028347011655569077,0.9353510737419128,0.03630197048187256
2022-05-09,20:45,@MMCrypto Worst case scenario is your limit orders being filled and #BTC dropping even further,mmcrypto worst case scenario is your limit orders being filled and btc dropping even further,0.015652351081371307,0.022134283557534218,0.962213397026062
2022-05-09,20:45,"#Bitcoin is up 1,681% over the last five years.   Zoom out.",bitcoin is up 1681 over the last five years zoom out,0.9376732707023621,0.04819941148161888,0.014127293601632118
2022-05-09,20:45,"I can't say anything #Bitcoin 
Everyone #HODL 
This year is over I think. My pf is down 70 % right now..Damn..I'm new in #Crypto but I believe everthing will get better. 
Hard bounce soon 💪💪",i cannot say anything bitcoin everyone hodl this year is over i think my pf is down 70 right nowdamni m new in crypto but i believe everthing will get better hard bounce soon,0.03675359860062599,0.10239344090223312,0.8608528971672058
2022-05-09,20:45,"It's time to redeem. fear and at its peak, we are 2 fingers away from the stock market crash wish me good luck. #btc",it is time to redeem fear and at its peak we are 2 fingers away from the stock market crash wish me good luck btc,0.2786563038825989,0.666397750377655,0.054945919662714005
2022-05-09,20:45,"The only people losing money right now are leverage traders that are being liquidated, and panic sellers that are selling at loss, as long you're a long term holder you have nothing to worry about, because we'll def bounce back in no time #btc",the only people losing money right now are leverage traders that are being liquidated and panic sellers that are selling at loss as long you are a long term holder you have nothing to worry about because we will def bounce back in no time btc,0.01646069809794426,0.2113577276468277,0.7721816301345825
2022-05-09,20:45,"What does it means that: Stablecoin $UST has lost its peg to the dollar?

It’s lost it’s attachment or something? 🤷‍♂️. I’m trying to understand what’s happening 😅

#BtC #LUna",what does it means stablecoin ust has lost its peg to the dollar its lost its attachment or something im trying to understand whats happening btc luna,0.028220929205417633,0.2264878898859024,0.7452911138534546
2022-05-09,20:45,Bottoming out?#BTC #ETH#APE #XRP🌊🌊🌊,bottoming outbtc ethape xrp,0.049060698598623276,0.512292206287384,0.4386471211910248
2022-05-09,20:45,Don’t go gently into the night smash buy #bitcoin @SwanBitcoin,don not go gently into the night smash buy bitcoin swanbitcoin,0.03321200981736183,0.9355372786521912,0.03125077858567238
2022-05-09,20:45,@PeterSchiff I hope it does drop to 10k I’ll back the truck up #Bitcoin,peterschiff i hope it does drop to 10k ill back the truck up bitcoin,0.15350094437599182,0.49707064032554626,0.3494284152984619
2022-05-09,20:45,@elonmusk are you selling #btc???,elonmusk are you selling btc,0.03959715738892555,0.9380802512168884,0.022322610020637512
2022-05-09,20:45,"El Salvador has purchased an additional 500 #Bitcoin ($15,372,000)",el salvador has purchased an additional 500 bitcoin 15372000,0.09715379029512405,0.8933898210525513,0.009456426836550236
2022-05-09,20:45,"If you always trade tokens for more tokens of a different type, the total number of tokens in your investment will increase with every trade.
#SeasonalTokens #CryptoMining #CyclicalInvesting #BTC",if you always trade tokens for more tokens of a different type the total number of tokens in your investment will increase with every trade seasonaltokens cryptomining cyclicalinvesting btc,0.19772744178771973,0.7873953580856323,0.014877228066325188
2022-05-09,20:45,@BryanBSolstin #Bitcoin is International Monetary Fund now.,bryanbsolstin bitcoin is international monetary fund now,0.0329444520175457,0.9417870044708252,0.025268590077757835
2022-05-09,20:45,El Salvador announces new purchase of 500 #BTC 🚀🚀🚀🚀🚀,el salvador announces new purchase of 500 btc,0.1926453858613968,0.7876443266868591,0.019710347056388855
2022-05-09,20:45,Current #Bitcoin Price is $31224 #BTC #Crypto,current bitcoin price is 31224 btc crypto,0.023252468556165695,0.9516956210136414,0.025051914155483246
2022-05-09,20:45,"JUST IN: Over $920 million has now been liquidated from the cryptocurrency market in the past 24 hours.

#cryptocrash #bitcoin #BitcoinCrash #btc #altcoins",just over 920 million has now been liquidated from the cryptocurrency market in the past 24 hours cryptocrash bitcoin bitcoincrash btc altcoins,0.030219800770282745,0.8705540299415588,0.09922622889280319
2022-05-09,20:45,"Is $TESLA selling @BTCTN #btc ? 
What you think 🤔 
@elonmusk ☝️",is tesla selling btctn btc what you think elonmusk,0.05616208538413048,0.9315738081932068,0.012264110147953033
2022-05-09,20:45,"music is must at all times, like #btc",music is must at all times like btc,0.027275854721665382,0.9503753781318665,0.02234872616827488
