Date,Time,Original tweet,Clean tweet,Positive,Neutral,Negative
2022-05-09,19:15,@Ethlife1Eth Help me : @ccrienclarue @eloise_box #Giveaways #BTC #MiamiGP #FCNOGCN #ONEPIECE1016 #AVAX #Ape,ethlife1eth help me ccrienclarue eloisebox giveaways btc miamigp fcnogcn onepiece1016 avax ape,0.12161058187484741,0.8648023009300232,0.013587108813226223
2022-05-09,19:15,"🚀🚀🚀 $788,574 BTCUSDT LONGED @$30,893.00 on #Bybit (19:13:19 UTC) #BTC #cryptocurrency",788574 btcusdt longed 3089300 on bybit utc btc cryptocurrency,0.02903834916651249,0.9378361701965332,0.03312549740076065
2022-05-09,19:15,"Peek-a-boo, you fuks, you‼️

#btc #Bitcoin is having a quite a laugh😃 😂😀 🙈",peekaboo you fuks you btc bitcoin is having a quite a laugh,0.46877962350845337,0.4485391080379486,0.08268128335475922
2022-05-09,19:15,"This project has be provide to be a very strong gathering an excellent team of manger. The last news give even more.
 #WorkQuest $WQT $WUSD #WorkNet #WorkQuestApp #blockchian #crypto #cryptolife #BTC #BNB
 #ETH #digitalization #digitalassets #saving #BinanceSmartChain",this project has be provide to be a very strong gathering an excellent team of manger the last news give even more workquest wqt wusd worknet workquestapp blockchian crypto cryptolife btc bnb eth digitalization digitalassets saving binancesmartchain,0.6048988699913025,0.3863151967525482,0.008785996586084366
2022-05-09,19:15,@beautyofhelin remember the fed can't buy all your precious #bitcoin... even if they could they wouldn't with inflation,beautyofhelin remember the fed cannot buy all your precious bitcoin even if they could they would not with inflation,0.04280620068311691,0.906570553779602,0.050623293966054916
2022-05-09,19:15,"@beautyofhelin If you're gonna panic at all at this stage, you should panic buy, not panic sell.
I'm bought the dip on #Bitcoin and some promising gems.",beautyofhelin if you are gonna panic at all at this stage you should panic buy not panic sell i am bought the dip on bitcoin and some promising gems,0.14027619361877441,0.8377668261528015,0.021956980228424072
2022-05-09,19:15,"#Bitcoin #Ethereum #cryptocurrency is testing your patience.
There will always be bull markets followed by bear markets followed by bull markets.
Patience and right decisions will take you forward!",bitcoin ethereum cryptocurrency is testing your patience there will always be bull markets followed by bear markets followed by bull markets patience and right decisions will take you forward,0.0638832151889801,0.913844108581543,0.022272733971476555
2022-05-09,19:15,"Buying #altcoins at an 80-85% discount feels good.

#Crypto #cryptocurrency #cryptocurrencies #cryptotrading #Bitcoin #Cryptocrash $BTC",buying altcoins at an 8085 discount feels good crypto cryptocurrency cryptocurrencies cryptotrading bitcoin cryptocrash btc,0.21979697048664093,0.7689216136932373,0.011281415820121765
2022-05-09,19:15,"REMINDER:

☣️Inflation at historical levels
☣️Petrodollar is over
☣️Dollar reserves confiscated 
☣️US debt only payable with more money printing

Don’t be fooled by irrational markets

#Bitcoin’s purpose, technology and use case has never been stronger 💎👐🏼",inflation at historical levels petrodollar is over dollar reserves confiscated us debt only payable with more money printing don not be fooled by irrational markets bitcoins purpose technology and use case has never been stronger,0.14912894368171692,0.8158788084983826,0.0349922850728035
2022-05-09,19:15,@angelzz934 #METAKAT is my holdings!! This is the future of #ue5 #p2e #BNb #btc #bitcoin #memecoin #altcoin #altcoins #memecoins #avax #solona #matic #CRO #binance #bsc #BSCGemsAlert #BSCGem #BinanceSmartChain #DeFi #DeFiProject @elonmusk  #metaverse #UE5 #$METAKAT!,angelzz934 metakat is my holdings this is the future of ue5 p2e bnb btc bitcoin memecoin altcoin altcoins memecoins avax solona matic cro binance bsc bscgemsalert bscgem binancesmartchain defi defiproject elonmusk metaverse ue5 metakat,0.05152676999568939,0.9337160587310791,0.014757085591554642
2022-05-09,19:15,"Good MOURNING, #BTC.",good mourning btc,0.18147030472755432,0.7980496287345886,0.020479978993535042
2022-05-09,19:15,Current #Bitcoin Price is $30807 #BTC #Crypto,current bitcoin price is 30807 btc crypto,0.020827721804380417,0.9491387605667114,0.030033491551876068
2022-05-09,19:15,Today's a good day to test if you can withdrawn crypto from whatever exchange you're on if you've never done it before. #tether #Cryptocrash #bitcoin,today a good day to test if you can withdrawn crypto from whatever exchange you are on if you ve never done it before tether cryptocrash bitcoin,0.10313796252012253,0.8825915455818176,0.014270471408963203
2022-05-09,19:15,SafeHaven Project looks promising. We hope for the success of the team and the community supporting this project. #WorkQuest $WQT $WUSD #WorkNet #WorkQuestApp #blockchian #crypto #cryptolife #BTC #BNB #ETH #digitalization #digitalassets #saving #BinanceSmartChain,safehaven project looks promising we hope for the success of the team and the community supporting this project workquest wqt wusd worknet workquestapp blockchian crypto cryptolife btc bnb eth digitalization digitalassets saving binancesmartchain,0.45779767632484436,0.5340366363525391,0.008165700361132622
2022-05-09,19:15,#bitcoin has bad breath,bitcoin has bad breath,0.013376603834331036,0.036032628268003464,0.9505907893180847
2022-05-09,19:15,Yes. This is fear. #btc,yes this is fear btc,0.0826655924320221,0.8928646445274353,0.024469798430800438
2022-05-09,19:15,@nayibbukele Also bought the dip #bitcoin,nayibbukele also bought the dip bitcoin,0.0587025061249733,0.9252998232841492,0.01599770598113537
2022-05-09,19:15,"This is not a “dip” we are in a bear market. S&amp;P 500 needs to hit 3,700 before we make a reversal. #BTC could hit $20k. But don’t think we fall below the 2017 high of $19,345.",this is not a dip we are in a bear market sp 500 needs to hit 3700 before we make a reversal btc could hit 20k but don not think we fall below the 2017 high of 19345,0.18280097842216492,0.6933618187904358,0.12383721768856049
2022-05-09,19:15,If we go to 28K I’m laying down all the fiat I can to get more #Bitcoin .,if we go to 28k im laying down all the fiat i can to get more bitcoin,0.043881263583898544,0.9251143932342529,0.031004367396235466
2022-05-09,19:15,#Bitcoin has really scared many people off this space. I guess this is the great filter we are experiencing. Paper hands are being washed out. They will come back when we hit 45k lol.,bitcoin has really scared many people off this space i guess this is the great filter we are experiencing paper hands are being washed out they will come back when we hit 45k lol,0.1115713119506836,0.6700282692909241,0.21840041875839233
2022-05-09,19:15,Nobody is laughing at @GarethSoloway right about now. #BTC,nobody is laughing at garethsoloway right about now btc,0.04918477311730385,0.7609115242958069,0.18990378081798553
2022-05-09,19:15,"Hey #Bitcoin, we asked #Dogecoin to go to $1. Not you",hey bitcoin we asked dogecoin to go to 1 not you,0.08556883782148361,0.9008597731590271,0.013571387156844139
2022-05-09,19:15,It’s over. I am out of fiat to buy more #Bitcoin,its over i am out of fiat to buy more bitcoin,0.06225696578621864,0.760786235332489,0.17695675790309906
2022-05-09,19:15,How much capital will it require to keep $BTC above 30k? 🤔 #Bitcoin #Crypto #cryptotrading #Cryptocrash,how much capital will it require to keep btc above 30k bitcoin crypto cryptotrading cryptocrash,0.06375982612371445,0.9247806072235107,0.011459559202194214
2022-05-09,19:15,We are now deciding whether you will be a millionaire or a multi-millionaire or even a billionaire in the future #Bitcoin,we are now deciding whether you will be a millionaire or a multimillionaire or even a billionaire in the future bitcoin,0.05395525321364403,0.932178795337677,0.013865984044969082
2022-05-09,19:15,"Don’t stop when you’re tired, stop when you’re done,,
#showedupjustintime
#daywithoutchildcare
#bitcoin",don not stop when youre tired stop when youre done showedupjustintime daywithoutchildcare bitcoin,0.033945634961128235,0.9281371235847473,0.03791726380586624
2022-05-09,19:15,"Anyone see any green candles lately?

$BTC $ETH $LUNA #Bitcoin #Ethereum",anyone see any green candles lately btc eth luna bitcoin ethereum,0.042816270142793655,0.9373313188552856,0.01985243707895279
2022-05-09,19:15,"OOO, what's going on? 
Bitcoin fell below $33000 , and Tesla is now below $800
#Tesla 
#BTC",ooo what is going on bitcoin fell below 33000 and tesla is now below 800 tesla btc,0.036274757236242294,0.7082153558731079,0.2555098831653595
2022-05-09,19:15,"Important to remember that #bitcoin still dictates the state of today's crypto market. Altcoins will rise again!

#Cardano #ADA",important to remember that bitcoin still dictates the state of today crypto market altcoins will rise again cardano ada,0.5226585268974304,0.4327320158481598,0.04460948333144188
2022-05-09,19:15,Happy Monday!!! #Bitcoin #Crypto,happy monday bitcoin crypto,0.05380392447113991,0.9188887476921082,0.02730734460055828
2022-05-09,19:15,"@AirdropDet 📝 :
I wish your project a much better future.  I hope your team succeeds. 🥰🥰

👥 :
@Fandisoraja @masud6247 @BlogNajmul @GAHOfficial_TW @masud888 

🏷️ : 
#Airdrops #CanaBoyz #Bitcoin #AirdropDetective",airdropdet i wish your project a much better future i hope your team succeeds fandisoraja masud6247 blognajmul gahofficialtw masud888 airdrops canaboyz bitcoin airdropdetective,0.36007407307624817,0.6303701996803284,0.009555717930197716
2022-05-09,19:15,@amin199998 @GreenMazino @stablekwon #btc will change the WORLD because shit coiners can’t change #btc,amin199998 greenmazino stablekwon btc will change the world because shit coiners can not change btc,0.13718979060649872,0.8424977660179138,0.020312415435910225
2022-05-09,19:15,"If the support doesn't hold #BTC , we should see btc slide down to $18k/$17k levels. What a time to witness this. #Cryptocrash #cryptotrading #Bitcoin",if the support does not hold btc we should see btc slide down to 18k 17k levels what a time to witness this cryptocrash cryptotrading bitcoin,0.012978709302842617,0.036070287227630615,0.9509510397911072
2022-05-09,19:15,I’m calling the bottom in the next 24 hours #BTC,im calling the bottom in the next 24 hours btc,0.04317174851894379,0.9212110042572021,0.03561730682849884
2022-05-09,19:15,#Bitcoin Bitcoin is only exchange bosses playground for liquidation game i hope exchanges will investigated and regulated,bitcoin bitcoin is only exchange bosses playground for liquidation game i hope exchanges will investigated and regulated,0.08997928351163864,0.8976221084594727,0.01239856518805027
2022-05-09,19:15,"@CryptoWhale You were wrong, because #Bitcoin it going to $21k 😂",cryptowhale you were wrong because bitcoin it going to 21k,0.08029742538928986,0.8291678428649902,0.09053471684455872
2022-05-09,19:15,"@CountBitcoin The sharks are focusing on 21k....I am not a shark, but I own other vol products that I sell and move profits into #btc",countbitcoin the sharks are focusing on 21ki am not a shark but i own other vol products that i sell and move profits into btc,0.051735036075115204,0.9306944608688354,0.017570504918694496
2022-05-09,19:15,"#btc-help #crypto @elonmusk @cz_binance @wheals Lost everything in future 😔 please help Elon &amp; big wheals
(Eth)
0x5A747CfA82F11527b997f6838D7624D951C4468b",btchelp crypto elonmusk czbinance wheals lost everything in future please help elon big wheals eth 0x5a747cfa82f11527b997f6838d7624d951c4468b,0.07196691632270813,0.8905764222145081,0.037456657737493515
2022-05-09,19:15,"@Breedlove22 Maybe when the US realizes #Bitcoin is inevitable, it will place #Bitcoin mining rigs in every US embassy throughout the world. Instead of proxy wars we can create hope",breedlove22 maybe when the us realizes bitcoin is inevitable it will place bitcoin mining rigs in every us embassy throughout the world instead of proxy wars we can create hope,0.13876889646053314,0.8484348654747009,0.012796269729733467
2022-05-09,19:15,Just wanna kick a #btc bear in the dick today.,just wanna kick a btc bear in the dick today,0.0643894299864769,0.8271912932395935,0.10841924697160721
2022-05-09,19:15,"Keep some Buy Orders ready between 28K and 30K 
#BTC #BTCDOWN #btc2022",keep some buy orders ready between 28k and 30k btc btcdown btc2022,0.09630774706602097,0.8867451548576355,0.016947109252214432
2022-05-09,19:15,"WE ARE ALL GONNA FUCKING MAKE IT!!! #Crypto IS FUN HAHAHAHA....😂😂😂

#dogecoin 
#Bitcoin",we are all gonna fucking make it crypto is fun hahahaha dogecoin bitcoin,0.07865869998931885,0.9024263620376587,0.018914954736828804
2022-05-09,19:15,"Leave the past where it belongs..
#showedupjustintime
#daywithoutchildcare
#bitcoin",leave the past where it belongs showedupjustintime daywithoutchildcare bitcoin,0.05447015166282654,0.9180419445037842,0.027487918734550476
2022-05-09,19:15,This was a great day for #bitcoin! Thanks to all the paper hands and wales! Thanks for the cheap sats!,this was a great day for bitcoin thanks to all the paper hands and wales thanks for the cheap sats,0.8309835195541382,0.15769150853157043,0.011325093917548656
2022-05-09,19:15,Create automated tasks with @jobboycom API Deposit withdraw with #crypto #bitcoin,create automated tasks with jobboycom api deposit withdraw with crypto bitcoin,0.04047772288322449,0.9392165541648865,0.020305754616856575
2022-05-09,19:15,#bitcoin seeking 12k,bitcoin seeking 12k,0.0837019681930542,0.8955280184745789,0.02077004499733448
2022-05-09,19:15,Another opportunity to buy #BTC,another opportunity to buy btc,0.14302107691764832,0.8479172587394714,0.00906168669462204
2022-05-09,19:15,"@maxkeiser Why Max?
@Saylor didn't hurt #Bitcoin, he is a maximalist with solid conviction.",maxkeiser why max saylor did not hurt bitcoin he is a maximalist with solid conviction,0.09956561774015427,0.8807877898216248,0.01964661292731762
2022-05-09,19:15,"If #Bitcoin get to $30,000, I'll delete my Twitter account &amp; sell my #Bitcoin I'm sick of this shit.",if bitcoin get to 30000 i will delete my twitter account sell my bitcoin i am sick of this shit,0.01347733661532402,0.18331831693649292,0.8032044172286987
2022-05-09,19:15,"El Salvador just bought the dip! 🇸🇻

500 coins at an average USD price of ~$30,744 🥳

#Bitcoin",el salvador just bought the dip 500 coins at an average usd price of 30744 bitcoin,0.10269875824451447,0.8833695650100708,0.013931742869317532
2022-05-09,19:15,#Bitcoin go lower I dare you!,bitcoin go lower i dare you,0.07128521800041199,0.7658200860023499,0.16289472579956055
2022-05-09,19:15,@CryptoLikeMo Long term investor. Time to start buying good projects and don't forget to stack #Bitcoin,cryptolikemo long term investor time to start buying good projects and do not forget to stack bitcoin,0.21056483685970306,0.7789853811264038,0.010449735447764397
2022-05-09,19:15,"Luna about to dump 52,000 #BTC. This is going to be epic.",luna about to dump 52000 btc this is going to be epic,0.04093252494931221,0.8646714091300964,0.09439606219530106
2022-05-09,19:15,ima take a wild guess that the bottom will be 21k or 17k #bitcoin,ima take a wild guess that the bottom will be 21k or 17k bitcoin,0.029688749462366104,0.8368386030197144,0.13347271084785461
2022-05-09,19:15,"#Bitcoin is not crashing. It's the global fiat economy. 

#Bitcoin is king. #HODL on and #stacksats .",bitcoin is not crashing it is the global fiat economy bitcoin is king hodl on and stacksats,0.060969721525907516,0.8948146104812622,0.0442156121134758
2022-05-09,19:15,"@rovercrc I'm waiting for it to drop to 30,000 may be I would accumulate some #Bitcoin",rovercrc i am waiting for it to drop to 30000 may be i would accumulate some bitcoin,0.01065866556018591,0.06881100684404373,0.9205303192138672
2022-05-09,19:15,@beautyofhelin I bought #Bitcoin at $45k I guess there's no need buying at $32k... Hope I'm not stupid Helin? 😀,beautyofhelin i bought bitcoin at 45k i guess there is no need buying at 32k hope i am not stupid helin,0.08529838919639587,0.8887732625007629,0.025928350165486336
2022-05-09,19:15,"Been talking about a similar scenario to 2018 and it happened EXACTLY AS PREDICTED 🤝..

Nobody wanted to believe it because most of them were not there , ITS ALMOST EXACTLY THE SAME #Bitcoin",been talking about a similar scenario to 2018 and it happened exactly as predicted nobody wanted to believe it because most of them were not there its almost exactly the same bitcoin,0.03758878633379936,0.8747528791427612,0.08765830099582672
2022-05-09,19:15,I didn’t know the market was gonna dip this much. #BTC I would have played my cards differently had I known.,i didn not know the market was gonna dip this much btc i would have played my cards differently had i known,0.13461510837078094,0.6819395422935486,0.1834452897310257
2022-05-09,19:15,"@BitcoinMagazine Right Picture, Dont wait , Buy #BTC",bitcoinmagazine right picture dont wait buy btc,0.033953387290239334,0.9417390823364258,0.02430751733481884
2022-05-09,19:15,@TheMoonCarl If hits 10K am IN #BTC,themooncarl if hits 10k am in btc,0.08938607573509216,0.871751070022583,0.038862816989421844
2022-05-09,19:15,Everything is so cheap today. What to buy? #bitcoin #crypto,everything is so cheap today what to buy bitcoin crypto,0.04000445827841759,0.9356733560562134,0.02432219497859478
2022-05-09,19:15,"I told Ya 
#BTC #Cryptocrash",i told ya btc cryptocrash,0.05785384401679039,0.9213038682937622,0.02084229700267315
2022-05-09,19:15,Well that was quick #Bitcoin,well that was quick bitcoin,0.2304718941450119,0.7249191403388977,0.04460893198847771
2022-05-09,19:15,"#BTC where are the whales? Hunting 🤠 ready to jump in 🦁, but at what price",btc where are the whales hunting ready to jump in but at what price,0.03859003260731697,0.9343080520629883,0.027101906016469002
2022-05-09,19:15,@CNBC Keep buying #Bitcoin ✌️,cnbc keep buying bitcoin,0.12712141871452332,0.8539168834686279,0.018961666151881218
2022-05-09,19:15,Where are all the moon boys screaming #buythedip ? #Bitcoin #Crypto #bearmarket,where are all the moon boys screaming buythedip bitcoin crypto bearmarket,0.02580392360687256,0.8880087733268738,0.08618724346160889
2022-05-09,19:15,"There’s a lot of blood on the streets, some of it is mine.  Good time to do some DCA-ing! #BTC #ADA #ALGO #XLM #COTI",theres a lot of blood on the streets some of it is mine good time to do some dcaing btc ada algo xlm coti,0.11401748657226562,0.8678020238876343,0.01818053610622883
2022-05-09,19:15,"@reyTempest_ @MrBigWhaleREAL @BabyCatcoinBSC Every packages coming from $babycatcoin is worth going for 
☄️💕🤗#btc #bnb #bsc #BUSDREWARDS #BabyDogeCoin",reytempest mrbigwhalereal babycatcoinbsc every packages coming from babycatcoin is worth going for btc bnb bsc busdrewards babydogecoin,0.13707399368286133,0.8533288836479187,0.009597131051123142
2022-05-09,19:15,"@McDonalds make some room on your roaster, I need a job… Crypto is crashing 🥴 What do we do?! #Bitcoin #CryptoCrash",mcdonalds make some room on your roaster i need a job crypto is crashing what do we do bitcoin cryptocrash,0.02914745733141899,0.9322388768196106,0.0386136919260025
2022-05-09,19:15,@BusinessFamous I am glad they chose to buy gold instead of #Bitcoin,businessfamous i am glad they chose to buy gold instead of bitcoin,0.2698037922382355,0.7161646485328674,0.01403152383863926
2022-05-09,19:15,"Me: Mom #bitcoin dip, go buy right now.

Mom: I already bought $500 an hour ago.",mom bitcoin dip go buy right now i already bought 500 an hour ago,0.08975350111722946,0.895922839641571,0.014323708601295948
2022-05-09,19:15,@ZakaWaqar Luna sold 42000 #Bitcoin,zakawaqar luna sold 42000 bitcoin,0.04908735677599907,0.9356129169464111,0.015299694612622261
2022-05-09,19:15,"Whenever we say #BTC is going to zero, it proves us wrong. 

Whenever we say #BTC is going to $100K, it proves us wrong. 

#BTC is going to zero.",whenever we say btc is going to zero it proves us wrong whenever we say btc is going to 100k it proves us wrong btc is going to zero,0.11764053255319595,0.3790057599544525,0.5033537745475769
2022-05-09,19:15,When #Bitcoin hit 69k you guys all wanted to buy it cheaper. Now that it is are you buying ?,when bitcoin hit 69k you guys all wanted to buy it cheaper now that it is are you buying,0.13823875784873962,0.8480466604232788,0.013714614324271679
2022-05-09,19:15,The only panic selling you should be doing right now is selling the useless things you have and investing into your favorite project. #Bitcoin,the only panic selling you should be doing right now is selling the useless things you have and investing into your favorite project bitcoin,0.031542085111141205,0.9073373675346375,0.061120521277189255
2022-05-09,19:15,Good evening what a wonderful day to be alive 🚀🚀🚀 #Crypto #cryptocurrency #CryptoA1 #ETH #Saitama #Bitcoin,good evening what a wonderful day to be alive crypto cryptocurrency cryptoa1 eth saitama bitcoin,0.12282730638980865,0.8622143268585205,0.014958417974412441
2022-05-09,19:15,"Everything is beautiful when you look at it with love,,
#showedupjustintime
#daywithoutchildcare
#bitcoin",everything is beautiful when you look at it with love showedupjustintime daywithoutchildcare bitcoin,0.052598413079977036,0.9281885623931885,0.019212989136576653
2022-05-09,19:15,"@EarnWithSapna #Bitcoin $28000🚩 / $29000 🚩
📊 I hope it won't break this levels 💚",earnwithsapna bitcoin 28000 29000 i hope it will not break this levels,0.12528634071350098,0.6713824272155762,0.20333123207092285
2022-05-09,19:15,We haven't had such hard bleeding in #crypto in a long time. Even #btc and #eth down more than 10% last 24 hrs. Obv oversold in the short term... still gonna wait bc I think we're not quite done yet w this immediate bleeding,we have not had such hard bleeding in crypto in a long time even btc and eth down more than 10 last 24 hrs obv oversold in the short term still gonna wait bc i think we are not quite done yet w this immediate bleeding,0.022505924105644226,0.0461321696639061,0.9313619136810303
2022-05-09,19:15,"@TheMoonCarl Pump it into some solid #Altcoins such as #CODE #DAFI and $GREEN 

#Greenhouse tokenomics are unique in that all DEX fees are utilized to buy back and burn the GREEN token, meaning that the DEX has a value capture mechanism directly related to usage of the protocol.🔥

#BTC #ETH",themooncarl pump it into some solid altcoins such as code dafi and green greenhouse tokenomics are unique in that all dex fees are utilized to buy back and burn the green token meaning that the dex has a value capture mechanism directly related to usage of the protocol btc eth,0.07929672300815582,0.9104534983634949,0.010249754413962364
2022-05-09,19:15,"Weak bounce, seat belts on, 100% in stablecoins.
Looking for entry points!
#BTC #altcoin",weak bounce seat belts on 100 in stablecoins looking for entry points btc altcoin,0.08149085938930511,0.7730122208595276,0.14549694955348969
2022-05-09,19:15,if the NASDAQ drops 1% you can find a 1000 explanation but when crypto crashes you can't find none #Bitcoin,if the nasdaq drops 1 you can find a 1000 explanation but when crypto crashes you cannot find none bitcoin,0.02766164019703865,0.3906297981739044,0.5817086100578308
2022-05-09,19:15,"Just wait until #bitcoin correlation turns negative and finally decouples from legacy markets, once inflation gets out of control. We are not even in the beginning. Then you'll see $1M/coin.",just wait until bitcoin correlation turns negative and finally decouples from legacy markets once inflation gets out of control we are not even in the beginning then you will see 1mcoin,0.05737612023949623,0.8585423827171326,0.08408152312040329
2022-05-09,19:15,This shakeout is testing! #hodl #theta #tfuel #BTC,this shakeout is testing hodl theta tfuel btc,0.13844327628612518,0.8527344465255737,0.008822253905236721
2022-05-09,19:15,"@ape_g4ng Problem with NFT is liquidity! You can’t get out when you want to, you have to wait! #NFT #Bitcoin",apeg4ng problem with nft is liquidity you can not get out when you want to you have to wait nft bitcoin,0.02351151965558529,0.39003992080688477,0.5864485502243042
2022-05-09,19:15,Who is happy to get #Bitcoin cheaper ? Stack #satoshis,who is happy to get bitcoin cheaper stack satoshis,0.21812616288661957,0.769203245639801,0.012670610100030899
2022-05-09,19:15,Has @saylor sold the office furniture to buy more #bitcoin yet?? 😂😂,has saylor sold the office furniture to buy more bitcoin yet,0.029356099665164948,0.9032838940620422,0.06735996156930923
2022-05-09,19:15,@stablekwon Did you sold 42.5K #BTC reserves.,stablekwon did you sold 425k btc reserves,0.0694785788655281,0.9151965975761414,0.015324758365750313
2022-05-09,19:15,"@elonmusk pump this up, save #BTC from hell!  #xvg still hodling strong, i suggest that this crash will unfold the true 'ones'.",elonmusk pump this up save btc from hell xvg still hodling strong i suggest that this crash will unfold the true ones,0.3049784004688263,0.6728050708770752,0.022216515615582466
2022-05-09,19:15,"Hello @saylor why are you not buying the dip this time?

My lovely @nayibbukele is #btc still your legal tender? How are your citizen fairing??",hello saylor why are you not buying the dip this time my lovely nayibbukele is btc still your legal tender how are your citizen fairing,0.09634669870138168,0.8839544057846069,0.019698921591043472
2022-05-09,19:15,Now its that time when the money is transferred from weak to strong hands #HODL #BTC,now its that time when the money is transferred from weak to strong hands hodl btc,0.05542990565299988,0.926540732383728,0.01802935265004635
