Date,Time,Original tweet,Clean tweet,Positive,Neutral,Negative
2022-05-09,20:45,"@MotivatorHAN I'm sorry, I mean the price mark of #BTC as at then not the current price now.",motivatorhan i am sorry i mean the price mark of btc as at then not the current price now,0.040893469005823135,0.928022027015686,0.031084531918168068
2022-05-09,20:45,@ClaudioVenturao @Bitcoin @TheMoonCarl Unfollowed a long time ago. HODL your #Bitcoin and u will recover. 💪🏻💪🏻,claudioventurao bitcoin themooncarl unfollowed a long time ago hodl your bitcoin and u will recover,0.08616446703672409,0.878304660320282,0.03553086519241333
2022-05-09,20:45,"#BTC took a shit. 

Relax, how much do you want this?",btc took a shit relax how much do you want this,0.04743749648332596,0.9160512089729309,0.036511316895484924
2022-05-09,20:45,"Stack Those SATs
#Bitcoin #BitcoinCrash  #Cryptocrash",stack those sats bitcoin bitcoincrash cryptocrash,0.033065810799598694,0.9480984210968018,0.01883578673005104
2022-05-09,20:45,I just bought $1.75 of #BTC . Hopefully that creates a surge 🥴,i just bought 175 of btc hopefully that creates a surge,0.30814751982688904,0.665841817855835,0.026010662317276
2022-05-09,20:45,"Some people are selling their #bitcoin. Me, I'm trying to figure out what items I can post on eBay to turn more dollars into harder, sounder money.",some people are selling their bitcoin me i am trying to figure out what items i can post on ebay to turn more dollars into harder sounder money,0.05622662231326103,0.896129310131073,0.04764413461089134
2022-05-09,20:45,"If the price of one of the seasonal tokens plunges, you can trade other seasonal tokens for it and increase the number of tokens you own.
#SeasonalTokens #CryptoMining #CyclicalInvesting #BTC",if the price of one of the seasonal tokens plunges you can trade other seasonal tokens for it and increase the number of tokens you own seasonaltokens cryptomining cyclicalinvesting btc,0.17804935574531555,0.7971850037574768,0.024765627458691597
2022-05-09,20:45,"@TheStreet Wait, Schiff? Time to long #BTC $btc 🚀",thestreet wait schiff time to long btc btc,0.06794803589582443,0.8944926261901855,0.037559349089860916
2022-05-09,20:45,"#Bitcoin at a free fall, Is it crypto winter?🤷🏻‍♂️",bitcoin at a free fall is it crypto winter,0.025113709270954132,0.9320814609527588,0.04280490055680275
2022-05-09,20:45,@HenriIVcrypto @Davincij15 If you are interested in #BTC trading and want to improve your skill or have any questions you are welcome to join @mstrade trading community! You can meet nice people there and get any tip or advice you need!,henriivcrypto davincij15 if you are interested in btc trading and want to improve your skill or have any questions you are welcome to join mstrade trading community you can meet nice people there and get any tip or advice you need,0.17632433772087097,0.8134932518005371,0.010182425379753113
2022-05-09,20:45,"$UST is the chosen one - effeminate nerd energy renders many unable to see.

The dramatic evolution of a global decentralized #Dollar that strengthens with each survived stress test.

Part 1 was #bitcoin , part 2 $ETH (smart contracts), part 3 is the Libertarianization of dollar.",ust is the chosen one effeminate nerd energy renders many unable to see the dramatic evolution of a global decentralized dollar that strengthens with each survived stress test part 1 was bitcoin part 2 eth smart contracts part 3 is the libertarianization of dollar,0.06820720434188843,0.8920555114746094,0.03973724693059921
2022-05-09,20:45,"@Oviroro_ I'm sorry, I mean the price mark of #BTC as at then not the current price now.",oviroro i am sorry i mean the price mark of btc as at then not the current price now,0.031948454678058624,0.8893487453460693,0.07870274782180786
2022-05-09,20:45,"We will go under 30k

$BTC #Bitcoin 

Watch Weekly and Monthly chart !",we will go under 30k btc bitcoin watch weekly and monthly chart,0.043799471110105515,0.9407287240028381,0.015471745282411575
2022-05-09,20:45,"I have buy orders at ridiculously low prices. #alts can go another 90%. Not checking my total port but keep adding liquidity to buy this 'dip' when #BTC is around $30,000-$24,000",i have buy orders at ridiculously low prices alts can go another 90 not checking my total port but keep adding liquidity to buy this dip when btc is around 30000 24000,0.1237322986125946,0.7919673919677734,0.08430034667253494
2022-05-09,20:45,"Always trade tokens for more tokens and the total number of tokens you own will increase with every trade.
#SeasonalTokens #CryptoMining #CyclicalInvesting #BTC",always trade tokens for more tokens and the total number of tokens you own will increase with every trade seasonaltokens cryptomining cyclicalinvesting btc,0.2774907052516937,0.7107385993003845,0.011770683340728283
2022-05-09,20:45,@natbrunell Not worried at all. #hodl and buying more #btc,natbrunell not worried at all hodl and buying more btc,0.16313190758228302,0.8036171793937683,0.033250827342271805
2022-05-09,20:45,@zolah04 @Davincij15 Check out @mstrade trading community if you are interested in #BTC and want to improve your trading or get a tip or advice from experienced traders!,zolah04 davincij15 check out mstrade trading community if you are interested in btc and want to improve your trading or get a tip or advice from experienced traders,0.19988492131233215,0.7901731133460999,0.009941989555954933
2022-05-09,20:45,"All jokes aside, who is selling their #Bitcoin at these levels?",all jokes aside who is selling their bitcoin at these levels,0.026143085211515427,0.9148738980293274,0.05898301675915718
2022-05-09,20:45,"#BitcoinButton  Who bought BTC or #bitcoin 10 years ago, 2 million edla and got it today, you are a billionaire. #cryptocurrency #Money of the future world #Blockchain",bitcoinbutton who bought btc or bitcoin 10 years ago 2 million edla and got it today you are a billionaire cryptocurrency money of the future world blockchain,0.06788324564695358,0.9194769263267517,0.01263981219381094
2022-05-09,20:45,@JTCryptosis For real 💯 try to justify buying more #BTC  or just stuff it @GutterCatGang. Probably both ..bottom isn’t in yet. IMO,jtcryptosis for real try to justify buying more btc or just stuff it guttercatgang probably both bottom isn not in yet imo,0.04432624951004982,0.91703200340271,0.03864173963665962
2022-05-09,20:45,@cheongchaklaw @Davincij15 If you are interested in #BTC trading and want to improve your skill or have any questions you are welcome to join @mstrade trading community! You can meet nice people there and get any tip or advice you need!,cheongchaklaw davincij15 if you are interested in btc trading and want to improve your skill or have any questions you are welcome to join mstrade trading community you can meet nice people there and get any tip or advice you need,0.18263956904411316,0.8068459630012512,0.010514487512409687
2022-05-09,20:45,"An investor who trades 3 Spring tokens for 5 Summer tokens will have more tokens in total after the trade than before. 
#SeasonalTokens #CryptoMining #CyclicalInvesting #BTC",an investor who trades 3 spring tokens for 5 summer tokens will have more tokens in total after the trade than before seasonaltokens cryptomining cyclicalinvesting btc,0.10267830640077591,0.8654925227165222,0.03182923048734665
2022-05-09,20:45,"YouHODL bought another 100 #Bitcoin   at an average USD price of $30,556

We now #HODL 7,942 #BTC                                                                  
10% of this amount is invested with #cloudmining pool @b1pool

#crypto
#cryptocurrency
#BitcoinWhale",youhodl bought another 100 bitcoin at an average usd price of 30556 we now hodl 7942 btc 10 of this amount is invested with cloudmining pool b1pool crypto cryptocurrency bitcoinwhale,0.0647427961230278,0.9237056374549866,0.011551585048437119
2022-05-09,20:45,"The only panic I feel right now is how to get more € to buy more #Bitcoin, bc nothing changed fundamentally. 

Fiat is worthless bc it can be printed out of thin air. #Bitcoin is our only hope 🧡.",the only panic i feel right now is how to get more to buy more bitcoin bc nothing changed fundamentally fiat is worthless bc it can be printed out of thin air bitcoin is our only hope,0.04017689451575279,0.9213209748268127,0.038502179086208344
2022-05-09,20:45,Don’t cheer. Like you shouldn’t have been crying a couple of hours ago. #btc #xrp #ETH #crypto,don not cheer like you shouldn not have been crying a couple of hours ago btc xrp eth crypto,0.036465615034103394,0.9077507257461548,0.05578361079096794
2022-05-09,20:45,IMO buying #Bitcoin and many of the current #growth #stocks out there now would be a great investment.,imo buying bitcoin and many of the current growth stocks out there now would be a great investment,0.405575692653656,0.5847087502479553,0.009715557098388672
2022-05-09,20:45,What's your bear market strategy for #Bitcoin,what is your bear market strategy for bitcoin,0.03665544092655182,0.9445305466651917,0.01881404034793377
2022-05-09,20:45,@THORChain If you really interested in a stable algo  backed by #Bitcoin that keeps it's pegged in a turstless way (bitcoiner style) you should list $DoC by @moneyonchainok.,thorchain if you really interested in a stable algo backed by bitcoin that keeps it is pegged in a turstless way bitcoiner style you should list doc by moneyonchainok,0.052340734750032425,0.9332809448242188,0.014378322288393974
2022-05-09,20:45,Liar liar pants on fire 🔥the big question. Is @saylor on leverage or the guys behind the #luna #btc,liar liar pants on fire the big question is saylor on leverage or the guys behind the luna btc,0.02383193001151085,0.91013503074646,0.06603307276964188
2022-05-09,20:45,“An investor's worst enemy is not the stock market but his own emotions” #Bitcoin,an investor worst enemy is not the stock market but his own emotions bitcoin,0.03237806633114815,0.6953468918800354,0.27227506041526794
2022-05-09,20:45,#btc whales telling us to go outside this summer defi is cancelled,btc whales telling us to go outside this summer defi is cancelled,0.037921518087387085,0.9325150847434998,0.029563454911112785
2022-05-09,20:45,"I'm not gonna lie... Although I wanted to see lower prices for #btc, this day has been scary",i am not gonna lie although i wanted to see lower prices for btc this day has been scary,0.5236336588859558,0.39508888125419617,0.08127743005752563
2022-05-09,20:45,@Blockworks_ They have been sold all $1.5b #Bitcoin ?,blockworks they have been sold all 15b bitcoin,0.039623599499464035,0.9438936114311218,0.01648281328380108
2022-05-09,20:45,@silverguru22 Return of sound money to the world is no tulip. #Bitcoin,silverguru22 return of sound money to the world is no tulip bitcoin,0.1407402604818344,0.8442537188529968,0.015006004832684994
2022-05-09,20:45,"#spx closed below $4000 and #bitcoin is a breath away from $30k mark , what happens now ?",spx closed below 4000 and bitcoin is a breath away from 30k mark what happens now,0.03649560734629631,0.6061549186706543,0.35734954476356506
2022-05-09,20:45,"The fintwit follower growth hack has always been being ""irrationally long"" a single asset... #bitcoin is the best example of this.  

Horrendous for returns, great for paid newsletter subs.",the fintwit follower growth hack has always been being irrationally long a single asset bitcoin is the best example of this horrendous for returns great for paid newsletter subs,0.08953146636486053,0.7575917840003967,0.15287666022777557
2022-05-09,20:45,@PeterSchiff @CNBC But #bitcoin fixes this 😎,peterschiff cnbc but bitcoin fixes this,0.05085426941514015,0.901334822177887,0.04781093820929527
2022-05-09,20:45,Breaking news:  https://t.co/6Zkbi0FUet #BTC #Crypto #Binance #Altcoins #ADA #Sand #Doge #Luna #Bitcoinpump #dogecoin #FTM #Cardano #PlanB #Uniswap #Sushiswap #xrp #NFT #Solana #SOL #shiba #Ethereum #Cryptocurrency #Ether #Etherium #Bitcoin #Bullrun  #cryptonews  #ALGO #Ma,breaking btc crypto binance altcoins ada sand doge luna bitcoinpump dogecoin ftm cardano planb uniswap sushiswap xrp nft solana sol shiba ethereum cryptocurrency ether etherium bitcoin bullrun cryptonews algo ma,0.049242693930864334,0.9294335246086121,0.021323734894394875
2022-05-09,20:45,It’s only two things that will push the crypto market up parabolic 1. #Bitcoin #btc  spot ETF 2. #ETH2,its only two things that will push the crypto market up parabolic 1 bitcoin btc spot etf 2 eth2,0.6677553057670593,0.311404824256897,0.020839907228946686
2022-05-09,20:45,@nattyzworld Sounds interesting.. only a #btc thing??,nattyzworld sounds interesting only a btc thing,0.028013771399855614,0.936381459236145,0.03560478612780571
2022-05-09,20:45,#Bitcoin bottom looks in,bitcoin bottom looks in,0.16914480924606323,0.6942132115364075,0.1366419643163681
2022-05-09,20:45,What’s next for #BTC ? Will go under 30k ? #Cryptocrash,whats next for btc will go under 30k cryptocrash,0.02693224884569645,0.9455689191818237,0.027498852461576462
2022-05-09,20:45,@CryptoWendyO @AltcoinDailyio USDT is no longer pegged to USDC.  #BTC has to be sold to restore the peg. Unfortunately for LUNA.,cryptowendyo altcoindailyio usdt is no longer pegged to usdc btc has to be sold to restore the peg unfortunately for luna,0.18265533447265625,0.7986450791358948,0.018699580803513527
2022-05-09,20:45,"in these situations you buy, 
you don't sell! #btc",in these situations you buy you do not sell btc,0.02793271467089653,0.9331457614898682,0.03892148286104202
2022-05-09,20:45,"#Bitcoin JUST PUMPED LIKE $1,000 IN THE PAST HOUR. BULLISH!!!!!! 😤📈🚀🌝",bitcoin just pumped like 1000 in the past hour bullish,0.2987540662288666,0.6808261275291443,0.020419811829924583
2022-05-09,20:45,@BTCCopy @Davincij15 Check out @mstrade trading community if you are interested in #BTC market price analysis! These guys are professional traders and they are doing good math!,btccopy davincij15 check out mstrade trading community if you are interested in btc market price analysis these guys are professional traders and they are doing good math,0.233358696103096,0.7557889819145203,0.010852226056158543
2022-05-09,20:45,"Oga sabinus is the king of Naija comedy now. No need to drag the crown with him, instead use that energy to trade #Bitcoin in this #Cryptocrash  . Vote sabinus or don’t vote at all 

Stephanie apostle portable wike El salvador fulani Kendrick #altcoins",oga sabinus is the king of naija comedy now no need to drag the crown with him instead use that energy to trade bitcoin in this cryptocrash vote sabinus or don not vote at all stephanie apostle portable wike el salvador fulani kendrick altcoins,0.04900915548205376,0.9298170804977417,0.021173756569623947
2022-05-09,20:45,@CryptoWhale Not only that they will start to encourage to open long positions arguing that the bottom is in. But the #bitcoin monthly chart shows that this is going much lower.,cryptowhale not only that they will start to encourage to open long positions arguing that the bottom is in but the bitcoin monthly chart shows that this is going much lower,0.2689932584762573,0.19428035616874695,0.5367263555526733
2022-05-09,20:45,"Biden finally won,he   worked hard for news  #recession  ! only in US  !!!  #marketcrash  DOW to zero next weeks ! real esate market crash soon,hosue prices was triple, over valued mortgage approved by scam bankers!  bankers are criminal invest in #BTC  #Crypto",biden finally wonhe worked hard for news recession only in us marketcrash dow to zero next weeks real esate market crash soonhosue prices was triple over valued mortgage approved by scam bankers bankers are criminal invest in btc crypto,0.09493084251880646,0.8072036504745483,0.09786553680896759
2022-05-09,20:45,"if you fear now and sell fearfully, exit the market and don't come back. you don't deserve long-term success if you're stressing in the short term #Bitcoin #MTRG ⚡️ @CryptoWizardd @Meter_IO 💎",if you fear now and sell fearfully exit the market and do not come back you do not deserve longterm success if you are stressing in the short term bitcoin mtrg cryptowizardd meterio,0.06817606836557388,0.7705933451652527,0.1612306535243988
2022-05-09,20:45,@ashwsbreal @SirDecka Let’s gooooooo!!! #BTC,ashwsbreal sirdecka lets gooooooo btc,0.05264677852392197,0.9145463705062866,0.03280682489275932
2022-05-09,20:45,"@CryptoWendyO @AltcoinDailyio Of course it is. Dont trust shitcoins, disguised as stable coins. Only one will rule them all - just buy #BTC",cryptowendyo altcoindailyio of course it is dont trust shitcoins disguised as stable coins only one will rule them all just buy btc,0.04352857545018196,0.9330933094024658,0.02337806485593319
2022-05-09,20:45,"🚀🚀🚀 $1,120,587 BTCUSDT LONGED @$31,235.90 on #Binance (20:33:10 UTC) #BTC #cryptocurrency",1120587 btcusdt longed 3123590 on binance utc btc cryptocurrency,0.03670131042599678,0.9298953413963318,0.033403344452381134
2022-05-09,20:45,#BTC mega sale. Stack them sats!,btc mega sale stack them sats,0.05659083276987076,0.9279063940048218,0.015502790920436382
2022-05-09,20:45,#BTC  entering my buy zone!,btc entering my buy zone,0.07557358592748642,0.9038742184638977,0.02055218070745468
2022-05-09,20:45,"@MetawarOfficial Awesome project of 2022
#BULL
#Bitcoin 
#CRYPTONEWS",metawarofficial awesome project of 2022 bull bitcoin cryptonews,0.07814144343137741,0.9092208743095398,0.01263769343495369
2022-05-09,20:45,"Just remember.
1 BTC != $30k
1 BTC = 1 BTC
#BTC",just remember 1 btc 30k 1 btc 1 btc btc,0.08058501780033112,0.893912672996521,0.025502251461148262
2022-05-09,20:45,"I’ve had zero negative emotions about #bitcoin today, two years ago I would have been destroyed about my stock portfolio. 

Tick tock…",ive had zero negative emotions about bitcoin today two years ago i would have been destroyed about my stock portfolio tick tock,0.05483781546354294,0.6234760880470276,0.32168611884117126
2022-05-09,20:45,@TheCryptoZombie I don't have #BTC,thecryptozombie i do not have btc,0.024240145459771156,0.9216496348381042,0.05411016568541527
2022-05-09,20:45,"The market is feeling I am crying 
#btc #crypto",the market is feeling i am crying btc crypto,0.06197366118431091,0.544603705406189,0.3934226334095001
2022-05-09,20:45,"Too many 0-24 month people playing 2+ year games.

#Bitcoin",too many 024 month people playing 2 year games bitcoin,0.022210733965039253,0.7624304890632629,0.21535877883434296
2022-05-09,20:45,"The time you'll realise that those verified gurus ain't better than you are,then you'll start making your own decisions.What I'm I saying??  Some btc millionaires are not truly investors, just heard of #btc and allocated big $$ into it at low price. Some of them are entrepreneurs",the time you will realise that those verified gurus am not better than you arethen you will start making your own decisionswhat i am i saying some btc millionaires are not truly investors just heard of btc and allocated big into it at low price some of them are entrepreneurs,0.046009428799152374,0.9256500005722046,0.028340531513094902
2022-05-09,20:45,@TheMoonCarl $sats and #bitcoin,themooncarl sats and bitcoin,0.03852905333042145,0.9415410161018372,0.01992996595799923
2022-05-09,20:45,"🚨🚨🚨 37,190.47 #BTC ($1,147,562,978) aggregated entries for #Gemini 
😳😳😳😳😳😳",3719047 btc 1147562978 aggregated entries for gemini,0.02420194074511528,0.9195823073387146,0.056215763092041016
2022-05-09,20:45,@Crypwizcrypto1 @Davincij15 The entire world has no choice but to accept crypto. Study #Bitcoin so you can understand the world. You are welcome to join @mstrade community if you are interested in crypto!,crypwizcrypto1 davincij15 the entire world has no choice but to accept crypto study bitcoin so you can understand the world you are welcome to join mstrade community if you are interested in crypto,0.12466207891702652,0.8660723567008972,0.009265530854463577
2022-05-09,20:45,I can’t fit to cry all I can do is laugh #Bitcoin,i can not fit to cry all i can do is laugh bitcoin,0.023722928017377853,0.7886471152305603,0.18762999773025513
2022-05-09,20:45,"Thoughts 💭 

There will be some kind of relief , markets move in waves and not straight to zero

From a macro view we are still fckd. In a bear market every bullish impulse is temporary. To form a solid ground or bottom you need time. 

#Bitcoin",thoughts there will be some kind of relief markets move in waves and not straight to zero from a macro view we are still fckd in a bear market every bullish impulse is temporary to form a solid ground or bottom you need time bitcoin,0.09713252633810043,0.8502519726753235,0.052615564316511154
2022-05-09,20:45,fake relief rally. #bitcoin gonna dump below 30k,fake relief rally bitcoin gonna dump below 30k,0.15285655856132507,0.5559549331665039,0.29118847846984863
2022-05-09,20:45,"People should stop thinking only that with HODL they are going to become a millionaire, they should be responsible and have good money management

#btc #eth",people should stop thinking only that with hodl they are going to become a millionaire they should be responsible and have good money management btc eth,0.10443706065416336,0.8839449286460876,0.01161802839487791
2022-05-09,20:45,"@apollo_river $PAW is taking over the crypto twitter space.

🐕🐈🐻🐘🦔🐒🦁🐴🐔🐇🐖🦝

#doge #shib #crypto #bitcoin #cryptocurrency",apolloriver paw is taking over the crypto twitter space doge shib crypto bitcoin cryptocurrency,0.03989804908633232,0.946357011795044,0.013744911178946495
2022-05-09,20:45,"The states are collecting bitcoin under their hands, so that no one gets excited, bitcoin will fall to 20-odd, nothing like that will happen, they want to leave people out, and they want to make a system that attracts the rich #Bitcoin #Btc #Binance #Bnb #Ethereum #cripto",the states are collecting bitcoin under their hands so that no one gets excited bitcoin will fall to 20odd nothing like that will happen they want to leave people out and they want to make a system that attracts the rich bitcoin btc binance bnb ethereum cripto,0.04056646674871445,0.898578941822052,0.06085463613271713
2022-05-09,20:45,"When #Bitcoin is up, all bulls come out with their chest beating, proclaiming they're right.

When #BTC is down, all bears come out with their chest beating, proclaiming they're right.

Crazy how that works. I'm just waiting for my triggers to go off so I can stack more #sats.",when bitcoin is up all bulls come out with their chest beating proclaiming they are right when btc is down all bears come out with their chest beating proclaiming they are right crazy how that works i am just waiting for my triggers to go off so i can stack more sats,0.04702841117978096,0.9128122925758362,0.04015934467315674
2022-05-09,20:45,"To be short #bitcoin implies that you think the government will default on their debt rather than print the money.

That is never the politically viable choice.

This volatility is a fantastic opportunity imo.

Fed will come to the rescue eventually... print brrr",to be short bitcoin implies that you think the government will default on their debt rather than print the money that is never the politically viable choice this volatility is a fantastic opportunity imo fed will come to the rescue eventually print brrr,0.2267533242702484,0.7496548891067505,0.023591816425323486
2022-05-09,20:45,#btc accumulation begins.,btc accumulation begins,0.086548812687397,0.8853679299354553,0.02808319590985775
2022-05-09,20:45,I am at universe #777 where the crypto prices are up 1000% every day . It took me 100days to open the portal and some spell learning........ #BTC #Crypto #forfun,i am at universe 777 where the crypto prices are up 1000 every day it took me 100days to open the portal and some spell learning btc crypto forfun,0.1275031715631485,0.8561064600944519,0.016390400007367134
2022-05-09,20:45,@SokoAnalyst One day #Bitcoin will be used as a reserve currency. Crypto is too big to fail unlike fiat currency.,sokoanalyst one day bitcoin will be used as a reserve currency crypto is too big to fail unlike fiat currency,0.03881872817873955,0.8873937726020813,0.07378750294446945
2022-05-09,20:45,"We're gonna need everyone to ""give up it's over."" For this thing to finally reverse. #Bitcoin",we are gonna need everyone to give up it is over for this thing to finally reverse bitcoin,0.10020928084850311,0.8472478985786438,0.052542876452207565
2022-05-09,20:45,"so seems like if #Bitcoin moves, it moves every fkn market.

we called BAYC the BTC of NFTs but nah man, BTC movement is affecting every market.

if BTC stables, we will see some good upward movement.",so seems like if bitcoin moves it moves every fkn market we called bayc the btc of nfts but nah man btc movement is affecting every market if btc stables we will see some good upward movement,0.31871289014816284,0.6370975971221924,0.04418954625725746
2022-05-09,20:45,"@Cointelegraph This project @MetagwaraToken  has been an amazing project that's about to take over . Bitgert/#MGT partnership has been finalized successfully with great implications for the project. Consequently, #MGT has now migrated to bitgert chain .We are early guys hop in to #MGT 

#btc ￼",cointelegraph this project metagwaratoken has been an amazing project that is about to take over bitgertmgt partnership has been finalized successfully with great implications for the project consequently mgt has now migrated to bitgert chain we are early guys hop in to mgt btc,0.8059730529785156,0.186378613114357,0.00764830969274044
