Date,Time,Original tweet,Clean tweet,Positive,Neutral,Negative
2022-05-07,16:15,"Central Bank of Argentina Bans Private Banks From Offering Cryptocurrency Services
https://t.co/amYlaI3NjF
#airdrop #giveway #followback #seigniorage #bsc #btc",central bank of argentina bans private banks from offering cryptocurrency services airdrop giveway followback seigniorage bsc btc,0.017866531386971474,0.6632978916168213,0.3188355565071106
2022-05-07,16:15,"Wanna own your home?

Save in #Bitcoin where your purchasing power grows rather than shrinks; the US chart below

#cryptotrading #Crypto #BTC #Ethereum #NFT #HODL #hodling #buythedip #Cryptocrash https://t.co/uTanPooSNR",wanna own your home save in bitcoin where your purchasing power grows rather than shrinks the us chart below cryptotrading crypto btc ethereum nft hodl hodling buythedip cryptocrash,0.07581835240125656,0.905890166759491,0.018291492015123367
2022-05-07,16:15,"#Bitcoin Quick Rip: YOU choose how to interact with #BTC (ft @heady_wook )
https://t.co/60nnERzHce",bitcoin quick you choose how to interact with btc ft headywook,0.040696434676647186,0.9435598850250244,0.015743674710392952
2022-05-07,16:15,"🛑 BITCOIN WHAT DO WE NEED??!! 🛑 
Watch my latest BITCOIN update on @YouTube 
https://t.co/RQIMspncC2
#btc #bitcoin $btc https://t.co/tpNycdpMWJ",bitcoin what do we need watch my latest bitcoin update on youtube btc bitcoin btc,0.03262849897146225,0.9415668249130249,0.025804735720157623
2022-05-07,16:15,@LawrenceLepard Now do #BTC,lawrencelepard now do btc,0.05551699548959732,0.9088457226753235,0.0356372632086277
2022-05-07,16:15,"@Dennis_Porter_ They are only scared of privacy ( $xmr ), not coins they can use as surveillance like #Bitcoin.",dennisporter they are only scared of privacy xmr not coins they can use as surveillance like bitcoin,0.032170940190553665,0.9242948293685913,0.04353426396846771
2022-05-07,16:15,Current #Bitcoin Price is $35969 #BTC #Crypto,current bitcoin price is 35969 btc crypto,0.02047366090118885,0.9467737674713135,0.032752566039562225
2022-05-07,16:15,"@BTC_Archive Good 
UK stoped it last year 
Hasn't stoped people being able to trade #Bitcoin and #Crypto on Binance
So a non event",btcarchive good uk stoped it last year has not stoped people being able to trade bitcoin and crypto on binance so a non event,0.0819290280342102,0.8887932300567627,0.029277769848704338
2022-05-07,16:15,"Rtr160 Friends, I found new gem! Just take a look at FxRumble, you will like it, I am sure. Participate in contests and tournaments to get good rewards just for your trading experience #FxRumble #CRYPTO #trading #Forex #Gaming  #cryptocurrency #blockchain #Defi #Metaverse #BTC",rtr160 friends i found new gem just take a look at fxrumble you will like it i am sure participate in contests and tournaments to get good rewards just for your trading experience fxrumble crypto trading forex gaming cryptocurrency blockchain defi metaverse btc,0.09878043085336685,0.8892213106155396,0.011998220346868038
2022-05-07,16:15,Revenue coin is a unique project. This project has a very unique and hard working team. So i am sure for the success of this project.#revenue #revenuecoin #bnb #bitcoin,revenue coin is a unique project this project has a very unique and hard working team so i am sure for the success of this projectrevenue revenuecoin bnb bitcoin,0.7556352019309998,0.23605778813362122,0.008306986652314663
2022-05-07,16:15,"@Teldra2 @LynAldenContact #bitcoin is a digital asset that is global, scarce, censorship resistant, divisible, fungible, and can be transferred anywhere in the world in a second. All traits that beanie babies don't have.",teldra2 lynaldencontact bitcoin is a digital asset that is global scarce censorship resistant divisible fungible and can be transferred anywhere in the world in a second all traits that beanie babies do not have,0.08019156754016876,0.9045575261116028,0.015250897966325283
2022-05-07,16:15,@DiversiFibsc @bava23 @davidgokhshtein @gokhshteinmedia #DiversiFi has you covered. #Rewards in 5 blue chip #Cryptos #Btc #ETH #AVAX #DOT #matic,diversifibsc bava23 davidgokhshtein gokhshteinmedia diversifi has you covered rewards in 5 blue chip cryptos btc eth avax dot matic,0.2081548124551773,0.7784610986709595,0.01338412705808878
2022-05-07,16:15,"@cryptojack IF you ape in early yes, till now I still don't own 1 #BTC",cryptojack if you ape in early yes till now i still do not own 1 btc,0.027747901156544685,0.9304089546203613,0.041843194514513016
2022-05-07,16:15,"@AirdropDet I hope this project will be successful sir, and then it becomes one of the best cryptos, Good luck. 

@isalbyu2 
@yanuset2 
@Yuliakasih22 

#airdrops #DexCheck #Bitcoin    #AirdropDet",airdropdet i hope this project will be successful sir and then it becomes one of the best cryptos good luck isalbyu2 yanuset2 yuliakasih22 airdrops dexcheck bitcoin airdropdet,0.3162566125392914,0.6752274632453918,0.008515965193510056
2022-05-07,16:15,"@BitcoinMagazine @BitcoinEkasi Why Genius Satoshi Nakamoto thought of 21M #BTC why int 21M ..!!! 
@DocumentingBTC @BTC_Archive",bitcoinmagazine bitcoinekasi why genius satoshi nakamoto thought of 21m btc why int 21m documentingbtc btcarchive,0.048361726105213165,0.9260486364364624,0.02558964677155018
2022-05-07,16:15,"From my Observation, @EmperorBTC is mostly active during bad times like this, trying to motivate, teach and make sure we all survive this period, so that we can reap the rewards when the bulls return👍🏽
#Crypto #Bitcoin",from my observation emperorbtc is mostly active during bad times like this trying to motivate teach and make sure we all survive this period so that we can reap the rewards when the bulls return crypto bitcoin,0.10369978845119476,0.8838021159172058,0.012498047202825546
2022-05-07,16:15,"I'm not interested in price, I don't care if the price goes up or down. I'm interested in #Bitcoin itself, the technology behind it.

“#Bitcoin is more than a price.”",i am not interested in price i do not care if the price goes up or down i am interested in bitcoin itself the technology behind it bitcoin is more than a price,0.043132465332746506,0.9353346824645996,0.02153286151587963
2022-05-07,16:15,"On average, the price of a #bitcoin has gone up $7.40 per day since it has existed.",on average the price of a bitcoin has gone up 740 per day since it has existed,0.9061527252197266,0.057069920003414154,0.03677738830447197
2022-05-07,16:15,"#SeasonalTokens #CryptoMining #Cyclicallnvesting #BTC
SeasonalTokens coins are specifically created for global usage with virtual wallets eliminating the need to carry physical cash",seasonaltokens cryptomining cyclicallnvesting btc seasonaltokens coins are specifically created for global usage with virtual wallets eliminating the need to carry physical cash,0.1000145673751831,0.889004647731781,0.010980745777487755
2022-05-07,16:15,"@OZONE42798933 @BitcoinComfy #Bitcoin was and is made for the inner circle rich. Whales, exchanges..",ozone42798933 bitcoincomfy bitcoin was and is made for the inner circle rich whales exchanges,0.0531826987862587,0.9319076538085938,0.014909612014889717
2022-05-07,16:15,@cz_binance #Bitcoin is the money.,czbinance bitcoin is the money,0.03622986748814583,0.947225034236908,0.016545061022043228
2022-05-07,16:15,"@tyler adding more #BTC to the #HODL stack every day, twice a day.",tyler adding more btc to the hodl stack every day twice a day,0.12731170654296875,0.85797119140625,0.014717156998813152
2022-05-07,16:15,@Junglejuice_btc Spot on. #Bitcoin is on track to become the world's reserve currency over the next decade.,junglejuicebtc spot on bitcoin is on track to become the world reserve currency over the next decade,0.7155012488365173,0.2762809097766876,0.008217837661504745
2022-05-07,16:15,@LynAldenContact @ycharts @LynAldenContact you are amazing! #Bitcoin,lynaldencontact ycharts lynaldencontact you are amazing bitcoin,0.10691721737384796,0.8789236545562744,0.014159157872200012
2022-05-07,16:15,"@Not_IMFNews 
$BTC
#bitcoin 
Bitcoin is the alpha and the omega",notimfnews btc bitcoin bitcoin is the alpha and the omega,0.04727797955274582,0.9409250020980835,0.011797009967267513
2022-05-07,16:15,@MoonwithADAM Putting all my savings in #btc now!,moonwithadam putting all my savings in btc now,0.04440600797533989,0.9341443777084351,0.02144959382712841
2022-05-07,16:15,"To whoever said #bitcoin was going to hit 25k, that’s not happening. It’s about to pump hard 🚀",to whoever said bitcoin was going to hit 25k thats not happening its about to pump hard,0.10368385165929794,0.8519245386123657,0.04439157620072365
2022-05-07,16:15,Today is a good day to buy #Bitcoin.,today is a good day to buy bitcoin,0.6666995882987976,0.32354220747947693,0.009758231230080128
2022-05-07,16:15,make #cryptocurrency #litecoin #bitcoin with @jobboycom,make cryptocurrency litecoin bitcoin with jobboycom,0.06274063885211945,0.9231441617012024,0.014115196652710438
2022-05-07,16:15,"project is very serious and reliable for investment. The company has already implemented many successful projects around the world
#RadiantGalaxy #Gaxy #Metaverse #NFTs #Gaming #DeFi #Airdrop  #cryptocurrency #blockchain  #Defi #NFT #crypto #BTC #Altcoin #NFTCommunity
#NFTgamers",project is very serious and reliable for investment the company has already implemented many successful projects around the world radiantgalaxy gaxy metaverse nfts gaming defi airdrop cryptocurrency blockchain defi nft crypto btc altcoin nftcommunity nftgamers,0.43747231364250183,0.5544982552528381,0.00802943017333746
2022-05-07,16:15,Not your #Bitcoin not your 🔑,not your bitcoin not your,0.029194971546530724,0.8991797566413879,0.071625255048275
2022-05-07,16:15,"I hope we get a fat green bullish dildo up to the #BTC highs, but until then guys the trend is down, and so this is how i trade it and made good money doing so 

You want too long every bounce, go right ahead and tweet about it. Don't like what i tweet, unfollow and bugger off ❤️",i hope we get a fat green bullish dildo up to the btc highs but until then guys the trend is down and so this is how i trade it and made good money doing so you want too long every bounce go right ahead and tweet about it do not like what i tweet unfollow and bugger off,0.018987879157066345,0.18406647443771362,0.7969456911087036
2022-05-07,16:15,"@Polyd_ @TheGuySwann @coinbase Cool yea that’s one of the coolest parts of the #bitcoin blockchain. I can pay someone, and they cannot deny they’ve received my payment. It’s right there in the latest block that confirmed it!",polyd theguyswann coinbase cool yea thats one of the coolest parts of the bitcoin blockchain i can pay someone and they cannot deny theyve received my payment its right there in the latest block that confirmed it,0.12089455872774124,0.8625360131263733,0.016569457948207855
2022-05-07,16:15,"best Future Trading Exchange is?

#Bitcoin #binance",best future trading exchange is bitcoin binance,0.08890757709741592,0.8992630243301392,0.011829339899122715
2022-05-07,16:15,"@scottmelker @Dennis_Porter_ Why not prioritize sending it to developing nation's politicians and political activists? 

idealism, speculation, or utility IMO are the 3 motivations of interest in #Bitcoin 

The peoples of developing nations need $BTC to get out of the grip of the World Bank and IMF.",scottmelker dennisporter why not prioritize sending it to developing nation politicians and political activists idealism speculation or utility imo are the 3 motivations of interest in bitcoin the peoples of developing nations need btc to get out of the grip of the world bank and imf,0.053947802633047104,0.9294009804725647,0.016651153564453125
2022-05-07,16:15,"Yo, how many people who sold their houses for #BTC or #ETH in the last year? You literally just sold your house for 30-40% less than what you hoped.",yo how many people who sold their houses for btc or eth in the last year you literally just sold your house for 3040 less than what you hoped,0.03209426999092102,0.889965295791626,0.07794048637151718
2022-05-07,16:15,@JambesGre @NervosNetwork You say shit coin because they aren't pleasing your short term mindset of price exploring to highs instead of waiting for the project to be refined and fine tuned to actually be a stronger version of #Bitcoin and #ETH  #Nervos is newer so patience is important💯,jambesgre nervosnetwork you say shit coin because they are not pleasing your short term mindset of price exploring to highs instead of waiting for the project to be refined and fine tuned to actually be a stronger version of bitcoin and eth nervos is newer so patience is important,0.1660679429769516,0.8187903761863708,0.015141715295612812
2022-05-07,16:15,@BTC_is_king1 @NikoJilch #Bitcoin is for everyone,btcisking1 nikojilch bitcoin is for everyone,0.04896671324968338,0.932297945022583,0.018735365942120552
2022-05-07,16:15,"The Fed cannot tighten, and not for any other reason than this:

The rules to the fiat game rely on prices going up forever, ergo inflation good in the eyes of the Keynesian. 

Which means debasement of the dollar forever. 

#Bitcoin is true scarcity.",the fed cannot tighten and not for any other reason than the rules to the fiat game rely on prices going up forever ergo inflation good in the eyes of the keynesian which means debasement of the dollar forever bitcoin is true scarcity,0.05724363401532173,0.6864506602287292,0.2563057839870453
2022-05-07,16:15,@invest_answers @intocryptoverse @NewsAsset Are you a buyer of MSTR at this level?  How many shares equals 1 #btc,investanswers intocryptoverse newsasset are you a buyer of mstr at this level how many shares equals 1 btc,0.060536883771419525,0.9235875606536865,0.015875516459345818
2022-05-07,16:15,@binance Rise and shine #BTC,binance rise and shine btc,0.4858104884624481,0.48437264561653137,0.029816875234246254
2022-05-07,16:15,"When everyone get out the train , btc going up , that's how do it !
#btc",when everyone get out the train btc going up that is how do it btc,0.04065600782632828,0.9374125599861145,0.021931448951363564
2022-05-07,16:15,@bouchondeliege_ @jeune_rat_94 Mdrrrrrr mais oui la fefe sur snap mais I need a logo and a banner il leur faut un metamask trust wallet need help #ETH #BTC  solana coinbase binance account blocked,bouchondeliege jeunerat94 mdrrrrrr mais oui la fefe sur snap mais i need a logo and a banner il leur faut un metamask trust wallet need help eth btc solana coinbase binance account blocked,0.12717196345329285,0.8592422604560852,0.0135857705026865
2022-05-07,16:15,"I just set up a daily recurring buy ($20) for #Bitcoin Grown weary of trying to time dips, if we are in a macro downtrend or gonna chop sideways for another year then it’s all good.",i just set up a daily recurring buy 20 for bitcoin grown weary of trying to time dips if we are in a macro downtrend or gonna chop sideways for another year then its all good,0.049795832484960556,0.6812084317207336,0.2689957320690155
2022-05-07,16:15,Shima8095 #Bitcoin #Ethereum #BNB #ETH #BitcoinCrash #DOT #MANA #SHIB #XRP #DOGE #BABYDOGE #Saitama #ADA #SOL #FTM #M…,shima8095 bitcoin ethereum bnb eth bitcoincrash dot mana shib xrp doge babydoge saitama ada sol ftm m,0.07943093031644821,0.9075204133987427,0.013048604130744934
2022-05-07,16:15,#MetapleFinance #Metaple #MLX #blockchain #cryptocurrency #technology #bitcoin #money #crypto #Binance #BNB #cryptocurrencies #fintech The best platform and concept. Great future and Good team i think this projects Will be success.,metaplefinance metaple mlx blockchain cryptocurrency technology bitcoin money crypto binance bnb cryptocurrencies fintech the best platform and concept great future and good team i think this projects will be success,0.8345433473587036,0.15749935805797577,0.007957217283546925
2022-05-07,16:15,"@AirdropDet Good project 
#Airdrops #CanaBoyz #Bitcoin #AirdropDetective",airdropdet good project airdrops canaboyz bitcoin airdropdetective,0.15930014848709106,0.8323802947998047,0.00831956509500742
2022-05-07,16:15,@ChrisBlec It’s all DINO . Decentralized in name only . The only real decentralized coins at the current moment that I personally know of in my opinion are $btc #bitcoin  &amp; $xmr #monero maybe a few others.,chrisblec its all dino decentralized in name only the only real decentralized coins at the current moment that i personally know of in my opinion are btc bitcoin xmr monero maybe a few others,0.04589882493019104,0.9392542839050293,0.014846880920231342
2022-05-07,16:15,The amount of people I still see calling for a 400K #BTC this year 🤣,the amount of people i still see calling for a 400k btc this year,0.07639376819133759,0.9036946296691895,0.019911594688892365
2022-05-07,16:15,"@TechDev_52 #btc teaches us how to engage long term. These correction waves provide alpha to those that can remove emotion and follow the path to eternal glory. Allow support zones to give long term wisdom my friends. Thank the floors, and hug zones of resistance.",techdev52 btc teaches us how to engage long term these correction waves provide alpha to those that can remove emotion and follow the path to eternal glory allow support zones to give long term wisdom my friends thank the floors and hug zones of resistance,0.1594269871711731,0.8257891535758972,0.014783854596316814
2022-05-07,16:15,"@SmartKidCoin Good luck
Thanks for this opportuny 

@Robin_hulk21 @Cryptolenma 
@Jak_Ushiha 
#BTC
#BNB",smartkidcoin good luck thanks for this opportuny robinhulk21 cryptolenma jakushiha btc bnb,0.370719313621521,0.613576352596283,0.015704309567809105
2022-05-07,16:15,"Interesting project idea, specially now the market is developing, I'm sure this project will attract investments in the developmen #WorkQuest $WQT $WUSD #WorkNet #WorkQuestApp #blockchian #crypto #cryptolife #BTC #BNB #ETH #digitalization #digitalassets #saving #BinanceSmartChain",interesting project idea specially now the market is developing i am sure this project will attract investments in the developmen workquest wqt wusd worknet workquestapp blockchian crypto cryptolife btc bnb eth digitalization digitalassets saving binancesmartchain,0.42751896381378174,0.56498783826828,0.007493217941373587
2022-05-07,16:15,@derekmross The chances of taking a guess &amp; being wrong are massive but I’m going to guess #Mexico is next official legal tender... Central American &amp; African countries are the most likely alternatives... anyone has some specific guesses? @Excellion #Bitcoin #BTC #Africa #News #Economy #USA,derekmross the chances of taking a guess being wrong are massive but im going to guess mexico is next official legal tender central american african countries are the most likely alternatives anyone has some specific guesses excellion bitcoin btc africa news economy usa,0.03697041794657707,0.9359003901481628,0.02712925523519516
2022-05-07,16:15,"🚀🚀🚀 $2,422,531 BTCUSDT LONGED @$35,953.80 on #Binance (16:10:40 UTC) #BTC #cryptocurrency",2422531 btcusdt longed 3595380 on binance utc btc cryptocurrency,0.04174095764756203,0.9253897666931152,0.03286927938461304
2022-05-07,16:15,Why nobody talk about crash 💥 FUD inflation #Cryptoweekend #Cryptocrash #cryptotrading #cryptocurrency #Bitcoin #MarketCap we need all information no only it going to the moon uptrend we doing good. And some rugged new crypto still coming out 🤦‍♂️🤷‍♂️,why nobody talk about crash fud inflation cryptoweekend cryptocrash cryptotrading cryptocurrency bitcoin marketcap we need all information no only it going to the moon uptrend we doing good and some rugged new crypto still coming out,0.5677361488342285,0.416333943605423,0.01592988520860672
2022-05-07,16:15,"Fun Fact: We've spent more time ranging than it took to drop from November highs to January lows. From when we peaked at $69K back in November, it took 77 days for the price to bottom at $32.9K in January. And since then we've spent 98 days ranging (moving sideways).

#Bitcoin",fun we have spent more time ranging than it took to drop from november highs to january lows from when we peaked at 69k back in november it took 77 days for the price to bottom at 329k in january and since then we have spent 98 days ranging moving sideways bitcoin,0.028480833396315575,0.07221891731023788,0.8993002772331238
2022-05-07,16:15,"BITCOIN FELL!

USD $35,953.22 (-0,00%)
Yesterday: -1,60%
Last 30 days: -16,71%

#bitcoin",bitcoin fell usd 3595322 000 160 last 30 1671 bitcoin,0.01446758396923542,0.03200400993227959,0.9535284042358398
2022-05-07,16:15,Wen weekend #Bitcoin pump devs,wen weekend bitcoin pump devs,0.1165420413017273,0.8514693379402161,0.031988613307476044
2022-05-07,16:15,"$BTC: $6,066.22 (505.52%)
$ETH: $18,777.81 (1,564.82%)
$ADA: $27,223.26 (2,268.60%)
$BNB: $28,715.92 (2,392.99%)
$DOGE: $81,402.06 (6,783.51%)
$LINK: $4,113.74 (342.81%)
$TRX: $8,264.05 (688.67%)
$XRP: $3,758.44 (313.20%)

#bitcoin #doge #cardano #ethereum #bnb",606622 50552 1877781 156482 2722326 226860 2871592 239299 8140206 678351 411374 34281 826405 68867 375844 31320 bitcoin doge cardano ethereum bnb,0.04469609260559082,0.9233021140098572,0.03200174868106842
2022-05-07,16:15,"@cryptoworld202 I'm mainly following #BTC and #ETH on bfx right now, as prices have gone into a strong dip",cryptoworld202 i am mainly following btc and eth on bfx right now as prices have gone into a strong dip,0.12585218250751495,0.8352310657501221,0.03891674801707268
2022-05-07,16:15,"@official_ikonic IKONIC is the Only Esports &amp; Pro-Gaming NFT marketplace dedicated to celebrate in-game IKONIC moments
#IKONIC #CRYPTO #BSC #BINANCE #BITCOIN",officialikonic ikonic is the only esports progaming nft marketplace dedicated to celebrate ingame ikonic moments ikonic crypto bsc binance bitcoin,0.04032998904585838,0.9447007179260254,0.014969290234148502
2022-05-07,16:15,"A successful project that has not left me without attention, I believe that the company is the best offer on the market,don't pass it by. #aliceincrypto #NFT #aliceNFT #Airdrop #bountycampaign #bitcoin #defi #Crypto #BSCGem #BSCGemsAlert #web3.",a successful project that has not left me without attention i believe that the company is the best offer on the marketdon t pass it by aliceincrypto nft alicenft airdrop bountycampaign bitcoin defi crypto bscgem bscgemsalert web3,0.23575907945632935,0.7555801272392273,0.008660731837153435
2022-05-07,16:15,"Just was talking to my 97-year-old grandmother, about this new kind of money that has been discovered :) She said ""it sounds very interesting! and complicated."" :) 
#BTC",just was talking to my 97yearold grandmother about this new kind of money that has been discovered she said it sounds very interesting and complicated btc,0.06564141064882278,0.9181073307991028,0.016251234337687492
2022-05-07,16:15,#movetoearn #m2e $btc $eth #bitcoin #metaverse #crypto $bnb #bscgem #bnbchain $nft #nft #stepn #gmt $gmtNyAa,movetoearn m2e btc eth bitcoin metaverse crypto bnb bscgem bnbchain nft nft stepn gmt gmtnyaa,0.05227022245526314,0.9215714931488037,0.026158351451158524
2022-05-07,16:15,"$BTC: $878.52 (62.75%)
$ETH: $2,128.31 (152.02%)
$ADA: $1,051.45 (75.10%)
$BNB: $1,994.69 (142.48%)
$DOGE: $3,331.65 (237.97%)
$LINK: $527.83 (37.70%)
$TRX: $2,357.32 (168.38%)
$XRP: $1,889.73 (134.98%)
$CAKE: $950.32 (67.88%)

#btc #eth #ada #bnb #doge #cake",87852 6275 212831 15202 105145 7510 199469 14248 333165 23797 52783 3770 235732 16838 188973 13498 95032 6788 btc eth ada bnb doge cake,0.041134294122457504,0.932348906993866,0.026516830548644066
2022-05-07,16:15,"$BTC: $713.41 (118.90%)

Your $600 stimulus is worth $713.41 of $BTC, a 24hr change of -0.39% and -$2.79. 

#bitcoin",71341 11890 your 600 stimulus is worth 71341 of btc a 24hr change of 039 and 279 bitcoin,0.1302212029695511,0.8522495627403259,0.01752924732863903
2022-05-07,16:15,"Bitcoin BTC Current Price:
$35,973.66

1h: +0.01%
24h: -0.32%
7d: -6.52%

30d: -17.12%
60d: -6.96%
90d: -13.38%

#btc $BTC #bitcoin",bitcoin btc current 3597366 001 032 652 1712 696 1338 btc btc bitcoin,0.03563894331455231,0.9406234622001648,0.023737626150250435
2022-05-07,16:15,"4chan /biz/ coin mentions (past hour)

#1🥇 Bitcoin: 28 (+13)
#2🥈 Chainlink: 12 (-3)
#3🥉 Ethereum: 8 (+4)
#4 Kadena: 6 (+2)
#5 Shiba Inu: 5 (+5)
#6 Cardano: 4 (+4)

#BTC #LINK $ETH $KDA #SHIB #ADA",4chan biz coin mentions past hour 1 28 13 2 12 3 3 8 4 4 6 2 5 shiba 5 5 6 4 4 btc link eth kda shib ada,0.12112262099981308,0.8605538010597229,0.018323523923754692
2022-05-07,16:15,I found some overbought (4h) coins which RSI values are over 70: BTT/USDT #binance #crypto #cryptocurrency #RSI #BTC,i found some overbought 4h coins which rsi values are over bttusdt binance crypto cryptocurrency rsi btc,0.11074423044919968,0.8637968897819519,0.025458896532654762
2022-05-07,16:15,"I found some oversold (4h) coins which RSI values are below 30: TRIBE/USDT, CITY/USDT, RIF/USDT, HEGIC/BUSD, FIS/USDT #binance #crypto #cryptocurrency #RSI #BTC",i found some oversold 4h coins which rsi values are below tribeusdt cityusdt rifusdt hegicbusd fisusdt binance crypto cryptocurrency rsi btc,0.05190619081258774,0.6648603081703186,0.2832334339618683
2022-05-07,16:15,@TheCryptoCandy I'd love to but #Bitcoin is struggling to get it up right now.,thecryptocandy i would love to but bitcoin is struggling to get it up right now,0.05273476988077164,0.5175206065177917,0.429744690656662
2022-05-07,16:15,Current #Bitcoin Price is $35985 #BTC #Crypto,current bitcoin price is 35985 btc crypto,0.020675484091043472,0.947422981262207,0.031901512295007706
2022-05-07,16:15,"By trading tokens for more tokens, you can convert price fluctuations into gains.
#SeasonalTokens #CryptoMining #CyclicalInvesting #BTC",by trading tokens for more tokens you can convert price fluctuations into gains seasonaltokens cryptomining cyclicalinvesting btc,0.09216351807117462,0.8870084285736084,0.020828086882829666
