Date,Time,Original tweet,Clean tweet,Positive,Neutral,Negative
2022-05-18,20:45,"$BTC
The monthly chart never lies and what the RSI is telling us is that there is a great buying opportunity in front of us. 
It's also telling us that the bottom is probably not in. 

But don't let this life-changing opportunity go. 

Be patient and stay in the game!

#Bitcoin https://t.co/mY8NfWtbbS",btc the monthly chart never lies and what the rsi is telling us is that there is a great buying opportunity in front of us it is also telling us that the bottom is probably not in but do not let this lifechanging opportunity go be patient and stay in the game bitcoin,0.12893490493297577,0.8502392172813416,0.020825861021876335
2022-05-18,20:45,"@BSCGemAlert #dkscomeback #dks
Dks rally started games big exchanges partnerships coming soon every month not investment advice
🔥🔥🔥🚀🚀🚀🚀🚀🚀
#Bitcoin #CeekVR #gem #LUNA #terraluna #SHIB #blockchain #Web3 #SAFU #BSC #Zilliqa #BNB #altcoin #CZBinance #MANA https://t.co/pFKkfkvalO",bscgemalert dkscomeback dks dks rally started games big exchanges partnerships coming soon every month not investment advice bitcoin ceekvr gem luna terraluna shib blockchain web3 safu bsc zilliqa bnb altcoin czbinance mana,0.13449817895889282,0.852532148361206,0.012969644740223885
2022-05-18,20:45,"the strongest bullish signal flashed for #Bitcoin. Not trend reverse but price bounce is anticipated!

@tradeosiann  is a super #BTC Trader 
I’ve been following his tweets and tips seriously &amp; I’ve been doing great $AVAX $PYR $REN $KEY #Cryptocurrency  $TRB💯",the strongest bullish signal flashed for bitcoin not trend reverse but price bounce is anticipated tradeosiann is a super btc trader ive been following his tweets and tips seriously ive been doing great avax pyr ren key cryptocurrency trb,0.5185990929603577,0.46759459376335144,0.013806283473968506
2022-05-18,20:45,Satoshi Era #Bitcoin Whales Bounce Back To Life As $BTC Enters Heavy Accumulation Phase https://t.co/A4ggH3MeoC via @coinjupiter,satoshi era bitcoin whales bounce back to life as btc enters heavy accumulation phase via coinjupiter,0.7617934942245483,0.22565190494060516,0.012554635293781757
2022-05-18,20:45,"@elonmusk Lets go Elon, remember the vast majority supports you. The algorithm just makes it seem we are the minority. Lets go. You next step is to take all the excess energy your companies use and mine #Bitcoin . So we take the money out of their hands. ❤️",elonmusk lets go elon remember the vast majority supports you the algorithm just makes it seem we are the minority lets go you next step is to take all the excess energy your companies use and mine bitcoin so we take the money out of their hands,0.0345914289355278,0.937376856803894,0.028031693771481514
2022-05-18,20:45,Refuel Monday today at 6 pm EST. Come find out how you can earn #BTC #ETH #xrp #ada #doge #shiba and more with the power…,refuel monday today at 6 pm est come find out how you can earn btc eth xrp ada doge shiba and more with the power,0.1147194355726242,0.8749065399169922,0.010374099016189575
2022-05-18,20:45,"$BTC down 4.7% today more or less exactly mirroring the NASDA 100. 

So much for crypto being a hedge guys? #Bitcoin 

Makes you wonder at the entire legitimacy of #Web3 as a construct when it's all correlated to a volatile asset. 

Makes you wonder how speculative things are.",btc down 47 today more or less exactly mirroring the nasda 100 so much for crypto being a hedge guys bitcoin makes you wonder at the entire legitimacy of web3 as a construct when it is all correlated to a volatile asset makes you wonder how speculative things are,0.01905406080186367,0.18300090730190277,0.797944962978363
2022-05-18,20:45,At what price will $MSTR ‘s #Bitcoin holdings be under water?,at what price will mstr s bitcoin holdings be under water,0.02162518911063671,0.8993360996246338,0.07903863489627838
2022-05-18,20:45,"Have we reached the bottom with #Bitcoin 

What we saying?",have we reached the bottom with bitcoin what we saying,0.15967276692390442,0.5030785799026489,0.33724862337112427
2022-05-18,20:45,1/2 Lots of shade being thrown at #DeFi by #BTC maximalists. But I would argue that #DeFi is to 401ks and other financial instruments what #Bitcoin is to money. #Cardano #ergo I love #btc it is the best money that has ever existed and I love $ADA and $Ergo because I should own my,12 lots of shade being thrown at defi by btc maximalists but i would argue that defi is to 401ks and other financial instruments what bitcoin is to money cardano ergo i love btc it is the best money that has ever existed and i love ada and ergo because i should own my,0.07155900448560715,0.9051666259765625,0.023274362087249756
2022-05-18,20:45,"Buying #BTC is like giving money to the banks, because they own most of it. Buy #Hex instead, and pay yourself.",buying btc is like giving money to the banks because they own most of it buy hex instead and pay yourself,0.026492085307836533,0.9343334436416626,0.03917453810572624
2022-05-18,20:45,The next few years is their last attempt to shake out the little man. I’m making it all the way. #bitcoin,the next few years is their last attempt to shake out the little man im making it all the way bitcoin,0.030760115012526512,0.6111323833465576,0.35810747742652893
2022-05-18,20:45,"Crypto update 📈

 #BTC  -2.88% ⬇️
 #ETH -4.42% ⬇️
 #ADA -7.07% ⬇️
 #SOL -9.20% ⬇️
 #AVAX  -1.97% ⬇️
18.05th, at 17:44",crypto update btc 288 eth 442 ada 707 sol 920 avax 197 1805th at,0.0361701063811779,0.9227083325386047,0.041121575981378555
2022-05-18,20:45,True NFT artists don’t care about bear markets..! #Nft #NFTartists #BTC #Crypto,true nft artists don not care about bear markets nft nftartists btc crypto,0.031075987964868546,0.9400833249092102,0.02884073369204998
2022-05-18,20:45,"@toglesby27 @TradingwithPhil @BitcoinMagazine @saylor @MicroStrategy No. I told him that there's important reason why @saylor is balls deep in #Bitcoin 
He suggested not clear intentions. I suggested he doesn't understand value of #Bitcoin and that's why he thinks so. There are serious reasons why we had 60K and why it's still very very cheap.",toglesby27 tradingwithphil bitcoinmagazine saylor microstrategy no i told him that there is important reason why saylor is balls deep in bitcoin he suggested not clear intentions i suggested he does not understand value of bitcoin and that is why he thinks so there are serious reasons why we had 60k and why it is still very very cheap,0.053464584052562714,0.9057534337043762,0.040781959891319275
2022-05-18,20:45,#Bitcoin  makes my dick hard as FUCK!,bitcoin makes my dick hard as fuck,0.0650651678442955,0.5740992426872253,0.36083555221557617
2022-05-18,20:45,"DON'T vote to fork LUNA !!!
🚨 VOTE to #BurnLuna 🚨
#LUNA #UST #Cryptos #DoKwon #cryptotrading #cryptocurrecy #cryptocommunity #CryptocurrencyNews #Terra_Luna #terraluna #Bitcoin",do not vote to fork luna vote to burnluna luna ust cryptos dokwon cryptotrading cryptocurrecy cryptocommunity cryptocurrencynews terraluna terraluna bitcoin,0.035235561430454254,0.9368448257446289,0.027919622138142586
2022-05-18,20:45,"@CrypteriumNFT We will support this project Until the end
Good luck🔥💥
nice🚀
@fatemehactor 
@Abolfazl15999 
@Rezaaarajabiii 
#Airdrops #Bitcoin #AirdropDetective",crypteriumnft we will support this project until the end good luck nice fatemehactor abolfazl15999 rezaaarajabiii airdrops bitcoin airdropdetective,0.31643590331077576,0.6745206117630005,0.009043500758707523
2022-05-18,20:45,@NorthmanTrader #Bitcoin had kicked in with its collapse starting in December so..,northmantrader bitcoin had kicked in with its collapse starting in december so,0.3455429673194885,0.16672231256961823,0.48773467540740967
2022-05-18,20:45,"best alternative for fiat #USD  ohh yea #btc @Bitcoin 
why you holding fiat 🤣🤣
@binance 
@coinbase 
@elonmusk",best alternative for fiat usd ohh yea btc bitcoin why you holding fiat binance coinbase elonmusk,0.13769593834877014,0.8526791334152222,0.0096249645575881
2022-05-18,20:45,@JeffBezos @Avik Wall Street also hates @Tesla &amp; #Bitcoin ...,jeffbezos avik wall street also hates tesla bitcoin,0.023923909291625023,0.5400325059890747,0.43604356050491333
2022-05-18,20:45,"#Bitcoin
JUST IN: 🇰🇷 South Korea is reportedly considering a stricter licensing system for #cryptocurrency issuers",bitcoin just south korea is reportedly considering a stricter licensing system for cryptocurrency issuers,0.11080358922481537,0.8612942695617676,0.02790221944451332
2022-05-18,20:45,"@Sean69667043 @Hig_Boss so it is either the environmental impact or the vulnerability in x years that will limit the #BTC price growth potential. Therefore I think POS coins are the better choice. The environment impact is many orders of magnitude smaller, and there is no halving problem.",sean69667043 higboss so it is either the environmental impact or the vulnerability in x years that will limit the btc price growth potential therefore i think pos coins are the better choice the environment impact is many orders of magnitude smaller and there is no halving problem,0.2142229974269867,0.7577414512634277,0.028035510331392288
2022-05-18,20:45,"I REPEAT: unfollow all permabull moonboys who got you rekt with their nonsense bullposting hopium all the way down from $69k and only follow unbiased objective analysts who call both upside and downside 

#BTC #Crypto",i unfollow all permabull moonboys who got you rekt with their nonsense bullposting hopium all the way down from 69k and only follow unbiased objective analysts who call both upside and downside btc crypto,0.04098956286907196,0.8946499824523926,0.06436038017272949
2022-05-18,20:45,#Tesla’s #Bitcoin holdings could be under water by now.,teslas bitcoin holdings could be under water by now,0.039337705820798874,0.4173060357570648,0.5433562994003296
2022-05-18,20:45,The best thing about teamwork is that you can share your saddle and divide the heartache. Keep up the good work team!!  #revenue #revenuecoin #bnb #bitcoin,the best thing about teamwork is that you can share your saddle and divide the heartache keep up the good work team revenue revenuecoin bnb bitcoin,0.12254393100738525,0.863328754901886,0.014127317816019058
2022-05-18,20:45,"#elon_musk viens de Twitter  #Bitcoin , #ETH &amp; #dogecoin for all people , this is my little secret I promised you (It's your time)👍✈️ 💵#THETER💴 #Crypto #NFTs #NFTProjects #Metaverse #BTC  #BNB   #LUNA #NFTCommunity #NFTdrops #CRO   #Binance   #Solana #dogecoin",elonmusk viens de twitter bitcoin eth dogecoin for all people this is my little secret i promised you it your time theter crypto nfts nftprojects metaverse btc bnb luna nftcommunity nftdrops cro binance solana dogecoin,0.046704765409231186,0.9260054230690002,0.027289871126413345
2022-05-18,20:45,"@ChicagoBeerSnob @PoppaGeorgio5 @Boeing74 @Kentuckeye @TheDemocrats Neither. My goal in starting this conversation is to point out that the President can control inflation if he wants to.

But personally, my goal is to fix the money, which means leaving USD behind. And preferably with as little strife as possible. Enter #Bitcoin.",chicagobeersnob poppageorgio5 boeing74 kentuckeye thedemocrats neither my goal in starting this conversation is to point out that the president can control inflation if he wants to but personally my goal is to fix the money which means leaving usd behind and preferably with as little strife as possible enter bitcoin,0.10494303703308105,0.8720472455024719,0.023009732365608215
2022-05-18,20:45,"Entire timeline was long #BTC.
Stop gambling, long a breakout or at least long range low but don't just do this mid-air shit.",entire timeline was long btc stop gambling long a breakout or at least long range low but do not just do this midair shit,0.030840110033750534,0.9100679755210876,0.059091921895742416
2022-05-18,20:45,Quickswap (QUICK) went up 12.0 percent in the last 30 minutes on Binance. #QUICK  #crypto #bitcoin #cryptocurrency #btc #ethereum #blockchain #eth #trading #altcoin #binance #cryptonews,quickswap quick went up 120 percent in the last 30 minutes on binance quick crypto bitcoin cryptocurrency btc ethereum blockchain eth trading altcoin binance cryptonews,0.8901141285896301,0.09622335433959961,0.013662493787705898
2022-05-18,20:45,@Anbessa100 $Qrdo they keep up working fulltime - great Team - great Partners - #qredo #dyor #dmpc #vault #lfg #ElSalvador #BTC,anbessa100 qrdo they keep up working fulltime great team great partners qredo dyor dmpc vault lfg elsalvador btc,0.30981525778770447,0.6778955459594727,0.012289192527532578
2022-05-18,20:45,@DigiEconomist Please proved proof of these wild claims about EVs &amp; #Bitcoin,digieconomist please proved proof of these wild claims about evs bitcoin,0.133133664727211,0.8508277535438538,0.01603851653635502
2022-05-18,20:45,"On the bright side, #Bitcoin beat the NASDAQ today",on the bright side bitcoin beat the nasdaq today,0.9401623606681824,0.0416218563914299,0.018215877935290337
2022-05-18,20:45,"This is a very smart project brings us excitement to always follow. We believe this company will work and succeed because this project is with a great team that always provide creative ideas and ideas so that this will get more 
#revenue #revenuecoin #bnb #bitcoin",this is a very smart project brings us excitement to always follow we believe this company will work and succeed because this project is with a great team that always provide creative ideas and ideas so that this will get more revenue revenuecoin bnb bitcoin,0.7964880466461182,0.1953326165676117,0.008179361000657082
2022-05-18,20:45,"Reading old tweets makes me cringe. The posturing is so obvious in CT. 

#crypto #bitcoin #cryptocurrency #blockchain #cryptotrading #investor  #business",reading old tweets makes me cringe the posturing is so obvious in ct crypto bitcoin cryptocurrency blockchain cryptotrading investor business,0.030308058485388756,0.5927363038063049,0.37695562839508057
2022-05-18,20:45,@SumanRohitK7 Same bro #Bitcoin 🔥😂,sumanrohitk7 same bro bitcoin,0.041626349091529846,0.9361560344696045,0.022217636927962303
2022-05-18,20:45,"@elonmusk Just join the #Bitcoin side elon we support you.
Demo or repu  nobody cares the are all liars",elonmusk just join the bitcoin side elon we support you demo or repu nobody cares the are all liars,0.029978187754750252,0.8808221220970154,0.08919969946146011
2022-05-18,20:45,#BTC is now at $29001.85,btc is now at 2900185,0.031114300712943077,0.9233006834983826,0.045584939420223236
2022-05-18,20:45,"BITCOIN FELL!

USD $29,001.85 (-0,98%)
Yesterday: -2,81%
Last 30 days: -26,91%

#bitcoin",bitcoin fell usd 2900185 098 281 last 30 2691 bitcoin,0.013677743263542652,0.02530631236732006,0.9610159397125244
2022-05-18,20:45,Nice move up #Bitcoin 😅,nice move up bitcoin,0.6942974925041199,0.2824898064136505,0.02321266569197178
2022-05-18,20:45,"@JayVTheGreat I also think that #Bitcoin as a security can be argued. As Nerayoff has stated to @_XRpizza, the SEC came up with decentralization narrative. This seems to be the only thing standing between #Bitcoin and #Ethereum from being considered securities.",jayvthegreat i also think that bitcoin as a security can be argued as nerayoff has stated to xrpizza the sec came up with decentralization narrative this seems to be the only thing standing between bitcoin and ethereum from being considered securities,0.07066115736961365,0.9107663631439209,0.018572527915239334
2022-05-18,20:45,Great #Btc adoption 😂😂😂.,great btc adoption,0.11177738010883331,0.8714912533760071,0.01673133671283722
2022-05-18,20:45,"Current #Bitcoin price is $29,038.74",current bitcoin price is 2903874,0.019539467990398407,0.9385002255439758,0.04196028783917427
2022-05-18,20:45,"Caution: I could be wrong., But one more crash is expected. #BTC 1D graph is saying some more down candles in coming week. Try to play safe side. #BTCUSDT But as I said I could be wrong and market can be reversal to upside. #BTCUSD #BTC",i could be wrong but one more crash is expected btc 1d graph is saying some more down candles in coming week try to play safe side btcusdt but as i said i could be wrong and market can be reversal to upside btcusd btc,0.029034152626991272,0.1361907571554184,0.8347750902175903
2022-05-18,20:45,"Wall Street has closed in red today and the Dow Jones falls 3.6% (the biggest drop since 2020)

Be careful about taking LONG positions on #Bitcoin and altcoins.

If 27.000$ doesn’t hold we will probably keep retracing.",wall street has closed in red today and the dow jones falls 36 the biggest drop since 2020 be careful about taking long positions on bitcoin and altcoins if 27000 doesn not hold we will probably keep retracing,0.0322904996573925,0.09024223685264587,0.8774672746658325
2022-05-18,20:45,Current #Bitcoin Price is $29039 #BTC #Crypto,current bitcoin price is 29039 btc crypto,0.020422086119651794,0.9493670463562012,0.030210843309760094
2022-05-18,20:45,"@MartiniGuyYT That's right, I completely agree with you #Bitcoin 🚀🚀🚀",martiniguyyt that is right i completely agree with you bitcoin,0.21724005043506622,0.7556730508804321,0.0270868930965662
2022-05-18,20:45,"On this day 12 years ago, a man paid 10,000 #Bitcoin   for two pizzas. 

Today, 10,000 $BTC is worth $294M.

Happy #Bitcoin  Pizza day 🤤",on this day 12 years ago a man paid 10000 bitcoin for two pizzas today 10000 btc is worth 294m happy bitcoin pizza day,0.06571997702121735,0.9127561450004578,0.02152380533516407
2022-05-18,20:45,Binance Courts German Regulators as Push Into Europe Continues. #BTC,binance courts german regulators as push into europe continues btc,0.1799352765083313,0.6765271425247192,0.14353758096694946
2022-05-18,20:45,"#Bitcoin 📈 

▓▓▓▓░░░░░░░░░░░ 29%

price:$28986.27      eth/btc: 0.07",bitcoin 29 007,0.03236905112862587,0.9314647912979126,0.036166105419397354
2022-05-18,20:45,"Never underestimate the power of consistently moving your stop loss to break even, sometimes even before securing your gains. Capital preservation is the elite risk management approach. Prevent losses more than You chase gains.
#BTC #Crypseth",never underestimate the power of consistently moving your stop loss to break even sometimes even before securing your gains capital preservation is the elite risk management approach prevent losses more than you chase gains btc crypseth,0.06677587330341339,0.9096282124519348,0.02359590493142605
2022-05-18,20:45,8 red weekly candles in a row for #bitcoin? Never happend before right,8 red weekly candles in a row for bitcoin never happend before right,0.18436770141124725,0.6369336247444153,0.17869865894317627
2022-05-18,20:45,"YCC testnet tokens were created. DM to access our testnet and help us set up our network.
 🪙🙏🚀

#ycc2222 #yccaustin #youthcryptoconference #BTC #ETH #cryptocurrencyeducation #yccmanila #yccnairobi",ycc testnet tokens were created dm to access our testnet and help us set up our network ycc2222 yccaustin youthcryptoconference btc eth cryptocurrencyeducation yccmanila yccnairobi,0.1492072194814682,0.8425047993659973,0.00828799232840538
2022-05-18,20:45,"Focus on the few winning horses.. DCA in the strongest crypto #BTC #ETH

Survive the hard months and then be ready again, savvier than before.",focus on the few winning horses dca in the strongest crypto btc eth survive the hard months and then be ready again savvier than before,0.3193225562572479,0.6670737862586975,0.013603677041828632
2022-05-18,20:45,"If Warren Buffet was 40 years younger and did some real research into bitcoin and understood it; plus as he has said ""be fearful when others are greedy, and greedy when others are fearful.""

Would he buy #Bitcoin now?",if warren buffet was 40 years younger and did some real research into bitcoin and understood it plus as he has said be fearful when others are greedy and greedy when others are fearful would he buy bitcoin now,0.045949261635541916,0.9252134561538696,0.02883727476000786
2022-05-18,20:45,"Is 50% of your total investment in #Luna? Take advantage of the profits and rebalance your portfolio. Buy crypto that went up less but is safer (e.g. #Bitcoin, #Ethereum) or take some profits in #stablecoins (maybe not UST eh eh). Decentralize your portfolio.",is 50 of your total investment in luna take advantage of the profits and rebalance your portfolio buy crypto that went up less but is safer eg bitcoin ethereum or take some profits in stablecoins maybe not ust eh eh decentralize your portfolio,0.10640396177768707,0.8781386017799377,0.015457398258149624
2022-05-18,20:45,Bitcoin down to $ 28k range. -3.9% change in 24h.  #bitcoin #btc,bitcoin down to 28k range 39 change in 24h bitcoin btc,0.030230103060603142,0.052479151636362076,0.9172906875610352
2022-05-18,20:45,"It's unfortunate that so many seemingly intelligent people in the #redpill or #manosphere space are willingly promoting scams to their followers. Between #Crypto and #NFT dogshit, it's pathetic. It seems only @Rich_Cooper gets it -- #bitcoin only. Everything else is a scam.",it is unfortunate that so many seemingly intelligent people in the redpill or manosphere space are willingly promoting scams to their followers between crypto and nft dogshit it is pathetic it seems only richcooper gets it bitcoin only everything else is a scam,0.022054141387343407,0.667692244052887,0.31025367975234985
2022-05-18,20:45,Going to pump the next crypto #coin soon. Coin name will be shortly announced on telegram only. Link is provided in the profile description #BTC #BNB #ETH,going to pump the next crypto coin soon coin name will be shortly announced on telegram only link is provided in the profile description btc bnb eth,0.02557877078652382,0.952091634273529,0.022329645231366158
2022-05-18,20:45,"@Orodromeus_ @CryptoRezeh @WalshWealthWWG We play the trend yesterday we shorted #Bitcoin around $30,600.",orodromeus cryptorezeh walshwealthwwg we play the trend yesterday we shorted bitcoin around 30600,0.05903945490717888,0.9017081260681152,0.039252400398254395
2022-05-18,20:45,What are your price predictions for #Bitcoin🤔,what are your price predictions for bitcoin,0.024933794513344765,0.9442260265350342,0.03084014169871807
2022-05-18,20:45,SP500 peeps please try harder. #Bitcoin,sp500 peeps please try harder bitcoin,0.03269962966442108,0.9063683748245239,0.06093194708228111
2022-05-18,20:45,"Lol man. People suckin till their throat to join discord and get WL, but this #Discord thing 😂😂😂😂 #cryptocurrency 
#ETH #SOL #BTC 
@abductingmfers don't even have a discord and have 300 left to be sold out. { 4200 }

Not hating,But people seeking WL. Not engagement 

#NFTs",lol man people suckin till their throat to join discord and get wl but this discord thing cryptocurrency eth sol btc abductingmfers do not even have a discord and have 300 left to be sold out 4200 not hatingbut people seeking wl not engagement nfts,0.02515764907002449,0.8440007567405701,0.13084155321121216
2022-05-18,20:45,"@LynAldenContact @Melt_Dem If Ethereum just muses and schemes about going PoS in perpetuity, they don’t have to take the endless heat from FUDites about “boiling the oceans” the way #Bitcoin does.",lynaldencontact meltdem if ethereum just muses and schemes about going pos in perpetuity they don not have to take the endless heat from fudites about boiling the oceans the way bitcoin does,0.030307484790682793,0.9317836761474609,0.037908826023340225
2022-05-18,20:45,"if #bitcoin does not hold this range its going to goblin town

and it SHOULD goto goblin town",if bitcoin does not hold this range its going to goblin town and it should goto goblin town,0.04956810548901558,0.9006005525588989,0.049831289798021317
2022-05-18,20:45,@julianhosp This is actually sad but absolutely true !!!! #btc #crypto,julianhosp this is actually sad but absolutely true btc crypto,0.05485561490058899,0.9032887816429138,0.04185561090707779
2022-05-18,20:45,@patrickluberus @iced_jesus @PlasmaPower0 @nano One altcoin death at a time teaching a tough lesson. There are shitcoins and there is #Bitcoin. It's not too late. Admit your mistake. Lick your wounds. Man up. And come join us.,patrickluberus icedjesus plasmapower0 nano one altcoin death at a time teaching a tough lesson there are shitcoins and there is bitcoin it is not too late admit your mistake lick your wounds man up and come join us,0.058179423213005066,0.8968520760536194,0.04496847838163376
2022-05-18,20:45,@GrantCardone #Bitcoin is the new gold,grantcardone bitcoin is the new gold,0.06523340940475464,0.9243123531341553,0.010454230941832066
2022-05-18,20:45,Dump incoming #btc,dump incoming btc,0.022414518520236015,0.8237258791923523,0.15385957062244415
2022-05-18,20:45,"@100trillionUSD I would rather buy half #BTC at price 30k and if it falls to 20k I'll buy another half.
Same if the price goes up.😉",100trillionusd i would rather buy half btc at price 30k and if it falls to 20k i will buy another half same if the price goes up,0.045946165919303894,0.8610368967056274,0.09301697462797165
2022-05-18,20:45,"NFA …. but if you have a lil bag you want to drop in the market my tip of the day would have to be… “Sit on your bags n wait”.

We will go down lower in due time n when we do you can grab that juicy dip 🔥🔥 #Crypto #btc #ada #xrp",nfa but if you have a lil bag you want to drop in the market my tip of the day would have to be sit on your bags n wait we will go down lower in due time n when we do you can grab that juicy dip crypto btc ada xrp,0.0397811196744442,0.7879346013069153,0.17228424549102783
