Date,Time,Original tweet,Clean tweet,Positive,Neutral,Negative
2022-05-14,16:45,@HuobiGlobal The Rising and Shining Star of The Crypto World. #pit #PitbullToken #pitbulltoken1000x @BscPitbull #Bitcoin #btc,huobiglobal the rising and shining star of the crypto world pit pitbulltoken pitbulltoken1000x bscpitbull bitcoin btc,0.132144957780838,0.8559046983718872,0.011950326152145863
2022-05-14,16:45,"My heartful thankyou to @Tradeosiann for knowing me this dangerous #Bitcoin crash and #Ethereum crash. That's because of you only  I didn't cause any type of losses. A huge thankyou to you once again. #Binance #cryptocurrency crash  ""accurate from all."" #BTC bf",my heartful thankyou to tradeosiann for knowing me this dangerous bitcoin crash and ethereum crash that is because of you only i did not cause any type of losses a huge thankyou to you once again binance cryptocurrency crash accurate from all btc bf,0.22952082753181458,0.7543023228645325,0.01617690920829773
2022-05-14,16:45,"$BTC going down to 20k or going to bounce from this 28k support level?

What do you think and which alts are you buying in this dip?

#bitcoin #btc #luna $luna #terra #ust $ust $anc",btc going down to 20k or going to bounce from this 28k support level what do you think and which alts are you buying in this dip bitcoin btc luna luna terra ust ust anc,0.02771938592195511,0.7254802584648132,0.24680036306381226
2022-05-14,16:45,"#btc 👀, forming a higher low on 4h. Bulls can take over from this level!",btc forming a higher low on 4h bulls can take over from this level,0.16536374390125275,0.8122832179069519,0.022353051230311394
2022-05-14,16:45,"🧐 They said: Withdraw your #bitcoin from exchanges because not your keys not your coins! 🤔

Have your say👇",they withdraw your bitcoin from exchanges because not your keys not your coins have your say,0.02561982534825802,0.8110480308532715,0.16333219408988953
2022-05-14,16:45,"@ashwsbreal What if they use the 3B worth of #BTC to do buybacks &amp; they burn supply, with all this attention on top of that, could it become the new shiba?

Anything over .10 will cause an insane amount of #meme like fomo in my opinion.

I can see that ""Lunatics"" 💩 all over social media.",ashwsbreal what if they use the 3b worth of btc to do buybacks they burn supply with all this attention on top of that could it become the new shiba anything over 10 will cause an insane amount of meme like fomo in my opinion i can see that lunatics all over social media,0.02919851429760456,0.7788469195365906,0.1919545829296112
2022-05-14,16:45,"@airdropinspect Wonderful day with this amazing project I'm believing and supporting it until the it's biggest successful.
@Llartym
@Nathanaelcj1 @sumi_palu
@Romeo7sS
@edekelvin3

#Airdrop #Airdrops #Airdropinspector #O2ETHDao #O2 #Crypto #Bitcoin",airdropinspect wonderful day with this amazing project i am believing and supporting it until the it is biggest successful llartym nathanaelcj1 sumipalu romeo7ss edekelvin3 airdrop airdrops airdropinspector o2ethdao o2 crypto bitcoin,0.5054323673248291,0.48460137844085693,0.009966306388378143
2022-05-14,16:45,@fabthefoxx @DerGeier21 I'm new. But it's ok. Ofc its not easy but I know why I'm doing what I'm doing. I don't regret anything. #Bitcoin is the future.,fabthefoxx dergeier21 i am new but it is ok ofc its not easy but i know why i am doing what i am doing i do not regret anything bitcoin is the future,0.10457500070333481,0.86619633436203,0.02922869101166725
2022-05-14,16:45,"for those who will see this tweet please follow me 🙏🙏  for you it's only a click but for me it means a lot thank you ❤️❤️
#kittycara #nftart #NFTCommunity #Bitcoin #LUNA #cryptocurrency #cryptotrading #ETH #opensea #NFTartwork",for those who will see this tweet please follow me for you it is only a click but for me it means a lot thank you kittycara nftart nftcommunity bitcoin luna cryptocurrency cryptotrading eth opensea nftartwork,0.0667959451675415,0.9184373617172241,0.014766684733331203
2022-05-14,16:45,"@CryptoTownEU 💐🌹🌹Quite brilliant &amp; very🌺 interesting project at its early stage👨‍👨‍👦.Its community is fast🌷 growing.This💐has definitely huge potential as well.very👨‍👨‍👦good Airdrop.💐🌹💐

@Uk36526760

@Uttam60594047 

@DebSark00679860 

@TanmoykumarMo20 

@Moni04776337

💐💐#BTC #ETH #BSC🌹💐",cryptotowneu quite brilliant very interesting project at its early stageits community is fast growingthishas definitely huge potential as wellverygood airdrop uk36526760 uttam60594047 debsark00679860 tanmoykumarmo20 moni04776337 btc eth bsc,0.7180201411247253,0.2741915285587311,0.0077883354388177395
2022-05-14,16:45,Anchor Protocol (ANC) went down 12.6 percent in the last 30 minutes on Binance. #ANC  #crypto #bitcoin #cryptocurrency #btc #ethereum #blockchain #eth #trading #altcoin #binance #cryptonews,anchor protocol anc went down 126 percent in the last 30 minutes on binance anc crypto bitcoin cryptocurrency btc ethereum blockchain eth trading altcoin binance cryptonews,0.008347678929567337,0.026946427300572395,0.9647059440612793
2022-05-14,16:45,Galatasaray Fan Token (GAL) went up 10.3 percent in the last 30 minutes on Binance. #GAL  #crypto #bitcoin #cryptocurrency #btc #ethereum #blockchain #eth #trading #altcoin #binance #cryptonews,galatasaray fan token gal went up 103 percent in the last 30 minutes on binance gal crypto bitcoin cryptocurrency btc ethereum blockchain eth trading altcoin binance cryptonews,0.8835434317588806,0.1045641154050827,0.01189242023974657
2022-05-14,16:45,Ordered some maple syrup and excited to support a local business rather than Costco. Got 1/2 gallon coming my way. To make it better I paid @beisnerds in lightning sats! No better feeling than a closed loop circular #bitcoin economy FTW. Stay tuned for the taste test!,ordered some maple syrup and excited to support a local business rather than costco got 12 gallon coming my way to make it better i paid beisnerds in lightning sats no better feeling than a closed loop circular bitcoin economy ftw stay tuned for the taste test,0.1355741024017334,0.8468859195709229,0.01753998175263405
2022-05-14,16:45,"@100trillionUSD anything is possible  in future even #Bitcoin sees ZERO
since you can not see what is behind , those who are real deciders.. I mean 
if they want that would be possible",100trillionusd anything is possible in future even bitcoin sees zero since you can not see what is behind those who are real deciders i mean if they want that would be possible,0.10260677337646484,0.8725885152816772,0.024804651737213135
2022-05-14,16:45,"Also, do not consider the stonk market. That is also a ponzi scheme being replaced by #bitcoin",also do not consider the stonk market that is also a ponzi scheme being replaced by bitcoin,0.025344572961330414,0.7474814057350159,0.22717396914958954
2022-05-14,16:45,"$BTC going down to 20k or going to bounce from this 28k support level?

What do you think and which alts are you buying in this dip?

#bitcoin #btc #luna $luna #terra #ust $ust $shib",btc going down to 20k or going to bounce from this 28k support level what do you think and which alts are you buying in this dip bitcoin btc luna luna terra ust ust shib,0.03019043244421482,0.7962828874588013,0.17352664470672607
2022-05-14,16:45,"#SeasonalToken #Cyclicalinvestment #Cryptomining #BTC 
If the crypto license application is accepted the bank would be approved to offer exchange and crypto-asset services
Will Germany be the first  in Europe to support and accept #crypto as a good investment? 📈",seasonaltoken cyclicalinvestment cryptomining btc if the crypto license application is accepted the bank would be approved to offer exchange and cryptoasset services will germany be the first in europe to support and accept crypto as a good investment,0.7959303855895996,0.19797758758068085,0.006092003546655178
2022-05-14,16:45,"My heartful thankyou to @Tradeosiann for knowing me this dangerous #Bitcoin crash and #Ethereum crash. That's because of you only  I didn't cause any type of losses. A huge thankyou to you once again. #Binance #cryptocurrency crash  ""accurate from all."" #BTC j",my heartful thankyou to tradeosiann for knowing me this dangerous bitcoin crash and ethereum crash that is because of you only i did not cause any type of losses a huge thankyou to you once again binance cryptocurrency crash accurate from all btc j,0.1772734671831131,0.8040211200714111,0.018705392256379128
2022-05-14,16:45,"Let me remind you something.

#crypto comunity still paying attention to #BTC and cryptomarker. What does that mean?

-we need more capitulation and lateral range for months. 

This is not the bottom",let me remind you something crypto comunity still paying attention to btc and cryptomarker what does that mean we need more capitulation and lateral range for months this is not the bottom,0.045367710292339325,0.7714809775352478,0.18315134942531586
2022-05-14,16:45,#bitcoin is freedom.,bitcoin is freedom,0.040909335017204285,0.9342687129974365,0.024821920320391655
2022-05-14,16:45,@nayibbukele Thanks Mr.President for your continuous support on #Bitcoin ! the Crypto industry will always support you!!,nayibbukele thanks mrpresident for your continuous support on bitcoin the crypto industry will always support you,0.8520212769508362,0.13931819796562195,0.008660425432026386
2022-05-14,16:45,"If anyone is starting a #bitcoin meetup, I’ll make your website for you. 1,000sats/mo for hosting. 
Side hustle so slower turn around than full time dev but willing to put in the work.",if anyone is starting a bitcoin meetup ill make your website for you 1000satsmo for hosting side hustle so slower turn around than full time dev but willing to put in the work,0.08562635630369186,0.8906055092811584,0.023768160492181778
2022-05-14,16:45,"@amasad @Noahpinion If you get Chinese takeout, you will find that the fortune cookie is sponsored by @SBF_FTX. Mine said:

“In retrospect, it was inevitable.”

I was amazed.

#Bitcoin",amasad noahpinion if you get chinese takeout you will find that the fortune cookie is sponsored by sbfftx mine in retrospect it was inevitable i was amazed bitcoin,0.06493076682090759,0.8994973301887512,0.03557188808917999
2022-05-14,16:45,"@HuobiGlobal Have you heard of the Pitbull token? #BSC #BSCGems #PitbullToken #Pitbullish #PitbullTokenArmy #BuyPitbullToken #BuyPIT #PitbullMetaverse $PIT #Metaverse #P2E #NFT #Bsc #BTC #BNB Don't you think there are many reasons to buy, what are you waiting for @BscPitbull #Bitcoin #btc",huobiglobal have you heard of the pitbull token bsc bscgems pitbulltoken pitbullish pitbulltokenarmy buypitbulltoken buypit pitbullmetaverse pit metaverse p2e nft bsc btc bnb do not you think there are many reasons to buy what are you waiting for bscpitbull bitcoin btc,0.038265131413936615,0.9412450194358826,0.02048986405134201
2022-05-14,16:45,@trading_athena MC is the most irrelevant metric to use when trying to estimate the future price of a coin. What you are saying is the same thing people said about #BTC in 2015 at $5B MC. The majority of people never thought #Bitcoin could reach the MC it has today.,tradingathena mc is the most irrelevant metric to use when trying to estimate the future price of a coin what you are saying is the same thing people said about btc in 2015 at 5b mc the majority of people never thought bitcoin could reach the mc it has today,0.04968741536140442,0.9226783514022827,0.02763417176902294
2022-05-14,16:45,"My heartful thankyou to @Tradeosiann for knowing me this dangerous #Bitcoin crash and #Ethereum crash. That's because of you only  I didn't cause any type of losses. A huge thankyou to you once again. #Binance #cryptocurrency crash  ""accurate from all."" #BTC f",my heartful thankyou to tradeosiann for knowing me this dangerous bitcoin crash and ethereum crash that is because of you only i did not cause any type of losses a huge thankyou to you once again binance cryptocurrency crash accurate from all btc f,0.2248355597257614,0.7586854696273804,0.016478925943374634
2022-05-14,16:45,"@moonie10x @easyeight08 the only way $LUNA talks up is because @easyeight08  himself is probably managing $LUNA and wants to make up #BTC loss.

all bla bla bla",moonie10x easyeight08 the only way luna talks up is because easyeight08 himself is probably managing luna and wants to make up btc loss all bla bla bla,0.03264196962118149,0.9181085228919983,0.049249473959207535
2022-05-14,16:45,"$BTC going down to 20k or going to bounce from this 28k support level?

What do you think and which alts are you buying in this dip?

#bitcoin #btc #luna $luna #terra #ust $ust $eth",btc going down to 20k or going to bounce from this 28k support level what do you think and which alts are you buying in this dip bitcoin btc luna luna terra ust ust eth,0.03312346339225769,0.7968105673789978,0.1700659692287445
2022-05-14,16:45,"We will be giving 10,000,000 $LUNA for everyone who Retweet this and comment. Those who follow our account have priority. $LUNA.

👇DROP Your $LUNA ADDRESS 

#LUNA #LUNAtics #Terra #lunaterra #BTC",we will be giving 10000000 luna for everyone who retweet this and comment those who follow our account have priority luna drop your luna address luna lunatics terra lunaterra btc,0.016829922795295715,0.8880476951599121,0.09512237459421158
2022-05-14,16:45,"@Inchhighprivate #Bitcoin is incredible - a work of engineering and organizational genius.

An entire industry of copycats emerged from #Bitcoin but none of them make any sense b/c they are all centralized. A centralized blockchain is just a slow, inefficient alternative to a regular database.",inchhighprivate bitcoin is incredible a work of engineering and organizational genius an entire industry of copycats emerged from bitcoin but none of them make any sense bc they are all centralized a centralized blockchain is just a slow inefficient alternative to a regular database,0.030862029641866684,0.9254327416419983,0.043705299496650696
2022-05-14,16:45,"When should $LUNA publish its recovery plan?

Today    Next Week    Now
👇             👇               👇

#Luna #bitcoin #terraluna #eth",when should luna publish its recovery plan today next week now luna bitcoin terraluna eth,0.03912501409649849,0.9396823048591614,0.02119269408285618
2022-05-14,16:45,"@Sanjiinu_Army #sanji #sanjiinu best charity/donation token

#btc #luna #eth #bnb #ust #usdt #busd",sanjiinuarmy sanji sanjiinu best charitydonation token btc luna eth bnb ust usdt busd,0.32390254735946655,0.6644848585128784,0.011612556874752045
2022-05-14,16:45,"@SimplyBitcoinTV I transferred some euros from a one bank to another one, it has been 2 days and I have not received it yet...now let's talk about #Bitcoin not working as a day to day payment 😄😄😄",simplybitcointv i transferred some euros from a one bank to another one it has been 2 days and i have not received it yetnow let us talk about bitcoin not working as a day to day payment,0.0353582538664341,0.8803116679191589,0.08433003723621368
2022-05-14,16:45,"$BTC going down to 20k or going to bounce from this 28k support level?

What do you think and which alts are you buying in this dip?

#bitcoin #btc #luna $luna #terra #ust $ust #avax #ada",btc going down to 20k or going to bounce from this 28k support level what do you think and which alts are you buying in this dip bitcoin btc luna luna terra ust ust avax ada,0.030512971803545952,0.8442221879959106,0.12526480853557587
2022-05-14,16:45,@WhaleCoinTalk So true! #BTC where the future lies 💯,whalecointalk so true btc where the future lies,0.09728305041790009,0.8850595951080322,0.017657335847616196
2022-05-14,16:45,@MartiniGuyYT YES #LUNA will flip #BTC,martiniguyyt yes luna will flip btc,0.08283565193414688,0.8854355812072754,0.03172873333096504
2022-05-14,16:45,"@FossGregfoss @ToddAultIII #btc lives in game theory land of last man standing

It’s unrecognized value will be apparent to fiat normies only when fiat credit collapses completely and fully and #btc is the only monetary system with integrity 

“Full faith and credit” til the end we go",fossgregfoss toddaultiii btc lives in game theory land of last man standing its unrecognized value will be apparent to fiat normies only when fiat credit collapses completely and fully and btc is the only monetary system with integrity full faith and credit til the end we go,0.08815302699804306,0.886176586151123,0.02567042037844658
2022-05-14,16:45,@JoeBiden 80 million votes folks. If you think he’s doing a good job you’re failing the IQ test. The LGBTC community cannot support this. Rome is burning! Buy #Bitcoin,joebiden 80 million votes folks if you think hes doing a good job youre failing the iq test the lgbtc community cannot support this rome is burning buy bitcoin,0.09941910952329636,0.8363214135169983,0.06425952911376953
2022-05-14,16:45,There must be a way to prevent #bitcoin_whales from controlling the #market in order for #Bitcoin to maintain its transparency.,there must be a way to prevent bitcoinwhales from controlling the market in order for bitcoin to maintain its transparency,0.06891178339719772,0.9064393043518066,0.02464890480041504
2022-05-14,16:45,After I lost my money in a #scam that #Terra orchestrated with their currency $LUNA made me suspicious of all #cryptocurrencies even #Bitcoin.,after i lost my money in a scam that terra orchestrated with their currency luna made me suspicious of all cryptocurrencies even bitcoin,0.04462176561355591,0.557481586933136,0.3978966176509857
2022-05-14,16:45,I feel there is a dirty game in progress. Who guarantees the value of #Bitcoin and is it really that no one can control it?,i feel there is a dirty game in progress who guarantees the value of bitcoin and is it really that no one can control it,0.025911346077919006,0.6118624806404114,0.36222609877586365
2022-05-14,16:45,There are so many big #bitcoin whales that I doubt their greed for simple people's money will make #Bitcoin worthless.,there are so many big bitcoin whales that i doubt their greed for simple people money will make bitcoin worthless,0.044756315648555756,0.9124897718429565,0.042753901332616806
2022-05-14,16:45,"@BTCTN financial freedom #BTC  in #Argentina la polla , in this country the rules are invented according to politicians",btctn financial freedom btc in argentina la polla in this country the rules are invented according to politicians,0.023041240870952606,0.9436373114585876,0.03332147002220154
2022-05-14,16:45,What happened recently in the #LUNA #scam made me doubt that the end of #Bitcoin would be the same way!,what happened recently in the luna scam made me doubt that the end of bitcoin would be the same way,0.05880586430430412,0.8662889003753662,0.07490521669387817
2022-05-14,16:45,@joooonahxd $2K in last week due to #btc 💰💰,joooonahxd 2k in last week due to btc,0.06463445723056793,0.05840910226106644,0.8769564032554626
2022-05-14,16:45,"@jratcliff Thats probably why people invest their dollars if they want to conserve value.

What does that mean for #Bitcoin? 🙄",jratcliff thats probably why people invest their dollars if they want to conserve value what does that mean for bitcoin,0.03493397310376167,0.9312855005264282,0.03378051146864891
2022-05-14,16:45,"$44,000 #BTC by July 🚀 I feel it in my bones!",44000 btc by july i feel it in my bones,0.051669470965862274,0.9160978198051453,0.03223264962434769
2022-05-14,16:45,"@RichardHeartWin should look the sameish in the log, $luna was a boat floating on the ocean of #BTC and where it went south there’s a massive feed back loop of pumping btc to save it actually sunk it..",richardheartwin should look the sameish in the log luna was a boat floating on the ocean of btc and where it went south theres a massive feed back loop of pumping btc to save it actually sunk it,0.04694027453660965,0.9118530750274658,0.04120659828186035
2022-05-14,16:45,"@AirdropDet I am very lucky for participating this very good and great project. I also noticed a great interest for this project. Thanks for launching this great project. 

@NazmulH63253773 
@SweetKamini1 
@Shuvo442 

#Airdrops #KOKChain #Bitcoin #AirdropDetective #Cryptocurrency",airdropdet i am very lucky for participating this very good and great project i also noticed a great interest for this project thanks for launching this great project nazmulh63253773 sweetkamini1 shuvo442 airdrops kokchain bitcoin airdropdetective cryptocurrency,0.7096711993217468,0.2818162441253662,0.00851255003362894
2022-05-14,16:45,"#ADA/USDT
Signal Type: Long
Leverage: Cross (20.0X)
Entry Targets: 0.5070  0.4900
Take-Profit Targets:
1) 0.5100
2) 0.5135
3) 0.5170
4) 0.5205
5) 0.5240
6) 0.5280
7) 0.5320
8) 0.5380

Stop Loss:
1) 0.4800

#Bitcoin #ETH #Cryptocrash #TRX #shibainu",adausdt signal long cross 200x entry 05070 04900 takeprofit 1 05100 2 05135 3 05170 4 05205 5 05240 6 05280 7 05320 8 05380 stop 1 04800 bitcoin eth cryptocrash trx shibainu,0.053333573043346405,0.9193531274795532,0.02731327712535858
2022-05-14,16:45,"@RealMasalaBonds Besides the Bukele laser eyes are back, but I am concerned about his policies somewhat. Hard to tell what is FUD and what isn’t as an American bitcoiner abroad parsing Salvadoran news. All the #bitcoin denominated nation states will eventually be max max liberty nations though.",realmasalabonds besides the bukele laser eyes are back but i am concerned about his policies somewhat hard to tell what is fud and what isn not as an american bitcoiner abroad parsing salvadoran news all the bitcoin denominated nation states will eventually be max max liberty nations though,0.13006433844566345,0.7247263789176941,0.14520925283432007
2022-05-14,16:45,"🔥 Drop your #NFT, I wanna support some of you! Follow, retweet and like this post👇 #eth #ethereum #crypto #NFT #NFTs #nftart #nftartists #sol #shib #bitcoin",drop your nft i wanna support some of you follow retweet and like this post eth ethereum crypto nft nfts nftart nftartists sol shib bitcoin,0.026547564193606377,0.874167263507843,0.09928514063358307
2022-05-14,16:45,"WQ is very interesting project with big goals ahead project looks promising. I believe this project has surely a 
bright future.
#WorkQuest $WQT $WUSD #WorkNet #WorkQuestApp #blockchian #crypto #cryptolife #BTC #BNB #ETH #digitalization #digitalassets #saving 

#BinanceSmartChain",wq is very interesting project with big goals ahead project looks promising i believe this project has surely a bright future workquest wqt wusd worknet workquestapp blockchian crypto cryptolife btc bnb eth digitalization digitalassets saving binancesmartchain,0.5636772513389587,0.4265361428260803,0.009786581620573997
2022-05-14,16:45,In Kucoin currently the trading volume of #LUNA in the last 24 hours is 684 million. It is greater than #BTC(468 million) and #ETH (192 million) combined.,in kucoin currently the trading volume of luna in the last 24 hours is 684 million it is greater than btc468 million and eth 192 million combined,0.23294799029827118,0.7381367087364197,0.02891523577272892
2022-05-14,16:45,"@Sanjiinu_Army While #BTC and #LUNA are experiencing a huge drop, #sanji is still looking strong.  because #sanjiinu has a very strong team and community.  Keep accumulating!  Journey to Mars is imminent.",sanjiinuarmy while btc and luna are experiencing a huge drop sanji is still looking strong because sanjiinu has a very strong team and community keep accumulating journey to mars is imminent,0.9368135333061218,0.03932984918355942,0.023856595158576965
2022-05-14,16:45,"🔴 Sell $SNX [Spot Hourly]
#SNXUSDT
Average Cost: $2.474
Sell Price: $2.529
Filled: 10.1051 #SNX / 25.56 #USDT
PNL: $0.56 / 2.22%

#Synthetix #Binance #Bitcoin #Metaverse #NFT #Web3 #Altcoins",sell snx spot hourly snxusdt average 2474 sell 2529 101051 snx 2556 usdt 056 222 synthetix binance bitcoin metaverse nft web3 altcoins,0.05773108825087547,0.9220234155654907,0.020245475694537163
2022-05-14,16:45,Wen number go up? #Bitcoin,wen number go up bitcoin,0.3122243285179138,0.628706693649292,0.05906900390982628
2022-05-14,16:45,"🚨 221 #BTC (6,404,670 USD) just transferred 🚨

From:
bc1qzxlvwcfl3llk6pmmv656y7fvgcw56lze4dpjxh

To:
3AexBQYwsTxA9o78y2XDAp4rrCMbSUm311

Tx hash:
197849a159cc3c14691cf106641893ff5f6e11f7ad16c8d47f1f949675866b2d

#Bitcoin $BTC",221 btc 6404670 usd just transferred bc1qzxlvwcfl3llk6pmmv656y7fvgcw56lze4dpjxh 3aexbqywstxa9o78y2xdap4rrcmbsum311 tx 197849a159cc3c14691cf106641893ff5f6e11f7ad16c8d47f1f949675866b2d bitcoin btc,0.08638253808021545,0.8791979551315308,0.03441949561238289
2022-05-14,16:45,#BTC is now at $29045.73,btc is now at 2904573,0.025571033358573914,0.933168888092041,0.0412600114941597
2022-05-14,16:45,@terra_money  is back let’s keep pushing 🚀🚀🚀🚀🚀🚀#LUNA #LUNAUSDT #cryptocurrency #Binance #Bitcoin,terramoney is back lets keep pushing luna lunausdt cryptocurrency binance bitcoin,0.21988292038440704,0.7610245943069458,0.019092557951807976
2022-05-14,16:45,"#Seasonal Tokens #Crypto Mining #Cyclicallnvesting #BTC
The project is drawing strong interest from the community, I believe in the team that will take the project even further from their great ideas.",seasonal tokens crypto mining cyclicallnvesting btc the project is drawing strong interest from the community i believe in the team that will take the project even further from their great ideas,0.8581100106239319,0.1330752968788147,0.00881471298635006
2022-05-14,16:45,@Trader_XO I want a $17k #Btc,traderxo i want a 17k btc,0.08395101130008698,0.9058228731155396,0.010226123966276646
