Date,Time,Original tweet,Clean tweet,Positive,Neutral,Negative
2022-05-18,9:45,"@funnygameworld #Chinese divers Chen Yuxi and Zhang Jiaqi dominated the women's synchronised 10m platform, winning the gold medal at the #Tokyo #OlympicGames on Tuesday. 

#FGW #FunnyGameWorld #crypto #bitcoin #cryptocurrency #blockchain #bounty #binance #eth #token #coinsbit",funnygameworld chinese divers chen yuxi and zhang jiaqi dominated the women synchronised 10m platform winning the gold medal at the tokyo olympicgames on tuesday fgw funnygameworld crypto bitcoin cryptocurrency blockchain bounty binance eth token coinsbit,0.14150524139404297,0.8452112078666687,0.01328352652490139
2022-05-18,9:45,"@DigiFinex I Think this is a faithful project.The projector has a lot of attractions so hopefully the project will be better in the future and will be the best project.

@NurHoss61201905
@ebrahim2355
@AlAmin78744584
@MdShoponpk4

#crypto #Bitcoin #cryptocurrecy #NFT #TOK $TOK",digifinex i think this is a faithful projectthe projector has a lot of attractions so hopefully the project will be better in the future and will be the best project nurhoss61201905 ebrahim2355 alamin78744584 mdshoponpk4 crypto bitcoin cryptocurrecy nft tok tok,0.7808193564414978,0.21110917627811432,0.008071435615420341
2022-05-18,9:45,"@funnygameworld This project has a very bright future, because I really think this project is too perfect to be true. This is a very cool and innovative project.
#FGW #FunnyGameWorld #crypto #bitcoin #cryptocurrency #blockchain #bounty #binance #eth #token #coinsbit",funnygameworld this project has a very bright future because i really think this project is too perfect to be true this is a very cool and innovative project fgw funnygameworld crypto bitcoin cryptocurrency blockchain bounty binance eth token coinsbit,0.18432985246181488,0.8063130974769592,0.009357049129903316
2022-05-18,9:45,"@SatsJoseph It's the only MODERN asset with both - wide public trust and long proven stability and security, both going hand to hand.
#Bitcoin is hope.",satsjoseph it is the only modern asset with both wide public trust and long proven stability and security both going hand to hand bitcoin is hope,0.14835906028747559,0.8422183990478516,0.009422576054930687
2022-05-18,9:45,"👋 A new block was found on the #Bitcoin network. We're at block height 736897, current #bitcoin price is $29864.55 and there are 195686247690011 #sats left to mine.",a new block was found on the bitcoin network we are at block height 736897 current bitcoin price is 2986455 and there are 195686247690011 sats left to mine,0.025563029572367668,0.9290820956230164,0.045354850590229034
2022-05-18,9:45,"$BTC Latest Block Info: Block 736897 holds 85 transactions for a total of 317.29704 #Bitcoin including Block Reward. Block Size 111,453 Bytes",btc latest block block 736897 holds 85 transactions for a total of 31729704 bitcoin including block reward block size 111453 bytes,0.03622247278690338,0.9434258937835693,0.020351624116301537
2022-05-18,9:45,"@IOHK_Charles @licuende @VitalikButerin Cardano is a centralized PoS scam. Cardano is a social token that tracks your YouTube career. I do like how you talk about Cardano in the third person though, it's comical. Until you find a way to counterfeit energy, #bitcoin is the ring that rules all.",iohkcharles licuende vitalikbuterin cardano is a centralized pos scam cardano is a social token that tracks your youtube career i do like how you talk about cardano in the third person though it is comical until you find a way to counterfeit energy bitcoin is the ring that rules all,0.02810571901500225,0.9165189266204834,0.05537533387541771
2022-05-18,9:45,"@natbrunell #BTC died in 2017 when it didn’t scale over 1MB and is no longer economically viable to use as a peer to peer crypto currency ❌

This is why #Bitcoin forked into two and we have #BitcoinCash #BCH  and it works peer to peer as cash with near zero transaction fees ✅",natbrunell btc died in 2017 when it didn not scale over 1mb and is no longer economically viable to use as a peer to peer crypto currency this is why bitcoin forked into two and we have bitcoincash bch and it works peer to peer as cash with near zero transaction fees,0.03923780098557472,0.9104375839233398,0.05032467469573021
2022-05-18,9:45,okx 💜💯 #BUYFEG #FEG $FEG #FEGTOKEN #FEGARMY #FEGEX #trading #Crypto #BTC #ETH #Saitama #SHIB #BabyDogeCoin #BabyDoge #dogec…,okx buyfeg feg feg fegtoken fegarmy fegex trading crypto btc eth saitama shib babydogecoin babydoge dogec,0.057034023106098175,0.9251646995544434,0.01780124008655548
2022-05-18,9:45,"🟩 Block 736896 ⛏ ⛏

📅 18th May 2022, 09:37:17 GMT

📣 2,188 tx with a value of 31,891.778 ₿ ($952.22m 🇺🇸)

📣 distributed to 5,291 recipients 💎🙌

📣 19,043,106.25 ₿ (90.68146%) mined ⛏

📣 1,956,893.75 ₿ remaining 💰

#bitcoin #tictoknextblock",block 736896 18th may 2022 gmt 2188 tx with a value of 31891778 95222m distributed to 5291 recipients 1904310625 9068146 mined 195689375 remaining bitcoin tictoknextblock,0.045379310846328735,0.9237106442451477,0.030910024419426918
2022-05-18,9:45,"@CryptoTownEU You are a great example for other projects.
I trust this project and I look forward to it. With our support, it will do well
@Niya1391 @Roz13662 @SarkerMAbdullah @Rakibul25493828 @FariarShojib
#Airdrop #Airdrops  #BSC #Crypto #Bitcoin #giveaway",cryptotowneu you are a great example for other projects i trust this project and i look forward to it with our support it will do well niya1391 roz13662 sarkermabdullah rakibul25493828 fariarshojib airdrop airdrops bsc crypto bitcoin giveaway,0.5388937592506409,0.4516445994377136,0.009461614303290844
2022-05-18,9:45,@BTC_Archive Which is a bad news for #Bitcoin,btcarchive which is a bad news for bitcoin,0.008610212244093418,0.036277513951063156,0.9551122784614563
2022-05-18,9:45,"The more time $btc is sat at 30k the less likely we will break to the upside. I only see #bitcoin bleeding a bit more and testing some low 20k numbers.
Could be wrong, but that's my bias 

$luna $ust $link $ada #cryptotrading #Cryptocrash",the more time btc is sat at 30k the less likely we will break to the upside i only see bitcoin bleeding a bit more and testing some low 20k numbers could be wrong but that is my bias luna ust link ada cryptotrading cryptocrash,0.07153043895959854,0.4974878430366516,0.4309817850589752
2022-05-18,9:45,"Luna needs a huge pump to £1 

#terraluna #UST #LUNA #Crypto #Binance #BabyDoge #KISHU #SHINJA #shibainu #doge #elon #Tesla #Coinbase #cryptocurrency #PITBULL #eth #bitcoin",luna needs a huge pump to 1 terraluna ust luna crypto binance babydoge kishu shinja shibainu doge elon tesla coinbase cryptocurrency pitbull eth bitcoin,0.10379007458686829,0.882427453994751,0.013782413676381111
2022-05-18,9:45,"@BybitAfrica BTC Halving. 
@Syed06132454
@AgusSud22579681
@maaBaton37 
#BTC #Bybit",bybitafrica btc halving syed06132454 agussud22579681 maabaton37 btc bybit,0.31339141726493835,0.6559942364692688,0.030614297837018967
2022-05-18,9:45,"work quest platform is one of the few where investors can invest and be confident of success. It has extraordinary goals&amp;plans for the future.The team of the best professionals &amp; creators.
#WorkQuest $WQT $WUSD #WorkNet #WorkQuestApp #blockchian #crypto #cryptolife #BTC #BNB #ETH",work quest platform is one of the few where investors can invest and be confident of success it has extraordinary goalsplans for the futurethe team of the best professionals creators workquest wqt wusd worknet workquestapp blockchian crypto cryptolife btc bnb eth,0.37690019607543945,0.6156615018844604,0.00743829132989049
2022-05-18,9:45,@TheMoonCarl #bitcoin not crypto,themooncarl bitcoin not crypto,0.03383509814739227,0.936305046081543,0.029859881848096848
2022-05-18,9:45,"It’s crazy to think that there’re people out there that have paid £50,000 to be misled by a Keynesian economist for 3 years. FIAT education is a waste of both time and money. #Bitcoin",its crazy to think that therere people out there that have paid 50000 to be misled by a keynesian economist for 3 years fiat education is a waste of both time and money bitcoin,0.02054113894701004,0.29956209659576416,0.6798967123031616
2022-05-18,9:45,"👋 A new block was found on the #Bitcoin network. We're at block height 736896, current #bitcoin price is $29854.73 and there are 195686872690011 #sats left to mine.",a new block was found on the bitcoin network we are at block height 736896 current bitcoin price is 2985473 and there are 195686872690011 sats left to mine,0.026466406881809235,0.9289732575416565,0.044560328125953674
2022-05-18,9:45,@PeterMcCormack @nayibbukele @NYDIG_BTC It was OK but I really missed the message of why #Bitcoin would exactly improve the lives of many El Salvadorans? E.g. I can't believe you didn't bring up the many remittance fees they will be saving. I think you had the urge that it had to be neutral and thus it missed the point,petermccormack nayibbukele nydigbtc it was ok but i really missed the message of why bitcoin would exactly improve the lives of many el salvadorans eg i cannot believe you did not bring up the many remittance fees they will be saving i think you had the urge that it had to be neutral and thus it missed the point,0.2458328902721405,0.5529865622520447,0.2011805921792984
2022-05-18,9:45,"Day 244
Just used @thebtcco to buy me a visa card. I am able to travel more freely.
Thank you so much #bitcoin plebs. @NomadicFuturist you are awesome.
Currently in Malawi, the 12th country.
Zikomo,
Paco
#runwithbitcoin",day 244 just used thebtcco to buy me a visa card i am able to travel more freely thank you so much bitcoin plebs nomadicfuturist you are awesome currently in malawi the 12th country zikomo paco runwithbitcoin,0.2368777096271515,0.7485619783401489,0.014560317620635033
2022-05-18,9:45,"UK Inflation reaches 9%, the highest it’s seen in 40 years 

#inflation #uk #Bitcoin #Crypto",uk inflation reaches 9 the highest its seen in 40 years inflation uk bitcoin crypto,0.6684679388999939,0.1623898148536682,0.1691422313451767
2022-05-18,9:45,"Can we see some #BTC dump ? 
I am waiting dear #Bitcoin 😂",can we see some btc dump i am waiting dear bitcoin,0.0407690554857254,0.9361898899078369,0.02304103411734104
2022-05-18,9:45,"Is bitcoin still be used as hedge to inflation?

#btc
#bitcoin
#bearmarket
#inflation",is bitcoin still be used as hedge to inflation btc bitcoin bearmarket inflation,0.059584908187389374,0.9259621500968933,0.014452878385782242
2022-05-18,9:45,"@NokuOfficial You are a great example for other projects.
I trust this project and I look forward to it. With our support, it will do well
@Niya1391 @Roz13662 @SarkerMAbdullah @Rakibul25493828 @FariarShojib
#Airdrop #Airdrops  #BSC #Crypto #Bitcoin #giveaway",nokuofficial you are a great example for other projects i trust this project and i look forward to it with our support it will do well niya1391 roz13662 sarkermabdullah rakibul25493828 fariarshojib airdrop airdrops bsc crypto bitcoin giveaway,0.544685959815979,0.44498929381370544,0.010324746370315552
2022-05-18,9:45,"Next three hours will be tough for the market
#cryptotrading #btc #Ethereum",next three hours will be tough for the market cryptotrading btc ethereum,0.024753134697675705,0.19417501986026764,0.7810718417167664
2022-05-18,9:45,@cz_binance cheating bastards @stablekwon @cz_binance #LUNAtics #luna #LUNAUSDT #lunatera #btc #Bitcoin #Ethereum #altcoins #Memes #VINU,czbinance cheating bastards stablekwon czbinance lunatics luna lunausdt lunatera btc bitcoin ethereum altcoins memes vinu,0.05312688276171684,0.9266584515571594,0.020214635878801346
2022-05-18,9:45,"“Inflation has peaked!”

But inflation COMPOUNDS

#matishard #btc",inflation has peaked but inflation compounds matishard btc,0.264564573764801,0.16423742473125458,0.571198046207428
2022-05-18,9:45,"$Luna Foundation Guard reserves have been depleted from more than 80,000 #bitcoin on May 7, to just 313 #bitcoin today, #LFG said
$Luna Foundation guard.",luna foundation guard reserves have been depleted from more than 80000 bitcoin on may 7 to just 313 bitcoin today lfg said luna foundation guard,0.01572704128921032,0.028904760256409645,0.9553682208061218
2022-05-18,9:45,"I don't understand the idiots who still don't want to understand this..
#btc",i do not understand the idiots who still do not want to understand this btc,0.03002888895571232,0.4845018982887268,0.48546916246414185
2022-05-18,9:45,create twitter tasks and pay with #bitcoin #ethereum #litecoin #nft #airdrop with @jobboycom,create twitter tasks and pay with bitcoin ethereum litecoin nft airdrop with jobboycom,0.03466211259365082,0.9412561058998108,0.024081749841570854
2022-05-18,9:45,You wanna be the first millionaire in your family just buy and hold #Randyinu you’ll get 8% btc reflection #Randyinu #next100xgem #btc #BSCGem 🔥🔥🔥🔥🔥🔥🚀🚀🚀🚀🚀🚀🚀🚀🚀🚀🚀🚀,you wanna be the first millionaire in your family just buy and hold randyinu youll get 8 btc reflection randyinu next100xgem btc bscgem,0.07808231562376022,0.910855770111084,0.011061917059123516
2022-05-18,9:45,@NorthmanTrader about #Bitcoin for sure,northmantrader about bitcoin for sure,0.03648343309760094,0.9341326355934143,0.029384011402726173
2022-05-18,9:45,@coinspotau Next coin listing will be #OMAX an emerging #Blockchain project @OmaxToken @omaxians #BNBChain #1000xgem #Bitcoin  #Trending #Blockchain2022 #SHIBARMY #bitcoinlfg,coinspotau next coin listing will be omax an emerging blockchain project omaxtoken omaxians bnbchain 1000xgem bitcoin trending blockchain2022 shibarmy bitcoinlfg,0.05399824678897858,0.9327818751335144,0.013219841755926609
2022-05-18,9:45,"BTC at 20k is a good buying time for alt coins ! 

#terraluna #UST #LUNA #Crypto #Binance #BabyDoge #KISHU #SHINJA #shibainu #doge #elon #Tesla #Coinbase #cryptocurrency #PITBULL #eth #bitcoin",btc at 20k is a good buying time for alt coins terraluna ust luna crypto binance babydoge kishu shinja shibainu doge elon tesla coinbase cryptocurrency pitbull eth bitcoin,0.15771259367465973,0.8305483460426331,0.01173902116715908
2022-05-18,9:45,"@MariusCrypt0 It was a Ponzi ffs, stop blaming the #Bitcoin price. Do Kwon manipulated the price of Bitcoin upwards with fake dollars (UST) printed out of thin air prior to the 7 week downtrend.",mariuscrypt0 it was a ponzi ffs stop blaming the bitcoin price do kwon manipulated the price of bitcoin upwards with fake dollars ust printed out of thin air prior to the 7 week downtrend,0.030592147260904312,0.2558078169822693,0.7136000394821167
2022-05-18,9:45,The best way to fight inflation is to move to a #Bitcoin standard.,the best way to fight inflation is to move to a bitcoin standard,0.151369109749794,0.8363239169120789,0.012306983582675457
2022-05-18,9:45,"@funnygameworld Hope will soon change future crypto trends in new ways. it looks very promising, as this project is always a trend. very strong project.
#FGW #FunnyGameWorld #crypto #bitcoin #cryptocurrency #blockchain #bounty #binance #eth #token #coinsbit",funnygameworld hope will soon change future crypto trends in new ways it looks very promising as this project is always a trend very strong project fgw funnygameworld crypto bitcoin cryptocurrency blockchain bounty binance eth token coinsbit,0.3309820592403412,0.6607661843299866,0.008251778781414032
2022-05-18,9:45,"@AirdropDet @Maxity_io This is a good project and have a good team. Congratulation to the team for their efforts to make this happen and best regard for the future.  
@BrAvEhEaRtRU @Orang32998969 @Cryptoxbuddy
#Airdrops #Maxity #Bitcoin #AirdropDetective #Crypto #BUSD",airdropdet maxityio this is a good project and have a good team congratulation to the team for their efforts to make this happen and best regard for the future braveheartru orang32998969 cryptoxbuddy airdrops maxity bitcoin airdropdetective crypto busd,0.3922552764415741,0.5994518399238586,0.008292908780276775
2022-05-18,9:45,"Some people Buy crypto some people mine crypto!!

 Who make more profit?
#BTC #Luna #doge #Ethereum",some people buy crypto some people mine crypto who make more profit btc luna doge ethereum,0.03324343264102936,0.9432804584503174,0.023476187139749527
2022-05-18,9:45,"Old people:  #Bitcoin, #Ethereum and #dogecoin are worthless.  Also old people:  You better pay me lots of taxes every t…",old bitcoin ethereum and dogecoin are worthless also old you better pay me lots of taxes every t,0.047013286501169205,0.8929308652877808,0.060055818408727646
2022-05-18,9:45,"Two things are inevitable: #Bitcoin &amp; #veganism.

Change my mind.",two things are bitcoin veganism change my mind,0.04735776036977768,0.9145840406417847,0.038058191537857056
2022-05-18,9:45,"Big dips ahead get ready to invest!

#terraluna #UST #LUNA #Crypto #Binance #BabyDoge #KISHU #SHINJA #shibainu #doge #elon #Tesla #Coinbase #cryptocurrency #PITBULL #eth #bitcoin",big dips ahead get ready to invest terraluna ust luna crypto binance babydoge kishu shinja shibainu doge elon tesla coinbase cryptocurrency pitbull eth bitcoin,0.11804559826850891,0.8637077808380127,0.018246613442897797
2022-05-18,9:45,"BREAKING: Terra $LUNA buying another amount into #Bitcoin, actually $176 million.",terra luna buying another amount into bitcoin actually 176 million,0.07688717544078827,0.9089252948760986,0.014187539927661419
2022-05-18,9:45,"@amonbuy @KyberNetwork @KyberDAO @KyberVentures @binance @coinbase @cryptocom @Blockworks_ @crypto @WatcherGuru #Bitcoin always recover if you wait long enough, If there is any coin not to ever underrate then is BTC because the pump will always happen

If you aren’t following @Acflexi  you should be. There aren’t many who have a better understanding of value investing, great tweets &amp; tips",amonbuy kybernetwork kyberdao kyberventures binance coinbase cryptocom blockworks crypto watcherguru bitcoin always recover if you wait long enough if there is any coin not to ever underrate then is btc because the pump will always happen if you aren not following acflexi you should be there aren not many who have a better understanding of value investing great tweets tips,0.05658482387661934,0.9137245416641235,0.029690667986869812
2022-05-18,9:45,"@BitcoinMagazine @nayibbukele Very well, these people really need to be educated to get a correct adoption

Colombia is also growing a lot, you can currently buy prepaid cards from various businesses and services in exchange for #Bitcoin

And this year they will host the first #cryptos event, by @xpocrypto",bitcoinmagazine nayibbukele very well these people really need to be educated to get a correct adoption colombia is also growing a lot you can currently buy prepaid cards from various businesses and services in exchange for bitcoin and this year they will host the first cryptos event by xpocrypto,0.23654261231422424,0.7543339729309082,0.009123416617512703
2022-05-18,9:45,"@gladstein @EdanYago #Bitcoin always recover if you wait long enough, If there is any coin not to ever underrate then is BTC because the pump will always happen

If you aren’t following @Acflexi  you should be. There aren’t many who have a better understanding of value investing, great tweets &amp; tips",gladstein edanyago bitcoin always recover if you wait long enough if there is any coin not to ever underrate then is btc because the pump will always happen if you aren not following acflexi you should be there aren not many who have a better understanding of value investing great tweets tips,0.06552402675151825,0.9053203463554382,0.029155561700463295
2022-05-18,9:45,Atletico Madrid Fan Token (ATM) went up 12.3 percent in the last 30 minutes on Binance. #ATM  #crypto #bitcoin #cryptocurrency #btc #ethereum #blockchain #eth #trading #altcoin #binance #cryptonews,atletico madrid fan token atm went up 123 percent in the last 30 minutes on binance atm crypto bitcoin cryptocurrency btc ethereum blockchain eth trading altcoin binance cryptonews,0.9040079712867737,0.08212358504533768,0.013868462294340134
2022-05-18,9:45,"@BriseBitgert #Bitcoin always recover if you wait long enough, If there is any coin not to ever underrate then is BTC because the pump will always happen

If you aren’t following @Acflexi  you should be. There aren’t many who have a better understanding of value investing, great tweets &amp; tips",brisebitgert bitcoin always recover if you wait long enough if there is any coin not to ever underrate then is btc because the pump will always happen if you aren not following acflexi you should be there aren not many who have a better understanding of value investing great tweets tips,0.06580027937889099,0.9062854647636414,0.027914317324757576
2022-05-18,9:45,@CryptoMichNL Pump #Bitcoin and let's rest,cryptomichnl pump bitcoin and let us rest,0.08508516103029251,0.9040970802307129,0.01081775687634945
2022-05-18,9:45,"@elonmusk @elonmusk I have a crazy idea!
why don't you create a gym.
TESLA FIT.
managed by TESLA bot 
who help people while exercising.
and a card to access, payable monthly with BTC and Dogecoin!
with tesla parking. 😍
#Tesla #TESLAbot
#dogecoin
#BTC #ElonMuskTwitter",elonmusk elonmusk i have a crazy idea why do not you create a gym tesla fit managed by tesla bot who help people while exercising and a card to access payable monthly with btc and dogecoin with tesla parking tesla teslabot dogecoin btc elonmusktwitter,0.04521794244647026,0.9331624507904053,0.021619530394673347
2022-05-18,9:45,We have detected: #Bitcoin $BTC was listed as BTC/₽ on #Huobi Global,we have bitcoin btc was listed as btc on huobi global,0.022501779720187187,0.9526581168174744,0.024840114638209343
2022-05-18,9:45,Current #Bitcoin Price is $29842 #BTC #Crypto,current bitcoin price is 29842 btc crypto,0.021962933242321014,0.9492542147636414,0.028782861307263374
2022-05-18,9:45,@WClementeIII The #Bitcoin price and overwhelming lack of interest begs to differ...,wclementeiii the bitcoin price and overwhelming lack of interest begs to differ,0.1835649162530899,0.3506303131580353,0.4658048152923584
2022-05-18,9:45,@ODU_96 The goal for #Bitcoin is freedom. It is a way to store time and widen the range of possibilities in life.,odu96 the goal for bitcoin is freedom it is a way to store time and widen the range of possibilities in life,0.40906083583831787,0.582675576210022,0.008263537660241127
2022-05-18,9:45,"What crypto market is planning for the next week?

#Flitpay #whynotcrypto #Bitcoin #cryptotrading 

Bear              Bull             Can't say
 👇                 👇                   👇",what crypto market is planning for the next week flitpay whynotcrypto bitcoin cryptotrading bear bull cannot say,0.02841329388320446,0.9364634156227112,0.03512324020266533
2022-05-18,9:45,"@Sweety_zaramoto GM @Sweety_zaramoto 
No #Bitcoin logo on top...😎",sweetyzaramoto gm sweetyzaramoto no bitcoin logo on top,0.031056707724928856,0.9438344240188599,0.02510889060795307
2022-05-18,9:45,"@TheMoonCarl hear...HEAR !!! #BTC #DGB #ETH #TRX #altcoin
Bitcoin🔜🔙🆙2️⃣the🔝💪2️⃣💯",themooncarl hearhear btc dgb eth trx altcoin bitcoin2the2,0.05753679946064949,0.9180201888084412,0.024443011730909348
2022-05-18,9:45,"@BTC_Archive #Bitcoin always recover if you wait long enough, If there is any coin not to ever underrate then is BTC because the pump will always happen

If you aren’t following @Acflexi  you should be. There aren’t many who have a better understanding of value investing, great tweets &amp; tips",btcarchive bitcoin always recover if you wait long enough if there is any coin not to ever underrate then is btc because the pump will always happen if you aren not following acflexi you should be there aren not many who have a better understanding of value investing great tweets tips,0.06881248205900192,0.8992698788642883,0.03191766142845154
2022-05-18,9:45,@jonanon18 @BTC_Archive I choose #btc,jonanon18 btcarchive i choose btc,0.07692404091358185,0.9082342982292175,0.014841682277619839
2022-05-18,9:45,"Volume drying up. Big move pending. Which way are we going?📈📉
$BTC #Bitcoin",volume drying up big move pending which way are we going btc bitcoin,0.0395793616771698,0.9174001812934875,0.04302043467760086
2022-05-18,9:45,"#BITCOIN #BTC impulse bar 29765.61 - 29868.65

$BTC Bar close 29827.95

#Crypto short term volatility detection",bitcoin btc impulse bar 2976561 2986865 btc bar close 2982795 crypto short term volatility detection,0.034882802516222,0.9307795763015747,0.034337639808654785
2022-05-18,9:45,"@rovercrc #Bitcoin always recover if you wait long enough, If there is any coin not to ever underrate then is BTC because the pump will always happen

If you aren’t following @Acflexi  you should be. There aren’t many who have a better understanding of value investing, great tweets &amp; tips",rovercrc bitcoin always recover if you wait long enough if there is any coin not to ever underrate then is btc because the pump will always happen if you aren not following acflexi you should be there aren not many who have a better understanding of value investing great tweets tips,0.06005912646651268,0.9087895154953003,0.03115135058760643
2022-05-18,9:45,@cryptomanran It’s inevitable!!! Cheaters all around crypro. 90% of all projects will die soon or later! One wise man ( @maxkeiser ) says: ALT coins are here only to steal your #BTC away….. 💯 agree !,cryptomanran its inevitable cheaters all around crypro 90 of all projects will die soon or later one wise man maxkeiser alt coins are here only to steal your btc away agree,0.032229043543338776,0.8895809650421143,0.07819002121686935
