Date,Time,Original tweet,Clean tweet,Positive,Neutral,Negative
2022-04-26,17:45,"Current #Bitcoin price is $38,294.06",current bitcoin price is 3829406,0.021086661145091057,0.938919186592102,0.03999421373009682
2022-04-26,17:45,"@WhaleChart I’m watching $38k-$48k as the next resistance for #Bitcoin if we can break this range with confirmation then the 2nd half of bull market  is starting!

I’ve been following &amp; taking @62_crypt tweets and every single tips seriously I’ve  been doing superb

Follow her!!",whalechart im watching 38k 48k as the next resistance for bitcoin if we can break this range with confirmation then the 2nd half of bull market is starting ive been following taking 62crypt tweets and every single tips seriously ive been doing superb follow her,0.19302552938461304,0.7921887040138245,0.01478574052453041
2022-04-26,17:45,"#32 #Stablecoins allow for the convenience of cryptocurrency (fast settlement and fewer regulatory hurdles) without the risk of volatile price fluctuations of other cryptocurrencies like #BTC and #ETH therefore, serving as a more superior medium of exchange. 4/9",32 stablecoins allow for the convenience of cryptocurrency fast settlement and fewer regulatory hurdles without the risk of volatile price fluctuations of other cryptocurrencies like btc and eth therefore serving as a more superior medium of exchange 49,0.6093260049819946,0.380890816450119,0.009783126413822174
2022-04-26,17:45,@SimplyBitcoinTV Leaving us with depression that is called #BTC,simplybitcointv leaving us with depression that is called btc,0.02428269572556019,0.34722933173179626,0.6284879446029663
2022-04-26,17:45,"@AirdropStario This is a very good project. You all join.

@AbuyusufRony2

@simanto_joy

@Biplob80049000 

#cryptocurrency #Airdrop #BSC #Bitcoin #USDT #METAPUFFY #PUFFY #Airdropstario",airdropstario this is a very good project you all join abuyusufrony2 simantojoy biplob80049000 cryptocurrency airdrop bsc bitcoin usdt metapuffy puffy airdropstario,0.2717702388763428,0.7201406955718994,0.008089079521596432
2022-04-26,17:45,"@phil_geiger In addition to not having self sovereignty, having to “sell the #bitcoin” at the time of retirement is a HUGE con for “not your keys” model. Unchained FTW",philgeiger in addition to not having self sovereignty having to sell the bitcoin at the time of retirement is a huge con for not your keys model unchained ftw,0.041024480015039444,0.8521491885185242,0.1068262830376625
2022-04-26,17:45,@elonmusk my young daughter doesn’t trust you because she thinks you’re ‘musky’! 🤔 whatever that means! 🤣🤣🤣 #Crypto #doge #nft #btc,elonmusk my young daughter doesn not trust you because she thinks youre musky whatever that means crypto doge nft btc,0.029869319871068,0.8315799832344055,0.13855065405368805
2022-04-26,17:45,"@AirdropStario Fantastic Project 

@ChayonCosta
@Kamruzzaman2023
@MdAnarul01 

#Airdrop #BSC #Bitcoin #USDT #BitcoinFanClub #BTCF #Airdropstario",airdropstario fantastic project chayoncosta kamruzzaman2023 mdanarul01 airdrop bsc bitcoin usdt bitcoinfanclub btcf airdropstario,0.1438765674829483,0.8446267247200012,0.011496735736727715
2022-04-26,17:45,@TheCryptoLark I bought #Bitcoin and $BMI @Bridge_Mutual,thecryptolark i bought bitcoin and bmi bridgemutual,0.09727521985769272,0.8922399282455444,0.01048482395708561
2022-04-26,17:45,"🐮 BULLWHALE! just LONGED $3,240,115 worth of #Bitcoin #BTC at $38,350 on #Binance Futures",bullwhale just longed 3240115 worth of bitcoin btc at 38350 on binance futures,0.038298118859529495,0.912044107913971,0.04965771362185478
2022-04-26,17:45,"🐻 BEARWHALE! just SHORTED $6,491,882 worth of #Bitcoin #BTC at $38,340 on #Binance Futures",bearwhale just shorted 6491882 worth of bitcoin btc at 38340 on binance futures,0.10330592840909958,0.7919445633888245,0.10474947839975357
2022-04-26,17:45,"🔻🔻🔻 $1,170,400 BTCUSD SHORTED @$38,340.0 on #Binance (17:41:20 UTC) #BTC #cryptocurrency",1170400 btcusd shorted 383400 on binance utc btc cryptocurrency,0.03756958618760109,0.9350436925888062,0.02738676778972149
2022-04-26,17:45,📈 ETHUSD SELL signal now (partial) #eth #crypto #DCA #TradingSignals #BTC #Bitcoin 26/4/2022@17:41:18,ethusd sell signal now partial eth crypto dca tradingsignals btc bitcoin,0.02995689958333969,0.9357785582542419,0.03426458686590195
2022-04-26,17:45,#BTC has fallen by -7.29% in the last week. The price is currently $38294.06.,btc has fallen by 729 in the last week the price is currently 3829406,0.008550803177058697,0.031022407114505768,0.9604268074035645
2022-04-26,17:45,"its going sub 20k - bitcoinpoker

#bitcoin",its going sub 20k bitcoinpoker bitcoin,0.0756526067852974,0.9062535166740417,0.018093835562467575
2022-04-26,17:45,@rovercrc So who listened to this 🤡 bought #BTC and got REKT?,rovercrc so who listened to this bought btc and got rekt,0.1296498328447342,0.8579347729682922,0.012415394186973572
2022-04-26,17:45,I can’t believe #Bitcoin is this cheap.  Buying opp of the decade imo,i can not believe bitcoin is this cheap buying opp of the decade imo,0.20746636390686035,0.7721726298332214,0.020360982045531273
2022-04-26,17:45,I’m buying the dip #bitcoin,im buying the dip bitcoin,0.08972450345754623,0.8924928307533264,0.01778271608054638
2022-04-26,17:45,"@MatthewHyland_ This idea that #BTC is not correlated to the stock market came from influencers. This is not a market for influencers now, it is kinda funny 🤡😂",matthewhyland this idea that btc is not correlated to the stock market came from influencers this is not a market for influencers now it is kinda funny,0.03223298862576485,0.9028377532958984,0.06492920219898224
2022-04-26,17:45,"@Roman_Trading Follow me, unbiased and don't use complicated indicators. You can check how accurate i was in predicting the next move of #BTC",romantrading follow me unbiased and do not use complicated indicators you can check how accurate i was in predicting the next move of btc,0.06712406873703003,0.9170621633529663,0.01581380143761635
2022-04-26,17:45,JUST IN: 🇨🇦 Ban Of Canada says that #bitcoin and #crypto is not a way for people to opt out of inflation,just ban of canada says that bitcoin and crypto is not a way for people to opt out of inflation,0.03158080205321312,0.6737279891967773,0.2946912348270416
2022-04-26,17:45,"""Never going to give you up"" — Rick Astley on #Bitcoin",never going to give you up rick astley on bitcoin,0.05241017788648605,0.9226890206336975,0.024900808930397034
2022-04-26,17:45,"@whale_alert What do you think about #Bitcoin state at the moment, because its Fear and Greed index is 41 - MILD FEAR with price of 38671.964846034602 usd? Our analytical team has done detailed #BTC research, but we want to hear your opinion too.",whalealert what do you think about bitcoin state at the moment because its fear and greed index is 41 mild fear with price of 38671964846034602 usd our analytical team has done detailed btc research but we want to hear your opinion too,0.05890160799026489,0.9233368635177612,0.017761530354619026
2022-04-26,17:45,#Bitcoin will change your family tree forever for the unselfish,bitcoin will change your family tree forever for the unselfish,0.0873921811580658,0.8918009400367737,0.020806843414902687
2022-04-26,17:45,"Will it go to 35k?  Maybe.  But what few are talking about is the fact that #Bitcoin #BTC has been building a MASSIVE support range at 38-40k.  Why?  Because we're about to burst.

I thought it was going to happen already, but it'll happen soon.",will it go to 35k maybe but what few are talking about is the fact that bitcoin btc has been building a massive support range at 3840k why because we are about to burst i thought it was going to happen already but it will happen soon,0.38722360134124756,0.5940185785293579,0.01875780150294304
2022-04-26,17:45,It's hammer time #btc,it is hammer time btc,0.036235030740499496,0.9255326986312866,0.03823225572705269
2022-04-26,17:45,Yo homies my local bodega got their liquor license taken and he needs to adopt #bitcoin right now. He’s super scared so I want to reach out to y’all seeing if you’ve ever emergency onboarded a business and what you found to be best immediate use practice. And potential problems,yo homies my local bodega got their liquor license taken and he needs to adopt bitcoin right now hes super scared so i want to reach out to yall seeing if youve ever emergency onboarded a business and what you found to be best immediate use practice and potential problems,0.06312494724988937,0.8930741548538208,0.043800923973321915
2022-04-26,17:45,@jerryxfeng Fuckkkk what a joke 🤣. You can choose the #Bitcoin sell it and have 40k in cash.,jerryxfeng fuckkkk what a joke you can choose the bitcoin sell it and have 40k in cash,0.03671921789646149,0.9314544796943665,0.03182634338736534
2022-04-26,17:45,"@Duetertoken Join this airdrop with me, bro!!!
@bit_jes  @phannhim15  @mrnghia12101 
#Dueter #DUO #Bitcoin #music",duetertoken join this airdrop with me bro bitjes phannhim15 mrnghia12101 dueter duo bitcoin music,0.11914364248514175,0.8677939176559448,0.013062422163784504
2022-04-26,17:45,@MartiniGuyYT True that! #Bitcoin 🚀,martiniguyyt true that bitcoin,0.1486012488603592,0.8150169849395752,0.03638176992535591
2022-04-26,17:45,NEW: Buenos Aires will allow its citizens to pay taxes in #Bitcoin  and digital assets.,buenos aires will allow its citizens to pay taxes in bitcoin and digital assets,0.11900532990694046,0.8701173067092896,0.010877389460802078
2022-04-26,17:45,"The price of #bitcoin is like a 🎢. 
This is the power of capital,it hurts us. LOL",the price of bitcoin is like a this is the power of capitalit hurts us lol,0.05793031305074692,0.90171879529953,0.04035085067152977
2022-04-26,17:45,@MartiniGuyYT Agree. Just waiting for a while. #btc,martiniguyyt agree just waiting for a while btc,0.17113015055656433,0.8044815063476562,0.02438829466700554
2022-04-26,17:45,"Rest In Peace Trading, forex and #Bitcoin",rest in peace trading forex and bitcoin,0.03606479987502098,0.9405636787414551,0.023371577262878418
2022-04-26,17:45,Whether #Bitcoin will return to $60K again...very sure,whether bitcoin will return to 60k againvery sure,0.1588757485151291,0.825154185295105,0.015970144420862198
2022-04-26,17:45,@o0splat0o #Bitcoin changes lives,o0splat0o bitcoin changes lives,0.08168324828147888,0.8648850321769714,0.05343174189329147
2022-04-26,17:45,"@AlzdFrnaz @binance @StarlinkInu @cz_binance @davidgokhshtein @cryptocom @StarlinkInu #StarlinkInu #CRO #cryptocurrency #TheFirst #MATIC #BSCGems #BSC #Bitcoin #ETH #APE #Blockchain #Crypto #DeFi
 @TrustWallet @WatcherGuru @DjPrestigeUk @frey @hollarabbitmac @cryptocom @BSCGemsAlert @whale_alert @TheMoonCarl @vingoslang @kris $ADA $BNB $Shib
$BTC $CRO",alzdfrnaz binance starlinkinu czbinance davidgokhshtein cryptocom starlinkinu starlinkinu cro cryptocurrency thefirst matic bscgems bsc bitcoin eth ape blockchain crypto defi trustwallet watcherguru djprestigeuk frey hollarabbitmac cryptocom bscgemsalert whalealert themooncarl vingoslang kris ada bnb shib btc cro,0.05195433273911476,0.9272305965423584,0.020815091207623482
2022-04-26,17:45,#Ivermectin is the next #Bitcoin,ivermectin is the next bitcoin,0.04504166543483734,0.9391357898712158,0.015822552144527435
2022-04-26,17:45,"@BitcoinMagazine @IndiraKempis @senadomexicano They just need like 3500 more, vut at least started #WAGMI #bitcoin #crypto",bitcoinmagazine indirakempis senadomexicano they just need like 3500 more vut at least started wagmi bitcoin crypto,0.0652177706360817,0.9108322262763977,0.023949984461069107
2022-04-26,17:45,"@BTC_Archive Soon these $BTC ATM Machines will be in every store around the world just like regular Cash ATMS 💯
#Bitcoin 
#Crypto",btcarchive soon these btc atm machines will be in every store around the world just like regular cash atms bitcoin crypto,0.057608213275671005,0.9304845929145813,0.011907163076102734
2022-04-26,17:45,You know Tim Westwood is trying to hide all his money in #Bitcoin and Crypto,you know tim westwood is trying to hide all his money in bitcoin and crypto,0.02633766643702984,0.8583510518074036,0.11531134694814682
2022-04-26,17:45,"debit cards are annoying, like they’re clunky, they’re painful, they’re error-prone—so #Bitcoin is just easier too, right? And so what I’ve done at times is use #Bitcoin to pay for something, then go buy some more #Bitcoin quickly before the price moves too much so that I’m not",debit cards are annoying like theyre clunky theyre painful theyre errorproneso bitcoin is just easier too right and so what ive done at times is use bitcoin to pay for something then go buy some more bitcoin quickly before the price moves too much so that im not,0.026989376172423363,0.5610978603363037,0.411912739276886
2022-04-26,17:45,"Now isn't the time to be making any rash/critical buys..

There's going to be a scalping of practices illegitimate developers use to pump projects

Developers who have been using said tactics will inevitably get exposed to what they are; frauds

#btc $eth $ftm $avax $sol",now is not the time to be making any rashcritical buys there is going to be a scalping of practices illegitimate developers use to pump projects developers who have been using said tactics will inevitably get exposed to what they are frauds btc eth ftm avax sol,0.01999044232070446,0.5365786552429199,0.44343090057373047
2022-04-26,17:45,"To be clear and ease any confusion on this channel.

I Hodl #BitCoin &amp; $WILD, buying dips accordingly but
I Trade #MicroCaps like baseball cards constantly.

#NFTs spook me out, but I'm thinking on it.  🃏🧐",to be clear and ease any confusion on this channel i hodl bitcoin wild buying dips accordingly but i trade microcaps like baseball cards constantly nfts spook me out but i am thinking on it,0.08788149803876877,0.868323028087616,0.04379549250006676
2022-04-26,17:45,"@Dennis_Porter_ Well, I started with portion too. Then I increased that portion... #bitcoin",dennisporter well i started with portion too then i increased that portion bitcoin,0.20809538662433624,0.7724449038505554,0.01945967599749565
2022-04-26,17:45,"Simply incredible what $fitfi is doing and it is only getting started, let’s go! $gmt holders better get on board 

#Crypto #fitfi #gmt #cryptocurrecy #meta #nike #Bitcoin",simply incredible what fitfi is doing and it is only getting started lets go gmt holders better get on board crypto fitfi gmt cryptocurrecy meta nike bitcoin,0.09116724133491516,0.8936947584152222,0.015137930400669575
2022-04-26,17:45,Traveling to Bitcoin Beach #Bitcoin and I’m excited to see the opportunities abroad!,traveling to bitcoin beach bitcoin and im excited to see the opportunities abroad,0.4458905756473541,0.5417615175247192,0.012347874231636524
2022-04-26,17:45,"The thought behind this project is extraordinary and incredible and deserves more help. Thanks to the team behind such an amazing project.
#FGW #FunnyGameWorld #crypto #bitcoin #cryptocurrency #blockchain #bounty #binance #eth #token #coinsbit
@funnygameworld",the thought behind this project is extraordinary and incredible and deserves more help thanks to the team behind such an amazing project fgw funnygameworld crypto bitcoin cryptocurrency blockchain bounty binance eth token coinsbit funnygameworld,0.25134462118148804,0.7400497794151306,0.008605514653027058
2022-04-26,17:45,"1. #Bitcoin ATM installed in Mexican Senate

2. Fidelity announces #Bitcoin in 401k allocation.

3. Fort Worth, Texas first US city to Mine #BTC

Good day for fundamentals, bad day to look at prices.",1 bitcoin atm installed in mexican senate 2 fidelity announces bitcoin in 401k allocation 3 fort worth texas first us city to mine btc good day for fundamentals bad day to look at prices,0.2546355724334717,0.7227851748466492,0.022579245269298553
2022-04-26,17:45,"Breaking news | @binance announces a crypto card that will allow displaced Ukranians to make crypto transactions and receive funds through the Binance Visa Card.
#Crypto #Bitcoin #eCash #xec #eCashArmy",breaking news binance announces a crypto card that will allow displaced ukranians to make crypto transactions and receive funds through the binance visa card crypto bitcoin ecash xec ecasharmy,0.2686140537261963,0.7184540629386902,0.01293188240379095
2022-04-26,17:45,A great place to buy! #Bitcoin,a great place to buy bitcoin,0.16828957200050354,0.8212108612060547,0.010499604977667332
2022-04-26,17:45,#BITCOIN IS ABOUT TO BOUNCE BIG 🚀,bitcoin is about to bounce big,0.23656265437602997,0.6988345980644226,0.06460273265838623
2022-04-26,17:45,"Trade broadly refers to the exchange of goods and services, most often in return for money. #NFTCommunity #nftart #NFTdrops #NFTartists #NFTGame @BoredApeYC @MeekMill @Coinbase_NFT @TheBinanceNFT #bitcoin",trade broadly refers to the exchange of goods and services most often in return for money nftcommunity nftart nftdrops nftartists nftgame boredapeyc meekmill coinbasenft thebinancenft bitcoin,0.023802654817700386,0.9456645250320435,0.0305328331887722
2022-04-26,17:45,"@PricedinBTC Will this be via Fidelity custody #btc? I assume they have a lot given their relatively early interest...or another external product. Very interesting, for example ...if they mined what they are offering to customers.",pricedinbtc will this be via fidelity custody btc i assume they have a lot given their relatively early interestor another external product very interesting for example if they mined what they are offering to customers,0.21417921781539917,0.7773508429527283,0.008469982072710991
2022-04-26,17:45,Now it’s enough dump. #Bitcoin go back to the bright side pls.,now its enough dump bitcoin go back to the bright side pls,0.20426249504089355,0.7734056115150452,0.022331837564706802
2022-04-26,17:45,"@BitcoinMagazine @IndiraKempis @senadomexicano That's cool 🙌
#Bitcoin",bitcoinmagazine indirakempis senadomexicano that is cool bitcoin,0.04476272314786911,0.9226729869842529,0.03256430849432945
2022-04-26,17:45,"If 38k doesn't hold, I'm certainly not buying 37k.

#BTC",if 38k does not hold i am certainly not buying 37k btc,0.054350610822439194,0.9083157181739807,0.037333641201257706
2022-04-26,17:45,"🔻🔻🔻 $1,354,400 BTCUSD SHORTED @$38,220.6 on #Binance (17:39:11 UTC) #BTC #cryptocurrency",1354400 btcusd shorted 382206 on binance utc btc cryptocurrency,0.03496444225311279,0.9360330104827881,0.029002605006098747
2022-04-26,17:45,🚨 BREAKING: The first #Bitcoin ATM Machine in Mexico has been installed inside the Senate.,the first bitcoin atm machine in mexico has been installed inside the senate,0.23912067711353302,0.7529547810554504,0.007924554869532585
2022-04-26,17:45,"How blind do you have to be to not understand this is a trend that will keep growing:
1. First country to adopt #Bitcoin 
2. First US city to mine 
3. First US state to mine 
4. First central bank to put #BTC on balance sheet
5. Second country to adopt 

and so on, and so on...",how blind do you have to be to not understand this is a trend that will keep 1 first country to adopt bitcoin 2 first us city to mine 3 first us state to mine 4 first central bank to put btc on balance sheet 5 second country to adopt and so on and so on,0.048927031457424164,0.9279128909111023,0.02316013164818287
2022-04-26,17:45,"@WatcherGuru @IndiraKempis Soon these $BTC ATM Machines will be in every store around the world just like regular Cash ATMS 💯
#Bitcoin 
#MassAdoption 🥳",watcherguru indirakempis soon these btc atm machines will be in every store around the world just like regular cash atms bitcoin massadoption,0.0794137641787529,0.9093409180641174,0.011245337314903736
2022-04-26,17:45,"""People will buy things with #Bitcoin and then years later it will turn out to be an expensive purchase. So what I try to do to avoid that is—some things you want to buy with #Bitcoin, for privacy reasons or because it’s easier and just like wire transfers and credit cards and",people will buy things with bitcoin and then years later it will turn out to be an expensive purchase so what i try to do to avoid that issome things you want to buy with bitcoin for privacy reasons or because its easier and just like wire transfers and credit cards and,0.03135932236909866,0.8634610772132874,0.10517960041761398
2022-04-26,17:45,@michaeljburry #bitcoin solves this,michaeljburry bitcoin solves this,0.10928009450435638,0.8289169669151306,0.06180291250348091
2022-04-26,17:45,"@DylanLeClair_ Nice, Cheap #sats
#Bitcoin the ultimate Government Credit default swap 👌",dylanleclair nice cheap sats bitcoin the ultimate government credit default swap,0.040457434952259064,0.9366165995597839,0.022925911471247673
2022-04-26,17:45,"@BitcoinMagazine @IndiraKempis @senadomexicano For education purposes, there are no #bitcoin ATMs working in México yet, there is no legislation for it.",bitcoinmagazine indirakempis senadomexicano for education purposes there are no bitcoin atms working in méxico yet there is no legislation for it,0.02945408597588539,0.9396068453788757,0.030939042568206787
2022-04-26,17:45,"Can’t wait to eat rice for dinner tonight with a glass of tap water 

Thank you #Bitcoin",can not wait to eat rice for dinner tonight with a glass of tap water thank you bitcoin,0.13366268575191498,0.8476129174232483,0.018724387511610985
2022-04-26,17:45,"Inbox me, If you still want your Account Back!!!

I'm available 24/7 for all Hacking Services
#Hack #coinbase #Hacking #bitcoin   #bnb  #privacy",inbox me if you still want your account back i am available 247 for all hacking services hack coinbase hacking bitcoin bnb privacy,0.04698183387517929,0.9376706480979919,0.015347504988312721
2022-04-26,17:45,500 btc orders at 38k 👀 #btc,500 btc orders at 38k btc,0.07381083071231842,0.8896777629852295,0.03651144728064537
2022-04-26,17:45,International trade allows countries to expand markets for both goods and services that otherwise may not have been available. #NFTCommunity #nftart #NFTdrops #NFTartists #NFTGame @BoredApeYC @MeekMill @Coinbase_NFT @TheBinanceNFT #bitcoin,international trade allows countries to expand markets for both goods and services that otherwise may not have been available nftcommunity nftart nftdrops nftartists nftgame boredapeyc meekmill coinbasenft thebinancenft bitcoin,0.2992123067378998,0.693163275718689,0.007624413818120956
2022-04-26,17:45,"JUST IN: 23% of online businesses aim to accept #Bitcoin and  #crypto as a payment method by 2024, according to a survey b…",just 23 of online businesses aim to accept bitcoin and crypto as a payment method by 2024 according to a survey b,0.11462607979774475,0.8742315173149109,0.011142385192215443
2022-04-26,17:45,"This project has good dynamics of growth, I recommend the project as one of the most interesting in the market, chance of the better future. #aliceincrypto #NFT #aliceNFT #Airdrop #bountycampaign #bitcoin #defi #Crypto #BSCGem #BSCGemsAlert #web3",this project has good dynamics of growth i recommend the project as one of the most interesting in the market chance of the better future aliceincrypto nft alicenft airdrop bountycampaign bitcoin defi crypto bscgem bscgemsalert web3,0.4285253584384918,0.5643998980522156,0.007074766326695681
2022-04-26,17:45,@MatthewHyland_ exchanges that do this because both the whale and our hand both see the coins ... #btc 28.8K to 19K,matthewhyland exchanges that do this because both the whale and our hand both see the coins btc 288k to 19k,0.10178442299365997,0.8834285140037537,0.014787089079618454
2022-04-26,17:45,"@BTC_Archive Not only for #Bitcoin 

The world nedds to install the ATM of other cryptos.",btcarchive not only for bitcoin the world nedds to install the atm of other cryptos,0.11683039367198944,0.8753382563591003,0.00783134251832962
2022-04-26,17:45,"@Lw589000Murphey @jameslavish The first rule of #Bitcoin club.

1: Dont Change The Code

The second rule of #Bitcoin club, 

2: Tell everyone about it, relentlessly.",lw589000murphey jameslavish the first rule of bitcoin club dont change the code the second rule of bitcoin club tell everyone about it relentlessly,0.025462573394179344,0.913378119468689,0.06115926802158356
2022-04-26,17:45,@NASA @elonmusk Take #bitcoin with you on your way to space,nasa elonmusk take bitcoin with you on your way to space,0.058786604553461075,0.9280372858047485,0.013176101259887218
2022-04-26,17:45,@BTC_Archive This news not affecting for #bitcoin..its still bearish 😩😩😩,btcarchive this news not affecting for bitcoinits still bearish,0.047818150371313095,0.7085610032081604,0.243620827794075
2022-04-26,17:45,This coin will always conquering all #cryptocoin and thats #BTC,this coin will always conquering all cryptocoin and thats btc,0.0703204944729805,0.9135351777076721,0.01614435575902462
2022-04-26,17:45,"Do you remember the last time Bitcoin had 5 straight red weeks? 

 Bullish

#Bitcoin",do you remember the last time bitcoin had 5 straight red weeks bullish bitcoin,0.09533291310071945,0.7803942561149597,0.12427276372909546
2022-04-26,17:45,@CryptoHulk76 @StarlinkInu @cryptocom @kris @StarlinkInu #StarlinkInu #CRO #cryptocurrency #TheFirst #MATIC #BSCGems #BSC #Bitcoin #ETH #APE #Blockchain #Crypto #DeFi #CRORewards @darcydonavan @cronos_chain @MikeTyson @davidgokhshtein @mcuban @ParisHilton @scottmelker @crypto_birb @cryptocom @kris $ADA $BNB $Shib $BTC $CRO,cryptohulk76 starlinkinu cryptocom kris starlinkinu starlinkinu cro cryptocurrency thefirst matic bscgems bsc bitcoin eth ape blockchain crypto defi crorewards darcydonavan cronoschain miketyson davidgokhshtein mcuban parishilton scottmelker cryptobirb cryptocom kris ada bnb shib btc cro,0.049465980380773544,0.9292521476745605,0.021281857043504715
2022-04-26,17:45,Heyy #BTC 38k,heyy btc 38k,0.043942585587501526,0.919707715511322,0.036349762231111526
