Date,Time,Original tweet,Clean tweet,Positive,Neutral,Negative
2022-05-20,14:15,"#Altcoins showing strength
[Med-High time frame Targets]

1. $ANY #Anyswap =&gt; $21.10🔥
2. $SET #Tenset =&gt; $5.16🔥
3. $KCS #KuCoin =&gt; $25.37🔥
4. $XMR #Monero =&gt; $242.01🔥
5. $KLAY #Klaytn =&gt; $1.16🚀🔥

#CRYPTO #ALTS #Bitcoin",altcoins showing strength medhigh time frame targets 1 any anyswap gt 2110 2 set tenset gt 516 3 kcs kucoin gt 2537 4 xmr monero gt 24201 5 klay klaytn gt 116 crypto alts bitcoin,0.4966592788696289,0.485211044549942,0.01812971569597721
2022-05-20,14:15,"Bitcoin yesterday to now a little unexpected, trading volume did not continue to shrink, but increased by $200 million, the market trend, has continued the weak adjustment trend has not changed, the current 4 hours a bit of the bottom trend feeling #BTC",bitcoin yesterday to now a little unexpected trading volume did not continue to shrink but increased by 200 million the market trend has continued the weak adjustment trend has not changed the current 4 hours a bit of the bottom trend feeling btc,0.16990169882774353,0.3196231722831726,0.5104751586914062
2022-05-20,14:15,#Bitcoin Pizza Day merch delivers lightning-fast style https://t.co/zxF4jGhrEk via @coinjupiter,bitcoin pizza day merch delivers lightningfast style via coinjupiter,0.3132922053337097,0.6730960607528687,0.013611716218292713
2022-05-20,14:15,Our awesome artist has been knocking up some amazing silhouettes for the website - so good we almost wanna drop them in the collection!#Helios #Mining #Fintech #Insurtech #Crypto #Bitcoin,our awesome artist has been knocking up some amazing silhouettes for the website so good we almost wanna drop them in the collectionhelios mining fintech insurtech crypto bitcoin,0.046145159751176834,0.9059957265853882,0.04785911366343498
2022-05-20,14:15,Important Technical Signal Appears On #Bitcoin Daily Chart https://t.co/cGNMOPT3CD via @coinjupiter,important technical signal appears on bitcoin daily chart via coinjupiter,0.07697150856256485,0.9033020734786987,0.019726350903511047
2022-05-20,14:15,So when the market is range-bound and going nowhere. Are the market-makers on holiday or just too busy scratching their balls to do anything? How does that work exactly? @Tradersreality #Bitcoin #Crypto,so when the market is rangebound and going nowhere are the marketmakers on holiday or just too busy scratching their balls to do anything how does that work exactly tradersreality bitcoin crypto,0.029281163588166237,0.9284716844558716,0.04224715754389763
2022-05-20,14:15,"#BITCOIN #BTC impulse bar 29901.33 - 30109.6

$BTC Bar close 30074.5

#Crypto short term volatility detection",bitcoin btc impulse bar 2990133 301096 btc bar close 300745 crypto short term volatility detection,0.040284741669893265,0.9302827715873718,0.029432469978928566
2022-05-20,14:15,@Lagarde We dont want state money...we want free decentralized money! #Bitcoin !,lagarde we dont want state moneywe want free decentralized money bitcoin,0.05682917684316635,0.9267836809158325,0.016387153416872025
2022-05-20,14:15,"#WorkQuest $WQT $WUSD #WorkNet #WorkQuestApp #blockchian #crypto #cryptolife #BTC #BNB #ETH #digitalassets #saving #BinanceSmartChain
This is really very cool and strong project with great facilities.I hope this project will achieve more success.We will be happy to see",workquest wqt wusd worknet workquestapp blockchian crypto cryptolife btc bnb eth digitalassets saving binancesmartchain this is really very cool and strong project with great facilitiesi hope this project will achieve more successwe will be happy to see,0.8361461758613586,0.15530337393283844,0.008550405502319336
2022-05-20,14:15,"Traditionally looking at Hodl waves(UTXO age distribution), when there is a down swing with no noticeable sell off on chain, the sell off is short lived (2 months) then there is a large upswing in prices. Trust me I’ve lived through like 10 of these. #bitcoin",traditionally looking at hodl wavesutxo age distribution when there is a down swing with no noticeable sell off on chain the sell off is short lived 2 months then there is a large upswing in prices trust me ive lived through like 10 of these bitcoin,0.14387032389640808,0.7606257200241089,0.09550392627716064
2022-05-20,14:15,"Panic sellers sell the bargain.

Bargain buyers buy the panic.

#bitcoin #btfd #dca",panic sellers sell the bargain bargain buyers buy the panic bitcoin btfd dca,0.050640225410461426,0.9233623147010803,0.025997454300522804
2022-05-20,14:15,"@PawTipBot @PAW_digital #bitcoin,#bitcoincash, 

#paw, #paw cool

paw_33sed5i6pnbu19sg4arjzgjqip3kxndo7skgdd6oxbqgyef1cjd696h7e8yr",pawtipbot pawdigital bitcoinbitcoincash paw paw cool paw33sed5i6pnbu19sg4arjzgjqip3kxndo7skgdd6oxbqgyef1cjd696h7e8yr,0.08273480832576752,0.8773835301399231,0.03988157957792282
2022-05-20,14:15,@cometwtf @opensea @_NFTsPromoter @brizorolla @DjPrestigeUk @masluna17 @catalogNFT @ArtAngel_NFT @TheKCKantz please tag more people and retweet so we can all learn what people actually want from NFTs. #NFTCommunity #NFTGiveaway #BNB #Binance #Bitcoin,cometwtf opensea nftspromoter brizorolla djprestigeuk masluna17 catalognft artangelnft thekckantz please tag more people and retweet so we can all learn what people actually want from nfts nftcommunity nftgiveaway bnb binance bitcoin,0.08207174390554428,0.9055580496788025,0.01237024087458849
2022-05-20,14:15,"👋 A new block was found on the #Bitcoin network. We're at block height 737181, current #bitcoin price is $30097.83 and there are 195508747690011 #sats left to mine.",a new block was found on the bitcoin network we are at block height 737181 current bitcoin price is 3009783 and there are 195508747690011 sats left to mine,0.02386504039168358,0.9240196347236633,0.05211525410413742
2022-05-20,14:15,The current price of #BTC is $30148.2 in USD,the current price of btc is 301482 in usd,0.028788719326257706,0.9492765665054321,0.02193467877805233
2022-05-20,14:15,@kelly814_kelly @Mandrik People ask for what they want and when they get it they don’t want it! 😂 #Bitcoin #BuyTheDip #DCA #GetOnWithYourLife,kelly814kelly mandrik people ask for what they want and when they get it they don not want it bitcoin buythedip dca getonwithyourlife,0.037490859627723694,0.9356767535209656,0.026832416653633118
2022-05-20,14:15,"Inflation and velocity of money are vectors.

#Bitcoin",inflation and velocity of money are vectors bitcoin,0.019515082240104675,0.9033707976341248,0.07711410522460938
2022-05-20,14:15,"#Helios #Mining #Fintech #insurtech #Crypto #Bitcoin Visit now. you can see the good opportunity. if you join and invest here. you can get good profit. so,don't miss it.",helios mining fintech insurtech crypto bitcoin visit now you can see the good opportunity if you join and invest here you can get good profit sodon t miss it,0.33931973576545715,0.6510536074638367,0.009626638144254684
2022-05-20,14:15,@saylor ...Even outlined a situation where he felt that #Bitcoin would go over to the CFTC under a commodity. Not sure what the confusion is about?,saylor even outlined a situation where he felt that bitcoin would go over to the cftc under a commodity not sure what the confusion is about,0.03982708230614662,0.8905530571937561,0.06961988657712936
2022-05-20,14:15,"@HodlDee Whatever happens, #Bitcoin is the only one which can be owned, since nothing and no one can have access to it, once you own it. Ex.: If dollar breaks and you own dollars, your dollars are no longer. My opinion.",hodldee whatever happens bitcoin is the only one which can be owned since nothing and no one can have access to it once you own it if dollar breaks and you own dollars your dollars are no longer my opinion,0.02578136883676052,0.868488073348999,0.10573062300682068
2022-05-20,14:15,"@LunaTerraV $btc $bscs $shib $ldo $dfy $eth $trx $doge #Giveway #ETH #CoinMarketCap #BSC #NFT #ElonMusk #BTC
THIS IS AMAZING FAITHFUL AND EXCELLENT REWARD⚡

@CRIPTOCARENCY

@RubaiyaSultan_A

@RjMizanur736

@BinanceChain
 
 👇👇👇

0x16567477ad53Cac3519F7aCa362997c202f37aDC

Thank you 💕",lunaterrav btc bscs shib ldo dfy eth trx doge giveway eth coinmarketcap bsc nft elonmusk btc this is amazing faithful and excellent reward criptocarency rubaiyasultana rjmizanur736 binancechain 0x16567477ad53cac3519f7aca362997c202f37adc thank you,0.6626750826835632,0.3274115025997162,0.009913448244333267
2022-05-20,14:15,@saylor @GaryGensler @SECGov Why always after your tweet #BTC  Dump,saylor garygensler secgov why always after your tweet btc dump,0.02588139846920967,0.9288612008094788,0.04525734856724739
2022-05-20,14:15,"(1/4) 
Because of poor macroeconomics, $BTC fell sharply
 
The next probability will enter a deep bear market. It is hard to take profit from the spot

So Pump signal is temporarily stopped

#BTC #Ethereum #STEPN #Cryptos #Kwon",14 because of poor macroeconomics btc fell sharply the next probability will enter a deep bear market it is hard to take profit from the spot so pump signal is temporarily stopped btc ethereum stepn cryptos kwon,0.015067048370838165,0.09296607971191406,0.8919668197631836
2022-05-20,14:15,"@ViaBTC @coinexcom Dear @CoinEx_official, we recommend that you also list #Akita token to prevent Meme coin Shiba from being unipolar. Best memecoin for #ebay.
@cz_binance @binance  #Recommend #Justice #bitcoin #Ethereum #AKITA #crypto  #AKITAINU #akita_dao #akita_network #akita_avax #coinex",viabtc coinexcom dear coinexofficial we recommend that you also list akita token to prevent meme coin shiba from being unipolar best memecoin for ebay czbinance binance recommend justice bitcoin ethereum akita crypto akitainu akitadao akitanetwork akitaavax coinex,0.06093708425760269,0.9241628050804138,0.01490012463182211
2022-05-20,14:15,"@rektcapital #bitcoin is just 14 years old, it doesn't have that ""history"" to rely on.",rektcapital bitcoin is just 14 years old it does not have that history to rely on,0.028277823701500893,0.9321649074554443,0.039557259529829025
2022-05-20,14:15,"@HMaximillian @callembear @KinderInu $KINDER is already a great community and so much coming , great time to get on board and also earn stable #passiveincome 5% #USDT reflections also donating to charity as a utility 

@KinderInu #kinderinu 

#BSC #BSCGem #BSCGems #1000Xgems #1000xgem #NFT #BTC$luna",hmaximillian callembear kinderinu kinder is already a great community and so much coming great time to get on board and also earn stable passiveincome 5 usdt reflections also donating to charity as a utility kinderinu kinderinu bsc bscgem bscgems 1000xgems 1000xgem nft btc luna,0.6087989807128906,0.38249340653419495,0.00870753638446331
2022-05-20,14:15,"#Bitcoin Happy ""Pizza Day"", the twelfth anniversary of Laszlo Hanyecz's trade of 10,000 BTC for two large pizzas✨💥💥💥💥💥⚡️🔥🔥🔥🔥",bitcoin happy pizza day the twelfth anniversary of laszlo hanyecz trade of 10000 btc for two large pizzas,0.12449415028095245,0.8610126972198486,0.014493157155811787
2022-05-20,14:15,Stablegains allegedly invested investor funds in Anchor Protocol without informing them and lost roughly $42 million when #Terra #LUNA collapsed along with its #UST stablecoin. #BTC #Bitcoin,stablegains allegedly invested investor funds in anchor protocol without informing them and lost roughly 42 million when terra luna collapsed along with its ust stablecoin btc bitcoin,0.016584362834692,0.28963205218315125,0.6937835812568665
2022-05-20,14:15,"@funnygameworld I really love projects with smart team. Another of such project is Carbon Creatures NFT project. Their convept is unique and will foster the preservation of our planet.
#FGW #FunnyGameWorld #crypto #bitcoin #cryptocurrency #blockchain #bounty #binance #eth #token",funnygameworld i really love projects with smart team another of such project is carbon creatures nft project their convept is unique and will foster the preservation of our planet fgw funnygameworld crypto bitcoin cryptocurrency blockchain bounty binance eth token,0.1664692610502243,0.8251869678497314,0.008343834429979324
2022-05-20,14:15,🤝 Follow me on @betfury. Let's hunt for Bitcoins together! Get an exciting experience on #1 I-Gaming platform with #BTC staking payouts!💰.My Username: User7432446 #betfurysuccess #bitcoin #staking,follow me on betfury let us hunt for bitcoins together get an exciting experience on 1 igaming platform with btc staking payoutsmy user7432446 betfurysuccess bitcoin staking,0.1688467115163803,0.8223433494567871,0.008809894323348999
2022-05-20,14:15,🤝 Follow me on @betfury. Let's hunt for Bitcoins together! Get an exciting experience on #1 I-Gaming platform with #BTC staking payouts!💰.My Username: User27148  #betfurysuccess #bitcoin #staking,follow me on betfury let us hunt for bitcoins together get an exciting experience on 1 igaming platform with btc staking payoutsmy user27148 betfurysuccess bitcoin staking,0.1769278198480606,0.814471423625946,0.008600736036896706
2022-05-20,14:15,@kucoincom I bought gold for my friends wedding ceremony with $BTC #BTC➡️GOLD,kucoincom i bought gold for my friends wedding ceremony with btc btcgold,0.1613495647907257,0.8280380368232727,0.01061241328716278
2022-05-20,14:15,#bitcoin #cryptocurrency #money #rich #gambling #lottery #dollars #rich #becomingrich #winning #COVID19 #quarantine #lockdown Marlboro is the most popular cigarette brand in the United States. #tobacco #cigarette,bitcoin cryptocurrency money rich gambling lottery dollars rich becomingrich winning covid19 quarantine lockdown marlboro is the most popular cigarette brand in the united states tobacco cigarette,0.23028942942619324,0.7581390738487244,0.011571512557566166
2022-05-20,14:15,"If #btc is trading at 30k is because there are no narratives left to cling on besides bottom is in and weekend pump.

I patiently wait to fill my asks.",if btc is trading at 30k is because there are no narratives left to cling on besides bottom is in and weekend pump i patiently wait to fill my asks,0.04098810255527496,0.7793222665786743,0.17968964576721191
2022-05-20,14:15,"crypto portofolio will look like this for 2025 #Web3: @MarlinProtocol @ankr @COTInetwork @OasisProtocol @oceanprotocol @THORChain. As you know we are still early in this space, most of them have a marketcap between 50 and 100mil, that should give you a 100X minimun #BTC #Crypto",crypto portofolio will look like this for 2025 marlinprotocol ankr cotinetwork oasisprotocol oceanprotocol thorchain as you know we are still early in this space most of them have a marketcap between 50 and 100mil that should give you a 100x minimun btc crypto,0.11522862315177917,0.8755207657814026,0.009250578470528126
2022-05-20,14:15,"Goood Morningg Twitter!!
#btc #nfts #NFTCommunity",goood morningg twitter btc nfts nftcommunity,0.049754612147808075,0.9275326132774353,0.022712774574756622
2022-05-20,14:15,@saylor @GaryGensler @SECGov #Bitcoin and cryptos are THE CURRENCY OF THE MAFIA AND CRIMINALS to launder the money,saylor garygensler secgov bitcoin and cryptos are the currency of the mafia and criminals to launder the money,0.023010248318314552,0.8951795697212219,0.08181021362543106
2022-05-20,14:15,@OnBrinkCapital @vdramaliev @BobLoukas Yeah your right and I see where your going with it but it would be hard to recover the retail money only the true believers would stay put. But it would also mean maybe the opportunity to ethereum to surpass #BTC,onbrinkcapital vdramaliev bobloukas yeah your right and i see where your going with it but it would be hard to recover the retail money only the true believers would stay put but it would also mean maybe the opportunity to ethereum to surpass btc,0.32681459188461304,0.6552571058273315,0.017928319051861763
2022-05-20,14:15,"@GweneKit Satoshi spirit will soon shine on our faces...

#BTC #Satoshi #BTCs #Satoshi Nakamoto
#ETH #Elon Musk.",gwenekit satoshi spirit will soon shine on our faces btc satoshi btcs satoshi nakamoto eth elon musk,0.1073993667960167,0.879777193069458,0.012823456898331642
2022-05-20,14:15,"Was about 5 when I asked Mom who/what stopped the police from using their lights when running late. 

Answer was brief/vague. My mind, even more inquisitive.

""Quis custodiet ipsos custodes?""
""Who will guard the guards themselves?""

The State is unchecked &amp; hates you.
#Bitcoin",was about 5 when i asked mom whowhat stopped the police from using their lights when running late answer was briefvague my mind even more inquisitive quis custodiet ipsos custodes who will guard the guards themselves the state is unchecked hates you bitcoin,0.07256325334310532,0.838672935962677,0.08876385539770126
2022-05-20,14:15,Good coins always rise if you give them enough support and time. Good communities are primed 💹 #Crypto #Binance #BNB #BTC,good coins always rise if you give them enough support and time good communities are primed crypto binance bnb btc,0.2132185995578766,0.7762914299964905,0.010490032844245434
2022-05-20,14:15,@SECGov Please stop protecting the large financial institutions. Approve a #Bitcoin ETF and allow Americans the same opportunity that many other countries have afforded their citizens!,secgov please stop protecting the large financial institutions approve a bitcoin etf and allow americans the same opportunity that many other countries have afforded their citizens,0.20404084026813507,0.7723835110664368,0.023575637489557266
2022-05-20,14:15,"Funnygameworld is the platform you have been waiting for all your life where you can earn simply by playing a game,game is available on playstore,have fun easy winning.
#FGW #FunnyGameWorld #crypto #bitcoin #cryptocurrency #blockchain #bounty #binance #eth #token #coinsbit",funnygameworld is the platform you have been waiting for all your life where you can earn simply by playing a gamegame is available on playstorehave fun easy winning fgw funnygameworld crypto bitcoin cryptocurrency blockchain bounty binance eth token coinsbit,0.06577396392822266,0.9192802906036377,0.01494581624865532
2022-05-20,14:15,"Investors having a ""Target"" for $BTC dont understanding what Bitcoin is or better what #bitcoin will be in the future. Bitcoin will surpass $. You cant get a ""Target"" in Fiat for Bitcoin. The #Inflation will pump it just forever. There is no limit.",investors having a target for btc dont understanding what bitcoin is or better what bitcoin will be in the future bitcoin will surpass you cant get a target in fiat for bitcoin the inflation will pump it just forever there is no limit,0.04241073131561279,0.8985791206359863,0.059010110795497894
2022-05-20,14:15,@Mandrik It’s in the bear market where the real personal wealth is created! #bitcoin,mandrik its in the bear market where the real personal wealth is created bitcoin,0.023627476766705513,0.9116474390029907,0.06472501158714294
2022-05-20,14:15,Current #Bitcoin Price is $30173 #BTC #Crypto,current bitcoin price is 30173 btc crypto,0.021911529824137688,0.9514427185058594,0.02664569392800331
2022-05-20,14:15,Stay tuned for this weekend! We going to have #BitcoinPizzaDay by @coinhako 🍕😋 with my wife and fellow $AMP buddy's @dcresencia 🥳 #BTC,stay tuned for this weekend we going to have bitcoinpizzaday by coinhako with my wife and fellow amp buddy dcresencia btc,0.10155162215232849,0.8851140141487122,0.013334349729120731
2022-05-20,14:15,"So did you join the funnygameworld presale or did you miss the Airdrop or did you miss the ongoing bounty,no worries you can still play the game on playstore and earn

#FGW #FunnyGameWorld #crypto #bitcoin #cryptocurrency #blockchain #bounty #binance #eth #token #coinsbit",so did you join the funnygameworld presale or did you miss the airdrop or did you miss the ongoing bountyno worries you can still play the game on playstore and earn fgw funnygameworld crypto bitcoin cryptocurrency blockchain bounty binance eth token coinsbit,0.03788398951292038,0.9261483550071716,0.0359676331281662
2022-05-20,14:15,Anyone feel like the attendees of #Bitcoin gathering in #ElSalvador with @nayibbukele may be buying $BTC now for their central banks? I would keep quiet too atm knowing if announcement comes out they’re buying price go boom,anyone feel like the attendees of bitcoin gathering in elsalvador with nayibbukele may be buying btc now for their central banks i would keep quiet too atm knowing if announcement comes out theyre buying price go boom,0.04220246896147728,0.899080753326416,0.05871669948101044
2022-05-20,14:15,"Dump in coming😅

#Bitcoin",dump in coming bitcoin,0.032929759472608566,0.6335856318473816,0.33348459005355835
2022-05-20,14:15,"@funnygameworld This is a wonderful project with an amazing project team .they are very hard working and making this project outstanding.
#FGW #FunnyGameWorld #crypto #bitcoin #cryptocurrency #blockchain #bounty #binance #eth #token #coinsbit",funnygameworld this is a wonderful project with an amazing project team they are very hard working and making this project outstanding fgw funnygameworld crypto bitcoin cryptocurrency blockchain bounty binance eth token coinsbit,0.23672978579998016,0.7544862031936646,0.008783968165516853
2022-05-20,14:15,"@BCBabely Thank you for your sats and generosity! You're helping prove that #bitcoin is for everyone, everywhere. 🧡",bcbabely thank you for your sats and generosity you are helping prove that bitcoin is for everyone everywhere,0.842626690864563,0.14807459712028503,0.009298783726990223
2022-05-20,14:15,"@CaesarNFTx Join here cause so easy. Follow only ya guys🙏🏻 @Oktafiansah75 @Luckyoshi_
@AurellJs @adiwinwangi
@0xkaycityx @realkwonxx89
@azka_nando22 @poetrakancil73 @Bigwin1_cityx
Gutlak bestie🤲♥️
#BTC #APE #Avax #AvalancheHouse #NFTGiveaway #EGLD",caesarnftx join here cause so easy follow only ya guys oktafiansah75 luckyoshi aurelljs adiwinwangi 0xkaycityx realkwonxx89 azkanando22 poetrakancil73 bigwin1cityx gutlak bestie btc ape avax avalanchehouse nftgiveaway egld,0.10298032313585281,0.880405068397522,0.016614628955721855
2022-05-20,14:15,@KryptCarl @cctip_com @coinkit_ @lk_finance #BTC to the Moon 🚀,kryptcarl cctipcom coinkit lkfinance btc to the moon,0.08465982973575592,0.9025828838348389,0.012757271528244019
2022-05-20,14:15,"@coinbureau Yes, it is a threat. Pow is the best way to secure the blockchain. It is a MASSIVE disappointment that they are moving away from that model. CENTRAL BANKERS will control ETH if they do not already. Then everyone can kiss their yield bye bye #BTC",coinbureau yes it is a threat pow is the best way to secure the blockchain it is a massive disappointment that they are moving away from that model central bankers will control eth if they do not already then everyone can kiss their yield bye bye btc,0.02999798208475113,0.3350362479686737,0.634965717792511
2022-05-20,14:15,"@earnwithrk All should spend 💯 hrs learning true power of #btc for themselves, DYOR",earnwithrk all should spend hrs learning true power of btc for themselves dyor,0.15217363834381104,0.8358271718025208,0.011999224312603474
2022-05-20,14:15,"This project stands out from others for its realism and excellent qualities of the team, which is focused on achieving real results.I am confident in the success of this project. #FGW #FunnyGameWorld #crypto #bitcoin #cryptocurrency #blockchain #bounty #binance  #token #coinsbit",this project stands out from others for its realism and excellent qualities of the team which is focused on achieving real resultsi am confident in the success of this project fgw funnygameworld crypto bitcoin cryptocurrency blockchain bounty binance token coinsbit,0.7107460498809814,0.28128334879875183,0.007970532402396202
2022-05-20,14:15,"We will have to endure a long period of high inflation, 10 years plus......opt out and buy #Bitcoin to preserve your purchasing power or else you will have your savings melted away..",we will have to endure a long period of high inflation 10 years plusopt out and buy bitcoin to preserve your purchasing power or else you will have your savings melted away,0.03136925399303436,0.38772135972976685,0.5809093713760376
2022-05-20,14:15,"@elonmusk Now, let's make #Bitcoin legal tender in Brazil and the future will be bright.",elonmusk now let us make bitcoin legal tender in brazil and the future will be bright,0.1380404382944107,0.8534508943557739,0.008508688770234585
2022-05-20,14:15,"One thing about crypto don't undermine any coin and stay away from scam,buy funnygameworld now that it cheap and don't leave in regret in future .
#FGW #FunnyGameWorld #crypto #bitcoin #cryptocurrency #blockchain #bounty #binance #eth #token #coinsbit
@funnygameworld",one thing about crypto do not undermine any coin and stay away from scambuy funnygameworld now that it cheap and do not leave in regret in future fgw funnygameworld crypto bitcoin cryptocurrency blockchain bounty binance eth token coinsbit funnygameworld,0.03134907782077789,0.9284997582435608,0.04015122726559639
2022-05-20,14:15,"@banklessfreedom Please Follow @banklessfreedom 
Community #Bitcoin #banklessfreedom

@cctip_com draw 200000 WAIFER 100",banklessfreedom please follow banklessfreedom community bitcoin banklessfreedom cctipcom draw 200000 waifer 100,0.028436537832021713,0.9477054476737976,0.02385799027979374
2022-05-20,14:15,#BTC Oversold bounce coming.,btc oversold bounce coming,0.03964512422680855,0.05762924998998642,0.9027255773544312
2022-05-20,14:15,@wallstreetbets #bitcoin only. For those who know the truth.,wallstreetbets bitcoin only for those who know the truth,0.03162207081913948,0.9485737681388855,0.0198040921241045
2022-05-20,14:15,I'm am more sure with each passing day that the people who don't believe in the value of #Bitcoin simply don't understand anything about it.,i am am more sure with each passing day that the people who do not believe in the value of bitcoin simply do not understand anything about it,0.03073708899319172,0.5360798239707947,0.43318310379981995
