Date,Time,Original tweet,Clean tweet,Positive,Neutral,Negative
2022-05-18,9:45,"Luna classic is for the community!
#lunacoin #terraluna #UST #LUNA #Crypto #Binance #BabyDoge #KISHU #SHINJA #shibainu #doge #elon #Tesla #Coinbase #cryptocurrency #PITBULL #eth #bitcoin",luna classic is for the community lunacoin terraluna ust luna crypto binance babydoge kishu shinja shibainu doge elon tesla coinbase cryptocurrency pitbull eth bitcoin,0.041389547288417816,0.9390626549720764,0.019547859206795692
2022-05-18,9:45,@apollo_river #paw $paw #Cryptocrash  #Bitcoin  is good very much😎😎,apolloriver paw paw cryptocrash bitcoin is good very much,0.7392497658729553,0.2516559064388275,0.009094292297959328
2022-05-18,9:45,"Waiting for that one last short sqeeze before I enter again

#Bitcoin",waiting for that one last short sqeeze before i enter again bitcoin,0.03793999180197716,0.9347213506698608,0.027338622137904167
2022-05-18,9:45,"@maxkeiser Thank you @maxkeiser for bringing attention to #BitcoinCash #BCH 

Everyone knows it’s a threat to the current financial system more than #BTC

#Bitcoin split into two in 2017 

#BTC crippled at 1MB ❌
#BCH increases capacity to scale as needed ✅",maxkeiser thank you maxkeiser for bringing attention to bitcoincash bch everyone knows its a threat to the current financial system more than btc bitcoin split into two in 2017 btc crippled at 1mb bch increases capacity to scale as needed,0.9061343669891357,0.07934562861919403,0.014520024880766869
2022-05-18,9:45,"@finterestICP #Bitcoin always recover if you wait long enough, If there is any coin not to ever underrate then is BTC because the pump will always happen

If you aren’t following @Acflexi  you should be. There aren’t many who have a better understanding of value investing, great tweets &amp; tips",finteresticp bitcoin always recover if you wait long enough if there is any coin not to ever underrate then is btc because the pump will always happen if you aren not following acflexi you should be there aren not many who have a better understanding of value investing great tweets tips,0.06690310686826706,0.9045261144638062,0.028570808470249176
2022-05-18,9:45,The future of payments is the #Bitcoin⚡️network.,the future of payments is the bitcoinnetwork,0.03544009476900101,0.9399480819702148,0.024611864238977432
2022-05-18,9:45,Hmm...what about these low btc buy/sell volumes since May 13th? 🤔 #Bitcoin #inflation,hmmwhat about these low btc buysell volumes since may 13th bitcoin inflation,0.03497125580906868,0.25083374977111816,0.7141950726509094
2022-05-18,9:45,"@HisseyIris @VitalikButerin He's built an orgy of swaps, wraps, burns, mints, and stakes run by centralized dapps that do nothing but optimize token interactions to keep the orgy going-- which is branded as web3. He's getting older and wiser, seeing before you clowns that ultimately, it will be #Bitcoin .",hisseyiris vitalikbuterin he is built an orgy of swaps wraps burns mints and stakes run by centralized dapps that do nothing but optimize token interactions to keep the orgy going which is branded as web3 he is getting older and wiser seeing before you clowns that ultimately it will be bitcoin,0.05487358942627907,0.9253869652748108,0.01973942667245865
2022-05-18,9:45,The problem isn’t #Bitcoin.The problem isn’t #Dogecoin.The problem isn’t #Ethereum.The problem isn’t #Shiba Inu.…,the problem isn not bitcointhe problem isn not dogecointhe problem isn not ethereumthe problem isn not shiba inu,0.023636391386389732,0.8956791162490845,0.08068452775478363
2022-05-18,9:45,"@jessimckenzi Oh wow, imaging doing good things ""Without getting permits or telling anyone."" 

It almost feels like... Freedom and human progress.
#bitcoin #btc",jessimckenzi oh wow imaging doing good things without getting permits or telling anyone it almost feels like freedom and human progress bitcoin btc,0.1572132408618927,0.8321996331214905,0.010587099008262157
2022-05-18,9:45,"This project has a very bright future because I really think this project is too perfect to be true. This is a very cool and innovative project.
#TaleteCode #Staking  #deflyield #defi #BSC #defiproject #HighesFixedAPY #titano  #Bitcoin #cryptotrading",this project has a very bright future because i really think this project is too perfect to be true this is a very cool and innovative project taletecode staking deflyield defi bsc defiproject highesfixedapy titano bitcoin cryptotrading,0.4098980724811554,0.5812530517578125,0.008848852477967739
2022-05-18,9:45,"This is huge. 

 ChainDingus launched today with $300 USD in seed funding from @SamA. 

 It's the first the first and only murse for furries. 

 Watch this space. #Crypto #Web3 #Preseed #VC #BTC #ETH",this is huge chaindingus launched today with 300 usd in seed funding from sama it is the first the first and only murse for furries watch this space crypto web3 preseed vc btc eth,0.145485058426857,0.8460084795951843,0.00850644987076521
2022-05-18,9:45,"Luna is set to become the biggest meme coin in history!

#terraluna #UST #LUNA #Crypto #Binance #BabyDoge #KISHU #SHINJA #shibainu #doge #elon #Tesla #Coinbase #cryptocurrency #PITBULL #eth #bitcoin",luna is set to become the biggest meme coin in history terraluna ust luna crypto binance babydoge kishu shinja shibainu doge elon tesla coinbase cryptocurrency pitbull eth bitcoin,0.20414410531520844,0.7839852571487427,0.011870607733726501
2022-05-18,9:45,"@pushpendrakum #Bitcoin always recover if you wait long enough, If there is any coin not to ever underrate then is BTC because the pump will always happen

If you aren’t following @Acflexi  you should be. There aren’t many who have a better understanding of value investing, great tweets &amp; tips",pushpendrakum bitcoin always recover if you wait long enough if there is any coin not to ever underrate then is btc because the pump will always happen if you aren not following acflexi you should be there aren not many who have a better understanding of value investing great tweets tips,0.06771198660135269,0.9044197201728821,0.027868304401636124
2022-05-18,9:45,@davidgokhshtein Retail investors will run to buy #Bitcoin when it will cross 60000 😂🤣😅,davidgokhshtein retail investors will run to buy bitcoin when it will cross 60000,0.13193145394325256,0.8536645174026489,0.014404002577066422
2022-05-18,9:45,99% of people talking about #Bitcoin in context of #inflation never experienced hyper-inflation and have no clue how wrong they are.,99 of people talking about bitcoin in context of inflation never experienced hyperinflation and have no clue how wrong they are,0.04081723839044571,0.5611572861671448,0.3980255424976349
2022-05-18,9:45,"@Crypto_ono @BTCSecure @stablekwon @terra_money @TheModAcademy_ Give your project a lead as skilled community management is important to any project.
And @TheModAcademy_  does this in the best possible way. Your community growth is priority.

#BTC #Ethereum #altcoin #community #Shillers #Moderators #Hypers #blockchain #Solana #NFTProject #TMA",cryptoono btcsecure stablekwon terramoney themodacademy give your project a lead as skilled community management is important to any project and themodacademy does this in the best possible way your community growth is priority btc ethereum altcoin community shillers moderators hypers blockchain solana nftproject tma,0.15249431133270264,0.8385456204414368,0.008960074745118618
2022-05-18,9:45,#Bitcoin talks and bullshit takes the bus.,bitcoin talks and bullshit takes the bus,0.04123319312930107,0.9373264908790588,0.021440286189317703
2022-05-18,9:45,"@CoinDesk @ArgoBlockchain @JamieCrawleyCD #Bitcoin always recover if you wait long enough, If there is any coin not to ever underrate then is BTC because the pump will always happen

If you aren’t following @Acflexi  you should be. There aren’t many who have a better understanding of value investing, great tweets &amp; tips",coindesk argoblockchain jamiecrawleycd bitcoin always recover if you wait long enough if there is any coin not to ever underrate then is btc because the pump will always happen if you aren not following acflexi you should be there aren not many who have a better understanding of value investing great tweets tips,0.06068079546093941,0.912588357925415,0.026730839163064957
2022-05-18,9:45,"These fucking guys…

“China has returned as the second-largest #Bitcoin mining hub, with 21%+ of the total global $BTC mining hash rate.”

Oh, the games they play…
BAN/UNBAN…
Manipulative mother fvckers 🙄

#AltSeason soon? 👀

#CryptoNews",these fucking guys china has returned as the secondlargest bitcoin mining hub with 21 of the total global btc mining hash rate oh the games they play banunban manipulative mother fvckers altseason soon cryptonews,0.29347139596939087,0.691303014755249,0.015225627459585667
2022-05-18,9:45,"#kishimotoinu  is on fire 

Lets kill a few Zeros together because we are the fastest growing crypto community in the world. 

#Teamkishimoto #kishimoto #Kishi #Moto #Kishimoto50k #Kishimoto100k #saitama #ETH #BTC #dogecoin  #shibainu  #FLOKI  #ToTheMoon #kishimotoA5",kishimotoinu is on fire lets kill a few zeros together because we are the fastest growing crypto community in the world teamkishimoto kishimoto kishi moto kishimoto50k kishimoto100k saitama eth btc dogecoin shibainu floki tothemoon kishimotoa5,0.2619999051094055,0.7273874282836914,0.01061264332383871
2022-05-18,9:45,@KairosCrypto_ No doubt! I cannot see any generation except the oldest buying gold anymore. It has a poor use case compared to #Bitcoin !,kairoscrypto no doubt i cannot see any generation except the oldest buying gold anymore it has a poor use case compared to bitcoin,0.02836235798895359,0.16948969662189484,0.8021479845046997
2022-05-18,9:45,"@cz_binance The CFTC says #Bitcoin is a commodity and should be under its control. Thousands of other cryptos must be regulated by the SEC as they are securities. This is how crypto is made, decentralized crypto becomes a dream thanks to you...",czbinance the cftc says bitcoin is a commodity and should be under its control thousands of other cryptos must be regulated by the sec as they are securities this is how crypto is made decentralized crypto becomes a dream thanks to you,0.07482341676950455,0.9113494157791138,0.013827133923768997
2022-05-18,9:45,"No, you can’t just pull the cord out of the wall to stop #bitcoin",no you can not just pull the cord out of the wall to stop bitcoin,0.03590582311153412,0.9097551107406616,0.054339125752449036
2022-05-18,9:45,"Luna investors are holding more BTC than before the crash!  

#terraluna #UST #LUNA #Crypto #Binance #BabyDoge #KISHU #SHINJA #shibainu #doge #elon #Tesla #Coinbase #cryptocurrency #PITBULL #eth #bitcoin #$LUNA",luna investors are holding more btc than before the crash terraluna ust luna crypto binance babydoge kishu shinja shibainu doge elon tesla coinbase cryptocurrency pitbull eth bitcoin luna,0.05105156823992729,0.9306352138519287,0.018313229084014893
2022-05-18,9:45,"@whale_alert These are the best times to make huge income in @dexioprotocol with #dexihunter hunting BTC, eth, BNB, trx, QRcodes, NFT and so much more

#BTC #bsc #MoveToEarn #PlayToEarn #gaming #LearnToEarn #augumentedreality",whalealert these are the best times to make huge income in dexioprotocol with dexihunter hunting btc eth bnb trx qrcodes nft and so much more btc bsc movetoearn playtoearn gaming learntoearn augumentedreality,0.5020310878753662,0.4883342683315277,0.009634658694267273
2022-05-18,9:45,"Looks like the #BTC decoupling is happening but in the wrong way, equities pumping and crypto staying the same

Does not bode well for when equities has the next leg down 📉",looks like the btc decoupling is happening but in the wrong way equities pumping and crypto staying the same does not bode well for when equities has the next leg down,0.03616413474082947,0.6386194229125977,0.3252164423465729
2022-05-18,9:45,"The Lightning Network (LN) just got a bit faster, as the suitably named Bolt Card now enables Bitcoin (BTC) enthusiasts to pay for goods and services using contactless technology. 

#bitcoin",the lightning network ln just got a bit faster as the suitably named bolt card now enables bitcoin btc enthusiasts to pay for goods and services using contactless technology bitcoin,0.32007136940956116,0.6690465211868286,0.010882074013352394
2022-05-18,9:45,@AndrewScheer Nobody can reduce the value of a dollar better than the government… #bitcoin,andrewscheer nobody can reduce the value of a dollar better than the government bitcoin,0.09752094000577927,0.28800296783447266,0.6144761443138123
2022-05-18,9:45,"BITCOIN WENT UP!

USD $29,846.81 (+0,34%)
Yesterday: +0,02%
Last 30 days: -24,78%

#bitcoin",bitcoin went up usd 2984681 034 002 last 30 2478 bitcoin,0.9195654392242432,0.060919877141714096,0.019514644518494606
2022-05-18,9:45,spend #cryptocurrency #litecoin #bitcoin #eth on @jobboycom,spend cryptocurrency litecoin bitcoin eth on jobboycom,0.07527776062488556,0.8924344182014465,0.0322878360748291
2022-05-18,9:45,"Current #Bitcoin price is $29,853.84",current bitcoin price is 2985384,0.0210233423858881,0.9402127265930176,0.03876388072967529
2022-05-18,9:45,"@AmethystNFT @MarilynMonroe @Fendi @MIUMIUofficial @AUROBOROS_LTD @tribute_brand @ThomBrowne @DAVIDKOMALONDON @LANVINofficial @BALENCIAGA This is Very strong expensive and huge project 
@OfficialSabbir1
@ICC 
@1solProtocol 

#cryptocurrency #Usdt #bitcoin #dollar",amethystnft marilynmonroe fendi miumiuofficial auroborosltd tributebrand thombrowne davidkomalondon lanvinofficial balenciaga this is very strong expensive and huge project officialsabbir1 icc 1solprotocol cryptocurrency usdt bitcoin dollar,0.2881874740123749,0.6993615031242371,0.01245094370096922
2022-05-18,9:45,"@BTC_Archive The CFTC says #Bitcoin is a commodity and should be under its control. Thousands of other cryptos must be regulated by the SEC as they are securities. This is how crypto is made, decentralized crypto becomes a dream thanks to you...",btcarchive the cftc says bitcoin is a commodity and should be under its control thousands of other cryptos must be regulated by the sec as they are securities this is how crypto is made decentralized crypto becomes a dream thanks to you,0.07130800187587738,0.9146120548248291,0.014079884625971317
2022-05-18,9:45,"@apollo_river absolutely $PAW till infinity and beyond. Unstoppable 🚀🚀

#cryptocurrency #Paw #Bitcoin",apolloriver absolutely paw till infinity and beyond unstoppable cryptocurrency paw bitcoin,0.06742893904447556,0.9143578410148621,0.018213236704468727
2022-05-18,9:45,@mishalederman @klever_io 🔥🧠 only a matter of time before🥇 #BeKlever #Klever #KLV $KLV #Crypto #blockchain #Bitcoin,mishalederman kleverio only a matter of time before beklever klever klv klv crypto blockchain bitcoin,0.029206853359937668,0.9464090466499329,0.02438410557806492
2022-05-18,9:45,@WhaleEverything #BTC until the end mate! 🙏🙏,whaleeverything btc until the end mate,0.052188318222761154,0.9285566806793213,0.019254961982369423
2022-05-18,9:45,"#Bitcoin 📈 

▓▓▓▓▓░░░░░░░░░░ 30%

price:$29830.56      eth/btc: 0.07",bitcoin 30 007,0.02832275815308094,0.9284541010856628,0.043223101645708084
2022-05-18,9:45,"@CelebrityGigMag @gaiuschibueze can donate 1 #bitcoin for us 😏😏, open the floor chief.",celebritygigmag gaiuschibueze can donate 1 bitcoin for us open the floor chief,0.11114902794361115,0.8796427845954895,0.009208225645124912
2022-05-18,9:45,#BTC is now at $29830.56,btc is now at 2983056,0.02963363751769066,0.9298929572105408,0.040473394095897675
2022-05-18,9:45,"@BTC_Archive Inflation or not, #Bitcoin will always be a good buy.

Prepare ahead for what the bearish market might look like which is the reason everyone should check out $TORN which they can stake in $ppTORN vault to generate more income for them.",btcarchive inflation or not bitcoin will always be a good buy prepare ahead for what the bearish market might look like which is the reason everyone should check out torn which they can stake in pptorn vault to generate more income for them,0.18600276112556458,0.8033173084259033,0.010679970495402813
2022-05-18,9:45,"On #NewsInChina, we cover: In a week, #Taiwan reported over 400,000 #COVID19 cases; Shehbaz Sharif @CMShehbaz’s government intends to dismantle the China-Pakistan Economic Corridor Authority; #Bitcoin declared as a virtual asset to be protected by #Chinese law; (1/2)",on newsinchina we in a week taiwan reported over 400000 covid19 cases shehbaz sharif cmshehbazs government intends to dismantle the chinapakistan economic corridor authority bitcoin declared as a virtual asset to be protected by chinese law 12,0.0840950682759285,0.8841567039489746,0.031748224049806595
2022-05-18,9:45,Big coin pump is coming soon. The information will be available soon. Coin will be announced on telegram. Link in description. #cryptopump #btc #coinpump #USDT #BNBcoins #Eth #BNBarmy,big coin pump is coming soon the information will be available soon coin will be announced on telegram link in description cryptopump btc coinpump usdt bnbcoins eth bnbarmy,0.04428667575120926,0.9421259164810181,0.01358741894364357
2022-05-18,9:45,Create automated tasks with @jobboycom API Deposit withdraw with #crypto #bitcoin,create automated tasks with jobboycom api deposit withdraw with crypto bitcoin,0.04047772288322449,0.9392165541648865,0.020305754616856575
2022-05-18,9:45,"BTC WILL REACH 100k ! 

#terraluna #UST #LUNA #Crypto #Binance #BabyDoge #KISHU #SHINJA #shibainu #doge #elon #Tesla #Coinbase #cryptocurrency #PITBULL #eth #bitcoin",btc will reach 100k terraluna ust luna crypto binance babydoge kishu shinja shibainu doge elon tesla coinbase cryptocurrency pitbull eth bitcoin,0.2599903643131256,0.7304254770278931,0.009584108367562294
2022-05-18,9:45,@WhiteBit #BTC to the moon 🔥,whitebit btc to the moon,0.08984166383743286,0.8957931399345398,0.014365257695317268
2022-05-18,9:45,Starting to really see the value of #Bitcoin especially after watching that YT video on the big cycle. I just have to figure out now when’s the best time to start stacking sats.,starting to really see the value of bitcoin especially after watching that yt video on the big cycle i just have to figure out now whens the best time to start stacking sats,0.10850613564252853,0.8720249533653259,0.019468866288661957
2022-05-18,9:45,Current #Bitcoin Price is $29863 #BTC #Crypto,current bitcoin price is 29863 btc crypto,0.021052297204732895,0.9503246545791626,0.028623022139072418
2022-05-18,9:45,"You can print $LUNA

You can't print #Bitcoin",you can print luna you cannot print bitcoin,0.01915406808257103,0.9341290593147278,0.046716850250959396
2022-05-18,9:45,"@WhaleChart Rusian's economic scientist 
#BTC
#Crypto",whalechart rusian economic scientist btc crypto,0.04432293772697449,0.9224345684051514,0.03324250504374504
2022-05-18,9:45,@cryptojunk1 @decodejar Why do you assume that I’m a moonboy? I carefully researched Cardano and held loads of it prior to choosing #eGLD as my second investment after #BTC,cryptojunk1 decodejar why do you assume that im a moonboy i carefully researched cardano and held loads of it prior to choosing egld as my second investment after btc,0.05393117293715477,0.9274295568466187,0.01863921619951725
2022-05-18,9:45,"📣 Curated Coin Metrics every day 📣

#BTC  |  29844 USD  |  -2.4% 

Mrkt Dominance:  44.2% 

Txn Vol:  21.138B

Active Addresses:  1.029M

TVL:  174.4M",curated coin metrics every day btc 29844 usd 24 mrkt 442 txn 21138b active 1029m 1744m,0.055108692497015,0.9238167405128479,0.021074561402201653
2022-05-18,9:45,"Wats up with ETH ? Is it still a good investment! 

#terraluna #UST #LUNA #Crypto #Binance #BabyDoge #KISHU #SHINJA #shibainu #doge #elon #Tesla #Coinbase #cryptocurrency #PITBULL #eth #bitcoin",wats up with eth is it still a good investment terraluna ust luna crypto binance babydoge kishu shinja shibainu doge elon tesla coinbase cryptocurrency pitbull eth bitcoin,0.2062467485666275,0.782378613948822,0.011374609544873238
2022-05-18,9:45,"Top 10 Cyptocurrencies in the World by Twitter Followers (18/MAY/2022) 🔥

1. #BNB Binance 8.84M
2. #Bitcoin 5.25M
3. #Dogecoin 3.37M
4. #SHIB 3.34M
5. #Ethereum 2.52M
6. #XRP 2.51M
7. #CRO 2.13M
8. #Solana 1.76M 
9. #BabyDoge 1.396M
10. #SafeMoon 1.391M",top 10 cyptocurrencies in the world by twitter followers 18may2022 1 bnb binance 884m 2 bitcoin 525m 3 dogecoin 337m 4 shib 334m 5 ethereum 252m 6 xrp 251m 7 cro 213m 8 solana 176m 9 babydoge 1396m 10 safemoon 1391m,0.09211171418428421,0.8872336745262146,0.020654596388339996
2022-05-18,9:45,"Bitcoin shakes of Fed volatility as analysts remain split on return under $24K

#bitcoin #crypto",bitcoin shakes of fed volatility as analysts remain split on return under 24k bitcoin crypto,0.08999110758304596,0.18746528029441833,0.7225436568260193
2022-05-18,9:45,@Axel_bitblaze69 @cz_binance How are they gonna burn 🔥 $LUNA with literally 0 funds? They sold almost all of their #Bitcoin,axelbitblaze69 czbinance how are they gonna burn luna with literally 0 funds they sold almost all of their bitcoin,0.049995969980955124,0.9220990538597107,0.027905011549592018
2022-05-18,9:45,There’s no better way to amass wealth than through #Bitcoin  and #crypto.,theres no better way to amass wealth than through bitcoin and crypto,0.05213635414838791,0.9278593063354492,0.020004380494356155
2022-05-18,9:45,"@Bscgemalerts I've never been this bullish on #CENTRIC 🔥🔥

Timing is EVERYTHING.

Seems like all of the stars are aligning right before the entire market hits new ATHs. WHERES MY #CENTRICWARRIORS? $CNS $CNR #BNB #BTC #ETH #CentricStrong",bscgemalerts i have never been this bullish on centric timing is everything seems like all of the stars are aligning right before the entire market hits new aths wheres my centricwarriors cns cnr bnb btc eth centricstrong,0.1036701425909996,0.8791120052337646,0.0172178503125906
2022-05-18,9:45,"Wanna paint some #NFTs, what do you think?
#btc",wanna paint some nfts what do you think btc,0.0393889881670475,0.9338603615760803,0.02675059624016285
2022-05-18,9:45,"Good Morning #cryptotwitter 
Is your #Bitcoin getting ready for summer
&amp; switching from Fruit Loops to actual fruit...😎",good morning cryptotwitter is your bitcoin getting ready for summer switching from fruit loops to actual fruit,0.08086264878511429,0.9009723663330078,0.018164927139878273
2022-05-18,9:45,"🟩 Block 736897 ⛏ ⛏

📅 18th May 2022, 09:37:50 GMT

📣 85 tx with a value of 317.297 ₿ ($9.47m 🇺🇸)

📣 distributed to 580 recipients 💎🙌

📣 19,043,112.50 ₿ (90.68149%) mined ⛏

📣 1,956,887.50 ₿ remaining 💰

#bitcoin #tictoknextblock",block 736897 18th may 2022 gmt 85 tx with a value of 317297 947m distributed to 580 recipients 1904311250 9068149 mined 195688750 remaining bitcoin tictoknextblock,0.04837412387132645,0.9252409338951111,0.026384998112916946
2022-05-18,9:45,"@GhostOfNakadai #Bitcoin always recover if you wait long enough, If there is any coin not to ever underrate then is BTC because the pump will always happen

If you aren’t following @Acflexi  you should be. There aren’t many who have a better understanding of value investing, great tweets &amp; tips",ghostofnakadai bitcoin always recover if you wait long enough if there is any coin not to ever underrate then is btc because the pump will always happen if you aren not following acflexi you should be there aren not many who have a better understanding of value investing great tweets tips,0.06254324316978455,0.9070000052452087,0.030456744134426117
2022-05-18,9:45,Boring #btc,boring btc,0.042130451649427414,0.9181549549102783,0.03971458598971367
2022-05-18,9:45,@ProgramadorREAL #bitcoin script,programadorreal bitcoin script,0.043203774839639664,0.9331303834915161,0.023665813729166985
2022-05-18,9:45,"FUN FACT: 5 years ago today #Bitcoin was $1,987. Crypto is here to stay",fun 5 years ago today bitcoin was 1987 crypto is here to stay,0.045493002980947495,0.9329808354377747,0.021526211872696877
2022-05-18,9:45,"This project looks very interesting. I am interested, and I will support this project until it is successful.#WorkQuest $WQT $WUSD #WorkNet #WorkQuestApp #blockchian #crypto #cryptolife #BTC #BNB #ETH #digitalization #digitalassets #saving #BinanceSmartChain",this project looks very interesting i am interested and i will support this project until it is successfulworkquest wqt wusd worknet workquestapp blockchian crypto cryptolife btc bnb eth digitalization digitalassets saving binancesmartchain,0.2572579085826874,0.7347224354743958,0.008019698783755302
2022-05-18,9:45,"#CryptoCurrency moves 24 hrs (in $USD)
Coins fall, BTC &lt; $30,000
Bitcoin #BTC -2.5% $29,863.4
Dogecoin #DOGE -1.6% $0.08
Ethereum #ETH -3% $2,027.1
Avalanche #AVAX -4.2% $33.1
LiteCoin #LTC +0.6% $71.1
Solana #SOL -4.1% $54.2
Polygon #MATIC -2.4% $0.69
#Trading #NFTs #NFT",cryptocurrency moves 24 hrs in usd coins fall btc lt 30000 bitcoin btc 25 298634 dogecoin doge 16 008 ethereum eth 3 20271 avalanche avax 42 331 litecoin ltc 06 711 solana sol 41 542 polygon matic 24 069 trading nfts nft,0.07757428288459778,0.8815885782241821,0.0408371202647686
2022-05-18,9:45,"#Bitcoin next month will be trade at 19.891 (2017 Top) or below, certainly 2017 Top will be test per June 24 structure, price already show up in the screen.",bitcoin next month will be trade at 19891 2017 top or below certainly 2017 top will be test per june 24 structure price already show up in the screen,0.02940220944583416,0.942676842212677,0.027920976281166077
2022-05-18,9:45,"Nobody can hurt me without my permission #bitcoin 
is #pow",nobody can hurt me without my permission bitcoin is pow,0.03359415382146835,0.926582932472229,0.03982292115688324
