Date,Time,Original tweet,Clean tweet,Positive,Neutral,Negative
2022-05-11,21:45,"@FreddieRaynolds @tbr90 @terra_money It's amazing that this was perfectly executed and $LUNA was advised way in advance that it 'could happen' and it actually did. Only detail missed was the crash effect on #BTC but other than that, it was genius.",freddieraynolds tbr90 terramoney it is amazing that this was perfectly executed and luna was advised way in advance that it could happen and it actually did only detail missed was the crash effect on btc but other than that it was genius,0.0613192543387413,0.8967630863189697,0.041917625814676285
2022-05-11,21:45,"Everyone was saying the NOTHING Can stop BTC NOTHING! unless the internet is shut down completely. #btc 
The Fed: Allow us to increase interest rates. 
#crypto market -10000%",everyone was saying the nothing can stop btc nothing unless the internet is shut down completely btc the allow us to increase interest rates crypto market 10000,0.07016679644584656,0.9107220768928528,0.019111119210720062
2022-05-11,21:45,Time to find new gem 👀 $galeon will be the futur health BC. $galeon / $btc +37% over 14 days 🔥🔥🚀🚀 no Bear market for $galeon @GaleonCare @PowerHasheur #btc #eth #france #crypto https://t.co/9et7hBGele,time to find new gem galeon will be the futur health bc galeon btc 37 over 14 days no bear market for galeon galeoncare powerhasheur btc eth france crypto,0.0828799232840538,0.9054242372512817,0.01169584784656763
2022-05-11,21:45,"There is alot of accumulation nesr 29000$ levels .
We can surely dip below but Its time to accumulate more .
#BitcoinButton 
#Bitcoin 
#altcoin",there is alot of accumulation nesr 29000 levels we can surely dip below but its time to accumulate more bitcoinbutton bitcoin altcoin,0.1925755739212036,0.7277919054031372,0.07963252067565918
2022-05-11,21:45,"If you continue holding your #Bitcoin you'll blame no one but yourself 👌👌💯
#BitcoinCrash #Binance #LUNA #Lunacrash #Cryptocrash #cryptocurrency #HODL #Crypto #cryptotrading #cryptocurrencies #NFTs",if you continue holding your bitcoin you will blame no one but yourself bitcoincrash binance luna lunacrash cryptocrash cryptocurrency hodl crypto cryptotrading cryptocurrencies nfts,0.023481957614421844,0.8972116708755493,0.07930634170770645
2022-05-11,21:45,"@rovercrc I bought #BTC at $382.40  I sold it at $59,487.  You are an *****  it's time for you to be quiet.",rovercrc i bought btc at 38240 i sold it at 59487 you are an it is time for you to be quiet,0.07434158027172089,0.9051525592803955,0.02050587721168995
2022-05-11,21:45,"How deep is the dip, #Bitcoin ?
#BDFD",how deep is the dip bitcoin bdfd,0.03007311001420021,0.874035120010376,0.0958917960524559
2022-05-11,21:45,"Better for #Bitcoin to go to 20k now and 2x by August, than for it to bounce from here but get to 10k by August 😵‍💫😔",better for bitcoin to go to 20k now and 2x by august than for it to bounce from here but get to 10k by august,0.23482829332351685,0.745876669883728,0.01929504983127117
2022-05-11,21:45,@exatorian @TheCryptoLark The probability of 20K is getting higher #Bitcoin,exatorian thecryptolark the probability of 20k is getting higher bitcoin,0.6455212235450745,0.28284066915512085,0.07163801789283752
2022-05-11,21:45,"It's times like these, in which true character shows!  

Act on your convictions, stay true to your values, dont betray yourself!

Love you all! #Bitcoin",it is times like these in which true character shows act on your convictions stay true to your values dont betray yourself love you all bitcoin,0.05849791318178177,0.9094930291175842,0.03200903162360191
2022-05-11,21:45,@garyblack00 $TSLA owning over $1.5B #bitcoin should be the bad news.,garyblack00 tsla owning over 15b bitcoin should be the bad news,0.010893448255956173,0.05089682713150978,0.9382097125053406
2022-05-11,21:45,"@airdropinspect Best project ever, I am very happy to be participating in this project. I hope this project will gain more popularity in the future

@rifqiteh
@jattts27
@CatstrongerRush

#Airdrop #Airdrops #Airdropinspector #BSC #NEST #USDT #Crypto #Bitcoin",airdropinspect best project ever i am very happy to be participating in this project i hope this project will gain more popularity in the future rifqiteh jattts27 catstrongerrush airdrop airdrops airdropinspector bsc nest usdt crypto bitcoin,0.608532726764679,0.38221296668052673,0.009254266507923603
2022-05-11,21:45,"@satsstackamoto @nh7756 @cryptomanran how did Not buying $hex work out??

u could have multiplied ur $btc by 10,000...
10,000...

#bitcoiners should join us or be left behind.

ur promoting old spaghetti code  with two inflation bugs  and no audits.

#hex literally outperformed everything 2020 and 2021
new #bitcoin.",satsstackamoto nh7756 cryptomanran how did not buying hex work out u could have multiplied ur btc by 10000 10000 bitcoiners should join us or be left behind ur promoting old spaghetti code with two inflation bugs and no audits hex literally outperformed everything 2020 and 2021 new bitcoin,0.10291677713394165,0.8031983375549316,0.0938849225640297
2022-05-11,21:45,"Warren Buffett said he wouldn’t buy all the #Bitcoin in the world for $25. 

But I’ll bet he’s in at $24.99, and he just might get it.",warren buffett said he wouldn not buy all the bitcoin in the world for 25 but ill bet hes in at 2499 and he just might get it,0.08938497304916382,0.8954750895500183,0.015139969997107983
2022-05-11,21:45,"That's weird #Bitcoin price is going down but my sats are going up!

Anyone else having this issue?",that is weird bitcoin price is going down but my sats are going up anyone else having this issue,0.040226973593235016,0.2560745179653168,0.703698456287384
2022-05-11,21:45,"Will you time the bottom right, anon?

#eth #btc #sol",will you time the bottom right anon eth btc sol,0.05351699888706207,0.9276798367500305,0.018803125247359276
2022-05-11,21:45,"The Fiat System pushed human beings out on the risk curve in order to attempt to keep up with their money being debased.    Assets were monetized and now we are resetting.    Once the floor is in, capital will eventually figure out #bitcoin is the escape.",the fiat system pushed human beings out on the risk curve in order to attempt to keep up with their money being debased assets were monetized and now we are resetting once the floor is in capital will eventually figure out bitcoin is the escape,0.10303128510713577,0.8383641242980957,0.05860460549592972
2022-05-11,21:45,"No gain, only pain #btc #cryptotrading #crypro #bitcoin",no gain only pain btc cryptotrading crypro bitcoin,0.07698923349380493,0.8612213134765625,0.061789460480213165
2022-05-11,21:45,"Feels a lot like November 2018. 
#stocks #crypto #Bitcoin",feels a lot like november 2018 stocks crypto bitcoin,0.046593792736530304,0.9327974319458008,0.020608818158507347
2022-05-11,21:45,@RjDigitalEarner @kapilagrawal7 @AjeetK @simplykashif @CryptooAdy @Ruch_9 Now blooding is over... #BTC touch its yearly low 27945$ 🙏🙏🙏 Know every one buy with out fear.. Coins... 🙏 jai maa kaali🙏 bull run start soon🙏 #Bitcoin #Bitcoin2022 #bullrunstart after this week🙏,rjdigitalearner kapilagrawal7 ajeetk simplykashif cryptooady ruch9 now blooding is over btc touch its yearly low 27945 know every one buy with out fear coins jai maa kaali bull run start soon bitcoin bitcoin2022 bullrunstart after this week,0.1318589597940445,0.710400402545929,0.15774062275886536
2022-05-11,21:45,Hodling #BTC 🧡🧡🧡,hodling btc,0.04273853823542595,0.922786295413971,0.0344751738011837
2022-05-11,21:45,@elonmusk Please save #bitcoin,elonmusk please save bitcoin,0.03460576757788658,0.9387649297714233,0.026629289612174034
2022-05-11,21:45,STOP LISTENING TO THESE FAKE ACCOUNTS TELLING YOU TO HOLD LMAO $LUNA $BTC #Tether #terraluna #BTC &amp;  #ETH,stop listening to these fake accounts telling you to hold lmao luna btc tether terraluna btc eth,0.021480927243828773,0.8984505534172058,0.08006853610277176
2022-05-11,21:45,I haven’t seen a tweet saying this so I will. Fuck you do kwon lol #btc,i haven not seen a tweet saying this so i will fuck you do kwon lol btc,0.049850430339574814,0.9259929656982422,0.02415667101740837
2022-05-11,21:45,"Can anyone tell us what #Bitcoin wants to do?

#cryptotrading #BitcoinCrash #Bitcoin2022 #altcoins #LUNA #Cardano",can anyone tell us what bitcoin wants to do cryptotrading bitcoincrash bitcoin2022 altcoins luna cardano,0.06270626932382584,0.9248297214508057,0.012464030645787716
2022-05-11,21:45,"#BITCOIN EXTENDS SELLOFF, PLUNGES 10% TO FALL BELOW $28000, LOWEST SINCE DEC. 2020. #BitcoinButton",bitcoin extends selloff plunges 10 to fall below 28000 lowest since dec 2020 bitcoinbutton,0.016148129478096962,0.03295208141207695,0.9508997797966003
2022-05-11,21:45,"What do you guys think?

I think they need to sell an amount of their #Bitcoin to decrease the debt",what do you guys think i think they need to sell an amount of their bitcoin to decrease the debt,0.11474176496267319,0.7538921236991882,0.13136611878871918
2022-05-11,21:45,"1,908 #BTC (54,635,372 USD) just transferred

From:
1MpDYMabgsySnf2QEwQmkz2LLP3CPWem8C

To:
38LcGZBXrFZwTviXWN2TkctZDBiK5k47oZ

Tx hash:
10435edc35dfbe873c66ffb09d47003f2e94f7f59ceadef148b7c1ef8e084287

#Bitcoin $BTC #crypto",1908 btc 54635372 usd just transferred 1mpdymabgsysnf2qewqmkz2llp3cpwem8c 38lcgzbxrfzwtvixwn2tkctzdbik5k47oz tx 10435edc35dfbe873c66ffb09d47003f2e94f7f59ceadef148b7c1ef8e084287 bitcoin btc crypto,0.07571780681610107,0.8997318148612976,0.024550369009375572
2022-05-11,21:45,@EncryptedShark @DeItaone You misswrote #bitcoin,encryptedshark deitaone you misswrote bitcoin,0.044985007494688034,0.9161891937255859,0.038825783878564835
2022-05-11,21:45,@kapilagrawal7 Now blooding is over... #BTC touch its yearly low 27945$ 🙏🙏🙏 Know every one buy with out fear.. Coins... 🙏 jai maa kaali🙏 bull run start soon🙏 #Bitcoin #Bitcoin2022 #bullrunstart after this week🙏,kapilagrawal7 now blooding is over btc touch its yearly low 27945 know every one buy with out fear coins jai maa kaali bull run start soon bitcoin bitcoin2022 bullrunstart after this week,0.15099531412124634,0.758419930934906,0.09058473259210587
2022-05-11,21:45,"This week's WagmiTV episode is gonna be juicy, stay tuned 👀 #btc $luna $ust @Doc_Mada @WillBagley11 @investingnrd",this week wagmitv episode is gonna be juicy stay tuned btc luna ust docmada willbagley11 investingnrd,0.07313893735408783,0.8985439538955688,0.028317058458924294
2022-05-11,21:45,"Talking about ""The #Bitcoin Bride"" with RascalTweets now live on #TheCryptoRundown",talking about the bitcoin bride with rascaltweets now live on thecryptorundown,0.06295296549797058,0.9172914028167725,0.019755559042096138
2022-05-11,21:45,Terra Luna is at the best discount price you will never see again!! @terra_money #cryptocurrency #TerraUSD #LUNA #Lunacrash #Bitcoin #buythedip,terra luna is at the best discount price you will never see again terramoney cryptocurrency terrausd luna lunacrash bitcoin buythedip,0.07158394157886505,0.9140079021453857,0.014408161863684654
2022-05-11,21:45,@24nz00fozhjn0 @10_BTC4 zero doubt here ! #bitcoin 🍻✌😎,24nz00fozhjn0 10btc4 zero doubt here bitcoin,0.049157001078128815,0.8935785293579102,0.057264432311058044
2022-05-11,21:45,"Just a thought. What if all stables got destroyed?
What if that was the goal. 
What would happen then? 
No one would be safe, and crypto would disappear for a while.
Just a thought.
Was this the end of it?
#Cryptocrash #Crypto #Bitcoin #USDT #Tether",just a thought what if all stables got destroyed what if that was the goal what would happen then no one would be safe and crypto would disappear for a while just a thought was this the end of it cryptocrash crypto bitcoin usdt tether,0.023041095584630966,0.8983184099197388,0.07864044606685638
2022-05-11,21:45,@AshBennington @gckaloudis @RealVision Thank you sincerely for the offer! Headed to host the Boca Raton #Bitcoin Meetup! Next time!,ashbennington gckaloudis realvision thank you sincerely for the offer headed to host the boca raton bitcoin meetup next time,0.7020776867866516,0.2868913412094116,0.011030994355678558
2022-05-11,21:45,"@TheRealPlanC When I wake up tomorrow, I will not be surprised if Bitcoin is down to $25,000. Sweet dreams Bitcoiners. #Bitcoin",therealplanc when i wake up tomorrow i will not be surprised if bitcoin is down to 25000 sweet dreams bitcoiners bitcoin,0.028016095981001854,0.2365434467792511,0.7354404926300049
2022-05-11,21:45,"Looking for an exit for your #Bitcoin investments?
The @DomainHacks brand is available for acquisition.
DH it's:
• A portfolio of 200+ premium domain hacks valued at $2M+ 
• $300K+ in sales since Dec '21
• Three 6 figures sales between '21-22
• $BTC 200+ in revenues since '13",looking for an exit for your bitcoin investments the domainhacks brand is available for acquisition dh a portfolio of 200 premium domain hacks valued at 2m 300k in sales since dec 21 three 6 figures sales between 2122 btc 200 in revenues since 13,0.22368359565734863,0.7680315375328064,0.00828480627387762
2022-05-11,21:45,#Stablecoin 'Terra' Bounces Back. $LUNA #Bitcoin,stablecoin terra bounces back luna bitcoin,0.7778717875480652,0.09374789148569107,0.12838034331798553
2022-05-11,21:45,"The problem isn’t #Bitcoin.

The problem isn’t #Dogecoin.

The problem isn’t #Ethereum.

The problem isn’t #Shiba Inu.

The problem isn't #Solana.

The problem is overconfidence.

Overconfidence leads to leverage.

Leverage leads to crashes.

Few understand this.",the problem isn not bitcoin the problem isn not dogecoin the problem isn not ethereum the problem isn not shiba inu the problem is not solana the problem is overconfidence overconfidence leads to leverage leverage leads to crashes few understand this,0.022591331973671913,0.5265300869941711,0.4508785903453827
2022-05-11,21:45,"Medium #Twitter user:

OMG #Bitcoin is dumping, #crypto is a scam!

Same user some days later:
OMG looks at the price, BUY BUY BUY, #crypto are the future!!

And in bio u read crypto enthusiast 😂
#binance #dip #buythedip #LUNA #UST",medium twitter omg bitcoin is dumping crypto is a scam same user some days omg looks at the price buy buy buy crypto are the future and in bio u read crypto enthusiast binance dip buythedip luna ust,0.028788791969418526,0.9301262497901917,0.04108498618006706
2022-05-11,21:45,"Plan B
Plan C
Plan F ail
#Bitcoin",plan b plan c plan f ail bitcoin,0.02304696850478649,0.9429545998573303,0.033998411148786545
2022-05-11,21:45,"@FantasyArenaNFT @FantasyArenaNFT Nice job! 
#blockchain #btc  #luna   #NFT #GameFi #UST",fantasyarenanft fantasyarenanft nice job blockchain btc luna nft gamefi ust,0.030082881450653076,0.9434154629707336,0.026501594111323357
2022-05-11,21:45,"I've been watching weak hands lose their minds every time #Bitcoin dips since 2013. So annoying.
Stop being so emotional. Relax and wait.",i have been watching weak hands lose their minds every time bitcoin dips since 2013 so annoying stop being so emotional relax and wait,0.029043490067124367,0.650628924369812,0.3203275799751282
2022-05-11,21:45,"Lol it’s so funny to me that we still panic when the market goes red. 

Everything is on sale! 

#beentheredonethat #Crypto #Bitcoin #Ethereum #dogecoin",lol its so funny to me that we still panic when the market goes red everything is on sale beentheredonethat crypto bitcoin ethereum dogecoin,0.044367071241140366,0.9215747117996216,0.034058161079883575
2022-05-11,21:45,@pickeringenergy The SEC needs to treat Bitcoin as a security or statements about #Bitcoin by companies like $MSTR that are constructive Bitcoin (or proxies for Bitcoin) as statements about securities and subject to enforcement action for misleading investors. The law is there: use it.,pickeringenergy the sec needs to treat bitcoin as a security or statements about bitcoin by companies like mstr that are constructive bitcoin or proxies for bitcoin as statements about securities and subject to enforcement action for misleading investors the law is use it,0.02581946738064289,0.9090589880943298,0.0651216134428978
2022-05-11,21:45,Why do we wonder?  Only the race was returned to the line that the contestants were standing on due to the bias of the referee's whistle. #ETHGATE #Btc #Cryptocrash #XRP #Xrp #XRPHolders,why do we wonder only the race was returned to the line that the contestants were standing on due to the bias of the referee whistle ethgate btc cryptocrash xrp xrp xrpholders,0.03929081931710243,0.8119737505912781,0.14873546361923218
2022-05-11,21:45,"In these bear markets/crash/crazy shit going on, im glad im invested into SD tokens featuring Asset-Backed technologies! #SINU #BSCGemsAlert #Bitcoin #Binance #Terra #LUNA #USDT #cryptocurrency #Cryptocrash",in these bear marketscrashcrazy shit going on im glad im invested into sd tokens featuring assetbacked technologies sinu bscgemsalert bitcoin binance terra luna usdt cryptocurrency cryptocrash,0.08452250063419342,0.90345698595047,0.012020564638078213
2022-05-11,21:45,"Soooo it took #bitcoin 1.5 years of adoption, invention and progress to drop to a lower price then before 😂

As long as rich people can make 1.000.000.000$ this easy in a few days in this space, we are in a screwed system ✌️",soooo it took bitcoin 15 years of adoption invention and progress to drop to a lower price then before as long as rich people can make 1000000000 this easy in a few days in this space we are in a screwed system,0.06324461102485657,0.5352674126625061,0.40148794651031494
2022-05-11,21:45,"@saylor I know we're down, but I'm still so pro crypto.
Even though I hate that it's still not popular yet. 
#Bitcoin #Etherum #Solana #LUNA #Crypto #Cardano #TRON #tezos #matic #Polygon #chainlink #Binance #Cosmos #Algo #VeChain #APECOIN #BAYC #MAYC #AxieInfinity #makerdao",saylor i know we are down but i am still so pro crypto even though i hate that it is still not popular yet bitcoin etherum solana luna crypto cardano tron tezos matic polygon chainlink binance cosmos algo vechain apecoin bayc mayc axieinfinity makerdao,0.053193099796772,0.8174670338630676,0.12933982908725739
2022-05-11,21:45,More than $1 billion is expected to flow into Australia’s first #bitcoin ETF launching in couple of hours.,more than 1 billion is expected to flow into australias first bitcoin etf launching in couple of hours,0.1385800540447235,0.8521338701248169,0.009286072105169296
2022-05-11,21:45,@BBCNews #bitcoin awaits you,bbcnews bitcoin awaits you,0.03678327053785324,0.92615807056427,0.03705872222781181
2022-05-11,21:45,Buying #bitcoin is a vote that entrepreneurs and scientists are more important to society than politicians.,buying bitcoin is a vote that entrepreneurs and scientists are more important to society than politicians,0.16274866461753845,0.822770357131958,0.014480951242148876
2022-05-11,21:45,#Bitcoin Crashes To Lowest Since 2020. #BitcoinButton,bitcoin crashes to lowest since 2020 bitcoinbutton,0.010896902531385422,0.028171295300126076,0.9609318375587463
2022-05-11,21:45,The bottom is Near Officially #Bitcoin,the bottom is near officially bitcoin,0.09054704755544662,0.5181350708007812,0.39131781458854675
2022-05-11,21:45,"Is this the moment to let go of all ALTS in order to defend Bitcoin’s position? We need to consider this seriously. Remember without #Bitcoin, there’s no #ALTS. If there’s less confidence in Bitcoin, there’s ZERO confidence in ALTS. #BuyBitcoin",is this the moment to let go of all alts in order to defend bitcoins position we need to consider this seriously remember without bitcoin theres no alts if theres less confidence in bitcoin theres zero confidence in alts buybitcoin,0.061833806335926056,0.9038464426994324,0.03431978449225426
2022-05-11,21:45,"Zoom out on Luna 🔭

Its getting known to the unknowns.

#Bitcoin
#LUNA",zoom out on luna its getting known to the unknowns bitcoin luna,0.06287612020969391,0.9183255434036255,0.01879839226603508
2022-05-11,21:45,"#bitcoin is at ATL since jan 21
#BitcoinCrash",bitcoin is at atl since jan 21 bitcoincrash,0.028176408261060715,0.7652018070220947,0.20662181079387665
2022-05-11,21:45,"Haemorrhage on the crypto floor!

#btc #cryptocurrency",haemorrhage on the crypto floor btc cryptocurrency,0.016597233712673187,0.13018986582756042,0.8532129526138306
2022-05-11,21:45,"Spot of the Day 💯

Binance
#MDA/#BTC All take-profit targets achieved 😎
Profit: 14.1529% 📈
Period: 19 Days 10 Hours 12 Minutes ⏰",spot of the day binance mdabtc all takeprofit targets achieved 141529 19 days 10 hours 12 minutes,0.06658877432346344,0.9159507751464844,0.017460448667407036
2022-05-11,21:45,"1,703 #BTC (48,772,464 USD) just transferred

From:
12d1C6gCgxqQRRypRsph5NmMmti9FES57H

To:
1Hm44kKQrydTszKrCCnAR6jzC1624J6SEL

Tx hash:
61a7612ba832b18d05cb267c9ac480fad5b553eb948450bb5b1d5d600adc21ab

#Bitcoin $BTC #crypto",1703 btc 48772464 usd just transferred 12d1c6gcgxqqrryprsph5nmmmti9fes57h 1hm44kkqrydtszkrccnar6jzc1624j6sel tx 61a7612ba832b18d05cb267c9ac480fad5b553eb948450bb5b1d5d600adc21ab bitcoin btc crypto,0.10141204297542572,0.874666154384613,0.02392188459634781
2022-05-11,21:45,"I think 10k is on the table.

$dji $btc #btc #bitcoin",i think 10k is on the table dji btc btc bitcoin,0.04332951828837395,0.938734769821167,0.017935698851943016
2022-05-11,21:45,"Sad to see what is happening this past few days with Luna ecosystem. This is why #Bitcoin  is so different… nobody is the public figure, is not a company, nobody owns it and at the same time, everybody does. There is no single point of failure",sad to see what is happening this past few days with luna ecosystem this is why bitcoin is so different nobody is the public figure is not a company nobody owns it and at the same time everybody does there is no single point of failure,0.024160871282219887,0.8130653500556946,0.16277381777763367
2022-05-11,21:45,"#Bitcoin and #Crypto is in a free fall right now and i'm excited, very excited. #YEdge is amazing.",bitcoin and crypto is in a free fall right now and i am excited very excited yedge is amazing,0.17177072167396545,0.8138143420219421,0.014414895325899124
2022-05-11,21:45,"I’m so super scared right now, is it time to buy my fear yet? 🤔 #BITCOIN",im so super scared right now is it time to buy my fear yet bitcoin,0.04560022056102753,0.8970719575881958,0.057327739894390106
2022-05-11,21:45,"@Cylumfinance @news_of_bsc Aim for the moon at least you end up you know the rest. “To the moon !!! “ 
@DianeBragg15 @Alexand_2211 @moneyqueen3458 @coleric321 #CYLUM #CYM #BNB #BSC #cryptocurrency #binance #BTC #ETH",cylumfinance newsofbsc aim for the moon at least you end up you know the rest to the moon dianebragg15 alexand2211 moneyqueen3458 coleric321 cylum cym bnb bsc cryptocurrency binance btc eth,0.08384635299444199,0.9023118019104004,0.013841853477060795
2022-05-11,21:45,"Welcome the Crypto Winter 🥶

#btc #bitcoin #Cryptocrash #Crypto #winter #bearmarket",welcome the crypto winter btc bitcoin cryptocrash crypto winter bearmarket,0.06772881746292114,0.9143076539039612,0.017963532358407974
2022-05-11,21:45,"March 2020: Black Swan Event.

May 2022: Black Kwon Event.

#Bitcoin #BTC #Crypto",march black swan event may black kwon event bitcoin btc crypto,0.02733326330780983,0.9439157843589783,0.028750889003276825
2022-05-11,21:45,"What a sale, Christmas came early this year. #Bitcoin",what a sale christmas came early this year bitcoin,0.100807785987854,0.8675875663757324,0.03160462528467178
2022-05-11,21:45,Where are the bull market influencers now lol. Folks this is a bear market and has been since January.  Don't fret though because #Bitcoin will recover just like the past 2 cycles.  Worst case is beginning of 2024 for all time high again less than 2 years away.,where are the bull market influencers now lol folks this is a bear market and has been since january do not fret though because bitcoin will recover just like the past 2 cycles worst case is beginning of 2024 for all time high again less than 2 years away,0.1676790714263916,0.7879761457443237,0.04434477910399437
2022-05-11,21:45,#Bitcoin is not for boys,bitcoin is not for boys,0.030422387644648552,0.9401754140853882,0.02940216101706028
2022-05-11,21:45,Galatasaray Fan Token (GAL) went up 10.2 percent in the last 30 minutes on Binance. #GAL  #crypto #bitcoin #cryptocurrency #btc #ethereum #blockchain #eth #trading #altcoin #binance #cryptonews,galatasaray fan token gal went up 102 percent in the last 30 minutes on binance gal crypto bitcoin cryptocurrency btc ethereum blockchain eth trading altcoin binance cryptonews,0.8690990805625916,0.11950716376304626,0.011393686756491661
2022-05-11,21:45,Now blooding is over... #BTC touch its yearly low 27945$ 🙏🙏🙏 Know every one buy with out fear.. Coins... 🙏 jai maa kaali🙏 bull run start soon🙏 #Bitcoin #Bitcoin2022 #bullrunstart after this week🙏,now blooding is over btc touch its yearly low 27945 know every one buy with out fear coins jai maa kaali bull run start soon bitcoin bitcoin2022 bullrunstart after this week,0.12086931616067886,0.7123892307281494,0.1667415052652359
2022-05-11,21:45,"@maxkeiser Once #daveportnoy sell all his #Bitcoin, 
 i will start buying again 🤣",maxkeiser once daveportnoy sell all his bitcoin i will start buying again,0.07538295537233353,0.9122232794761658,0.012393811717629433
2022-05-11,21:45,Finally the local dip arrived for #btc. I bought heavily at 28300. Now the price is 28400 as of this tweet!,finally the local dip arrived for btc i bought heavily at 28300 now the price is 28400 as of this tweet,0.12374337017536163,0.8566032648086548,0.019653307273983955
